,tweets,user,location,polarity
634,Jealousy I'd disease and he's a victim. 😉😉… https://t.co/gbFw0D0Kog,YooWrites_,YooniVerse ,-0.07500000000000001
635,New Alzheimer's drug slows disease by a third https://t.co/yi76OhRKLM,RobsonDeMCap,Kuala Lumpur City,0.06818181818181818
636,@DrLoupis Mental illness is a devastating disease!,chrisbarr58,"Buford, GA ",-0.55
637,"@pigfoot_power You think that's wild, wait until you see the eyes on his dick. It's covered in them like some sort… https://t.co/JoD2Btfus5",roselialescrime,"37, she/her",0.1
638,"People sometimes surrender &amp; just choose to live with the disease. You find another one, they had a vision, they'd… https://t.co/KZqYPQKqNS",JudithK01341665,,0.13636363636363635
639,"@candy_clowns No. A virus FUNCTIONS in a disease-causing way.
But disease is not REQUIRED for a virus to exist.
It… https://t.co/twXceCq8pE",MsAmitripped,"Scotland, United Kingdom",0.0
640,.@CDCMMWR is the official Twitter profile featuring information from the Centers for Disease Control and Prevention… https://t.co/VVul6czthp,CDCMMWR,Atlanta,0.0
641,@Amelia84M Trump derangement syndrome is pretty serious disease,iCaptainRyan,Samannud,-0.04166666666666666
642,and the british continue the age old tradition of bringing disease everywhere they go https://t.co/Ohg32qj91m,mo_elizabeth_,blm & trans rights,0.05
643,Cheese timer for my fish disease.,WordsmithSarah,Illinois,0.0
644,"I was walking on the ocean has die offs, I think they have a disease and you shouldn’t touch it, the clams had a di… https://t.co/cLdpTHncQk",Jessica_Midder,,0.0
645,@MelonieMac I think the pork thing had something to do with pigs being nasty and spreading disease. It's still a te… https://t.co/WQE8qNs1Uj,revenantkodahn,,-1.0
646,"@REMASCULATE 😬
IMO, Lyme disease is the least of your concern. https://t.co/Zix4I9bmUS",toni_hs101,Florida ,-0.3
647,New Alzheimer's drug slows disease by a third https://t.co/T7YgTxgmQw,TayaAmritsaria3,United States,0.06818181818181818
648,Dr. Marco Zoccali of Columbia University Irving Med Center goes into great detail on sacral nerve stimulation (as u… https://t.co/HPCjUIpdYo,BoomerangMed,"Mountain View, CA",0.35000000000000003
649,New Alzheimer's drug slows disease by a third - BBC News https://t.co/BFKTlU1Jvn,LisaTheRiveter,"Seattle, WA",0.06818181818181818
650,@anchor_soul @BornAgainMissy We must define health differently. Heart disease is the number one killer in the Unite… https://t.co/rE4rDfLrkq,BryanToton,"Salisbury, NC",0.0
651,"I thought after the results of my HIDA I would move towards removal, as that’s the only treatment for functional ga… https://t.co/MtfdZjIeKg",StarrlightMason,Daybreak Town,0.0
652,@BubsandJacks @purrdeadcatpurr @infinity_waves_ @AutisticCoach_ I never said autistic people aren't disabled. I sai… https://t.co/ef02UglJQc,lil_writer,"Bordeaux, France",-0.2
653,"@thelawmom @adamseybold00 @oldmallpics False?? It's proven to not work! If you need 7 shots of anything, and it doe… https://t.co/RznsHLU4X4",saras76,,-0.4000000000000001
654,"Did you know that loneliness increases your risk of anxiety, depression, heart disease, dementia, and stroke? It's… https://t.co/hGNndXvgka",pauletteperhach,Free newsletter and events ➡️,0.0
655,Early-life interactions between the microbiota and immune system: impact on immune system development and atopic di… https://t.co/uEOe0UZY0O,LabWaggoner,"Cincinnati, OH",0.1
656,"@taitangetich Oh Allah! The Sustainer of Mankind! Remove the illness, cure the disease. You are the One Who cures.… https://t.co/GQdQAH1KOs",abassmabdi,"Nairobi, Kenya",0.0
657,"May is ALS Awareness Month.

We are committed to raising awareness for this incurable disease.

On May 19, we will… https://t.co/4NcE573008",CanesBaseball,See You at The Light!,-0.5
658,@5lut_ Colonizer genes waking up to spread disease again,Rage_Bloomer,"Somewhere, USA",0.0
659,"Started #SaintX &amp; I cannot help when Alycia comes on screen that I whisper ""Lexa."" It's a fucking disease. 😂😭😅",SVaughn21,"Anniston, AL",0.0
660,@anik1968 @MeetJess Most likely post Covid sequelae Emin sting in a stroke. Artorial hardening is a common post Cov… https://t.co/Hhyagkaoqn,Redeyedkamislay,Purgatory ,0.06666666666666667
661,"Prayer For Today: Wednesday, May 3, 2023

Today’s Special Prayer Is For Everyone Suffering From Any Illness And Dis… https://t.co/PjYQDQhDHc",lerses,"Atlanta, GA",0.35714285714285715
662,🕰 Reversing ageing to cure disease https://t.co/Ex5W6ffk67,pomdr,Nassau County,0.0
663,@Aisha11ug @chozen_phoebe Avoiding disease like AIDS AND HIV,Kibirig56786025,"Wakiso, Uganda",0.0
664,@Grounded_Texan @BDOH @WCSOFL What needs to be done is get control back of msm and schools…that would go a long way… https://t.co/qdOHbs60ou,JulieMoonRise,,-0.025
665,Likelihood reclassification by an acoustic-based score in suspected coronary artery disease https://t.co/qWthyjfFv3 https://t.co/dkxmlnvy50,Heart_BMJ,"London, UK",0.0
666,"@WeZakaQ Even I would  have die https://t.co/4n49HNq9sA 
Let make it real what make man die from this disease  like this it's ignorance",TheColonel2023,,0.2
667,"@candy_clowns The second meaning is more appropriate to viruses, because not every infection leads to disease.",MsAmitripped,"Scotland, United Kingdom",0.3333333333333333
668,"@_ppmv As a neurodivers father of a neurodivers son i have a strikt rule:

As soon as someone makes statements impl… https://t.co/9oDG6wUBX2",karldieter21,,0.0
669,"Is TAVR too common among younger, low-risk patients? 2 experts share their concerns - Cardiovascular Business https://t.co/A6Bun1HeiL",cardiacpetct,,-0.09999999999999999
670,Optimism has paid off and we are only at the beginning of the Paradigm shift in neurodegenerative disease! https://t.co/GIPTtxJzaz,MC_Tartaglia,"University Health Network; CRND, University of Toronto",0.0
671,Several of the most prominent dinosaur skeletons @NMNH exhibit signs of ancient injuries and disease. https://t.co/sVpigMkJLU,SmithsonianMag,"Washington, D.C.",0.3333333333333333
672,@catsscareme2021 They forgot to list Crohn's Disease as a side effect of the MMR My son died at 26 from complicatio… https://t.co/XQtYyCPQpk,MimiCoughlan,America,0.0
673,@WalterHudson Democrats are a lying disease,factsminnesota,"on the toilet, myhouse",0.0
674,Michael J. Fox says he doesn't expect to 'be 80' in raw interview about Parkinson's https://t.co/Mycwbt8pYW,WISN12News,"Milwaukee, WI",-0.23076923076923078
675,"FOR EXERCISES TO HELP YOU KEEP YOUR BODY DISEASE FREE AND KEEP FIT 
AM THE ANSWER.
Oscar fitness program",THOMAS22348668,,0.4
676,"Every year, #malaria claims more lives in #Nigeria than any other country in #Africa. 🌍We must continue to raise aw… https://t.co/Y4coaXaOM4",ZeroMalaria,,0.1875
677,#YogiAdityanath we are twin brother suffering from cerebral palsy which is very real disease we are doing social wo… https://t.co/aoVHm9y0XQ,ayushgoel570,"Meerut, India",0.14666666666666667
678,"Actually you shouldn’t eat bread high in carbs &amp; risk of diabetes, shouldn’t use butter high in calories and fat ri… https://t.co/89eXSpG3BQ",Caramel_Iccy,"Houston, TX",0.10666666666666667
679,"@JoeBiden America has never had a president with dementia as bad as what you've got, Joe.

""One of the classic earl… https://t.co/ehBjmFQvgX",RI7164S,,-0.2666666666666666
680,"Another advantage of immunotherapy is that utilizing the immune system allows the body to kill metastatic disease,… https://t.co/C8ruX46XMo",asliverarrow,"Columbus, OH",0.0
681,"A dog with rabies positive, 9 victims, and the dog is still roaming around? We’ll never know how many more will be… https://t.co/0PprHKOQdN",IrwanCourtesy,نݢري کيسارن ڤايوڠ,0.4090909090909091
682,That Mbappe fanbase is a disease https://t.co/GBioJ0Ikcn,tintswalomegacy,"Kwami, Ko nna,Aka mina,my huis",0.0
683,"@NitramyesnahH That’s so sad Marty. My Mum dies of cancer aged 50. That was 24 years ago. I had cancer, Hodgkins Ly… https://t.co/3QZXaD205A",Rachel_Doyle72,St Albans/Manchester 🐝,-0.3
684,@ItsNickFasho this has to be some parasitic brain disease.,sidxworthy,"atlanta, ga",0.0
685,@wnshkagenda the disease that plagues many kpoppies. parasocial relationships are parasocializing a bit too close to the sun,haikeakaiha,they-them,0.5
686,@CNN Great news ! This horrible disease is not talked about enough …  or given the funds for research @AlzResearchUK,quishey,"Brixham, England",-0.06666666666666665
687,homosexuality is a disease https://t.co/1n7KN4t9uF,sulmmasiv,they/them,0.0
688,I found this big full tick by my dog balls. Should I be worried about Lyme disease? https://t.co/MpoHvtomGk,REMASCULATE,,0.175
689,"The ignorance of basic #immunology here is astounding. Even I, a lowly Uni student knows that no vaccine since 1721… https://t.co/tGju76c9ES",CmdrJonty,Innerspace,0.19999999999999998
690,"dudes will throw away a good girl who would give them the world, for a girl who will give them a disease fr",isms2003,"Maia, Portugal",0.7
691,what is the brit’s obsession with bringing over disease https://t.co/MoYARdkHef,starboymingi,"she/her, carrd byf",0.0
692,@ImeldalinaG @Atlanta_Police these are all noble pursuits. you can do that AND STILL be preventive. you cure a dise… https://t.co/eiRFLA1wgT,enterprise_cust,,0.6
693,"FILE - A sign for Eli Lilly &amp; Co. sits outside their corporate headquarters in Indianapolis on April 26, 2017. The… https://t.co/8yzYj0RVBC",VeniceGondolier,"Venice, Florida",0.0
694,"FILE - A sign for Eli Lilly &amp; Co. sits outside their corporate headquarters in Indianapolis on April 26, 2017. The… https://t.co/E59r4HkrhX",PuntaGordaSun,"Punta Gorda, Florida",0.0
695,"FILE - A sign for Eli Lilly &amp; Co. sits outside their corporate headquarters in Indianapolis on April 26, 2017. The… https://t.co/8gnwDD7xgT",CharlotteSunFla,"Port Charlotte, Florida",0.0
696,@thotimusprime29 @axlehire Playing with mac n cheese is why you got a disease.,MobileTuba,,0.0
697,"FILE - A sign for Eli Lilly &amp; Co. sits outside their corporate headquarters in Indianapolis on April 26, 2017. The… https://t.co/6kSQTERcOT",sun_port,"North Port, FL",0.0
698,"BOOKBUB 99p/c
If you altered MAD COW DISEASE to infect humans
And fed it to your enemies
Death would be put down to… https://t.co/YfJ2aY1QIp",AYPuckett,Somerset,-0.30462962962962964
699,already googling where to buy a team czechia jersey filip chytilism is a disease i will not recover from,demonleclerc,3 RIC•16 LEC•44 HAM•63 RUS,0.0
700,Aging is not a disease.  Ignorance is.  And that one has a cure.,magikalalpha,,0.0
701,What will become of us?  Society is finished trying to stop disease from spreading.  People are just consuming and… https://t.co/PdjeCfbAgR,Magnolia_613,Dystopia,0.0
702,"At my desk, about to begin a live chat on gun violence, thinking about the Texas shooter and the survivor I just wr… https://t.co/1H0zUHkKFm",JohnWoodrowCox,,0.13636363636363635
703,"@MoreOrLessAMess @GrayAthene They didn't even treat it, first ever blood test was only conducted in 87, official po… https://t.co/RqHIb1CqSi",vytejok,Vilnius,0.125
704,"Additionally, some cancers don’t respond well to immunotherapy, which might lead to a change in treatment options.… https://t.co/XFIx5jgWTX",asliverarrow,"Columbus, OH",0.0
705,New Alzheimer's drug slows disease by a third https://t.co/ZkBu4ODR8p,FLYFLEDGLINGFLY,Australia,0.06818181818181818
706,New Alzheimer's drug slows disease by a third https://t.co/tz2aaUuP5a,mcbridetd,"St Louis, MO",0.06818181818181818
707,So sick of this weird NT misinformation being spread around about BTS. Stop lying. They don't have the NT disease?!… https://t.co/mIgF6s3EF5,SunPuppy97,any pronouns,-0.6071428571428572
708,Michael J. Fox says he doesn't expect to 'be 80' in raw interview about Parkinson's https://t.co/C3pbU3Z06D,WESH,Orlando - Daytona Beach,-0.23076923076923078
709,Michael J. Fox says he doesn't expect to 'be 80' in raw interview about Parkinson's https://t.co/3oG390iAjG,wyffnews4,"Greenville, SC",-0.23076923076923078
710,"thought you fvckers hated it over here anyway. we have our own disease riddled yt folks, thanks tho. https://t.co/nDtF0mBGc6",bojogaetae,she/her • btxt ✢⁷♡,-0.03333333333333335
711,"@ThatEricAlper Witnessing my mom’s illness make her deteriorate b4 my eyes, and having our roles basically switch.… https://t.co/wGvepR3riX",musical__bean,"Brooklyn, NY",0.0
712,Calling all males diagnosed with celiac disease. We're getting ready for an exciting virtual event on May 22nd with… https://t.co/BhhRBByZYz,uchicagoceliac,,0.25
713,@5lut_ Stay the fuck out of our country you disease ridden freaks,_EveOnline,,0.0
714,"system allows the body to kill metastatic disease, therefore, lowering the chances of relapse. Despite these advanc… https://t.co/96EiXsNgd1",asliverarrow,"Columbus, OH",0.0
715,"@TheFigen_ It's fake, but certainly the way technology is moving, very possible. However, I think it is more likely… https://t.co/hZWdrBlVf5",eastvillagetwt,"East Village, New York, NY",0.04285714285714286
716,Tepezza Approved for Thyroid Eye Disease Regardless of Disease ... - Endocrinology Advisor: Tepezza Approved for Th… https://t.co/9jKwX9FQNw,mb_endocrine,,0.0
717,Genetic testing is typically used to help confirm a Pompe diagnosis. Check out our resource page to learn how GAA g… https://t.co/7t73REvxnC,PompeNews,"Pensacola, FL",-0.16666666666666666
718,"Jelousy is a disease. And keep minsung out of ur mouth when you, yourself is also a fucking shipper. What a hypocri… https://t.co/aAyhmx5TRN",chitozboi,,0.0
719,DYK that May is #LupusAwarenessMonth? Join me and Make Lupus Visible by raising awareness about this chronic autoim… https://t.co/JkgZltcFU7,LERISmedia,"Washington, DC",0.0
720,#LymeDisease is becoming more common in the UK. Avoiding tick-bite and removing ticks as soon as possible is the be… https://t.co/yFWYkXDhgc,Bartonella,"Research Triangle Park, NC",0.16249999999999998
721,Register for this webinar by @VivoSense to understand how patient engagement can enhance digital endpoint developme… https://t.co/CCeuzmxQU4,Xtalks,Online,0.0
722,y’all nasty fucks gon do what y’all do best and spread disease everywhere https://t.co/21a6QPFTkZ,2ynthx,she/they,0.0
723,Men ages 30-55 are the fastest growing sector for the disease. https://t.co/p7WeBDCgYw,levelmag,,0.0
724,@stonewallz no virus has EVER been contagious?? no virus has EVER caused disease?? jfc😭and in the context of terrai… https://t.co/eZee7W1yrz,disgaursting,,0.0
725,Eli Lilly said its experimental Alzheimer's drug appeared to slow worsening of the mind-robbing disease. https://t.co/No70LtBUrC,CBSNews,"New York, NY",-0.10000000000000002
726,"Today we approved the first respiratory syncytial virus (RSV) vaccine, approved for use in the U.S., to prevent low… https://t.co/7gUkysRlTJ",US_FDA,"Silver Spring, MD",0.125
727,"@sprinkles19025 @RexChapman @SeaBosJoe ""common sense?"" You aren't using any of that word in this kid's situation si… https://t.co/wmUgByqj4V",KevinDArnold,desert ,-0.3
728,The rare disease challenge: Nobody knows the disease and the several symptoms. No GP has the time to celebrate a hu… https://t.co/rBLd795bGT,SchulerHealth,71069 Sindelfingen,0.15
729,"@SamWalworth I am willing to take vaccines that eliminate the disease. 

I am not willing to take seasonal flu shot… https://t.co/yVAazsOHgl",digysa22,🏝🌊☀️🌴,0.0625
730,@TransScienceTS @CosmicLordSteve @OliLondonTV That's because women without uterus are men. The only CLOSEST thing t… https://t.co/OCO1TTIUx4,JackHorner626,Criminally Good at Baking Pies,0.0
731,"@CGC6000 @elebull @itsJeffTiedrich I was disqualified due to Graves Disease. Even after a year clear, I was still t… https://t.co/gWcSGrNBOG",SaintMsA23,,-0.01249999999999999
732,"@LoriMills4CA42 What could go wrong?

Biden admin says this is great for the US. Will bring us... disease, more nee… https://t.co/jbuQHsCrOE",RobSmith_Munich,West Coast,0.26666666666666666
733,@ComradeX02 “Celebrity worship is a disease” and you have Taylor swift and bey in your bio while also claiming to b… https://t.co/u8r0GapbpF,acrowdedplace,,0.0
734,Professor &amp; Head Ophthalmology chaired the session on Diabetic Eye Disease held @Gsvm_kanpur @GsvmKanpur Auditorium… https://t.co/WBbKKlx8iS,EyeGsvm,,0.0
735,You can look at disease as a form of disharmony. And there's no organ system in the body that's not affected by sou… https://t.co/nZNhOKeAvB,SabzerAzoh,Nature 🍃,0.0
736,"@ChrisPalmerMD It may be equally bad for addiction as it’s seen as a decision and not a disease by many. Also, diab… https://t.co/EtebYLosqu",CoachAnnaSRx,"Nebraska, USA",-0.09999999999999992
737,"@RUDOLFJ15 @CreutzfeldtD The data show no increase in the prevalence of prion diseases: 
https://t.co/NMt7fAj3Qw.
T… https://t.co/yhD3sxjxr6",Asso_Emilys,,0.0
738,Michael J. Fox says he doesn't expect to 'be 80' in raw interview about Parkinson's https://t.co/XJEgFHnqdF,WXII,"Piedmont Triad, NC",-0.23076923076923078
739,The refugees who managed to settle there had good social and political connections unlike the ones who were sent to… https://t.co/qQLe3Nnfeh,CommenterSerial,State of Conscious Inertia,0.24444444444444444
740,"@WiChrisandra The current disease of woke  is reaching the private schools in my area and others, I hear as well.",mtgir,somewhere green,0.0
741,Exciting news! I am thrilled to announce that my first research paper has been published. The paper is published in… https://t.co/HX6TrKPVts,Minhajul1akib,,0.3833333333333333
742,@drkeithsiau Could it be Whipple's Disease?,diogo_war,,0.0
743,#Meniere's disease patients have a variety of treatment options to consider when receiving treatment for #vertigo and #tinnitus.,VertigoHelp,,0.0
744,"@SkrungleSkrimbo You CAN have healthcare, but that isn’t what it says. 

You don’t have the RIGHT to healthcare. Yo… https://t.co/9r9ZYklMBZ",LostLarry1,,0.2857142857142857
745,"Heya! I published any quadruplet of poetries.

Subjects:
(1)Dog with skin disease,
(2)Corruption of eyes and sou
(3… https://t.co/HFQw0UEIIK",prnce2048,"Prayagraj,India",0.0
746,STAY IN YOUR TURF!!! i dont want to catch whatever disease makes your teeth look like that https://t.co/4Zk2tlBszX,AntiWarDevil,any pronouns 🏳️‍⚧️,0.0
747,@ag76_biotech Hard to ascribe much value to pc data- you could argue that one of the reasons for so much prior fail… https://t.co/M9Bx1TQogD,biobrainbox,,-0.14791666666666667
748,@SkySportsPL All that beef gravy given him mad cow disease,timmy_tubbs,,-0.37916666666666665
749,"Brilliant to see @erikapriceart's This Dread Disease We Call Skin getting some well-deserved praise, genuinely one… https://t.co/C0h3I8mIun",LeoHealy,"Yorkshire, UK - He/Him",0.65
750,@MarthaHabluetz1 @SenBryanHughes @TexasSenateGOP @SenatorBirdwell This nasty dreadful daylight saving time should g… https://t.co/RH6s9SUKiq,robertbmack2,"Hillsborough, California",-1.0
751,"🇨🇭ZÜRICH OERLIKON🇨🇭
I returned to the #UnitedKingdom this morning after having a few days in Zurich and to tell you… https://t.co/zQbu1tcu1q",levittpt,"London, England",0.0875
752,"I have hit the £1,000 target on my fundraiser for Huntington’s Disease. Should I increase target to £1,500? 💚💗 https://t.co/IshDCk2oiB",rickyjohnston26,medway kent UK,0.0
753,Eli Lilly gained 5.8% after the clinical trial data showed its donanemab drug slowed progression of Alzheimer’s dis… https://t.co/0G7q902OrD,chippy_ca,Canada,0.0
754,"@ilovehiphop_88 Artifacts No Expiration Date, Diamond D, Rear View, and Nas king’s disease 3, and a few others",JohnQuality5,,-0.2
755,"@LiveAction Pulmonary Hypertension, Ectopic Pregnancy, Molar Pregnancy, Cancer, Preeclampsia, Kidney Disease, Heart… https://t.co/as0CxJwNMN",libertycorn0123,,0.0
756,influencer culture is a disease,imsmokingacig,unravelingtheknot of suffering,0.0
757,"@kristenmag @PeteUK7 I haven't recorded any songs about mosquitos, but we also try to reduce the spread of disease… https://t.co/bIkqkXgS0m",Ninawildflower,"Norwich, England",0.0
758,@cynthiamckinney Armed goons with badges...a systemic infectious disease.....only the truly ignorant turn a blind eye,PhotoSarsfield,,-0.25
759,"@PrinzmetalAngin Of course, patients with obstructive coronary disease can also have endothelial dysfunction or spa… https://t.co/5Tm5fswlbH",egutiMD,,0.0
760,@LeanderAlphabet Pat Riley called it the disease of more,oxybroadcast,"La Crescenta, CA",0.5
761,"“It could be available for seniors as soon as this fall, pending a recommendation for its use from the US Centers f… https://t.co/1bFD3Tu6u4",AmeshAA,"Pittsburgh, Baltimore, NYC",0.4
762,this is a mental disease https://t.co/ygqPuPja9i,luvzara7,she/her blasian,-0.1
763,"There is absolutely nothing in this clip that I wouldn’t expect a half decent CB to do, this fanbase is a disease o… https://t.co/1ZUd12fnyv",u_ited,don't take me seriously,0.06666666666666667
764,@Randall87454048 Sometimes pandemics stop when there aren't enough people left to transmit disease.,NietzscheKant2,,0.0
765,@DrAseemMalhotra and @joerogan on the Over-Prescribing of Statins for Heart Disease https://t.co/7Prl5ysU1l via @YouTube,TrevorFitzgibb1,"Spartanburg, SC",0.0
766,"Are harmful chemicals are linked to Parkinson's? 🤔

Join us for an in-person book discussion with Dr. Ray Dorsey, c… https://t.co/hDhPt2z8on",PFWPA,"Pittsburgh, PA",0.0
767,@aeie_md Hahahhahahahahaha I have covid symptoms this is not a shipper’s disease hahahahahahahaahahaaha damn I wann… https://t.co/ZrKyEn3gfc,julianeband,"ÜT: 14.45274,121.04465",0.0
768,@GSostakas @TheNoonGospel @DrJohnLoMonaco @rachelschraer And another one. The rate was similar between 2020 and 202… https://t.co/xnc89jtgcu,taleaver,,0.0
769,"@bambkb Endless vaccines, can no-one see how Nazi this is 😕 
And what if we don't want to eradicate all disease, ze… https://t.co/oBmVnM5AkR",meta_munk,uk,-0.125
770,"Disease. It will face death. Religion
OUNASS_NOON_PROMO_NON_TOYOU_TO_Fordeal_HM_and_Body_H&amp;M
YOU_H_AND_M_OUNAS_COUP… https://t.co/om1Q5vvBRf",UniqueArmstrong,,0.0
771,@mattmezz @simonateba @SecBlinken Lots actually.  Most are simply feeling sick for a day or two after (equal to the… https://t.co/QWseRwPJg0,NellaDoubleDub,,-0.053571428571428575
772,"Donanemab, a monthly antibody infusion made by pharmaceutical company Eli Lilly, also significantly reduced brain p… https://t.co/3OK2CXY3FS",NBC10Boston,"Boston, MA",0.375
773,"@ViroLIEgy @Bio_inspiration All your confounding variables were irrelevant, like claiming cell culture medium cause… https://t.co/xMRcKOKkhj",Tetrahydropyran,,-0.5
774,"Many African American individuals are at risk for APOL1 kidney disease, but few know they have the gene variants th… https://t.co/M2DTn3KCk8",KidneyNews,North America,0.075
775,Let's remember Cholera is a preventative disease https://t.co/2F7iElVXWX,TafadzwaMamvura,"Harare,Zimbabwe",0.0
776,Increasing mean levels of depressive symptoms in dementia with Lewy bodies while patients with Azheimer's disease s… https://t.co/udM9Qn8jQ0,BlancFrdric7,"Strasbourg, France",-0.3125
777,"@vickyojays Tissue culture is an advanced technique to grow disease-free, genetically altered, or high-valued plant… https://t.co/6cGdE6c4ni",organicfarmKE,,0.32
778,brain disease from growing up online ig,Geenix7,"Virginia, USA",0.0
779,Erik Prince is a disease that requires a hemp-based solution. https://t.co/bNZsGQmWIi,mccannst,,0.0
780,"Quick take is perhaps a bit more efficacious that lecanemab - due to patient selection, perhaps more complete/faste… https://t.co/RndXBGlRUU",smead2,London and Ivinghoe Aston,0.26166666666666666
781,@Fan2La88 @HokieJAC @Kriscilicious @eugenedun111 @PApynys @SeidenWSBTV @Atlanta_Police @wsbtv Jesus Christ IMHO. Th… https://t.co/DN0e4zGDoO,MAContrera313,,0.0
782,"Best heart-healthy foods for men that help you protect your cardiovascular system from a heart attack, coronary hea… https://t.co/UXSzvHbhOQ",healthyious,,0.75
783,"May is Bladder Cancer Awareness Month, and @TUF_tweets, along with other charities, will be active
on social media… https://t.co/fxf0s4js1J",TUF_tweets,UK and Ireland,-0.075
784,DDW 2023: sessions you can’t miss. https://t.co/k07IVn9fcu @DDWMeeting @AASLDtweets #DDW2023,gastroendonews,"New York, New York",0.0
785,"@LwyrUp406 @MrbillREdenver Even when they know it's false, if they do the surgery and sex change the stats for suic… https://t.co/xUfnD79A7O",amilian,Honduras,-0.4000000000000001
786,"My name people were born to win, but sometimes not entirely developed.
OUNASS_NOON_PROMO_NON_TOYOU_TO_Fordeal_HM_an… https://t.co/9YbOofr41d",heyme125,Panama City,0.375
787,"The illness ruled out of the game, it's suffering from a disease called a Mvala. https://t.co/2xzmRTD4Py",FootballMalusi,,-0.4
788,Long COVID clues point to viral reservoirs as key target : Shots - Health News via ⁦@NPR⁩ #COVID #COVID19… https://t.co/7JeS7eXcil,GotSkyHealth,"California, USA",-0.025
789,Phase 3 clinical trial data showed the $GSK vaccine had an efficacy of 82.6% in preventing confirmed lower respirat… https://t.co/uYSzzqcrpj,thudderwicks,Wall Street,0.4
790,"Guns,disease, Christianity, and an idyllic way of life https://t.co/jrA67beT65",neemax7,,0.0
791,british people love spreading disease https://t.co/poIoiCa910,swordgirl_,,0.25
792,"@FionaStephens1 Hey, even if it were, you have every right to ask. Answer; I don't know. I think we were sold this… https://t.co/azAi1SMvPs",DrHoenderkamp,"London, England ",0.2857142857142857
793,My terrible disease has left my vocal chords so stretched out and knackered that I can now do a pretty good impress… https://t.co/QzRZ9WfEHX,RedJolt,"Fra Mauro Hotel, Bar & Casino",-0.020000000000000018
