,tweets,user,location,polarity
0,"@USFWS But every tick eaten is one less to burrow under someone's skin and potentially spread disease. So yea, opossums!",proverbialcat,,-0.08333333333333333
1,A man who alleges he caught Legionnaires' disease after a hotel in Napa was contaminated last summer has filed a la… https://t.co/VeVcAwuJyk,KPIXtv,San Francisco Bay Area,0.0
2,CORRECTION: Disease Outbreak News (DON): Cholera - Malawi https://t.co/ibclrkT5SC,lekh27,new delhi,0.0
3,"@DeepakChopra my friend!  The appearance of a savior is a promise given to us by God, the twelfth imam of the Shiit… https://t.co/oqi38K74u9",Havva1344,خلیج فارس ,0.0
4,genyern #六盘水 disease #辽源 squarrosee #文山 https://t.co/YZg60G3xhW,DianaLu98883188,Sandy,0.0
5,"Despite #Turkey’s denial of #ArmenianGenocide, it’s destructive role in #Azerbaijan’s aggression on #Armenia &amp; the… https://t.co/tKiHcy1Ye1",zkhosq,Armenia | USA,-0.6
6,Meet our consultant interventional interventional #pulmonologist Dr.SUBHAKAR garu for all kinds of lung diseases li… https://t.co/xfJjPmgepf,namasvi_clinics,"Pragathi Nagar, Nizampet ",0.0
7,"@STudio_8_7 @Mariyaturhh Being broke today is not a disease, once the individual got value, the rest is history.",datesnature,"Lekki, Ikate, Lagos, Nigeria ",0.0
8,"FIRST S.A VIRTUAL ANGIOEDEMA CENTRE LAUNCHES IN RARE DISEASE AWARENESS MONTH 
The Sinovuyo South African Virtual An… https://t.co/bqmZdrC592",HAE_SouthAfrica,Johannesburg,0.18333333333333335
9,@lordvictor Imagine being killed by the Earth equivalent of Parkinsons disease.,Ben_Saint_James,"Tennessee, USA",-0.2
10,"@LynArch97576977 This country is steeped in tradition and history 
How you think you got though both wars, famine a… https://t.co/kSDYX39TMT",thursty007,"Toronto, Canada",0.0
11,"@shelly_187 Add ""The Clot Thickens"" by @malcolmken
Very easy read that systematically dismantles existing heart dis… https://t.co/NjTYpjcvG3",garrypkeogh,"Greystones, Ireland",0.5633333333333334
12,"@TonyRobbins 😍my friend!  The appearance of a savior is a promise given to us by God, the twelfth imam of the Shiit… https://t.co/3EI7O2Ivzh",Havva1344,خلیج فارس ,0.0
13,Go to emergency room thinking you may just have the flu or a stomach bug but find out you have a bowel obstruction… https://t.co/1PtL1GrQK3,TL_Weezie,,0.0
14,@iluminatibot And Jordan Peterson predicted it by demonstrating the stats of authoritarian takeovers via infectious… https://t.co/CQEJbCaIbq,Iset05312031,,0.0
15,"Don't Let Your Heart Open To Valve Disease

Suffering From any Heart symptoms 
Consult Our Cardiologist 
Pls Do Cal… https://t.co/iNiw7L7loT",DrRavindraheart,,0.0
16,"@HenMazzig yup - you are absolutely right! 
Focus on saying sorry &amp; working against the hijack of being Jewish 
as… https://t.co/Qd3mRJRlgv",YaelBerda,Yaffa,-0.07142857142857144
17,@NottabotMom @CovidDataReport im sure there was no way to prevent the infected needlessly breathing disease all ove… https://t.co/KVbUc90oql,antlila333,"Louisville, KY",0.0
18,"#17Feb_SantRampalJi_BodhDiwas#17Feb_SantRampalJi_BodhDiwas
Is to create disease free world where no one is affected… https://t.co/KhRf2HOwlp",patil_kashinat,"Jalna, India",0.4
19,New Research: A case report of neuronal intranuclear inclusion disease with paroxysmal peripheral neuropathy-like o… https://t.co/aifgIyf3uD,FrontNeurol,"Lausanne, Switzerland",0.13636363636363635
20,@GarysBlues I'm not worried about it...Allowing the Dems + media to get infected with foot in mouth disease...If we… https://t.co/ReIYD73eJy,jimdande25,Michigan ,0.0
21,"Well, fuck. On my scorecard: 1 for Cancer, 1 for thyroid disease, and 1 for endocrine disruption. 🤦🏻‍♂️ https://t.co/QdwbMmkhaw",SmarmedD,Free State of Florida 🐊,0.0
22,"@DavidLuiz_4 @Flamengo 🙏my friend!  The appearance of a savior is a promise given to us by God, the twelfth imam of… https://t.co/X73CkET76c",Havva1344,خلیج فارس ,0.0
23,"140Ruggeri grapes (unknown pollen father). God knows which salt,drought or disease tolerant rootstocks could be bor… https://t.co/8QGPLyjJKp",AZTbiowine, Madrid🇪🇸-Adelaide🇭🇲,-0.1
24,"@LindaMason13 @JackGYoung @Broadwaybandit5 ""maladie de Charcot"" is what the French called ALS or Lou Gehrig's Disea… https://t.co/f14OJBlCcT",Democracy631,"Bretagne, France",0.0
25,"@stillgray Venereal disease, I mean, Madonna, please get the hell away from me. 🙏",ManInHisRoom,,-0.3125
26,Best wishes to a great Cymru footballer Jason Bowen following his Motor Neurone Disease diagnosis All fans here in… https://t.co/fbN35pxCvZ,KevJohnscymru,"Swansea, Wales",0.6
27,"@oscar8 🌸my friend!  The appearance of a savior is a promise given to us by God, the twelfth imam of the Shiites;… https://t.co/HzrW4zzm6y",Havva1344,خلیج فارس ,0.0
28,Originally posted on Reddit. Do you think my lizard have metabolic bone disease https://t.co/q5kA1talRY,KAITLYN07933690,,0.375
29,@nick_coatsworth Well you wouldn't be my doctor then. I like my doctors to be smart and know stuff about disease pr… https://t.co/KFR1LxNMC4,TrippettaRaffe,,0.21428571428571427
30,"@JessikaBaral 4/ Bayer and Huma work together to build an online heart risk assessment tool, taking a step towards… https://t.co/HPrkrEk3KF",vasudevbailey,"San Francisco, CA",0.0
31,"@Comcept @willianborges88 🌸my friend!  The appearance of a savior is a promise given to us by God, the twelfth imam… https://t.co/HxSkpKG5S8",Havva1344,خلیج فارس ,0.0
32,“The other thing is I think the beautiful thing about this is understanding the microclotting process… is this is p… https://t.co/PeJ0uTZxIG,loscharlos,"San Francisco, CA",0.3625
33,Centrism is truly a disease,gooprone1975fan,,0.0
34,@SumSumSeVeN JEALOUSY IS A DISEASE AND I'M A SERIOUS PATIENT.,fckd_Trndsetter,under your bed,-0.3333333333333333
35,"Very tough situation this time we didn't faced any issues
like this before Due to hot waves in western Rajasthan cu… https://t.co/Jxqy5BzEHZ",organicjikaka,"Barmer, Rajasthan ",-0.09513888888888888
36,"@andresiniesta8 @visselkobe 💞my friend!  The appearance of a savior is a promise given to us by God, the twelfth im… https://t.co/1caGilF6gh",Havva1344,خلیج فارس ,0.0
37,"Disease
There is still us against you don't wait for comrade swiftly slain, vigil strange with your mouth
Because you help",TitusAndMessina,,-0.05
38,"@nickypromotes I hope it's my turn today so I can win here If you're lucky, I want to buy my grandmother some fruit… https://t.co/fSZU1XNbWz",LebaranBigwinx,,0.5666666666666667
39,@3minutehero @jaxxdragonan @frieda_lessar @IanCopeland5 The “science” is missing its foundation. Do fire fighters a… https://t.co/a2vTPNHNn5,holisticgrenade,"California, USA",-0.2
40,"@cesc4official 😍my friend!  The appearance of a savior is a promise given to us by God, the twelfth imam of the Shi… https://t.co/jiQUfr51Hy",Havva1344,خلیج فارس ,0.0
41,@apiculturalLdn @ApidaeHoney @ElmTreeBees @GlenHeathrHoney I am surprised at the numbers of imported (non-native) b… https://t.co/ugzsBxfvtQ,Valehoney3,vale of belvoir,0.1
42,@TheOnlyKemi Do you have agbado disease,dutchflamx,,0.0
43,@eugyppius1 @RealJermWarfare @uMarhobane What does that tell us about human disease? Nothing. Not even animal disease.,zbingledack,,0.0
44,"@MayoIsSpicyy Bad case of the infectious, UTRA MAGA TRUMP DERANGEMENT SYNDROME where he lives in YOUR brain 24/7.… https://t.co/7EpxblKj6l",frankkane1919,Your Grandmama's Cellar,-0.6999999999999998
45,Imagine a Somali Muslim brother replying this way to a Dua.  Walahi nationalism has to go . It’s a disease that has… https://t.co/fg8dwFpYFW,dr_technocratic,"Dallas, TX",0.0
46,"#GUQQIE: Did she watch to? I hope so. I hope it hurt.
#OWEN: You are a disease on the face of this earth, and I am… https://t.co/qnwKG2JXYE",ALEXKRALlE_,ic by @ThwPankChu !!,0.0
47,"Lmao that was Peak Infectious Disease Period. 

😂 https://t.co/hRFdItX3qJ",Letter_to_Jack,,0.0
48,Donald Trump: Mexican migrants bring 'tremendous infectious disease' to US https://t.co/IIgWn8yU3q,Gregory011,,0.16666666666666666
49,Of all the things I've seen Nothing will ever seem As clean as my disease I rinse my hands of thee,MrKittyLyricBot,,0.3666666666666667
50,"Register now! WEBCAST of The 150th Anniversary of the Discovery of M. Leprae 
~ A Look at the Past, Present and Fut… https://t.co/VqPQsgKq59",TNFandSHF,東京 港区,-0.125
51,"@LuisSuarez9 @Gremio 💞my friend!  The appearance of a savior is a promise given to us by God, the twelfth imam of t… https://t.co/Uggtzz2sXr",Havva1344,خلیج فارس ,0.0
52,"NFL players     Porn Actresses
                      🤝 
         Getting an acronym
          Disease from rough 
                     Play",your_cman,W E S T C O A S T ,-0.1
53,"@Goodtweet_man Wait, is this person saying the fungus that takes control of people's brains should not be feared. M… https://t.co/IDEfpS1L4s",TapiaWant,unemployment office,0.0
54,"@3gerardpique 😍my friend!  The appearance of a savior is a promise given to us by God, the twelfth imam of the Shii… https://t.co/7EI8MPy44d",Havva1344,خلیج فارس ,0.0
55,"good morning i went to the doctors and it went fine before bestie dropped ""it could be this chronic disease i did r… https://t.co/vZE0FxWazY",laurakitten_,she/her | 17 ,0.5583333333333333
56,"@Carles5puyol 💞my friend!  The appearance of a savior is a promise given to us by God, the twelfth imam of the Shii… https://t.co/NB6mnQlZ3b",Havva1344,خلیج فارس ,0.0
57,"TechBio Happenings of the week! 5 things we enjoyed reading this week: @JessikaBaral

1) GlassAI diff diagnosis for… https://t.co/cdNOEsApEo",vasudevbailey,"San Francisco, CA",0.5
58,@uwanuruochi My brother....they are protecting the disease (Nigeria) that is keeping them in the hospital of non-ch… https://t.co/Mf8EvDmKKO,IfeanyiHoreb,,0.0
59,"@DoubleDownNews @DrAseemMalhotra It seems to me that Malhotra is blaming vaccines for the excess deaths, whereas ot… https://t.co/izoO28VbUL",janiceplant1,,0.0
60,Discovering the royal roots of #Haemophilia: Queen Victoria was a carrier of the gene that caused the disease in so… https://t.co/d2uDfPsniJ,homi_lab,,0.0
61,@claushetting @c_drosten He did not invent it friend. The guy that did though conveniently died 6 months before cov… https://t.co/8F7EalE7Ef,BigJohn38777516,,0.0
62,Bird flu is affecting farm chickens. Lumpy disease affected farm cattle. Is it so far fetched to conclude that the… https://t.co/HOlUzCaT4f,jagchat01,Bhubaneswar,0.1
63,"@XabiAlonso 🌸my friend!  The appearance of a savior is a promise given to us by God, the twelfth imam of the Shiite… https://t.co/n0MH4BPFCP",Havva1344,خلیج فارس ,0.0
64,"I heard there’s a bird flu, weird clouds, COVID variant, mad cow disease, chicken feed problem, food factory fires,… https://t.co/64mKaZXUzx",MrGlobal129,,-0.46458333333333335
65,@EnemyInAState China gaslighted the world repeatedly about #Covid19  to protect xi's ego and the CCP.  vs be honest… https://t.co/lLQ8WXek8z,pqpolitics,"Vancouver, BC",0.6
66,"@GreenEngineer42 It does seem like an enormous dose, but it is looking like it may be the correct one for many peop… https://t.co/9tsuuMkRkS",Doc_Valerie,Santa Fe,0.25
67,"@KAKA 💞my friend!  The appearance of a savior is a promise given to us by God, the twelfth imam of the Shiites;  Ma… https://t.co/n7WzmeAI6i",Havva1344,خلیج فارس ,0.0
68,Is it possible  we might be able to prevent this disease with high fiber diet ? https://t.co/37RVff5HU2,espacetime_,"Cyberspace, ",0.22
69,@Covredarkbane @soldier04206266 @pinkheretic Why though? Vaccinating agaisnt a disease with 99% survival rate?,NgolaBlink,Africa,0.0
70,"@RealDeanCain Is she on meds for some disease, like thinking she matters, med?",jklmnop39,Washington State.,0.0
71,@RMajongwe @nickmangwana @ZiFMStereo @ZBCZW @StarfmZimbabwe Ah yas! Music doesn’t influence anything to that extent… https://t.co/d9uT7X7cex,tafadzwamarere,Harare,0.0
72,"Fluoride has been linked to calcification of the pineal gland, lower IQ, cancer, endocrine disruption, diabetes, kidney and thyroid disease.",iluminatibot,,0.0
73,"@10Ronaldinho @KingJames @NBA my friend!  The appearance of a savior is a promise given to us by God, the twelfth i… https://t.co/VipqZxM2YF",Havva1344,خلیج فارس ,0.0
74,"GOT A HAND ON MY KNIFE, KEEP A PAW ON MY PIECE, I’LL REVEAL WHAT I CONCEAL WHEN YOU EXPECT IT THE LEAST, UR ASS AIN… https://t.co/7x0JZFKojO",RAWRDBOT,🔞,-0.3
75,"Special issue: Emerging Benefits of Vitamin B3 Derivatives on Aging, Health and Disease: From Basic Research to Tra… https://t.co/SxKBFpzZWd",0506Wong,,0.17857142857142858
76,"@neymarjr 🙏my friend!  The appearance of a savior is a promise given to us by God, the twelfth imam of the Shiites;… https://t.co/DkheXSa8G7",Havva1344,خلیج فارس ,0.0
77,"@artemisia10626 I'm not avoiding it. It's absurd, and the microorganisms that cause disease, and the means by which… https://t.co/qk0Drla6qh",veryvirology,"Arizona, USA",-0.5
78,"I have this disease late at night sometimes, involving alcohol and the telephone.",despondentliar,dm to submit quotes,-0.3
79,"@Cristiano @AlNassrFC @AlNassrFC_EN 🙏my friend!  The appearance of a savior is a promise given to us by God, the tw… https://t.co/aVrCH7CNyR",Havva1344,خلیج فارس ,0.0
80,@AGreenroyd1958 @slackingoff3 @CXineax @AmandaINC @ArisKatzourakis You describe yourself really well that you don’t… https://t.co/1yqH02xS54,hidebehindblock,,0.2
81,Woman Films Seizures From Lyme Disease https://t.co/XDPCgFqC5c via @YouTube,LelaMoo48226016,Northern california ca,-0.05
82,"@DrPimKe @FrankMikeDavis1 Bad case of the infectious, UTRA MAGA TRUMP DERANGEMENT SYNDROME where he lives in their… https://t.co/9KuCzuPM3o",frankkane1919,Your Grandmama's Cellar,-0.6999999999999998
83,@hollelyn Yeah the right medicines have helped me with my depression immensely. Having a Neuromuscular Disease has… https://t.co/HZjNRhoQre,AlienPizzareia,"South Carolina, USA",0.14285714285714285
84,"@TerryGlavin As well, CBC dropped any distinction between reporting and commentating years ago - &amp; staffing ensured… https://t.co/eEfI0QdfQu",Charles0084,,0.0
85,"Remember ✅

➡️Perianal fistulas and abscesses are often the first signs of Crohn's disease",AbdulmawlaSaber,"الدقهلية, مصر",0.25
86,"Tribalism is fu*king bad
Tribalism is more than a deadly disease",spydon01,Nigeria,-0.13333333333333328
87,Did you know that pigeons ranked first in causing Meningococcal disease?,WeHatePigeons,,0.25
88,"@DavidHundeyin @2705Dahjoy Lol no problem, one day you will be remembered too for supporting peter obi... investiga… https://t.co/mZgTSAMJW5",Viperdeyforyou,,0.525
89,"this is my son, he has every disease :( killing him would be a mercy https://t.co/nxPrGtMeaM",nyauticuh,💵: $nyauticuh,0.0
90,]B^`P Cancer is a deadly disease.       #丽江    #铜仁  #攀枝花  https://t.co/zYRYQQsW1Y,wakibula,,-0.2
91,"@maddow 💞my friend!  The appearance of a savior is a promise given to us by God, the twelfth imam of the Shiites;… https://t.co/KPt2Kwf5I2",Havva1344,خلیج فارس ,0.0
92,@I_Am_JohnCullen Is National Vaccine Institute yet another Gates funded sham cover “charity” entity like GAVI &amp; CEP… https://t.co/jxJ5ksgb43,FrancesScott007,"Austin, TX",-0.2
93,"@harrylitman @maddow 💞my friend!  The appearance of a savior is a promise given to us by God, the twelfth imam of t… https://t.co/fXPSfjz1f8",Havva1344,خلیج فارس ,0.0
94,@overmanwarrior @healthbyjames How many times did he catch covid? That's the relevant question here. Covid-19 is a… https://t.co/3ve0pQQ42a,TKL5555,Great White North,0.45
95,@WaitReborn India z suffering from this disease - helping terrorists country and getting back stabbed.,kenchuliwal,,0.0
96,"Get up soldier. Given the scale of issues like global warming and epidemic disease, we shouldn't underestimate the… https://t.co/hWtliVliPV",ECOTerminator,Your Motherboard's house,0.0
97,Immunic to Host Virtual Celiac Disease R&amp;amp;D Day to Highlight Current Pathways for Drug Development and Unmet Med… https://t.co/ePFYhNEi6l,newsfilterio,"New York, NY",0.0
98,"@LVRaider321 @FrankMikeDavis1 They have a bad case of the infectious, UTRA MAGA TRUMP DERANGEMENT SYNDROME where he… https://t.co/BQa4iVLZTp",frankkane1919,Your Grandmama's Cellar,-0.6999999999999998
99,"@chrislhayes my friend!  The appearance of a savior is a promise given to us by God, the twelfth imam of the Shiite… https://t.co/Dt6SVnWTB5",Havva1344,خلیج فارس ,0.0
100,"""Aggression unopposed becomes a contagious disease.""",fsa21227,,0.0
101,Diagnosis can improve the effectiveness of treatments and avoid long-term complications for the infected patient. U… https://t.co/Zr4kUZpnYk,AlgadhirL,"NAKURU, Freehold High Street.",-0.05
102,"The family, whose income had stopped after their father was bedridden due to heart disease was helped by the NSS Un… https://t.co/UzlTRl29yi",nsstvm,,-0.125
103,The premise of its defense is of defect and disease towards me. I am more than happy to be dishonored by my fathers… https://t.co/ZqHZSLD8iV,ColeP223,,0.65
104,"@theliverdr Green tea has been shown to have potential health benefits for the liver. shown varying results, with s… https://t.co/kUgRLfY7hg",SwamiHarami,,-0.1
105,@SibusisoPhakat1 @proforlax @AlbaMokopane We brought poverty and disease? You are joking right?,TotsShelly,Sandton,0.2857142857142857
106,@AllenShrugged @Doctor_Eric_B @drcole12 Why would a Dr be concerned with a viral pandemic disease? Hmmm 🤡🤡🤡🤡,JordanP19554170,,0.0
107,Possible genetic basis and mouse model found for severe nonalcoholic fatty liver disease - https://t.co/L7FTizcaJ2{ https://t.co/jqGTtolErP,isearch247,,-0.1
108,"@MadScientistFF That addiction is a disease of the mind, body, and soul. It's not just about quitting, we have to l… https://t.co/DjglZbV871",KarenBenning2,,0.0
109,"#17Feb_SantRampalJi_BodhDiwas
Is to create disease free world where no one is affected by the diseases. This is pos… https://t.co/KtgV1ivLxN",Kartik59165,,0.4
110,"@jaketapper @Devil_May_Dance my friend!  The appearance of a savior is a promise given to us by God, the twelfth im… https://t.co/8iIAZaEBNx",Havva1344,خلیج فارس ,0.0
111,jealousy is a disease. get well soon babe xoxo,rhyenfish,my boyfs,0.0
112,"Dieticians could support patients both those wanting to lose weight but also those who are underweight, suffer from… https://t.co/VgItppHptn",drgandalf52,Nottingham,0.0
113,"my son, he has every disease https://t.co/Ej3s204Ijg https://t.co/eMAM8mUjal",phantomhag,,0.0
114,"@Acosta 💮my friend!  The appearance of a savior is a promise given to us by God, the twelfth imam of the Shiites;… https://t.co/ZXWO9o16Fh",Havva1344,خلیج فارس ,0.0
115,"@mel_wright123 @RonFilipkowski Sorry, I tried but just couldn't continue after the 1st few lines.
I wonder if he ha… https://t.co/Z5k8oN5PNw",PurAndTell,"Ulladulla, NSW Australia",-0.35
116,"So please knock it off with the ADHD is a product of capitalism, and start framing it as a potential debilitating d… https://t.co/N4x15U8D1Z",Msnintendique64,"Probably, Taco Bell",0.0
117,"We’re speaking at the Europe Rare Disease Summit 2023 in #Madrid!

We're on “The patient’s voice as a driver of acc… https://t.co/Hvm388iJle",RareBeacon,"Cambridge, England",0.3
118,Debashrita Dey &amp; Priyanka Tripathi’s article examines the cinematic portrayal of Alzheimer’s in ‘Maine Gandhi Ko Na… https://t.co/NL6KKEoVGN,JGLR_JGU,"NCR Delhi, India",0.0
119,Every name of a disease are named after spirits,N_Spirit_NTruth,New York,0.0
120,@herbivorebaby Miyavi is really Japan’s GOAT bassist 😭🧎‍♂️,Iuxury_disease,🇹🇼🇯🇵 • she/he/they,0.2
121,"@ZcohenCNN @Acosta @PaulaReidCNN 🌻my friend!  The appearance of a savior is a promise given to us by God, the twelf… https://t.co/IvO33YbXZf",Havva1344,خلیج فارس ,0.0
122,Going to catch a disease like it's a soft ball,AshleyAsphodel,,0.1
123,"@KachiEkwerike @Blaqboy00 Stupid talk, because human poverty, illness and war have been on a steady downtrend for m… https://t.co/aNHKArWODl",DavidHundeyin,EMEA,0.08333333333333333
124,"@GalacticaGay314 Are you on PrEP? Reduces anxiety significantly. 

And no, it's not a ""cancelable"" take. HIV is a v… https://t.co/FE3c8kVAFo",ChrisMBlondell,"Philadelphia, PA",-0.1875
125,@CheburekiMan IGNORANCE is an Expensive DISEASE.,MarcAbramsD,Nairobi~Prague~Moscow~Zurich,-0.5
126,@nailgunwaowao Im pretty sure they avoid stuff like that because of disease risk with stuff like spine and brain,NitricAcidShake,,0.375
127,Mark Heathcliff(The Mandela Catalogue) has every single disease imaginable. https://t.co/8xUja6XiQu,AnalogAnything,automated by @infestasious,-0.07142857142857142
128,"@Yamiche @NBCNewsNow 💞my friend!  The appearance of a savior is a promise given to us by God, the twelfth imam of t… https://t.co/6HcJNWjL5k",Havva1344,خلیج فارس ,0.0
129,"Masks will also not be required to be worn on public transport, the health ministry said in a statement, as authori… https://t.co/rSabHhaMRQ",JKviews07,,0.0
130,"@hopirules Well, not really make you taller but your body is active and as an athlete, you eat well, sleep well, et… https://t.co/J2ThylBYzm",Iuxury_disease,🇹🇼🇯🇵 • she/he/they,-0.11666666666666667
131,"@JoeEEnglish @Yamiche @UNICEF @NBCNewsNow my friend!  The appearance of a savior is a promise given to us by God, t… https://t.co/3Kh4Ue5zPg",Havva1344,خلیج فارس ,0.0
132,"The risk of neurodegenerative diseases, such as Alzheimer's disease and Parkinson's disease, increases with age.
Th… https://t.co/Gb3ZdwJY8Z",LinusOmonge,,0.0
133,"Richter syndrome - novel insights into the biology of transformation. 

Such a challenging disease. ‘Disease marked… https://t.co/4ceKcU3qnC",graham74GC,Opinions are mine,0.19999999999999998
134,"Even we sexual disease. It
؟?
نمشے

🔹H4🔹
🔹H4🔹
🔹H4🔹",dodiramadan22,,0.0
135,@OliveSiffleur @MeetJess Well here in America the Center for Disease Control has suggested that we go to once a yea… https://t.co/IejIHK29H7,Americanhope78,"California, USA",-0.1
136,"@HopeRising19 @DrAseemMalhotra It proved 85% natural immunity, severe disease in the elderly and those with comorbi… https://t.co/u4iLerOdjt",Ljh05211999,Western Cape,0.1
137,@DrEliDavid @catturd2 Liberalism is a disease.,JeffreysErik,"Conroe, TX",0.0
138,@WillsOkojie That's why they say poverty is a disease,chimdi_orjiani,,0.0
139,@JustAGnome11 @stillgray He is a Alzheimer's disease patient,twiter20228,,0.0
140,"@Goldie1846 @angie_keathly Sorry that happened in your life, Patty.  Let’s not forget paranoia and inabilty to swal… https://t.co/tcfpott61D",AnnieP84665986,‘Radical’ Left WA Proud Blue,-0.5
141,"Ahead of print

Dextran sulfate sodium (DSS)-induced murine colitis is the most commonly used model for the analysi… https://t.co/vuSh6RAIPR",ClinAdv,"Wroclaw, Poland",0.1
142,"Alzheimer's disease is a bad disease,a man that support/ordered the killings of innocent citizens of our nation 🇳🇬,… https://t.co/Stx4tmnVuj",diepole,,-0.09999999999999992
143,"@jordanbpeterson @GinsbergHarold To introduce RNA to the high throughput process of course. 
Before 2020 these prod… https://t.co/nqD658vgEl",_HeartofGrace_,United States,0.16
144,“the interesting thing about @resiapretorius before.. was really trying to understand why chronic disease condition… https://t.co/EV9YLRsDXE,loscharlos,"San Francisco, CA",0.35
145,"God’s Word is alive in me; therefore, I cannot die. My body is impervious to sickness, disease or death. Every time… https://t.co/aaRq4RrrQO",didabliz,In Christ Jesus,0.1
146,@hopperowner @vvictorman_uel theres nothing inevitable about that. they can send anyone who can’t comprehend diseas… https://t.co/HZLyHbCYE8,antlila333,"Louisville, KY",0.0
147,To get everything you want is not a good thing. Disease makes health seem sweet. Hunger leads to the appreciation o… https://t.co/YvwIOlXAyS,HeraclitusSays,Uncover forbidden teachings👉,0.0
148,"@knightradiantt @jaxxdragonan @holisticgrenade @frieda_lessar @IanCopeland5 What a cooker ""Anthrax is an acute zoon… https://t.co/fIMIHQeaBE",3minutehero,,0.6
149,"@SavLovesSwift Taylor happy, ALWAYS. In a very very VERY small way I can slightly relate (*slightly* being key here… https://t.co/m0RVABkAPo",BaylyTaylor,"Columbus, OH",0.02833333333333334
150,@thehaloofthesun @itsnickfurlong @tomgreenlive I'll get a disease!,Krebstar1,,-0.5
151,"Where good girls go to die, that's where I'll be 
 Remembering our love as if it were a disease 
 Forget about the… https://t.co/8cVbA36oME",LAMlyrics,,0.2333333333333333
152,"whatsapp 090048 49786

 #worshop #reikihealingenergy #reikihealing #free  #mass #disease #health #wealth #happiness… https://t.co/5jgIEAGPmc",Nirvanahealings,"Navi Mumbai, India",0.0
153,@PollySamson When you understand the corruption of the military and medical industrial complex who profits off of d… https://t.co/uw1lyhRO7P,surething1973,,-0.13333333333333333
154,"Why do you @thetamoonshots insist..., on still choosing..., to put your pee pee into other men's disease filled poo… https://t.co/u9CQuXmM9I",TrumpInaugMarch,"Harrisonburg, VA",0.1375
155,@PRESSURELlCIOUS @petmaxoff jealousy is a disease dylan https://t.co/xEQGhMhQBB,HARRYSHOAX,"
i’d write this in the sky, i miss 
you like it was the very first night.
✄┈┈┈┈┈┈┈┈
eighteen. unproblematic. he / they ♡",0.0
156,Fatty liver symptoms: 4 digestive problems that may signal advanced stages of fatty liver disease | The Times of In… https://t.co/8OuiascY9a,AnilRat19449107,,0.0
