,tweets,user,location,polarity
0,@greatgreyowls @kristenmag Just taking an mRNA shot puts you at risk of autoimmune disease.,underyourskin,🇨🇦 ,0.0
1,The founders say the software can reveal any possible abnormalities in about 15 seconds. “We are like the Google Ph… https://t.co/eqp9N2sUgm,thebetterindia,India,0.0
2,"Let's unite to end the suffering caused by TB. On this World Tuberculosis Day, let's raise awareness and support th… https://t.co/7U0NBToKtd",milaapdotorg,India,0.0
3,"World TB Day is commemorated to raise public awareness about the devastating health, social and economic consequenc… https://t.co/0btmu8TlU8",KauveryB,Bangalore,-0.19166666666666665
4,"Tuberculosis is a curable disease but without detection and proper treatment, it could turn fatal. 

This… https://t.co/WWL2DzyLGs",KotakGeneral,"Mumbai, India",0.0
5,Between 20% and 30% of TB survivors end up with some form of lung problem that makes it difficult to breathe. The c… https://t.co/CgC8TXD9OG,Bhekisisa_MG,Johannesburg,-0.5
6,"World Tuberculosis Day reminds us to stay alert against this lethal disease. 

Let's raise awareness and support th… https://t.co/oh2FLCVtPG",omr_supremehosp,"No.1/56, OMR, Padur, Chennai",0.0
7,"TB bacteria causing chaos, inquiries on source &amp; remedy effectiveness. Dr. Vinay Nandicoori to discuss on ""Towards… https://t.co/iC5Jeywoig",kkroundtables,"Mumbai, India",0.0
8,#Tuberculosis is an infection that affects the lungs and spreads through respiratory droplets. Most people think th… https://t.co/vy2D5P51FZ,Apollo_Chennai,Chennai,0.5
9,Infertitlity is a disease of reproductive system that impairs body's ability to perform basic reproductive function… https://t.co/v2n32BVPoq,Wishealth1,,0.0
10,"On this World Tuberculosis Day, Let’s pledge to raise awareness about Tuberculosis upon timely diagnosis and treatm… https://t.co/fQPM1MNXoB",KVHospital,Kovilpatti,0.0
11,"Brisk walking has been shown to lower your risk of heart disease, stroke, and high blood pressure. Plus, it's a gre… https://t.co/eh6UJ2ZeSB",drvenkateshhara,,0.16
12,"Tuberculosis remains a major global health threat. As we mark World Tuberculosis Day, remember those who have lost… https://t.co/Gg45eiZfGO",ekata_manch,"Mumbai, India",0.03125
13,"TB is curable and preventable...
On this World Tuberculosis Day, let's spread awareness and help eradicate the dise… https://t.co/FWdHQfK3Ce",KnackGlobal,India,0.0
14,procrastination is a disease,calsvault,she / her • 19 • chicana,0.0
15,@Bergermeister23 its a disease that should be treated in an asylum.,jeleigh75,"Gosford,NSW,Australia",0.0
16,Lrt my adhd actively makes it harder to take care of myself and a huge cause of my suicidal depression was the myri… https://t.co/pVFgGDXcC9,hotmalewife,pdx,0.05555555555555558
17,"Tonight’s for you JV!!!

Thank you 🙏 for the childhood memories &amp; years full of laughter

Get some rest king… https://t.co/gvaan9pw7D",RyanHorstkotte,"Las Vegas, NV",0.35
18,In India over 20 lakh people die due to TB every year. This is due to improper diet.DSS volunteers has shunned smok… https://t.co/Oc18OCWfqh,SunReet777,,-0.125
19,"PM Sh Narendra Modi Ji has set the ambitious goal of making India TB-free by 2025, five years ahead of the global t… https://t.co/xAxLllPGPA",madurai_aiims,"Madurai North, India",0.21666666666666667
20,"@BaronVonPhul @nypost It's to promote the idea that people don't just choose to commit suicide out of nowhere.

The… https://t.co/yit4OEUCV2",mayankniko973,India,0.0
21,@DrSamba959 Salutogenic focuses on what causes health &amp; a maintenance of good health rather than the disease.Saluto… https://t.co/MF72C0DBwO,bretneymj,,0.7
22,DEPRESSION — THE DISEASE OF THE CENTURY https://t.co/bCCp4ykAtk,BpMarcelo,South Africa,0.0
23,@MukkaObulReddy World Tuberculosis day asks every person to come together and reduce the possibilities of this deadly disease,Ramanarayana6R,,-0.2
24,"@hallstrong1 ...rubbish tip to you, spreading disease with the greatest of ease. 

No, I don't recall it.",AlbertonPower,"Adelaide, South Australia",1.0
25,"@ptrish1969 @MadBeets @JoJoFromJerz @elonmusk Patricia, c'mon, you know that personal responsibility is a sympton o… https://t.co/ldQI4ivBfy",Islandjen2012,,0.0
26,"Everything you need to know about Hand, Foot and Mouth Disease from Dr Shobha Sapkota. 

#Awareness #pediatric… https://t.co/cT7Q9qrIpx",medharmaclinix,"Jhamsikhel, Lalitpur, Nepal",0.0
27,&amp; I HAVE UNDIAGNOSED EARLY ONSET PARKINSON DISEASE &amp; I HAVE DISSOCIATIVE IDENTITY not a disorder A continuum of POS… https://t.co/azUCBIbhiz,AnnaattheMUSE,,0.1
28,#The_World_TB_Day marks the day when Dr Robert Koch in 1882 announced that he had discovered the bacterium that cau… https://t.co/lNQKJOZ2CZ,rpfnfrkir,Katihar,0.0
29,"Acknowledging World Tuberculosis Day with an aim to build public awareness about the disease.
This World TB Day, le… https://t.co/1LtiNokI4S",archanadhawandr,New Delhi,0.0
30,"[WORLD TUBERCULOSIS DAY]

Tuberculosis is an infectious disease that we should be aware of. The tagline for World T… https://t.co/dNvuT7aEvx",jklunair,"Surabaya, Indonesia",0.25
31,"PM Modi is always concerned about contagious disease like COVID and TB
https://t.co/trzwpHzrDD

via NaMo App https://t.co/TFynaKD46P",prashanth_pgr,,0.0
32,"On #WorldTBDay, we reaffirm our resolve to ending Tuberculosis by ensuring universal access to effective healthcare… https://t.co/AHjj8hpdi2",DrPKashyap,,0.3
33,@FOX5Vegas She got some skin eating disease.,CarmineSantia14,,0.0
34,"One step towards treating #Tuberculosis can make a big difference!! 
Today is a day to raise public awareness about… https://t.co/Uwgu8X5wUL",btushar02,"Bhubaneshwar, India",0.0
35,Lying gotta be a disease 😂😂 fr cause why y’all do it for no reason,_CoeurInconnu,,0.0
36,"We know that DNA is the powerhouse of our body. 
Saint Gurmeet Ram Rahim ji tells that it has been expressed in rel… https://t.co/qkhpBnUKoY",gs6280758639,,0.0
37,"PM Modi is always concerned about contagious disease like COVID and TB
https://t.co/zOe6gAPPuZ

via NaMo App https://t.co/8hvwysgZC0",AmitDat79867370,,0.0
38,"@seeksboston26mi Fucking disease, sorry man. I hope you get better soon",sublimepilgrim,,0.0
39,not @nxl_jayska correctly diagnosing me with Wants Shanks To Raw Me Disease https://t.co/JnLkImKfPD,nsd_ao3,Canada,-0.015384615384615385
40,"Añonuevo: At present, we actually have three cath labs [at UP-PGH]. This is designed to offer services to our patie… https://t.co/jydO8xk1l1",upsystem,Quezon City,0.0
41,"@JanetMagee18 @Michell63807421 Twitter provides a record of how language changes or not in dementia.
Bear in mind t… https://t.co/72xLrRl9NS",dr_shibley,London ,0.0
42,Jq&amp;kv Cancer is a deadly disease.   #上海   https://t.co/R9MK9TJ4EI,Muhamma12064418,Pakistan,-0.2
43,"@NatGeo It's A Disease . So doctor's, love ones ,friends all can reach out by helping them .There should be a low c… https://t.co/kTHchvgrer",MaryMary3125417,,0.25
44,"@GoldieRolledOne @SFMoonknight @ChuckCallesto Slavery cost a fortune to maintain, not easy to keep dozens of 100s b… https://t.co/LCa7hlCZyx",LuciusQCincinn1,,-0.21666666666666667
45,"Good morning

I learned in class as a student doing phlebotomy also about Alzheimer's Disease

The disease comes wi… https://t.co/8UtO5dDg9b",khoziceo,,0.7
46,"@CNN Seems like fungus, flu’s, auto immune disease, strokes and heart attacks are up, my what could it be…hmmm, nah better not to say.",dibby29118520,,0.5
47,TB in children isn’t being controlled – it’s key to fighting the disease for everyone else https://t.co/Wfx21ARieY,NewsNamibian,Windhoek,0.0
48,@GooningPretty @CarnivoreIs @Magnum_Farce @andyswarbs Every article you have linked goes on to state that cholester… https://t.co/l9B1BvYo57,j73192943,,0.0
49,Let us spread awareness about the disease &amp; encourage timely action to fight this epidemic. Increase your willpower… https://t.co/K3IFzkzX3Y,TinaRan65879835,,0.1
50,"Three princes bring you a treasure as a gift. You must pick one.

One shows you a tapestry that can teleport anywhe… https://t.co/zn1pSNNpNX",Monkey_D_Ren,Self Note: Finish Fata Morgana,0.0
51,"On #WorldTuberculosisDay, we at #HPCL appeal everyone not to ignore the early symptoms of tuberculosis and spread a… https://t.co/OPFnDwoyDr",HPCL_Mumbai,,0.1
52,"@B1gChubs @jessmdqq Cope harder brother, of course he was referring to it as a fictitious disease. I don't care wha… https://t.co/HdSzGtACJ4",FiendingPhergus,,-0.1
53,sugar da ddy disease https://t.co/4aj3Y9kC8j,jeonghandwaeyo,'99,0.0
54,Yes stop America from spreading the poison and disease of casteism. Also after that end Racism https://t.co/HG5IbnsLRc,deryll_dlima,"Mumbai, India",0.0
55,On #WorldTBDay Saint Gurmeet Ram Rahim Ji asking everyone to come forward to make #TBMuktBharat so everyone can hav… https://t.co/FOXoHQngPr,vipulgupta777,"Perth, Western Australia",0.0
56,"@Izuna99 All people do is emulate off of trend, and what is promoted as alright to do, without any type of conseque… https://t.co/34sYhvAXzR",edboomstick,Erie,0.0
57,@hpmacd It’s real weird that people misunderstand the field of psychology enough to believe even for a second that… https://t.co/UhXAglzZWz,dsgstnghrnybtch,"Batfam, RTMNT, Villainous",-0.25
58,"@TimesNow It's a chronic case of foot-in-mouth disease, always making some irresponsible, tactless, insensitive rem… https://t.co/ZZ1ElKIMUN",gopal146p,Kalyan W,0.0
59,@leckie_cameron based adv. CN undermines EVERY SINGLE DEMOCRACY. Complain what CN did to Bellamy's. All aware of th… https://t.co/UX8L4vPiWt,CElmtrees,,0.08928571428571429
60,Know the four magic tests that one must do to catch the silent killer—Chronic Kidney Disease. Did you know diabetes… https://t.co/ul2wMaYCq7,chetanabelagere,"Bengaluru, India",0.25
61,[Racial-ZA] Incidence of HIV-related Kaposi's sarcoma not improving in East Africa: People in East Africa with HIV-… https://t.co/JZw11P2dvS,StigmabaseO,CA | AM | AUNZ | UK | HIV,0.0
62,@retiredcheerr @wevegotourteam Fr bitch got gum disease😭,Cheer__Threads,,0.0
63,P%J!w Cancer is a deadly disease.   #上海   https://t.co/lPxCEpLvEV,ALHatmi19196273,,-0.2
64,"@MRomero510 He was suffering from Lyme disease. Really screwed him up , he talked about it on the radio and etc. yo… https://t.co/Q9DV9NffhM",hungrysnkrdad,,0.2
65,"#TBMuktBharat heaps people do smoke, take drugs or bad intake habits, result is get disease like TB. On #WorldTBDay… https://t.co/cWnAgCHB17",ritubala24,"Perth, Western Australia",-0.6999999999999998
66,"#GodMorningFriday
The Supreme God can increase the age of the person who does true devotion and can destroy any dis… https://t.co/rx66qAVXcG",Mohan13520563,,0.07499999999999998
67,'o&lt;vR Cancer is a deadly disease.   #上海   https://t.co/si8sKWIdcZ,Khalid481921,,-0.2
68,@CathyMcManus5 @JustinTrudeau @POTUS Sad that you have this I stand with Trudeau disease,CSawiman1234,,-0.5
69,IM ACTUALLY INFECTED WITH A DISEASE CALLED JEALOUSY BCUZ WTF JIMIN,Bab3y1,𖤣𖤥𖠿𖤣𖤥,0.0
70,Consumpation tobacco and cigarette leads a person to disease like a TB. Saint Gurmeet Ram Rahim ji tells that by co… https://t.co/tgXTheBljH,GoodluckLuck14,"New York, USA",0.0
71,small creatures they have every disease https://t.co/ihU4ENerMf,Vendi_MM,psych ward,-0.25
72,Warm greetings on World Tuberculosis Day. We should celebrate the occasion of World Tuberculosis Day by helping peo… https://t.co/dZXP7qVtNE,MukandL,,0.6
73,@justin_hart Trump is not responsible for the decisions made based on the lies told to him by the “experts” Fauci a… https://t.co/oWfk4bHJdy,Citizen2Truth,,-0.1
74,World TB Day is observed to spread awareness about the social and economic consequences of the disease that impacts… https://t.co/HpHA5DIwsr,IYCHimachal,"हिमाचल प्रदेश, भारत",0.11666666666666667
75,World's latest Tuberculosis Report estimated that 10.1 million people were affected by this deadly epidemic in a si… https://t.co/Zz2gmS0zUB,indiacom,India,0.15
76,@LucasGage584 It's an extension of the entire basis of Western allopathy. All Livings Things are literal disease an… https://t.co/LyGJ2oYHWt,SepteusT,Technoligarchy of America,0.0
77,"“I wish somebody told me life was unkind before my worst moments opened my eyes. I try to hold on, hold my head hig… https://t.co/ZWyynU0vyl",giiina14_,"Ohio, USA",-1.0
78,"Smoking has major effects like cancer, heart disease, stroke, lung diseases, diabetes, and more. It also increases… https://t.co/NEVlGaoU0s",Omthakur_25,"Samastipur, India",0.28125
79,Local newspapers closing down is a threat to field epidemiology. https://t.co/XN0VbxfmKr,debunkdenialism,Debunking Denialism,-0.07777777777777779
80,Join us in raising awareness on this World Tuberculosis Day. Let's work together to end the spread of this curable… https://t.co/x9Wfr1vI3n,supercarehosp,"Shillong, India",0.0
81,"Hey, if you feel bad, just keep watching the news. Russia is going to lose the war since they don't have ammo and a… https://t.co/SL8kABOhdd",MelryanMello,,-0.6999999999999998
82,"Add SHORTER LIFE EXPECTANCY, CHRONIC DISEASE’S And LACK Of EARNING POWER To The MIX..&amp; It’s Almost Enough TO THROW… https://t.co/77YwWFA2ct",TONYHSNOW1,,0.0
83,"Saint Dr gurmeet Ram Rahim Singh Ji Insan says , follows these tips to improve immunity and stay safe from deadly d… https://t.co/Oh86iWugma",RashmiInsa4,,0.15
84,there are only 2 types of girls cavity girls and gum disease girls which one are u,irlolive,,0.0
85,"By smoking and consuming tobacco, a person becomes a victim of a serious disease like TB. Saint Gurmeet Ram Rahim j… https://t.co/bcQjiO8ZRQ",palakseth9954,,-0.20416666666666666
86,"Might ongoing COVID burden on hospitals play a role? 

We'd be stupid not to see that we can't layer more &amp;more dis… https://t.co/TOgVYN6TwP",a_longhurst,"British Columbia, Canada",0.5
87,@LibbyMbc I'm sending love and strong energy to fight the disease. Please keep us informed.,Mischl,"Fort Myers, FL",0.4666666666666667
88,i have a disease where anytime i see ben as teddy ijust think of patrick. like......,annsliethinker,he 22,0.0
89,The theme of this year's #WorldTBDay is 'Yes! We can end TB!' and this article argues that key to doing that is to… https://t.co/0Q9Y5HUTvu,FutureMedia_Nam,Namibia,0.0
90,@brunalinzmeyer Poster child for wokeness being a disease 😂🤣 https://t.co/xYKo5vnAY3,Jeff_Lebowski14,Your mom’s bedroom,0.0
91,@Anne_Vroeg I meant to add its helped tremendously with my autoimmune disease. And I don’t have any pain at all wit… https://t.co/lJeqtpPZhH,katetwhitley,"Nashville, TN",0.3333333333333333
92,@DrSamba959 Salutogenic model focuses on creation and maintenance of good health rather than to look for the causes… https://t.co/wvuFcKiOFu,yasminnsurayaa,,0.7
93,"On #WorldTuberculosisDay, we stand together to raise awareness about this serious disease and pledge to do our part… https://t.co/OwjPo5smp4",AndSaikripa,"Malad West, Mumbai",-0.3333333333333333
94,@Vijaybakore_ @MoHUA_India @collector_dewas @PROJSDewas @ChouhanShivraj @pmayubhopal @SpDewas @DGP_MP One is that p… https://t.co/EY7Ypsnkxw,miss_payal_,"लखनऊ, भारत",0.0
95,Saint Dr.Gurmeet Ram Rahim Singh Ji Insan teach us to everyone that every disease cure with regular practice of med… https://t.co/pVtRiVQdy1,gharu_kaur,"फरीदकोट, भारत",0.0
96,@YouAreLobbyLud I did have an argument on here with a sleep medicine physician who thinks that cohort studies are b… https://t.co/On6HSVGRKR,Mielgray,,0.0
97,On World Tuberculosis Day let's raise awareness about the disease and encourage timely action to combat the global… https://t.co/jUgupTB7Qm,mygovtripura,"Tripura, India",0.05
98,"Tuberculosis (TB) remains as an important public health problem in India. Awareness about the disease, its diagnosi… https://t.co/PPmpg2RvS1",onco_life,"Satara, India",0.2
99,"@TrashPandaGirl my brain autocorrected me sorry whoops

it's that occasional foot disease you use that NZ spray on… https://t.co/b2qiHHvyLi",DingDangDoohoo,"""Show more replies""",-0.25
100,@BANGTANUNITED7 @a1ways311 @tarahtalk @ClownWorld_ Mental studies? The same ones that used to call homosexuality a… https://t.co/BJ4ikDhh2K,andreaduarte202,,-0.05
101,@BigShade55 YOUR THE DISEASE! IM THE CURE!,akaBigLash,"Norwich, England",0.0
102,"By the time Jesus and his disciples arrive, Lazarus’ disease has so overtaken him that he is sealed up in death, sh… https://t.co/7xIM5kkZMd",AlethiaWrites,,0.0
103,"The Dua in this Hadith is:
 
All shifaa comes from Allah. We take medicine but it's effect is only permitted by the… https://t.co/MsyKMwD6ga",Ahmaad_Ibrahem,"Jos, Nigeria",0.0
104,"Alhamdulillah!!!
It's Another Friday

Narrated `Aisha (RA): Allah's Messenger (SAW) used to treat with a Ruqya sayi… https://t.co/Xcf15Mup5N",Ahmaad_Ibrahem,"Jos, Nigeria",0.0
105,@IZMKS44 @VigilantFox Everything is a chemical. Some of the most potent carcinogens are totally natural. Even the b… https://t.co/rQq41Y5o3A,ianfmusgrave,"Adelaide, Australia",0.3666666666666667
106,"World Tuberculosis Day 2023!
Yes! We can end TB!
World TB Day is observed annually on March 24th to raise awareness… https://t.co/uyGydwbIgQ",jclinicalmedres,,0.0
107,"TB disease flourishes due to intoxication, alcohol and weak immunity.Saint Gurmeet Ram Rahim ji tells that self-con… https://t.co/8NndBz9i83",komalIn33141025,,-0.25
108,"@WeveAllGotToEat @MeganTheOracle @rcgkennedy I’m not sure why people care so much
Everyone had the choice, 
The so… https://t.co/PCseJmZrbr",ezacktphotoz,19/12/2018  ┴ʞƆ∀ZƎ@,-0.024999999999999994
109,"We cannot be ever pulled down by the harshest disease 👍🏻
If we shake hands with healthy living, nothing can stop us… https://t.co/85bRKrtmPi",The_NthSense,,0.17222222222222222
110,"The egg is a powerhouse of disease-fighting nutrients like lutein and zeaxanthin.
These carotenoids may reduce the… https://t.co/2IomYmzq5D",BaliyoNepalNI,,0.0
111,"Today is #WorldTuberculosisDay, a day to raise awareness and support for the fight against this deadly disease. At… https://t.co/73n6Lc51Fv",beharahospital,Visakhapatnam,-0.2
112,"@hal_mcgowan @wu_wenyuan What disease?
Education?
lol.",bex0760,"Los Angeles, CA",0.8
113,@brunalinzmeyer Poster child for wokeness being a disease 😆,Jeff_Lebowski14,Your mom’s bedroom,0.0
114,@JohnRMoffitt @JMPeck69 @SouthlakeIndep1 @indivisibletx24 @derosajoe51 @johnpgatta @keithmehl @HougenJ… https://t.co/wNkYzlYTge,Key4SkeletonA,Left of Center,0.0
115,The nano particle vector carried this spike though out the body to create diverse disease syndromes that wouldn’t c… https://t.co/MOKU20yUAb,reasonoverfear,"Cavan, Ireland",0.0
116,The real pandemic was the “ cure” the vaccine. The  💉did the same as that RNA sequence only better causing more dis… https://t.co/4b6U5mGwts,reasonoverfear,"Cavan, Ireland",0.24
117,Acidity in your body = DISEASE! https://t.co/MK6KVlN8Le,paquenojoda,,0.0
118,#WorldTBDay meditation has the power to recover from any serious disease. Saint Gurmeet Ram Rahim Ji gives tips &amp; d… https://t.co/aweBe8g4IK,Lovepre22641144,,-0.3333333333333333
119,#WorldTBDay meditation has the power to recover from any serious disease. Saint Gurmeet Ram Rahim Ji gives tips &amp; d… https://t.co/GHYHxSW82a,Lovepre22641144,,-0.3333333333333333
120,I swear some black folks are their own worst enemy. As if black people weren't unhealthy enough with all the diabet… https://t.co/9xcWibd3zn,TakesTaurus,"Heat City, Az",-0.18888888888888888
121,‘Yes’ We can end TB!’ this is what Surf India urges on “World Tuberculosis Day.” The event is observed annually to… https://t.co/hg8tVgM3Ka,SurfIndia23,,0.0
122,"Every year more than two lakh people die due to TB. TB disease occurs due to alcoholism, prolonged illness, wrong e… https://t.co/gHSPPGtvLL",Chancha62724772,,-0.0625
123,#WorldTBDay meditation has the power to recover from any serious disease. Saint Gurmeet Ram Rahim Ji gives tips &amp; d… https://t.co/beVSTPpuPM,Lovepre22641144,,-0.3333333333333333
124,#WorldTBDay meditation has the power to recover from any serious disease. Saint Gurmeet Ram Rahim Ji gives tips &amp; d… https://t.co/dIvCpCZ7gN,Lovepre22641144,,-0.3333333333333333
125,"As we all know TB is a dangerous disease, and we get 2 lakhs TB cases per year, Saint Gurmeet Ram Rahim Ji teaches… https://t.co/skUIoeF4eV",RajniSa63289478,,-0.6
126,sk9X` Cancer is a deadly disease.   #上海   https://t.co/Sh8wkICI3z,ktd57668171,,-0.2
127,@GenghisKhanh1 @RobertKennedyJr Start here. I'm not your assistant so you'll have to conduct your own due diligence… https://t.co/cm58oOf93d,SeanceInfin,"Nevada, USA",0.2375
128,"In India more than 2 lakh people die every year due to TB, a disease caused by drugs like alcohol. Saint Gurmeet Ra… https://t.co/0l08WolIm0",Love_Insan_1525,"Rajasthan, India",0.1875
129,"Caffeine: https://t.co/oGQFGwPb6U

Caffeine intake may thus lower the risk of conditions linked to overweight or ob… https://t.co/iuFFgNOZdJ",stofcare,San Antonio,0.0
130,"@JackPosobiec Because Dysmorphia is a mental disease and just like any other Mental Health issue, you have higher r… https://t.co/mlagjyIErF",Donnie1923,"Amherst, NY",-0.018750000000000003
131,"@AngelaBelcamino God, liberalism is a fucking disease. You prove it every day.",beatzbydox,,0.0
132,"On #WorldTuberculosisDay, we need to raise awareness that TB is a preventable &amp; curable disease. Access to treatmen… https://t.co/cFux3xXzkT",RanjanJhainc,"Madhubani, India",0.0
133,Pseudomonas aeruginosa bacteria as seen under a microscope. The Centers for Disease Control and Prevention says 68… https://t.co/P6KBBV8kTe,AbdulsatarBoch1,,0.0
134,#WorldTBDay meditation has the power to recover from any serious disease. Saint Gurmeet Ram Rahim Ji gives tips &amp; d… https://t.co/BVw6QzuczW,Lovepre22641144,,-0.3333333333333333
135,Let's come together to end TB from our country with the guidance of Saint Gurmeet Ram Rahim Ji. Let's spread awaren… https://t.co/Uo5AmyWNxF,i_renu_sethi,"Faridabad, India",0.0
136,"@bex0760 @wu_wenyuan You, and your fellow parasites, have been put on notice.

Parents will not tolerate your disease anymore.",hal_mcgowan,,0.0
137,@j73192943 @GooningPretty @Magnum_Farce @andyswarbs I wonder how humans managed to become apex predators over a 2 m… https://t.co/sjza8kGzl6,CarnivoreIs,,0.0
138,@KanekoaTheGreat @MartyMakary @akheriaty @MaxBlumenthal @MaajidNawaz @BretWeinstein @rabois @ComicDaveSmith… https://t.co/6LEr35LIF3,DancingBlue_Sky,,0.0
139,"Worldwide, TB is the 13th leading cause of death and the second leading infectious killer after COVID-19.… https://t.co/79j8YMV9Nl",republic,"Mumbai, India",0.0
140,"We can end TB !
The World Health Organization has resolved to eliminate this #TB_disease from the #world by 2030.… https://t.co/3s6bs6v7vv",Sanjubolbam,"New Delhi, India",0.0
141,#WorldTBDay meditation has the power to recover from any serious disease. Saint Gurmeet Ram Rahim Ji gives tips &amp; d… https://t.co/4O6aicfj4u,Lovepre22641144,,-0.3333333333333333
142,"@AStandardofCare 

Caffeine intake may thus lower the risk of conditions linked to overweight or obesity, such as t… https://t.co/RlWNrxFSMo",stofcare,San Antonio,0.0
143,"To Avoid Disease TV , put pulses, fruits and vegetables in your diet. Do exercise and meditation regularly… https://t.co/GDcb2jXxb3",PayalIn40728780,,0.0
144,#WorldTBDay meditation has the power to recover from any serious disease. Saint Gurmeet Ram Rahim Ji gives tips &amp; d… https://t.co/eTlVh0thlt,Lovepre22641144,,-0.3333333333333333
145,#WorldTBDay meditation has the power to recover from any serious disease. Saint Gurmeet Ram Rahim Ji gives tips &amp; d… https://t.co/keGZgZaNDe,Lovepre22641144,,-0.3333333333333333
146,#WorldTBDay meditation has the power to recover from any serious disease. Saint Gurmeet Ram Rahim Ji gives tips &amp; d… https://t.co/0uLTI2He5f,Lovepre22641144,,-0.3333333333333333
147,#WorldTBDay meditation has the power to recover from any serious disease. Saint Gurmeet Ram Rahim Ji gives tips &amp; d… https://t.co/kIMpb6tuno,Lovepre22641144,,-0.3333333333333333
148,"On this #WorldTBDay Let us spread awareness about the disease of TB &amp; make #TBMuktBharat
Saint Gurmeet Ram Rahim Ji… https://t.co/PIQVops5QQ",poojakamboz,"Mohali, Punjab India",0.0
149,"World Tuberculosis Day... Despite being preventable and treatable, TB remains the world's leading infectious diseas… https://t.co/JiagkcmmiO",INDIA_RMS,"Panchkula, India",0.0
150,@arunamiller Wrong.  God made us what we are.  We should seek to be what He made us.  We should strive to rule our… https://t.co/H4t2zO4DJx,Jeremiah1025,,-0.5
151,"Let's unite to end TB! On this World TB Day, let's raise awareness about the impact of tuberculosis and the need fo… https://t.co/upErFK4CfG",DPathcare,E 8A Hauz Khas New Del-49,0.0
152,#WorldTBDay meditation has the power to recover from any serious disease. Saint Gurmeet Ram Rahim Ji gives tips &amp; d… https://t.co/9g78vcdwW7,Lovepre22641144,,-0.3333333333333333
153,"By smoking and consuming tobacco, a person becomes a victim of a terrible disease like tuberculosis. Following the… https://t.co/DBkYIVxO2P",Love_Insan_1525,"Rajasthan, India",-0.35833333333333334
154,"This is my child, Bizarro Kai, they have every disease https://t.co/jXpN6ihre8",ninjagoanything,,0.0
155,"There's a feeling. The feeling of two people being desperate for one another, but still unsure if they can hold the… https://t.co/a7T2EEMWW5",beombeombot,,-0.6
156,#WorldTBDay meditation has the power to recover from any serious disease. Saint Gurmeet Ram Rahim Ji gives tips &amp; d… https://t.co/V20sasD0xl,Lovepre22641144,,-0.3333333333333333
