,tweets,user,location,polarity
0,A Festus Keyamo who said Tinubu is suffering from Parkinson disease as a then supporter of Ameachi in the primary e… https://t.co/7ownwemQSc,AyamTjay,"Lagos, Nigeria",0.4
1,"Talked much about primitive ideology which focuses primarily on food, if have enough food forcing women to have bab… https://t.co/4IrN77XnnR",jstevh,,0.20000000000000004
2,"@bellsandthebull @BarbaraLoo3 @rycunni @asheem Have to admit, it was fairly well conceived. They cover vaccine inju… https://t.co/Z0sP47YO29",2tall4this1,,0.7
3,"@Hikaru46493606 @nuriyahk @ExMuslimSameer Housefly (Musca domestic) isn't a cicada or dragonfly.

The legs of a hou… https://t.co/mIQUuK9tJl",dotcentauri,,0.0
4,@Jenniferkunkel @BWieds @CHTCOTH @PompeyHutch @newworldrushman @jbtpba @Doorsfanatic @DCRock Our leather chair suff… https://t.co/zOhrKDvGLK,wrighty_tweet,United Kingdom,0.0
5,"Money has come, parents take your children to school. We pray all will be safe from predators and from sickness and… https://t.co/cisWZzhSAk",AgonzaSunshine,"City born, Kampala, Uganda",0.5
6,"@CilComLFC Never had such luxuries here, abducted at 12 for MKUltra experiments &amp; against odds, am here now, lived… https://t.co/T0nvbuI8FB",SplashyOperator,,0.0
7,@Berniceness @artcgreen @WSOnlineNews Diagnosed with Parkinson's disease. Lots of class you're showing there.,Oldger1958,"Edmonton, Alberta",0.0
8,@AdithyaK212 @theliverdr @pritiputa .. particular disease therein dealt with in its most virulent form. The diagnos… https://t.co/La9PN9bkGk,cavesofaltamira,,0.3333333333333333
9,"We show that factors forcing host growth promote viral proliferation and epidemic risk in oysters, thus providing p… https://t.co/zqJyIIhkj3",AEI_IR,"Oldendorf (Luhe), Deutschland",0.0
10,"@StaceyS40941908 @BeauTFC It does happen. If you search for it, you’ll find about a 100 people a year who are kille… https://t.co/AgiE3wUkFx",JohnnyIsSoAlive,United States,0.0
11,"Grants to USA, Canada, and International Nonprofits, IHEs, Agencies, and For-Profits for Resea- Due: 03/23/2023 https://t.co/jNZFTnYlEk",WisconsinGrants,Wisconsin,-0.0625
12,"Grants to USA, Canada, and International Nonprofits, IHEs, Agencies, and For-Profits for Resea- Due: 03/23/2023 https://t.co/8SuSRFU6vD",VirginiaGrants,Virginia,-0.0625
13,"Grants to USA, Canada, and International Nonprofits, IHEs, Agencies, and For-Profits for Resea- Due: 03/23/2023 https://t.co/KYkkfSTE4N",SCarolinaGrants,South Carolina,-0.0625
14,"Grants to USA, Canada, and International Nonprofits, IHEs, Agencies, and For-Profits for Resea- Due: 03/23/2023 https://t.co/YPQ2jfPOdG",PAGrants,Pennsylvania,-0.0625
15,"Grants to USA, Canada, and International Nonprofits, IHEs, Agencies, and For-Profits for Resea- Due: 03/23/2023 https://t.co/2BvkYAfcJO",OregonGrants,Oregon,-0.0625
16,"Grants to USA, Canada, and International Nonprofits, IHEs, Agencies, and For-Profits for Resea- Due: 03/23/2023 https://t.co/KAUlRao3J4",OklahomaGrants,Oklahoma,-0.0625
17,"Grants to USA, Canada, and International Nonprofits, IHEs, Agencies, and For-Profits for Resea- Due: 03/23/2023 https://t.co/2onUvMrvc1",MSGrants,Mississippi,-0.0625
18,@Avellini7 @esmi2007 @healthbyjames It's ain't gonna be you double chin. Not because of the virus. But because of y… https://t.co/q9NSyBjurp,GetACluee,Cyber Town USA,0.0
19,"Grants to USA, Canada, and International Nonprofits, IHEs, Agencies, and For-Profits for Resea- Due: 03/23/2023 https://t.co/drg7J8F0DG",GrantsMaine,Maine,-0.0625
20,"People with the disease Covid-19 tend to be calmer, except can fly into sudden rages. But typically not much seems… https://t.co/BZhXtzItSr",jstevh,,0.23333333333333336
21,"Grants to USA, Canada, and International Nonprofits, IHEs, Agencies, and For-Profits for Resea- Due: 03/23/2023 https://t.co/8FWu2IW7cE",IndianaGrants,Indiana,-0.0625
22,"Grants to USA, Canada, and International Nonprofits, IHEs, Agencies, and For-Profits for Resea- Due: 03/23/2023 https://t.co/3EIUCJjkyN",GrantsIllinois,Illinois,-0.0625
23,];Cpt Cancer is a deadly disease.       #广元  #孝感   #宁德  https://t.co/8D4kBYFBxu,pierresim1,Haiti,-0.2
24,"Grants to USA, Canada, and International Nonprofits, IHEs, Agencies, and For-Profits for Resea- Due: 03/23/2023 https://t.co/J3SyqnGhWo",GrantsDC,"Washington, DC",-0.0625
25,"Grants to USA, Canada, and International Nonprofits, IHEs, Agencies, and For-Profits for Resea- Due: 03/23/2023 https://t.co/jycNqukZgd",GrantsCT,Connecticut,-0.0625
26,"Grants to USA, Canada, and International Nonprofits, IHEs, Agencies, and For-Profits for Resea- Due: 03/23/2023 https://t.co/MOxXfxIwZx",GrantsArizona,Arizona,-0.0625
27,"Grants to USA, Canada, and International Nonprofits, IHEs, Agencies, and For-Profits for Resea- Due: 03/23/2023 https://t.co/Cdn8QFIguf",GrantsAlaska,Alaska,-0.0625
28,"Divine Health Realities 
🗣SAY THIS …I dominate my environment and reign over sickness and disease,over demons of da… https://t.co/xYErzKKETT",brianshactar,Harare Zimbabwe,0.0
29,We then engineered cells with the same loss that cause mesothelioma. We are now able to identify critical aspects o… https://t.co/BsTumqeF1a,gram_lab,"Edinburgh, Scotland",0.16666666666666666
30,"“Isn’t it ironic Dr. Dre won the Dr.
Dre Global Impact Award” is the new “Isn’t it ironic Lou Gehrig got Lou Gehrig’s disease.”",Tristanshouts,"San Francisco, CA",0.1340909090909091
31,"Syphilis is a bacterial infection that is often spread by sexual contact. In Uganda, the disease was first discover… https://t.co/SW5PDV6XQO",CitizenReportUG,"Kampala, Uganda",0.25
32,be fr this man has avoided putting a label on his sexuality like it’s a disease. Which is valid btw but don’t expec… https://t.co/5KMCiBQ2F2,milfsuki,•19ʅʕ•ᴥ•ʔʃhe/fae•,0.0
33,Help Me Survive Kidney Disease for 3 more months! https://t.co/FMiOJc3O7B,S3333Angel,,0.5
34,"@gmbutts Weak men make hard times ! Biden is a veggie, and trudeau , well trudeau is a horse of a different color a… https://t.co/KCbEInHAZE",JoffleyJeff,,-0.22222222222222224
35,@wow__then Trenchfoot sounds like a joke disease but nobody who has experienced it is laughing.,Killskerry,"Portland, OR",0.8
36,"@kaashimori Coffee, but without the heart disease www",moonIitsmiles,writer is 21+,0.0
37,Biometric screening isn’t a substitute for a regular physical examination by your healthcare provider. It doesn’t d… https://t.co/j1F9XqoQLp,Mag_CartaHealth,"Ikoyi, Nigeria",0.0
38,A biometric screening is a clinical screening performed for employees at a company’s workplace or a commercial lab… https://t.co/6Va9Jw5xOH,Mag_CartaHealth,"Ikoyi, Nigeria",0.0
39,"@BallouxFrancois I have lost interest in Covid the virus, the disease, and the epidemic... and thank you for your c… https://t.co/ku244Mpwvr",apsociallife,Peoples Republic of Washington,0.0
40,"@GeorgeL92724713 @InRangeTV Like I said if you are removing non disease body parts or irreparable brain damage, then yes.",RhinoThy,Colorado plateau.,0.0
41,"JUST PUBLISHED!!!
https://t.co/nAOhGpYSQj
First report of the in vitro activity of beta-lactams against Mycobacteri… https://t.co/ARgzo84Lqg",s_ramongarcia,"Zaragoza, Spain",0.25
42,"@Muniz_Benny @unique_anonym There is a new disease going around. If your choice is to ignore all the info about it,… https://t.co/aLpDGKF4M0",adriancjr,"Helsinki, Rep.of Droplet Dogma",0.13636363636363635
43,anxiety is diagnosing yourself with a new disease every day,XimenaElorduy,,0.13636363636363635
44,"New study affirms link between sickle cell disease and risk of increased mortality in pregnant women.

Learn more:… https://t.co/JtY2KaUM74",eMedEvents,United States,0.32323232323232326
45,South Africa has no dedicated rare disease policy in place. HAE S.A is one of 27 patient support groups affiliated… https://t.co/ZRmRVkKBrN,HAE_SouthAfrica,Johannesburg,0.3
46,"Molecular characterization, pathogenicity, and protection efficacy analysis of 2 wild-type lentogenic class I Newca… https://t.co/JRhoAwiIEe",GsaJournals,Albuquerque,0.1
47,"The pseudo masters say, ""If you meditate, you'll become rich, successful."" That is absolute nonsense.Meditation wil… https://t.co/wHpZd8NICs",buddha_osho,,0.44166666666666665
48,"Stem cell therapy for Chronic Obstructive Pulmonary Disease (COPD)

Stem cell therapy for Chronic Obstructive Pulmo… https://t.co/Hwzw2qLVfq",VieCells,"Surat, India",0.0
49,@KanchenjungaEve Fascism plain and simple. It’s a mental disease that inflicts a complete group identity.,harsh8848,India,-0.05357142857142857
50,"My faith is making me well.

🙏🏻 Verse: 🙏🏻

He said to her, “Daughter, your faith has made you well; go in peace, an… https://t.co/LemTEdmai2",lucky_ducky101,"Stockton, California, USA",0.0
51,"The NICVD provides a range of services including outpatient consultations, diagnostic tests, interventional procedu… https://t.co/Rz8Bs08uAx",Coreen96391806,,0.0
52,@tealmobile7 @PSRSurf Whole foods vegan diet. No added salt sugar or oils. Only way to beat heart disease without medications.,JenniferKlemme,,0.1
53,Life is fatal disease that we will escape all too soon... We may as well embrace it joyfully!,Tyranosopher,Earth,0.0
54,@Bobkimber64 Thank you for your well wishes and very generous donation. I am sorry you lost your partner to this awful disease.,chloeagibson,nottingham,-0.43333333333333335
55,"Question of the Day: What name is given to a microorganism, especially one which causes disease? #DaybreakHitz https://t.co/zYmlSLRnek",Hitz1039FM,GA-099-3341,0.0
56,That has heart disease and diabetes written all over it in bright yellow https://t.co/PWlwrrSlB1,The_AZ_Warrior,USA,0.35000000000000003
57,"Taiwan on Monday reported 16,640 new cases of #COVID19 and 63 deaths from the disease. New Taipei recorded the high… https://t.co/sRjBKcbVek",Focus_Taiwan,Central News Agency (CNA),0.14424242424242426
58,"Classic series 😎 - Baastrups disease 

#FOAMed #FOAMrad @FOAMradOrg @mskteachingroom @NehaYaduMD @drdevrad… https://t.co/qqDhO1i2aG",drvenkimdrd,United Arab Emirates,0.16666666666666666
59,@HeikkiRay @tyoterveys My 5 cents: While a variety of factors may explain a disease the question is which of them a… https://t.co/OIRvqKokqn,ba_tuulasaarela,"Savonlinna, Finland",0.0
60,@DrAlanDesmond I didn't agree because you didn't quantify the LDL increase or substantiate what % or what increase… https://t.co/uDaPF8ryCe,notnow8724,,0.0
61,"Chinese researchers have described what they claim is the world's youngest #Alzheimer's patient, a 19-year-old in B… https://t.co/g1f1EdRnin",TTmon2011,People's Republic of China,0.05
62,Guinea worm disease reaches all-time low https://t.co/f1jGkMFwZo,sharon_smith_1,,0.0
63,@MiaWinston_ @aaliyah clout chasing is a helluva disease,icejr_FrFr,"Carson/ Long Beach, CA",0.0
64,"On the occasion of the ""World Cancer Day"", #IndianArmy conducted lectures at Bhattadhirian, #Poonch. The aim of lec… https://t.co/nnOESAUfU8",PriyaSh95788438,,0.0
65,the Transformtion™️ consists of u essentially dying every day (if ur a complete mortal anyway) so u have 2 be fed a… https://t.co/1zHJudsgm3,D3ATHRING,it/flesh/haunt,0.05
66,"@sanjay_world @BohemianAtmosp1 ""bUt It PrEvEnTs SeVeRe FoRmS oF dIsEaSe"". 

Guess what they teach residents about t… https://t.co/JFSi62PX6W",hgpskdm,🇧🇷,0.0
67,"@AlisaValdesRod1 I just googled shriveled fingertips; I get them when dehydrated, but they can also be due to poor… https://t.co/Bbm2V1nN5h",rryan0117,"California, USA",-0.2625
68,"We’ll kickstart our #healthed series with Chronic disease awareness and prevention, #staytuned 

Chronic diseases a… https://t.co/bVV6ArnEPd",AmalOutreach,"Lagos, Nigeria",0.0
69,"@ShashiTharoor @UN 'Dies of Rare Disease' .Yes, he was overwhelmed by the love of people like Shashi . please visit… https://t.co/e70on0jcTg",VishnuMDubai,,0.4
70,@GADDAFFI_ @harluks_ @SuperSmada awoof disease,Fittyfour__,"Lagos, Nigeria",0.0
71,Choose (d. correspond to disease):,RadiologiaBcn,,0.0
72,"@DrAseemMalhotra ""Something very impactful coming soon""

Do we finally tell them that there is no ""virus"" that was… https://t.co/AK4iKULLNI",Dirk_aus_Hessen,,0.1
73,@Beingsayedul You were most likely already infected. The vaccine mRNA is a small piece of an RNA molecule. It has N… https://t.co/Dhkw0LkOF1,wercozy,,0.08333333333333333
74,@NHSEngland Enhanced care is provided with a focus on care home patients (following the COVID impact) and the DES o… https://t.co/a3tvni877F,drgandalf52,Nottingham,0.0
75,I've got thirteen channels of Coronavirus disease 2019 (COVID-19) on the T.V. to choose from,srhrnfkfmfn,,0.0
76,"1 second ago, a Leafcutting Bee that could potentially pollinate 10,000 zucchini flowers has died, because it was i… https://t.co/nbFgMDU5we",HiveEmpty,,0.0
77,"aunt who suffers from heart disease is alright, feared this one the most ❤️ everything is looking okay so far on th… https://t.co/U9vfJ9aGYV",inshallove,follow ≠ endorsement,0.125
78,"Symptoms of a serious disease:

✔️Brutal killing of innocent civilians including children in #Oromia region.
✔️Hang… https://t.co/yUURnCd4Dt",dere9744,Ethiopia,-0.23611111111111108
79,Centers for Disease Control and Prevention detected variants of Omicron in wastewater.#Omicron,LisaHag67969183,,0.0
80,"@ewnupdates Oh so they now openly admit that the city was once the gem of the East Coast of Africa!
Dumb is a disease in the ANC",PaulKorb4,,-0.1875
81,at*B# Cancer is a deadly disease.    #上海 #天津    #青岛         https://t.co/CGMop7uFJl,kiah_tasha,,-0.2
82,"@shawnteNorth @kdhanjal12 Trump did what humans CAN, and that is try to react to the disease. Trump was just one ma… https://t.co/ioOrVY9uuh",colemarisa49,,0.0
83,It is not a real vaccine. The disease has agood survival rate. I got COVID and did not die...didn't have any sympto… https://t.co/8Aw1kzbOnY,troicurtosi,"Phoenix,AZ",-0.1
84,@NaomiPhilip12 A dear friend is currently barely hanging to life after becoming seriously ill when she took the vac… https://t.co/v8avt2X5xN,PanshakHaggai,Nigeria,0.0
85,"The world is beautiful, but has a disease called man

ARISING WINNER PRIYANKA 
PRIYANKA OWNS TROPHY",priyankalover7,India,0.85
86,@SylviaNovak Like the vaccine? I wouldn't want that disease either. People be droppin' dead left and right from that shit.,UncommonsenseB,Oregon,0.028571428571428564
87,Alzheimer's disease often starts with mild symptoms which become dominant over time and can make the affected indiv… https://t.co/LO3nUbXWBG,drkadamnagpal,"Delhi, India",0.3333333333333333
88,The male species is diseased to such an extent that it has created it's own antibodies to protect the disease by ta… https://t.co/0W9AVuG7mK,UnkillableKind,data,0.0
89,@CoolTimesOnline Lmao we have the same terminal brain disease I see,jackal27,MO,0.0
90,@MarcLobliner @TristanSnell We’re stupid? You claimed to have prosecuted Trumps university right? That was another… https://t.co/xQ3q2HscH7,Coopdogdemssuck,,0.2857142857142857
91,"@MeghUpdates As a pride Hindu, I would refuse to play in Sharia countries...
Why go there?
They are clear about the… https://t.co/egbyVunkhG",UlloorBabu,Bangalore,0.10000000000000002
92,"@shawnteNorth @kdhanjal12 Yeah, no matter whose watch it is, no sane person can believe he could stop the disease.… https://t.co/VTCzzdrU7P",colemarisa49,,0.0
93,"@MichaelPSenger Masks do not protect against spread, but reduce the viral load on the body protected by the mask. R… https://t.co/2ozNEWLuLj",Levgurova,,0.0
94,So I'm barely alive form being tortured but they thought I was looking at a woman being tortured and passing out no… https://t.co/th0MW3Szb6,SarahTo55690989,,0.1
95,"@NKyuubi69 @erotibot_art Saddest part to me is the absolute defence and validation people have over it, despite the… https://t.co/kuMserDfV9",Ingbenn1,"Iowa, USA",0.2
96,Thy say that hatin sh*+ been disease this niggaz been catching that sh*+.☮️ #Respectfully,Jr28Yolo,LAGOS,0.6
97,"@AmandaSalas When it comes to a disease like cancer, you learn to respect it. You don't ignore it, you take ever st… https://t.co/VH9TJ7LfPh",49ervic,,0.0
98,"Experts caution against declaring victory as each flu season is different.
RSV and flu cases subside as COVID hospi… https://t.co/Q1lzhSbmcO",AnnaCha56159530,"New London/Norwich, Connecticu",0.0
99,@TinPotPourri @healthbyjames A real vaccine protects a person from infection even if they stand next to a infected… https://t.co/gka5ObLOhs,Penningt4Hargis,,0.1
100,"Last November, researchers fromseveral universities and the U.S. Centers for Disease Control and Prevention detecte… https://t.co/ZoW1XndONW",Colleen75035999,,0.0
101,"Enjoy the perfect balance of flavor and health with a sprinkle of fresh #curryleaves, or our #Karuveppilaipodi. A r… https://t.co/BhizYQ1maH",MURUGANIDLISHOP,,0.5666666666666667
102,"Curse of Darkness is set in the year 1479, three years after the events of Castlevania III: Dracula's Curse. Though… https://t.co/uThNKT9ZXk",playcursebot,"Valahiei, România",0.0
103,"my grandmother, cousin and grandfather in Hatay Antakya Urgenpasa Mahallesi 12th Street Dunya Apartment.  My grandf… https://t.co/Ux4czWe3AD",ShenolKutay,,0.0
104,"Your disease is mental inaction.""
_iherb_code_coupon_
both of which qua https://t.co/Yc924iwMPH",Anggriparasuli,,-0.1
105,"10 tips for healthy eyes
.
.
.
.#treatment #treatmentinturkey #turkey #medicaltourism #medicalinturkey #turkish… https://t.co/Y6hAapHfQl",Vimfayihs,Ankara,0.5
106,"The @City_Ekurhuleni public vaccination site list. 

COVID-19 vaccines have proven to be the best form of defence a… https://t.co/39rS8hW1nN",GautengHealth,"45 Commissioner Street, JHB",0.5
107,"Avoid 2 Things In Your Life: 

1. Foodie/Overheating = promotes excess body fat, diabetes, bad brain function, etc.… https://t.co/Ei7WzbUcU9",ElephchildCopy,101% Free Mini Course:,-0.6999999999999998
108,Every year on 4 February World Cancer Day is observed globally and is celebrated by WHO to make people aware of the… https://t.co/muQWcL7BKR,TransformHappi1,,0.3
109,"Shredding the night away with Vader, HATEOFFICIAL, Thy Disease, PATHOGEN (PH) and Sagrado🎸at Cuneta Astrodome this… https://t.co/Vf8CfEoWOj",TicketnationPh,,0.0
110,Now nature did not design the kidney to secrete Renin to give you the disease called Hypertension. The RAAS mechani… https://t.co/r1zrVOKtkv,Jasonphilip8,"Chennai, India.",0.0
111,DISEASE 󠁿󠁿 IS 󠁿󠁿 HER 󠁿󠁿 PRIMARY 󠁿󠁿 LANGUAGE ．,CRYPTIDORENDA,SINCE  WE  MUST  DIE  .ᐟ,0.4
112,@DavidSacks Forget the disease-carrying birds and biological weapons research laboratories invented one after anoth… https://t.co/F7Rqpz934A,dorulets,Romania🇷🇴🇺🇦,0.0
113,@Debunk_the_Funk There are 2 kinds of podcasts; a) tone deaf patently murderous govt. regulators promoting drugs fo… https://t.co/PaUu6iGS6K,Mead4Prez,San Francisco,0.0
114,@EmirateExchange @djkenzee @dr_adetountanni It shouldn't be a thing of pride...in whatever context. The man goes ou… https://t.co/jOds2wm1Cz,Aya_Agbebi,"Lagos, Nigeria",0.0
115,@Funshyabel @ManLikeIcey You're suffering from the disease called Tinubuism. It is a disease of the Brain seasure. https://t.co/muasIYQtTR,Miranda21185775,"Flower Mound, TX",0.0
116,@RobJamesMcKenna Swedish lab study shows  mRNA vaccine integrates into our DNA at the cellular level – permanently.… https://t.co/DmBzhc40Rx,FieldWhistle,Track Abuse @ AltrueSoft.com,0.0
117,"The Elite are eugenicists, who regard humanity in aggregate as animals that consume valuable resources and defile t… https://t.co/xF1mKUiqEI",itslordsherry,,0.0
118,Zielinsky is a disease he has stolen billions of billions of dollars I believe out of that 100 billion he is in pos… https://t.co/ynoeXCkUZv,widowsson32,South Houston Texas ,0.0
119,"If you can, atleast take your kid to school to a level where he or she can read and write. Illiteracy is a disease",DariausDa2,Kampala,0.0
120,"@ScienceBotikus I had no idea about this:  A salmon-rich, low cholesterol diet means that Inuits rarely suffer from… https://t.co/A33EWSd2kF",botbot_13,,0.225
121,q*)VS Cancer is a deadly disease. #三亚     #合肥   #青岛           https://t.co/MzSnwT1OaB,ISAIASMONTES13,,-0.2
122,@Tertiaryman @ABridgen No. COPD is an airways disease. Covid affects the interstitial structures of the lungs. Howe… https://t.co/ogRJgJo0SD,Abster_1983,,0.0
123,Gastroesophageal Reflex Disease (GERD) Complications Diagram. https://t.co/F57ki0YKYL,MSN_PH_CNS,,0.0
124,Thinking about how people are getting this disease over and over and over again makes me lose my mind https://t.co/YD06Zj3k9D,meentomatoes,he/they • 21,0.0
125,@hvo a rapidly growing specialist contract research organisation (CRO) and world leader in testing infectious and r… https://t.co/j0tO0NyQJ5,Allan_eureka,Glasgow,0.0
126,"Can lifestyle change reverse kidney disease?

Get in touch today for expert advice!
Dr. Jitendra Kumar - Director o… https://t.co/I7giawYiQp",DrJitendraNeph,,0.0
127,"2nd Day of the GRC on Mitochondria in Health and Disease!! Do not miss many of our posters: 
@Sweetwaterbeat… https://t.co/HrI2hPuvWY",LabScorrano,"Padua, Italy",0.25
128,"Covering a heart related disease

Foreign Media : Five billion people unprotected from trans fat leading to heart d… https://t.co/TfXN4ZQix1",_Chintu_ji,,-0.0625
129,"@Kath_Dennis @Sabrina_Poirier I'll be reading this later.

I think the M.E awareness day/week/month is 90% an echo… https://t.co/v35jZlwo9r",MEFoggyDog,UK,-0.25
130,"@DrToddLee @EMSwami It’s a novel coronavirus that has killed millions of people, statistically is a threat to every… https://t.co/PkZClgshpU",Claude__Cat,Straddling South AL/FL border,-0.2
131,"Angelina from Australia is one of the Rare Disease Day Heroes for 2023! She loves dancing, watching cartoons &amp; play… https://t.co/9hlQZzEstm",RareVoices,Australia,0.3
132,"Animal agriculture is one of the biggest reasons of many epidemics and disease outbreaks.
Go Vegan to stop this. https://t.co/qo4gWsIAAm",veganrishabh,,0.5
133,"I hate you already, but check this out. Given the scale of issues like global warming and epidemic disease, we shou… https://t.co/2MVoY4Ulak",ECOTerminator,Your Motherboard's house,-0.4
134,"@BallouxFrancois Much as I’d say don’t let the unpleasantness of Kamil put you off, you make a very good point.
I w… https://t.co/2dBlOMW3VS",snj_1970,"London, England",0.5549999999999999
135,@JekapOmod Ethno supremacism is the disease. Most ethnicities and people (me included) suffer from some kind of sup… https://t.co/Mjs1vfTfY6,Etus2K,Here,0.55
136,@wanderingdrum @SBakerMD What’s the pre-cursor to heart disease? Diabetes.  You know the biggest risk factor for di… https://t.co/YURhJvSxC7,JaybirdMcgee,,0.0
137,"#Florida governor #DeSantis &amp; his #CultureWars are STUPID!

He’s bringing so much shame &amp; ignorance &amp; pain &amp; diseas… https://t.co/hpojQzc217",FLDireStraits,"Florida, USA",0.2
138,"@LdogExtreme Created in 1995, AGENDA 21 to deliver the KILL SHOT via slow release disease in vaccines. Now fact.

M… https://t.co/zIJME7RbD1",AmohangaDeidre,,-0.30000000000000004
139,"In patients with a history of PVTE, the risk of recurrence is 1.4% to 11%. Women with a history of thromboembolic d… https://t.co/9yZosN152v",delumet,,0.0
140,"@vsunqnNP @spectatorindex Forcing a lockdown for a benign disease, printing shit loads of money and then increasing… https://t.co/3OUrjemzKK",vidyudabhe,India,0.0
141,Download the ancient Chinese healing secrets eBook by master Mingtong Gu and learn how Qigong can help you improve… https://t.co/YV23cN0as1,AHealthBlog,,0.0
142,"Atlas of plasma NMR biomarkers for health and disease in 118,461 individuals from the UK Biobank #HelsinkiHealth… https://t.co/TsTYzqv2G7",TerkkoLib,"Helsinki, Finland",0.0
143,"https://t.co/vX9s558k19  #prime2  Cheng XS, ...,  Fearon WF (JAMA Intern Med) __Association of Pretransplant Corona… https://t.co/bbxHpIqpiV",the_paper_link,San Francisco,0.0
144,@thereal_truther Randomly selected controls are important for this reason—to tease out behavior that Influences out… https://t.co/pmaQbz8ojp,isabelltemple,,-0.04999999999999999
145,Virus infections exposure increases the risk of neurodegenerative disease risk (data from @uk_biobank @FinnGen_FI)… https://t.co/JtLroFvVuj,raj_psyc,,0.0
146,"@Goldendeefarms Depends what your limiting factors are.
Ie if light is limiting, increased interception will do tha… https://t.co/Xp7I0pypD6",eyres_N,"Geraldton, Western Australia",0.4
147,"Gift of Goraksha, another was Lumpy skin disease https://t.co/HxbQotF2D8",gliosol,Parallel Universe ,0.0
148,@monkie_69 He's so close to understanding why we need universal Healthcare... But also not understanding the differ… https://t.co/XzeWDJYgZT,nolablue79,"Slidell, LA",0.0
149,"For you I'll spread their legs
Like disease",fleshframe,,-0.5
150,"""A general lack of awareness of women’s heart disease may lead to doctors or patients missing heart attacks in wome… https://t.co/S0CElOlWE7",womensbrainpro,Switzerland & Worldwide,-0.075
151,Wild Yam is a plant that has been used historically by Native Americans and is found in many regions of the United… https://t.co/WvBzRkMBoT,fithealth,"Swansea , Wales , UK",0.19999999999999998
152,"The NICVD provides a range of services including outpatient consultations, diagnostic tests, interventional procedu… https://t.co/a967FGnhRD",Angelic73172598,,0.0
153,"What if depression isn't actually a clinical disease

But you just need to go outside and sweat, breath hard, and feel some pain",composedmale,,-0.09722222222222222
154,"💥 Did you know mangoes pack a punch of health benefits? 🥭 They're loaded with Vitamin C &amp; polyphenols, including ma… https://t.co/ZTIK57Gi2O",NativanaNu,,0.0
