,tweets,user,location,polarity
0,Traumatic brain injury history and severity increases the risk for cardiovascular disease among US #veterans. #TBI… https://t.co/XNh5O2TOHD,oxeiabio,"San Diego, CA",0.0
1,@teaandstrumpet oh? is this for your lack of bone disease?,TrashGir1,hell,0.0
2,"And the winner studies a pediatric disease - NDI! @ASPNeph
#ASNKids22 #KidneyWk https://t.co/RDBLm5VqyE",drjosflynn,"Seattle, WA",0.0
3,"Dr. Campbell
“Excess deaths continue to grow, especially in UK, but in other countries as well. In the UK there are… https://t.co/CsznVaIiVG",ChGefaell,"Madrid, Spain",-0.0625
4,"@harriss_tom @RepThomasMassie Blather,  The reason it is ""preventing"" is preventing death and disease is because om… https://t.co/QrSjcZrghE",katemar34200911,,0.0
5,Human brain organoids implanted into rats could offer new way to model disease.... why do science experiments seen… https://t.co/r9MmoFy4VF,epsunburst,Liverpool UK ,0.06818181818181818
6,@PackersProphet @LoriMacrae20 @packersloren It was never a one-shot fixes all covid disease; there were always goin… https://t.co/05mwnrUvTN,Kathy8s,US Midwest,0.0
7,"Inability to understand sarcasm can be an early warning sign of a brain disease

ITV SENSATION RUDRA PRATIK 
#PratikSehajpal",sambitdas3,,0.1
8,"Baby Pavaneswari aged 2 months old with Complex heart disease underwent heart surgery on 31st Oct, Baby has now bee… https://t.co/CLhrqV7kuu",SuperStarSanto6,"Andhra Pradesh, India",-0.09999999999999999
9,"@larry0x Interesting idea

IMO there’s another reason for it which is neither disease nor conditioning for war

You… https://t.co/at0cxsiTNN",nexain,Rootless International,0.5
10,@CTVNews Another medication caused an incurable cancer and I watched two people close to me die quickly due to it.… https://t.co/y8sNpoLcs3,jadedstatement,Canada,-0.3125
11,Brain disease surely. https://t.co/ORAoRaQVms,Apo_mitsis,"Derby, England",0.5
12,i have a disease its called cry at every event horizon edit whether i know the idol or not,bnnyliz,for kjw and hyj,0.0
13,"Honestly, if I'm a poor person who is smart and feels my future is in my own hands aka education hard work persever… https://t.co/n4r15XBwbj",funnlim,Malaysia,0.024523809523809514
14,@LouPas @Linuzifer @elonmusk @Twitter @TwitterMktg test https://t.co/hxpxSdUcSN,fractalfoxnode,Berlin,0.0
15,@FoxNews @RonDeSantisFL @RonDeSantisFl looks #deathly #ill. What is he #sick from? Does he have a real #doctor to s… https://t.co/NwVAe5tARu,dynamo24936469,,0.2
16,"Shogetsu (turmeric) has almond-scented flowers, and flowers in late March. Prone to rot disease, it was featured in Architectual Digest.",CherryExpertBot,,-0.3
17,"Hey my long haulers, Dr. Bhattacharya’s research focuses on the health and well-being of vulnerable populations… ye… https://t.co/EOWfTLhMng",cocobelladoodle,Plague Island,-0.275
18,"@michael_rich29 @GbengaGOLD @PeterObi Nope, Toxicity is a big disease, May God deliver y'all",6ixlux,"Atlanta, GA",0.0
19,@sarahkarpar @DParton61 God bless you and your husband.  I pray night for all suffering from this horrid disease.,JuneDeaton1,,0.0
20,"10-year-old Elowen has spent half her life as a @LevineChildrens patient, but she’s not letting her chronic kidney… https://t.co/LJmDys6Wp4",GiveAtrium,"Charlotte, North Carolina",-0.05555555555555555
21,Booktok is such a disease tbh,Amb_TCS,trapped in the mosh pit,0.0
22,"@WatcherGuru The fact that he doesn’t realize the platform is just a reflection of its users, shows how bad this di… https://t.co/gSdbuBcR7z",mansasimba,,-0.6999999999999998
23,"Disease burden of Delhi from Air smog is highest !
https://t.co/ATJUYHF0kk",HSwaminath,"Bengaluru, India",0.0
24,"Dr ⁦@DrHaigentz⁩ Missak Haigentz, leader of Thoracic Oncology Disease group at #cancernj2022 Summit. Pointing out h… https://t.co/ly2vefM03F",HH_Oncodr,Rutgers-Cancer Inst of NJ,0.0
25,@jeffreycombs @elonmusk @Twitter Twitter is a social disease.,seaninmuskoka,Ontario,0.03333333333333333
26,@KyrieIrving I think #KanyeWest's foot-in-mouth disease has spread to #KyrieIrving.,RichWritesRants,"Raleigh, NC",0.0
27,just thinking about all of the times my mom used to tell me to just ignore it when I didn't feel good until things… https://t.co/J238FV8ehE,wiitchfiingers,RVA,0.7
28,"Pretty hurts,
We shine the light on whatever's worst,
Perfection is a disease of a nation 🎶",mrsking254,,-0.11666666666666665
29,"@GodGave2A @CoD2Freedom @ElijahSchaffer People truly overcomplicate it to woke virtue-signal. But like yeahhhh, it’… https://t.co/EQp80RxQxZ",CultureWarToday,,0.0
30,Man has one incurable disease: Ignorance. - Clark Dufour,362t,,-0.5
31,"Baby Pavaneswari aged 2 months old with Complex heart disease underwent heart surgery on 31st Oct, Baby has now bee… https://t.co/CSqH7yWafY",MBfoundationorg,,-0.09999999999999999
32,"talking with hellz is a disease because we call cooking ""malewifing"" and now its become an unfortunate part of my vocabulary",therapytlbot,,-0.5
33,@aleon05 So sad seeing what the disease has done to Michael.,steusmotus,,-0.5
34,"@AgentCoopr702 @TudorDixon @hernandez4ltgov did zombie tuder dixon tweet this 

sorry that u think even more people… https://t.co/n0TMTGxNgY",Redmond80Chris,,0.0
35,My brother this government will do nothing to secure your future fight as a man get out of the country and look for… https://t.co/gB97thx1i8,BSebatindila,"Uganda ,Qatar ",0.2
36,"Ernest Gilbertson (1897 - 1932) enlisted Sherwood Foresters, Pte 127203.  Discharged 13th Nov 1919, suffering with… https://t.co/6W0iuiR6Fz",WaymarkGenes,"East Midlands, England",0.0
37,@mtracey &amp; huge vectors for disease.,Sonatasaurus,,0.4000000000000001
38,"**If  you stop chanting, the evil energy will increase and the disease will resurface.
#Health_Wealth_byYoga https://t.co/E7QjzqzLYT",tkdutta5,kolkata,-1.0
39,"@DrJohnnyFever6 @VagabondOrbital @Microbedoc2 @maolesen @sojourner_blanc This is nonsense, COVID is absolutely not… https://t.co/gDIPUi9Mp2",0bj3ctivity,United Kingdom,-0.1
40,@STVNews Pancreatic cancer is an awful disease but is known as the silent cancer as mostly symptoms are varied and show too late to help,Greent1875,"Edinburgh, Scotland",-0.2
41,"I put forward my best suggestion. ""Shawcross"", previously known as HS.

I rejected Verneuil-Jemec-Revuz Syndrome (V… https://t.co/ZtKeQ6bIK5",RJ_Howes,Bunurong Land,0.4166666666666667
42,@ACTBrigitte The height of an pandemic.! That was quite the accomplishment of Trump getting gas prices to drop beca… https://t.co/LArVdxN67r,ggjustthink,"Colorado, USA",0.0
43,@BetteMidler Liberal Hollywood is a disease,thecryptbro,"Pennsylvania, USA",0.0
44,@Taurus_Moon_ @SaltyAndMore He has phantom honking disease and won't be able to show up.,BarelyBook,"315 Wilbrod #2,Ottawa, Ont",0.5
45,"@RoxyTall Worst to endure? Probably one of the mediaeval ones. Brutal close quarters combat, disease, torture, and one lasted for a century.",DavidRedSeven2,,-0.9375
46,apartment too small for three? louis and prior comfy but not louis and prior and prior's disease?,priorwalterbot,"bethesda fountain, nyc",-0.08333333333333333
47,"@MurielBlaivePhD Yes, it's horrible what the gov/dotcom/pharma cabal has done. The response to COVID was MUCH more… https://t.co/YnQ2l5C64Y",Fthisapp,,-0.25
48,"𝗛𝗲𝗹𝗹𝗼 𝗗𝗮𝗿𝗸𝗻𝗲𝘀𝘀

Rye Thorburn confronts a murderous disease that is awakening in the populace and he must decide if… https://t.co/F5pPBTZfJ0",IndieBook,On your bookshelf and e-reader,0.0
49,@catelouisemunro @MartinDaubney @alderleymel @TalkTV Leftism is a global disease!,Chriscarroll50,Ask me nicely & I'll tell you!,0.0
50,"The number of cholera cases in northwestern Syria has risen to 247 confirmed cases, and 6 deaths, according to medi… https://t.co/bMlt0GjBP8",alothman_nabel,"Bursa, Türkiye",0.4
51,Eczema occurs about 3 times more frequently in celiac disease and about 2 times more frequently in relatives of those with celiac disease.,EczemaNoMore,Manchester,0.30000000000000004
52,happy 2 weeks promare disease https://t.co/YJ3ZZ1gM5r,luciacactus,spaghetti,0.8
53,"@Danetendo1 @Pumadoesstuff @ShitpostGate The disease in that context would be a direct creation of God though.
As w… https://t.co/hvm30W2NIx",SamDunn93,Thornabronx,0.1
54,"@BpdLion Racism, sexism, homophobia etc etc are not restricted to any part of the UK not to any particular race wit… https://t.co/M4D96vtkgj",IanWarr34282027,,0.16666666666666666
55,"Large marine Newspapers can be converted, via chemical reaction, in chemical reactions and transformations⛔نمشي ⛔SH… https://t.co/0fxDycHBPv",PaigeLa44150295,,0.21428571428571427
56,"No it applies to all tribalists left, right and center. Tribalism is a disease, smh https://t.co/yKvwFZDJs3 https://t.co/ldceka5OPl",justgetintothe1,,0.0619047619047619
57,"@T0NYBISSETT Es q aplastada por una put4 ala de avión es heavy y encima súper poco después de lo de ""it's like your… https://t.co/NqmKvGdTUP",delenascaptn,mystic falls /// alexandria ,-0.2
58,"@MarkRuffalo The Israeli are no longer hiding their disgusting racism, they elected far rights maniacs who continuo… https://t.co/E7uvZyVF45",IbrahimQ85,"Jeddah, Saudi Arabia",-0.45
59,jealousy is a disease https://t.co/DLitUbgoxC,214delivery,,0.0
60,@NabilahMayat @mevparekh @sh_abbers Medical ophthalmology deals with inflammatory/vascular/neurol eye conditions -… https://t.co/2qRUSbDQia,sarjuathwal,"London, England",0.0
61,Vegetables and fruits play a critical part in maintaining good health and prevention of chronic diseases such as di… https://t.co/chcDq7lST6,wellness_____,"Virginia, USA",0.2333333333333333
62,"rant: if you are sick stay HOME

twice now i’ve gone to work and my coworkers have shown up sick as hell and as som… https://t.co/KRzHJTury1",iridescentgvf,dig toronto • 23 • she/her,-0.7142857142857143
63,"The European Organization for Research and
Treatment of Cancer (EORTC) trial showed a disease control and survival… https://t.co/RpER3SeCyx",ArrangoizMD,Mount Sinai Medical Center,0.0
64,@iluminatibot Pfizer recently bought another pharmaceutical company specializing in producing heart medication. Go… https://t.co/IEPHjPwkGF,123kakaymarie,,0.0
65,"""Inflation is not an act of God; inflation is not a catastrophe of the elements or a disease that comes like the pl… https://t.co/GRvsW9aLZe",eldestmyriad,Online,0.0
66,"@LegoLas44941816 Since you didn’t specify a timeframe, disease or the extent of compliance I chose “likely to be re… https://t.co/V9mh0IWHU7",Nestar_84,,0.0
67,@NeilWC2010 @Thorshared @healthyrespect1 @doctorasadkhan @Kit_Yates_Maths There are virtually no dangers and it’s a… https://t.co/g8YUPESOH7,JoJo_loves_sci,,0.0
68,"@newsmax Gee where do we start, Afghanistan with withdrawal, Shutting down the XL pipeline, passing an insane bill… https://t.co/9g1i3agbxM",dmammino23,,-0.5777777777777778
69,@Mrs_Slocombe_ @AllBiteNoBark88 Yes sadly he did sound as if he had some kind of degenerative disease motor neurone… https://t.co/1r6wdAAFhH,Mellycat6,Various,0.16666666666666666
70,"Nice !!!
I have - I can’t do shit - disease",LilSweetMary,Riyadh,0.6
71,"@Charlene_Mattie @Fear_No_More Athletes have been investigated. 
Nothing. 

Myocarditis is a common ailment you jus… https://t.co/MOiHpWzzcL",xeal_,Toronto,-0.3
72,"@25_cycle @lifewithsommer I understand this.
Do you?
PCR was and is used to diagnose covid cases. 
Covid is an illn… https://t.co/iNqANSnhQq",Leftychris2,,0.0
73,Life is a sexually transmitted disease and the death rate is 100%.,Silver_Zoldyck,NGL - #SDCFams,0.5
74,"@RepThomasMassie No, that makes the other 93% vulnerable to severe illness &amp; death from COVID-19.  Over 1 million A… https://t.co/UK2Ww3rlxn",drtom878,Idaho,-0.3125
75,jealousy is a disease get well soon https://t.co/W8E56gB53R,coywolfclown,gore/rot/guts/it/pup/bone,0.0
76,It’s a disease. https://t.co/X4FJFsDbE0,DeAlFiLi,"London, England",0.0
77,"@juanmoretime16 @thing_noticer @ChefGruel @disclosetv Next time theres some other disease, the govt and companies w… https://t.co/jWDIO9Kd9z",lostledger,"Somewhere, There",-0.0625
78,this is getting sketchy. from all exposing thread i have seen there's always a scenario of lying about having a dis… https://t.co/5IhbQ1eHKg,jaemprsso,she/her filo — minor 𓂋,0.0
79,@billmaher I’ve voted D my whole life. But when #Dumbercrats mindlessly embraced forced medical procedures in a mas… https://t.co/7s5lHO1Fqj,PJvonH,"Ashland, OR",-0.07500000000000001
80,"@nadig_cardio Fixed it, but no IVUS: budget constraint. You think native disease progressed in 4 months?",serioustaurean,"Bengaluru, India",0.1
81,i may soon be on adhd meds antidepressants and estrogen all at once i am basically a vessel for the cia (also i may… https://t.co/qByLhSq2ri,phoenix_kurenai,fulda gap,0.0
82,"@spicy_facts_69 or a ""serious disease""?",imax9000,NAFO HQ,-0.3333333333333333
83,@ChinaJoetraitor @SueLincoln5 @DonaldJTrumpJr Good every trump or republican needs to vanish. You are a disease,ItsMe04379240,,0.7
84,Diabetic retinopathy is the most common cause of vision loss in people with diabetes. Your chances of developing gl… https://t.co/IngrekTP7j,D_ANNIE9,,0.1
85,"This could be my something new
Hoping to bridge the gap between patient understanding of disease and the healthcare… https://t.co/nElKk0xelU",zeebausofi,Mumbai,0.13636363636363635
86,@mrmacaronii Ur head de hux. I just shake my head when I see my fellow youth campaigning for @atiku and his friend… https://t.co/rq76uft1XX,BabaKay58970725,,0.0
87,"Pair of giant inflatable lungs to visit Barnsley as part of cancer campaign
A pair of giant inflatable lungs are co… https://t.co/aZOlePBuF2",GrimethorpeSur1,Barnsley,0.0
88,#Tigray Denied meds for  infectious disease/Tuberculosis! Unable to prevent and treat! See details by Dr.… https://t.co/dL5hm6BKUH,JborgGa,“ጡላ” 𝖔𝖋 𝐌𝐚ñ𝐚𝐧𝐚 ሕልና 🧠🕊,-0.5
89,"Scientists made mini brains and infected them with coronavirus. What they saw could explain Long COVID

""But the in… https://t.co/9Gr4Js9Fbb",JulEStan1,"Buffalo/Rochester, NY",-0.05
90,@tubbostim thank U im unfortunately plagued with a very rare and severe disease called the cbeeduo illness,sillytubbo,ac 0pwhh . im 14 😐,-0.05499999999999999
91,You would have reached for her with the mindless desire of an infectious disease. You would have whored yourself to… https://t.co/wosABiOg0N,fatecries,,-0.2
92,@___simo hope u make it chief 😔 one fuck of a disease,kisumasu,Mikkeli softlock,0.0
93,This was a fantastic conference on treating spike disease from C or V injury. People can watch sessions for a donat… https://t.co/TmD3IvqIte,DrKellyWheeler,California ,0.4
94,"@Magic14272090 @bonnie_handy @HaplogroupNews @greg_travis @HFentonMudd Apologies use complex terminology, in tweet… https://t.co/Ka4AB8pWeR",RealCheckMarker,"Ottawa, Ontario",-0.3
95,Followed by @VilarinhoSilvia demonstrated how much can be learned by seeking new rare genetic variants in individua… https://t.co/tMjrFH4RTS,NASH_and_coffee,,0.21212121212121213
96,#karsiyaka alaybey  #egekent şemikler some seemed at death's door from age and disease. He would not have been https://t.co/TI5WDOy53E,KyleHar00061186,Indianapolis,0.0
97,"@EllisLover @samyIamva Wow, thank you for that info. I already have Stage 3 kidney disease. Don't need any more dam… https://t.co/U7YkE4DJE7",MikeMit59007199,Stuck in a blue state! ,0.3
98,"you are the hunger gnawing at my consciousnesses like a parasite, a disease,",yanziquotes,,0.0
99,The greatest histroy book ever written is the one hidden in our DNA. #DNA_ThePowerHouse u can lead to any success o… https://t.co/WvyEkJvXfJ,DivyaInsan77,,0.37777777777777777
100,@MJfromNS @SuddsAndrew @SharonT20519250 @rupasubramanya What is vile and deplorable is the hate farming that conser… https://t.co/eZiqjOZf05,k_govers,Ontario,-0.7
101,"Men are more likely to drink, smoke &amp; take risks, making them more prone injuries. 
Also, estrogen can reduce risk… https://t.co/CF8bG0Ec0V",mazpa_md,About To Catch a Flight,0.3333333333333333
102,ILL BRING THE FLAMETHROWERS LETS GO ERADICATE THAT FUCKING DISEASE https://t.co/vtEWvlaHlq,minchojjun,she/her 24 missing gaku 7,-0.5
103,"Men die of boredom, psychological conflict and disease. They do not die of hard work.

SHER DIL SHIV THAKARE",shiv_Squad68,,-0.14583333333333334
104,"@RealJFriesen @bsfarmzeldon @BenCarlisleLaw No, COVID and basic disease prevalence is.",DuckYouAntiVaxr,,0.0
105,"@TRyanGregory Need to separate real ""immunity debt"" which was caused by NPIs in 2020-2021, meaning a build up of su… https://t.co/9PKkIQxQuq",BudvarCat,Ohio,0.2
106,"@TarikThirteen All 3 are classics, but thank God it includes the previously unreleased Shake the Disease and It's Called a Heart! ❤🙏",KimiElectronic,,-0.16666666666666666
107,"@KrishnaPrakash @RajeswariAiyer Wow
I can see some connection 
There is a lot of research I am doing on the origin… https://t.co/7oMSPitcBn",WellSaidGuru,Bharat,0.1
108,@edtwtconfessing jealousy is a disease,stqrvingbitxh,she/her • aussie • gemini 𖤐,0.0
109,"@maolesen I wonder how many of your trolls/pro-covid-ers were also the one’s that said; “yeah, I would’ve done that… https://t.co/bptA9cDXsc",Neveroutofwork,The ONLY planet we’ve got.,0.5
110,"Disease, normally follows from whatever you find out about myself. I did not come
An empire there isn't ے⁦نون⁩- . T… https://t.co/wxooGa39o4",ashraffereg,,0.15
111,jealousy is a disease 😭😭😭 https://t.co/attijHihKV,haezkith,"she/they, read carrd byf",0.0
112,@POTUS Where? Ours is up 50 cents is 9 days while I was hospitalized for a disease You said is OVER. WHY ARE WE LYING TO OUR COUNTRY??,Sunshineside77,"New York, USA",0.0
113,"@blackdives literally it broke me more like what happened, she lasted 15 years assuming that he dumped her &amp; out of… https://t.co/i13kJWKdcn",noonaurr,,0.5
114,"@Bret2022 False.  There were NUMEROUS trials that claimed it was literally 100% effective.

Here's one, there are m… https://t.co/Ru0BwAZCnE",tallGOPgamerguy,nowhere,0.06666666666666664
115,@outmagazine You're all full of it. The man is innocent. Go take your medicine. Misandry is a horrible disease.,israelfrantzy,,-0.05000000000000001
116,@QuahogsUnited @ZacBissonnette It would be impossible for ME to give YOU a disease. You are still wearing 2 masks a… https://t.co/A6wRr28r3l,denisflanagan9,,-0.6666666666666666
117,@olarholu22 @Shedrack_jordan @mrmacaronii Vote your Chicago drug lord and godfather but he will never govern Nigeri… https://t.co/J1CHCxFGMD,cardinalstation,"England, United Kingdom",0.0
118,"Say this out loud!

“…..I am sufficient in God's sufficiency and blessed with the divine life that is impregnable t… https://t.co/leJ6q60qYx",SarahSu57063215,,0.1
119,"An ex colleague and continued dear friend lost her fight with cancer on 3/11/22 
2 1/2 years after her diagnosis an… https://t.co/q46lqgwgHI",RosieMaryBush,Hidden Disabilities Warrior,0.0
120,"@alexmeshkin If you listened to Fauci, Hotez, Osterholm, they were clear that it reduces risk for severe &amp; fatal ca… https://t.co/kqLqnX45he",StAnge1L,,0.10000000000000002
121,@ciriIIariannon not 15 year olds doing the re-up of tumblr chronic online disease 😭 we’ll never escape,jillvaIentine,lesbian,0.0
122,@StrigaRosa Imagine if they'd suggested there was a disease you got by having too many of the cyberdollars. That'd… https://t.co/WgQ1D2m1v8,Arichamus,The Mighty Pacific Rain Shadow,0.5
123,jealousy is a disease and i most certainly have it https://t.co/SCGeK34gHx,mkleereign,"she / her, 21!",0.35714285714285715
124,The foundation was formed several years ago as a global group of parents were determined to find a cure for their c… https://t.co/9qsNBkezFK,aloktayi,World,0.0
125,"Officials identified five confirmed cases, including one death of an individual in their 70’s, but the source of th… https://t.co/NGokM3Jz0K",ESTechLab,"Louisville, Kentucky 40206",0.2
126,"One group doing amazing work is @Foxg1Research! The FOXG1 Research Foundation ""is the parent-led, global rare disea… https://t.co/9p7RCftMRx",aloktayi,World,0.30000000000000004
127,"@karaswisher @elwinter There's a wikipedia entry on that observation, it's called ""Nobel Disease"". The entry for th… https://t.co/ETP5WW133m",yeldnal,Earth,0.0
128,@AmritaRathodBJP AQI has reached the sever level.People are gasping for breath.Cases of Chronic obstructive pulmona… https://t.co/RiPM0s1mrM,satishnsw,,0.0
129,Kanuism is a serious mental disease.  Demands and ultimatums ? Seriously? Or will you bring in Cuban pilots to fly… https://t.co/bsqi5F533z,manric540,Citizen of the World,0.00833333333333336
130,"Humanity is the worst disease of them all.
#HumanRights #humanity #human #humanitarian #HumanTrafficking",seekeroftruth84,,-1.0
131,I love humans when they leave me alone purrr... but it's a shame I'll have to spread my disease and start to make t… https://t.co/YySnCmKYhZ,heckincatto,,0.0
132,@GeorgeTakei Russian collusion and global warming and the last 30 media narratives come to mind as to things the le… https://t.co/DrCQzVwdtD,awwbitch1,Always ahead of you.,0.0
133,"So fuckin glad my son didn't take the chance....with his dad's lineage, who all died of heart disease, xpt for my h… https://t.co/mLVKtkchdd",Ingeastrid,behind the sun,0.5
134,@KariLake How dare you not protect our children from a communicable disease?,KSholinsky,East coast ,0.0
135,"@TRyanGregory @fitterhappierAJ yes, i don't know any colleague immunologist at lab or hospital that does not accept… https://t.co/7U23ojZxZz",VersatiIeTwink,,0.0
136,@PolitiFact @weareone1313 Ad in Michigan falsely claims our Proposal 3 allows abortion up to the date of expected d… https://t.co/Yiu3wXL3o7,DeletedSharon,"Michigan, USA",-0.25000000000000006
137,FULL DOWNLOAD (PDF) Clean Gut: The Breakthrough Plan for Eliminating the Root Cause of Disease and Revolutionizing… https://t.co/GFeoWhBl6E,samuelabimael1,,0.35833333333333334
138,@MsnMedicine Adding fruits and vegetables to the daily diets keeps our digestive system active to cleanse body of t… https://t.co/UVwqwvdP7Z,AshokSa54047627,,-0.06666666666666667
139,"""Whether the patient has a cardiac condition, hypertension, autoimmune disease, fibroids, or asthma, he or she must… https://t.co/rvsm1epsRi",plantpowerbowls,,-0.05
140,"@pfizer @BioNTech_Group Creating a higher death rate and higher profits..

Reading YOUR adverse reaction list was l… https://t.co/kSSbwRhF5b",btb101livecouk1,,0.25
141,"“the nature of the disease required so sharp a remedy.”

~ Robert Catesby

🎨 George Hull

#BookWormSat… https://t.co/ZkQRybvzjg",MaryKeiser1,United States,-0.125
142,Imagine being in the history books for being the richest man in history who fucked it all away because he caught Poster's Disease,Viral_Ben,,0.0
143,"Keep on crying. As I have said earlier that until and unless fake history is removed from textbooks, nothing will c… https://t.co/8fFHwuVaAu",buddhimedia,,-0.2333333333333333
144,Ur at a restaurant and a waiter comes over with two dishes covered by domes! One dome has 50 million and the other… https://t.co/Qyn5fLKS5P,AK_Yurei47,,-0.125
145,"@awfulannouncing You ESPN "" KNUCKLEHEADS"" ALWAYS  HAVE DIARRHEA"" OF DA MOUTH. AND THEN HAVE TO TURN AROUND AND WIPE… https://t.co/IdbSqYz5Gp",terrancepope13,,0.0
146,@BillboardChris @ChoooCole @realJamesKlug And even if breast cancer is the disease— mastectomy is not the treatment in most cases.,artsongfan,United States,0.5
147,"@at0micandy BBC News - Avian flu: Fourth Lincolnshire farm struck by disease
https://t.co/GoHF2omP7f",Captain_PUGWA5H,All At Sea,0.0
148,@kipmurkomen should be in a crisis meeting with these guys not @KenyA_irways managers.  Neocolonialism is a mental… https://t.co/q1fHlHsyet,manric540,Citizen of the World,-0.1
149,@SRKsSquad Nope. Teaser did what needed to be done. Yrf has this disease of revealing the whole plot in trailer so… https://t.co/n8r83TMqC2,sanaafsal,,0.2
150,When did Pretending become Talent over Doctors who save lives and Teachers who educate the people and Scientist tha… https://t.co/Bmx0gmE3LA,prothatdidnotgo,,0.0
151,"@Esther02485577 Logic has no place in the brains of these people, their obsession with money and power is manic disease.",georgeg56907598,,0.0
152,"Living with Noma, a painful mouth disease https://t.co/G5O8rTsPDZ @YouTubeより",ash_joan,,-0.7
153,@alexmeshkin Docs understand that long term protection against severe disease requires hybrid immunity - TCM develo… https://t.co/YTy8J9SilM,HowardSchlauch,"Gallup, NM",-0.05
154,@tl_chaos Haha it has become a disease sasa,Minch_Baniani,Eor Ekule,0.2
155,"@1992sFinest The biggest cause of heart disease, in people under 40, is the amount of energy drinks they consume, w… https://t.co/XYkZKaNW9I",sagheerosman,"Cape Town, South Africa",0.0
156,@kim_adamsWriter I’m sorry. Billy seemed so healthy. The vet said it was acute  blood clot caused by heart disease… https://t.co/Df92RMiivE,helen__chester,,0.19999999999999998
157,"Morning session @AASLDtweets #TLM22 Basic Science Symposium as applied to patients - 
Speliotes - common genetic va… https://t.co/UVmaHNo1e7",NASH_and_coffee,,-0.15
158,@MrBlonde_macro @Sino_Market Markets keep hoping for both &amp; both disappoint. Recent hope in case of China was trigg… https://t.co/Oi3TAx5bWu,vidyadharginde,Mumbai,0.0
159,"@JanForNoReason ...
Okay, if he wants to know...
She has an incurable disease. That's it.
Now he knows.

[ And she'… https://t.co/t5G7K5DnK5",cheshakitti,header: 纳豆nash; avi: 现代犬儒⚝pxv,0.06666666666666665
160,@DavidAKiernan2 @dfernan266 @mandyj94__ @globalbounce8 @GeraldoRivera Most people know that a vaccine is a preparat… https://t.co/OzE8Stztq2,spcjinx,"Michigan, USA",0.5
