,tweets,user,location,polarity
0,"@Chicago_History Well, the last time I actually enjoyed this, I took 3 sick days after, who knew, I had Crohn’s disease? #Crohns",cornerworker,IL land of corruption,-0.07142857142857144
1,@Leem44926123 New born ghouls are a legitimate threat phase of ghoul disease in Dread Hearts that builds in an area… https://t.co/ZZ7X28TY2J,DeadShuck,Texas,0.13636363636363635
2,@lucascalories jealousy is a disease and i have it,nocqlz,16 she/they,0.0
3,BREAKING NEWS: Baretta star Robert Blake dies of heart disease aged 89: Was once cleared of hiring stunt double to… https://t.co/yOjOk5WYik,RantReaper,,-0.05
4,"Social media people are having a disease

It is called “Us-thama”",aishalic_,,0.03333333333333333
5,"This is nothing but impression farming 🤣
This guy yt channel is getting dead day by day so he thought to trigger a… https://t.co/Xv7em7hMbD",Rage__fr,,-0.2
6,"@KFOX14 Thanks for sharing the importance of getting screened for colorectal cancer! With allies like you, we will… https://t.co/NGVbhQRiwW",CCAlliance,"Washington, DC",0.2
7,"The history of MS dates back to 1882, when it is believed Augustus d’Este, a grandson of King George III, was the f… https://t.co/RSmBM9psH7",BeansIsFrank,Boogie Wonderland,0.0
8,Actress disease isn’t just for kpop rip https://t.co/G9a9F2Hali,kataraminaj,,0.0
9,@ReturnofR Industrial Disease,radhyper,Tallahassee Florida,0.0
10,KkmHC Cancer is a deadly disease.    #上海 #天津    #青岛         https://t.co/FG3hUnweBu,edwardsuriel3,,-0.2
11,Dowry is a dangerous disease. Finish it from the root. Marry dowry free like Satguru Rampal Ji Maharaj Ji's discipl… https://t.co/BSTRxTVHWb,MankaVeer,,-0.09999999999999998
12,War is not an adventure. It is a disease. It is like typhus.,bot_flippy,Wherever I wanna be,0.0
13,"RIP Actor Robert Blake, who rose from ""The Little Rascals"" to ""Baretta"" to accused then acquitted murderer, has die… https://t.co/GewZn6X8S1",AHMalcolm,"Eastern Tennessee, USA, #TCOT",0.20625
14,"@jyduclos So less than a dollar per Canadian for a disease that (1) you are still allowing to rip, (2) has already… https://t.co/9IGZAWEMvN",AB_UseUrBrains,"Edmonton, Alberta",-0.16666666666666666
15,#DYK it's #WorldKidneyDay? I'm asking @RepAshleyHinson to support increasing funding to $15M for the CDC's Chronic… https://t.co/xnqjlsTPJD,lindsaykeegan,"Cedar Rapids, IA",0.0
16,"@SFB_Addict @CP24 Yeah, nothing to do with being 89 years old and heart disease. 🤣",Hello_From_TO,"Toronto, Ontario",0.1
17,@kristenashley__ Lmao talkin bout we only have periods cuz we don’t eat right and that if we ate right we wouldn’t… https://t.co/FuuakveWZf,MikeMyersMask1,"La La, Land. ",0.19047619047619047
18,"Saint Gurmeet Ram Rahim Ji preaches to do regular meditation to heal DNA . This is the best
#FridayFitness tip ever… https://t.co/hTIRWxAgzb",thindguransh1,,0.5
19,"The Lost Highway actor is dead at 89 years old. The news has been confirmed by his niece, Noreen Austin. The actor… https://t.co/D01TxNEeef",RareAmerica,,0.10000000000000002
20,"Last Tuesday, the 28th of February, IDFA celebrated Rare Disease Day - a global observance dedicated to raising pub… https://t.co/uWOoXKQSxV",IDFAustralia,Australia,0.16249999999999998
21,"A statement released on behalf of his niece, Noreen Austin, said Blake died from heart disease, surrounded by famil… https://t.co/6uvKcXFMgX",FOX26Houston,"Houston, Texas",0.0
22,@SethMacFarlane It’s a respiratory spreading vascular disease that causes end organ and neurological damage the has… https://t.co/SkbRZ7BFgz,Litefire01,TN/Tranquility,0.0
23,Baretta star Robert Blake dies of heart disease aged 89 https://t.co/guuGHAoOtZ via @MailOnline 🙏,djmaxyone,,-0.1
24,@goddeketal Virologists are obsessed by disease. Anything else is an anathema to them. They are disease fiends whos… https://t.co/G9dydyEDtR,SM23094607,,-0.5
25,#DYK it's #WorldKidneyDay? I'm asking @ChuckGrassley to support increasing funding to $15M for the CDC's Chronic Ki… https://t.co/ze9mCxq8Fe,lindsaykeegan,"Cedar Rapids, IA",0.0
26,@bridgetthemc It’s more of a psychological issue than a disease is why,rrh1stryker007,"Colorado, USA",0.25
27,"@KristanHawkins No, you aren't! Your husband stays home to care for your sick children, one of which you intentiona… https://t.co/LaqaEF9Uvd",therealmarilee,"Arkansas, USA",-0.7142857142857143
28,"A statement released on behalf of his niece, Noreen Austin, said Blake died from heart disease, surrounded by famil… https://t.co/isEfDCme4F",fox7austin,"Austin, TX",0.0
29,"A statement released on behalf of his niece, Noreen Austin, said Blake died from heart disease, surrounded by famil… https://t.co/GHU9V3iFWe",fox5dc,DC/MD/VA,0.0
30,"Delinah Blake told CNN in an email that her father died “peacefully” on Thursday “surrounded by family.”
The cause… https://t.co/pbIiMKT98N",JeedBe,"Now live in Portland, Oregon ",0.25
31,@appaloosamanche @alanbpcny @EdKrassen 2. I gave them condoms. No one got pregnant or a sexually transmitted diseas… https://t.co/Jpj2vWMXSY,molly_sante,"Colorado, USA",0.41666666666666663
32,🙏Baretta star Robert Blake dies of heart disease aged 89 https://t.co/z1tq1yDcYj via @MailOnline,maxturn66505550,,-0.1
33,"San Diego State University this week confirmed a professor died after contracting the disease, but experts say chan… https://t.co/pOtqmuhdDH",KPBSnews,"San Diego, California",0.4
34,"Abortion does not appear to have driven the decline in teen births. As a share of teenage pregnancy, it has remaine… https://t.co/8kmIuDK1Os",KwnF,Mistra,0.0
35,This was the 19th year for the event. https://t.co/ewIZtsOtVk,13abc,"Toledo, Ohio",0.0
36,Cataracts are an age-related eye disease that affect more than half of individuals by the time they reach 70-80 yea… https://t.co/cpDktO05Qf,WineCountryVis1,,0.11111111111111112
37,"Older adults are at higher risk of severe disease and death from COVID-19.  

Protect your loved ones from #COVID19… https://t.co/PSHZGBHTYU",WHOPhilippines,"Manila, Philippines",0.37222222222222223
38,"Chris Rock's rage towards @jadapsmith is fu**ing weird, and looks worse now since the last he spoke of her was to s… https://t.co/gjJSTy7q3z",heelsonthefield,baseball & other worlds,-0.3
39,A planned hospital for one of the fastest-growing areas of Horry County near Socastee hopes to help combat one of t… https://t.co/2IV7RWSMBR,postandcourier,"Charleston, SC",0.1
40,"Watch for ticks! Lyme disease is spread through ticks to humans &amp; animals. It can cause: rash, fever, chills, heada… https://t.co/D4Nae2mW3E",ButlerCounty_HD,"Hamilton, OH",0.0
41,"As women enter menopause, their bodies go through a lot of changes, including some that trigger a rise in heart dis… https://t.co/nA0MFClR7x",AHAOregon,Portland,0.0
42,@monkattain @Tonyygaxiola @SHULAGOD We’ve been with Covid for several years now. There’s absolutely no fucking way… https://t.co/JpgtzVPKbR,nothingleft_ok,"California, USA",-0.05
43,Should this mathematical score be incrementally applied to certain disease states and decades of age? @LBEBEN https://t.co/waDgvR5N6c,LBEBEN,"South Carolina, USA",0.10714285714285714
44,"@sanliz875 Gibson gets a pass because he is battling a tough disease, but Shepherd and the rest are horrible. One o… https://t.co/P0AKgm7H2t",Zalman888,"Lower Makefield, Pa.",-0.6944444444444444
45,"@pastrnak96 @NHLBruins 
Coming to the game in Raleigh! It's on my bucket list to meet you. I have Huntington's Dise… https://t.co/NQbjJskDpV",CaitlinShotwell,,-0.4
46,@NewsArenaIndia It is pathetic that the disease of freebies has caught on Maharashtra govt. This not only creates a… https://t.co/jfVMINR7Lu,tejpeer,,-0.5
47,@girlytwirly @ApheresisLC @Dysautonomia I would think that plasma exchange would be the superior modality as it wou… https://t.co/rfl5eafskT,cryptopheresis,,0.7
48,@ford_nik I have chronic migraine and cluster headaches so I empathize. 🫂 I have no advice to give since migraine d… https://t.co/usUuhoxhnh,hodie_heathen,Langley-on-the-Ganshowehanne,0.0
49,"#FridayFitness
Our health is most valuable wealth.A healthy person is someone free from disease. Saint Gurmeet Ram… https://t.co/3KR1Sf8d1I",Himanshusiyana,Bulandshahr ,0.4666666666666666
50,"7/ Drones with high resolution multispectral sensors flown at a low height can help detect some of these problems,… https://t.co/eFFX0ra4Pg",WeArePixelar,"Norfolk, VA",0.08
51,"6/ There are also tools &amp; technologies available to help growers monitor for these threats, such as disease-resista… https://t.co/YX8qKnnozy",WeArePixelar,"Norfolk, VA",0.2
52,"2/ The first threat to winter wheat is fusarium head blight, a fungal disease that can significantly reduce yields… https://t.co/DTBWr4ag7q",WeArePixelar,"Norfolk, VA",0.3125
53,"Fakeness is a disease, people need to be real again.",JakeSolberg7,,0.2
54,.@US_FDA the #ALS community delivered you a petition to grant #NurOwn a transparent and informative AdCom three mon… https://t.co/FURVyJrBxb,soakley626,,0.0
55,"We now have a Center for Disease Control that spies on us, censors us, and tries to force shots known to kill and m… https://t.co/cdC5r2NWbP",RWBPatriot1966,"border town, USA",-0.1
56,@JoanieOC @PAlexanderPhD That's what happens when the shot is the disease.,jodieiscool1,"Lockport, NY",0.0
57,"""Over the past week here in King County, someone was hospitalized for COVID-19 every three hours,"" said Chow, the a… https://t.co/KtvzUzC6c6",sandycompany,,-0.25
58,"@FortuneBrion @FlossObama your not wrong, though your not right. perhaps the trans woman even deserved the award. b… https://t.co/mf8s4zHZ7n",SeawardBj,,0.053571428571428575
59,@TheHockeyInsdr @barstoolsports Name one healthy professional athlete in American sports that was effected in a ser… https://t.co/uFdtvWg76z,ChazReece,,0.19999999999999998
60,"I didn’t post this to humiliate this young woman, no one deserves to be made fun of. Obesity is a mental and physic… https://t.co/s0CfIf6u9C",bud_cann,"Greenwich Village, NYC",0.10000000000000002
61,@mask_bastard Cures for all disease and 40 billion dollars worth of diamonds.,ArcadeLoverX,,0.3
62,Calling charges on obvious flops is becoming a disease,RandallSteven,"mountain view, arkansas",0.225
63,"#Baretta star #RobertBlake #dies of heart disease aged 89
 https://t.co/syD0TzBrpN",pinkbassist,Toronto,-0.1
64,short torso disease,hrrysmelomania,📖: (1/48),0.0
65,Interesting.. but Selena fans didn’t go after Selena for purposely ridiculing Hailey and making fun of her. But the… https://t.co/ZTFk8IF7hb,kennytesconi,"New York, USA",0.4
66,#DYK it's #WorldKidneyDay? I'm asking @SenJoniErnst to support increasing funding to $15M for the @CDCgov Chronic K… https://t.co/67W9hdVjKT,lindsaykeegan,"Cedar Rapids, IA",0.0
67,Easy E died during Saturn in Pisces bc of an uncurable disease.,shirleywirleyyy,"New York, NY",0.43333333333333335
68,@Matthew11778102 @ElaineCarol3 @richardzussman I’m quoting what Dr. Peter Chin-Hong who’s an infectious disease exp… https://t.co/cHDdgbfHRi,McalexMcintyre,"Port Moody, British Columbia",0.0
69,@bennyjohnson Probably light headed from myocardial disease,Cerekson3,Az,0.4
70,"@ToastMalone__ @ChadGPT_Chadbot @LibertyAnders So, if 1 in 3 men were dying daily from a single disease, it's a minority so no worries?",Susan_E_J_USA,"Planet Earth, The Milky Way",-0.03571428571428571
71,@quasar9uk @JamieJaime10 @KatyBruce108 @MEAssociation @actionforme I feel ill I don’t really feel tired. Tiredness… https://t.co/yfWKSBsAa2,DressFor_ME,Mostly housebound in the UK,-0.2333333333333333
72,Covid19 is devastating to the gut....and what's devastating to the gut will harm the brain. Taking measures to heal… https://t.co/pd1eA6Z2Rx,ChristineArnot4,"Oakland, CA",-1.0
73,NANA links immune exhaustion and accelerated memory deficit in diet-induced #obese #Alzheimer’s disease mouse model… https://t.co/MYNh1g32P0,LabWaggoner,"Cincinnati, OH",0.0
74,"@tracy_landi Thank you so much, Tracy. I pray you are well in your journey with this disease 💕",Royal_Flyness,Location: Adjacent To The Stunt,0.2
75,Why Am I Having Heart Palpitations? 14 Possible Causes https://t.co/MrmhWrDyPl from @WebMD;,JohnJr_1334,"New York, NY",0.0
76,@thew8ofkiszka Jealousy is a disease ❤️,twistedlucks,DIG Albany,0.0
77,"@YesWombat Like most older cats, he does have kidney disease. He's on daily medication for it and carefully monitored.",CatsOfYore,Vermont,0.14166666666666666
78,Rest in Peace my brother-protector-teacher. You fought valiantly from the day I opened my eyes in the world to the… https://t.co/6pFCZsrHFs,thetravellingG,,0.0
79,#alcoholawareness #InternationalWomensDay  💚#Health #BreastCancer- Alcohol is a major risk factor for breast cancer… https://t.co/AlDv4fLWpp,fscarfe,Greater Vancouver,0.0625
80,Preprint: Aberrant phase separation is a common killing strategy of positively charged peptides in biology and huma… https://t.co/SGxn05IU5x,NeuroGen_papers,"Grand Rapids, MI",-0.03636363636363636
81,"When crooked teeth are ignored, it can cause gum disease, tooth decay, breakage, and excessive wear and tear. To sa… https://t.co/FpbCheKneu",Smile4uDentist,"Mumbai, India",-0.125
82,@bendellwerry Because basically everyone these days has a mental disorder since everyone acts like anxiety and ADHD… https://t.co/GK2lWa7nZ4,PotluckLauren,"Jackson, MS",-0.1
83,@W3AllFallShort ALS is a cruel disease. So sorry for your loss.,LoriThecatlady,"Alabama, USA",-0.75
84,@TexTexington @JustinTrudeau @POTUS I'd be interested as well. Women seem to be affected more by autoimmune disease… https://t.co/yTy2cZsywq,simplesarahbear,"New Brunswick, Canada",0.375
85,"Would you rather:
-Live in constant fear of catching a new disease that will maybe kill you (2020)
-Live in constan… https://t.co/nDfMa8iBLh",sm,United States,0.2018181818181818
86,"@RedState I wonder which other disease he might have caught in Mexico. 
Watch out Mrs.
 Newson.",PeterLarouse,,-0.125
87,@leavemebe33 A disease,microbette,she/madrnah,0.0
88,@Coloradosandsto Vaccinated people not getting a disease prove it is helping. If vaccinated are dying obviously it… https://t.co/Jdg7lt2NuE,OAkhahenda,Nairobi,0.0
89,"@GolfElkLife @DrSusanOliver1 There's no explanation there of how.

How do covid vaccines cause prion disease?

Please cite the study.",DebateOnFacts,,0.0
90,"nobody told me how much having some kind of Body Hurt Disease would fuck up my SLEEP
like you get so tired because… https://t.co/OpAv6ilhta",lazyjunebug,bed,0.13333333333333333
91,You are my disease.. https://t.co/N7RPpCFdHl #goodmusic #musiclife #musicmake #newmusic #musicvideo #viralvideo  #Poverty #tweet,wildbluethistle,,0.0
92,jealousy is a disease get well soon https://t.co/zmsl1Btupy,iliwysyara,NeoCiTy,0.0
93,"@PERK_GROUP Step 1. Sexualize children
Step 2. Force vaccinesvon them for a sexually transmitted disease
Step 3. Ra… https://t.co/CtNltRl819",LMorgocon,,0.5
94,"#Depression &amp; #Alzheimers disease share genetic roots​ https://t.co/beR7wmO4yW

#dementia #mentalhealth https://t.co/3eaOu58wFq",LEAD_Coalition,"Washington, DC",0.0
95,"#RobertBlake, Actor Acquitted in Wife's Killing, Dead at 89 from Heart Disease https://t.co/HY4KdKG79j via @people",Cardel444,"Montreal, Canada",-0.2
96,"@Phaze311 @AnnaToccara @lizzo This is so embarrassing lol. Genetics, illness, medication, disease, accessibility, p… https://t.co/0Nnxi0lhsg",saraelizabeth,"Ohio, USA",0.8
97,"@SenatorWicker @POTUS This is simply not true. Not even in the top 10. More young people (&amp; how are you defining ""y… https://t.co/7W5U8VERDH",LHCBMatt,"Free State of Enon Holler, MS",0.23124999999999998
98,"Having a great time at NED APS meeting presenting our work on apple scab disease forecasting using biologicals. 

C… https://t.co/x9aGrquKdT",ligaastra,"Ithaca, NY",0.8
99,Stable fitness during COVID-19: Results of serial testing in a cohort of youth with heart disease - https://t.co/h6aTY7IDRB -,Dataemia,United States,0.0
100,@emeriticus The hate disease has infected his mind,BigWestHenry,The Big West,-0.8
101,"Saint Gurmeet Ram Rahim Ji insan always guide us that ist happiness is disease free, we should never intake non veg… https://t.co/OZYsECUXlN",Priya49211910,"Bhiwani, India",0.55
102,Our health is most valuable wealth.A healthy person is someone free from disease. Saint Gurmeet Ram Rahim ji guide… https://t.co/4nV0TPbrJN,DeepaMahajan18,"Gurdaspur, Punjab",0.4666666666666666
103,Healthy life is precious thing of one's life. But due to consumption of junk food all are suffering from diseases.… https://t.co/BcVz780bc1,2501_kitty,,0.2916666666666667
104,"@LarryPinkley1 @Project_Veritas @albanyschools @emeadowschools Oh it will change, most certainly will. I look forwa… https://t.co/lJO1hBDhLB",JeffRus02898670,,0.35714285714285715
105,"Long COVID Now Looks like a Neurological Disease, Helping Doctors to Focus Treatments - Scientific American https://t.co/XDr6knVD3i",LKSLTweets,"Michigan, USA",-0.025
106,Q&amp;A: The challenges of curing hepatitis B https://t.co/1fDWv6HbiE,ViralEd_Hep,"Lake Harmony, PA",0.0
107,"FWIW, when Cal Ripken was coming close to breaking Lou Gehrig’s record for consecutive games, many  Yankees fans we… https://t.co/ofA29Vr3w6",DocMary75,Lake Tahoe,0.5
108,"@halfdebate @misterfitzie @PeterWelch 3. disease, and like LDL it's a repair mechanism.

it's indicative of BigPhar… https://t.co/rhhpuengQz",MasalaFry69,,0.0
109,@souphttp Over-description is a disease and these days it’s a pandemic. The best writers can tell you how something… https://t.co/kW3QBdHNEs,hunderscorep2,,1.0
110,The early days of antibiotics must have been a heyday for organic chemists. Tweak one bond on the molecule —&gt; entir… https://t.co/GCnnJIquHa,jasonryanmd,"West Hartford, CT",0.1
111,Stem cell therapy to treat his autoimmune disease https://t.co/IWUhCdhisl #giveCUDDLY #IBelieveinKindness,jatkat45,"Boston, MA",0.0
112,@2010voyager @patriciaselfies @TuckerCarlson The medical examiner said the knee to the neck for 9 1/2 minutes was t… https://t.co/raOwaZ3RQG,clewis7711,,0.0
113,"@chuck_dc Exactly! Hubby has Meniere's Disease (ringing in ears, vertigo &amp; hearing loss) &amp; I have to watch all sodi… https://t.co/rTpFt9uI6N",CynPhil67,"South Carolina, USA",0.25
114,Bahadur Shah Zafar: This Mughal emperor had such a painful disease that he relied on amulets to treat it! https://t.co/qplMVhVrbQ,hmmnews1,,-0.35
115,Friedreich’s Ataxia (sometimes shortened to FA) is a disease that slowly damages the nervous system over time. Raym… https://t.co/m9hwA2z0vO,IndependentInst,"Oakland, CA",-0.30000000000000004
116,XzKg* Cancer is a deadly disease.    #上海 #天津    #青岛         https://t.co/hg53jIxNLu,SyedaaHamid,,-0.2
117,"@CrabbBrendan Is this the reason?

People, even those with expertise in the medical field, mixing up viruses and di… https://t.co/ctryTcpqjD",amysoyka,,0.0
118,"RIP Robert Blake aka Baretta. Age 89, possibly related to heart disease. Wishing everyone good health.",LaniMinella,,0.35
119,"Disease, normally as walking, running, or ball-playing. Sow
use this
_bath_and_body_onass_NOON_promo_NON_TOYOU_To_y… https://t.co/PUOlo4IejS",glorimabe94,,0.15
120,Our health is most valuable wealth.A healthy person is someone free from disease. Saint Gurmeet Ram Rahim ji guide… https://t.co/eBNeI1Fh1y,Love_Insan_1525,"Rajasthan, India",0.4666666666666666
121,Wanting strangers to get up 70K to put wigs on random ass women’s heads shopping for candles n shit when there are… https://t.co/74F98kAbkk,OGyoungstar_,,-0.5
122,@vickivaliant You are ✨iconic✨ &amp; oh what’s this? nothing got done to your account 🤭 i want them to know that jealou… https://t.co/iBwgc9Aep0,rosyhime,Twitch,0.5
123,"@Nayade_bleu @LakotaMan1 lgptq ideology effects others to their detriment, with death and disease and disfiguration.",Justin46thPotus,,0.0
124,Your Chad fact: many foodborne disease outbreaks are caused by contaminated hands. Scrubbbbbb #HandWashBot #ChadFact,SGUHandWashBot,Grenada,0.5
125,i forgot i'm not allowed to to say this out loud but i have a very real neuro degenerative disease that has been af… https://t.co/qiHUIDbrK8,ArmageddonSpeak,in the void between the winds,0.18
126,@Oficial_RC3 Sir i want to involve.... Football saved me when i got a disease at 15.......i lost alot of time due t… https://t.co/17HzKQJzBA,VIKLAKRA,"New Delhi, India",-0.125
127,@gtconway3d @NatlParkService How about some well to do MOC’s step up and sponsor Port-a-Potties and wash stations i… https://t.co/IMKpL5Nopr,itsmadeinPhilly,Southampton,0.0
128,@CovidSolidarit1 @BarkingMaad Diagnosed with Crohn’s Disease within 6 months of having COvID and GERD much worse following COvID.,ProudHeadTeach1,,-0.2
129,"Liberalism is quite literally a mental disease.

https://t.co/L2lYJgAEZI",NotBizz408,"San Jose, CA",-0.1
130,"@haveaconcern And yet, it's common throughout all recorded history, as well as nature.

It's one of 3 ways nature c… https://t.co/BcCva1G7gi",twinnymctwins,"Tallahassee, FL",-0.3
131,"I’m just a girl plagued with Silly Little Beverage Disease, currently sipping on a rose flavored milk tea with boba. Would recommend",melissafronczek,,-0.021875000000000006
132,"@halfdebate @misterfitzie @PeterWelch 1. Well some people might not like the taste of saturated fat laden food, so… https://t.co/IBxOQkUboJ",MasalaFry69,,0.0
133,@agaraladi @SenatorEnrii Like eeeh... Wisdom is very far from most people in this country. All they do is recycle i… https://t.co/xPzyTeC5lP,Ellanaomi17,,0.315
134,Ram Ka Naam is such a medicine that cures every disease. Saint Gurmeet Ram Rahim Singh Ji Insan says that if we med… https://t.co/qvGfGp6M56,Sukhpreet__k0ur,,0.0
135,"❤️Please donate blood!
illness, disease, accidents…
never takes days off.

Did you know that every time you donate… https://t.co/VNgcITmfKh",BrenDee85,PennsylvaniaUSA ,0.0
136,@HillBilly_Baby It's a mental disease.,LovesCanada8,Any area immune from BS. ,-0.1
137,"@GrantSceptic @HugoGye Vaccines didn’t prevent transmission, you’re right. However they did reduce it and they redu… https://t.co/LEurNZxjdX",bunnyb3r,,0.2857142857142857
138,Our health is most valuable wealth.A healthy person is someone free from disease. Saint Gurmeet Ram Rahim ji guide… https://t.co/MxN19fiLwh,insan8_ritesh,,0.4666666666666666
139,Ram Ka Naam is such a medicine that cures every disease. Saint Gurmeet Ram Rahim Singh Ji Insan says that if we med… https://t.co/iBSkvA0SAu,PriyaCh65154521,,0.0
140,@CCVagina I'm so sorry. We've lost 3 of our kitties to cancer and 1 to kidney disease over the years....it never gets easier.  =(,PACPurdue96,"Oregon, USA",-0.5
141,.@US_FDA the #ALS community delivered you a petition to grant #NurOwn a transparent and informative AdCom three mon… https://t.co/00N7G72epY,KarenSu34511139,,0.0
142,@RealVeerSatlok @e_chaurasiya @LordKabirsaheb @MuktiBodhbook @SaintRampalJiM @DeviyaRanii @RealShardha… https://t.co/ZvxcCY0Sih,VeerSatlok15,"Hyderabad, Pakistan",0.0
143,@holzenkrieger What about catching an anti- social disease?,dudmont66alt,"St Paul, MN",0.31666666666666665
144,"Not surprised. Nationalism can be a disease, that shows symptoms of superiority and selective everything. Less then… https://t.co/e200qo8Mcu",ByLazaruss,Bicoastal | Bicontinental,-0.10833333333333334
145,"#MedTwitter #Psychiatry
#psychology

Life and our response to life's ups and downs are not a disease to be cured.… https://t.co/0PDSdg9wqw",CarlosVSdWorld,Fail-ippines!,0.0
146,"@john_odocoileus @realpeteyb123 Every bit of its true, and he forgot ivermectin as well. Like Donald Trump said… Th… https://t.co/np92raERFf",ChaseBeckett52,,0.35
147,"We now have a Center for Disease Control that spies on us, censors us, and tries to force shots known to kill and m… https://t.co/wUUjUtyGMh",johnrackham82,America,-0.1
148,"@beverleyturner They were afraid of a disease that killed 6.9 million people, world wide &amp; you were afraid of a vaccine.",DoubleDumas,@doubledumas@universeodon.com,-0.375
149,"@S_LeGresley @MSNBC They are criminals for breaking the law. They are your prostitutes, drug mules, disease carrier… https://t.co/zBzYAATKcX",MacciniBen,,0.0
150,"@Insan_0777 Earlier, my body was so weak that i couldn't even stand for a little long time but now the regular prac… https://t.co/VkIQXMmWrc",Duniyatu1,,-0.12250000000000001
151,Swallow Impairment in Parkinson's Disease: Revelations from High-Resolution Videomanometry. #geripapers https://t.co/vpuCX9BMNV,geripapers,,0.16
152,I'm excited that Medtronic is partnering with National Kidney Foundation to help raise awareness of kidney disease.… https://t.co/j3k4bxiJ0O,JessieJeanPrice,"Hugo, MN",0.375
153,"How to protect yourself against chronic kidney disease, a silent killer, and recent advances .. - https://t.co/HIhdvE4pZH #GoogleAlerts",kidneystories,"Crown Point, IN",0.0
154,@Lizpowe08720708 @oregon_mom_ @IamTravisNelson None of what you've said here resembles reality. The vaccine is free… https://t.co/aFJlbNC7mI,carlaaxt,Oregon,0.4
155,"@anishkmitra @pepijn_breimer I don't do it, because I fear my heart would stop, but I read a really compelling stor… https://t.co/gjQsgkajpn",zack_again,United States,0.3
156,@TerryTiller3 @KellyMartin02 @PsychRecovery @HannahFreedrich @MalleyGlass @ReadReadj @ClinpsychLucy @LisaTMSA… https://t.co/H1ImTiJ3ga,AngelaH22168221,,0.0
157,"The thought of having to need or want brand ""to speak to me"" is a concept I just cannot and wont ever grasp.

Havin… https://t.co/3v07zMB0hK",MSyno1," ""¯\_(ツ)_/¯ "" ",0.0
158,"Blake died in Los Angeles, his niece confirmed to CBS News Thursday. She said he died after a battle with heart dis… https://t.co/wZ0iebiy6i",CBSPhiladelphia,"Philadelphia, PA",0.4
159,Mental disease ‼️ https://t.co/a0I4zsChnu,ThisIsMy4th,USA,-0.1
