,tweets,user,location,polarity
0,".@AcastiPharma submitted to the FDA the full protocol of its GTX-104 for a Phase 3 safety study of a rare disease,… https://t.co/DQhTJyCy5n",BioTuesdays,,0.32499999999999996
1,"I’m just waitin for the zyn gum disease articles to start dropping, y’all some goofballs for doin that stuff",romacastellanos,"San Antonio, TX",0.0
2,Hair loss is a new disease. Or they just don’t get any sun ☀️ https://t.co/GTWCyc2ZY8,SateiMC,3rd Keeper,0.13636363636363635
3,"On 𝗪𝗼𝗿𝗹𝗱 𝗢𝘃𝗮𝗿𝗶𝗮𝗻 𝗖𝗮𝗻𝗰𝗲𝗿 𝗗𝗮𝘆, we stand together to support those affected by this disease. This year's theme, ""𝗡𝗼 𝗪𝗼… https://t.co/IjIPLTUnQK",Healiuscancer,"Bengaluru South, India",0.0
4,"Male #incontinence can be caused by any of the following:

❗️Weak bladder or pelvic floor muscles
❗️Overactive blad… https://t.co/x4nf27gzsW",doctor_khurram,پاکستان,-0.125
5,"Honestly, I don’t blame Shereé and Marlo for being mad as hell. Jealousy is a disease. Kandi is on a whole other le… https://t.co/Dz9KxxPcjp",RHLegend32,"Los Angeles, CA",0.012499999999999997
6,@Naija_PR Clout chasing hell of a disease 🦠 sister 👩,SylvesterChi2,,0.0
7,"As Michael J. Fox promotes a new documentary about his life, his fight with Parkinson's disease becomes more diffic… https://t.co/8sVsy2JwrQ",knowknewz,New York City,0.21212121212121213
8,News &amp; Views: Assessing the genetic and cellular changes that underlie human lung cancer as it evolves could aid th… https://t.co/lKdyv0l4sA,NaturePortfolio,London,0.0
9,"[REPOST]

LF: Academic Commissioner 
TASK: case study focus lang po sa 
FOCUS LANG PO DITO
- Case
- Disease Discuss… https://t.co/iiQBz9kz3Q",s_hadow13,,0.0
10,@ForestryComm With regard to Ash dieback disease......I sincerely hope FE will be felling infected trees only?  #StandUpforTrees,bridge_53,Towcester,0.25
11,"Many people aren't aware of the full nature, scale and scope of Covid and the long tail of the disease, Long Covid.… https://t.co/CEUbyj9OcC",elisaperego78,,0.2
12,@TJSD4E @jkw_thfc @yestradamous @mike_hamm @prageru pregnancy is a curable disease,mashittis,"Texas, USA",0.0
13,"When you’re an economist who normalized mass disease, disability &amp; death among the nation’s children for profit and… https://t.co/kFZkxek8dj",LauraMiers,"New York, USA",0.0
14,"ICYMI: We completed the acquisition of CSI, a leader in systems to treat cardiovascular disease.

Together, we’re c… https://t.co/LWOh1SLDID",AbbottNews,"Abbott Park, IL",0.0
15,"The Irish made soups with the Seamoss, made it into drinks and ate it whole.

They believed it offered nutritional… https://t.co/cArluOhg4V",RameseSanders,"Florida, USA",0.1
16,Awesome... what do you do when the cure is worse than the disease... you double the genocide by combining it with m… https://t.co/ZlYBWf855c,collinlhenley,,0.19999999999999998
17,"Read ""Infectious disease detectives are puzzled by a mysterious spike in brain infections in Nevada children. One d… https://t.co/2Zli2w63zQ",Charley58115169,,0.0
18,"""Every year, about 476,000 people get #Lymedisease in the United States, &amp; the two groups with the highest infectio… https://t.co/ONFDZqi0DT",BayAreaLyme,"Portola Valley, CA",0.0
19,@timmy_nault how many of us have said 1 day @ a time ? You are a courageous person to tackle a difficult disease. M… https://t.co/U2qVzt9C9F,nisman_s,"Plainview, NY",0.0
20,"#ChildrenOfTigray who are forcibly displaced are extremely vulnerable &amp; are likely to suffer from disease, malnutri… https://t.co/RavsJapnnC",RJjst8,,0.0
21,"@ViroLIEgy @virusisaunicorn @JamieAA_Again So if something behaved exactly as a virus, and had a structure almost i… https://t.co/VZ0YmPxqK8",Tetrahydropyran,,0.25
22,"@Jannyleigh63 @Jezus_s @Michael_Yon No, actually, I’m a member of the Democratic Party. But the Republicans have go… https://t.co/TVtLxv9Y9w",suzygra,,0.0
23,High Dose Vitamin D May Treat Incurable Diseases: Experts The sunshine hormone reveals surprising effects on severa… https://t.co/zVu3qdg4YV,bellado611855,,0.12
24,@PProsseco @J4LYN @Adam30508905 @zookumar @EmeraldApple6 Its sobering to me to think that the bible prophecy sugges… https://t.co/lMNULni7eM,LouiseBrookes8,"Wimborne Minster, England",0.0
25,"JOB ALERT: We're seeking a sessional instructor to teach foundational principles in pharmacology, drug effects on h… https://t.co/06EviWH886",um_pharmacology,"Winnipeg, Manitoba",0.0
26,"@52Kii @WHOWPRO That study is over twenty years old. Even if if were true, some of the benefits may be outweighed b… https://t.co/PMty4sxwQ6",ergosphere_prop,,0.22499999999999998
27,"@LuxmooreS We do need more of these,
like an antidote
to a disease. 
So think of more
It's not a chore,
and it's ea… https://t.co/IxHUviY5UU",BelfastRhymer,"Belfast, Northern Ireland",0.5
28,@Tigrai_TV #ChildrenOfTigray who are forcibly displaced are extremely vulnerable &amp; are likely to suffer from diseas… https://t.co/sMLLQqet7M,RJjst8,,0.0
29,"@downshutpinks_ existence mo puro hate, it's a disease at this point lol get some help, there's a life outside this bird app",athenahatesu,personal acc of @mygiyunki,0.0
30,"@varmitage27 @LukaszukAB @ABDanielleSmith In the 1930's, Hitler positioned the Jews as ""spreaders of disease"" to tu… https://t.co/KTxJUXqYKd",BillMallory,,0.0
31,"Together, these findings raise interesting questions on the evolution, physiological significance, and disease &amp; me… https://t.co/uqh2NkWedp",ivy_lxiong,"Los Angeles, CA",0.5
32,"@muriukikirimi25 @amerix Cancer, heart disease’s &amp; diabetes is a bonus",Karmaka18207069,Malta,0.0
33,"Alzheimer's caregivers face special challenges. Whether you provide daily caregiving, participate in decision makin… https://t.co/MAQq0SuDif",AlzGPA,Pennsylvania,0.17857142857142858
34,@ArchyPunished Both sides-ism is a disease,emehlan,🇪🇪 (20),0.0
35,@EamonK10 @raffles343 @RestIsPolitics @campbellclaret @RoryStewartUK @GerryAdamsSF That’s the English disease… and… https://t.co/7hrYi67mMU,4drun,"ÜT: 51.443731,0.0167667",0.0
36,"Vaccine vs RSV, common but deadly virus, approved - Ground News https://t.co/qYiFJgG4Tx The US Food and Drug Admini… https://t.co/YilgaKBMDp",TheAsthmaCures,USA,-0.25
37,i wanna look like lee arknights so baaaad man it’s a disease,mn_crw,any/all (18),0.0
38,"@Morning_Joe According to the Centers for Disease Control and Prevention, the maternal death rates in Arkansas, Ken… https://t.co/QF88t5zNsD",annesmith2,Little Rock,0.0
39,Vedanta Biosciences Receives Fast Track Designation for VE303 and Presents Phase 2 Data at Digestive Disease Week… https://t.co/mSfuGfaewS,MedlockGreg,"Cambridge, MA",0.2
40,When the body is not able to produce apt hemoglobin then the disease of Thalassemia arises.Saint Gurmeet Ram Rahim… https://t.co/4b3RXoQATy,SnehGar11713703,,0.175
41,"DISEASE 🦠

DEATH ☠️

DESTRUCTION 💥

Coming to an American neighborhood near you https://t.co/geWk77wJjg",redcandlebaad,"Placerville, CA",0.05
42,Please share x this song is about our son brother nephew Callum who fought 9 months straight his life was taken to… https://t.co/TPIfHrDelN,Sophieogden19,"Liverpool, England",0.2
43,@Beigemania @undercoverman Such an awful and cruel disease. A sad day.,Mr_barriebach,United Kingdom,-0.625
44,@stillgray This is the disease called woke or progressive policies.,CharlieDonahue4,Africa,0.0
45,@MrUnIimited Looks like a disease.,ChristophCFC,,0.0
46,"When d crusader went to 1 of the state in d poverty reach region AKA northern Nigeria, he mistakenly got bitten by… https://t.co/vSseWQ569k",BashFarhan,Kebbi/Kaduna/Abuja,0.0
47,"@rightsideofmoon @AndrewM43671072 @WalshFreedom White supremacy is a disease that can infect anyone, no matter their skin tone.",RaeMieA,United States,0.0
48,Wish we didn’t have to mark #WorldOvarianCancerDay but it’s important to draw attention to this horrible disease th… https://t.co/mYJggt8Svx,DinaGusovsky,"New York, NY",-0.3
49,@waltermasterson The only thing that can save us from heart disease is a good guy with a butter,burpsknows,"Philadelphia, PA",0.35
50,@EdKrassen @TasteYourShake Is hate a disease?,KSteoger,,-0.8
51,@MsPottingShed @mancunianmedic To be fair I may struggle to answer any questions on radioiodine or thyroid eye dise… https://t.co/yxPZGV4nuq,emmaspencer1975,"Huddersfield, England",0.7
52,"""I see firsthand how this disease affects children and their families, so I'm proud to play a role in this effort.”… https://t.co/l9O8yaPsVX",NeuroOnc,,0.8
53,"@FOS You know Dan Gilbert’s son passed away yesterday right? Little insensitive to put this article out now, don’t… https://t.co/umfDdCywx2",JoeBecerra_,"Burbank, OH",0.04910714285714285
54,An important acknowledgment of potential overdiagnosis risk from treatment of screen-detected indolent disease in E… https://t.co/ZSLeSR3fZW,hsbalata,UK,0.2
55,"There are several reasons why an individual may benefit from the use of a stairlift.

We help those dealing with…
i… https://t.co/17MkOQJuSm",Acorn_Stairlift,Nationwide,0.0
56,@supermariot1m3s @niji_fans_para covid as disease still exists so…,toriyal_,u better don’t know ,0.0
57,"Is Your Pet Overweight? 🐕🐈🤔

Overweight and obesity in pets is both a primary disease and the root cause of many… https://t.co/6AmpHIY1Dj",bark_whiskers,,0.45
58,@drkeithsiau Willson disease ( kayser fletcher ring ),alshawam,Egypt,0.0
59,@JonathanNefro Dense deposit disease is a subtype of GC3 characterized by the detection of electron-dense deposits in the GBM.,DanielaGD14,,0.0
60,i will surrender my disturbing disease to god. Please give me miracle cure i dislike going to hospital anymore 🫠,AridzJ,"Jeddah, Kingdom of Saudi Arabia",-0.5
61,"@DStan58 yeah i can't vote in my own poll, but i disapprove,lol,.... but i respect their contribution while dislike… https://t.co/jlF9Wg9UfV",gregawashington,in a galaxy near you,0.7
62,"Effective &amp; recommended diets for heart health: Mediterranean, DASH, healthy plant-based (but avoid excess sugar &amp;… https://t.co/AV7G5PpayY",250HealthyFoods,"Marlow, Bucks, UK",0.55
63,"@SKavalakat Yes, Nehru was a victim of a terrorist by name Venereal Disease. Its name was syphilis  and because of… https://t.co/5vGwPoECSj",kumarchellappan,Kochi Kerala ,-0.07500000000000001
64,"@Nazmo130 @BeRuzzia Nope,this woman had cardiac disease and her husband asked one nurse to give her meds to avoid h… https://t.co/onsH9DSPzC",ULHYSSE,,-0.05
65,"Flossing every day is a crucial way to fight cavities and prevent gum disease.

Read the full article: How to Preve… https://t.co/tOghAZC3oq",LAWRTW,"Florida, USA",0.175
66,@anetraarchivist jealousy is a disease and i have it 💔 i gotta step my game up,anetraism,they/she/he | 18 | 🏳️‍🌈,-0.4
67,@GreenSwelfares Thalassemia disease occurs when the body does not make enough hemoglobin. Revered Guru Saint Gurmee… https://t.co/xxN8Yh1zBS,S0nu775283634,"Abohar, Punjab ",0.0
68,World Thalassemia Day is a global healthcare event commemorated every year on May 8th to raise awareness about the… https://t.co/PidLBznVl6,jyoti_nursing,,0.0
69,Radiologists may bypass using contrast dye for patients with severe kidney disease or contrast allergies to avoid c… https://t.co/QNBENp2RId,UMichMedScience,"Ann Arbor, MI",0.0
70,"@KSekouM Cats lower blood pressure!

They also lower your chances of developing heart disease &amp; hypertension!

Pett… https://t.co/qdm8p2bYqW",LA_Knight89,Arizona,0.0
71,"According to the CDC, about 3 million Americans have Glaucoma. But what is Glaucoma and how can you know if you're… https://t.co/p5ymuTdaFv",AVisionCenter,"Charlotte, North Carolina",0.0
72,Im telling YOU ITS A DISEASE https://t.co/FEvi5c1oH8 https://t.co/vtJRG2a23J,ptrinrzlkhh,,0.0
73,"@Injam09 @SamKhan999 😂👍 

Hinduism + Islam + Christianity + Judaism+ Sikhism+ All other Thousands of religions = Mental Disease",Michael62798855,,-0.1125
74,"@TomTalksMoney_ Don't mention the word bread to me again. Think I've found out the issue I've been having...

Poten… https://t.co/MTOzuzXciV",jasperinvests,Wednesday Dose Of Knowledge →,0.0
75,@SenSanders Ban McDonald’s cause heart disease is the No 1 killer in the US,josephb90210,,0.0
76,"Whenever I review a chart and see ALS (Lou Gehrig’s disease), I remind myself that there’s no reason for anything r… https://t.co/kXYlQ5h8nE",marvlsdead,,0.0
77,@Zvoutete14 If they wish to die I think they should be allowed to die in dignity. If you've ever cared for a termin… https://t.co/IKryuMo6bT,James33065220,CT37,0.0
78,📢 Interested in Alzheimer's disease and neuroinflammation biomarkers? Check our our review led by @andreibieger jus… https://t.co/HuwdAE2OrC,sm2luiza,"Rio Grande do Sul, Brasil",0.25
79,"hi everyone I'm finally back

diagnosed with a relatively serious mental disease but pretty glad to be back out of… https://t.co/hu5mtaMTnV",hwa_upd,pup/they,0.05277777777777778
80,"Latest @WHO DON on
Marburg virus disease outbreak in Equatorial Guinea and the United Republic of Tanzania. 
https://t.co/YoTBAUTKfD",DrAbdiMahamud,"Geneva, Switzerland",0.5
81,Democrats are saying let them in and denying the costs of this #invasion. Less pay &amp; fewer entry level jobs affecti… https://t.co/HHp2SeRgeT,FLRouleau,Florida,-0.16666666666666666
82,@emmaspencer1975 @mancunianmedic I would normally but have radioiodine treatment in the offing with an accompanying… https://t.co/1XWuppD1Z5,MsPottingShed,East Sussex,0.15
83,"CONSENSUS PAPER on CELL DEATH....
Apoptotic cell death in disease—Current understanding of the
NCCD 2023 just publi… https://t.co/FjnkN2CkQC",melino_G,,0.0
84,Congratulations to @VirusesImmunity and her lab for being awarded the prestigious Else Kröner Fresenius Price. For… https://t.co/E4mb3rABvc,cstroeckw,"Vienna, Austria",0.0
85,Blood is not formed in Thalassemia disease. Saint Gurmeet Ram Rahim ji inspired people to donate blood to help thal… https://t.co/SpqILtMoq8,SanjuVerma51415,,0.0
86,New Technique Rapidly Detects Parkinson’s and Chronic Wasting Disease - https://t.co/XYDfdJpsUs via @neurosciencenew,OrchidAdvocacy,,0.13636363636363635
87,Won't this dramatic shift in neuronal representation drive the majority of these so-called DEGs?  Single nucleus RN… https://t.co/RidMAbNx4T,LinvilleRaleigh,"Cambridge, MA",-0.2523809523809524
88,@my_perspectiv3 @Docwithnocause @Kishor_Ayu Diabetes is an ongoing disease. You may be able to get glucose control.… https://t.co/IgcIvaraen,sankisurgeon,North India,0.5
89,"@georgegalloway @MoatsTV It’s not the guns it’s a fracturing society, Treating the symptom not the neoliberal disease won’t work.",eveyaus,,0.0
90,@StuartP97208909 @emmakennytv @Ofcom @ClareCraigPath You might find this helpful. Don’t forget  that if spike were… https://t.co/icyO4B1CJb,thornhill_kyle,,0.0
91,@charliekirk11 Title 42 ends when communicable disease no longer a threat.(we still have several threats of antibio… https://t.co/lO4BbszW9I,vbeezs,,0.0
92,"I’m not really surprised at these findings: Fabry disease is still underdiagnosed, especially among women, a new st… https://t.co/YsxphsGf58",LorettaMacInnes,,0.028787878787878782
93,The high priority group includes older adults; younger adults with significant comorbidities (e.g. diabetes and hea… https://t.co/ptijuizFhR,shepherd_123,,0.17541666666666667
94,@DrjouanTaheri Non-necrotizing granuloma. Crohn disease most likely. Other less likely possibilities are TB and sarcoidosis.,yro854,New York,0.04166666666666667
95,The idea that women should immediately return to normality or even work after birth is a western mental disease.… https://t.co/mxmthfWRya,Porkchop_EXP,,-0.05
96,"@Goodtweet_man I can see a painful terminal disease scenario, but homelessness?",ravracc,Connecticut,-0.7
97,"#GodNightMonday
 There is neither disease nor fear of death in Satlok.  There is no lack of anything.  Every person… https://t.co/Ckl3DrodIU",RajniPr88655155,,0.0
98,{Fighting Stigma} Cognito Therapeutics Announces Poster Presentations at the International Society for ...: The pre… https://t.co/XYnUQ6LN1K,stigmabase,Worldwide,0.0
99,@JeonBigdickLuci Yes MyKnightV actually had some really life threatening disease so they sadly had to archive it. O… https://t.co/WUr3hwWmHy,jungcookies_koo,16/she/her/listning to indigo,-0.09999999999999999
100,@MaxVerkerk @ImForbesbtw @faithwillsaveu @PicturesFoIder Clearly you are saying misconceptions. God does not bring… https://t.co/oO17lE33x0,Carticort,"Bulawayo, Zimbabwe",0.10000000000000002
101,"The World Health Organization ended the Covid-19 global health emergency on Friday, saying it was time for countrie… https://t.co/zh52ZKvgDX",PaulaRecruiter,"Atlanta, GA",0.0
102,"At GSK Germany, we put great emphasis on developing and producing vaccines that can impact millions of patients wor… https://t.co/diSYfNFo34",DipoOlawale,London and Nigeria,0.8
103,mind you people are comparing the lighting of The Little Mermaid to the lighting of Game of Thrones…film twitter is… https://t.co/5jPIxY8vYB,aficionad0__,,-0.29375
104,"Only hope would be smashing some prostitute, whatever disease they got can’t be worse than this 😭 https://t.co/98iR1BE4gD",EvankhellSzn,135th Floor ,-0.2
105,URGENT: Rare disease patients need your help by supporting the Access to Rare Indications Act. If you live in one o… https://t.co/Idy1DSRkTc,StoCANcer,"Los Angeles, CA",0.2465909090909091
106,porn is a disease https://t.co/PIevQwP6zx,belluhsm,de,0.0
107,"@robertlufkinmd Stupid question, but wouldn't that mean that those treating their Celiac Disease (which my mom has)… https://t.co/x2Wr4I66qU",ManhattaKnight,"Manhattan, NY",-0.3125
108,"@Jen94006752 @MyBeaversUnit Fact: There are different human races. For example, some genetic conditions are more co… https://t.co/B03UIlnPlg",BlindOwl101,,0.16666666666666666
109,@DisbussingFilm @Variety I was today years old realizing vin disease voices groot,TheGreatHubleni,hahsa,0.1
110,"Did you know heart disease, cancer &amp; chronic respiratory diseases are top killers of American women? Prioritize you… https://t.co/ifRzT7Wn8b",rx_less,"Dallas, TX",0.25
111,"Too many dead bodies - not dead from disease or old age, but dead from REPUBLICAN POLICIES.

I'm DONE WITH the GOP. How about you?",HonorDecency,,0.06
112,@JakeSunding @WillMathis2 @JayDelivers2U @OuchThatsSharp @KingAodh @JoshuaPHilll 'The findings are based on an anal… https://t.co/QDyZdodptj,Legion_1183,Earth,0.0
113,"@rebelledeb @Eric_Conn He stands alone. As a man, though disabled, disease-ridden, broken...I can tell you yoga pan… https://t.co/qM0yLfWRn9",Bloodproveslife,Phoenix AZ / USA,-0.30000000000000004
114,"BOOKBUB99p/c
If you altered MAD COW DISEASE to infect humans
And fed it to your enemies
Death would be down to Natu… https://t.co/O4Hz9HkljR",AYPuckett,Somerset,-0.30462962962962964
115,"Neurologist Samuel Gandy, MD, PhD, comments on a clinical trial from drug manufacturer Eli Lilly, finding that an… https://t.co/DxrsoXmMi3",MSHSNeurology,"New York, NY",0.0
116,@MajToure999 Heart disease. Medical misdiagnosis. Both over 400K per year.,live_free_603,New Hampshire ,0.0
117,@BFW The Natural is boring?! Bad tweets are a disease...,benTbachman,"Starkville,MS",-0.5333333333333333
118,"@naturalandwell Should be sub-titled “How to Dramatically Increase Your Odds of Cardiac Disease, Liver Disease, Pan… https://t.co/F34NTGHbW7",dean_geno, Brighton UK/Chicago US,-0.05
119,"@LozzaFox @GBNEWS @ABridgen @FraserMyers Ranitidine passed as safe by MHRA, now withdrawn due to to cancer concerns… https://t.co/2YeodgNdug",MaxHead76231746,,0.1875
120,Neural spike signatures determine the behavioral presentation of cerebellar disease https://t.co/vvWRpxQbAY,aDNA_papers,Japan,0.0
121,"@LindaMacintosh2 @STR2out @PLACEEdinburgh @Airbnb Yes, like a bad disease, it has spread across the world",Brew_ster82,Northern CA,-0.6999999999999998
122,@FatDag My doctor is always telling me I'm too young for all the bone issues I have from my auto immune disease. Bu… https://t.co/d2HUY5OdVd,Amanda6t6,,0.1
123,World Thalassemia Day is observed each year on the 8th of May to raise awareness about the disease &amp; how we can hel… https://t.co/gy9IC774Aq,LabsNxgen,"Lahore, Punjab, Pakistan",0.0
124,@FoxNews @RepBarbaraLee Lol that State is going to be even more broke. They're trying to spread the liberal disease… https://t.co/bR5Cjb2YdV,BrettnerBruce,"Ashland, KY",0.65
125,⚡️Did you know that one of our use cases models #DiseaseOutbreaks of African Swine Fever by studying 🐗wild boar pop… https://t.co/KaMiOyXp6X,BiodiversityDT,,0.05
126,"What gets me about the dismissal of BM saying obesity is a problem?
 ADOS BM ALL have women in our lives who have h… https://t.co/GGpqeKLcqb",Rhythm1975,"Atlanta, GA",0.0
127,disease called having too much brian kang wife i forgot his stage name https://t.co/9r7HL4M92x,easterlily_mp3,"27, SEA, she/her",0.2
128,@TheTNHoller @GovStitt @PBSKIDS It is difficult read Republican's posts since they all got some weird disease that… https://t.co/9BrDvdwJ4N,toliver,The South,-0.5
129,"superior in the treatment of #chronic #disease / conditions. Overall, the two systems have different philosophies a… https://t.co/h9sc1d5kcQ",ExposomeHealth,"RTP, USA",0.2333333333333333
130,"@Kena09947635 has dedicated her work to helping the Ontario potato industry, specifically for pest and disease mana… https://t.co/KT0OzhyYf1",SpudSmartMag,Canada,0.0
131,"@laurenboebert This will be a health crisis!    When I entered the U.S. legally, I was required to have a health ev… https://t.co/c79JaFgIdH",knockdonfrontdr,USA. ,0.2
132,Beech Leaf Disease in RI 2023 Update: https://t.co/p2cGQgpb27 This guide was produced in collaboration with Dr. Ric… https://t.co/dY78gPRQCF,CT_CAES,"New Haven, CT",0.0
133,"Don't let Lyme disease catch you off guard! Learn the symptoms and take preventative measures.

Protect yourself wi… https://t.co/VWQzkmkGw5",MosquitoMiami,"Miami, FL",0.0
134,"@GuerrillaVille 35 years of consuming every non fiction disease history and public health book, documentary, tv sho… https://t.co/BG8Z7PrqqH",JenMindelen,"California, USA",0.0
135,I'm at the library spreading disease,HauntersMelody,"Boone, North Carolina ",0.0
136,"@svscarpino The lack of accommodations, the removal of required masking in medical settings, the absence of prophyl… https://t.co/o7QKFoWtqM",2022onward,,-0.00625
137,@SaharaReporters joblessness is a disease,bigdaddycool247,,0.0
138,Bwahaha… my overnight sleep tests results are in. Onset of sleep latency 2 MIN… I FEEL VINDICATED!!! NOTES: Test in… https://t.co/M9IDVq5YRl,WhitneyWickham,"Scottsdale, AZ",0.0
139,@_Juzzle I’ve got a personal family relation to the disease and I didn’t take it well,hollowrdx,"805, california.",0.0
140,@don14231 @MarkXx22148533 @Dhmcgrath77 @Victorshi2020 The previous administration:(May 2018) disbands the White Hou… https://t.co/EJeWbV5DCd,RCGme1,,-0.08333333333333333
141,"@SueNBCBoston @gorskon Also, living longer with government-inflicted chronic disease isn't necessarily ""a win"".",CarlaGericke,"Manchester, NH",0.8
142,@j_smithcameron Thank you. My grandmother was diagnosed with stage 4 in the late 90s and miraculously made it 5yrs… https://t.co/4IXucA4Ir2,Heather_MBL,,-0.3
143,HATE is a disease. Don't hate anybody not even a religious or political opponent. It may destroy you but YOU too. P… https://t.co/n8Zg7d59qM,Arslankataya,"Karachi, Pakistan",-0.36
144,We don't actually have to live with  frequent respiratory disease infection: airborne transmission mitigations redu… https://t.co/lLKeyuBiAZ,volatrader,volatrader@mastodon.social,0.07878787878787878
145,"Mukumu Girls: Students return after deadly disease outbreak

https://t.co/bkEyhBzjxS",NationAfrica,Kenya,-0.2
146,@MelissaSulewski I follow this power lifter on IG who caught Lyme disease. They didn’t know what it was until she h… https://t.co/mRMMrM7lpF,raggelyass_peas,,0.0
147,"@a_musingcat This is why I was so excited, and completely unsurprised of course, to see software developers become… https://t.co/sI5z7PEh4c",jkakar,Vancouver,0.2375
148,@paganhindu Wtffffff!!?! Why the f we aren’t extinct yet! Humanity is a disease!,_HCrane_,Gaslit chamber,-0.4
149,@broomedocs @Eleytherius New section at the end of every Research Roundup: venereal disease poems written by Casey??,First10EM,"Toronto, Canada",0.13636363636363635
150,"@brit GM, Brit! 🌻🌞

""No disease that can be treated by diet should be treated with any other means. : Maimonides""… https://t.co/nIUBv5h22B",GoldenMongoose,Mumbai ,-0.125
151,"@robbotrip @peaches_england @dr_barrett Well that’s not true, is it? Not least because a mildly ill person will be… https://t.co/8NwbFvPsMh",lairy_poppins,,-0.17500000000000002
152,"In Indonesian, diabetes used to be called 'sakit gula' that means 'sugar disease'. https://t.co/ghvCrDrdiS",y2thrive,Xanadu,0.0
153,Dr. Brickman is particularly interested in white matter abnormalities and the intersection between vascular disease and Alzheimer's disease.,alzdemjournals,,0.125
154,@linzer_pants Setbacks are normal in the disease.  Abstinence is really hard for addicts.,MyVirginMind,"Decatur, GA",-0.07083333333333335
155,"@jaimeschmidt GM, jaime! 🌻🌞

""No disease that can be treated by diet should be treated with any other means. : Maim… https://t.co/0MlnKiuY7K",GoldenMongoose,Mumbai ,-0.125
156,One of the lessons learnt from India’s handling of the Covid-19 pandemic is that the response to any future disease… https://t.co/lZ8tec4zZH,vkjha783,,0.0
157,"In the new @NASA Acres program, led by @UofMaryland, the space agency aims to aid #foodsecurity. With help from… https://t.co/SyDEarGFbS",GrapeResearch,"Sacramento, CA",0.13636363636363635
