,tweets,user,location,polarity
315,"It was #RareDiseaseDay yesterday, and u know I never really talk about the “rare” disease I live with (bc it’s bori… https://t.co/NKH3uMyaT1",positive_trans,Near London,0.11212121212121211
316,@husmani91 @LoriLightfoot You know we don't live in a democracy we live in a constitutional republic. People like y… https://t.co/RABuUrQzWN,Chitownwlidcat,"Florida, USA",0.13636363636363635
317,"Global Initiative for Chronic Obstructive Lung Disease 2023 Report: GOLD Executive Summary

A new definition of… https://t.co/kqdDwGkYHa",ATSBlueEditor,,0.06818181818181818
318,"""Nice touch"" by IA GOP to try to ban teaching about HPV vaccination in school. 😡
Vaccines were invented because pra… https://t.co/uujKYt143k",hwprattii,,0.6
319,@squeaky_jasper @JuicyGatorade What's y'all's headcanons on fat furs? Do YOU think they might have higher chances p… https://t.co/Wtuk7bEJHz,ShawthePig,United States of America,0.25
320,Yesterday Bettridge fundraised for Rare disease day by wearing bright colours and stripes! This is the globally-coo… https://t.co/2SQVzerdP4,BettridgeSchool,"Warden Hill Road, Cheltenham",0.3333333333333333
321,"Go yellow 💛 this #March Supporting #MarieCurie 
I bought my #daffodil attachment dog for dog collar
Im one of the l… https://t.co/3YJcwCxVJ5",AndreaJackGoro,"From York, live Huddersfield",0.125
322,@lookingfortheto it's like a cute disease,hewhoeatsfaces,,0.5
323,@Triode_in_situ @doc_singing No vaccine has ever eradicated a disease.  And polio still exists by the way 🙄,GinaZippiHicks,"Costa Mesa, CA",0.0
324,Can Crohn’s Disease Cause Colon Cancer? https://t.co/zBNaFcDuX0 #HealthCentral via @HealthCentral,mirletaliz,"Cincinnati, Oh, United States",0.0
325,@TrueNorthCentre If Dilbert had said white people are a disease and should be exterminated (quote from Joy Reid MSN… https://t.co/2pu0fj5YvS,rmanders60,KIngston Ontario,0.4
326,"@mmmofti @AdamMaina_ Like any disease,  the effects of Jungle Fever can be devastating.",T90Diesel,,-1.0
327,Jealousy is truly a disease,nompiloMabena18,"Johannesburg, South Africa",0.0
328,"@JEverettLearned Just recently heard from the ""news"" that erythritol ""may cause clotting"". The study itself shows:… https://t.co/qHGT2krwUE",Servi_Regis,"Florida, USA",0.0
329,Nurses make a distinction between disease (something is malfunctioning in your body) and illness (how you respond t… https://t.co/6G8W2bFFLd,fungusandalgae,,0.0
330,"Why is the @US_FDA making it harder for our children to live?

Enough is enough. We need treatments, and we need th… https://t.co/xIGSok0fQz",SikhFeminist,New York City; South Florida,0.009090909090909087
331,@corbinsabol @WhiteHouse And how does that help Type 1 diabetics who need insulin to survive? You fo realize Type 1… https://t.co/oPPOXVlUFz,wildwooddays03,,0.0
332,@simon_ekpa @PeterObi Failure is a normal thing for the obedient followers. They never get it right the first time.… https://t.co/qKRr83XrBW,ikemefunn,,0.15380952380952378
333,@PARareDisease It was a great day! Now we look forward to continuing to advocate for rare disease throughout the rest of the year!,PatientWorthy,,0.55
334,People were living in poverty before Brexit. People were relying on foodbanks before Brexit. Wages were shit before… https://t.co/BbNomgqY1W,WarmongerHodges,,0.0
335,@JayDlegend i don’t see the use issue in chopper not being able to fix it. it’s not a disease or sickness,StrawHatStixo,"Costa Mesa, CA",0.5
336,@UWaterloo @UWaterlooSPHS What is UW doing to ensure students and staff are as protected as possible from contracti… https://t.co/nFu5Lg2XU6,whollyholls,Canada,0.0
337,@MkeLibraWI92 @sukihanagoat 💯 Hoes love to project instead of being happy for the next it’s a disease!,SlaylaMarie88,,0.43333333333333335
338,"@Jamiehop27 Religion is silly. 
So is thinking that depression/anxiety is a disease, rather than a symptom of human… https://t.co/F8f5DzyTxm",drodegennaro,"Brooklyn, NYC",-0.25
339,"Heart disease is awful and I’m finding it hard to cope, now. The clogged arteries have caused me to feel sick, numb… https://t.co/CFdjHzOrqN",ChloeNi35754172,,-0.6514880952380953
340,to drive medical and biomedical research and innovation for neglected health issues. We believe that team work can… https://t.co/WhQIQSKxO3,InosanBiopharma,,0.0
341,"IBD healthcare professionals wanted!

Researchers at King’s College London are looking to help people living with i… https://t.co/kKoS7O4ysm",BowelResearch,"London, UK",0.0
342,"Only muslims can cure this disease. No tolerance for this insanity. 
https://t.co/CUeJPVPFvD",asirfurqan,Occupied Land,0.0
343,"Our CEO, John James, spoke to former colleague, Gurneet Kaur Bains, Head of Capability @DHSCgovuk '...sickle cell i… https://t.co/GyxCw0oXWe",SickleCellUK,London,0.0
344,#NowPlaying Thetworegs - Disease at https://t.co/JNfC3Ouky0 https://t.co/jtVvoiw0v2,rpmradiostream,,0.0
345,When safety/public health education from the 1910s is the same as 2020s. Top is an ad from 1912 advocating for the… https://t.co/12V0yuUpSQ,BGW_Archaeology,,0.16666666666666666
346,"Yesterday, February 28th, was #RareDiseaseDay. In this article for PM360, SVP of Analytics John Mangano explains ho… https://t.co/AsoqehkVdl",DeepIntentInc,"1450 Broadway, FL. 23, NY, NY",0.0
347,@JessHan92073869 Carbs are the key to life. Keto dieters are worse. They are literally eating themselves into kidne… https://t.co/R9JSFzgQRR,antlila333,"Louisville, KY",-0.2
348,"First trachoma, then chlamydia, now maternal sepsis. 

#Azithromycin is a single dose magic bullet searching for a… https://t.co/9PVsMs6bca",himmoderator,a Canadian in NYC,0.2261904761904762
349,"March is #NationalNutritionMonth! 🥬🐟 According to the @USDA, Americans should be eating #seafood twice a week - it… https://t.co/38Mn9xNmS6",BAP_Seafood,"Portsmouth, NH",0.0
350,'Yil+ Cancer is a deadly disease.    #上海 #天津    #青岛         https://t.co/tVGYs9HNUN,anabanana2232,,-0.2
351,"@PinkArtist5 when a person meets and loves dogs, then it turns into a disease! I WROTE ONCE THAT THE GREATEST LOVE… https://t.co/ymjxbV2JLU",radmilpet,"Belgrade, Republic of Serbia",0.75
352,@CivilLost @SariellaForever @BabeTruth2 @FearlessExpress @megafant1 @MichaelSteidel @brad_feinman @th1rt3en_TM… https://t.co/gfOXAv5k9B,MurphyYuiko,Anytown USA,0.0
353,Evidence for a connection between coronavirus disease-19 and exposure to radiofrequency radiation from wireless ... https://t.co/jLBHnsZYD7,DebraB713,,0.0
354,"Every word of this article is critical. Please give it a read.

""In addition to raising children with debilitating… https://t.co/OHCVfioBNp",RiaanResearch,"New York City, NY",0.0
355,Come and learn more about Chronic Kidney Disease this Saturday! @Ward8Dems @HillcrestWard7 @chenderson… https://t.co/sY0fdJpI3m,SWhitPhD,"Washington, DC",0.5
356,@Random__Dents @MarkAll26740409 @Chatty_si @DowdEdward i have a theory why excess death its lower in Easten Eu;in H… https://t.co/sB5Usgq9Jl,JazzillaJ,,0.0
357,"#MAGA is a mental disease characterized by low mental acuity, poor comprehension skills, and subjective logic: (1/2) https://t.co/f866BMSDJy",AmericaInTheMi1,"Memphis, TN",-0.15000000000000002
358,"Angelica was once believed to be the magical flower to cure any disease, and while it’s strictly not true, there ar… https://t.co/ss27nHho7Y",embouchic,,0.1625
359,@aaatyxszjy @shaunrein Just like sometimes people live until 100 and sometimes people get heart disease and live un… https://t.co/xD0VBeB1Nj,ericEnEspana,"Madrid, Spain",0.13636363636363635
360,it’s the day after rare diseases day ask me ab my rare disease,mariiluluna,"she/doll, fatphobes/allspo dni",0.3
361,"Yesterday was World Rare Disease Day, dedicated to raising awareness for the ~300 mil. people living with a rare di… https://t.co/tzM1Yn6wZ7",FatherJenkinsND,,0.3
362,"the disease are mistakenly attacked by a person’s immune system, which stops hair growth. In addition, there’s a ge… https://t.co/X4GiOWczn0",42_rodulfo,,0.0
363,"and just like that a brand new meme was born, that’s not what the discussion is all about. I am interested in how i… https://t.co/EGStj0xOAZ",42_rodulfo,,0.19318181818181818
364,the most severe case of pretty face disease https://t.co/JumWN2UVgY,jieuky,,0.375
365,Frontotemporal Lobe Dementia accounts for 10-20% of all dementia cases and is less well-known than Alzheimer’s dise… https://t.co/5w2neykoAd,MorrisPsych,"Parsippany, NJ",-0.16666666666666666
366,.@AmericanCancer releases new #ColorectalCancer Stats in time for #ColorectalCancerAwarenessMonth.… https://t.co/jObOVURA8C,CAonline,Atlanta,0.13636363636363635
367,@InstMathew @simon_ekpa Illiteracy is a disease,gentleblizz,"Owerri, Nigeria",0.0
368,"Scientists warn fructose can drive Alzheimer's disease. Foods high in added fructose include sauces, salad dressing… https://t.co/fTdrO7YTvl",elliotthetrainr,"New York,NY",0.16
369,"Today, @arifkamalmd is sharing key findings from the 2023 Colorectal Cancer Facts &amp; Figures Report. Colorectal canc… https://t.co/wAxoOeaznc",AmericanCancer,United States,0.0
370,https://t.co/Xibtw0nZQf The #myocardial #infarction benefits of #aspirin use are offset by #statin use in patients… https://t.co/kwygfUiCjk,HPE_magazine,London,0.0
371,"💚 No matter the day or time, taking the time to recognize a rare disease, condition or syndrome is crucial. Happy C… https://t.co/TlTONrVt5q",ADAWebAccess,,0.3666666666666667
372,@BrainAblaze The zebra was chosen to represent rare disease based on a quote from Dr. Theodore Woodward: “When you… https://t.co/uh84B5Dxem,yarrowsr,Occupied Pomo Coast,0.3
373,"Beverly Biller, MD, Harvard Med School and Massachusetts General Hosp and  Maria Fleseriu, MD, Oregon Health and Sc… https://t.co/jXD0qHoMji",CheckRare,New York,0.05000000000000002
374,"Many factors can cause chronic back pain. These range from inherited conditions to degenerative disc disease, to re… https://t.co/an7Bb8PkRG",PlasJamesMD,,0.25
375,"Where do we stand with #optoacoustic #endoscopy and why is it worth bringing it to the #hospital?

Answers in the r… https://t.co/F41vaSTbau",MunichImaging,"Munich, Bavaria",0.3
376,"""It was very hard, definitely confusing as a kid, and I remember just being very scared,"" says Jodi Young about wat… https://t.co/ijmemcleXd",LFPress,"210 Dundas Street, Suite 201, London, ON",-0.09479166666666666
377,"""It was very hard, definitely confusing as a kid, and I remember just being very scared,"" says Jodi Young about wat… https://t.co/ipSXAnC8xL",nationalpost,Canada,-0.09479166666666666
378,"""It was very hard, definitely confusing as a kid, and I remember just being very scared,"" says Jodi Young about wat… https://t.co/RETFdMZ5Jr",OttawaCitizen,,-0.09479166666666666
379,🧵two of my incredible cousins will be running 5k in may in memory of my grandad. they're raising money for Pulmonar… https://t.co/2ppwLfGO9N,bethjennid,"manchester, england",0.9
380,@Shivkryadv @Sthanu5 In ddx MYH9-related disease,Faisal_khaled_s,"Riyadh, Kingdom of Saudi Arabia",0.0
381,"Building a stronger heart can help prevent major risk factors that contribute to heart disease, and in the process,… https://t.co/gnnr6Z0RO0",ecfmgcareers,"HQ in Philadelphia, PA",0.0625
382,Did you know that 1 in 3 Americans are at risk for developing kidney disease? Luckily most kidney disease is preven… https://t.co/4XZ9IZXljA,HillsdaleHosp,"Hillsdale, MI",0.5
383,"Sign up today for @worldwidetrials webinar on rare disease day events!

Attendees will hear from a panel of patient… https://t.co/355uBU7cvV",Xtalks,Online,0.3
384,New @AmericanCancer #Colorectalcancer statistics 2023 out today in @CAonline  shows rapid shifts to more advanced d… https://t.co/kOmZUAyTj3,ACSNews,"Atlanta, GA",0.34545454545454546
385,What to Know About the Study Linking a Popular Artificial Sweetener to Cardiovascular Disease https://t.co/ImPqU8dIUn #general #feedly,SBarlow_ROB,Toronto,0.0
386,@reallaurenleigh It's about how to humanely get rid of rats considering they're wonderful intelligent social animal… https://t.co/TMEkYR1bsG,plentyofalcoves,ATL|patreon.com/StrucciMovies,0.6111111111111112
387,"#SaferSex means being ready when the moment hits. Make sure you are ready, and have condoms mailed to your door by… https://t.co/ZJKxG4hL6B",sehdph,"Waycross, GA",0.3
388,"@LainieandHarry @AlexBerenson You didn’t know 🤦🏼‍♂️
“More women than men die of heart disease every year…..Heart di… https://t.co/sMyJ47guvf",Rodman743,US,0.5
389,"New: Report shows more colon cancer cases found in younger people.

Overall cases of colon and rectal cancer are do… https://t.co/erGmE7Sx8C",TeddyAmen,"Washington, DC",0.1590909090909091
390,My mate had to cancel our plans cause she's got shingles. Ole henry 8th ass disease,Elly_hxy,Liverpool,0.0
391,@TRHLofficial If only there were a way to cut down on the severity of the disease. Oh well.,jeninthe405,Surrey with the fringe on top,-0.07777777777777779
392,@RepAndyBiggsAZ The report does not conclusively say covid came from a lab leak. The organization that does not dea… https://t.co/upzECRasoE,dave_salmonson,,0.0
393,"Unfortunately, there can be a link between GI conditions like Crohn’s disease and your #oralhealth. Here’s what you… https://t.co/9IF735RWVH",RenBenefits,United States,-0.5
394,"@Veganism_Ethics @GiveMeBanHammer You dont want any money just screm in people's faces, block roads, virtue signal… https://t.co/8nJcR5QHrk",businissus,,0.0
395,@FizzbuzzMEOW yeah I've heard of mad cow disease before D:,NimonoSolenze,,-0.37916666666666665
396,"In 2023, an estimated 153,020 people will be diagnosed with this highly preventable disease. Getting screened early… https://t.co/hM2cH6scBT",GraceAdvConsult,"Lexington, MO",0.13
397,"mRNA Vaccines are a Sham. People are Being Injected with Nanotech
The mRNA cationic liposome nanotechnologies are… https://t.co/2LB1cxk4fa",LilithKnight3,off-world...most of the time,-0.2
398,"Learn from some REAL doctors to help bring #health #wealth and #Happines 
https://t.co/1w8itUZKjW 

#HiveBlogShare… https://t.co/UzrLbKmz8T",IamAtmaLove,Hive,0.2
399,The #mRNA cationic liposome nanotechnologies are being used to introduce non-human #DNA into the cells of adults an… https://t.co/sbDBOb0Svv,lombardigabi03,Land of the free!,0.0
400,Interested in living longer? Living a #healthy life includes staying hydrated. How much water should you be drinkin… https://t.co/j79XcRoPbJ,neuralert,"Philadelphia, PA",0.225
401,"January on the left, last six months on the right

I have severe brain disease https://t.co/Fer3ydpxE6",hawk_1009,"North Carolina, United States",0.09523809523809523
402,Researchers from the @UofG are using social media platforms to improve disease surveillance and public safety. Thei… https://t.co/7f6kywcqJn,ORIONNetwork,"Toronto, Ontario, Canada",0.016666666666666666
403,@palminder1990 @CTVNews Just the need to compare whether COVID-19 or vaccines pose a greater risk of heart problems… https://t.co/xYZ3IKaZvy,TonyHui99,,0.5
404,"And if you don’t know what an autoimmune disease is, think of AIDS or HIV, two of the more well known diseases. All… https://t.co/gtGj3ZxP9c",BadaZ76,"Eating RAM rn, dont bother me",0.5
405,"Hey everyone….
Just received news, I’ll be going to the hospital on Friday for a Lumbar puncture. They’re gonna tak… https://t.co/T3v182SEZu",BadaZ76,"Eating RAM rn, dont bother me",0.0
406,Nathan's Story; Tay-Sachs Disease in the Irish Population https://t.co/k9SwiePwIA via @YouTube,dawn_debaker551,"Huntingdon Valley, PA",0.0
407,"""It was very hard, definitely confusing as a kid, and I remember just being very scared,"" says Jodi Young about wat… https://t.co/XHWUoKkyTh",theprovince,"Vancouver, B.C.",-0.09479166666666666
408,"Taking vitamin D supplements in old age helps to protect against dementia, new research suggests.

The study author… https://t.co/jpoEGfuRMd",TimesScience,"London, UK",0.11818181818181818
409,"This is one of the worst cases of ""Like Disease"" ever diagnosed. The poor creature uses the word ""Like"" 36 times in… https://t.co/nxndotEVNf",JosephEToomey,,-0.7
410,Colorectal Cancer Awareness Month is a time to shed light on a disease that affects millions of people every year.… https://t.co/gKQriLhsix,M3WakeResearch,"Raleigh, NC",0.4
411,Consumption Of Cannabis On A Daily Basis Found It Could Lead To Heart Disease https://t.co/PEFiHu47vY,VC_vidanews,,0.0
412,"Similarly, if NAbs are dropped, memory B cells may be able to replenish situations snappily. It may not completely… https://t.co/B4z1rFgXca",vitaminsmylife,,0.15
413,Researchers from @USDA_ARS recently studied the U.S. honey bee's genetic diversity to ensure the crucial… https://t.co/fK4G9tktCy,USagricultureUK,"U.S. Embassy London, UK",0.0
414,"This drop is seen especially in people with mild or asymptomatic disease, in whom the antibody response tends to be low in the first place.",vitaminsmylife,,0.14583333333333331
415,"📰📯 NEW ARTICLE IN PRESS!
Computed tomography severity score as a predictor of disease severity and mortality in COV… https://t.co/aAkP4hnhrR",JMIRS1,Canada,0.13636363636363635
416,RSV vaccines for older adults &gt;60yo and neonatal protection (via vaccination of pregnant women and transplancental… https://t.co/mRTkDS3PcL,boulware_dr,"Minneapolis, MN",0.25
417,"Call for Papers! Neurosurgery is seeking papers related to Global Neurosurgery on a local, national, regional, or i… https://t.co/idF9W7gdJa",NeurosurgeryCNS,"Schaumburg, IL",0.0
418,"IJMS, Vol. 24, Pages 4790: Targeting Measurable Residual Disease (MRD) in Acute Myeloid Leukemia (AML): Moving beyo… https://t.co/8W0O4R6U74",myjournals,,0.6
419,@scrippsresearch @flaneuseks Clearly Scripps research is not a real research company....Kristian Anderson decided i… https://t.co/G8sKEYt5bC,MistairRogers,,6.938893903907228e-18
420,@DrJamesOlsson He has Lyme disease and other co infections before vaccination. Bells Palsy is also linked to Lyme. https://t.co/YfUmVWRo02,lorrainedamonte,"South East, England",-0.125
421,#KidneyDisease can be caused by diseases like #Diabetes and #HighBloodPressure. About 1 in 3 adults with diabetes a… https://t.co/8JPqVDiVop,CuraScriptSD,"Lake Mary, FL",0.0
422,"@cenkuygur Wuhan is a city of, like, 12 million people. It's the largest city in the area. It's not even remotely s… https://t.co/iW3axQ0cXa",nonsense_hurrah,,-0.1
423,"Did you know? 🤔🚭

Most people who smoke know smoking causes cancer, lung and heart disease, but not that it also in… https://t.co/MmCBmRiPQU",DerbyCC,"Derby, England",0.5
424,"Janssen is pleased to be at #ECCO2023, presenting new data from across our portfolio of therapies for treatment of… https://t.co/5tqkQFjqWP",JanssenGlobal,"Raritan, New Jersey",0.3181818181818182
425,Support the immune system help increase disease resistance by improving the state of the gut.  MSP[RS] strengthens… https://t.co/VAgb9qDJXt,pighealth,Carberry Manitoba Canada,0.0
426,"@sanderhamburger Did you read the article? 

https://t.co/ahOLqNM6cG",sentimentstock,Orange County,0.0
427,@BoSnerdley The “disease of the unvaccinated “,KenBigdaddyP,"Arkansas, USA",0.0
428,"We missed posting yesterday, but Maddie's Miracles supports #RareDiseaseDay each year to help raise awareness of th… https://t.co/kh5wcjk9j2",Maddies_Miracle,"Reading, PA",0.0
429,@Shareef085 @the_beardedsina It’s not anti phospholipid syndrome is a disorder where one of the symptoms includes m… https://t.co/IlAOLyPKKy,Varnessa28,"Lagos, Nigeria",0.0
430,.@NYUDental researchers developed a topical gel to treat gum disease by blocking a receptor for a metabolic byprodu… https://t.co/bPSy9oZJq2,nyuniversity,New York,0.05
431,"DYK? Access to telemedicine encourages:

✔️ Disease management
✔️ Appointment attendance
✔️ Optimal clinical outcom… https://t.co/asPUbcTjNM",telehealthadv,,0.0
432,WEATHER WARNING turf disease Anthracnose https://t.co/K3rU6WfG6B,newarkweather,"Newark, OH",0.0
433,"There are several surveillance and protection zones covering Lancashire

https://t.co/cbdene4m06",lancstelegraph,Blackburn,0.0
434,The story of warfarin is incredible! From a mysterious cattle disease to rat poison to one of history's most prescr… https://t.co/Y3SyP9pHeF,NephJC,twittersphere,0.4666666666666666
435,@DavidWolfe Omg this is a lie. Yet again trying to blame everything except the true cause of all of the heart disea… https://t.co/dbSJ0YqiVV,All_En_Long,United States,0.35
436,"The primary symptoms of Parkinson's include tremors, stiffness, and difficulty with coordination and balance. Learn… https://t.co/fvqTTKKvVF",CareAtHomeCT,"New London, CT",0.4
437,Read more about the valuable rare disease research that @JessHarts and others in BMG are performing 👇 https://t.co/flvyr4Fg3Z,um_bmg,Winnipeg,0.4
438,New @HHSGov report focuses on addressing disparities and inequities in Alzheimer’s Disease care in the US. https://t.co/ZKHwGMzt7h,AlosaHealth,"Boston, MA",0.13636363636363635
439,"Two NYU research teams are among the 64 selected by @statnews for #statmadness, a virtual tournament celebrating re… https://t.co/w31GBIME2S",nyuniversity,New York,0.0
440,"Human feces and urine contain a motherlode of #healthdata: 'Smart toilets' detect daily fluctuations, serious disea… https://t.co/PP6d3T276g",medical_xpress,,-0.02976190476190476
441,"As Americans continue to live longer, the risk of developing valvular heart disease as valves age increases. https://t.co/n46DJeAgPS",mfldclinic,Wisconsin,0.13636363636363635
442,"There are over 100 types of #arthritis and related conditions, with a common denominator of pain! Senior Planet Hea… https://t.co/9ggnZKywY2",seniorplanet,"New York, NY",-0.15
443,AATD sometimes shows up in newborns as liver disease caused but the buildup Olof alpha-1 Antitrypsin deficiency. Ea… https://t.co/odB2yZbzZw,rda_aatd,"New York, NY",0.0
444,"🇯🇵 ""Water removal"" in Nara · Todaiji Temple... Fire powder brought by disease-free breath falls

# society #japan… https://t.co/MabU39dcMB",imminent_news,,0.4
445,"@apmassaro3 They were suffered from the disease of blindness. But the truth is, if west stops to supply weapons, Uk… https://t.co/XGt55ewQ9Q",santosbhusal,,0.0
446,"When fear is expressed, we recognize it as anger, abuse, disease, pain, greed, addiction, selfishness, obsession, c… https://t.co/BIOeXrNa7t",iamariamh,,-0.7
447,"@IanARowe As a liver transplant recipient in 4/10/2018, I certainly don't think of time I lost by having liver dise… https://t.co/UzZYZPbZgi",HealNAFLD,Washington State,0.21428571428571427
448,"""It was very hard, definitely confusing as a kid, and I remember just being very scared,"" says Jodi Young about wat… https://t.co/PAH7fppYCu",mtlgazette,"Montreal, QC",-0.09479166666666666
449,"From same study as previous:

""assoc's of serum 25(OH)D w mortality, particularly due to cardiovascular disease (CV… https://t.co/PJWoEzmTU7",NutriDetect,👇Visit My Website👉,-0.09722222222222221
450,"Again, here are some health risks associated with nagnesium deficiency:

- Anxiety
- High blood pressure
- Heart di… https://t.co/pcSpDQ3R09",NutriDetect,👇Visit My Website👉,0.16
451,I should tell my mom I'd rather kms then live with an un-curable skin disease,Ash_kiss3r,i got lost :(,0.13636363636363635
452,Yikes!&gt;”..evidence from animal studies suggests that long-term exposure to dietary #acrylamide could also increase… https://t.co/YRKu37imkG,CometsMum,Canada,-0.05
453,Z~Ra{ Cancer is a deadly disease.    #上海 #天津    #青岛         https://t.co/YLuZNxnKMC,marioyluigi1,,-0.2
454,"@TheyreLying1 @jwgain01 @RepThomasMassie I take it you have NO idea how the immune system works. 

Maybe start ther… https://t.co/xsB95fSmQ7",MCCH2021,,0.0
455,"Low vitamin D levels should concern you

Here are just a few health risks associated with low vitamin D levels:

-… https://t.co/ltQCHkIQjH",NutriDetect,👇Visit My Website👉,-0.06666666666666667
456,@CheffCrenshaw @jleetxgirl @amuse Mad cow disease really,Littleb18769439,,-0.18611111111111112
457,@succubvni looks like a disease,isaiah222real,,0.0
458,@VigilantFox @DrTinaPeers …and if you think a modified incomplete version of the C-19 spike protein will cause infe… https://t.co/NVqHwpuPnt,archie_chat,,0.0
459,"@jakeshieldsajj The one thing anyone with half an iq point in the USA knows, is you cannot tell queer people, what… https://t.co/jPuAZqLhUK",SOSuperficialty,NWA,-0.16666666666666666
460,Proton pump inhibitors (PPIs) - These are drugs used to reduce the production of stomach acid and treat conditions… https://t.co/hfR0NvLRYn,iPareshHavaldar,"Pune, India",0.0
461,"Antibiotics - Antibiotics are a class of drugs used to treat bacterial infections.

Statins - These are drugs used… https://t.co/rhxi9y9wKu",iPareshHavaldar,"Pune, India",0.0
462,"hey #Republicans , your problems dont end with Trump. You chose him, supported him, lied for him &amp; still cower to h… https://t.co/EaxFC7dzCe",R1ch1e5,"Rock, Space, Universe, ?",0.0
463,"Asthma has been associated with Churg-Strauss syndrome, an autoimmune disease and vasculitis.",AsthmaCauses,Worldwide,0.0
464,"@hemantmehta As a parent, aunt and friend of many who have been dx'd with autism...

I believe ALL sickness and dis… https://t.co/J5m0Q7OIMX",itstime4battle,Here and there,0.5
465,"Maybe I have a different understanding of this virus than these researchers but really?

It would be interesting to… https://t.co/E89BHIF4XM",jvipondmd,"𝙲𝚊𝚕𝚐𝚊𝚛𝚢, 𝙰𝙱",0.2333333333333333
466,"mRNA Vaccines are a Sham. People are Being Injected with Nanotech
mRNA cationic liposome nanotech are being used to… https://t.co/9tie8XOf5d",ZeWorldWildWolf,,-0.2
