,tweets,user,location,polarity
461,Let’s hope it hits crickets &amp; kills off the push for us to start eating them over meat?? 🦗🦗Ranchers warn disease th… https://t.co/Twjj5pbWFW,Sabre31686865,,0.0
462,@neutralcharge2 @Jwindfield1 @IanCopeland5 According to your logic. Everyone who had covid should’ve had cardiovasc… https://t.co/k7c9Y5PAuH,Rightorwrong76,,0.0
463,@diannaeanderson It is attitudes like this that caused  a rift in the family almost 20 yrs ago when my immediate fa… https://t.co/09gUrngpit,EerieGnuVeneer,"☄Hotspot, Deutschland ",0.0
464,seeing people be done w their exams while I’m not gonna be free until 15th feb … yeah jealousy is a serious disease.,9files_,IG: sutsukki | studytwt,0.033333333333333354
465,@amuse Has anyone else. Felt   the effects of B.S. (Biden Syndrome) a curable disease that effects you mentally spi… https://t.co/7hQSXZkTyn,kevinnewsom181,,-0.1
466,"@thegoldenbub @lacontroller @kennethmejiaLA Noise, fuel, &amp; light pollution are linked to dementia, heart disease, v… https://t.co/efg9sUHlEb",HowTheWestWS,California,0.4
467,It’s actually so sad. She’s disgracing herself with every social media post. Was never a fan but she’s gone crazy.… https://t.co/20AHgFxChG,IngridStone21,,-0.35555555555555557
468,Losing even one woman to cardiovascular disease is too many. Our wonderful team @hopkinsheart bayview cardiology cl… https://t.co/JzDA7xZCGj,EstherChoiMD,"Baltimore, MD",0.75
469,@AustinJayPatton Sounds like an incurable disease.,fightuntil,Germany,-0.5
470,"Heart disease is the leading cause of death in the U.S., but it can be prevented. We wear red today to raise awaren… https://t.co/z0YmuWH2l5",thundermisthc,"Woonsocket, RI",0.0
471,"@DrJamielinho @BrownHospMed Parkinson's disease
The death of neuromelanin-containing neurons located in the midbrai… https://t.co/l5I4JsOLwV",Morshed_4200,Shj-DXB,0.0
472,"@JosephONeillx Don't be so gloomy. There will be only one poll that matters. Also, the media's relentless pounding… https://t.co/pCzz7qr7ij",cszarrella,,0.0
473,@LambiLadaki Heart attack and liver disease!,pete75863963,,0.0
474,"Did you know, cardiovascular and eye diseases can share the same underlying causes? An annual eye exam can help det… https://t.co/VFwkar9FIs",VSPVisionCare,"Network of 39,000 eye doctors",0.0
475,"IMPEACH JOE BIDEN NOW!!!
Incursions by China in our AIRSPACE are permitted?
If we EVER needed proof that the Biden… https://t.co/LtaEiZvjsv",CooI4Cats,,0.0
476,"Laurence Geary will speak on “Famine, Disease, and Death in Modern Ireland”. Laurence lectured @UCCHistory and has… https://t.co/NgXtGPE2fr",CAIS_Irish,Canada,0.2
477,Mark your calendars for February 9 for an exciting workshop all about the role of nutrition in disease management a… https://t.co/plRyzHRm7I,BrailleInst,"Los Angeles, California",0.3
478,"Singing sensation, @BarbraStreisand set up @WHA in the US, to raise awareness of heart disease in women. She believ… https://t.co/WWkBqVhwfC",HeartCells,"London, England",0.0
479,but this is very sick like imagine wishing disease and d3ath upon people and using their lack of universal healthcare as a gotcha moment…,paoismyfriend,23 • she/her • georgia,-0.4642857142857143
480,"Happy #NationalWearRedDay. ❤️
.
National Wear Red Day is a day to wear red to help raise awareness about cardiovasc… https://t.co/SxdHSJ5jcI",SunaSolutions,"San Ramon & San Diego, CA",0.26666666666666666
481,"Solving the structure of a functional amyloid protein provides new clues to the origin of a rare disease 

Read mor… https://t.co/hNKQqSqOYP",bioengineerorg,"New York, USA",0.21818181818181817
482,"@jewishnightvale YEAH but they only talked about the more,, direct aspects about it. They also said the main things… https://t.co/LTBHTVE2p1",shiimmeerrs,he/rot,0.19166666666666665
483,"They are also part of this special beautiful family, which I have a warm heart for all of them.

Strong together fo… https://t.co/vu3uXPJkx3",Parkinson_verk,Nederland,0.5601190476190475
484,"@townhallcom IMPEACH JOE BIDEN NOW!!!
Incursions by China in our AIRSPACE are permitted?
If we EVER needed proof th… https://t.co/CPcTsoUk0m",CooI4Cats,,0.0
485,@GregAbbott_TX Are these 4 Chinese Nationals spies from Xi? Are they trying to escape Xi's brutal regime or the Covid-19 disease or what?,theresatruth,,-0.4375
486,"@GPaulTurner @YGurevitch He is a vile apologist for and supporter of racist terrorists. Like you are. Corbynism is a disease, a sickness.",markhumphrys,,0.0
487,"Yes, because a test for a highly transmittable disease trumps ALL other proven methods of not transmitting it.
 https://t.co/ZiUg8riDSa",WestofMars,West of Mars,0.0175
488,"Ranchers warn disease that would ‘decimate’ the cattle industry could cross the southern border

https://t.co/hAzGH3N2Sg",nczeczil_nicole,,0.0
489,Ranchers warn disease that would ‘decimate’ the cattle industry could cross the southern border… https://t.co/BuW3wnblrR,HomanBuddy,"Oklahoma, USA",0.0
490,National Wear Red Day is the first Friday in February. Wear red and encourage others to do the same.  Help raise aw… https://t.co/99ZxyNxkJN,UMMAclinic,"Los Angeles, CA.",0.0625
491,"National Wear Red Day ❤️
Raising awareness for heart disease in women. 

@ApurvaChalla 
@gizemcifci10… https://t.co/ZbHPJf9ecs",sordicharaMD,"Rochester, MN",0.0
492,"Happy #NationalWearRedDay! 

Our office supports the initiative to bring greater attention to heart disease &amp; we ga… https://t.co/SvXq0Aa6BH",AAEDC,"Annapolis, MD",0.65
493,"@therealnairaman Simping is a disease worse than covid 😂😂😂😂

Herpes SIMPlex virus.. at least the guy is getting some though 😂😂😂😂",TheGrimeGrammar,,-0.35
494,Nothing on tv tonight? Always wanted to watch two bloody amateurs with no budget or script at work? Then DO NOT MIS… https://t.co/lbxJqPEl24,_michael_scholl,"Gothenburg, Sweden",-0.8
495,"To learn the imaging and diagnostic features of the rare disease malakoplakia, which can affect kidney transplant p… https://t.co/KIoMbnYr71",KidneyNews,North America,0.3
496,@BradMossEsq It seems you have prion disease. Godspeed.,GlittaGladiator,Right behind you. ,0.0
497,"@niteowltaxes @KTLA Noise, fuel, &amp; light pollution are linked to dementia, heart disease, violent crime, &amp; hearing… https://t.co/zqYFRTwaeJ",HowTheWestWS,California,-0.2
498,"@Wokepotayto @KTLA Noise, fuel, &amp; light pollution are linked to dementia, heart disease, violent crime, &amp; hearing l… https://t.co/ywffZnN2ob",HowTheWestWS,California,-0.2
499,"@cjubprivate @rachelnmsu That sounds like a disease, Tree Boy. https://t.co/SS6BHUo5a4",classicblondess,"Tennessee, USA",0.0
500,Chile google just diagnosed me with heart disease. That’s why i don’t like googling shit 😩,imcoreylee,South side of ATL,0.0
501,"@Dr_P_S_Gill @reddit_lies Ok Dr.Gill, chronicity bad disease, long lasting ok? Patient go back to doctor for checku… https://t.co/BbEbjC2OQQ",FabRegion,,0.04166666666666669
502,"Today, I’m sporting my red tie in support of @american_heart for #WearRedDay to bring awareness to heart disease an… https://t.co/r0mZB5ueiu",steck_phil,"Albany, New York ",0.0
503,"@BirdMan5700 @KTLA Light pollution!!! Noise, fuel, &amp; light pollution are linked to dementia, heart disease, violent… https://t.co/QxNkpz4xBf",HowTheWestWS,California,0.0
504,"Goodbye old cells, hello longer life! Senescent “zombie” cells cause damage that drives chronic disease and aging.… https://t.co/MO3XtklyFp",LifeExtension,"Ft. Lauderdale, FL",0.1
505,"WE CAN FIGHT TOGETHER AGAINST CANCER!👊🏻

Cancer is a disease that occurs when changes in a group of normal cells wi… https://t.co/oQwbaxuj3z",biosys_tr,"ODTÜ Teknokent, Çankaya/ANKARA",0.15
506,"@TheTangoLima what is the psychiatric diagnosis/diagnosies?
it must be covered by several disease conditions.",jKerrm,,0.0
507,"The doctor of the future will give no #medicine, but will interest his patients in the care of the human frame, in… https://t.co/eoHo9cTOQ6",HealBodyAndSoul,,0.0
508,"We hope you joined the Bridge Authority (and others), today, by wearing red to raise awareness and funding for card… https://t.co/T4IdvVFr6C",NYSBridge,"Highland, NY",0.0
509,February 3rd is National Wear Red Day. Heart disease is the #1 killer of women -killing more than all forms of canc… https://t.co/iNRPzqb9zM,JeffreyESwope,,0.16666666666666666
510,@disclosetv Don't be surprised when some weird grain or cattle disease pops up in the US.,BigMangledMess,,-0.2
511,Listening to King's Disease III &amp; then transitioning to whatever is topping Rap Caviar just brings into focus how a… https://t.co/4irXmluEAW,tmgrace,"Chicago, IL",0.0
512,BIDEN WAKE UP- YOU WANT ANOTHER DISASTER ON YOUR WATCH! Ranchers warn disease that would ‘decimate’ the cattle indu… https://t.co/nGP7NbkOCi,magafuture,"Marco Island, FL",0.0
513,#NowPlaying:  Impending Doom - Ravenous Disease,PCModSquad,"Cape Canaveral, Florida",0.0
514,Our great Northwest Region team puts a lot of heart into serving students and our communities! We are celebrating N… https://t.co/vtYUvdvGqx,WGUWashington,,0.8
515,"@nycfann22 @KTLA Noise &amp; fuel pollution is linked to dementia, heart disease, violent crime, &amp; hearing loss.

“Disb… https://t.co/Go0d4CsvST",HowTheWestWS,California,-0.8
516,"@lsland_er @ScottAdamsSays By the time the sauce was prepared, the relative risk associated with the disease was un… https://t.co/jC7yEhW19K",brian_blivion,,0.0
517,Happy first #FRIday of the month! #WeGoRed in support of women's heart health. #DYK The eye is the only place in th… https://t.co/EBKtG9suBm,floridaretina,"Florida, Georgia",0.35000000000000003
518,"@lovegoatsalso @KTLA Noise &amp; fuel pollution is linked to dementia, heart disease, violent crime, &amp; hearing loss.

“… https://t.co/YqvqfeSAHH",HowTheWestWS,California,-0.8
519,Ranchers warn disease that would ‘decimate’ the cattle industry could cross the southern border… https://t.co/8WRjtScx88,michaellnance,,0.0
520,"Again a destructive ⁦policy by ⁦@JoeBiden⁩ admin is now going to destroy the cattle industry!! 
We don’t need to wo… https://t.co/WNXpsW2BQx",Lori4Texas,,-0.4
521,"Trend new: Rinella ME, ...,  Loomba R (Hepatology) __AASLD practice guidance on the clinical assessment and managem… https://t.co/JFHRaKuVd3",the_paper_link,San Francisco,0.13636363636363635
522,ORR of 28% with avutometinib + defactinib for recurrent low-grade serous #ovariancancer. 93% of patients had either… https://t.co/fQOohQJUP4,RossFH,"Portland, OR",0.0
523,"Ranchers warn disease that would ‘decimate’ the cattle industry could cross the southern border

More destruction m… https://t.co/vFdJX8zjlu",Carol96208870,,0.16666666666666666
524,"""Religion is the childhood disease of mankind, and nationalism is one of the consequences.""

Who said that?

#quote",JJdaViking,Earth,0.0
525,"@Jwindfield1 @IanCopeland5 @Rightorwrong76 nah, the data already points towards the vaccines safety/effectiveness;… https://t.co/g54X8ukdKr",neutralcharge2,,0.0
526,@InfluencerUg1 A tough disease 😹,rojamaibo,,-0.3888888888888889
527,"As I reflect on the family members I lost to SCD disease and complications, I cant help but wonder if @hbomax… https://t.co/LsJum6Yaec",Kristen01852807,Bay Area ,0.0
528,"Today is National Wear Red Day®, which brings awareness to heart disease and strokes in women. 
Xi Omega has suppor… https://t.co/L2HiAgNode",akaxo,"Washington, DC",0.0
529,"From head to toe, you're 14% more likely to get cancer if you have gum disease. Gum disease IS treatable. Tomorrow… https://t.co/87dJzhbKVy",PerioLase4LANAP,"Cerritos, Calif.",0.25
530,Horrible disease hope he is better soon 🤞🏼💚 https://t.co/2MrqwfEKiG,jason_binnie,Edin,-0.25
531,"February is American Heart Health Month. Wear something red today to help us bring awareness to heart disease.
•
Ti… https://t.co/1bY9TSqJZI",gtfolsom,"District Heights, MD",0.0
532,"@rawsalerts If US was doing this, I know for sure that it would be an international issue.
Oh wait, wait a minute.… https://t.co/7ijdPvSbjX",amie292,America,0.25
533,Matthew Reznicek is an Assoc. Prof. of English and Medical Humanities @Creighton and and v-p @ACIrishStudies. Matth… https://t.co/RyWuxsrjPs,CAIS_Irish,Canada,0.0
534,@Meh3625555 @1goodtern Thx for that info. I knew from my own experience with antibiotic-induced tendinopathy during… https://t.co/J8kz83qHLw,goldenerin,United States,0.6
535,"In recognition of #WorldCancerDay, we would like to honor everyone fighting this devastating disease. Our goal is t… https://t.co/6qfILeEtla",Triumvirainc,"Austin, TX",-1.0
536,"The importance of WHY you should be healthy/strong

1.Your testosterone levels will increase.
2.Less chance of futu… https://t.co/wrUBhHzdY1",MentalistaCopy,,0.2555555555555556
537,"We describe here https://t.co/viCLuhbT0l for the first-time inherited #IRF1 deficiency, in two unrelated patients w… https://t.co/Ro16nKJ4wg",JRosain,"Paris, France",0.25
538,"The first Friday in February is Wear Red Day--drawing attention to heart disease in women. For more info, check https://t.co/MtBQKZ8lUq",ChasesCalendar,"Chicago, IL, & Washington, DC",0.25
539,"#DidYouKnow that your heart beats more than 100,000 times a day, making it the hardest working muscle in your body?… https://t.co/RAIWda3ovm",AmsCardiology,"Abington, Blue Bell, & more!",0.5
540,Ranchers warn disease that would ‘decimate’ the cattle industry could cross the southern border… https://t.co/vHf95IC1MZ,DerekDenver2,,0.0
541,"@ZwaaiK No, but they do sneeze ! In court, that is,  ...without causing disease, just a breeze to ease or please the chimpanzees !",ghairo,"Cape Town, South Africa",0.0
542,"Fascinating. They keep dialing down the reporting frequency to reduce its coverage in the media.

That's a good thi… https://t.co/kqgAmKTvup",shovas,Canada,0.4148148148148148
543,I prolly should have gone to the chiropractor sooner. The fella looked at my back and refused to touch me. So I wen… https://t.co/Vmy6o0yhwt,BigDonQTrump,"Florida, USA",0.0
544,Cardiovascular Disease: Eating These 3 Foods May Help Lower Your Risk https://t.co/m0pX0BIoNa,CaptnKennysFr,Cape Breton,0.0
545,Wearing red Chucks today for #WearRedDay and @GoRedForWomen and @American_Heart because heart disease is the leadin… https://t.co/WUmvqCo86b,WordWhispers,San Francisco,0.0
546,This is how Barlow’s disease looks like and managed. https://t.co/oNPNCaTVlD https://t.co/LzPWJVFiRW,njohncamm,"Nuremberg, Germany",0.0
547,"@mtgreenee antifa, which stands for antifascist, which i doubt you knew, is not a group, its a bunch of like minded… https://t.co/b9KOZ7JMMS",Glenresister,"Wisconsin, USA",0.0
548,"You’ll conquer it!!! No matter what it is!!
There is no incuarable disease on this side of the cross… there is not… https://t.co/IO3hV8LKoF",ElvisBelinda,"Kampala, Uganda",0.0
549,@JordanC1107 Lost my Grandad to the same horrible disease! These moments are lovely though 🥰,81CWL,"England, United Kingdom",-0.16666666666666666
550,"@RonFilipkowski Shouldn't god be working on poverty, or disease or something more like that? LOL",JohnnieBrooklyn,,0.65
551,How worried should we be about avian flu? https://t.co/60v7qbsosu,PaulNuki,London,0.0
552,"Today, we wear RED! ❤️ As part of the national heart disease awareness campaign, CQ fluency joins this initiative t… https://t.co/30Fyzxs9LH",CQfluency,"Hackensack, New Jersey, USA",0.0
553,Today is National Wear Red Day®. Help raise awareness about cardiovascular disease by wearing red today! You can al… https://t.co/DuaSc8j7PX,KnoWEwell,,0.0
554,"Today is #WearRedDay! This annual event, also known as #NationalWearRedDay, is held in February to raise awareness… https://t.co/X4ZXJmY3ZY",wichitalessons,"Wichita, KS, US, 67226",0.0
555,February 3rd is National Wear Red Day to raise awareness for the need to eradicate heart disease and stroke in mill… https://t.co/1OzcoYZZ18,IATrustFunds,"Washington, DC",0.0
556,"Today is #WearRedDay! This annual event, also known as #NationalWearRedDay, is held in February to raise awareness… https://t.co/ZVNAC0HMDh",mymysticallife,,0.0
557,"Today is #WearRedDay! This annual event, also known as #NationalWearRedDay, is held in February to raise awareness… https://t.co/C4juwiQJLV",rtooms,"Houston, TX",0.0
558,@Radiobex How about a story about women battling heart disease ?  😉,CSGNottingham,meets: Arnold Methodist Church,0.0
559,"Today is #WearRedDay! This annual event, also known as #NationalWearRedDay, is held in February to raise awareness… https://t.co/hmQWitBuo0",MREnterprises71,,0.0
560,"Today is #WearRedDay! This annual event, also known as #NationalWearRedDay, is held in February to raise awareness… https://t.co/xFjdIO177i",MacSudsBody,"Excelsior Springs, MO",0.0
561,Fuckin horrible disease hope he beats it wouldn't wish this on anyone no matter what club they represent #fuckcancer https://t.co/A6jsIcJ7wq,hthejambo,dunfermline,-1.0
562,"@StrengthDebates I think both are on the exceeding side of for life demands and longevity, but…

I read a paper a c… https://t.co/1MSUmamMUT",zcolangelo,Illinois,0.0
563,@HJhughes79 It’s a disease. Cant be cured.,kawhiteknight,,0.0
564,Today is National Wear Red Day! Cardiovascular diseases continue to be a woman’s greatest health threat. Most heart… https://t.co/idtUqbZIps,examone,"Lenexa, KS",0.5
565,why are older siblings so weak with disease?,lesbforcait,,-0.10416666666666667
566,We’re celebrating National Wear Red Day! Heart disease is the leading cause of death for women &amp; men in the U.S. Kn… https://t.co/WfRI6y7D7l,SaintMarysCT,"Waterbury, CT",0.0
567,@mikejwhelan Your BMI is great. I suggest looking into Fork over Knives. It's a Whole Foods Plant Based diet. No ad… https://t.co/gPyIpvb3VQ,cookerguy,"Sacto, CA",0.5
568,Show your support this National Wear Red Day! 'Go Red' with Maximus to help raise awareness about cardiovascular di… https://t.co/pibgxUGEUO,MaximusCareerNY,New York,0.0
569,"By sequencing RNA in thousands of individual, or single, cells researchers are learning how different types of brai… https://t.co/XZzP6dRAaU",MIT,"Cambridge, MA",-0.023809523809523808
570,"#Obesity is often accompanied by #mentalhealth disorders, yet there is little consensus on whether a causal relatio… https://t.co/FheqgFl8Cz",endocrineweb,"New York, NY",-0.1875
571,"Want to better understand Covid and China?

Another excellent dispatch here ⬇️⬇️⬇️ https://t.co/YZTrqhQOke",PaulNuki,London,0.75
572,Today is National Wear Red Day. Our team is wearing red to spread awareness regarding women's heart disease.… https://t.co/zQZ0PnKVxK,OpTechUS,"Troy, Michigan ",0.0
573,@BrianKeithier @itsJeffTiedrich Trump derangement syndrome is like un treated lime disease,EricNepaBH,,0.0
574,Heart disease is easier to treat when detected early. Talk to your health care provider if you have any concerns ab… https://t.co/KNNWWvNlFz,KTBS,"Shreveport, LA",0.1
575,“The disease of philosophy. — Philosophy is itself the disease for which it pretends to be the cure: the wise man d… https://t.co/5ByopD0Z61,AJDiMar30,"Sacramento, CA",0.7
576,"Cardiovascular disease is the No. 1 killer of women, causing 1 in 3 deaths each year. 💘💃",ivery5000,USA  ,0.0
577,"A disease begins to grip the world in pandemic margins, and as it infects its victims they forget every…was there a question here?",jodyjsperling,"Oakland, NE",0.0
578,"Some experts believe that an infection causes Morgellons disease with bacteria known as Borrelia burgdorferi, the s… https://t.co/NWlmbaPi1E",KevinTweeted,Michigan,0.0
579,"@mschlapp @Bannons_WarRoom Conservative Values: Rape, Pedophilia, Disease and Death...oh, and groping male staffers against their will.",CeeCee7165,,0.0
580,"On tonight's STV News at Six: As @CR_UK warns that the NHS risks becoming ""overwhelmed"" by rising cancer cases, we… https://t.co/622GE4ys29",STVLouise,"Scotland, United Kingdom",0.45
581,"Pficer’s profits for producing the Anti-Covid-19 Vaccine exceed one hundred billion,a Disease created in the Labora… https://t.co/dtnckz2uGl",wilder_lindo,"Lima, Peru",0.0
582,Thank you @sdolwani for highlighting the importance of endoscopy services for Inflammatory Bowel Disease to the… https://t.co/NQqn9Cii61,CrohnsColitisUK,UK ,0.0
583,Feb. 3 is National #WearRedDay. Let’s wear red today to help raise awareness that heart disease is the #1 killer of… https://t.co/m3m6H2I0sT,SoCalHospitals,Southern California,0.0
584,Horrible disease 😞 https://t.co/vwbHZ4YV2N,JordanQuinn_6,,-1.0
585,"@HibernianFC Best wishes Ron. All the best with your fight, cancer is a horrible disease",arctic_jambo,"East Calder, Scotland",0.3333333333333333
586,"National Wear Red Day - February 3rd
#OurHearts. 

National Wear Red Day February 3. Heart Disease is the leading c… https://t.co/S5gSKoOO3P",TEHWOfficial,"Forestville, Maryland",0.0
587,@SenRickScott @AmericanHeartFL What if someone has heart disease and will die because they can't afford care and Me… https://t.co/P8uqFIVUn4,16ozbeer,,0.0
588,@VickiFrosinos We make our own red pictures of him!! ❤️💯National Wear Red Day ❤️American Heart Month❤️‍🩹 Fight Hear… https://t.co/IoBT6KnUNO,AlabamaCYFan,United States,0.15
589,"Ranchers warn disease that would ‘decimate’ the cattle industry could cross the southern border

https://t.co/Sf5Axa6U29",SusanHe02044156,"Pennsylvania, USA",0.0
590,"The Navy's EA-18G Growler jets are causing harm to our bodies in so many different ways, including intense vibratio… https://t.co/u2fTDgPLuY",SoundDefenseAll,"Washington, USA",0.2333333333333333
591,#weekendcleanliness is essential for healthy and disease-free living and plays a significant role in environment an… https://t.co/cUNBFcom5B,Annu21083617,,0.31875
592,"Are you interested in joining a community where your voice leaves a lasting impact?

We are collecting poems and ar… https://t.co/D0I6j4zkG3",IAFaccess,,0.125
593,"#Cancer may affect our bodies, but it will never defeat our spirits. Let's continue to fight for a world where no o… https://t.co/oPJDWEyeNw",asdo_rwanda,"Kigali, RWANDA",0.0
594,"Thanks to the vaccine, you can’t even go to a the hospital without getting tainted, and then “un-alived.”

https://t.co/8br8aF8nmG",SwanHill1,"New Orleans, LA",0.2
595,"They're #WearingRed for #WomensHeartHealth at @SaintAlsHealth in Ontario, OR! February is #HeartMonth, and our coll… https://t.co/Zy6W4f5T2O",SaintAlsHealth,,0.0
596,"Today I am wearing RED to bring attention to women’s heart health. More women die from heart disease,  then all of… https://t.co/NQaay55VgF",jamescara75,"Seattle, WA",0.25
597,i'm a disease playing victim,leechgrl,wip,-0.07500000000000001
598,Ranchers warn disease that would ‘decimate’ the cattle industry could cross the southern border… https://t.co/2l2CEl7n5I,jk_wash,Texas,0.0
599,Taking care of your mental health and wellness is integral to preventing and managing cardiac health. This… https://t.co/1XdJDGpC42,BbyHospitalFdn,"Burnaby, British Columbia",-0.07500000000000001
600,@RepAndyBiggsAZ Will you commit to telling us exactly what socialist things you'd like them to condemn before they… https://t.co/CHoRiJSIar,CanYouHelp15,F.ck Proud Boy Pieces of Shit,0.25
601,Vein stripping surgery used to be the only available treatment for varicose veins. The procedure removed the affect… https://t.co/wUh3ln7ScR,usaveinclinics,United States,0.2
602,"Today is National Woman's Heart Day, dedicated to raising awareness about the incidence of heart disease among wome… https://t.co/9cJasWTPSx",ulstersavings,"Kingston, NY",0.0
603,@trevormwills @IanCopeland5 also a staggering amount of people who died from sudden heart failure also had this fun… https://t.co/VZ1Ng7t5UQ,neutralcharge2,,-0.005555555555555573
604,"National Wear Red Day is an annual campaign to raise awareness about heart disease in women. 

Heart disease and st… https://t.co/oS4X0QMzj8",infinityrehab,"Wilsonville, Oregon",0.0
605,"It’s #WearRedDay &amp; we’re decked out in red to support women’s heart health.

❤️ Stroke is a leading cause of death… https://t.co/RjzZuL6apr",NatUrbanLeague,New York,0.0
606,TRG participated in National Wear Red Day to bring greater attention to heart disease as a leading cause of death f… https://t.co/oTQtStrB4A,TheReisGroup,"Washington, DC",0.25
607,"February is #AmericanHeartMonth, and FWC is raising awareness about cardiovascular disease (CVD) prevention. A heal… https://t.co/OnoX1cKHMA",GYNCancer,"Chicago, IL",0.0
608,Btw i'm free from the dengue disease now! I can return to drawing! 💪🏋️‍♂️,ArinqiA,"Busy, Comm work",0.4
609,@JoyceMeyer Every word that process out of God’s mouth is powerful enough to cause changes and bring healing. He se… https://t.co/3eVquw8Rfe,BernardBrown_br,"Rio de Janeiro, Brazil",0.15
610,@_HeartofGrace_ Hey that’s smart. In arterial disease there is lipid obstruction but this is usually secondary to a… https://t.co/srEpTEPVfm,DrDeFifi,,-0.04285714285714286
611,"Today is #WearRedDay. Raise awareness of #HeartHealth in women by wearing red! 

Did you know that heart attack sym… https://t.co/RdnhVht8od",VCUHSLibrary,"Richmond, VA",0.0
612,"#LowTestosterone has been associated with the development of Alzheimer's disease.

It’s essential for immune and br… https://t.co/YODO6HoYXg",SilkLifeMedSpa,"Lakewood, CO",0.0
613,@trevormwills @harlickjen @IanCopeland5 also a staggering amount of people who died from sudden heart failure also… https://t.co/JmmeQCgMls,neutralcharge2,,-0.15833333333333335
614,@JennyErikson Why are troglodytes like you and your disease-vector daughter on my timeline?,Suavebones,"San Diego, CA",0.0
