,tweets,user,location,polarity
0,Dumbass got a disease for birds. Couldn’t be me https://t.co/BNrDttriEm,JonkJahnson,Sprawling Suburban Labyrinth,0.0
1,"@glassolivesfw A note of hope, if you're not talking about out-and-out Celiac disease - I have a friend who became… https://t.co/RJRiSlmrvr",DaveAnd2000,,0.0
2,@DrLoupis Parents have Munchausen disease.,TommyG24141847,"Dallas, TX",0.0
3,@TanukisNut81483 @Tomarakh Rofecoxib (Vioxx)-Merck 1999 - an  alternative to non-steroidal anti-inflammatory drugs… https://t.co/ByFfHE2ezN,KatCallan540, bit north of 34th parallel S,0.0
4,hanahaki disease is considered lost knowledge now.. my bones just turned brittle and i just aged 7000 years https://t.co/F3TtbrSsZE,penbbles,📍they/it | 17 | black,-0.1
5,"@Kaleb_not_a_bot @Esqueer_ @AOC Sounds like Nazi talk equating people to a disease, but it's not shocking given you… https://t.co/KieViYaeVP",halit16,,0.5
6,Short term #airquality at #whitefield is Moderately polluted - AQI at 101 -  May cause breathing discomfort to peop… https://t.co/388bI7KFAM,WhitefieldAQI,"Thuberhalli, Bangalore, India",0.0
7,@AuldM It breaks my heart that no one seems to be listening regarding the permanent medical pathway that goes from… https://t.co/zwm3oswcSw,yona1959,,0.0
8,@Ghost424 @F1 @MercedesAMGF1 I suffer from a disease called Alonsobeliever-19. It appears you need help recovering,Motorsport_Fan3,East Tennessee | ✝️ | 🇫🇷🇩🇪,0.0
9,Ring culture is a disease. Charles Barkley carried the suns to the finals and just had the misfortune of playing in… https://t.co/QrdxsNydyd,DawsonforReal,"Hurst, TX",0.0
10,"scabcy pandar disease https://t.co/DJvr0p4p0x 
#副业 #话费 #迷药 #赚钱 #兼职",aylegggn,,0.0
11,"With Wilms tumor, there are 5 stages of disease; each with unique characteristics and treatment protocols. Staging… https://t.co/azm7lftQF8",Blasercrf,,0.375
12,"Disease: fever
Medicine: https://t.co/H9i1A7l9Gh",ihtesham_666,"Wah, Pakistan",0.0
13,"@FelicityCloake I thought baked beans, dandelions and grey squirrel was a fairly radical cassoulet? It appears not.… https://t.co/0d2HtOOR6l",AndrewJ31680521,Saint Saviour Island of Jersey,0.32499999999999996
14,i am redoing this video bc i have insane disease,griefingway,,-1.0
15,@heavenlydazai seventeen boys and their chunky shoes… a disease,jiangchng,23 she/they white bi,0.0
16,Canada has a disease...it's name is @JustinTrudeau,416Reggie,Canada,0.0
17,@JeannieKelly I'm now on statins. My high cholesterol may be due to my kidney disease. I eat well &amp; don't drink alc… https://t.co/AysrScTpZn,insomniacjane,By the sea,0.0175
18,Neil Diamond Tells ‘CBS Sunday Morning’ That He Only Recently Accepted His 2018 Parkinson’s Diagnosis: “Just In Las… https://t.co/QdjuwT46t2,drpatfarrell,United States,0.0
19,"@CarnivoreSapien Your promotion of daily cholesterol intake is also exponentially more dangerous than caffeine, hea… https://t.co/p1Ij1yGjNd",Hey_TBA,"San Diego, CA",-0.033333333333333326
20,"@halit16 @Esqueer_ @AOC So has a super rare disease affecting .00001% of the population. It wasn’t accepted then, i… https://t.co/pUltb5q1eX",Kaleb_not_a_bot,,0.31666666666666665
21,"@kotyk_blt @ileoanna I had recurring pains and problems, which later proved to be a chronic disease from specific l… https://t.co/0AJ4vDSGvc",TheHunter_68,"Cles, Trentino-Alto Adige",0.0
22,@nagisology this is why i get nothing done unorganized disease,meltmare,⚠️ TW: ESI sx/sp458 efvl rluei,0.0
23,StartUp Health co @Particle_Health has launched its Particle FOCUS (Filtered Outputs Curated for Usability + Simpli… https://t.co/kEaOX9Vb88,startuphealth,New York & San Francisco,0.0
24,A new University of Illinois project is using advanced object recognition technology to keep toxin-contaminated whe… https://t.co/EqVlY0VOEg,CASTagScience,"Ames, IA",0.2681818181818182
25,"@EnogieruIsoken 70% is obviously a hyperbole. 

It’s not about aesthetics, central adiposity has been strongly asso… https://t.co/tAEsFCKBGM",The_x_Dami,,0.14444444444444443
26,Full extent is compartmentalized and classified (as you should do if you are fighting a disease that literally inva… https://t.co/CU5SOQl40T,Aleksan76546148,"Maryland, USA",0.35
27,"@gorskon ""Considering the low burden of disease"" sounds an awful lot like that.",TotalCytopath,,-0.5
28,April is #ParkinsonsAwarenessMonth. This month we'll be exploring the physical and emotional impacts of Parkinson's… https://t.co/ONckGQEhqW,Aging_Research,"Washington, DC",0.0
29,"Don't forget: If you're in the Miami area tomorrow, join SCDAA, @my1blood and @Hemanext_Inc for a blood drive! For… https://t.co/2ZapWHa1la",SCDAAorg,"Baltimore, MD",0.0
30,"Man Loses Leg to Flesh-Eating Disease Caused by Very Rare Fungus Infection
https://t.co/ReoxwiSOKw",UsaJaun,,0.04500000000000001
31,I decided to write 'True Refuge' during a major dive in my own health. Diagnosed with a genetic disease that affect… https://t.co/WCuZ5z9DNe,BENSONKINO32771,,0.33749999999999997
32,This research will connect more than 40 experts and 13 institutions across the country and abroad to collaborate an… https://t.co/iqPy1Ubj74,IndianaUniv,Indiana,0.5
33,@miffymealss tell me why i thought the first meant cancer the disease at first WHEN I AM LITERALLY A CANCER,suns_diaryy,sw: 230 cw:213 ugw: 125 (lb),0.25
34,The government are like a disgusting disease that won't go away. Toxic 🤢 https://t.co/FH89aTkKqn,CaroleHenson11,,-1.0
35,"The Malaria epidemic in Afar is worsening, with over 3,600 confirmed cases reported in 36 woredas. We need to act f… https://t.co/ZxVpW2VLx6",AbyssiniaET,"New York, USA",0.4
36,"@TheCoinCollect8 @BrianRoemmele Heart Disease is very common, so these medical device should become more common. Th… https://t.co/iRE6DYYHFK",landout159,"California, USA",-0.0475
37,@JimGagnon6 @Claudoc3 @WhalenMona @Nataliegurl1 @satansradio666 @james_pidd @V_Hawtmess1 @SweetLouTiger… https://t.co/3LRWo4tSLb,Petriot15,"Reston, VA",0.0
38,"@PattheyIssa @WaelChehab1 Socialism is not a virus, but an incurable disease that has no cure. We were very optimis… https://t.co/M0xE5zeG1j",ogstenrodreg,,-0.15
39,"@tiras_corner In fact, we thrive, often moreso than our meat eating counterparts. We have lower incidents of chroni… https://t.co/5HLBO9Xrqm",4f0rty4,"Los Angeles, CA",0.0
40,Eur J Pediatrics Therapeutic perspective for children and young adults living with thalassemia and sickle cell dise… https://t.co/iReoBkTA1Q,dr_jpablo,En una UCIP no muy lejana...,0.1
41,@philly_bio Thank you this is an AMAZING post. Very thoughtful. My mother has Alzheimer's and as such I have learne… https://t.co/SxagRo0EZ2,mellowrk_lion,Los Angeles ,0.37333333333333335
42,"As promised, we've picked three winners for our Advanced Practice Workshop, including: Christine Cernera, Rachel Pe… https://t.co/8DzTuWXf2p",Schoolafm,,0.4
43,"Does no one find it strange that almost all mass shooters share a skin tone, an ideology, a social position, but we… https://t.co/FIQAu90RKL",communisthem,they/them,-0.008333333333333335
44,16 year olds trolls in kpop twitter are a disease fr like y’all should be doing ur homework https://t.co/X8fOJsf6qd,sweetaner,,0.0
45,@drkohilathas and dying on average at 25 years old to some horrible injury or curable disease...,rihosims,,-0.35000000000000003
46,"@narendramodi @Pontifex Sir,
Please send this talented Paster to cure @Pontifex ....he is curing thousands of peopl… https://t.co/n9gXjLZone",Jaya41757249,,0.7
47,"@THurts83 This disease is really a shame. I've heard people with dementia can get sidetracked frequently, but not as badly as this.",valoriexoxo2,,-0.13333333333333328
48,"Last night, I was pleased to present the Visionary Leader Award to @Slalom for their extraordinary leadership and c… https://t.co/t6Eiv9FWFq",CEOatNKF,"New York City, NY",0.20833333333333331
49,@Joshua_Newman Our only hope with all the daycare sicknesses is our kids will be immune to every recorded communica… https://t.co/3goEXQOIN7,samuelsski27,"Salt Lake City, UT",0.0
50,I am so excited! Our school has registered for @HeartandStroke's #JumpRopeForHeart! Please visit our school fundrai… https://t.co/sMKBlN2llZ,STA_ycdsb,"Keswick, Ontario",0.375
51,""" the disease affects the hand, foot and mouth of the patient so we're gonna call it hand, foot and mouth disease""",TipsyDr,Lebanon,0.0
52,@PinkNews Does he have Graves’ disease? Those eyes man,tabularasaTonyB,,0.0
53,"...""In stupid Valentino's lover said I can't have children for a real healthy disease!""...😂🥴😂",ProfessorLuque9,Pedregal de San Ángel CDMX /,0.75
54,"What a coincidence.

“The Centers for Disease Control and Prevention showed that outbreaks of emerging drug-resista… https://t.co/ajOe5tkKdO",MatrixMaze36912,,0.0
55,"Serotonin also regulates gut and immune function.

Crohn's disease flare-ups feature spikes in serotonin.

Endotoxi… https://t.co/Y95gYFR1jt",JBianco215,,0.0
56,Hey Tox Folks come see a sneak preview of SHOT IN THE ARM – come to the Soledad Ballroom in the 1st floor.… https://t.co/FpVlGXMLjH,DrLizaMD,"St Louis, MO",0.0
57,"So many people try to look younger than they are. Is that because society is obsessed with youth, and old age is seen as a kind of disease?",SteveMcEllis,,0.13999999999999999
58,"@LucasGage584 They say that the Ignorance is the disease of our time, amazingly it seems to be More concentrated in the US and the EU",gilberte_sh,,0.55
59,"@el__yassien Oh Allah, speed up the recovery of father of my dear sister, a cure that leaves no disease, O Allah, y… https://t.co/5Aoa9p6FdY",nesia_08,Allah's World ,0.0
60,"""205,852 healthcare professionals from three US cohorts followed for up to 32 years, we prospectively assessed two… https://t.co/gREbUyD7Ob",hollowood_zoe,,0.0
61,@OliLondonTV mental disease...,BrianCo87920501,,-0.1
62,"@waitbutwhy Probably of someone lying about it is probably higher than 1024, so would guess if 4713 of us dropped i… https://t.co/qrTahV48uw",nathanbraun,,0.25
63,@CalltoActivism Or he is laying the ground work for not guilty by reason of mental disease or defect.,KJM59316748,,0.075
64,@BluegrassRabbi @Christ_Conserv @KassyDillon Why are they so prevelant? Because we share so much similar DNA! No no… https://t.co/hDvDlukgPE,Rationalmod,,0.0
65,"It's factual that handwashing behavior improved by 80%  during the peaks of #COVID19 pandemic,and suddenly dropped… https://t.co/6IxOREecGZ",PHCAfric,Uganda and Africa ,0.0
66,"@JEduardoCabreroCastro, PhD, MSc, MD is using SC Alzheimer's Disease Registry Data #2023ADRegConf in his ongoing… https://t.co/jlDfka1sa8",ccadmr,University of South Carolina ,0.0
67,"@DamnLeo08 @hqmelander @11eric_d @MCU_Direct No, I would've preferred if they had recasted him cuz I like T'Challa… https://t.co/gkthUg2PQT",Razorwing_,,0.0
68,@thelordhand Same. It’s a disease,calamaricritics,,0.0
69,@waqasmughalpk @ImranKhanPTI @ImranRiazKhan @NaeemBukhariPTI @AliAminKhanPTI @MuradSaeedPTI @PTIOfficialLHR… https://t.co/6naDjucuLq,sadedi,Almaty,0.0
70,🥤 Did you know drinking soda and other sugary drinks can lead to serious health risks? #SodaDangers #HealthRisks 💔… https://t.co/8O9RUgVE2Y,Uask4ab,Global ,-0.22916666666666666
71,"Huntington's Disease  #Huntingtonsdisease 
Juvenile Huntington's disease  #JuvenileHuntingtonsdisease 
 Get Involve… https://t.co/qu1LouMm21",AwarenessHD,,-0.25
72,The goal of this manuscript was to provide evidenced-based approaches and interventions that may reduce coronary he… https://t.co/qMmNymgVak,jaideeppatelmd,Toronto 🛬 Baltimore ,0.0
73,"Medically, prognosis may be defined as the prospect of recovering from injury or disease, or a prediction or foreca… https://t.co/oX5MfxCQGw",SinoVedic,"नई दिल्ली, भारत",0.0
74,"A Persistent Challenge: Managing HIV Multidrug Resistance
The goal of this activity is to educate health care provi… https://t.co/IOOR8ksghr",AppliedCME,"New York, NY",0.0
75,"Scientists Discover Possible Cause Of Mysterious Liver Disease In Children Over 1,000 otherwise healthy children we… https://t.co/vXl5hS7Tvh",NewsRadioNH,"Portsmouth, NH",0.16666666666666666
76,"@TreallycareDon @ChannelInteres Sounds familiar.... like that thing with huge uptake, and now we have an over 20% i… https://t.co/ao36XCQSj3",quakc88,,0.38750000000000007
77,"Over 1,000 otherwise healthy children were diagnosed with severe cases of hepatitis and at least 22 died. https://t.co/glaZQXvyzj",995WRNO,"New Orleans, LA",0.1
78,"Scientists Discover Possible Cause Of Mysterious Liver Disease In Children Over 1,000 otherwise healthy children we… https://t.co/YPtLopbMX7",WTAGradio,"Worcester, MA",0.16666666666666666
79,Scientists Discover Possible Cause Of Mysterious Liver Disease In Children https://t.co/Ivn2MzsGdd,WMEQ,"Menomonie, WI",0.0
80,Spirits did say to get out of my comfort zone. Jah Jah. You would think i like going out cause i tend to make the m… https://t.co/84rwdmtbCW,minkaluv,Amongst the stars!,0.0
81,"@Dan66362316 @DavidWolfe Drugs are evil too, you are buying too much into the snake oil I'm afraid. My medicine is… https://t.co/3IOgYgFxMp",stopcruelworld,,-0.4666666666666666
82,"Tick activity on the rise as temperatures warm; Babesiosis, DTV, Lyme Disease https://t.co/DeJRtN4eUM https://t.co/UaohydUYPt",NewsChannel34,"Binghamton, N.Y.",0.6
83,"@lyndastraffin Donny should just stay quiet, but he will not.  So, suck it up buttercup. He is reaping what he sowe… https://t.co/DsCjqmwyPq",Crystal01717190,Swamp,0.0
84,“Nearly as many Americans believe someone close to them died from side effects of the COVID-19 vaccine as died from… https://t.co/SKErw2LYiC,xnert,"Albuquerque, NM",0.5
85,I just saw a stay trying to get a video with chan in it and he bent down to be in the frame  and jealousy is a dise… https://t.co/iWFZvnYjXj,lovestay_tash,STAYVILLE 🕷️,-0.15555555555555559
86,@gabriellajaee I would explain that type 1 is an autoimmune disease which currently has no cure only insulin and de… https://t.co/sip6RiGjc5,Noveltea2,"Toronto, Canada",0.0
87,@gabriellajaee I would explain that type 1 is an autoimmune disease which currently has no cure only insulin and de… https://t.co/yulBo57aVZ,Noveltea2,"Toronto, Canada",0.0
88,Wearing red is important and creates visibility for a huge problem. But we also need to invest in public health and… https://t.co/7XWH9ktKkv,calhealthreport,"California, USA",0.2
89,"If we agree #addiction is a #disease, why can't we agree how to treat it? Two conflicting ""disease models"": https://t.co/14q0P63GRo #rehab",RecoveryInst,"Santa Fe, New Mexico",0.0
90,"@binary_x A pair of cows were talking in the field. One says, “Have you heard about the mad cow disease that’s goin… https://t.co/sESLSgxwVa",Arshaviin7,,-0.37916666666666665
91,"""Nearly as many Americans believe someone close to them died from side effects of the COVID-19 vaccine as died from… https://t.co/v4gVzgVIZY",GIWilson,CA,0.5
92,Scientists Discover Possible Cause Of Mysterious Liver Disease In Children https://t.co/ajpqnSIj7b,1059KNRS,"Salt Lake City, Utah",0.0
93,Scientists Discover Possible Cause Of Mysterious Liver Disease In Children https://t.co/lahvRiYI9E,610wtvnnews,"Columbus, Ohio",0.0
94,Scientists Discover Possible Cause Of Mysterious Liver Disease In Children https://t.co/TvnB7UtPoe,1310WIBA,"Madison, Wisconsin",0.0
95,@unhealthytruth reduces the risk of a serious form of the disease. rather a vaccine than a Corona infection.,Timppalare,"Uusimaa, Suomi",-0.3333333333333333
96,2/3got lung cancer so she has 1/4 on one of her lungs removed but then she god motor neuron disease and sadly passe… https://t.co/CZD25HprO7,Englandfan48262,Luton England he /him ,-0.5
97,@ThomasResen @claushetting Virology needs to provide evidence that viruses exist and cause disease or the theory ha… https://t.co/xoRlWwDGCU,crianza,,0.0
98,"The Qur’ān is Allah’s greatest gift to mankind. It is the eternal book of guidance. It is a cure for every disease,… https://t.co/audeh8CMHX",9Milley_,,1.0
99,We need clean air infrastructure to allow people with severely depressed immune systems the freedom they deserve. A… https://t.co/WDsSDJcSdw,LizziCollinge,"North West, England",0.3666666666666667
100,Attention seeking is a disease and many people on Twitter are ill af.,Mohd_abdul_,+234,0.0
101,"Now online in @HepCommJournal! AASLD-endorsed article ""American College of Sports Medicine International Multidisci… https://t.co/3F2jo5YmSZ",AASLDtweets,"Alexandria, VA",0.0
102,"As the temperatures continue to get warmer in the spring, remember tick activity is also increasing. Here's what yo… https://t.co/AnNiUwj6Mu",JET24FOX66,"Erie, Pa",0.0
103,Scientists Discover Possible Cause Of Mysterious Liver Disease In Children https://t.co/B5rivdiuHN,kfbk,Sacramento,0.0
104,"Friday #Science

How poverty and racism 'weather' the body, accelerating aging and disease https://t.co/tP96pGR33O",WPSU,Central Pennsylvania,0.0
105,🚨 A systematic review of randomized controlled trials identified the effects of intradialytic #exercise on key indi… https://t.co/VHWWzpxaoC,GREXercise,,0.0
106,"Gotta reconsider my life choices🥲, after explaining a simple and very straightforward disease to one of my relatives.💆‍♀️",_Hana_Hassan_,,0.24375000000000002
107,"Old Saw digs into our darkness, reflecting back the disease of the land &amp; its keepers with a haunted, hungry collec… https://t.co/izy2fdG6Zi",RSTBRecords,"Hudson, NY",0.05
108,@futuredude @realDonaldTrump @JoeBiden Then why suggest endorsing through voting one disease over another?,SwetlandTom,,0.0
109,@kctorawrites I’m always a fan of shifting weight uncomfortably to show disease,saraanderson023,USA,-0.5
110,Rasmussen poll: Nearly as many Americans believe someone close to them died from side effects of the COVID-19 “vacc… https://t.co/xgknOm20fy,KenHanson59,"Minnesota, USA",0.5
111,The SC Alzheimer’s Disease Registry is the oldest and most comprehensive in the NATION! And anyone can access the d… https://t.co/gDgh8bKbLu,twilson_tpp,,0.5
112,@Realist87982417 You have been deluded into accepting mass repeated infection with a disease where after 3 infectio… https://t.co/QXx1Z34iMd,autocatalyticat,Stolen Haldimand Tract land,0.0
113,"@desserveyou GIRL , SELENA IS ALWAYS &gt;&gt;&gt;&gt;&gt;&gt;&gt;GIGI , NEVER COMPARE THEM AND DONT MOCK SOMEONE DISEASE , IT IS SHAMEFUL.",shreyanshp639,"Lucknow, India",0.0
114,If alcoholism is a disease then shouldn't insurance pay bar tabs??,jgjaxon,"Dallas, TX",0.0
115,"#MyositisPearls for Patients 40- Difficulty in swallowing may be seen in #myositis, often in severe disease. This m… https://t.co/H5kWolNbvx",docrota,"Pittsburgh, PA",0.0
116,Servitude is a terribly acquired disease to get rid off... especially in minds that have been trained for decades a… https://t.co/oP5DPT70VN,spaniard_9,Lahore|Multan,-0.5
117,@NoLieWithBTC Nothing new they all have the disease of Criminal Mind they cant help it .,bajan761,,-0.13181818181818183
118,not only are you an unattractive man but also shaming the appearance of someone dealing with an autoimmune disease… https://t.co/hRt6dORpoR,seIenadecisions,🇦🇷,0.0
119,"My heart goes out to @RepDanKildee and his entire family as they prepare to face the road ahead. 

Just as Congress… https://t.co/bUhqPgKom0",pamelapughmi,Michigan,0.0
120,"@robreiner Sir, I say this with all the tact I possibly can. You must have Alzheimer's disease. Get some help befor… https://t.co/vqvXQ86XgP",runstile,,0.0
121,@Razorwing_ @hqmelander @11eric_d @MCU_Direct This is funny bcuz they haven’t even established an actual name for t… https://t.co/ySKkE9jGoq,DamnLeo08,,0.125
122,"Neo-liberalism is mental illness in its purest form of pathology/disease:!  Every day, we slip further and further… https://t.co/3wl6vf4zeU",IritanoRichard,"New York, NY",-0.03333333333333333
123,Happy to share the website of the EU cofunded Joint Action UNITED4Surveillance. We wil  strengthen infectious disea… https://t.co/5BR8frm6JP,EelcoFranz,"RIVM, The Nederlands ",0.45
124,Public fungus disease. CDC? Thank you for letting me know.🇺🇸🇺🇸🇺🇸🇺🇸🗽🗽🇺🇸🇺🇸🇺🇸🇺🇸🌍🌎✌🏼 https://t.co/PJXNAVThdy,Al70174756Alba,,0.0
125,"@its_the_Dr Neo-liberalism is mental illness in its purest form of pathology/disease:!  Every day, we slip further… https://t.co/9B3QI8H4ZP",IritanoRichard,"New York, NY",-0.05
126,"@krassenstein I'm so glad this madness is only in the west and will never make way in a Africa, Islamic and some ot… https://t.co/pYNiUu65vx",kingsleybag,,0.25
127,"@POTUS Nope. According to the CDC, guns are responsible for about 4% of child deaths (excluding suicide). That trai… https://t.co/OPk1DIvDxM",mrfturbo,OH,0.2
128,"@SanjoyMahajan2 @AnthonyFreda10 None of the symptoms of mercury poisoning resemble polio. There is no rapid onset,… https://t.co/JUJGVgw0Yw",FillmoreWhite,"Dallas, TX",0.0
129,"@Epowers100 If they got rid of the brain disease theory and focused on complex trauma and other reasons, they'd hav… https://t.co/ZiszWsWANE",TraceyHiggins92,"Vancouver Island, Canada",-0.2125
130,@DanishScience @tarahtalk @SuperHero_88888 @MarioNawfal Do you have a link to any RCTs showing a correspondence wit… https://t.co/DhydVc2vF6,greg_travis,The Midwest,0.0
131,"Lobbying for big oil, tobacco, and special interest groups while telling people they are suffering a mental disease… https://t.co/xYA6L6WhNZ",NerdyDnDSarah,,0.0857142857142857
132,"The rumen-protected energy source also positively impacted milk production numerically, as the group receiving it p… https://t.co/MMBjFEQeaE",dairypodcast,,0.22727272727272727
133,da internet a disease https://t.co/n4fRrZUPxl,mackalacc,United States,0.0
134,TGIF all this heavy cold rain makes my hip hurt I have osteoarthritis and degenerative disc disease but it doesn’t… https://t.co/kPvwmVYSVH,Kara11735150,,-0.4
135,The #Ontario government will continue covering blood tests for celiac disease thanks a partnership between… https://t.co/UZK5u62ohD,machealthsci,,0.2
136,"Measles cases in Afar, Ethiopia have risen to 110 since the start of 2023. Immediate action is needed to contain th… https://t.co/KTBmmE4WPn",AbyssiniaET,"New York, USA",0.1
137,Saliva - Your Disease https://t.co/3gGbjGcCz4 via @YouTube “NOTHING IS FOR FREE - ITS YOUR DISEASE THAT YOU MADE “… https://t.co/n3rl5xWB53,BobRoss40469000,,0.4
138,@DaithiDeNogla U are a disease,0Kaizen0_,,0.0
139,"Why tf are they even infectious disease doctors???? 

Do they even care about the long term harm being caused by th… https://t.co/ZES9ts5F3X",Eman_Rimawi,"New York, NY",-0.05
140,@18tintaweb @KirstieMAllsopp @MrHarryCole Taxation has been applied to reduce consumption due to supply issues &amp; ot… https://t.co/MMlFc3KrcQ,GoBeepUK,"Nottingham, England",-0.125
141,"@ledamalekina Fortunately for you, you don't seem to suffer from that disease called intellect",GeriGoko,"London, England",0.4
142,"""No disease that can be treated by diet should be treated with any other means""
Moses Maimonides https://t.co/Kf0QucfwQ6",MendozaRayman,"Medellín, Colombia",-0.125
143,@EvelDick I never go on there for that very reason. It’s like a disease over there.,tweetsforteetz,Hammertown ,0.2
144,"This why Clout chasing needs to be recognised as a disease. Dude pulled a Logan Paul. Absolute piece of shit
https://t.co/CRkSbbiXQg",brideriser,Earth,0.2
145,clout is a disease,kelsoparklegend,"Texas, USA",0.0
146,"Check out the list of in-person, live webinars, and on-demand educational opportunities for April in N.C. at… https://t.co/5NNg1jJYgK",AlzAssocENC,"Raleigh, North Carolina ",0.19318181818181818
147,@jjkmyluv97 Jealousy is an insidious disease 😩💔,R_taekook22,Obsessed with Jeon Jungkook 🥵,0.0
148,"I'm just not feeling any of this ""heartbreaking moment for our country"" stuff. We've suffered tremendous loss since… https://t.co/Oqz6CAchQO",metaquest,San Francisco,0.3333333333333333
149,@JKhanClassified He seems like he is suffering from dementia or Alzheimer’s disease 🤔,findkaiser,"England, London . UK ",0.0
150,@zk_Froggy @zksync @omnisea Gm Ser my Frog is at last stage Meme disease and asking if you could give him an Froggy… https://t.co/hZ5HTD9fDQ,Jay_FCB9,Somewhere on the Earth,0.0
151,@adammantiam @dlboatright01 @lavern_spicer @POTUS I agree with this my counselor agrees with this. My son who us ga… https://t.co/G99aALbsqN,BearChance_GIFT,"Maryland, USA",0.0
152,"foams at the mouth with a head full of acid 
disease is her primary language",S0MUCH4STARDUST,30 mins,0.375
153,@broyeanice I'm 98% certain it is. The other 2% isn't sure because it doesn't know if you should try and argue that… https://t.co/CVmiU89TwZ,CourierJax,25|He/Him|Bisexual|,0.19642857142857142
154,"Baby please, adore me, adore me!! I am living for your disease.",bpdpilIed,30 || ic : dr chalk,0.0
155,@LeaderMcConnell The sickening disease infesting the Republican House is now in the Republican Senate. I know you'r… https://t.co/bgWkjs8w8p,TingerMaster,,-0.9
156,@GhostedOU812 @pratimbose @MamataOfficial @abhishekaitc @PCSD22 I think you suffer from the same disease that I do.… https://t.co/4UGEzp2975,ColourPolitical,,0.0
157,#HealthandMedicine #Fungus Man Loses Leg to Flesh-Eating Disease Caused by Very Rare Fungus Infection: The man said… https://t.co/f0qRCDY1zK,upasakabala,"London, United Kingdom",0.04500000000000001
158,"for Supporting the Awareness
 Of Huntington's Disease.
It's is Sincerely Appreciated. / Thank You /… https://t.co/xMtAlEmReO",AwarenessHD,,0.225
159,I have a disease and that's the only prescription,EthanLyrics,,0.0
160,@Mike198413 @John_Fanta @UConnHuskies @NCAA @MarchMadnessMBB Unfortunately after the disease died down a little bit… https://t.co/kwlrXtXyQ4,Fertleman7,"Bayside, Queens",-0.2810185185185185
