,tweets,user,location,polarity
0,@MikeSington @azardey3 Is it lack of training growing up or a mental disease? This is not normal.,DeepPurple007,,-0.0875
1,It’s important to people living with diabetes to manage their blood sugar. Keeping your blood sugar levels in your… https://t.co/Sr1D08lwTn,FriendsInNeed95,"Kingsport, TN",0.4
2,"Three found dead in house after suspected cholera in Kibera slum, Kenya 🇰🇪

📌 The disease has claimed around 100 li… https://t.co/D5Gk3rdPNo",HmpxvT,"Stockholm, Sweden",-0.2
3,@nursekelsey I developed a rare neurovascular disease after Covid,jetusername,,0.2
4,"“According to 18 USC 175, a bioweapon is a toxin, biological agent, or delivery system (mRNA lipid nanoparticles) t… https://t.co/nL5TRgKHkA",Russell4Heather,"Massachusetts, USA",0.0
5,@bronc0kb Bro my dad literally told me the other day this guy is better than ney because he's more skillful...it's a disease my guy,FREDRISTOTLE,"feudal, Japan ",0.2916666666666667
6,"Our goal is to educate and inform others about the impact of this disease, and we invite you to join us in this mis… https://t.co/tHdZTLKW6z",RutherFORCE_,,0.0
7,"• The absence of all of the following criteria, including extrahepatic adjacent organ invasion, disseminated diseas… https://t.co/96thTKbU6n",carcenogenesis,,-0.00625
8,"@SocialistPatri1 @Gina660 @Constit72852498 @Amylou3030 @RepMTG That's just treating the symptoms,  not the disease.",soundofshoom,,0.0
9,"Surgical resection

• Because surgery is the sole treatment option for biliary tract malignancies, care teams with… https://t.co/9T7YLlXKPz",carcenogenesis,,0.0
10,The strongest predictor of clinical progression in pts presenting with subjective cognitive decline was cortical th… https://t.co/9QVGXziMU8,blastnost,,0.0
11,"If a person experiences worsening bone pain coupled with a fever or any other infection-related symptoms, or if the… https://t.co/KwAYWQcAIf",JournBoneres,United States,-0.0625
12,"The day is intended to bring awareness to the risks and complications associated with diabetes, and to encourage in… https://t.co/owfH5tUoCj",drgalen_org,"Austin, Texas",0.0
13,@standesite Ok. Don’t do the teapot cos if u use tap water yoy can get a disease,milliesbesties,,0.5
14,"@mkolken As a parent of a mid-twenties adult son with mental illness, not only is the disease pervasive, but the la… https://t.co/QeEcwWEm70",SuckMyTweet17,"St. Charles, IL",0.0
15,Depression is a major risk factor for heart disease and one that can actually affect your heart physiologically. Le… https://t.co/wCZvaRMWBP,BHCorbin,"Corbin, KY",0.03125
16,@DrSamuelAkinye1 💯  It will be difficult for any disease to end without robust primary healthcare.,simisola10,Global health ,-0.04999999999999999
17,"Next: Chronic Kidney Disease: Insights for Empowered Health (virtual) (free) https://t.co/ahIorxDWcV
New: How To la… https://t.co/Io6dMLOXoJ",Podnews,,0.1787878787878788
18,"@ChuckBaim @GrtSpaceCoastr @ZaleskiLuke @elonmusk If ''It doesn't work for shit, either to prevent spread or diseas… https://t.co/OotLmVLSUb",perdulenore,Canada,0.0
19,@JosephD52079278 @MeUnloveable @Meatloafsndwch @nederino333 @DavidJollyFL @PMcConnellLaw December 2019: U.S. intell… https://t.co/a4O3n6CvbI,youareoverdone,,0.0
20,"#MDPIPharmaceutics
Special Issue ""Drug Development and Treatment for Neurological Disease""

Guest Editors: Prof. Dr… https://t.co/cPoK7Uoiri",MDPIpharma,"Basel, Switzerland",0.35714285714285715
21,"Alzheimer's disease is the most common form of dementia. Join us as we:
- Gain a greater understanding of receiving… https://t.co/R11F8foI8q",alzheimerniagar,"St. Catharines, Ontario",0.2333333333333333
22,@TheRealHoarse Does that come with a side of prehistoric disease?,thegeekyphotog,,0.0
23,"📰 Have you read the scientific statement from #ACNAP and @escardio on #integratedcare in cardiovascular disease?

T… https://t.co/HHR9OIBTRj",EditorEJCN,,0.0
24,Who wants to argue that Gender Dysphoria isn't a mental disease? #prayforCovenant #prayfornashville #prayForTennessee,_Bubba_Zanetti_,,0.05
25,I have every disease,SW4GB0YDANDOXD,dangerous individual,0.0
26,i think i caught the Disease https://t.co/rC9VU8YmmV,armslngth,they/any + neos →,0.0
27,@_mutio420 @Hey__Z It makes it worse. Weed heels some disease but no breath ones,basamiyi,Oreon Stars,-0.4
28,@smirking_bitch It's a disease.,Jabo_te_patak,,0.0
29,Diabetes affects women differently than men. #DYK women with diabetes have a higher risk of heart disease &amp; other c… https://t.co/cuhwcrA59l,FDAWomen,"Silver Spring, MD",0.041666666666666664
30,@KatYraeA @SkepticCyclist @stkirsch Slight correction: they didn't discontinue use of the smallpox vaccine. What wa… https://t.co/TzFsqpZGS5,JDCBurnhil,,-0.16666666666666666
31,"Don't judge someone with a different disease.
Don't expect anyone to be perfect.
Don't think you are perfect.",harshsaays,,0.6666666666666666
32,Online Parkinson’s Registry Proposed To Determine Causes Of The Disease https://t.co/oqSO8KT1xy,KKWKCameron,"Cameron, MO",0.0
33,Online Parkinson’s Registry Proposed To Determine Causes Of The Disease https://t.co/swEbXUVwtc,KAANRadio,,0.0
34,Online Parkinson’s Registry Proposed To Determine Causes Of The Disease https://t.co/mNpgTNyrma,NWMOInfo,,0.0
35,GUYS I FUCKING HATE THIS BITCHASS THEY EPICLY SUCKED MY DICK THAT GOT MILD MORGELLONS DISEASE WHAT A BOZO 💀💀💀😂😂😂 https://t.co/1ncSgGHG0n,madickinyoass,"Yo Mama, Ass Hole",-0.12222222222222225
36,Dr. Ezzard C Burdette JR's 2015/2016 sketches trying to understand HGC sex partners and HGC NDF terrorist causing s… https://t.co/8qwgIK1Uz8,BurdettemdC,"Chattanooga, TN of ATL",0.0
37,"@KarlaMayPeachey @whoopjamboree @marghie @nursekelsey https://t.co/vtKHxVVxvJ.

""Influenza can put you at high risk… https://t.co/dG7zYEkpf8",UnchainedCub,"Lawn Guyland, New Yawk ",0.16
38,"@chickenpakoraa Depression is as real as cancer. It is a disease.  Yes, praying can help but saying that depression… https://t.co/lW7cz0G4md",Judith_sween,Pakistan,0.2
39,"I think my missing is a disease that cannot be cured for a long time ""Missing is a Disease"" by Zhang Zhenyue. 
#霸凌… https://t.co/PqooDjhGN8",towngameplay88,"Las Condes, Chile",-0.15
40,@chicaloca813 @Franktheshank88 Do you really think Bobo taught her kids sex ed?  Highly doubtful.  I not only told… https://t.co/gXMAXyHoff,Kimberworld,Future Dachshund Sancturary ,-0.20000000000000004
41,PSA: my friend @DOT_Ruth_DOT is giving away some of her beautiful artwork if you fancy getting your hands on some https://t.co/6vvBxvDjUH,MulberryCoates,,0.85
42,"@mrddmia And we also have to take mental illness seriously.
It’s a serious disease.",UniterOne01,,-0.21666666666666667
43,@HasbullaHive It looks like Mark Zuckerberg had a baby with some weird disease https://t.co/A8Ghsr5ySk,BenWasHere69,Your mom's house ,-0.5
44,"And we also have to take mental illness seriously.
It’s a serious disease. https://t.co/RHCLOtmO2Q",UniterOne01,,-0.21666666666666667
45,"New Original Article from Arthritis Care &amp; Research:

Socio-economic, disease-related, and personal factors associa… https://t.co/6dqYh5LYpN",ACR_Journals,,0.14227272727272727
46,@JosephD52079278 @MeUnloveable @Meatloafsndwch @nederino333 @DavidJollyFL @PMcConnellLaw July 2019: The Trump admin… https://t.co/PLTdwlk6B9,youareoverdone,,0.0
47,Dr. Ezzard C Burdette JR's 2015/2016 sketches trying to understand HGC sex partners and HGC NDF terrorist causing s… https://t.co/r4p7WDBadA,BurdettemdC,"Chattanooga, TN of ATL",0.0
48,"If this was true mate, we'd have the cure for every disease in the world by now and we would've figured out telepor… https://t.co/iWxR4HML4g",zerobeltabu,Sambisa forest,0.35
49,"@amermedicalassn shares how following healthy eating patterns, consuming more whole grains, fruits, vegetables, nut… https://t.co/A5EPsnjJpe",schandraVY,New York ,0.3
50,"How Will Chronic Kidney Disease Impact My Life?
Thousands of Americans will be diagnosed with CKD in 2023, but othe… https://t.co/zwIf0BVGc3",About_Kidneys,Where kidney disease exists.,0.0
51,"#RealEstate #Consulting #Digitalproducts Water Danger – Legionnaire’s disease found in Mercer County, NJ https://t.co/6nIOlvt5bi",passiveincomeca,,0.0
52,Immune checkpoint inhibitors and Carbon iON radiotherapy In solid Cancers with stable disease (ICONIC) https://t.co/vTWwFX37c7 #radonc,radonclibrary,,0.25
53,"When I was a kid in the 1960s and 1970s, ticks were only wood ticks in the summer. Crewcuts and parental checks at… https://t.co/oaH1mVtbm3",JosephSapia,"Hell's Meadow, NJ, 08828, USA",0.0
54,"@amermedicalassn shares how following healthy eating patterns, consuming more whole grains, fruits, vegetables, nut… https://t.co/Fpo4dYdeiV",schandraVY,New York ,0.3
55,Dr. Ezzard C Burdette JR's 2015/2016 sketches trying to understand HGC sex partners and HGC NDF terrorist causing s… https://t.co/95ogdtZoAD,BurdettemdC,"Chattanooga, TN of ATL",0.0
56,Looking at my flaming pantyhose spreading disease all across my flaming morgues // Killing their cold skin sucked i… https://t.co/tDjUZKTmbw,becklyricsbot,,-0.6
57,@DC_Draino transition drugs are dangerously high amphetamines and testosterone.  Killing was the fever--trans is th… https://t.co/P1W5JGW63v,LisaMil04911006,,0.16
58,don't do this to me i literally have a chronic respiratory disease https://t.co/riMlaXOIA9,chaegoric,♿ 🎗️,0.0
59,"@StFreakingKezy ""Homosexuality is a disease worse than cancer""
You get change my mind
Using dolphins as an excuse to be a fool is foolish",JohnNwosu11,,-0.225
60,"Wherever so called upper caste Hindus migrate, they carry the disease of Casteism and brings shame to our nation wh… https://t.co/vyivd3yXKk",BagdeSunil,"Navi Mumbai, India",0.0
61,"Hence, it's very important to educate yourself about this disease and take precautions to stop its spread in light… https://t.co/J5UUOZjZIs",mypsa_official,,0.46
62,"Despite making headlines lately, only a few people know much about this disease. Even though it's a rare disease, i… https://t.co/aKeICPO5ge",mypsa_official,,0.075
63,"From defining expectations-debating disease rankings, the Mara Ecosystem Livestock Vaccination Strategy workshop le… https://t.co/jZZOSn3CNP",MaraPredator,"Maasai Mara, Kenya",0.0
64,jealousy is a disease oh god i wnat it too https://t.co/7EOCkcsNGh,svtgaytron,xe her | 18 | svt w6yv bp,0.0
65,"[𝗠𝗽𝗼𝘅 (𝗠𝗼𝗻𝗸𝗲𝘆𝗽𝗼𝘅)]

Greetings, Pharmily! 💊

Have you heard of 𝗠𝗼𝗻𝗸𝗲𝘆𝗽𝗼𝘅 𝗮.𝗸.𝗮 𝗠𝗽𝗼𝘅? 🙉

Mpox is a rare viral disease… https://t.co/am4y8S7WHU",mypsa_official,,0.3
66,InMed Pharmaceuticals has completed enrollment of its Phase 2 clinical trial using investigational drug INM-755… https://t.co/cds9sUqwXE,inmedpharma,"Vancouver, BC",0.0
67,"Farmers told to be on the lookout for TR4 disease
https://t.co/fKSoNtAhxP https://t.co/Mm2gh1X9UZ",LoopJamaica,Jamaica,0.0
68,Fear as disease strikes schools - https://t.co/Tb1AzFXwZE https://t.co/POHIrOkuPo,EducationNewsKe,Nairobi,0.0
69,"A lipid profile is a panel of blood tests used to find abnormalities in lipids, such as cholesterol and triglycerid… https://t.co/08kszXiU9L",LabAltus,,0.0
70,"@OcSkits YES
JOIN THE AUTISTIC DISEASE CLUB/pos https://t.co/55twM9XBNf",Spark_N_Smiley,I'll gargle your fuckin balls,-0.2
71,"The criminal rings drugmafias,  triads, Hell Angel's Norco terrorist cartels  benefit. Drugs lords  trafficking  co… https://t.co/ANA9QNDAC8",Michael23440534,Israel,-0.4
72,Dr. Ezzard C Burdette JR's 2015/2016 sketches trying to understand HGC sex partners and HGC NDF terrorist causing s… https://t.co/eHKFLhRDkw,BurdettemdC,"Chattanooga, TN of ATL",0.0
73,@LucasPeter2017 @catturd2 Another kind of mental disease called leftism.,QT_31416,,0.25
74,Can Chronic Kidney Disease Be Reversed? Everything to Know https://t.co/KOVEYK8NoZ,About_Kidneys,Where kidney disease exists.,0.0
75,@DineshDSouza Killing was the fever--trans is the disease--Dems are the Fauci lab,LisaMil04911006,,0.0
76,"News: MSF cautions people cut off from healthcare in Omo valley at high risk after outbreak of kala azar, a fatal t… https://t.co/g15ZtyrFcH",eyeonSudan,Brussels,0.16
77,Light therapy could help reduce heart disease https://t.co/qJKucgAlgc,KnowridgeSci,Brisbane,0.4
78,@laurenboebert @RandPaul You can't when liberals keep voting the same people in. Conservative values stop this crap… https://t.co/azp7VtmCT4,itscornknobs,,0.0
79,@datachick @CNN Seriously? It was a 28 yr old woman playing make believe guy...it is a mental disease not a gender.,cgrimes198,Earth...maybe....maybe not,-0.1111111111111111
80,"""Aggression unopposed becomes a contagious disease.""",alrogebndgjr26,المملكة العربية السعودية,0.0
81,"Beliefs on disease, which sticks to the best option and decide
؟?
نمشے

🔹H20🔹
🔹H20🔹
🔹H20🔹",frajolaboladom,,1.0
82,@stillgray Identity politics is a Disease! Where is William Wallace?,ProJock1997,,0.0
83,"@BeatRhymeLists NAS King’s Disease 
NAS King’s Disease 2
NAS King’s Disease 3",jadonpruitt35,Houston And L.A.,0.0
84,"Dr. Ezzard Charles ""Chuck""  Burdette JR's 2015/2016 sketches trying to understand HGC sex partners and HGC NDF terr… https://t.co/fNAlF6APyq",BurdettemdC,"Chattanooga, TN of ATL",0.0
85,Uric Acid and Its Role in Chronic Kidney Disease https://t.co/ScCac4QQDA,About_Kidneys,Where kidney disease exists.,0.0
86,"Are you ready to take the reins on diabetes? Today is American Diabetes Alert Day, so let's start taking control of… https://t.co/MTioAZDy7Q",RoaneGeneral,"Spencer, WV",0.1
87,@pressprogress Sarah is even worse at the job than we expected. foot in mouth disease seems to be spreading from pp to the whole party.,SteveWh48941132,Canada,-0.09999999999999999
88,Killing was the fever--trans is the disease--Dems are the Fauci lab,LisaMil04911006,,0.0
89,"A new study shows eye exams could help diagnose Alzheimer’s disease earlier.
https://t.co/ThDzdnVXI7",WOWK13News,"Huntington/Charleston, WV",0.06818181818181818
90,@SavageJoyMarie1 I wld take matters into r own hands unless Uwere born w some kind of congenital illness. You need… https://t.co/CfRVp4mzAY,VoxLuce,,0.6
91,"This #AmericanDiabetesAlertDay, learn more and view this video of @NIDDK Director Dr. Griffin P. Rodgers and NIDDK’… https://t.co/qYFeIYV3GW",HarvardSchoolo1,"Boston, MA",0.5
92,@cmoreton99 A lot of the mature trees died of Dutch elm disease or blew down in the great storm in the 80s,Waggetteone,"England, United Kingdom",0.24814814814814815
93,Big Pharma awarding more scholarships to students who devise macabre workarounds for the disease outbreaks &amp; emerge… https://t.co/qwb2ntBXiU,drcrystalheath,"Berkeley, CA",0.25
94,There are several ways to treat cancer – from #surgery to #chemotherapy. #Cancer is the disease when some of the bo… https://t.co/ZG0456o6Rr,immunooncol,"Barcelona, Spain",0.0
95,Latest on #Alzheimers: https://t.co/vB2XzQCJ7C Voyager Therapeutics Presents New Data Supporting Tau Antibody Progr… https://t.co/JT0LmKnN3n,Alzheimeric,,0.29545454545454547
96,"@amydiehl Pre covid, a very large man pulled up the arm rest &amp; literally took half my seat &amp; all my legroom. I have… https://t.co/h9fVqdF8jI",KristinaRevay,,0.05595238095238096
97,"On International Women's Month 2023, let us commit to fighting for gender equity and eliminating cervical cancer as a preventable disease.",nnngo,"Lagos, Nigeria",0.0
98,Dr. Ezzard C Burdette JR's 2015/2016 sketches trying to understand HGC sex partners and HGC NDF terrorist causing s… https://t.co/xp5PdxPAlX,BurdettemdC,"Chattanooga, TN of ATL",0.0
99,Cancer is a deadly disease．  #跑分 #兼职 https://t.co/x3akBxl0Ga,Diamon33635505,,-0.2
100,the bad wakefield kpop disease,HYUNJ1lN,ryn ☆ 16 | kyujin fan 4ever,-0.6999999999999998
101,"Had this person rolled into the school wearing a MAGA hat, everyone currently handwringing about misgendering would… https://t.co/LeqDWlPfwO",jadednation70,,0.0
102,"@MrAndyNgo Sadly, the gender disease it's spreading fast, corrupting minds with hate and radical ideas.",biofriendly2020,,-0.3666666666666667
103,Don’t need to search for it when you roaches are all over the damn to infesting everyone’s mentions like a disease https://t.co/jrUbOcZ3rj,RossIynch0325,She/Her | Blk🇨🇲 🇨🇩 ,0.0
104,Republicanism is a disease lol tell me why they’re talking about tik tok legislation on Fox News when kids are dead,dirtychipwater,LARAMiE,0.30000000000000004
105,Mike Milch was inspired to start baking gluten-free treats at home after being diagnosed with celiac disease.  https://t.co/9zQdz2px3e,SLOTribune,"San Luis Obispo, California",0.4
106,"Audrey Hale’s violence, her slaughtering of children, is a symptom of a much deeper disease. Gender ideology is pus… https://t.co/wqWKSokq8z",AntiWokeGalaxy,,0.2
107,@AllenDMartin @nathandickson @AGHamilton29 Yup! N NEVER had issue! Be NICE for ALL involved to attempt to TREAT THE… https://t.co/jgLRbmgyj7,janiedoe12121,,0.6
108,"@BrianOutraged @stopvaccinating Yes, that's what we've been told repeatedly. But do dig a little deeper into how th… https://t.co/8v0rgVTf9Q",Prateekdas26,,-0.1875
109,@Ahmadridismo It's not the fault of rabid dogs ..it's the disease injected in them via social media propaganda ...t… https://t.co/JhRtxDvFnC,arsi_87,"Islamabad, Pakistan",-0.03333333333333334
110,@gbp_acctg @StanichChannel @rawsalerts We had kids with full gun racks in my HS parking lot. Why did we never have… https://t.co/J4arP2bYZv,GabrielMyCat,somewhere under the rainbow,0.35
111,@guL_citsanyD_A @dpakman I can't believe Pak-rat hasn't died of some transmissible disease yet. Amazing what bargains with darkness brings.,Darth_Vikkyo,,0.6000000000000001
112,"Most damaging for health is PM2.5, tiny particulate matter which has been linked to an increased risk of conditions… https://t.co/OeYhkKECHr",TelGlobalHealth,Free to read,0.25
113,There is nothing that can help with a mental disease when you live it wholeheartedly.,LHazard7,Area 51 or within sight,0.018181818181818174
114,@Jdh4321 @JoJoFromJerz I want to get to a society where no one would ever imagine a debate on how to best “harden”… https://t.co/UnifaGL8X5,BetterWay16,"New York, USA",1.0
115,"hanbin interacting and talking with everyone there, jealousy is a disease and im dying from it",shanbinst,she/her | 22,0.0
116,Exactly. Stop bitching about air travel. Be grateful you live in this time and you don't have to ride a horse from… https://t.co/L1LhWjhvwy,hike_lee,"Georgia, USA",0.19318181818181818
117,"The good news is that they're really considered a nuisance #pest,” she says. So while house ants may show up on you… https://t.co/T9rsmoGr3r",EntomologyOrni1,"Barcelona, Spain",0.44999999999999996
118,"#Vitamin_D_deficiency can lead to a loss of bone density, which can contribute to osteoporosis and fractures (broke… https://t.co/ZVZopPnabS",NutritionalOf,,0.0
119,"@live_rehab Some medical doctors view it a disease. Others don't. Also, negritude and homosexuality were once consi… https://t.co/Vob1oJtldf",AnAddictAtheist,,0.0
120,Sadly autoimmune diseases are too often misunderstood &amp; misdiagnosed by healthcare providers.  We need better autoi… https://t.co/K9bRkFAAyt,AutoimmuneChat,,0.0
121,This wicked world desperately needs the Gospel! Nothing else will solve all its problems. It suffers from the deadl… https://t.co/DJngXSwRPl,ChefRobCo,LA - Lower Alabama ,-0.6
122,@sabhlok SARS-COV-2 has been found in European blood samples from September 2019 so this highly contagious disease… https://t.co/mE6N4OouUN,timjames16,,0.08
123,"@IsFrictional @MidVermontCS What ""human rights"" are you defending? If you don't think women's rights are human righ… https://t.co/bFb3aJMEwz",MsYAxisLabel,,0.0
124,"New GM crop trails for Potato 🥔 KJ 66 (resistant to late blight-
RB gene taken from the wild potato species Solanum… https://t.co/yszD0j0UY8",rajesh_ento,"New Delhi, India",-0.02121212121212121
125,@sumitkapoor16 @cz_binance @binance @BinanceAcademy What should young people do with their lives today? Many things… https://t.co/lx22YCblWH,Rahulraj0110,,0.3
126,"@canadavsengland @TomiLahren In '21, more Black men ages 15-24 died in gun homicides than from unintentional injuri… https://t.co/GAGejD8Vch",keaganchase,"Florida, USA",0.16666666666666669
127,"New study sheds light on the molecular effects of oxygen on proteins in cells, highlighting the importance of under… https://t.co/b1ufxsmK6M",naturallylifeAC,Türkiye,0.2681818181818182
128,what really annoys me is the fact that people don’t understand that you can be overweight and healthy- like…it’s ve… https://t.co/IcFhnITLdh,Basic6lyy,🇦🇺,0.35
129,Carcinoid Heart Disease-Induced Right-Sided Heart Failure as a Culprit for Significant Ascites - https://t.co/qkujV5nl78 -,Dataemia,United States,0.11468253968253966
130,@Atticus59914029 @IRussellCT If people address this social disease as if the solution is simple they are trapped in their agenda.,ltennimon,,-0.05555555555555556
131,i have a disease (gay disease),rainbowsnack69,big ass cloud lol,0.0
132,Chronic Kidney Disease: Expert Explains The Importance Of Timely Treatment And Prevention https://t.co/UsCksMSlcY,About_Kidneys,Where kidney disease exists.,0.0
133,"The criminal rings drugmafias,  triads, Hell Angel's Norco terrorist cartels  benefit. Drugs lords  trafficking  co… https://t.co/0nO5zAspGx",Michael23440534,Israel,-0.4
134,@SouthboundTexas @rrmin36 @AdamKinzinger What if you died from a preventable or minimizable disease? How would that have helped your family?,OgouBadagris,,0.0
135,"Because now outsiders are humans in their eyes and Pakistanis are insects. This is an illegal rate of 22 grade, Mun… https://t.co/SMYStj6vWD",BasitButt145717,,-0.5
136,"Protect Your Lung Health

Having healthy lungs is essential for overall health. 

For healthy lungs and a healthy l… https://t.co/bbrFwmse3n",DrErkanYILDIRIM,"İstanbul, Türkiye",0.3
137,Pentose Pathway Activation Is Superior to Increased Glycolysis for Therapeutic Angiogenesis in Peripheral Arterial… https://t.co/aBsGvUfKBI,hypoxiapapers,,0.7
138,The association of electronic health literacy with behavioural and psychological coronary artery disease risk facto… https://t.co/W1AfFVZDk5,digitalhealthev,,0.0
139,PubMed indexation for the European Heart Journal - Digital Health: a small step for the European Heart Journal fami… https://t.co/IJl2Bw0i9j,digitalhealthev,,-0.0625
140,Huh. I guess I'm not going to DC ever again. Bummer. I liked the museums. I like my lungs not infected with disease… https://t.co/RD6RQxOHIi,TenshiHime13,"Middle of Nowhere, USA",0.6
141,@ZachTinker It's a symptom of the true disease which is white supremacy,gopackgo425,,0.175
142,@MeCommonRaccoon @DrJBhattacharya Do masks work to block disease  or block the brain ?,JohnOdishaw,,0.0
143,"@HeatherHaddad10 @war24182236 @abc7newsbayarea People with Cancer have ""safe' places to go to and have them to be… https://t.co/dRvsPBGqFJ",E_L_O_Die,"San Francisco, CA",0.5
144,"To government,politicians,liberals and media NEED to realize that ITS NOT about Guns,its about MENTAL ILLNESS that… https://t.co/0YmIPDJolT",centeno_eulalia,Somewhere in New Jersey,-0.1
145,"""As of 19 March 2020, COVID-19 is no longer considered to be a high consquence infectious disease (HCID) in the UK""… https://t.co/QRefXO0fMP",NewsOnChain,,0.16
146,"Thing is he probably can't get fired. GoK rehabilitates, or thinks it can rehabilitate alcoholics.  Even refers to… https://t.co/rLEzOddMtS",kinjeketile,"Vladivostok, Russia",0.0
147,"Tanzania MoH declared an outbreak of Marburgas of 22 March, a total of eight cases, including 5 deaths @WHO #MVD… https://t.co/yvxednDVrt",claudinnetweets,USA,0.0
148,"I think my missing is a disease that cannot be cured for a long time 
#白虎 #夜场 #白虎 https://t.co/Bq1a3hx8B7",nadimsaifi,mumbai,-0.125
149,"@iluminatibot yep , in the  seventies and eighties , there was no such thing as lyme disease",kat_mystical62,New York ,0.0
150,@TheDaredevil I totally get this. I happen to have an invisible disease so with that I face a different set of issu… https://t.co/hiGx3qucZd,heidisammons,"Laguna Beach, CA",0.0
151,"One of the most useful pieces of diagnostic equipment in cardiology is the simple tape measure.

If your waist circ… https://t.co/HkQ42SSb6W",Paddy_Barrett,,0.26666666666666666
152,@EM_RESUS Damn I thought you were a doctor. Anyone worth their salt in the medical field knows the leading causes o… https://t.co/1KpuqQzUWc,ODLHodler,,0.15
153,"If time could be reborn 
 we never mount with ravens from isolation 
 The disease has come in our agony 
 And we ne… https://t.co/uf9Hvv68WD",AutoDjent,Darkness,0.0
154,Fowl Cholera Disease and Methods of Treatment https://t.co/PSZtvRoo7J,BenadineNonye,Nigeria,0.0
155,Louise is getting surgery on her mouth today she had some type of mouth disease so now they have to remove a bunch… https://t.co/CYiD4KweGx,mysuspets62502,,0.0
156,"@live_rehab If I'm a runner who habitually runs and then one day I get a cut that soon after become infected, is ru… https://t.co/bdTELrRohc",AnAddictAtheist,,0.0
157,"Let’s break a myth about strength training.

“Strength training is just for athletes.”

Wrong. It’s for anyone who… https://t.co/aGj0oYSObk",Kali_Kehayov,,-0.5
158,@KRae_shihTzu20 @Russell25604998 @RepMTG You do understand that the Covid craziness was gaslighting you? It was a c… https://t.co/NyGP5yho7Z,Hopiter5,,0.0
159,"@lesstenny Yep, had my 5th and finally diagnosed with covid today. If the vaccinations lessen the severity of the d… https://t.co/DHqiVCNKFC",tillysnitch,"New South Wales, Australia",0.0
