,tweets,user,location,polarity
0,Ding et al. developed an #ArtificialInteligence (AI)-assisted #imageanalysis and quantification process for stained… https://t.co/tfwCDmgNB3,TheJEADV,"Lugano, Switzerland",0.1
1,"@Alisonkc200 @mirandadevine Whatever disease his spouse gave him, it is making his hair fall out!",WendellinWA,Guess,0.0
2,"Severe health issues are observed after the devastating flood in 2022 such as malnutrition and respiratory illness,… https://t.co/kjv0o48uhG",SeharSHasan,Pakistan,-0.5
3,"While most organisms prefer DNA to store genetic information, many disease-causing viruses have benefited from havi… https://t.co/rX2lTpEQ33",TheHinduScience,"Chennai, India",0.5
4,"Bolton 10-year-old fundraising for cousin with Batten's disease
https://t.co/jSXlJIO61P",TheBoltonNews,Bolton,0.1
5,That book has been used to taint or cover the intellectual gaps on everything humans cannot understand... remember… https://t.co/edW4RLIsBC,Obacebryn79,UGANDA,0.3
6,"@Aussiephil2 @chazharris @Preem07 @BenJStrang Top 20 anthropogenic disasters* by mean death toll:
Western World = 1… https://t.co/Zn4Z0xUJaA",ComradeMikedrop,Aotearoa,0.0625
7,"@angela_hannides @Reuters Whatever disease his spouse gave him, it is making his hair fall out!",WendellinWA,Guess,0.0
8,"NURS 6501 Advanced Pathophysiology, PATHOPHYSIOLOGY THE BIOLOGIC BASIS FOR DISEASE IN ADULTS AND CHILDREN 8th Editi… https://t.co/lwbiNLuIMI",fliwyexamdumps,,0.4
9,"CHAIRMAN 'CLEARS'  THE ROAD FOR THE OKUMKƆM MANIFESTO🔥🔥
The All-knowing Physicians Have Had Their Fingers On The Pu… https://t.co/jE6fGR70BZ",GhanaLdc,,0.0
10,"@HagwithAttitude Whatever disease his spouse gave him, it is making his hair fall out!",WendellinWA,Guess,0.0
11,Mulder &amp; Scully are stalked by sideshow performers when Skinner is infected with a mysterious disease.,X_Filed,[redacted],0.0
12,"@EyLoulou Whatever disease his spouse gave him, it is making his hair fall out!",WendellinWA,Guess,0.0
13,"Congenital heart disease (CHD), a heart defect or abnormality present in newborns, is a term that strikes fear in p… https://t.co/Ev0yPTb8LN",dailycitynewspk,Karachi,0.0
14,"5 Dangerous Consequences of Untreated Gum Disease
https://t.co/lL4gWb6dZx
https://t.co/VWH6CSsDWJ https://t.co/18DwHDDsyf",DrNavid1,"New York, NY",-0.6
15,"violence was a disease gansey didn't think he could catch. but all around him, his friends were slowly infected.",ganseyslut,@paulfromme,-0.30000000000000004
16,"@michaelmina_lab @JayGordonMDFAAP Feline coronavirus has been endemic in cats for decades, a sequelae of this disea… https://t.co/2777eyXett",LexiFord17,Canada,0.0
17,"@Erulastiel14 Whatever disease his spouse gave him, it is making his hair fall out!",WendellinWA,Guess,0.0
18,"i don’t hang with jealous bitches, that’s a weak disease",ptxcii,𝖙𝖎𝖓𝖎𝖆𝖓,-0.375
19,I love my heart disease with a side of anecdote,botofthestates,USA USA,0.5
20,"@Morgayze Whatever disease his spouse gave him, it is making his hair fall out!",WendellinWA,Guess,0.0
21,"@DomajorReminor Whatever disease his spouse gave him, it is making his hair fall out!",WendellinWA,Guess,0.0
22,"March is Multiple Sclerosis Awareness Month, raising awareness and educating yourself and others is a critical part… https://t.co/Kkh4Ay9WVg",inDNA_life,"Bhubaneswar,Odisha",0.0
23,"@Lailaine0815 Whatever disease his spouse gave him, it is making his hair fall out!",WendellinWA,Guess,0.0
24,@LOLKNBR It's almost as if Angel Hernandez a communicable disease that's infected the lot of 'em...,SpaceBrees,,0.0
25,"Children are the least responsible for causing climate change, but they face the most danger. The climate crisis is… https://t.co/TsfXiDsYwU",vanessa_vash,Planet Earth 🌍 ,0.13333333333333333
26,"@shoedweller1 @ValeNappi To half formed creatures, The Nephilim. He is still the good guy? The Nephilim defies even… https://t.co/H46on8EsYS",MichaelDamm15,,0.26666666666666666
27,U-Shaped Relationship Between Serum Lactate Dehydrogenase with All-Cause Mortality in Patients with Chronic Obstruc… https://t.co/MWq25dDOmp,LungOmics,"New York, NY",0.0
28,"@NiacinGlutamine @Nohj_85 @ake2306 @Michell87463246 @React19org Hun I'm not ivermectim injured,  I'm injured by the… https://t.co/4rkTY7iE8T",catparkerphoto,"Plymouth, MN",0.0
29,"can't blame them, it must be hard having a good relationship when someone is always being abducted by aliens or by… https://t.co/fiS42tGhuo",gilliancapybara,de boa na lagoa • 26 • she/her,0.20416666666666664
30,"'Systematic mapping is required to identify animal model systems for disease vulnerability, resistance, and counter… https://t.co/jrx6EBqZ1N",mick_tagg,,0.0
31,@LibbyMbc The mind is a powerful thing. I have friends with cancer who are managing their disease. One was diagnose… https://t.co/VPwiI53P49,LisaWlvmom,"Westlake Village, CA",0.3
32,@spectatorindex Old news from 2022 https://t.co/8OcvJXVW5s,Nighthawk978,🇯🇵 ,0.1
33,"Please listen to &amp; share the new ep of
#diaryofakidneywarriorpodcast  ft Prof Ibi Erekosima @ibiereks exploring the… https://t.co/5bsnZsg2BN",diaryofakidneyw,"West Midlands, England",0.13636363636363635
34,"@rupamurthy1 ""Nehru"" died out of serious disease some says d cause of death wz HIV. 
""Indira"" died bcs of her curse… https://t.co/XjkNtF3INk",illusion_hind,India,-0.3333333333333333
35,What agencies can do to lower cardiovascular disease risks for first responders https://t.co/P6CDYUN89A #policenews,PoliceOne,Everywhere,0.25
36,"Leftism despises everything that’s not of their leftist disease, they are always right and everything else is evil https://t.co/Yar3UfoCzV",LamaZense,Kyoto,-0.25476190476190474
37,"@veggieto @cbouzy Whatever disease his spouse gave him, it is making his hair fall out!",WendellinWA,Guess,0.0
38,I miss Kai and Rover. Huhubels. What is this PRD post-rover-disease,joizjoyts,,0.0
39,"@vondollo @ctvregina Actually, no. I re-thought this. 

My dad died 3 months ago of an infection he got in the hosp… https://t.co/6ka5FvlLX6",LyingCreep,your mom,0.0
40,"@GradientMermaid @marieclaire Whatever disease his spouse gave him, it is making his hair fall out!",WendellinWA,Guess,0.0
41,1/2 Thank you FAO for taking steps to improve the food security of households by addressing the health of chickens.… https://t.co/zXNOTaVsAM,abcs_cons,Kabul,0.0
42,@BongoIdeas ''Attention seeking is not bad but too much of it is a chronic disease'',ken_lusha,Kumasi ,0.27499999999999997
43,Albay 2nd District Rep. Joey Salceda hopes the Senate would approve on third reading a bill that would create the c… https://t.co/x6oJvgy7Oh,nowyouknowph,Makati City,0.0
44,the mild transphobe to total nazi pipeline is wild. it’s like watching a deer lose to brain disease https://t.co/V8kno60L1S,mothandtwoferns,"she/her, 18",0.14444444444444446
45,"""It is perhaps the most devastating disease, as patients are ostracised and denied proper care"" Deepak Kapur, Head… https://t.co/3YB8JuMWFR",CombatNTDs,,-0.16666666666666666
46,"She didn't learn about her disease not until last week, when they went to a doctor. So through commission I was hop… https://t.co/9kOi4QcsFf",EdithSedit,,0.0
47,Roadkill: vehicle collisions may be threatening the survival of some mammal populations. A study found that roadkil… https://t.co/0r9EFlqopc,barbosavl,"Bedfordshire, UK",0.0
48,"@elonmusk @GAINNowAmerica Offcourse! 1001% correct, anyone against Tesla is automatically a Carbon dioxide/disease… https://t.co/gM3aru4Q9L",iykeinfos,"Abuja, Nigeria",0.0
49,"@RealCandaceO Candace, you’re such a disease.",masumehdadebala,,0.0
50,"Based on the number of Kyasanur Forest Disease (KFD) cases in the past, the team conducted workshops in parts of Si… https://t.co/ojJulr0QxQ",cwsindia,,-0.25
51,"@SarahData_ Harry looks more like Elton daily. Whatever disease his spouse gave him, it is making his hair fall out!",WendellinWA,Guess,0.25
52,@UrFav_Canadian @berd_communist @ryanseanbadger @ShitpostGate subjecting other people who can't get a vaccine for h… https://t.co/RROAvsxFv3,marsdemio,,-0.125
53,csh is a disease and I’m a carrier who spreads it around. https://t.co/OXgs08Cx83,surfjerkk,"California, USA",0.0
54,#Psychiatric and #Neurological #Manifestations of #Celiac #Disease in #Adults https://t.co/zdclT7A6kJ… https://t.co/wgFTbYDvbC,EdeshSeba,,0.0
55,@Middlemancrisi1 @LorenzoHall @wusa9 Unfortunate situation. Conservativism is a disease of the soul.,MerrillReno,"Oregon, Ohio",-0.5
56,@mybmc @mybmcWardHE @PMOIndia @amitabhk87 @G20_Bharat @CMOMaharashtra @Dev_Fadnavis @MPLodha @dvkesarkar… https://t.co/k3XzPmJnXX,thetruetrue,,0.0
57,"@KarenLasagna @RoyalReporter @SkyNews @DailyMirror @DailyMailUK Whatever disease his spouse gave him, it is making his hair fall out!",WendellinWA,Guess,0.0
58,@j_t_2390 @theproof @kitchenconserv Well now I'm going to have to try and read &amp; understand it. Because the title p… https://t.co/JBG3bHDaVt,stathitriadis,,0.0
59,"@AmbikQueen Whatever disease his spouse gave him, it is making his hair fall out!",WendellinWA,Guess,0.0
60,"6 Effective Tips on How to Prevent Tooth Loss
https://t.co/X9MHF904XQ
https://t.co/1Rn9TDiyHv https://t.co/TZjHcTj2Qf",MariannaWeiner,"Brooklyn, NY",0.6
61,"@Phillip93831930 Whatever disease his spouse gave him, it is making his hair fall out!",WendellinWA,Guess,0.0
62,A non-drug neuromodulation intervention has the potential to better address the complex nature of neurodegenerative… https://t.co/6bkekhGbHN,healthtechOC,"Orange County, Ca",0.06666666666666667
63,"doctor said i have hyper tyroid and it’s a long-term disease, i have to drink meds everyday and checkup every month… https://t.co/wFXlh6c56B",beckfreenist,🔞🌈,-0.125
64,"@Dharghan_ Whatever disease his spouse gave him, it is making his hair fall out!",WendellinWA,Guess,0.0
65,New Research: Editorial: Health literacy and disease prevention https://t.co/2IQEb7xK6T #PublicHealth #HealthForAll,FrontPubHealth,"Lausanne, Switzerland",0.13636363636363635
66,"@ricketiki Whatever disease his spouse gave him, it is making his hair fall out!",WendellinWA,Guess,0.0
67,@sentinelx92 @ADayTaramember @dainserk God created man and woman but after the fall of man sin entered the world wh… https://t.co/z9PY3Va5uG,LilHypnoLynx,𝚜𝚘𝚖𝚎 𝚊𝚏𝚝𝚎𝚛 𝚗𝚘𝚠,0.0
68,@Lashed2theMast @ddaily99 @MichaelARothman 5% of ppl. have true celiac disease. Many more are sensitive to it. I am… https://t.co/VfINAo8muO,bpw7,,0.36250000000000004
69,"Yr 10: Communicable disease

Bird flu in the news:
H5N1 strikes again,
This time in mammals.

#BiologicalHaiku… https://t.co/EjyPTMEEBH",leysbiotutor,"Cambridge, UK",0.0
70,Meta‐analysis: The impact of light‐to‐moderate alcohol consumption on progressive non‐alcoholic fatty liver disease https://t.co/XImlMPg6jJ,DrJHK,Korea(대한민국),-0.012499999999999997
71,At least 28% of children five years &amp; older have experienced untreated tooth decay while nearly 25% of 15-year-olds… https://t.co/gZIRWOhNa4,expressoshow,South Africa,0.19166666666666668
72,Editorial: Health literacy and disease prevention https://t.co/04NZKwKuck,OzdenGokdemir,,0.0
73,You conveniently didn't mention the severity of your disease for which the doctor might have suggested so. Before y… https://t.co/R16oaUZSur,SparesofWar,,0.0
74,Editorial: Health literacy and disease prevention https://t.co/LfIoy3yFMj,OzdenGokdemir,,0.0
75,"When there is an overdose of information, a bit of it is always going to be misinformation. Never ever abruptly sto… https://t.co/fRzcMqLn9q",DoctorLFC,India,-0.125
76,lung cell infected with SARSCoV2 or lung biopsies from COVID19 evidenced altered gene expr that matched those obtai… https://t.co/Lcy21DtH48,BagaiDr,"New Delhi, India",0.0
77,"@OutlanderJamie_ —wanted to still be a surgeon. 

Then the plague we were trying to outrun in Europe made its way t… https://t.co/tvP50fkjAn",TheSassenach__,ᴘᴇɴɴᴇᴅ ʙʏ ♔ #ʀᴇᴅǫᴜᴇᴇɴ  ♔ ,0.0
78,IL11 signaling-related genes were also differentially expr.  both WNT5A and IL11 were involved in pulmonary fibrosi… https://t.co/jlNQxJMk69,BagaiDr,"New Delhi, India",0.0
79,@Rancher_JohnG @Ilegvm Better get your guns before heart disease comes to your door. Trump is counting on you sendi… https://t.co/aeE2yQxANC,kinggavrock,"San Diego, CA",0.5
80,"...a few metabolic paths, as if on a few pages of a biochemistry text. The existence of these categories or disease… https://t.co/NlcN763XFf",MatsVinnaren,"Greater Helsinki, Finland",-0.2
81,"@Sthanu5 ▫️ In otherwise healthy children, chickenpox typically needs no medical treatment. Your doctor may prescri… https://t.co/T5bEhpFIcN",shaykh_hamed,,0.11111111111111112
82,"@AmbikQueen Whatever disease Harry's spouse gave him, it is making his hair fall out!",WendellinWA,Guess,0.0
83,"Over 10% of children in Japan who developed acute brain syndrome after infection with COVID-19 have died, Kyodo New… https://t.co/oegPxoYVWz",KhmerTimes,"Phnom Penh, Cambodia",0.27878787878787875
84,"@LoDuv -Get another doctor
Who specializes in 
Parkinson’s.
-Be specific- his behavior and symptoms 
-Bring a list… https://t.co/eFbWDupIVo",Conserv30187675,PNW,0.0
85,@LisaDenise54 @TwitterSupport I have a couple of recipes for dogs with kidney disease that can be made in a crock p… https://t.co/B5iBBnrChJ,ardso2,"Tiburon, CA",0.0
86,"@lumelights Born to contract disease, forced to get vaccinated 😩",BeefMandarin,"Irvine, CA",-0.30000000000000004
87,"@jamoyek11 @jacksonpbn He has not even resumed, you are talking of 8 years.

When was the constitution amended to 8… https://t.co/PFbUvZnuY6",umoh46,Nigeria,0.0
88,"@dickiemoore5 @KayBurley Whatever disease his spouse gave him, it is making his hair fall out!",WendellinWA,Guess,0.0
89,"@Chicago_Daisy If there was a foot in mouth disease, they’d all have it.",WildNorth13,,0.0
90,@captaincwjensen @Oregonian Exactly. Right now the only people in America who are guaranteed a humane death are tho… https://t.co/pxHpiot9h1,Heldtoanswer,"Portland, OR",0.14285714285714285
91,@AlegoGeorge3 @CollinsKipkur15 @Saitabao @RailaOdinga @makaumutua Denial is a very dangerous disease. Baba can not… https://t.co/zCHSJVcOZd,CeoOtieno,"Brisbane, Queensland",-0.78
92,@DrAethiana @DruvBhagavan ..the kid.  The Polio epidemic brought a transformation to vaccine availabilty...and as M… https://t.co/peXCc5v6ro,p_tuller,,0.0
93,"@fascinatorfun TLDR: 'In other words, it looks like adaptation to increasing global temperatures has enabled strain… https://t.co/DsGX1cI46L",hughbarnard,@hughbarnard@post.lurk.org,-0.0625
94,"Police said the suspect was 28-year-old Audrey Hale, who ""identified"" as transgender.

Wokeism is a mental disease… https://t.co/AYIE39jA7o",MeSavarkar,,0.0
95,"@2baeyes Whatever disease his spouse gave him, it is making his hair fall out!",WendellinWA,Guess,0.0
96,@coreybking My SIL is one of 9 siblings. A few years ago one of her sisters' got a disease that caused her kidneys… https://t.co/w1VFcWXcoJ,LeftCoaster44,"Bay Area, California",-0.2
97,Cureus | An Atypical Case of Lyme Disease Presenting With Lyme Carditis | Article https://t.co/gz9Dt1Aw3G,CarstenNicolaus,London / UK,0.0
98,"@TourreBakahai @KathViner Whatever disease his spouse gave him, it is making his hair fall out!",WendellinWA,Guess,0.0
99,@tedcruz Why treat the symptoms of the disease when you can treat the disease itself?,PaulsenDp,,0.0
100,"India started embracing the biotech agri-products !
 
https://t.co/mvoWNVStJ5",PlantAdaptOme,"Palampur, India",0.0
101,"@PeteUK7 The minimum, the absolute bare minimum would be accurate information about disease, its causes, and how to lead a healthy life.",MeddygLou,Wales,0.28750000000000003
102,"@nancytsidley Whatever disease his spouse gave him, it is making his hair fall out!",WendellinWA,Guess,0.0
103,"Only a true Satguru can relieve us from the disease of birth and death.
#GodMorningTuesday https://t.co/eQ3PUq3fuz",RDasi10,,0.175
104,An Atheist believes that a hospital should be built instead of a church. An atheist believes that deed must be done… https://t.co/jACoyVadML,spaceladyx3,,0.0
105,"@official_gbeng I wonder. 

Ignorant is a disease.",ObinnaEmmy,Yaba Lagos ,0.0
106,if vilera had hanahaki disease . hm,vanhwzns,:D,0.0
107,@leebee4life It's like a disease...,sarahlubin,"Portland, OR",0.0
108,"@umichvoter To quote Dr house, you need to learn every disease from amyloidosis to zalymoidosis.",uw_mod,,0.0
109,"@TheFakeDuchess Whatever disease his spouse gave him, it is making his hair fall out!",WendellinWA,Guess,0.0
110,The theme for the 10th APFSD hosted by @UNESCAP is “Accelerating the recovery from the coronavirus disease (COVID-1… https://t.co/rT08Bm2Mmt,UNEP_COBSEA,"Bangkok, Thailand",0.0
111,"you will never get rid of me, oh i'm like a fucking disease, i'll make a home in your gut 'cause it's somewhere war… https://t.co/wPGLj9B5sp",favlyricsb0t,,-0.5
112,"😷 The poor quality of air we breathe in our towns and cities is a health catastrophe.

🚙 Vehicle emissions are link… https://t.co/XV9CLjWdVC",greenmattbfd," Bradford, West Yorkshire",-0.4
113,michikatsu my son they have every disease https://t.co/Tg0dnFqcVT,knyanythingbot,"joke acc, KNY SPOILERS AHEAD!!",0.0
114,"@itvmeridian @StaceyPooleITV Yet children are still forced to attend purposely unmitigated classrooms, where they a… https://t.co/n7z1bArPLe",DavidFoxon2,"England, United Kingdom",-0.30000000000000004
115,"@TheFakeDuchess Whatever disease his spouse gave him, it is making his hair fall out!",WendellinWA,Guess,0.0
116,@writeriowa Y’all weirdos pushing this disgusting disease on innocent People there is only 2 gender’s!,ElijahMB,"Waterloo, IA",-0.16666666666666666
117,"The @City_Ekurhuleni public vaccination site list. 

COVID-19 vaccines have proven to be the best form of defense a… https://t.co/Bg9FruYKPk",GautengHealth,"45 Commissioner Street, JHB",0.5
118,@CRRJA5 @catturd2 @its_the_Dr @NahBabyNah @polishprincessh @45LVNancy @TheThe1776 @SquillMama @FemalesForTrump… https://t.co/TRvgLBnSaL,outofthebox68,"Florida, USA",0.0
119,"@CiciTee1 Whatever disease his spouse gave him, it is making his hair fall out!",WendellinWA,Guess,0.0
120,"In the past, it was known as ""internist's disease"" but with the increased use of  cross-sectional imaging, it would… https://t.co/nDNSuJoKYV",DrYukselUrun,"Ankara, Türkiye",-0.125
121,"New form of #omega-3 could prevent visual decline with #Alzheimer’s #disease
https://t.co/3rzsbcoAVd",newswise,Charlottesville,0.06818181818181818
122,"@JudyO49124538 Whatever disease his spouse gave him, it is making his hair fall out!",WendellinWA,Guess,0.0
123,A man from Ipswich is to undertake awareness and fundraising ventures for his niece after she was diagnosed with a… https://t.co/E91HPpnbhZ,ipswichstar24,"Ipswich, Suffolk",0.0
124,@officialakande1 Until they infect you with disease,Juicyray11,,0.0
125,"@ABridgen In the USA, the EUA language says they need to prevent the disease.

21 US Code 260 bbb

The disease is C… https://t.co/LNvfPjjuDE",I_Am_JohnCullen,..right over their shoulder.,0.0
126,@AMindinao @JamesCu79923978 @EndWokeness A substance used to protect from a disease. Like the covid vaccine made fr… https://t.co/aXGENCW6Pd,plsesendhelpnow,Schweiz,0.0
127,"your smile brings disease, 'cause we're young, fell in from the stars",crcastles_bot,hell,0.2
128,@RogerPielkeJr It's amazing how less than 40k related deaths per year - 2/3 of those suicides - can provide enough… https://t.co/f27XrKqgQn,sporglefork,,0.10833333333333336
129,Large study on risk of death after COVID19 vaccination and infection based on UK data. Slight elevation of ROD from… https://t.co/lIYxmpyHqv,MarionKoopmans,"Rotterdam, The Netherlands",0.023809523809523808
130,"Baby please, adore me, adore me!! I am living for your disease.",bpdpilIed,30 || ic : dr chalk,0.0
131,"@BrutusMaximusX Whatever disease his spouse gave him, it is making his hair fall out!",WendellinWA,Guess,0.0
132,"@EndWokeness Ironic since the medicine that they practice is 100% created, researched, developed, implemented and o… https://t.co/pTJRifa9OC",Duka_Tsla,,0.15000000000000002
133,"@dellabeach1962 @iamericmichael @apwk0rg #HSV1, #HSV2, and #HHV8 are herpes viruses that do cause a lot of human di… https://t.co/gJc2DIdIEu",PongoHuston,"Chicago, IL",0.0
134,"@roh_tweets @accidental_kiss @GGKrishnamoomoo Yeah, no. You absolutely do not ever excuse *the actions*, unless may… https://t.co/l8j4HFtydf",jonfmorse,Back in Overland Park finally,-0.07500000000000001
135,"@BrutusMaximusX Whatever disease his spouse gave him, it is making his hair fall out!",WendellinWA,Guess,0.0
136,I would think if you have herpes syphilis or gonorrhea or HIV or any other sexually transmitted disease or infectio… https://t.co/0XvFPj5fFT,IKnowSheTwitent,World ,0.1875
137,@KristanHawkins Treating life threatening injuries isn’t healthcare! Because being in a car crash isn’t a disease! 🤪,easaboski,"Auburn, IN",0.0
138,covid created huge learning deficits. not closing schools. covid. the deadly disease. which made it impossible to k… https://t.co/BRdbLSW9z2,nberlat,,-0.15555555555555553
139,"@TourreBakahai Whatever disease his spouse gave him, it is making his hair fall out!",WendellinWA,Guess,0.0
140,@shasel1104 @mandy_riddler @jikjik14270120 @itsallinaname1 @Rob_Roos Oh we went from the chicken little  THE COVID… https://t.co/lKSMcI34hh,CubanCelt,Mid Atlantic,-0.39375
141,"@TezzaBradshaw Whatever disease his spouse gave him, it is making his hair fall out!",WendellinWA,Guess,0.0
142,"@gilgal_uchechi These guys need education more than these camps , ignorance is a bigger disease.",BlackArtDubem,Nigeria,0.25
143,@adamd3560 @GioZamboni @tarponbillsfan @snappers27 @JoJoFromJerz @RepMTG Well before that we weren't asking people… https://t.co/O6ZHK2a5HO,JarrousMichael,"Farmington Hills, MI",0.0
144,"here is a plea, from my heart to you— nobody knows me as well as you do. you know how hard it is for me to shake th… https://t.co/K0vNlmacaW",bounsce,oblivion,-0.2916666666666667
145,"Once again..We are our own problem. Ignorance, illiteracy is a big disease. https://t.co/kbUwDv8yoh",Dr_Bellick,"Lagos - Ibadan, Nigeria",0.3
146,"Depression is associated with increased risk of premature coronary heart disease, according to a large study based… https://t.co/J6Kjnkx6sE",localhostsci,,0.21428571428571427
147,@Africa_Archives Dutch disease incoming?,cishaan,,0.0
148,"wait  no  seriously,  what  is  a  Scrooge.  is  it  some  kind  of  disease  or?",TRVXLER,"1/3  of  mirkwood’s  royal  hunters:
( @SYLVESTRlS ; @dearlygrown )
#winsomedescent. | pfp: reclusecomics. | header: terra.",0.3833333333333333
149,"@VigilantFox @SenRonJohnson Neurological conditions caused by auto-antibodies include mental retardation, Parkinson… https://t.co/ivzjzIZ7as",Luvnlight212121,,-0.1
150,1. Single measurements of telomere length are meaningless because it is the rate of telomere shortening that is rel… https://t.co/0KXsUTTRBz,telomerenetwork,,-0.2857142857142857
151,"@JamColley @moviemazz Dysentery?

Heart disease?

Diabetes?

:)",kovarchi,,0.0
152,"@bergi1954 Whatever disease his spouse gave him, it is making his hair fall out!",WendellinWA,Guess,0.0
153,@Ledhedd2 @USAO_MIE Karma gets them already 4 being the garbage dreck of humanity let alone HEALERS! Hard work taki… https://t.co/V0fqme2tr9,ezmirellda,USA,-0.2916666666666667
154,@VigilantFox @SenRonJohnson An auto-antibody is an antibody that attacks one or more of a person’s own proteins. Ma… https://t.co/bac1ONfQnv,Luvnlight212121,,0.55
155,@adityavnayak Who is she and why she is laughing like a mad without any comedy? Is she suffering from some disease 😔,Berlin_MHS4,,-0.625
156,@lonewolf208 further guidance. Ignorance is a disease. MLSCN has done noble to give MLT pathway to further their st… https://t.co/PLiQo36JQp,aaron_ayodele,,0.19999999999999998
157,"hanahaki disease but the person either forgets who their lover was or just dies, so basically no happy ending makes… https://t.co/F9Qog1uiIY",hiyyuvn,,-0.4
158,@DoaneBarile @JtheCat3 @TheUnrealPeterG @JackPosobiec Please tell me more? Like if the native Americans had guns in… https://t.co/rwL0e7qq4K,ConkiLarson,,0.5
159,@antio @AlpacaAurelius Not true. Wells are often contaminated too from environmental toxins. Plus well water has be… https://t.co/jQHLuZG5va,Jennife52482551,"Texas, USA",-0.175
160,@alok_bhatt Along ji ask any allopathic doctor about any permanent cure of any disease there reply is yes but go sp… https://t.co/tNgwoIGz08,JhaPranav0901,,0.0
161,"@Sthanu5 ▫️Varicella (chickenpox) 

Acute infectious disease caused by varicella-zoster virus (VZV) (DNA virus, her… https://t.co/WjMKePHMh6",shaykh_hamed,,0.6
162,@VigilantFox @SenRonJohnson The suppression of T-cells enables cancer and other dangerous infections to develop. In… https://t.co/4o0PMJ7Mdd,Luvnlight212121,,-0.3625
163,@Ripdavo_ @maybesobo Did I cure a disease or did I just state common knowledge,drewskiiiii15,"Texas, USA",-0.3
164,India loses a cheetah to kidney disease within seven months of translocation from Namibia - The Independent #India https://t.co/1O9vNGyGZf,Hoosierland02,,-0.15
165,"In 2070 will we still see millions of 50 year olds getting debilitating disease from SARS-CoV-2 infections?

I thin… https://t.co/crcfa77AjE",michaelmina_lab,"Boston, MA",-0.4
166,"The Spanish conquest resulted in the decimation of many indigenous communities, with millions of people dying due t… https://t.co/vnzigL4kuM",MohammedBourhr1,,0.125
167,In preparation of the Live Fire Exercise ‘Amber Lynx’ 🇩🇪🇨🇿 #soldiers conducted an animal disease prophylaxis. Our d… https://t.co/2DD2WC5syC,efp_lithuania,Lithuania,0.13636363636363635
