,tweets,user,location,polarity
643,Robert Blake is dead. And I think we all know the truth.  https://t.co/6gQ2OGipd3,LionelMedia,"Hell's Kitchen, USA",-0.2
644,i REALLY cannot believe my initial proposal for my ug diss was about the red scare and hysteria as a disease (i was… https://t.co/xki6JcGaet,januaryedicts,"𝗌𝗁𝖾 / 𝗍𝗁𝖾𝗒 , 𝟤6",0.06666666666666667
645,@KansasHoops @Gonzeeeeeee You can’t be serious. Heart disease is the #1 cause of death in this country and a colleg… https://t.co/rKOl24uwHr,WayfairPricing,,-0.3333333333333333
646,"@debraweddall @wtfis2bdone In a way, I do wonder how much of it is autoimmune related as someone who has autoimmune… https://t.co/B4TQZSVlb4",ObservingAngel,,0.1
647,@xrp_hodl_r @SadieXShaw The vaccine works vs severe disease for all strains but the biggest benefit was initial inf… https://t.co/wxG1JtIfFv,thereal_truther,"Orange County, CA",0.0
648,"WP - Actor Robert Blake, whose decades-long film and television career was tarnished by a notorious murder trial, h… https://t.co/P5jvyClbo8",newt50,"Ontario, Canada",-0.05
649,"A statement released on behalf of Robert Blake's niece said Blake died from heart disease, surrounded by family at… https://t.co/M2wSzA4o4W",NBC10,"Providence, Rhode Island",0.0
650,"Preservation of your sperm/liquid gives you vitality, and makes your skin glow, and make your face to have a magnet… https://t.co/Yz7Q0CFbZ2",UniversalLight0,,0.0
651,"Baretta star Robert Blake dies of heart disease aged 89
 https://t.co/DwtahH9qgc",michaelaleach,"Georgia, USA",-0.1
652,"Long COVID now looks like a neurological disease, helping doctors to focus treatments. “The causes of long COVID, w… https://t.co/gwqRW9jprG",olegfab77,"Portland, OR",-0.05
653,@chronicallybeee I've never felt more popular than when I told an infectious disease consult while inpatient that I… https://t.co/R0UIQlPgqc,Macaroni207,,0.55
654,"@susanthesquark “I have to write to be happy… But it is a hell of a disease to be born with. I like to do it, which… https://t.co/41hqaK2HTo",renogeologue,"Reno, NV",0.8
655,my chemical romance disease,frnkgato,he they ☆ 18,0.0
656,"•Heart disease: 695,547
•Cancer: 605,213
•COVID-19: 416,893 
And don’t forget, a good portion of the CV deaths are… https://t.co/N8JUTAAJ5X",Bodh_Salon,"115 Woolwich, Street, Guelph.",0.7
657,"was associated with almost a two times increased risk of premature adult death from respiratory disease, and accoun… https://t.co/6CeYFUDljZ",ValeBodi,  MEssland Worldwide,0.1
658,It is exciting to see this area moving forward - remote monitoring of disease parameters can really help better acc… https://t.co/AVHfZmOo90,MND_RIA,Australia,0.225
659,"@muscleforlife Lots.  Heart disease, diabetes alone would drop and save millions.",TLS77592579,Pennsylvania ,0.0
660,Fast Well | Feast Well -- Health Highlight: Did you know fasting can reverse fatty liver disease?  https://t.co/D6qE4V30nc,Leslie_D_Taylor,Idaho,0.0
661,"@AntibioticDoc @AngryCardio At the more severe end of the spectrum, this is intuitively true (i.e. keeping someone… https://t.co/54NOEXpDGk",GidMK,"Sydney, New South Wales",0.425
662,"Prayers to Coach D.  

What a wretched disease that seemingly touches us all in some form or fashion.  Lost my gran… https://t.co/gOIUYJg7zb",coachhick,"Anderson, SC",0.0
663,"Every disease has an herb to cure it 🌿

https://t.co/A7Nxo0Qqfu https://t.co/NJA9Emyq0i",OrganicLiveFood,US,0.0
664,@Tako1Fall @izzynski @endofanerajc @twocitizenships there is are entire groups of medications known to raise your c… https://t.co/8BANDUNkkQ,tarnacle,🇧🇬,0.0
665,"@JoseAntonioPhD Also, referring to Vitamin D as ""VD"" may be more efficient from a typesetting perspective, but ...… https://t.co/mnRjt3SUJl",MrPatricKennedy,"Lehi, UT",0.5
666,"@SethMacFarlane I wouldn’t wish post infectious disease on anyone. 

https://t.co/AFWare5l9I",EncephaloME,,0.0
667,"Actual number with practice.
OUNASS_NOON_PROMO_NON_TOYOU_TO_Fordeal_HM_Bath_and_Body_H&amp;M
YOU_H_AND_M_OUNAS_COUPON_S… https://t.co/QJDgrvfmsA",imhuz_Mickers,,0.0
668,"@ID_AA_Carmack (1/2) Remaining agnostic on the OP, but as an example:  if going in the ocean greatly reduced chance… https://t.co/kHWIuQ6b2I",starsailing11,,0.8
669,New Research: Identification of key genes and signaling pathways associated with dementia with Lewy bodies and Park… https://t.co/swEpLgI2qu,FrontNeurol,"Lausanne, Switzerland",0.06818181818181818
670,Best disease! https://t.co/Q8BoBHfRBl,stfuimmediately,West Village,1.0
671,"Out of all the women out there, Bad Bunny chooses Kendall Jenner? Whiteness really is a disease.
Can she even sing one of his songs?",qweentilly_8,DC,-0.24999999999999992
672,"A statement released on behalf of his niece, Noreen Austin, said Blake died from heart disease, surrounded by famil… https://t.co/ajIap3Wt7U",KCBD11,"Lubbock, TX",0.0
673,Sick fuck time to thin the herd mad cow disease https://t.co/3lVPRWCsZH,hawkwindcattle,"Joplin, MO/Dixon, CA",-0.4681547619047619
674,@tap_hex STD - Staking for Tshare disease?,HEXtoshiPLSmoto,Thailand,0.0
675,@_DirtyMusic @Boogie_Down_Pro @shesmypriestess @SHULAGOD I'll be just fine. Immunity without having to get reinfect… https://t.co/OaYGysTxX1,LucyLala80,"California, USA",-0.04166666666666666
676,"@AntibioticDoc @AngryCardio I think a perfectly reasonable explanation for that, given the metformin was such a sho… https://t.co/r7auyr8L4c",GidMK,"Sydney, New South Wales",0.1
677,"Three years ago, Miracle Doctor Jian, who could heal practically any disease and was capable of saving the doomed,… https://t.co/a8Q3pxMU00",NovelBub,,0.2
678,"@eva_kurilova I could care less what consenting adults do, but to be intimate with someone &amp; not tell them you have… https://t.co/cIUtEZkqqS",teddybare1000,,0.016666666666666677
679,@TomiLahren FU … I’m a Republican and I still wear one because I have auto immune disease and covid did a number on… https://t.co/pz5ERd01Gt,robinff490,palm beach gardens,0.0
680,"Robert Blake, the Emmy award-winning performer who went from acclaim for his acting to notoriety when he was tried… https://t.co/0IBRHvAxYz",bakersfieldnow,"Bakersfield, California",0.25
681,"The Imposter is D, voxelotor (Oxbryta), a hemoglobin S polymerization inhibitor that treats sickle cell disease. Fo… https://t.co/WZI0winWgg",PhunQuiz,United States,0.0
682,Covid is primarily a vascular disease as researchers at the Salk Institute demonstrated in May 2021.,ljd216,Australia,0.4
683,.@US_FDA the #ALS community delivered you a petition to grant #NurOwn a transparent and informative AdCom three mon… https://t.co/TopowQ89b8,eddieshafer,"The Woodlands, TX",0.0
684,"Jealousy is a disease, die slow",Theyluvvdonnn,"Sherwood, AR",-0.30000000000000004
685,"@thereal_truther @SadieXShaw Of course they do, and in most cohorts it surpasses the vax for protection against sev… https://t.co/aTmXHTig7G",xrp_hodl_r,,0.5
686,"@Sammy_Roth @latimes So it’s not human waste, disease, homelessness, and trash making it hard to get fresh air in L… https://t.co/rfB5JvZFPl",siouxseashell,,-0.04791666666666668
687,Excited to help facilitate this discussion! Combining animal models' systems neuroscience with human clinicopatholo… https://t.co/e20RkcAAC7,josephoh0517,"San Francisco, CA",0.1875
688,niggas will find ANYTHING sexually stimulating. men are a disease,costcoassociat3,,0.5
689,"@theoneand9110 @ambedkariteIND @tdsb Why down the tube? It's not like bamans are occupying all major positions, doi… https://t.co/hsh8PqUjbL",abhijvik,,-0.04652777777777779
690,@brendanpgraber It's really hard to see them with this disease. He and Tavor can bond over this at the Rainbow Brid… https://t.co/gYhDhgSYgC,HenryandIce,,-0.2916666666666667
691,"Robert Blake, the Emmy award-winning performer who went from acclaim for his acting to notoriety when he was tried… https://t.co/mQfM5xwRCp",KUTV2News,Utah,0.25
692,I am asking everyone!!! Is this what you want? Spreading disease? THis is total insanity @GovChrisSununu how many m… https://t.co/6uipgngmYc,PatientDay,United States,0.25
693,@KYGOP @LeaderMcConnell Maybe he can use this time to reflect on Kentuckians with disabilities who struggle everyda… https://t.co/txYFkRBmI4,lafevers_jane,"On Lake Cumberland, Kentucky",0.0
694,"ICYMI: the daycare disease du jour is strep throat. Ask me how I know. But don’t expect a verbal answer, because my… https://t.co/9PalFnz4Fv",SAPL,Halifax,0.0
695,@Moonbuncommie @EuphoriTori Centrism is a terrible disease.,TempehFueled,"Hippie Tree Town, CA",-1.0
696,@LisaMarieBoothe There's 75% of the countries women jumping up and down yelling at their TV. You just hang out in s… https://t.co/7Ef4PTxfBq,DonJohn14603204,,-0.15555555555555559
697,@bornposting i think the explanation is some sort of genetic disorder? disease? something? that fucked them up and so they look...that way,electricbeef,,0.0
698,"“Almost three years after apparently clearing the virus from her body, Ghormley is still suffering. She gets exhaus… https://t.co/xW5r2wtrqD",fightsandflows,"Miami, FL",0.05
699,Ozone pollution is linked with increased hospitalizations for cardiovascular disease - https://t.co/IIstTcOKgB -,Dataemia,United States,0.0
700,"@Letha_Hughes Any projection for 150 yrs from now

After climate change
And disease outbreaks

Of potential human population",ApairistDave,Gaia ,0.0
701,"Hepatitis C, The Disease, Epidemiology, Treatment, Eradication Part 3: United States Epidemiology https://t.co/xWd9BqPWUO",OceanCityDental,"Ocean City, Maryland",0.0
702,How I diagnose and treat acute graft-versus-host disease after solid organ transplantation https://t.co/8FLOxVEsFh,miltonlarrondo,Las Condes ,0.3
703,"According to the Center for Disease Control (CDC), approximately one in seven adults in the United States will have… https://t.co/30Bve5HmwA",Jim_WGEM,"Quincy, IL",-0.25
704,@songpinganq @SethMacFarlane Its funny or not really because that amount of fear mongering has a worse effect on he… https://t.co/xSTWMadRt3,Yolosdwibasc,,-0.08333333333333333
705,"@ameeeraaa_ Yeah probably but I am not exclusively referring to the man at the start of the video report

There is… https://t.co/BdM6RyA7kB",KOBverr,  ,0.0
706,"@SharkTenko @stevebeisheim @EndWokeness Why does politics have to come into this?
Anyone even remotely honest on th… https://t.co/FUYtrFGzZd",Epochhhhh,,0.6
707,Six my son they have every disease #lorienlegaciesbot https://t.co/2zJgIBS8wY,ll_anything_bot,,0.0
708,Early childhood lower respiratory tract infection and premature adult death from respiratory disease in Great Brita… https://t.co/PbxWx8zUgn,ValeBodi,  MEssland Worldwide,0.3333333333333333
709,@MaxCRoser want to do an interesting corollary? chart the rise of cancer (and the fall of other leading causes of d… https://t.co/FEWcD9x953,dropeik,near Boston,0.1875
710,"Borongan City in Eastern Samar has declared an outbreak of hand, foot, and mouth disease after 123 cases were logge… https://t.co/rA1J9DqlRQ",manilabulletin,"Manila, Philippines",0.0
711,"Robert Blake dead at 89.
 Robert Blake died on Thursday in Los Angeles. He was 89.

  The ""Baretta"" star died from… https://t.co/7SYVR6rDvv",CBDCUREDISEASE,"1717 S Prairie Ave. Chicago, ",-0.2
712,"Poor Sleep Increases Heart Disease Risk, Premature Death: Study

 #heart_disease #heart_disease_risk #poor_sleep… https://t.co/BXNHTeuMvb",UPresss,Gujrat Pakistan,-0.4
713,Rivear is  fabled for the Rivearian edible lobstoid but scourged by a vicious disease.,GoatSoupBot,Sotiqu,-0.15000000000000002
714,"@stkirsch That’s strange, since this published, peer-reviewed Israel study with over 1 M participants showed the va… https://t.co/2EB4EvO3hh",KevinGromley,"Farmington Hills, MI",-0.05
715,@DrCaliff_FDA @katiecouric Please help end this madness. #ALS is the cruelest disease. It requires a novel approach… https://t.co/Vyggu2UY3X,Sportsadd51,,0.0
716,@DavidWolfe I believe in a combination of Western and Eastern medicine along with specific supplements.  4.5 years… https://t.co/uOlED9P6s8,AskAndyCampbell,,0.0
717,"@BeckyBunzy Oh but the past is full of war, strife, and brutality as well. Statistically there was a much greater c… https://t.co/X4IBaurXY4",louminatto,,0.19999999999999998
718,@FTG_nz @NZStuff You mean after the colonizers murdered raped brought there disease here what else did Māori have t… https://t.co/A29gVeNCVd,Maori1011,"Waikato District, New Zealand",-0.3125
719,@heystuclark @MikhailaFuller @theliondiet @jordanbpeterson Don’t worry about cholesterol. The cholesterol hypothesi… https://t.co/slhNZx4bO8,investorsluck,,0.0
720,I am being harassed and terrorized and followed and poisoned I was charging up my phone and Lap top when these dise… https://t.co/DdHt5DmVUo,fonsijadhei,any location ,0.5
721,Local dumbass ate too much too fast and now must suffer the accursed Tummy Hurt disease 😔,forgottenkaze,(Icon by @akasnap_),0.13333333333333333
722,"Dawg. Y’all be. Careful. Hand foot and mouth disease is going around New Orleans, and I’m one of the victims , so y… https://t.co/ZGXY4d8fOs",ashley_anglais,"New Orleans, LA",0.018181818181818174
723,"@Jamesdad76 @TheHockeyInsdr @WakeThe_FukUp @barstoolsports Affliction is a different word, you should look it up. B… https://t.co/xrx10nccma",Frets10001,,0.0
724,"Robert Blake, the Emmy award-winning performer who went from acclaim for his acting to notoriety when he was tried… https://t.co/cCVhlNaoaq",komonews,"Seattle, WA",0.25
725,This man told my grandma to cancel her doctors appointment because he could not bring her a new oxygen tank because… https://t.co/pEdcDa7Sm3,KarlaAmbrose_,"Laredo, TX",0.13636363636363635
726,I can heal any wound or disease with the power of hugs https://t.co/HhsiUiCpFe,MemeDealer6920,,0.0
727,Baretta star Robert Blake dies of heart disease aged 89 https://t.co/Aw633uZSZu,worldnewstweet_,Worldwide,-0.1
728,"of 5 grams per day. With excess salt intake linked to high blood pressure, heart disease and stroke, WHO is calling… https://t.co/v8TtozOvzD",Live_Lighter,Australia,0.16
729,@ElijahSchaffer @1EPluribusUnum People I know wore masks to try to keep their senior relatives from getting a deadl… https://t.co/22vTd0PyE9,aepotter,austin texas,0.0
730,@meleedose I have diabetic neuropathy and liver disease. I generally try to stick to flower but the mutant gummies… https://t.co/8MB5b4PhUQ,BigGreenRob,"Edison, NJ",0.05000000000000002
731,AI Model Enables Alzheimer’s Disease Detection from Brain MRIs #roboticsainews #ai #artificialintelligence… https://t.co/IDMCATLxmf,RoboticsAINews,Australia,0.0
732,@LauraPowellEsq @mtaibbi Republicans and true Democrats allowed the liberal disease to spread and here we are now i… https://t.co/6aiHuj1cx3,johnny38134,,0.35
733,127zens disease is projecting their hatred onto mahae using them to fuel their hatred on dream like as if they gaf… https://t.co/wnUwitYQ0C,hoesfyu,,0.0
734,@cb_doge @elonmusk #Digtaldepopulation stupid kills more than any disease,Customercerveza,"South Lake Tahoe, CA",0.5
735,@Airplane354 that’s cuz they feel inferior and wanna make themselves feel bigger or like what you doin ain’t nothin… https://t.co/yJ5v1DmR5t,culturecloths,"Fresno, Ca",0.0
736,@Jusrangers Masks were never about rationality.  It's a social disease.,CheshireSkitz,"Seattle, WA",0.03333333333333333
737,Men don’t like women so I was like dang niggas gay but I also found out men also don’t like other men either men ac… https://t.co/MjLbRvyGno,angelicamcginns,Leaf village ,-0.125
738,but your honor! my client has anime vampire disease!,ZHANGQlLING,icon comm: MrVanhellis,0.0
739,"The longest word in the Oxford English Dictionary is 'pneumonoultramicroscopicsilicovolcanoconiosis', which refers… https://t.co/jcfSOyfSvN",Ben_Ccarter,,0.0
740,"&amp;""4_c Cancer is a deadly disease.    #上海 #天津    #青岛         https://t.co/y0SM1Z937h",hasansarwar1,,-0.2
741,@Timcast It’s not a yes or no question. If you are seriously bi-polar or schizophrenic - no.  If you have Tourette disease - yes.,venturasharkboy,,-0.08333333333333333
742,"The human mind is like a monkey. He likes to jump around, uncontrollably. At the worst point, the disordered human… https://t.co/AtbKSjda34",paulmckaryo,paulmckaryo.sol,-0.2625
743,"At Jafron, we are committed to providing hemoadsorption therapies targeting renal disease, critical illness, etc.,… https://t.co/ORzQ9mMimI",JafronBiomedic1,"Guangdong, China",0.0
744,Data-driven representations using deep network-coherent methylation autoencoders to identify robust disease and ris… https://t.co/kN4UzXFv26,biorxiv_bioinfo,,0.25
745,Data-driven representations using deep network-coherent methylation autoencoders to identify robust disease and ris… https://t.co/Y7ApLd4jdw,biorxivpreprint,New York,0.25
746,@ManvBrain @jewstein3000 @nataliesurely @awgaffney The psychosocial model of chronic disease is a fringe hypothesis… https://t.co/KdQfBXHfTE,GeoEduOne,Plague Island,0.0
747,CircRNA-disease inference using deep ensemble model based on triple association  https://t.co/bbgJP9r8ss #biorxiv_bioinfo,biorxiv_bioinfo,,0.0
748,CircRNA-disease inference using deep ensemble model based on triple association  https://t.co/jCfHn3q9lk #bioRxiv,biorxivpreprint,New York,0.0
749,"Mediterranean and MIND diets reduced signs of Alzheimer’s in brain tissue, study finds (The Mediterranean diet is a… https://t.co/TjkKXYy5nL",sargos66,"New Jersey, USA",0.0
750,"@TRyanGregory Has the field of economics failed?

Perhaps this could be a question worth asking.",anti_disease,,-0.1
751,@cobracommandr15 I never understand how they say he died of heart disease. He died because he was old.,brownrobin64,Mizzura,0.1
752,Neonatal Disease Prediction Using Machine Learning Techniques #NeoPapers #neoTwitter https://t.co/2CSVZFkgRr,neo_papers,,0.0
753,"Actor Robert Blake, known in the 70s as Baretta and later in life accused of the murder of his wife, died at the ag… https://t.co/IdMeNNRfI3",KRCG13,"Columbia/Jefferson City, MO",0.0
754,@L33ROYJ3NKINS3 @AnnaToccara @lizzo not all fat people have heart disease,raynejaywright,tummy town,0.0
755,OMFG the IT dude fixed it by fiddling with chrome settings. Didn't even need to be an admin. So basically I could h… https://t.co/1EpCtSSTxQ,yeetintolerance,Ngunnawal/Ngambri land,0.1
756,"@DrGrahamLJ Too many gaps in medicine.
AND too many shortcomings in healthcare. One of the biggest of the latter gr… https://t.co/LniTvu7365",NerdSharo,"Auckland, New Zealand",0.3333333333333333
757,Aw Robert Blake died today from heart disease. I remember when he was tried for murder all those years ago and how… https://t.co/ZcvxxiDoiy,StormzAngel,"Tulsa, OK",0.0
758,"There we go: difference between Vaccine and Infection- one sans autoimmune disease and other without. 
Thank you!… https://t.co/m5OqZlcW4v",670rv,,-0.125
759,@herbabymama @klein_msh Wether it's a disease or not it doesn't change the fact that doing drug isn't cool and tryi… https://t.co/SAW7XPjbis,3_14159e,Rwanda,0.35
760,@Dana25417963 Ya'll act like heart disease and heart attacks didn't happen before 2021 or something.,MichelD2005,,0.0
761,@daveyb0072 Miracle is impossible..what's keeping him alive is his now untreated Cushing's disease that forms corti… https://t.co/HGByZFb7Qh,CivilServantRet,New England,-0.2833333333333333
762,.@US_FDA the #ALS community delivered you a petition to grant #NurOwn a transparent and informative AdCom three mon… https://t.co/EjCxkdlrpU,deborahdalfovo,san francisco,0.0
763,Our political leaders need to communicate frankly with the public that the pandemic is not over. They need to stres… https://t.co/D3a9ATl6Do,peters_malcolm,ashford nsw,0.0
764,"@J_TheCynic Not that I know of yet, but toxoplasmosis may lead to Parkinson's.

https://t.co/cqmpqxHLDr.",TheParasiteGuy,,0.0
765,"Despite differences in SARS2 responses elicited in autoimmune &amp; healthy patients after vaccination, there was no di… https://t.co/te8mt72iR9",vipintukur,"Bijnor,  Uttar Pradesh, India",0.5
766,@AmberRadiance Also they never said it was a human zombie virus. We already have a fungus that hijacks ant brains &amp;… https://t.co/vYhW4beN8b,jaxseamripper,"Connecticut, USA",0.0
767,“Industrial Disease”  “ https://t.co/DbYu4vuGPV,davelang125,"Woodbury, MN",0.0
768,@SandraYozipovic Scary vaxxidents times. That's what Clif High calls many more to come in the coming years. Stay al… https://t.co/ma64mXciUq,toondrawer35,"Miami, Florida.",0.165
769,"Long COVID Now Looks like a Neurological Disease, Helping Doctors to Focus Treatments

The causes of long COVID, wh… https://t.co/dBMkuSA4UU",MeetJess,Covid Free Zone ,-0.05
770,@EoinPoil @immdaly The act is intrinsically evil.  The inclination is disordered. Like all attractions to sin it ca… https://t.co/g8ygT0GSmi,FaithinDepth,Ireland,-1.0
771,@RepSwalwell @RepSwalwell This is a classic example of a brain disease called “The night of the mind”.,ConnorTom21,,0.16666666666666666
772,@MysterySolvent Disease and pestilence.,LindaLabbe8,"Maine, USA",0.0
773,Study shows body fat is a safe haven for cancer cells; reducing excess fat can help beat the disease: https://t.co/vj6sU1C2jI,thehealthb0t,,0.5
774,"@Slatzism @MidniteMystik aids is already an incurable disease, is it really necessary to add your sick social torture?",jakob_w2002,Leipzig,-0.29523809523809524
775,Love&gt;. Now in the discourses of mind of the things to a human disease and discourse was love and magic are to tell knowing,rhetoric_ebooks,,0.375
776,Baretta star Robert Blake dies of heart disease aged 89 https://t.co/izR46f9nMs,DailyMail,New York,-0.1
777,"@jmcrookston @NjbBari3 I hope they figure it out soon!
Seems completely irrational that Fed and provincial devote $… https://t.co/KFGQx0n7mh",NickMackx,,0.1
778,@MILEHIGHMAFIA30 @NJBroncoguy84 Bro gotta disease smh,SauceNiko,BFE kansas ,0.0
779,ooo the sleepy bitch disease is bad today 🤪,sporeprince,"Portland, OR",-0.6999999999999998
780,It was not a peaceful passing. He suffered from an incurable disease.,execubot,"The Notarial Hall, Laterano",-0.3125
781,"Don't envy either look cool, imperceptible disease.",AugustMeg4,,0.07499999999999998
782,China's current flu infection remains at the level of seasonal disease like before COVID: CDC chief epidemiologist https://t.co/e9ELpTDhDv,thedextazlab,Tanzania,0.0
783,@Tallguy2436 Have you been tested for Lyme disease?,BostonBelle4,"тнє иσятн ѕнσяє & Freedom, NH",0.0
784,"I yell: I'm gonna live to be a hundred
I'm gonna see them cure disease
Then I'm gonna watch them
Go to war over the… https://t.co/cBNotq1Bpt",BugHunterLyric,,0.13636363636363635
785,"@steveeagle2 @RandPaul I’m not interested in arguing with you anymore. 
The disease was created in a lab through ga… https://t.co/83iMklQdai",MrZeroooooooo,,-0.125
786,"i carry your moral disease 
 i don't wanna be somethin' i'm not to stay alive",nbtlyrical,,0.05
787,He's got the flames disease https://t.co/Ld97zzH8Iq,sane_opinion,"Victoria, British Columbia",0.0
788,Thinking about endourology and MIS fellowship? Our 1-year @Endo_Society fellowship in MN combines focused clinical… https://t.co/sJYygdJ5XW,kvnkoo,,0.0
789,"Education had been easy.
 Learning things had been harder.
Getting an education was a bit like a communicable sexua… https://t.co/voRo5WHREy",_mirabot,½ hour ... see rentry... 🪷,0.16666666666666669
790,"Once hailed as among the finest actors of his generation, Blake became better known as the defendant in a real-life… https://t.co/TKwAjHzRQ9",CBS21NEWS,"Harrisburg, Pennsylvania, USA",0.35
791,@hang_warrison Paranoia is a disease unto itself and may I add. That the person standing next to you. May not be wh… https://t.co/Ti30od2ZQP,Saraphim777,Somewhere in PA,0.0
792,"@LogicalFallacyX @discworld_girl @jk_rowling Where did you read me saying ""sex doesn't exist?""? Do you have dyslexi… https://t.co/ROuRdHGlA8",ppersephonne,"São Gonçalo, Brasil",0.0
793,"{Fighting Stigma} Mediterranean, MIND diets linked to fewer Alzheimer's signs in brain, study finds: People who fol… https://t.co/puLy1kywi0",stigmabase,Worldwide,0.0
794,"{Fighting Stigma} New Blood Test Can Detect Alzheimer's Disease Much Sooner - Scripps News: The research team, led… https://t.co/SNTW3tj20u",stigmabase,Worldwide,0.16818181818181818
795,{Fighting Stigma} Transporting antibodies across the blood–brain barrier to treat Alzheimer's disease: In this stud… https://t.co/pBuDCvBSnQ,stigmabase,Worldwide,0.0
796,"@DelusionPosting Medical but ""offensive"" terms
Terms such as:
Hypertension
Arteriosclerosis
Heart Disease
Diabetes… https://t.co/YLXCwwHa0R",SkidManJurej,"Montgomery, AL",0.0
797,"@I_Will_Yeah @MysterySolvent Syphilis does have a face
There is one, and only one, legitimate photo of Stalin that… https://t.co/nONpK6C3jH",reenieween,"I'm here, where are you?🌊",0.0
798,"Robert Blake, the Emmy award-winning performer who went from acclaim for his acting to notoriety when he was tried… https://t.co/R5ycZZ2Ria",NBCMontana,Montana,0.25
799,"@BLDirks @amyroloffCF @KATUNews Abducted child found = “miracle.” 

Thousands of children die every day from war, f… https://t.co/CWNRin1tcJ",riptide1776,PNW 🌲🌲🌲,0.0
800,We are not all equal regarding kidney disease &amp; treatment access. Black Americans are almost 4 times as likely as W… https://t.co/gWaArnmWTp,yourcbhn,"Sacramento, CA",-0.05555555555555555
801,@Lujan588 @heavyredaction @thrasherxy Heart failure is an aging disease and so scary in that the smallest illness c… https://t.co/UuQ7inewtk,lmarytweets,,-0.4083333333333333
802,@IndiaToday @PoulomiMSaha Looks like Pappu’s Foot in the Mouth disease has caught up with @Jairam_Ramesh,sidm110029,,0.0
803,@DionCaines64 @mtaibbi Liberalism is a terrible disease and you have it…🤦🏼,ccwkcw,"El Cajon, CA",-1.0
