,tweets,user,location,polarity
0,@AvonandsomerRob Yeah let’s do to our general health what we’ve done dental hygiene and gum disease. UK has worst r… https://t.co/8FuVIFjpxf,turner_kevin,West of England,-0.475
1,@WRelapse2 I'm so sorry darling. Damn disease. If you need to talk here we are always baby 🫂🫂,beck_mar,Tarragona,-0.5
2,Currently listening to Kings Disease 3 🎶🎶🎶,S_Fleary1,"London, England",0.0
3,I have some kind of mental disease where I feel guilty about being evasive with people who are dangerously insecure and controlling,GuabaoBaby,"like, Georgia or something",-0.125
4,"The #Neurologist: Clinical &amp; Therapeutics Journal

      A physician who practices in neurology is called a neurolo… https://t.co/Ev8Z2Ez6fG",Omics_Online,,0.0
5,"Healthcare has been a special priority for the Modi govt!

The tremendous efforts are in force to provide accessibi… https://t.co/GToaFhLKFE",AlishaTomar3,Haryana,0.34523809523809523
6,"The picture is about the fear of death, which binds and unites people all over the world.
It's about a disease of t… https://t.co/NETmhSpuF3",eugshchukina,,0.0
7,"However, technical inventions make living with T1D easier now than let's say 30 years ago. Thanks to automated insu… https://t.co/5F3NnVINl3",InfinitePiers,"Sweden. Langley, VA",0.1
8,It is the most common life-long and incurable disease in 🇸🇪 which is also deadly if not treated. It is also very co… https://t.co/vIreCx2nmn,InfinitePiers,"Sweden. Langley, VA",-0.008333333333333326
9,Twitter is suffering from mad bro disease. Open thinking can build it back better https://t.co/B3yjb8TdRn,TheRegister,NA-EMEA-APAC,-0.03125
10,A scientific review regarding non-celiac gluten sensitivity reported there is a large percentage of people who repo… https://t.co/lqgR0Dgw86,Shape_Able,"Mount Pleasant,Michigan",0.21428571428571427
11,@LBC @NickFerrariLBC Wokeness is a disease of the afflicted.,TommyGribbin,Scotland,0.0
12,"What are the Risks of Belly Fat?  #weightloss #hearthealth
This visceral fat, belly fat, in your middle makes toxin… https://t.co/S0x4zCqv2f",AHealthyBod,US,0.0
13,"if you never get sick, it could be a sign of a rare disease",warmzerobot,sb when unfollowing!,-0.20714285714285716
14,King’s Disease 3 by Nas on Repeat. Album of the year but we won’t talk about it,Mr_Nick001,"Enugu, Nigeria",0.0
15,"Diabetes is one of the diseases that has been addressed. Awareness has been raised on the causes, different types o… https://t.co/KDwIcUQtpM",MICHAELWAWERUG1,"Ol Kalou, Kenya",0.0
16,"24/7 we are here for you!
Because osteoporosis weakens bones, making them less robust &amp; more prone to breaking, fal… https://t.co/GWBdPRztkK",ashish_surgeon,Pune,0.16666666666666669
17,#Diabetes is a silent killer. Don’t let it ruin your life or the life of your loved ones. On the special occasion o… https://t.co/tYnB00wjvy,rigofiltration,Bangalore,0.3523809523809524
18,Diabetes is a chronic disease where the pancreas doesn’t produce enough insulin if any at all. It also leads to ser… https://t.co/HuSVQJnuJL,OneMedrx,"Lagos, Nigeria.",0.0
19,"[ON AIR] Education on diabetes is vital, because even in 2022, many people who have the disease don't realise it.… https://t.co/bWEfuBMG65",channelafrica1,"Johannesburg, South Africa",0.3
20,@StandardKenya What about endemic ‘greening’ disease?  Carried by aphids.,MoA93407047,,0.0
21,"More than 500M people live with diabetes. As we celebrate the #WorldDiabetesDay, lets join hands in calling for gre… https://t.co/7zSCpDgEPy",OrthoTraumaIns,"Nairobi ,Kenya",0.3181818181818182
22,"There are many myths associated with diabetes disease. It is time to bust them all with facts.

Read the myths &amp; fo… https://t.co/jkBgz131Kv",MyAffordplan,"Delhi, India",0.5
23,Did you know that a long-term effect of diabetes can be the development of diabetic neuropathy?  This… https://t.co/m3DhjNqEOM,PainConcern,Edinburgh,-0.05
24,Across Africa right now children are facing climate emergencies not of their making. The children we support are ex… https://t.co/XfSZe79udr,ChanceChildhood,UK,0.2857142857142857
25,@VectorThaViper Stan culture is a disease to our entertainment industry.,_brunodegentle,"Istanbul, Turkey",0.0
26,Connect with our team at the #WorldOrphanDrugCongress in Spain this week. We are ready to learn how we can support… https://t.co/t6qaDwttCu,AdvClinical,Locations throughout the U.S.,0.2
27,"As we continue to grow, so too does our influence. As part of #BAPEN30 we're highlighting our growing influence in… https://t.co/NiAxVgTkaM",BAPENUK,EngScotWalesNIreland,0.0
28,"Be careful if you're heading over to the Peaks 

https://t.co/VdfP8jEZvW",yorkshirepost,"Yorkshire, England",-0.1
29,"@tagwarriorsph @SB19Official “Laughter serves as a blocking agent. Like a bulletproof vest, it may help protect you… https://t.co/d6G7R1sG3V",wennamoon,"National Capital Region, Repub",0.0
30,"Happy World Diabetes Day.

The occasion of World Diabetes Day is a reminder to all of us that we need to take care… https://t.co/Fa27dpPs5h",reecoupons,United States,0.8
31,@SkyNews So sad to hear   cancer is a horrid disease,phillycurlywigs,"Norfolk, United Kingdom",-0.5
32,"A person infected with #Ebola can't spread the disease until symptoms appear. #StaySafe 
#EbolaOutbreakUG https://t.co/e5YLH5LU5U",murungi_ada,"Kisoro, Uganda 🇺🇬",0.0
33,I'm listening to Social Disease by Bon Jovi ♪ https://t.co/u9a4q4geHY https://t.co/dqbMivVpIo,busainet,"Bandung, ID",0.03333333333333333
34,"""While I fully agree that China's hard-line approach to Covid-19 containment has saved lives, the policy's impacts… https://t.co/t0431MQ3sP",StrawberryNG,Nigeria,-0.2916666666666667
35,This is a hard watch after seeing him yesterday. We need to find a cure for such an awful disease. I’m so sad it’s… https://t.co/SIMIrotjCv,mrsjuliemathers,Scotland,-0.4479166666666667
36,"Mai  Mihara, a Japanese female figure skater who came back to victory in the Grand Prix series Skate U.K. while dea… https://t.co/63cKVjIwiY",HNOwXLv4a83hGyA,日本 東京,0.125
37,"#WorldDiabetesDay here’s to my fabulous feisty neice Tilly, her Dad Matt who live with this disease everyday and my… https://t.co/IcykMQaCFn",michellecarrin3,,0.11212121212121212
38,"#addiction is a hugely complex and destructive disease, and its impact can be simply devastating. All too often, li… https://t.co/gV0AnGFex0",AddictnPodcast,"Florida, USA",-0.6333333333333333
39,@MikkelJ46087336 @Tendar In ruzzia PLS counts as a blessing and not a disease,andre1sk,Dublin,0.0
40,"Type 1 diabetes is the most common metabolic disease among children and the youth. 

It is important to screen chil… https://t.co/izpPzOG4e3",GhCoPS,"Accra, Ghana",0.20000000000000004
41,What we should know about @ebola disease that has so far killed 54 people in Uganda. The virus broke out on 20th Se… https://t.co/n3gD1NKjHn,FineMiracle4,,-0.03333333333333333
42,"@MajesticVision @MuskRatLove420 @WilliamAnd809 @ClownWorld_ By a combinaron of them:

Preventative care measures, a… https://t.co/DayRkwoLnw",Yana_BlackSoul,,0.0
43,@Atlas_Chicago @wee_cuppa @Lachdanan14 @ImDorianBae @stillreezy @CNN You are not blind: what is happening in your e… https://t.co/La6XQxnHq2,XaviPortales,Groenlandia,0.25
44,"Ebola outbreak in Ug is real,,, it's spread is continuing,,, President @KagutaMuseveni will be addressing the natio… https://t.co/RBkbgpNP8j",DykeJbd,,0.2
45,“Smoking and obesity – which we could cut down dramatically with these measures in place – are both significant ris… https://t.co/NWlTTmaNeT,vaper_the,"Sydney, Australia",0.10972222222222221
46,rina's shinchan disease got to her https://t.co/lfK0PuP4IA… https://t.co/DmKyEUT0tr,girlsforina,she blk ,0.0
47,TW :  General Physicians in Panaji: ...qualified medical practitioners who can treat your health condition or disea… https://t.co/wCFlTGr9k4,StigmabaseU,WORLDWIDE,0.02500000000000001
48,TW :  Diabetes Capital of the World: From reactive to preventive - The need for a shift in the healthcare...: ...an… https://t.co/2SCKLPIBWo,StigmabaseU,WORLDWIDE,0.0
49,"People take ownership of sickness and disease by saying things like MY high blood pressure MY diabetes, MY heart di… https://t.co/skMe6xnkuV",Acceleratebus3,"Mbezi Beach, Jogoo",0.16
50,"TW :  World Pneumonia Day: Keep these foods in your diet, stay away from the disease: ...world. The purpose of this… https://t.co/pdb1yKbwTh",StigmabaseU,WORLDWIDE,0.0
51,"Ronaldo; ""This club sold Pogba and bought a person with a heart disease, and they still added on Fernandez who goes… https://t.co/UBcSzuL1Zd",badinfluenceo1,"Abuja, Nigeria",0.0
52,"This is a very good initiative, to avoid this disease, we should know about it. #FlipkartDiabetesFreeRun
 https://t.co/y3Yoe16m1w",Shalinithakur67,Delhi,0.9099999999999999
53,We all should stay away from diabetes and give this same advice to other people diabetes is dangerous disease… https://t.co/Ri6JTHI4L8,Arshi__Tweets,,-0.24166666666666667
54,"In today's time, many people are troubled by this disease and all of you must join this campaign and take more and… https://t.co/cpU8Fgx0cj",Priyanka_00001,,0.16666666666666666
55,"Healthcare has been a special priority for the Modi govt!

The tremendous efforts are in force to provide accessibi… https://t.co/hoDN2XkzxA",HARIDWARJIBJP,"Uttar Pradesh, India",0.34523809523809523
56,"Really doing very well and people are appreciating a lot, you all must know this is a very dangerous disease.… https://t.co/9Pq1cpVrZw",Priti_00001,,-0.12666666666666668
57,"Really friends are doing very well, if you also want to get rid of this disease, then you must also follow their gu… https://t.co/3aQOMzUVaX",Anjali_00001,,0.2
58,"Silly comparison 👇
TMAO disease in pets: The gut microbiome in dogs with congestive heart failure. https://t.co/NWQasHPh9s",SmilGeoff,"Earth, sometimes ",-0.4083333333333333
59,"We all should avoid and be aware of this disease to stay healthy #FlipkartDiabetesFreeRun
 https://t.co/NgE3WOuoGy",YeshPal89329973,"Chandigarh, India",0.375
60,"A lot of people are joining this campaign, in fact, if you also want to get rid of this disease, then you must also… https://t.co/l9HC1iV07R",doli_pandey,,0.0
61,"Today, 14 November, World Diabetes Day is celebrated to raise awareness of the disease and promote knowledge of its… https://t.co/UwlGDqyzlf",inviTRAcom,,0.35
62,Diabetes is a serious disease that can lead to many complications. We must be aware of the signs… https://t.co/cKpPAaRLAe,Hulkboy000,"Abu Dhabi, United Arab Emirate",0.1388888888888889
63,"@miz_rat Don’t many of us⁉️

🔴Not to forget the Fairfield Infectious Disease Hospital.

🔴It was one serious decisio… https://t.co/jDNQzlZb3n",elliemail,Wide Bay Region QLD,0.08333333333333334
64,@InsekoLorita1 Killer disease👊😂😂,OscarJr_CFC14,,0.0
65,@Sal_Robins @BluffKingHal @ComradeHedgehog People who suffer from dementia have to act quick when they want euthana… https://t.co/JXUjYcy1Dh,ClemVanWessel,"Haren, Groningen",0.3333333333333333
66,"fit always , no disease can hinder your health  #FlipkartDiabetesFreeRun",Disha5757,,0.4
67,"(Stole this from reddit)
Yeah anti vaxxers, explain why you people are so scared of something that can give you imm… https://t.co/0E9qtRQMGp",VCaerix_Ch,"in london meusem, rotting",0.0
68,"Reducing the burden of disease is important, as we know multiple #StrepA infections is a precursor to Rheumatic hea… https://t.co/rkyHrcJxm4",Jake_A_Lacey,"Melbourne, Victoria",0.2
69,"We must learn all we can about diabetes and how to prevent it. This disease can be deadly
#FlipkartDiabetesFreeRun
https://t.co/xtF2UV4f7g",hulke011111,,-0.2
70,It's really common disease these days and we all must take care of our parents and needy people.… https://t.co/w2IMZ3Iwe0,Sexy_aatma,"New Delhi, India",-0.3
71,MorphoSys: Licensing Partner Roche Announces Phase 3 GRADUATE Program for Gantenerumab in Early Alzheimer’s Disease… https://t.co/cN58Y9PKoM,iitoLifeScience,"Bremen, Germany",0.1
72,"If you want to get rid of this disease, then you must also meet this campaign or the campaign is very good and it w… https://t.co/HKBChtPIOp",nikki_000_,,0.9099999999999999
73,"@MatMcLachlan During the course of the war, one in four Confederate soldiers died, either from wounds or disease.
(… https://t.co/9kxpxhaO5i",AndrewRawson11,"Sheffield, England",0.0
74,Time to be aware of diabetes and its potential to ruin our lives. This disease is serious and we must not ignore it… https://t.co/JBZis5qZcp,Strangergi1230,,-0.027777777777777773
75,"This is a very dangerous disease and to get rid of this disease, we must raise our voice for it and must cooperate… https://t.co/2526G2ynWl",Hsr_001_,,-0.78
76,"There will be nothing better than this, friends, because if we all want to be free from disease, then this is very… https://t.co/NfcxREFJQC",Meowwgirl_,India,0.3666666666666667
77,"Really friends, this is a very dangerous disease and people have to go through a lot of trouble due to this and you… https://t.co/cxLA1nFP6E",DriftWorld3,India,-0.22625
78,@MNDoddie5 Saw the inaugural Doddie Weir Cup game Wales v Scotland in Cardiff 5 years ago. Heartbreaking to see how… https://t.co/Oi3vNB9ZUX,kayel115,"Wales, United Kingdom",-0.4
79,"Why don’t people want to make a disease the center of all human life, forever? It must be because the diabolical di… https://t.co/iyVdeFnz84",UubzU,Wasting away in Miladyville,-0.05
80,"Diabetes is a very big disease and everyone has to unite against it, today India has to become diabetes free.… https://t.co/Q4Yeq5tUKq",SatyamEden_OO7,India,0.2
81,SARS-CoV-2 is re-gaining mutations in Spike's NTD such as 144del that confers a high evasive potential against mAB… https://t.co/Ibgc2juUJr,Ricardo__JRH,"Cereté, Colombia",0.05333333333333334
82,"@PeteMac007 They’ve sold you these scenarios &amp; made you believe you don’t have a right to good, affordable,accessib… https://t.co/wGVYprVmoJ",Randall87454048,"Sydney, Australia",0.4928571428571428
83,"People have benefited a lot from Flipkart, whether it is disease in everything and it is really right to take any p… https://t.co/a1g2NaPj5f",Love22430,,0.2857142857142857
84,"Lots of accounts will imply Type 2 is something you ""do"" to yourself and not a disease like many others triggered b… https://t.co/a1tKk0kIJp",INALJNaomi,NY & Budapest; prev NOLA/DC,0.5
85,"Truly friends, today a lot of people of the country are in the grip of this disease, in order to get rid of it, peo… https://t.co/7kRCxqbRzE",Tanya_00002,,0.0
86,@NatalieSmal Why? 😂😂 Himars disease?,Cristianwarham,,0.0
87,Don't lose your life because the doctors said that you are going to die because of incurable health issues like… https://t.co/ts14Sju2hh,PaulFra53163031,Benin 🇧🇯 ,-0.5
88,"It is very important for all of you to know about this disease, #FlipkartDiabetesFreeRun
 https://t.co/3VIHyCPE8J",Realtofanojhaaa,mumbai,0.52
89,"Follow a healthy habit of walking , and stay fit always , no disease can hinder your health… https://t.co/0BsNl2MQI7",chinuu356,India,0.45
90,"Really friends, everyone should pay attention to it, it is a very dangerous disease and to get rid of it, we must k… https://t.co/ns8naUVHaY",rajput_9006_,Jaunpur,-0.29000000000000004
91,"Turritopsis dohrnii, better known as the immortal jellyfish, can go from adulthood back to childhood and, in theory… https://t.co/2y2UJLtOqJ",Factsofw0rld,,0.25
92,"Enticed by the trendy disease, I let my brain mix turn to mush.
I'll give in to my vile consciousness, so I can become a part of you.",scrambIekousai,10 •  ic jpedamame715,0.04999999999999999
93,"@Cernovich Dementia is progressive degenerative disease of the brain. ""Stroke"" is an instance where blood supply is… https://t.co/DsZXibv0Hc",Blanksl42504760,Singapore,0.0
94,Drugs just as good as bariatric surgery for diabetic kidney disease https://t.co/ZJKKsvIrgj via @ein_news @carel_leroux,IrSPEN,"South Dublin, Ireland",0.7
95,"Healthcare has been a special priority for the @narendramodi Ji's government. 

The tremendous efforts are in force… https://t.co/EUpJVXp2zB",drlaxmanbjp,"Hyderabad, India",0.34523809523809523
96,New Research: Unbalanced networks and disturbed kinetics of serum soluble mediators associated with distinct diseas… https://t.co/8Z8sUpxFRA,FrontImmunol,"Lausanne, Switzerland",0.21818181818181817
97,@AstraZeneca Is it possible that tou have kidney disease if your ultrasound and urine tests are all good?,ohmnanonBB1,Republic of the Philippines,0.35
98,@Karen92195695 @aplaceinthesun I’ve just read it too - this vile heinous disease!! Hope you are ok - reading stuff… https://t.co/3L3kFuZiXS,DianePotter2,"Bournemouth, Dorset",0.5
99,Probiotic ‘backpack’ to treat inflammatory bowel disease https://t.co/KhkJxd431Z,bulletin_ex,,0.0
100,Though the resources of the town were stretched thin due to the large number of refugees; though crowded and unhygi… https://t.co/WdYWr2Sz1X,ramanmann1974,Delhi/Punjab/Haryana/West U.P,-0.09017857142857141
101,The occasion of World Diabetes Day reminds us all that we must not take this disease lightly as it can affect our l… https://t.co/RjoVkiz0uA,RebatiTripura,Tripura and Delhi,0.4
102,@cfcliamk96 @jamiebhoy2009 @CelticGraves The living conditions must have been horrendous. That would have spread il… https://t.co/gLU1ulH8Qj,Stephen4_2,Section 445,0.0
103,DIABETES MELLITUS is a metabolic disease characterized by hyperglycemia resulting from defects in insulin secretion… https://t.co/irwmkOoSF6,unicistarHc,,0.0
104,Reactive arthritis is a painful inflammatory arthritis (joint disease caused by inflammation). It occurs in respons… https://t.co/qIoznyWhXL,UnabridgedMD,,-0.7
105,"Girls and women with PCOS have insulin resistance and are more likely to get type 2 diabetes.

Diabetes can be reve… https://t.co/iCMk0awU2O",samedaclinic,,0.25
106,6. Chewing gum with eucalyptus leaf extract has been found to significantly decrease plaque buildup on teeth and si… https://t.co/DpFxVVCC3a,FOMAWA,"Gogar farms , Nakuru, kenya",0.375
107,"@Swamy39 Of course not. As it's on records , he died due to sexual transmitted disease, aids probably",JayMohare,,-0.125
108,Don't forget to join us tomorrow at 1pm SAST for our last webinar on the developmental origins of health &amp; disease… https://t.co/iafv2FNUpm,bt30cohort,,0.0
109,"1.Eucalyptus tea is high in flavonoids (antioxidants) that may lower your risk of certain cancers, heart disease, a… https://t.co/snJu7KoALH",FOMAWA,"Gogar farms , Nakuru, kenya",0.18714285714285714
110,World Diabetes Day 2022: 5 myths about the disease you never knew https://t.co/M81JKZkDHw,hjtvnews_in,,0.0
111,@ChrisEgginton Led on spreading disease too,bencourtice,Hiding behind a grass tussock,0.0
112,@Tendar The disease Lavrov is suffering from is called PLS: Permanent-Lying-Syndrome.,MikkelJ46087336,,0.0
113,"sailing through, your disease and you. your disease and you, your body like a basket, shivering in static for us in… https://t.co/TlR8h0rZZo",neutralmilkotel,,0.5
114,"@SBube @SteveBTooze So, do the deaths from 'heat' include deaths from floods, and deaths from disease which are a c… https://t.co/YGUNdmL726",Roseanna_PfH,"South East, England",0.0
115,@10harg talking about my weight like in gcse science they didn’t use you as a practical for coronary heart disease,Nathan_Version7,,0.0
116,Our AI device that predicts acute respiratory disease has received a CE Mark - taking us one step closer to changin… https://t.co/Dp1ipVbIE1,simedx,London,0.6
117,"On every 14th November, the World Diabetes Day is observed. The main focus of this day is to raise awareness about… https://t.co/hbaJ6NEaiW",seashellgroup,Mumbai,0.16666666666666666
118,"A video of my new invention, 20 TwenTea:cancer, diabetes, dementia, depression, brain, heart, liver disease, eyesig… https://t.co/lroaazgspE",DrNakaMatsBot,東京都世田谷区,0.13636363636363635
119,"I've just donated to Kevin Sinfield's fundraiser for Motor Neurone Disease Association, Leeds Hospitals Charity, Th… https://t.co/q4Q2L59YfK",ecbourne,,0.0
120,"Thousands of militant neo-Nazis were institutionalized in the wake of the 2014 coup, such Right Sector and Azov, an… https://t.co/l3AMkg9oZC",SimonMillerCPI,"Missouri, USA",0.14285714285714285
121,"@BohemianAtmosp1 If haircuts had been declared a 'Notifiable Disease' in March 2020, yes! 👍🏻🤣",eezeejoe,,0.0
122,"What the Flip is glucopuncture, and do we really think it could do any good for Dupuytren nodules? 
@dupuytren… https://t.co/wkAiKOntVq",Dupuytrens,U.K. ,0.44999999999999996
123,"@Fenased @placebokarl @abcnews Non sick students could still have and spread a disease

And it's daytime. And only year 12 have exams",DaydrinkingKing,,-0.35714285714285715
124,"I have emo disease, and the doctor gave me your WeChat.@Nnattawin1 

#NETIZENSREPORT #Nnattawin for Asian Celebrity… https://t.co/ogOKbAzXW0",cynthia4177,ประเทศไทย,0.0
125,@Stephen4_2 @jamiebhoy2009 @CelticGraves Agree. It's easy to talk about poverty but can we really grasp the reality… https://t.co/ypEeGkW7MH,cfcliamk96,,0.31666666666666665
126,"Based on weekend photos in social media, many people who think themselves good &amp; kind who also think, “I could give… https://t.co/KH4RLA38LQ",augieray,"Dublin, Ireland",0.45833333333333337
127,"Hesperetin, a Promising Dietary Supplement for Preventing the Development of Calcific Aortic Valve Disease… https://t.co/8V8uUWcb2o",mitopapers,"Melbourne, Victoria",0.2
128,"@TheScotsman That is a stinking lie... but even if it weren't, how much worse it would be sticking with the disease that is Westminister.",RobynLStewart,Ayr Scotland,-0.4
129,@GermanBiotech It certainly won’t be if you wait until the last 5% of the disease’s progression to initiate treatment.,Nucleics_Inc,Australia,0.10714285714285714
130,absolutely appalling. Don't eat toxic salmon. Ass shops to please cease stocking it. These industries are bad for T… https://t.co/tUecb3hqO9,frayed_and_bent,South East Tasmania. ,-0.5249999999999999
131,"Holy Spirit, Help Me Heal: Overcoming Disease &amp; Dysfunction through Spirit Connection &amp; Soul Healing D8URK52

https://t.co/xzRgG88TbB",sheldon73l,,0.0
132,sana the disease i diagnosed the patient mentioned in my exam kanina becomes for real 😌😌😌🫶🌀🌀🌀,mikasighs,20 • they/them • eng&fil,0.2
133,Having sickle cell disease does not mean you cannot enjoy good health. The number one ingredient for a healthy life… https://t.co/KgEIEJR4wp,isccghana,"Greater Accra, Ghana",0.4390625
134,Drugs just as good as bariatric surgery for diabetic kidney disease https://t.co/Q2fRThOtIq,EINPresswirePR,Washington DC,0.7
135,Urgent warning as cases of Victorian disease rocket in UK – the symptoms to look out for - Mirror Online https://t.co/FQE0VQJWHk,allard_wanda,,0.0
136,"Diabetes is a health condition but not a dreadful
disease. Through diet and exercise like yoga, we
can control diab… https://t.co/JpfrgxSZxx",anvayaa123,Hyderabad,0.5
137,"....the continent and is forecast to become one of the leading causes of death in Africa by 2030.

Amongst many oth… https://t.co/YJyR0LPFsX",beaconhealth1,"Osun, Nigeria",0.5
138,"Today marks #WorldDiabetesDay.
Type 2 diabetes (#T2D) is a common and complicated condition that has become a signi… https://t.co/bMGHxsflss",Novogene_Global,,-0.4
139,"@Sal_Robins @ComradeHedgehog Yes, but the guidelines are very strict. People who want euthanasia have to be of soun… https://t.co/iDp7KJf8GY",ClemVanWessel,"Haren, Groningen",0.2
140,@Greta_NP @MeetJess @ejustin46 I had it as a baby. I have all of those conditions except kidney disease.,AnnieTehworst,"Lake of the Ozarks, MO",0.0
141,"To answer the question:

Can you use a disease to cure another disease?

Dr Wagner-Jauregg found the answer was yes… https://t.co/mdEMBYSNYu",DrTravisBrown,"Clinpath. Adelaide, Australia",0.0
142,"@MrDanishSaleem @TheOdinProject Yeah everyone is going through this incurable disease:/
But best of luck 👍",Zainab_Nisa786,Online 🇵🇰,0.25
143,"Me and My Disease 
By  Smileyfoot
https://t.co/DpHpLJVS5K https://t.co/hOgt3LNrkK",urcityradio,"Norwalk, CT",0.0
144,New Study Explains The Gender Gap With Alzheimer's Disease - msnNOW https://t.co/vOxO2levT0 https://t.co/WE6qqQiIYS,MemoryLossBook,United States,0.13636363636363635
145,A Muslim boyfriend Mohammad Aftaab Ameen Chopped his Hindu girlfriend Shraddha Madaan body Into 35 Pieces and dispo… https://t.co/MVSNWcukBo,paritush_assam,"Guwahati, Assam,India ",0.0
146,@jjbngschn No bc doctors are pretty much useless at this rate I know more than them 😭😭they can’t even SPELL my disease,autumnacorns,BLM | censor names | BIPOC,0.08333333333333333
147,league of legends is a disease to the brain,kuyapisces,LOS ANGELES,0.0
148,@Janela_X @MNDoddie5 Unfortunately love is not enough for this wretched disease. Doddie has spent the last 5 years… https://t.co/1kfApMf1qc,MaryWoo41450098,,0.1
149,"@madbutwright ""Every Generation Got Its Own Disease"" by the German group Fury in the Slaughterhouse is about the AI… https://t.co/lqC2WKrO2W",back2babylon5,"Chicago, IL",0.3
150,Today is #WorldDiabetesDay! @WHOMalawi joins @health_malawi and partners in commemorating the World Diabetes Day  i… https://t.co/AWODT29oJW,WHOMalawi,Lilongwe,0.0
151,@MariaA2480 Make you Holla  everything you go #1 . That's a walking disease.,johntho82266664,,0.0
152,@GachungaK The locked jaw disease is no longer an issue.,mikeokok2010,"Nairobi, Kenya",0.0
153,"When everyone is sick, we no longer consider it a disease.

#reflectionnotes",Ammarsheikhs1,"Karachi, Pakistan",-0.7142857142857143
154,"On the occasion of World Diabetes Day, let us come together to make everyone around us aware of the challenges of t… https://t.co/jjywhzxuT7",VijayFoods_,,0.25
