,tweets,user,location,polarity
0,@somshankar_25 @speakshoutroar @DeeEternalOpt @subhaminion @chiragbarjatyaa 2021 jabs were brought in for a qualita… https://t.co/ntaZnKZp8N,_chAyA_,,0.0
1,"@justin_hart @mcuban Wrong on almost everything? Isolating &amp; wearing masks wasn’t a bad decision, it was the right… https://t.co/1sazCXPa4b",djravrphatpants,Soon-to-Be Ghost Town,-0.3047619047619047
2,"PINNet: a deep neural network with pathway prior knowledge for Alzheimer's disease
https://t.co/JYvPUuFbuF #maskotlib",LibKot,,0.0
3,"Communicable disease caused by having unhealthy lifestyle
#2 performance task in PE
#lifestyle
#unhealthylifestyle https://t.co/nFQgniX1c6",NicoleK03249214,,-0.4
4,Petition: Voucher scheme for those with Coeliacs Disease for gluten-free food https://t.co/VP4SSd4rLe,leonsheen26,,0.4
5,"According to the Global Burden of Disease 2019 study, air pollution from fine particulate matter caused 6.4 million… https://t.co/lF8Ct0iVuL",EqualityUnited,The Worlds 🌎🌏🌍🇺🇸,0.20833333333333334
6,@kidsdogs49ers @Nat_Diaz_505 @pegasoar1 @DataNerd808 @jim_mcneil @ERICSORENSEN I haven’t had to see an infectious disease doctor.,DaveCun87374470,,0.0
7,@Crazy_ButCute2 He suffers from Chronic Bitch Assness. It's a disease only a bitch made mf can get.,KelevraRyu,"Newport, NC",-0.3
8,@BillingMartin @dangodeassi @GreenerPT3 @DrJohnOrchard I think there's a role for them... eg. gout or Fz Shldr.  I… https://t.co/JKnTxrF4l1,hjluks,"New York, USA",0.0
9,"🧐-Sunday. December 4th, Day#338 of 2022. Air borne disease 💨are causing babies 👶 to have high fever &amp; 64,000 babies… https://t.co/gmq2xV3s42",JesusGa05753255,Glendale AZ(Messanic PASTOR),0.16
10,"A chronic, progressive lung disease caused by prolonged inhalation of asbestos particles https://t.co/VjNJituKyj",kourvand,,0.0
11,"@AnneBay4 @ReverendWarnock What's at stake in 2024?  Have Asthma, Obesity, Diabetes, Heart Disease, Arthritis, Canc… https://t.co/qT2gdN2YFV",NotfreeunderGOP,florida,0.0
12,"@StarMakerBolin @KariLake WOW, what a deeply hateful sick comment…. truly the disease that’s destroying the country!",MickeyTulip,"Palo Alto, CA",-0.20357142857142857
13,"The hanahaki returns this time fir his feelings for Rody, and Izuku can't take it a second time, so he succumbs to the disease",LynnLynnBug1,,0.0
14,Okay but I still want a story where Rody gets Hanahaki disease because Izuku starts dating Katsuki. So he gets them… https://t.co/ugIqSFUN7S,LynnLynnBug1,,0.5
15,"Theodor de Bry, Scene with a Warning Against Venereal Disease in a Circle at Center, 1580–1600 #themet… https://t.co/PbfvcSoywp",met_drawings,"New York, NY",-0.1
16,"@BadMedicalTakes As someone who worked in cancer research for a bit, I can firmly state that no, we do not have a m… https://t.co/k0WP0vYNnC",Swimerchic96,"Illinois, USA",-0.2
17,The two doctors made different diagnoses of my disease https://t.co/7L0ol2DR26,AwyBaxai,,0.0
18,@theREALzebatov @LuvDodgeCharger @Cybermage14 @ArnieB71 @ShalinGala Wild meat still causes heart disease in cancer.… https://t.co/FFHxuzDzY6,Nacho1man,"Holland, MO",0.1
19,@mmpadellan Democrats are a disease.,tim_hayhurst,United States of America,0.0
20,@Kit_Yates_Maths Cocooning -the theory of protecting others by inoculating yourself was also inaccurate with pertus… https://t.co/Kp4OsNeQXo,JamieRowam,Kcmo,0.0
21,"This is SANATAN Dharma

In Kutch Gujrat when 25 cows got lumpy disease their owner prayed,took vow that he will bri… https://t.co/mBmBn8bwX1",EkVishwa,Mother Earth 🌎,0.0
22,The basic aim of this institution is the conquest of disease #开云体育 https://t.co/APKOp9s20t,HeronNidia,,0.0
23,"Soundness, especially of body or mind; freedom from disease or abnormality https://t.co/uxfmGA4Jgv",BabaWalar,,0.0
24,"Do Citizens ever wonder:

Why are Americans so darn sick??

Why are so many always at the doctor, hooked &amp; dependen… https://t.co/WmFacLnjvD",GoForDawn,Jersey Girl gone Global,-0.10714285714285715
25,"@0luwat0bi Stigma might not be the word, but i consider it unfair to blame people for their self preservation. Espe… https://t.co/JVXZSegBSW",AweleNwandu,Goon Palace 🦄,-0.5
26,"@marla_vous What's at stake in 2024?  Have Asthma, Obesity, Diabetes, Heart Disease, Arthritis, Cancer, Pregnancy,… https://t.co/fXKo1asDQa",NotfreeunderGOP,florida,0.0
27,@agy_lena Radiation is implicated with thyroid disease isn’t it?,MarkMooch,London,-0.4
28,This is hysterical. Now it’s the Disease Formerly Known as Monkeypox https://t.co/nS5Ad6jV6h,CarolinaGirl585,,-0.5
29,"Inspired by his daughter’s #SickleCell journey, #49ers running back @Teco_Raww is raising awareness of this disease… https://t.co/WD3IeIlBLY",pfizer,"New York, NY",0.0
30,"@smitnrn Yep, severe autoimmune disease",sbhank,,0.0
31,"For the carriers that keeps spreading this infectious disease and still not showing any signs or symptoms of it, wh… https://t.co/u9q15uIgwn",JudePromisee,Earth.,0.0
32,@P2eudo @podgy713 you got that Benjamin Button disease sorry homie,spectionhere,,-0.5
33,"This is SANATAN Dharma

In Kutch Gujrat when 25 cows got lumpy disease their owner prayed,took vow that he will bri… https://t.co/mzn2Emts1r",arvindrbansal,Delhi,0.0
34,Non-alcoholic fatty liver disease (NAFLD) is the term for a range of conditions caused by a build-up of fat in the… https://t.co/nLEZ3asMPN,drugcarts,"Mumbai, India",-0.225
35,@saythewordmom @ritch_barron @JerasIkehorn Me too!  Looks like a viral cardiovascular disease more than a lung disease at this point.,JoAnneSapelo,Mid-Atlantic U.S. State,0.5
36,Hopeful glimmers in long war on Alzheimer’s disease https://t.co/IOZLJm7Hd9,SerpTalk,"Dallas, TX",-0.05
37,"@EXQUlS So weird, gosh jealousy is such a disease",coffeeisdrugs,श्रीं || 📍madras ,-0.25
38,Hopeful glimmers in long war on Alzheimer’s disease https://t.co/qKglwA5dX7,RSSFeedsCloud,"Dallas, TX",-0.05
39,"@jrc1921 He thinks Nye Bevan was a disease. I'm assuming he'd go private to have it treated? (No left, no NHS)",ealingtradesco1,Ealing,0.0
40,Chicken pox is a contagious disease https://t.co/WGruR4lQ0m,marithaadanne,"Imo, Nigeria",-0.6
41,flying around at night is better than Disease,JonnyStocks43,"Miami, FL",0.5
42,Shit a disease https://t.co/GxmSWGSRCe,Lilfable1,"Brooklyn, NY",0.0
43,Hopeful glimmers in long war on Alzheimer’s disease https://t.co/hWPTH1hsU4,sitedataseo,"Texas, USA",-0.05
44,"Regards vaccines, efficacy refers to how well a vaccine prevents ____(usually disease); whereas effectiveness refer… https://t.co/QezYssQR1M",AlexanderV878,,-0.25
45,"@SocialistNY American ""Exceptionalism"" is a disease.",dervish2525,,0.0
46,"@speakshoutroar @_chAyA_ @DeeEternalOpt @subhaminion @chiragbarjatyaa 2020 wave was practically a separate disease,… https://t.co/IcsmVwKXCf",somshankar_25,"Jamshedpur, India",0.0
47,@ifixhearts Can you show me statistically where heart disease was the leading cause of death during the pandemic. I… https://t.co/fuhRODPSnY,bdillydally1,"Myrtle Beach, SC",0.0
48,Hopeful glimmers in long war on Alzheimer’s disease https://t.co/hqsJ53xzlS,QuickCartWP,United States,-0.05
49,Hopeful glimmers in long war on Alzheimer’s disease https://t.co/EmnLPeo2Sp,NewsPlopcom,,-0.05
50,@JanuaryMovie @SinnaPomme @brclothwrites I believe studies are starting to show that getting rid of at least the di… https://t.co/53d5zrZf0B,environaty,Argentina,-0.15
51,8/Both SC379 - a #StemCell derived GPCs glial progenitor cell (GPC) program  &amp; SG418 - a #Fusogen HSC program aimed… https://t.co/WoWmwUkAqz,yaireinhorn,,0.0
52,Interview with @NutritionMadeS3 about heart disease prevention via lifestyle factors. Heart disease is the world's… https://t.co/1Uzv6M5aSj,fproofmastery,"Bern, Switzerland",0.0
53,@kdurquiza @MarkedByCovid What a crappy friend you are. Posting these conversations for the world to see. And treat… https://t.co/Y60kKqKOa5,kylebuckley,Idaho,0.0
54,"Renal Diet Cookbook: 200+ Scrumptious Recipes for Every Stage of Kidney Disease  Low Sodium, Low Potassium and Low… https://t.co/AfVb1LuA4p",Al13Q,,0.0
55,Sleisenger and Fordtran's Gastrointestinal and Liver Disease Review and Assessment E-Book (Sleisenger and Fordtrans… https://t.co/j4stD3WEUf,EnricoGusikows2,,0.0
56,@DontCareWhatYo3 @Timcast I don't remember heart disease and cancer being  caused by a coughing guy in church.,GeorgeJ20262901,"Tonawanda, NY",0.0
57,"This is SANATAN Dharma

In Kutch Gujrat when 25 cows got lumpy disease their owner prayed,took vow that he will bri… https://t.co/vpFGbUo2Y5",Goel18Meera,"Gurgaon, India",0.0
58,@EXQUlS jealousy is a disease,ultivron,,0.0
59,@Mofo75ca @TejSwatch @Creox @elie_mcn She quotes a bioethicist saying it’s the more ethical action. Stopping people… https://t.co/oBOt8hEKTP,hfjohnsen,"Ottawa, Ontario",0.26666666666666666
60,"@DrAseemMalhotra The fact the vaccine caused a massive autoimmune disease response cannot be mentioned, and has bee… https://t.co/KMaj139ZQg",PrimeNewForest,The New Forest,0.0
61,@kristenmag So the reason there isn’t a study in efficacy against severe disease in the college pop is not funding…… https://t.co/V6FXSOK6jV,sagusta9,"Atlanta, GA",0.0
62,Systematic evaluation of urinary formic acid as a new potential biomarker for Alzheimer’s disease https://t.co/a0mIKMN9F3,drdarmata,,0.06818181818181818
63,"@MarshaBlackburn Marsha, you are embarrassing yourself. Service members have gotten vaccinations to protect them fr… https://t.co/gl6yhlSVmE",bseadeer2022,,0.0
64,LOL what an horor... I look at @JoyReid @cnn as A bad disease...and others https://t.co/g9FtND7bej,GiovanniAzul1,Spain/ NYC/ UPSTATE NY ,0.0500000000000001
65,@CooperDaves @mcuban How are you defining “work”. If you define it as stopping disease then they don’t “work”. If y… https://t.co/dg1s7ymOxJ,MykeChaz,New York,0.0
66,"CAT FACTS: THE PET PARENTS A-to-Z HOME CARE ENCYCLOPEDIA: Kitten to Adult, Disease &amp; Prevention, Cat Behavior Veter… https://t.co/4udWuGIaTR",krajcikqiuyy,,0.1
67,"@JoCaPaLe @RepThomasMassie @POTUS Even if you assume masks work (they don’t), the aircraft already has far far bett… https://t.co/6ymPZ5tRR8",ChrisWiest11,"Kentucky, USA",0.1
68,"Hanahaki was created by Naoko Matsuda in 2009 in her manga titled Hanahaki Otome or The Girl Who Spitted Flower.

T… https://t.co/9byCJdWTdI",Daine_93,Liyue,0.0
69,@RandPaul Rand Paul has a vendetta for a career public servant - a guy who has devoted his entire life/career to fi… https://t.co/qTfBmeuKIn,Farfromnormal4,,0.0
70,"You threaten nurses ambulance and our children with your disease lies greed, war guess where you are going at Judge… https://t.co/zdFSOFdXyf",MikeStagg6,Somerset England Eu ,0.0
71,@mvankerkhove @MichaelWorobey @Tuliodna @ScienceMagazine there appears to be some mistake maria fellow infectious d… https://t.co/HXQI3hPfRy,AllergyDisease,UK,0.0
72,The fuck is wrong with some people. Saw a weird baby with a rare disease on my timeline. I don't even follow that p… https://t.co/s80xXH6DUL,Havi_635,,-0.2333333333333333
73,@MissFlyByNight Cholesterol &amp; heart disease,AndrewHarriman8,"South East, England",0.0
74,A disease known is half cured.               NAMSHI_promocode_promo_SIVVI_NOON_code_discount_coupon_TO YOU_STYLI_OU… https://t.co/PCrFXFmng1,azzshieana,,-0.16666666666666666
75,My eyes look dead and my bedhead looks like a mullet but he's such a good boy we just learned he has kidney disease… https://t.co/1Ty215c5D4,SplatterEffect_,"New York, NY",0.16666666666666666
76,@Kit_Yates_Maths No genius. When you're sick the people you most likely infect are close family members. This 'dise… https://t.co/Y0cMTfHx2T,TheRealistMFer,,-0.07142857142857144
77,"#开云 #亚博体育  A severe, often gangrenous inflammation of the mouth or genitals, occurring usually after an infectious… https://t.co/1MCzSalWsH",PuttSachiko,,-0.25
78,"Stickles Disease
There is over
Your life is over
Your life is everywhere

I am in his day
'Cause I feel it again, shouting",TitusAndMessina,,0.0
79,"@PragmaticInOz @Know_HG @jamesamcgee @i_petersen No
 This was pre vaccine wild type mostly which was a different di… https://t.co/6FSK1Fhwd6",BennyisHere_215,,0.19999999999999998
80,"Coronavirus Vaccine Development - Where Do We Go From Here?
With Kizzmekia Corbett (Prof., Immunology &amp; Infectious… https://t.co/P83VaoSqTv",nycallday247,New York City,0.0
81,"Ironic that such Qs, even posed as contexually and moderately as I think I've tried to here, may be called ""misinfo… https://t.co/TXZ3NIhzgJ",yyvonwang,NoCo,0.06666666666666667
82,You are repulsed by my sentient nature &amp; offended by my bravado; Disgusted by my body’s notion to exist outside of… https://t.co/vUOcrDC79R,mcfkerson,"My couch, der!",-0.39999999999999997
83,"This is SANATAN Dharma

In Kutch Guj when 25cows got lumpy disease their owner prayed,took vow tht he ll bring them… https://t.co/MUcZKPJtfW",Ninja0179048354,,0.0
84,@TMDA_TELANGANA @KTRTRS Thank you sooo much KTR Sir for your concern about our Muscular Dystrophy patient. Feeling… https://t.co/dRPdvshKXU,YadavSry,,0.2
85,"@Ishikawa_Sachi I wear one every day working clinical (53 w/ heart disease), it's a bit hot sometimes. Look at it a… https://t.co/lowLbaUaAB",KtuluRob,"Norternmost, California",0.25
86,"When #diarrhea sneaks up on you, it’s far from pleasant. These tips can help you manage one of the most challenging… https://t.co/1vEjpLci4d",EverydayHealth,United States,0.4583333333333333
87,"@bergstrom_doug @ida_v_e GOP has to pretend to care. Meanwhile . . .What's at stake in 2024?  Have Asthma, Obesity,… https://t.co/ErKMEBMQKu",NotfreeunderGOP,florida,0.0
88,"@HaraldVogel11 @LBowdeno @bobscartoons Back up those figures, you cannot.

You truly believe vaccines have not redu… https://t.co/L1upmg7YnY",StopCoronaVir12,,0.0
89,"High-Risk Disease, Novel Treatments, Health Care Equity Highlighted at SABCS - https://t.co/FmP1kUJ7Lt Managed Mark… https://t.co/gJ9InoNWyo",boobstagramm,Los Angeles,0.16
90,"@omar_danoun My husband is an electrician. We've heard a lot of crazy myths over the years, but this one has him la… https://t.co/rYHiaIaOlZ",Half_Baked_Wife,"West View, PA",-0.6
91,"@AtomJones @Dozzle101 @maximelearning @ChamberDisciple @MichaelPSenger PCR DOA, you must be joking.
PCR tests are s… https://t.co/FkTifEtmcd",lijnspook,,0.0
92,"@Jax87539443 What a nice picture you’ve drawn 👏🏻😃‼️At age 2, I inherited a Hershsprung’s disease that required 5 ma… https://t.co/HXfsYvGbug",BentWith,"Maplewood, MN",0.6
93,Prolly stand closer to 5’8 cuz of my disease,KIRKVEMBER,,0.0
94,"Let's expel this sick fuck. He's spread his brain disease around long enough. Fill him with meat, send him back to… https://t.co/18ev9gJCB4",JordanMRoberts,Toronto,-0.1910714285714286
95,@vijayiyer312 @mx__worldwide @thane_black BINGO!! Our current system of categorization is absurd. In no way does it… https://t.co/FfA2h3v7Y1,MGresko2431,,-0.25
96,"Is honest light. Disease often
bilev me the tree",Oktakurniawan16,Bandung,0.5
97,@SinnaPomme @brclothwrites You don't like mosquitos. You just haven't been around them to know that yet. The mosqui… https://t.co/ZvWFz5sWw1,environaty,Argentina,0.0
98,@UltraDane Liberalism is a disease,GOP2A4LIFE,"New York, USA",0.0
99,"@MUSIKMENFESS The reve festival- feel my rhythm, luxury disease, 28 reasons, beatbox, new jeans 1st ep",kageyaa_ma,"Kendari, Indonesia",0.13636363636363635
100,@lisaismymother @SKlNNYBRINA @PopCrave ….s poverty stricken nail manicure worker drvgged by cardiopulmonary disease… https://t.co/zdHJwIhNI9,GREYPlNK,Affection and Love,0.0
101,"@LaRaza1492 @Cash__Burner How in hell can something be a ""genocide"" (the intentional extermination of a people) whe… https://t.co/V9rrjgflws",lucien_og,"Tarragona, España",0.0
102,@K24Tv United on paper. Right now even ODM is in shambles. His denial level has become a disease,Denno_Mancini,"Nairobi, Kenya",0.2857142857142857
103,"@kashka208 @ida_v_e @tomaskenn What's at stake in 2024?  Have Asthma, Obesity, Diabetes, Heart Disease, Arthritis,… https://t.co/wx1gyhSacW",NotfreeunderGOP,florida,0.0
104,"@enzogirl11 @FLOTUS @WhiteHouse Before the renovation, many ""original"" plantings were long gone due to disease and… https://t.co/unjk9TleQp",MarthaShuping3,,0.175
105,"@JerasIkehorn Clean air &amp; water, the power grid, interstate hiways, safety standards, health departments, fire depa… https://t.co/LHJ2uGxHSS",radiopinecone,"West Yellowstone, Montana",0.3666666666666667
106,"Even if you haven’t found an affordable healthcare plan before, the Inflation Reduction Act extended financial assi… https://t.co/g5rG0nAeTU",LungNE,"CT, MA, ME, NH, NY, RI and VT",0.0
107,"@JReinerMD Exactly.  Locking down, promoting useless masks, mandating experimental shots, and treating children as… https://t.co/EeAWLLx0Rj",libertarian1231,United States,-0.0763888888888889
108,@mx__worldwide Using the current categorization I am moderate.The problem is the categories are NOT reflective of t… https://t.co/UQiZxRSvae,MGresko2431,,0.0
109,"Artificial Intelligence Predicts Future Heart Disease, Stroke Death Risk Using Single X-Ray https://t.co/yWjZAx7TYN #ai #ml #dl",AINewsFeed,United States,-0.2238095238095238
110,What is Graves&amp;#39; Eye Disease? https://t.co/aqwi9P7Qe4 https://t.co/sPUKsl82oU,dailyeyehealth,"Kampala, Uganda",0.0
111,lying is the disease and the truth is the cure               NAMSHI_promocode_promo_SIVVI_NOON_code_discount_coupon… https://t.co/gY8vIhBMI7,arizwan169,,0.0
112,@GeorgeJ20262901 @Timcast Heart disease and cancer kill 3 times as more than covid. But Meh right?,DontCareWhatYo3,,0.39285714285714285
113,Dinghy and Disease much feature high on the review of 2022!,Mitchover1,South of England ,0.18
114,@prakashraaj Over tweeting is the new disease.,shivena,"Aurora, CO, USA",0.13636363636363635
115,"@nicmarriaga @ida_v_e What's at stake in 2024?  Have Asthma, Obesity, Diabetes, Heart Disease, Arthritis, Cancer, P… https://t.co/trIsCQDsHH",NotfreeunderGOP,florida,0.0
116,@N76247476Man Not here to say right or wrong but the CDC should use those 8600 patients as scientific collection co… https://t.co/lBwX82BvI4,PWright1991,,-0.10714285714285715
117,"I really don't wanna hear those words coming from ANTI-VAXXERS.

My disability is not worse than your child dying h… https://t.co/63XQ5b9zsD",CobaltRogue917,United States,0.2
118,"People have a greater risk of heart disease, stroke, type 2 diabetes, and depression if they often sleep for 10 hours or longer.",Fact,,0.5
119,@TheLancet My husband was diagnosed a few months back and is steadily declining.  He has lost 55 pounds and cannot… https://t.co/5QsxApUijX,trahanteriann,,-0.011111111111111118
120,@ClarkeMicah If I were an 80 year old and I was told that the choce was between freezing my grandchildren's life fo… https://t.co/oU5wQtVAhv,UsSpacy,,0.1
121,@PJM_vocal okay I thought my weverse had developed some kind of disease since nobody talked about it :)),la_lun_na,,0.39999999999999997
122,"@TomFitton 32 Year old woman admits it’s a mental disease, and wants money. So she’s liberal.",WayneGilbertso1,,0.06666666666666667
123,"you'll never get rid of me, oh I'm like a fucking disease",purpleguyquotes,,0.0
124,"@DonDeicke @EuniceE62945638 @AnishaKMD In no way do I believe it’s droplet, I also understand the science behind th… https://t.co/RssUhXnZML",DebraBr81576310,,-0.4
125,"@ibdgirl76 Approach to plant medicines, &amp; provide training to physical therapists so they’re knowledgeable about ra… https://t.co/QAwakydlcQ",VIoletTailor,"Colorado, USA",0.0
126,"Did you know? Dr. Karl Bruno Stargardt, best known as the first doctor to describe Stargardt disease, was born on D… https://t.co/tfiJA9Aaku",reVisiontx,,0.625
127,It's amazing how all these 'celebs' who work for msm are 'anti establishment' and yet they won't divert from the es… https://t.co/2MjodygtEw,d415y4g3,"Freemasons heads, rent free",0.6000000000000001
128,Stay multis in any form are a disease,ReynoldDaDon,,0.0
129,@rjb_1998 @ASonNamedBort Talksport people surprised they've not had their passports taken off them and made to slee… https://t.co/qKVAp7njpu,SCFCJosh96,Home ,0.1
130,@EricMadere The disease 🦠,Model_Shanti,"New York, USA",0.0
131,@realTuckFrumper America deserves to see the dysfunction and corruption of the man's family... that claims he's PRE… https://t.co/NbqFwleNPj,ForyRad,,0.0
132,@drpraveenpsy Nope  but I think from what I know if depression will be of lifetime one have to take meds regularly… https://t.co/pWiwDz0MG5,DarkScientist5,,0.0
133,"@GxLaw00 @uncleseany @POTUS Except for the fact that if you don't catch a disease you can't spread it, that's a pre… https://t.co/r9oDMFiibj",Boxy_05,"Sunshine Coast, Queensland",0.0
134,"88% of Americans are metabolically unhealthy.

Heart disease is the leading cause of death every year (even during… https://t.co/fZFgFufw3O",ifixhearts,Get my book at,-0.4
135,"@JRJHealey @AMCKunneke @TracyBethHoeg How have they saved lives if they don’t prevent transmission, as first sold t… https://t.co/louKB3aaex",baseball41519,,0.25
136,"LOL 

a celeb disease? https://t.co/vk3WqiwSyL",RancidPotato,Hole In The Ground,0.8
137,"Is the disease really contagious? Yes, it is, undoubtedly.",OspinaBot,,0.2
138,My #AOA体育 disease #亚美 is #森林舞会 an https://t.co/OctGfF0eFJ,Aslamkh85652766,Mohabbat Nagar,0.0
139,Great high level academic event in stone disease👏 https://t.co/W7NX5rrE7y,endoAzim,Uzbekistan,0.32
140,One of the most common diseases that your dog can suffer from is definitely heartworm disease. Click link to read m… https://t.co/Q8zQpxcMkh,clonedt1,Cambodia,0.06666666666666667
141,Former Formula One driver Patrick Tambay has died at the age of 73 https://t.co/sJ9FQXiPyP via @MailSport,aussiecoley,,0.0
142,"Isn't an disease currently
؟?
نمشے

🔹C44🔹
🔹C44🔹
🔹C44🔹",mylo1130,,0.0
143,the contraction of a disease https://t.co/7zSllAaJUC,mr_mmd69,,0.0
144,@JeremyRedfernFL @ChristinaPushaw These people are ill if they think that Covid is the only communicable disease. W… https://t.co/DzQfaD3HGV,pet_demo,,-0.25
145,"Later, because the leader refused to answer the phone call, the angry crowd gathered at the community service cente… https://t.co/4w22iPxCeo",WpaperRv_Eng,Beijing,-0.25
146,"This place has everything: disease-eyeballs, passed-out non-depressives, an illegal quarry where a black-market  Ge… https://t.co/KnYupqAW6x",stefonerator,,-0.3333333333333333
147,"@chiefsoutsider1 @AdamSchefter It’s not just a regular stomach ache, he has a legit intestinal problem like Chrohn’… https://t.co/bRuqAvvZor",MrNooner84,"Atlanta, GA",0.0
148,@JohanJnrRidley @_kiebolton18_ @trott3r @CBennett_12 I think half of it comes from especially if the celeb has canc… https://t.co/bJqzJJfxG6,pdiddiz,,-0.08333333333333333
149,"@NEWSMAX Smart man, he knows the cure is worse than the disease ....... 🤔",ODiaz21162,"New Britain, CT",-0.09285714285714287
150,"chronic single disease:

Vision of having children and spending my entire life with her after a week of texting

sy… https://t.co/20tgcKIB2E",irvanchen,Medan,-0.03571428571428571
151,"@TheKirby_Guy @AxolotlScribbl1 @caveman_paste Okay so we know the “why”, but it’s not a good defense for spreading… https://t.co/Rpy6heQNRY",Nidonemo,"Fargo, ND",0.07500000000000001
152,"@TheJumpMuddler @JamesMoir10 I got u

My New Disease by Under Earth

Give it a listen here:
https://t.co/SA4A1Ti7o0",SongFinderBot,Australia,0.13636363636363635
153,"“It is a fair, even-handed, noble adjustment of things, that while there is infection in disease and sorrow, there… https://t.co/y8eezokNUU",FriarDale,Chattanooga,0.6499999999999999
154,@hyderabaddoctor Want to know if it is ar all possible to not die in hospital. Every thing a person does or related… https://t.co/EyJN4X9YWg,SumeetSabnis1,"Cincinnati, OH. Now in Pune",0.0
155,"New today:  Unusual Presentation of a Common Diagnosis in a Patient With Chronic Kidney Disease
https://t.co/sHwSDsNNm3 #CME",AMAEdHub,"Chicago, IL",0.012121212121212125
156,"@retiredatcchick @JamesHu29812484 People are jumping on me for not celebrating this woman's death.

I do not celebr… https://t.co/fJJ66vIf4z",RockyMountViews,,0.0
157,@hottwinklawyer a train in Europe can get you across a continent a subway here can barely get you across the city car culture is a disease,PotatoFaceBunny,He/Him,0.05
158,"@POTUS Who still thinks this is good PR? Nobody trusts this admin, nobody wants the dystopian “cure” to the disease… https://t.co/aqa2cI08Zu",HearIsMe,Worldwide,0.44999999999999996
159,@braindensity @OAyomidele @BigChiefDamian @officialABAT Illiteracy is a disease,Neyostica,Space,0.0
160,"Think of it, Doctor. Absolute power. Power for good. Why you could reign benevolently. You could end wars, sufferin… https://t.co/tfHXbE8F4I",picsignore,,0.44999999999999996
161,This disease runs in my family and is always a haunting specter in our lives. This reframe is super thought-provoki… https://t.co/GpMqGrlpgO,MENALibAHS,"Cambridge, MA",0.3333333333333333
162,@caglvn Disease away from you 😭🥺,Elham20011380,,0.0
163,"#LiveYogiLife 
Follow Guru Siyag Siddh Yoga and live disease free life. https://t.co/VhoMoh8t0N",TulsaRam2021,"Barmer, India",0.2681818181818182
164,@MuellerSheWrote I’m surprised you didn’t bring up the fact that Hunter has been suffering for decades with the hor… https://t.co/kAuyFYETD4,DrWayne03527763,,0.1
165,#开云 #亚博体育  His disease was complicated by pneumonia https://t.co/l4G7dFbjt8,Judith55363221,,-0.5
166,@NiceDrewishFela @davegreenidge57 @Stonekettle He mite wanna get checked out for Graves’ disease 😳,amybeth_gansel,Philadelphia ,0.0
167,#heartattack  is trending 😢 my father is Patient of this disease,RashmikaTweets,bharat,0.0
