,tweets,user,location,polarity
0,"Ranchers warn disease that would 'decimate' the cattle industry could cross the southern border

https://t.co/jr6qT5WScT",JackAub42647787,SF Bay Area,0.0
1,Never let the disease control you or your life because you are gifted with the willpower to fight against all the o… https://t.co/5VL0UTaFUN,HUDPunjab,"Mohali, India",0.5
2,#heartdisease is the #1 killer of women. Raise awareness about women and heart disease during #AmericanHeartMonth https://t.co/GwU0CtHyLH,matherhospital,"Port Jefferson, NY",0.0
3,"Here is an unsolicited radiology pearl:

If you are not a pulmonologist, or do not manage interstitial lung disease… https://t.co/p5xPn9sW5M",dr_cellini,,0.0
4,How to tell 300K+ people with #MultipleSclerosis that they may have been catastrophically misdiagnosed and instead… https://t.co/KjvJdwYf9l,ActiveMSer,New Mexico,0.0
5,(NBA YoungBoy Says He Has a Disease of Putting Out Too Much Music) https://t.co/0feDHClNMF https://t.co/paSNKln8Jp,hip_hopintell,,0.2
6,"Cancer doesn’t have one look, feeling, cause or course. It can happen to anyone, anytime. This #WorldCancerDay do u… https://t.co/ysrwf5PNvC",urvashi01,"New Delhi, India",0.0
7,"Link between coffee &amp; kidney disease may depend on genetic variant, study finds #UofT ☕️ https://t.co/YXzLBHwy9f https://t.co/V1w46B5mIv",UofT,"Toronto, Ontario, Canada",0.0
8,"Today marks National Wear Red day, a day to bring attention to women's heart health. 

Cardiovascular disease is th… https://t.co/p5IaQN1yBD",I77Express,North Carolina,0.0
9,♥️February is National Heart Month. We’re Wearing Red today at Monongalia County Schools’ Administrative Offices to… https://t.co/k4jplNHFKv,Monongalia_Co,"Monongalia County, WV",0.0
10,First time this Mulitple Sclerosis has affected my life... I want to go so bad... but I can barely walk... how much… https://t.co/atJeFz7KvE,MzLadyLion,"Knoxville, TN",-0.04999999999999996
11,@campdelcorazon - a camp for kids with heart disease in Los Angeles https://t.co/NFliuNpbzE,getchangehq,"San Francisco, CA",0.0
12,@saniaalhyahooc1 @Demsy_Simply @adamugarba It will never be well with illiteracy.  You and Tinubu are suffering fro… https://t.co/E1lDYtkPCg,doneghluis,South Africa,0.0
13,"Another way to support heart health is to donate to a cause that spreads awareness, educates, and combats heart dis… https://t.co/6kAUT4gG86",getchangehq,"San Francisco, CA",0.0
14,"Understand what healthy looks like for you. Learn what a healthy blood pressure, cholesterol, weight, and blood sug… https://t.co/exyVdQ8Znx",getchangehq,"San Francisco, CA",0.5
15,Manage your stress! Self-care is major when it comes to preventing heart disease. Get moving – baby steps are ok! –… https://t.co/IJS498aqUX,getchangehq,"San Francisco, CA",0.28125
16,Happy National #WearRedDay! Did you know that heart disease is the leading cause of death in the U.S.? ❤️ In honor… https://t.co/L53165qYEI,getchangehq,"San Francisco, CA",0.8
17,"Well, shocking.  NYC has spent a billion dollars on the 34,000 illegal immigrants who r in NYC and all they have do… https://t.co/Mqys7q0srB",bach_sand,"Connecticut, USA",-0.5333333333333333
18,"We all love our furry little friends. Check out this Hope Week presentation where Kristin Brunstein, DVM, discusses… https://t.co/HpJRit2cND",RSNhope,"California, USA",0.15625
19,Here is this week's most-read article featured on our #POMPEDiseaseNews website! Are you caught up?… https://t.co/u0ulKLmACK,PompeNews,"Pensacola, FL",0.5
20,Aggressive periodontitis is a highly destructive form of periodontal disease that occurs in patients who are otherw… https://t.co/ABf4Lwwhxb,MallGADentistry,"Buford, GA",-0.6
21,"Did you know that cardiovascular disease is the #1 killer of women? February is #AmericanHeartMonth, and you can le… https://t.co/a49s7qImLS",AAACentralTexas,"Belton, Texas",0.0
22,Detecting measurable residual disease beyond 10−4 by an IGHV leader-based NGS approach improves prognostic stratifi… https://t.co/nxWDyM23pX,BloodJournal,,0.0
23,Did you know children who have a parent with Essential Tremor have a 50% chance of inheriting a gene that causes di… https://t.co/3jSQCL1fW5,CNS_Studies,,0.0
24,"Another ‘touch point’ where cardiovascular risk can be addressed.

Adverse pregnancy outcomes &amp; long term risk of i… https://t.co/2TFiu6TVCa",cpgale3,"Leeds and Harrogate, England",-0.05
25,"Making everyone aware about cancer is the first step towards making this world free from this disease. 

World Canc… https://t.co/aet0dgo9LG",alexanestate,"Kharar, India",0.3
26,This day is designated for spreading awareness about cardiovascular disease — the number one killer of women. https://t.co/sTAuVv4aaI,news4buffalo,"Buffalo, NY",0.0
27,"Prayer for Today: Friday, February 3, 2023
Today’s Special Prayer Is For Everyone Suffering Any Illness, And Diseas… https://t.co/xZ07UhOfKZ",lerses,"Atlanta, GA",0.35714285714285715
28,"@PippaOona Many parents meant well but they severely abused their kids by getting them masked, isolated for weeks i… https://t.co/ddahSRAbzM",PlanetUplift,,0.5
29,"More open border collateral damage comin'.

Ranchers warn disease that would 'decimate' the cattle industry could c… https://t.co/NeWXIh6lS0",SandpointSlim,"Idaho, USA",0.25
30,"As part of American Heart Month, those all over the country are joining together to spread awareness of heart healt… https://t.co/0i4tYRWvRy",ConversionIA,"Brentwood, TN",0.0
31,We’re going RED today to raise awareness for women’s heart health. Cardiovascular disease is the #1 killer of women… https://t.co/5hkvYN3Nkb,RadNetImaging,,0.0
32,"Our first talk in the New Diagnosis/PD Refresher Workshop Series will take place on Tuesday, February 7 at 12:00pm… https://t.co/Skouu5EtYn",ParkinsonsBC,"Vancouver, BC",0.19318181818181818
33,"Dr. Reshmaal Gomes, MD, FACC, MCRP, had the pleasure of speaking on Good Morning Arizona today for National Wear Re… https://t.co/BC3JP2HmCv",PhoenixHeart_AZ,"Glendale, Goodyear, Scottsdale",0.7
34,"Join us on National Wear Red Day to raise awareness for heart disease and stroke. If you're wearing red, share your… https://t.co/3DviIhZb3w",mysuncoast,"Sarasota, Florida",0.0
35,Thank you @GovPhilScott for rocking your red and raising awareness of the No. 1 killer of women – heart disease.… https://t.co/WBOnuepbHd,VTHeartAssoc,,0.0
36,New resources for the PD clinical practice guideline can be found at the link below! https://t.co/SgfMiYdLXc… https://t.co/nYOw0nDSVw,APTANeuroPT,"Minneapolis, MN",0.13636363636363635
37,"World Cancer Day aims to prevent millions of deaths each year by raising awareness and education about cancer, and… https://t.co/MjcKseona0",sivawestcoast,"Eathamozhi, Nagercoil",0.0
38,February 3 is National #WearRedDay! DYK heart disease is the leading cause of death in the U.S.? We’re joining… https://t.co/4ULwbQFjgq,DurhamHealthNC,"Durham, NC",0.0
39,"On World Cancer Day, let us promise to never surrender or let anyone else surrender to this disease.
#cancerday… https://t.co/gEmhLlk6Pc",AthealM,Ahmedabad,0.0
40,"World Cancer Day aims to prevent millions of deaths each year by raising awareness and education about cancer, and… https://t.co/8pzD46qcaf",limited_gas,,0.0
41,"@ThisIsTheDealio @atrupar That's what the admin wants everyone to believe. Hundreds of Americans dying every day, t… https://t.co/CeeI47upkU",mgubrud,,0.2
42,"Kim Huntington-Alfano, D.O., a primary care physician at the Midwestern University Multispecialty Clinic wants wome… https://t.co/kTCzG3KNWH",MidwesternUniv,Downers Grove IL & Glendale AZ,0.30000000000000004
43,February 3rd is National Wear Red Day. Heart disease is the #1 killer of women -killing more than all forms of canc… https://t.co/ZhndUe6ToO,SteveA1960,,0.16666666666666666
44,"1 in every 5 deaths is due to heart disease, meaning that we are all impacted physically or emotionally by this dis… https://t.co/xjuq4gjEGH",EiraH2O,"Cook County, IL",-0.0625
45,"Yesterday, the @MWRDGC Board of Commissioners recognized February as American Heart Month. Today is National Red We… https://t.co/6AGhfQh00L",EiraH2O,"Cook County, IL",0.0
46,"@joncaleaf1 @gabrieloguda We're no mates sycophant,Raila is not my alpha and omega!!
That's your disease since time… https://t.co/Uz85C0jvav",BCheromoi,Bomet ,0.0
47,"@ViroLIEgy @anointedoneee @barryjohnreid21 @Mr_Magoo5 @CallMeEOnly No, I’m not claiming that they are not exposed t… https://t.co/Pv7exh3RXe",dxbdaddy,"Dubai, United Arab Emirates",0.0
48,@ColumbiaMed 2⃣Celiac disease can raise your risk for heart disease. Read the new guidance for people with celiac: https://t.co/3CtPpOwP3a,CUMC_GCA,"Washington Heights, Manhattan",0.13636363636363635
49,"@Islandlatte @RonDeSantisFL he said that the lands were never stolen from my people, I am Native American! Our land… https://t.co/QQbcnC5Lr2",CandidaOrta,"Temple Terrace, Florida",0.0
50,I got that fungus disease from the videogame show and now my dick is a mushroom,R0B0TM0NSTERS,,0.0
51,"One more issue at our wide open border with Mexico. It's only a matter of time... 🌵🇺🇸🐮
Ranchers warn disease that w… https://t.co/qENLViGp9q",LeanRight6,Arizona,0.1
52,"@AriDavidPaul @barber_btc @jordanbpeterson @Forbes @veryvirology @Covid19Critical I disagree.

Most people don't ne… https://t.co/0l6lwlSv3K",RationalStoic,In your head,0.5
53,"@art_burke @2wiredSecurity @Jaybefaunt Nobody ""wants' a job, dipshit. We work them to not starve on the street of a… https://t.co/HvKkXRf3pc",magistercaecus,,0.2
54,"Barney has youngblood's disease, poor guy https://t.co/VGXTiL2dmV",Spongey445,"Tomball, TX",-0.4
55,"Mutated Mornings and Evenings of Subterfuge PART 42 : Watching, Waiting,... https://t.co/lZCECXHRfB via @YouTube Ac… https://t.co/oKhvcmkYOD",DrJackSKYWATCH1,Sky,0.0
56,@MrAndyNgo Cultural disease.  Starts at home.  Respect for human kind is slowly rotting away.,AngelsFan1968,,0.09999999999999998
57,"Metabolic Cofactor Supplementation in Alzheimer's Disease (AD) and Parkinson's Disease (PD) Patients

https://t.co/uWMpQUrrfV",renesugar,Earth,0.0
58,"Livestock ranchers of one with hoof feet are now afraid of hoof and mouth disease coming across the border. Cattle,… https://t.co/yl7fSfWRhR",JackNas51331300,United States,-0.6
59,"Combined metabolic activators improve cognitive functions in Alzheimer’s disease patients: a randomised, double-bli… https://t.co/yNEPSw7UE1",renesugar,Earth,0.0
60,Ranchers warn disease that would 'decimate' the cattle industry could cross the southern border https://t.co/6qPUgVAPFK,Stormdrane,"Georgia, USA",0.0
61,"How is the DoD so sure it’s only a harmless surveillance balloon? Is it spreading a new strain of COVID, anthrax or… https://t.co/Tpnlg2ZjyC",daveguidos,,0.21212121212121213
62,Cardiovascular Disease: Eating 5 Eggs Per Week May Help Lower Your Risk  https://t.co/2NYWv3aV5A,Arby0ne,Land of Liberals,0.0
63,@aarickawash Wait until you see how many die from obesity and heart disease. It’ll hit ya at some point.,Provena22,,0.5
64,@pjampaganza Yes but recently I’ve lost 2 brothers 1 to heart disease and 1 to cancer.I heard and read that the dea… https://t.co/pgPWfDJCRK,carp40404,,0.0
65,The @UMassChan Office of Well-Being is partnering with @American_Heart to spread awareness on the importance of CPR… https://t.co/B9WFu0OWbM,UMassChan,"Worcester, MA",0.0
66,@glowinasia “i hope you get ANY kind of disease and die” “tpwk” oh the irony,sentyouflowrs,23,0.6
67,Jealousy is a disease and I have the pathological one. Oh my god https://t.co/0Ul1Okps2X,dalsosupreme,desi | arsville| 19,0.0
68,"Also, all this hysteria around a balloon is going to cause conspiracy theorists to start convulsing as if disease i… https://t.co/uFSE9LaIVG",Takethepwrback,Azkaban ,0.0
69,"@BBeeLight1 Which is serious, but the foot-in-mouth disease ""host"" in the White House IS decimating our country, an… https://t.co/9LowzgTWM7",realErikJuergen,Hidden Bunker Nondescript Bldg,-0.16666666666666666
70,"It's National #WearRedDay, and @GaPorts is doing its part to raise awareness about the impact of heart disease on w… https://t.co/NtXLvZUHph",GaPorts,"Savannah, GA",0.0
71,"Large Study Found Flu and Common Virus Linked to Neurological Disease, but They May Not Be the Cause: Experts

https://t.co/QqqP8Fxx2M",Kimmy33311,,-0.04285714285714286
72,@DocHashmi @mark_ginkel @DocSavageTJU @mmamas1973 @fischman_david @SVRaoMD @mirvatalasnag @djc795 @willsuh76… https://t.co/VqYNQLmreP,nolanjimradial,,0.0
73,@nexxterra @LimitGovt How is it OK to FORCE a mother who absolutely wanted her baby to carry to term when said fetu… https://t.co/OH2xBXABsX,Vengeance1974,,0.35
74,"@gargantuandwarf @Moai214527262 @PeterSweden7 always been and how it always will be.

If all that concerned medicin… https://t.co/QsYlZnYT09",RobdanPistov,,0.0
75,"Cardiovascular disease kills more women than all forms of cancer combined, yet only 44% of women recognize that car… https://t.co/dxbbuA873j",TVPPA,"Chattanooga, TN",0.25
76,"@BACHAGALOOP_ @DonaldJTrumpJr If a weird grain or cattle disease pops up soon in the US out of nowhere, don't get the wrong idea.",BigMangledMess,,-0.5
77,"New research finds widespread evidence that some alleles are more likely to be epigenetically silenced than others,… https://t.co/7xvuLjCVHg",TheScientistLLC,,0.21212121212121213
78,"@KatieWDee It's a Disease of Mind,Body, and Spirit, if left untreated. It's fatal. I have seen Miraculous Recoverie… https://t.co/6aylV3IPXQ",jlnpjr,"Big Cyprus , FL",0.0
79,"Based on Centers for Disease Control and Prevention data, over 107k overdose deaths occurred in the 12-month period… https://t.co/X6TzL06lGD",CHS_Monterey,"Monterey, CA",0.0
80,"Want to improve your financial wellness and reduce your risk of cardiovascular disease at the same time? Join the ""… https://t.co/ZCeSRbSYD4",fnbo,"Omaha, NE",0.0
81,more evidence that Mr Beast is the anti-christ: he has crohn's disease,b1gb0ss79,,0.5
82,"my brother has diabetes and when he was laid off years ago, he was genuinely terrified of what would happen because… https://t.co/swpCund525",palstineseaview,harry’s house | ,0.4
83,❤️#MatherHospital goes Red for Women on #wearredday during #americanheartmonth to raise awareness about women and h… https://t.co/QbZ50vTEed,matherhospital,"Port Jefferson, NY",0.0
84,"@_aussie17 Thanks for this, it makes absolute sense, my father in law lost his toes and eye sight to this disease",mariejo667,,0.2
85,"Read ""Cardiovascular Disease: Eating 5 Eggs Per Week May Help Lower Your Risk"" on SmartNews: https://t.co/Ff58YoEiZv",DanCas2,California (o/18 :-),0.0
86,February is American #HeartMonth! Join the CDC this month in raising awareness about cardiovascular disease (CVD) p… https://t.co/H73zbxnMGv,GreenfieldIN_PD,"Greenfield, Indiana",0.0
87,"Worst disease, cleverness meritocracy. We're living in the room
؟?
نمشے

🔹H4🔹
🔹H4🔹
🔹H4🔹",arya_cloud23,,-1.0
88,The @typhoidland team have finally reunited in for #TyphoidCocklesTerrorism -watch this space for more the evolving… https://t.co/qewYLEg2T4,SJVanders,"Oxford, England",0.25
89,"@LPNational @POTUS We all benefited from people getting vaccinated and not dying.

Plague rats don't have a right t… https://t.co/giV08xKTQZ",ZayPrime1,"New York, USA",0.2857142857142857
90,@neuro42inc Be open.  To technology you do not understand. To indications/disease states that are not glamorous. To… https://t.co/Z6VNTOuntZ,mattkaufmanTMG,,0.0
91,⁦@GoRedForWomen⁩ ⁦@UTMBSurgery⁩ ⁦@UTMB_CTSurgery⁩ did you know? Heart disease leads to 1 in 3 deaths per year in wo… https://t.co/8lnc20GTD5,gLevyMD,"Galveston, TX",0.0
92,Heart disease is the #1 cause of death for women in the U.S. Take charge of your heart health! Learn more at… https://t.co/PygVGRZAqo,UtahDHHS,"Salt Lake City, Utah",0.5
93,@alx @elonmusk There is no disease on Mars until we get there.,WallstreetWits,,0.0
94,"Join us as we wear red in honor of ""National Wear Red Day"", to bring awareness that heart disease is the number one… https://t.co/GcvyT2yYOr",phshriners,"Memphis, TN",0.0
95,Pick me-ism is a disease get well soon xo https://t.co/sPhdmVIVo5 https://t.co/9Vfe34IuA7,Kaitlynmseymour,,0.0
96,"Did you know that heart disease claims the lives of 1 in 3 women – more than all forms of cancer combined? Today, H… https://t.co/UfZj9gessJ",HSHAssoc,"Boston, MA",0.5
97,"On Fridays, we wear red ♥️ #NationalWearRedDay 
#WomensHeartHealthMonth 
• Cardiovascular disease is the #1 killer… https://t.co/Mt0o3bEmae",mimimd83,"California, USA",0.0
98,Which type of disease is this guys https://t.co/yYZXW08qkH,kabi_joshua,,0.0
99,My sweet friend Julie and I are rocking our red for heart disease and stroke awareness!!  #UPSWearRedDay https://t.co/7jqwuXDl3M,BransMama3276,,0.175
100,"New research: Syngeneic model of carcinogen-induced tumor mimics basal/squamous, stromal-rich, and neuroendocrine m… https://t.co/GpmKR5efeN",FrontOncology,"Lausanne, Switzerland",0.2556818181818182
101,Fuck cancer horrible disease hope you get well soon Ron 💚💚 https://t.co/SeB6evAPNt,Whacko1875,"Scotland, United Kingdom",-1.0
102,It's #WearRedDay and we are raising awareness for the number one killer of women - cardiovascular disease… https://t.co/8g8X7hpzlm,UAZHeart,Tucson AZ,0.0
103,@Undefea48952537 Hapo nikubali kukukosoa. Ujinga uliopo sio wa serikali bali ni wa wakenya. Our biggest disease is… https://t.co/Tnmj2eGrER,JustPinkerton,,0.0
104,"@neeramitra Freedom, since everything depends on it. Being broke is just not having financial freedom. Being sick i… https://t.co/8tVwOORECN",girainyson,The Netherlands,-0.35714285714285715
105,"On #WearRedDay, we’re reminded that women face increased risk of heart disease and stroke. Today’s the day to… https://t.co/cAbHC5ljhZ",edwards_care,United States,0.0
106,Alcohol-related liver disease is among the most common causes of morbidity and mortality worldwide. https://t.co/CklzuTOg2m,Immunology_LR,,0.06666666666666667
107,@CircRes Review Alert! #Integrin-Dependent Cell-Matrix #Adhesion in #Endothelial Health and #Disease. Learn more at… https://t.co/XVuFaJ5j7B,CircRes,,0.5
108,@sasilik @19joho The premise seems to be that immunity acquired from disease (with all its antecedent risks) is som… https://t.co/BxzWCyhQ5T,axoplasmicgap,Brain 🧠 ,0.0
109,"https://t.co/6w0MXLoBdg

Silver for Infectious Disease",bobmccauley51,"Austin, Texas",0.0
110,"@word_geek @lisakwildman @1goodtern Yes, the measles vaccine is great, we agree on that. However, the CFR of measle… https://t.co/xcqaG8Qmkn",Crilljin,"Stockholm, Sverige",0.8
111,"@PeterHotez Looking at their reference material, the Qatar study showed 60% effectiveness against reinfection durin… https://t.co/6F3AeZ0ERQ",BlueLionBlog,,0.0
112,"@BisonBriggz I can relate to that, kinda in reverse I thought I'd got indigestion, turns out I'd had a heart attack… https://t.co/1JRd80yhUm",what_jeremy,,0.0
113,Short term #airquality at #whitefield is Moderately polluted - AQI at 101 -  May cause breathing discomfort to peop… https://t.co/L3nfOQEaYn,WhitefieldAQI,"Thuberhalli, Bangalore, India",0.0
114,@electrocomplexx If you don’t transcend to the other world or suffer from a disease  or accident ofc,wishihadeula,Japan,-0.125
115,D.D. Hachar Elementary wears red for Heart Disease Awareness! https://t.co/OkeplE1hBQ,DDHacharLISD,"Laredo, TX",0.15
116,"@Informal_Geek01 @InspiringPhilos @EphraimAyil First of all, I don't care. Liberals are cucks. Muslims are not.

Se… https://t.co/yNJAC5Rcd3",MiddIePath,The road to knowledge,0.25
117,"Wearing red on National Wear Red Day in support of the American Heart Association and women everywhere! 
Cardiovasc… https://t.co/BEJdojlj3t",PHSHealthDept,"Nebraska, USA",0.0
118,@Steve45598226 @healthbyjames For those who did have changes did not have significant changes and they were transie… https://t.co/ISL0hQcjxx,ingvar_arni,,0.375
119,@mikejwhelan The therapeutics available are wonderful to control heart disease! You already do most of recommendati… https://t.co/oanwcMDjPy,nanazib3,,0.6333333333333333
120,Study shows Indigenous patients with autoimmune liver disease face worse symptoms and outcomes… https://t.co/lLi2z9ImIQ,Monarchglobalh,,-0.4
121,"Ranchers warn disease that would 'decimate' the cattle industry could cross the southern border

https://t.co/lpT7XQ2Qjt",harrytpk,Chicago metro,0.0
122,@aespalert like literally 💀 they need smthing to b wrong w her so bad bc they see her as perfection despite the dep… https://t.co/y4TpPHzali,Alover00517922,caribbean gal,-0.5999999999999999
123,@randomblackman @farmingandJesus This is dumb bro.. we are over 50 years removed from all that... Every situation i… https://t.co/jyfzSosWyz,xTheGoodNews,The Church,-0.375
124,"Today people are suffering from one or the other disease, the main reason for this is the lack of proper routine an… https://t.co/3Zrd8dLSUm",Navjeet20167713,,0.013888888888888886
125,February 3rd is National Wear Red Day. Heart disease is the #1 killer of women -killing more than all forms of canc… https://t.co/jp0vmSjj9A,naydene_d,"Bethlehem, PA",0.16666666666666666
126,An open challenge to Muslims! Imagine you  or your beloved ones are diagnosed with a fatal disease !! The doctor sa… https://t.co/mhke88bYdU,DerSquint,Israel,0.35
127,"@ninaturner Don’t forget that it was 620,000 white Americans that died in the Civil War from fighting, starvation a… https://t.co/VlRKnaqizf",robert99344,Washington State,0.0
128,@Agronomydoc Started one on fire at a Western Committee on Plant Disease meeting in Moose Jaw in the late 1990s or… https://t.co/EzwcdG8oWb,FungusAmungus3,"Lacombe, Alberta",-0.15
129,"It is not being have seen dreadful things apparent to the discourse, I have persuaded by a byword for to disease and trick",rhetoric_ebooks,,-0.475
130,The gut microbiome in Alzheimer's disease: what we know and what remains to be explored https://t.co/jmcYzpqDM3,christian_dkka,"Düsseldorf,Krefeld Umgebung",0.0
131,"#Vaccine hesitancy decreases, long term concerns remain in myositis, rheumatic disease patients: A comparative anal… https://t.co/NBX3UR1i13",LatikaGupta_,United Kingdom,-0.05
132,"@SenseKeto @joadomeit @JamieSale This is truth, the shots make very little difference to severe disease.",Candace1200,"Brandon, Manitoba",-0.24375000000000002
133,City Hall employees gathered in honor of National Wear Red Day to help raise awareness for heart disease. https://t.co/K2BZlsNA57,CityofElizabeth,50 Winfield Scott Plaza,0.0
134,"""EGG-SCUSE ME""
@MeetJess @RadCentrism
@DavidJoffe64 @white_bite
From February to December 2022, 43 MILLIONS egg-lay… https://t.co/jL9U2fnp1j",ejustin46,"Cannes, France",0.0
135,"@jetf23 @MuhHeidigger @ScottAdamsSays @RobbieJ377 @motherfood That's why I said the ""first order logic"" was not abo… https://t.co/LYMk204pvk",RichardWWard1,"Alexandria, VA",0.25
136,"Libtardism is a disease.
https://t.co/4bkLHYaLQo",tommybo19207544,"Las Vegas, NV",0.0
137,Precision health in action: Passive monitoring by smart toilets for protecting health and preventing disease. Via… https://t.co/oQcx7LAFnz,MuinJKhoury,"Atlanta, GA",0.15714285714285714
138,"Ranchers warn disease that would 'decimate' the cattle industry could cross the southern border

https://t.co/ReCDfBxhTF",Fritober2,,0.0
139,@Lostlnamoment jealousy is a disease and I have it 🥲,inaralovesNiall,,0.0
140,"In honor of #WearRedDay, employees at Norwalk City Hall are wearing red to help raise awareness about heart disease… https://t.co/V99LFueCix",Norwalk_CT,"Norwalk, CT",0.0
141,@JesslovesMJK @RWMaloneMD @RobertKennedyJr @SenRonJohnson @SenatorRennick @EpochTimes @PetrSvab @thecoastguy… https://t.co/AgnFkFX49s,t_endian,UK ,0.0
142,@benjiwal @SuyogCancer @hoperugo @darioT_ @PTarantinoMD @Dr_RShatsky @fnacevedo @CesarGSanchezR… https://t.co/pnn9HpJMY3,todrashish,Vellore,0.0
143,The @USDA_APHIS is considering requiring electronic identification for interstate movement of certain cattle and bi… https://t.co/KDly7IEAmJ,AVMAvets,"Schaumburg, IL",0.21428571428571427
144,#HepAsk How do B cells and T cells work to fight disease? https://t.co/QYXb7w3wv9,hepatitismag,United States,0.0
145,Did you know heart disease is a leading cause of death in the US? Join us on National Wear Red Day to raise awarene… https://t.co/NSwHlTKexm,NCTreasurer,"Raleigh, NC",0.0
146,"@ZakSmith0315 @JoeBell A vaccine that barely works, and winds up having more people die from the disease than the u… https://t.co/J37rCLU1tw",LibertardsSuck,"Des Plaines, IL",0.275
147,"Today, we celebrate #WearRedDay in support of the American Heart Association! 

We are proud to rock our red to rai… https://t.co/POg1Ft6SfR",RASLogistics,United States,0.26666666666666666
148,"Rare disease: Supplements reimbursed by Quebec Health Insurance
https://t.co/WkPR3diXE8

#BusinessNews https://t.co/b5t1bJkI2H",NowMyNews,,0.3
149,"#SickleCellWarriors, we know living with Sickle Cell Disease can be a challenge, so let’s talk about it!  🗣️

It’s… https://t.co/Du3RkBAvJa",SCDFoundation,"California, USA",0.0
150,"Today our Loveland, CO team joined people around the country for #WearRedDay to bring greater attention to heart di… https://t.co/tSLJUzZMm8",nordsonmedical,"Minneapolis, MN",0.5
151,"If you don’t want heart disease, #WearAMask. https://t.co/edxlTFGLwP",shaboom,"Suquamish, Washington, USA",0.0
152,⁦@GoRedForWomen⁩ ⁦@HeartNews⁩ ⁦@UTMBSurgery⁩ ⁦@UTMB_CTSurgery⁩ Why wear red today? #wearRedforWomen to riae heart d… https://t.co/ey58sdirsG,gLevyMD,"Galveston, TX",0.0
153,"Ultra-processed foods have been linked to number of adverse health conditions, including heart disease, obesity and… https://t.co/0pis6AWbll",thephillyvoice,Philadelphia,0.0
