,tweets,user,location,polarity
0,Action is needed in low- and middle-income countries to ensure that the benefits are felt equally around the world. https://t.co/pcU1OdHZEg,hhtomatoe,"Denver, CO",0.025
1,Vitamins not as effective in treating heart disease as some think https://t.co/zijMO3XvMw,canoncitynews,"Cañon City, Fremont County, Colorado, USA ",0.6
2,@seattlestorm Simone Edwards was truly special and we will miss her so much. Taken way to young by a terrible disease 💔💔💔,wsnanursejudy,,-0.08571428571428572
3,@MissKrabappel Considering most optometrists haven’t heard of the disease that caused my blindness I don’t have maj… https://t.co/04QRBJBBEk,Lyalj,Michigan ,0.5
4,Remembering Ginger Reeder https://t.co/jjDR1EPtQn The news of Bruce Willis' frontotemporal dementia diagnosis hit m… https://t.co/JbWp72UG8T,tuatu_pr,Madrid,0.0
5,"Summary of opinion: Innovax-ILT-IBD,turkey herpes virus, expressing infectious bursal disease virus and avian infec… https://t.co/0pW4dofTu3",hccentralpharm,United States,0.0
6,AwesomeCapital: Merck: Priority Review for Cytomegalovirus Disease... https://t.co/9iXsk07jNQ,cmencke,,0.0
7,capitalism is a disease and if you think you can win with it you are infected,knuckle_fuck,"Nashville, Tennessee ",0.8
8,@RonnyJacksonTX You are a lying sack of traitorous 💩.  I'm not interested in your violently biased 'medical' opinio… https://t.co/ZzmEBJS9nR,VampireMuffnMan,"Minnesota, USA",-0.30833333333333335
9,"@Babygravy9 But it’s a GOOD thing that a 19 year old has it, because it challenges our assumptions about the diseas… https://t.co/6zKL02WVk9",vengeroo,,0.39999999999999997
10,@Mikeyboy1521 @OK_Dumbass @charliekirk11 Vaccines period don’t STOP you getting a disease or transmitting it. They… https://t.co/pPWJyyez4f,Dj236980,,0.0
11,"@mrboringperson @VaushV For Non Black people who are INCAPABLE of reading for yourselves.

To suggest Blackness nee… https://t.co/eehzbxIk34",CommunistsEgirl,She/Her,-0.16666666666666666
12,@AwkwardDari @XiranJayZhao @lyingrain The reasoning for the french academy went: COVID stands for coronavirus disea… https://t.co/Yt7T4AKBuP,CoralineAE,,0.0
13,"@EricJorgenson Little off topic, but think about this.

Centre for Disease Control.

Take away assumptions, and read the words.",nobreakfasts,NFA,-0.1875
14,"@_wishcraft ""Blue fish"" sounds like a kinda disease, can I re-roll?",MaidenFGC,Sweden,0.0
15,@SaintHeartwing @Calamityjane77 @libsoftiktok Using students is definitely BS. Liberalism is a mental disease. Imag… https://t.co/tJ0Ze6dsCB,DamnYouHenne,"Florida, USA",-0.05
16,"I am confused as to what the difference is between Sjogren's with+ SSA, SjD with ""only"" positive ANA and SjD with n… https://t.co/DHBI4BJV0q",MalintheEnt,"Västerås, Sverige",-0.057575757575757586
17,@thereal_truther @RaisingSqrPegs @Hansmajestaet1 @dobssi @galinash @saint She was dxd with Covid induced Graves Dis… https://t.co/B5M7g6uE7V,SavorySensation,Davos Level Risk Adverse,0.0
18,If anyone has cure for this #wildhearts disease on my PC.  Please halp.  Thanks. https://t.co/FmmXDJ93Xd,EDCCarry,"New York, NY",0.2
19,@WHOAFRO Marburg virus disease. Viral Haemorrhagic fever.  Bleeding from the eyes and mouth... some call it the ''Z… https://t.co/sG3TdJChdy,CraigandBarbar1,,0.0
20,"@krassenstein His disease was formed by Lithuania(country) with directed energy weapons,wireless mind control techn… https://t.co/ZGF7EDyvJ5",AgneSimkute,,0.0
21,@VincentCrypt46 72 hours a month will prevent any disease,mujibomb4u,central shadow banned dessert,0.0
22,@eagle123kp @WildHoney808 You know nothing at all about this disease. Stay out of things you know nothing about! Yay for her!,Christy82635445,,0.0
23,"Join us today @ 1:25 in HHB 104 for @uabbme Graduate Student Presentations ft. Hunter Dean, MS, and Rifqi Aufan on… https://t.co/LOQFFrPZY2",uabbme,,0.0
24,@CumbriaChief Jealousy is a disease. Perhaps she'll get well soon. Lady looks fab to me.,Midge1415,,0.0
25,"@TheDrJon @molsjames @unbridledmd But - we all knew by March 1, 2021 (before mass-vaccination of healthy adults at… https://t.co/Egpbf24nNq",jhnghmn,"Lake Stevens, WA",0.5
26,"Sickly sea lion is Chile’s first bird flu case in marine mammal 

@ejustin46 @RajlabN @siamosolocani

https://t.co/knwsmCsIpW",COVID19_disease,,-0.23214285714285715
27,"Producer and rare disease mum, @laineymoseley, has created an incredible documentary, Too Rare To Care, capturing t… https://t.co/j2s3HK29aD",brannigan001,"Woking, South East",0.375
28,Small wonders: The antibodies from camels and sharks that could change medicine https://t.co/FRxBLn1TQw https://t.co/84Q2cFiTLu,HealthSmartMe,Melbourne AU,-0.25
29,Covid  finally got my hubby n I.We are vaxed  n believe that is why we both feel like we have a bad cold rather tha… https://t.co/Q99FGbbtte,CarmFl61,Blue dot in red state Fl,-0.4333333333333333
30,@K8Stott @1goodtern I have said since 2020 that Long Covid acts like an autoimmune disease. I also feel that Covid… https://t.co/6fSC1idN7u,catladyactivist,"Covid Hellscape, USA",-0.05
31,"@SandraDuffy123 @IrishTimes When we go back in time, we learn that louis pasteur was backed by royal elites to push… https://t.co/9uaEFon5Y8",QuasiGee,,0.0
32,"Bird populations everywhere are currently being ravaged by the H5N1 virus.

The Economist reported today that about… https://t.co/4CmpxKU8Sb",EconomistSaid,,0.0
33,"Issues such as #poverty #ethnicity #childhoodtrauma, social determinants most powerful predictor of being diagnosed… https://t.co/Q1IWgX8qSy",LisaTMSA,Northern Ireland,0.20833333333333331
34,"Confidence and hard work is the only medicine
To kill a disease called failure ✅✅",HaseebA31649263,,-0.2027777777777778
35,@JohnFetterman I have been hospitalized for depression. It is the disease that very few want to speak about. Your h… https://t.co/snywOoolUt,MichaelsRefrain,"Seattle, WA",-0.26
36,my thing is this: they’re fighting each other over control &amp; power &amp; saying “fuck the disease” like this is how an… https://t.co/eQxNIpQu5U,Ziggy_Indy,on your mind ,-0.125
37,@prageru It wouldn't replace them. Those who like to abuse the current system would start getting robbed and scamme… https://t.co/VE7saEK0Pi,Ellef0nt,,0.0
38,@Semiotics_Omnia @ElanzaWellness @theendoinformer Exactly. It’s progressive and that makes it dangerous. Some types… https://t.co/8EWWUWeqwE,greenleaftee,,-0.175
39,"@RoslynLayton @CryptoLawUS @InsideSourcesDC @CecereCarl Thank you, Roslyn for helping us disinfect this disease of… https://t.co/HjTpIa8tMQ",1way_xrp,,0.0
40,"@Michele07317502 @thejackhopkins And Abbottitis, but this disease seems to be a copy of the Florida flu.",TBrno11,Bay Area,0.0
41,"Sampling continues on Harris today on the Lewis and Harris sheep scab control project.
The scheme involves testing… https://t.co/zhEb9ULymy",MoredunComms,"Penicuik, Midlothian",0.0
42,@pilutions @deepily I recomend self deletion as a viable solution to their thinking problems. Some people just can'… https://t.co/VA4QPSJ67J,bipedal_opinion,he. they. her.,0.0
43,"When it comes to eating right and exercising, there is no ""I'll start tomorrow."" Tomorrow is disease.",DietingForLife,Manchester,0.26785714285714285
44,@belletastrophe Jealousy is a disease and I’m chronically ill,Vigilsante,Nikolaus A. Carter,-0.5
45,"What radiation doses on humans ? 

How much Millisievert per hour on individual for continous days could trigger ce… https://t.co/jeI7k4W4qT",my_conviction_2,Chennai,0.1
46,A black-streaked dwarf disease on rice in China is caused by a novel fijivirus https://t.co/SSDeomuy0f,GsaJournals,Albuquerque,-0.16666666666666666
47,@logipab @SantaRosaPolice People are so loving and understanding these days. It’s not like alcoholism is a disease… https://t.co/l6RSFCJHoM,LeonaKenzy,,0.6
48,niR=S Cancer is a deadly disease.    #上海 #天津    #青岛         https://t.co/YOxb6quMp7,popbutt2,,-0.2
49,"@chroniceileen It’s really wonderful you help people connect around your disease, it’s hard not knowing anyone else… https://t.co/LWmzViZh6K",hedonish,cash.app/$Hedonish   she/they,0.35416666666666663
50,"Virtue Signaling is a disease.

If anyone thinks that an AR-15 (or any weapon) ""Kills someone"" then yes, please do… https://t.co/DljdMHw4Ya",KAMbot1138,,0.0
51,"@notgood67875506 @CoralineAE @XiranJayZhao @lyingrain It's not the virus, it's the corona virus disease. I thought… https://t.co/2oHYpKE3tt",GundalfRWB,,0.0
52,People with long COVID explain how it changed their lives - PBS NewsHour https://t.co/SBWAbI25bM #longCOVID #news,StudyLongCOVID,United States,-0.05
53,"@MistressOfNull @Unearthly_Chi1d To be fair, both participants were getting severely affected by a nonsense space d… https://t.co/mplgEBO7eT",CommanderHales1,Terra Alpha,0.7
54,"Woman Dies of Rare Brain Disease Within 3 Months of Second Pfizer Shot, Doctor Says Vaccine Could Be Responsible •… https://t.co/8e8Bq7TQkA",llcichon,,0.16666666666666666
55,@chroniceileen Lol if you know and late 20s/early 30s folks with indolent systemic mastocytosis (esp if they’re que… https://t.co/nX0p9MDrIh,hedonish,cash.app/$Hedonish   she/they,0.19999999999999998
56,Sounds like a disease,sillyzaki,,0.0
57,"@ManGoinOtherWay @BrentLeeSDCIC @zoeharcombe It’s possible, but not probable.  You’re basically saying that you don… https://t.co/c9Xn8Om4iJ",jimeekay,United Kingdom,0.0
58,@PrettyBlackMy Do not feed into Pookie 🤣😂 that man had pigmentation. His skin l disease grew as he got older. He go… https://t.co/Uyea4hXcwF,ToriiAGTweets,rip torian tae KingChris eric,0.16666666666666666
59,[NAvx Cancer is a deadly disease.    #上海 #天津    #青岛         https://t.co/NzIbQoiLlN,AgusSukoco87,,-0.2
60,"""person with a melancholy temperament had been fated with both an awful burden and what Byron called “a fearful gif… https://t.co/Dg11WR2tMU",reddy_rajneesh,"Hyderabad, India",-0.95
61,"when i’m good im good, but when i’m bad i get a serious venereal disease",pinkglocky,"Houston, TX",0.09166666666666669
62,"After 3 years as an all-virtual meeting, the Conference on Retroviruses and Opportunistic Infections returns this y… https://t.co/JYEPLdnX62",InfectDisNews,"Thorofare, NJ",0.0
63,"BS! Capital B!🧐
Alarmism is a disease of the weak minded...🙄🍻😉

https://t.co/5oOya8d1W0 https://t.co/dS25lKjLsB https://t.co/p7SUezP3Zx",TedVerwey,,-0.375
64,Advanced imaging tech may be able to detect early-stage lung disease https://t.co/Dq4CeVaOKn via @medical_xpress,MonarchFromGR,Greece,0.3333333333333333
65,@FiorellaIsabelM But that same government has become so entrenched that it has made it nearly impossible for its ci… https://t.co/F36IeVccon,MagisterIR,California,-0.3333333333333333
66,@GuyL0nely I’m not a fan of it but I was at least hoping they were going to go somewhere with it? Give him super st… https://t.co/ddQmGj9Afu,LangleyMNeely,"Chicago, Illinois USA",0.016666666666666663
67,#ASCOGU23 Adjuvant pembrolizumab (pembro) for renal cell carcinoma (RCC) across UCLA Integrated Staging System (UIS… https://t.co/vWPsYDm08W,MLPOncoData,"Medellín, Colombia",0.0
68,Help us fight against heart disease when you shop in store! You can round up your purchase or donate a custom amoun… https://t.co/OLFrAYMBuP,AdvanceAuto,"Raleigh, NC",-0.2
69,/ i think despair disease fuyuhiko gets the friendliness desease 😭 he keeps scaring mikan bc everytime she turns ar… https://t.co/EiUMZd9pRK,BBYGNGSTA,MDNI ⋮ drrp | mvrp ⋮ icon:,0.0
70,"Millions worldwide suffer from Morgellons disease, yet the CDC continues to dismiss and stigmatize this debilitatin… https://t.co/WVKaFEyf8m",MMorgellons,,0.0
71,"Despite peer-reviewed evidence and the pleas of advocates, the @CDCgov continues to dismiss #Morgellons disease as… https://t.co/huw10FNd6d",MMorgellons,,0.0
72,@MetroUK Sad times. Brutal disease.,David_Murphy198,"Glasgow, Scotland",-0.6875
73,Eating a #plantbaseddiet is linked to lower risk of heart disease or cancer. It also boosts the immune system.,SmoothieHeals,,0.0
74,"Playing victim hood is  a kind of disease, some people will always find others conspiring against them, and if not… https://t.co/LosYzydnBR",ArguingIndian,,0.26249999999999996
75,"Outdoor activity reduces the incidence of myopia in children
1. #Myopia is a refractive error of eyes, which causes… https://t.co/ObAnoLjnon",hyderabaddoctor,India,0.0
76,"@anon54980 And then this guy, Kupukupu who fell from space and without word about him causing mayhem or bringing a… https://t.co/XMRz30VZlp",DBanes2,,0.0
77,"@AliNeitzelMD Protection from severe disease remained high, and Omicron isn't as dangerous.

Long Covid is a larp.",JohanMullet,The Mitten,-0.1633333333333333
78,"@AwkwardDari @CoralineAE @XiranJayZhao @lyingrain It's Corona Virus Disease, so maybe it's because of the disease part.",GundalfRWB,,0.0
79,"@mariashriver This so true medical issues need to be in the light, not in the dark. There is no shame in suffering… https://t.co/iS9xNyHzeS",SookramGaitrie,,0.20625
80,"@fitterhappierAJ Of course, severe disease doesn't include chronic infections that damage organs over the long term and cause long-covid...",dittmar_david,,-0.05
81,@JenniferSey I'm going to go out on a limb and say NOBODY needed it. At best it prevented vulnerable ppl from sever… https://t.co/24LAiE2MWT,OclisaGee,FL,0.25
82,"Bravo #mhhs #hosa future health professionals for the ABCs of Gum Disease campaign, https://t.co/fLOmd11Qcn. Gratef… https://t.co/jc1h9xYL5Z",EileenE_CN,California,0.0
83,Understanding potential disease behaviour hinges on accurate #diseaseburden calculations. But how this be confident… https://t.co/3hQdw3ezyi,hellobluedot,"Toronto, Canada",0.30000000000000004
84,People living with long COVID explain how the disease changed their lives https://t.co/QvRjao8U2C,aspirefamily2,london,-0.05
85,@4CPcomics Great news but the headline missed some detail. “Protection was substantially lower for the omicron BA.1… https://t.co/WINWyFW24S,JReynoldsMLIS,"University of Miami, Miller School of Medicine",0.8
86,"Congrats to Omar @omar_on_a_chip, Ryan @ryantyee &amp; Melody on their review paper where they highlight instances wher… https://t.co/FPPMkf2ecI",YYZscientist,"Toronto, Canada",0.0
87,@notlikethesoup Man financially secures family’s future before being forced to retire due to tragic disease,kicharters,California,-0.23500000000000001
88,"@pordede wife is a doctor, don’t love the idea of her working for free

i want cheap gene therapies that cure disea… https://t.co/yMkGn5ZVxz",art_pleb,,0.43333333333333335
89,other tags: hanahaki disease | angst | one-sided | omega!jiu | alpha!wendy | jiu wants wendy saur bad https://t.co/yK02A9D4K6,altshuttles,22's Wendy. Pilot-in-Training.,-0.20833333333333326
90,Novel Approaches to Understanding the Mechanisms of the Neuropsychiatric Symptoms in Alzheimer’s Disease and Relate… https://t.co/k18JGQba6N,DJDREK84,"Brunswick, Georgia, USA",0.0
91,@TheChiefNerd @GovRonDeSantis Talk about a disease....,OmaTalley13,"Austin, TX",0.0
92,@swastrosarah @drclairetaylor @cdc @OpenMedF Per SEC update 👆🏻the way and the kind of tests that Dr. Systrom’s grou… https://t.co/MYM6pQfn6q,ValeBodi,  MEssland Worldwide,0.25
93,"@zukosmadre I’m not a scientist.  I’m most definitely not anti-science.  I’m not anti-vax, and I’m not anti-birth c… https://t.co/vr6eVSOPrD",JRGhaddar,NYC Austin LA,0.25
94,Being a broke girl is also a disease https://t.co/vHiH2jJRLL,ogwokmaurice,kampala,0.0
95,Entitlement is one hell of a disease.,Stylespobykara,"Nassau,Bahamas🇧🇸",0.0
96,jealousy is a disease,vvlbie,,0.0
97,Pfizer scraps half of participants in Lyme disease drug trial due to quality issues https://t.co/cezADUZ9Fg,statnews,,-0.14583333333333331
98,SG@?B Cancer is a deadly disease.    #上海 #天津    #青岛         https://t.co/quCq8gyMHP,cieza_fs,,-0.2
99,‘#Adolescent binge #alcohol enhances early #Alzheimer's disease pathology in adulthood through proinflammatory neur… https://t.co/848DiAak5l,Facultyopinions,"London-based, global reach",0.1
100,"#BirdFlu continues to spread across the globe, threatening stocks of poultry supplies.

The disease is extremely de… https://t.co/GL8lVlqs0F",EpochTimes,"New York, USA",-0.125
101,"Brain on Fire: Chloe G. Moretz you are so talented! This story is so touching that I've cried an ocean of tears. 
I… https://t.co/bIrDLFrjqW",Cassy_the_Raven,"Rimini, Emilia Romagna, Italia",0.6
102,He has ever disease known to man https://t.co/mttmANPdvO,CremDotEXE,"She/They, 20, 🇹🇭",0.0
103,"No, he'll never make it Too much disease and drugs.🐻🙃 https://t.co/axihLXtJFB",nancethebear,3rd rock from the Sun 🌞,0.2
104,Depression is a disease and you don’t need to pretend it’s a superpower to have compassion. https://t.co/s4xPhEGyqC,PeterRobinsonMD,,0.0
105,"Save that disease, normally contracted in childhood.
؟?
نمشے

🔹W77🔹
🔹W77🔹
🔹W77🔹",alinrevine,hateg,0.15
106,"@ProfFuriosa @TheAtlantic @KatherineJWu So you agree it's not a ""rich, white woman's disease"" as you earlier claimed. Great stuff.",LongCovidNews,long covid hell,0.153125
107,"The video is not long enough to properly judge. However, this is a Hyperbaric high oxygen pressurized Chamber used… https://t.co/RvyXVkNSp0",elmtree888,New Zealand ,0.04625
108,"r 56 million will contract the disease, which
ki
_Coupon_Iherb_I_Herb_Code_s_
  He spread the dust o https://t.co/HFHGRTpdRM",Naaluv1,,0.0
109,"Wishing speedy recovery for all the devils and other club supporters who've got the rainbow disease 🙏
You can see i… https://t.co/bG350DChX3",MrS1UU,Gym,-0.125
110,The Clock is Ticking - Register Today! Fulfill your ABFM requirements and register now for the stand-alone FAFP Vir… https://t.co/Ns2kCOxPCe,_FAFP,Florida,0.0
111,Do the people here at Indigo know what they're putting in the bookshelves? An entire shelf dedicated to Harari's ne… https://t.co/ms13zUWYJZ,JanEricLerner,"Hamilton, Ontario",0.0
112,@Iovepaths Me and you both it’s so fawking scary like what do you mean there’s a disease with no cure and a 100% fa… https://t.co/Ehee9Qlt5t,dearaprils,she her ,-0.40625
113,Vad@&gt; Cancer is a deadly disease.       #上海 #天津    #青岛                   https://t.co/w4jfhHos4v,tyleryoung87,,-0.2
114,"@MichelleDewbs I totally agree with you. I'm talking from first hand experience, as I'm in hospital at the moment h… https://t.co/KpvVnDAPUt",deriasst,,0.125
115,@djtloves2 @streifel_v I agree with you about Biden having Alzheimer's. But please do not group him with others tha… https://t.co/Q43WP32h1B,grba2020,"Virginia, USA",0.0
116,"iIf anyone has had the misfortune of living with, or witnessing a person with the onset of Dementia,  realizes that… https://t.co/6st04bXr68",Texasfreespirit,"The Woodlands, TX",0.0
117,"Persimmons contain flavonoids called quercetin and kaempferol, which have both been linked to a reduced risk of hea… https://t.co/T8UHgWhQJd",kollaJell,"Temecula, California",0.0
118,"Bruce Willis diagnosed with 'cruel disease' frontotemporal dementia, family announces https://t.co/X4QBp2bwZ7 I hop… https://t.co/omzTXLgUUd",loptweet,,-1.0
119,19-year-old becomes youngest ever diagnosed with Alzheimer's disease https://t.co/jNu2FoDbFO,calgaryherald,"Calgary, Alberta",0.1
120,"Heart disease is a common condition that affects people with diabetes, but how much do we really know about it?  … https://t.co/ZT9Gz2DzC6",diabetes_africa,,-0.04999999999999999
121,Hot take of the morning is that the overdevelopment of the financial sector in the US is the Dutch Disease of Ameri… https://t.co/l2OCXjS6gc,realjdowner,Bogotá,0.125
122,People living with long COVID explain how the disease changed their lives https://t.co/65TYOOywYL,BlazersUnited,,-0.05
123,"@Sassafrass_84 @KarenGa71454633 Personally, I'm a pharmacist.  I got the disease in November of 19.  Of course, I k… https://t.co/UnkVvRX85x",JCDeardeuff,,0.0
124,@mkraju Depression is a tough disease. Best wishes to Sen. Fetterman and his family.,CuriousPongo,,0.3055555555555556
125,"Persimmons are full of antioxidants.
Generally orange or dark orange in color, persimmons are rich in beta-carotene… https://t.co/P2zL051kUF",kollaJell,"Temecula, California",0.15625
126,"Prioritizing #health equity in #clinical development ensures better patient outcomes, and creates a framework for u… https://t.co/7GyR2H89b8",Clin_Info_News,,0.5
127,your dick ashy and with DISEASE https://t.co/DydLkhcUfN,classicplaygirl,"Arizona, USA",0.0
128,@NikkiSixx Becoming a great veterinarian nurse (career change at 47) despite recent diagnosis of sister disease of… https://t.co/tYkyd2hrGD,CaptainMalort,,0.4166666666666667
129,@EvaRoethler next week is my last week before leave and i can’t tell you how bad i’m suffering from “not feeling it” disease,holidayballiday,"Minneapolis, MN",-0.23333333333333328
130,When someone in your life has a serious brain illness (mental illness) - in difficult moments remember you are both… https://t.co/aKGS7ZWkrl,debookie,"Seattle, WA, USA",-0.3111111111111111
131,"@hon_eyc0mb Different diagnosis, this is a seperate and secondary diagnosis.  The other was a disease that made it… https://t.co/QXd5zvUs1I",BadgerFanJHoege,"Madison, WI",-0.14166666666666666
132,The mosquitoes that transmit the disease dramatically increased their range over the last century as temperatures w… https://t.co/ucHZxfcT4n,UCLASustainLA,UCLA,0.0
133,@AshJHill @palminder1990 More people died of heart disease in Canada in 2020 than people have died from covid (with… https://t.co/f2ObAoCoYV,KevinUrbaniak10,,0.5
134,@SCDFoundation @HopkinsHeme Thanks for coverage @parents and great to hear from @sicklecell101 in this piece.… https://t.co/HeUHusF8j0,LydiaPecker,,0.5
135,People living with long COVID explain how the disease changed their lives | PBS NewsHour https://t.co/fKdiVyWwMI,Hephaestus7,Canada,-0.05
136,"The slow burn of inflammation is linked with diseases such as cancer, heart disease and dementia - but lifestyle fi… https://t.co/DNBgRMMBz0",theipaper,,-0.15000000000000002
137,"@Doctor_I_am_The Ah yes, I remember this.  I think I also asked back then about when is likely the majority will present prion disease.",gjbangar,,0.0
138,Our first patent granted! My student Dr.Namisha’s seminal work on developing a method to impart ToLC virus disease… https://t.co/35i2a6Gapn,manoj_prasad70,,0.25
139,Prevention and control of Cardiovascular Disease. https://t.co/pcHfVMEDfJ,OptimalTrend,Lagos,0.0
140,@MediaFoxx @SprouseCarson @getnickwright Keep spewing your Fox News talking points. Imagine the damage if she had g… https://t.co/f2fLDwlcHy,urnotthtguy,,0.0
141,Pablo Sleuth my son they have every disease https://t.co/tXgmUymdHu,HenryAnything,Toppat Orbital Station,0.0
142,@idahodom1 @AIdahoan @nichols_senator Steroids aren’t a vaccine for a disease and can also be given by a doctor leg… https://t.co/odzoYIfNXJ,ImLeConquerant,"Boise, ID",0.0
143,@HunterAA6 These people are absolute clowns. I still deal with respatory issues daily from when I contracted COVID… https://t.co/4eA1T3QaTs,SebrinaShelton,Georgia ,0.1
144,@Karenssidenigga @FireflyCait @cliftonaduncan Right. The idea is to get vaccinated BEFORE catching the disease... B… https://t.co/ZbLQIWoF4k,criticalsfl,South Florida,0.44285714285714284
145,I've never added someone who hasn't personally wronged me to The List (of people I'll visit if the world falls apar… https://t.co/fQfQPiWrHE,ClareandPresent,,-0.25
146,"@CovidCastaways ME/CFS. I did find a great Dr to read though ""How can I get better?"" by Dr. Richard Horowitz. He re… https://t.co/7KPHFjPBfb",lux,west coast,0.65
147,@littleghoulies id kill for a diarrhea disease,LayzPotatoBitch,Pennsylvania,0.0
148,"Stream The Government Throws Money at Heart Disease, but Prevention Is Better than Cure by Mises Institute | Listen… https://t.co/FWmLuosPng",The_Duck_Test,🇬🇧,0.5
149,@Forbes His disease was formed remotely by Lithuania(country) with directed energy weapons.,AgneSimkute,,-0.1
150,White lead disease and 2p https://t.co/DEGdK69dFs,dokmin2711,,0.0
151,These are very mentally ill people!!! @krassenstein @edkrassan @bynsny Fun Fact did ya'll know Transgenderism is li… https://t.co/mL8hR19TTa,rolotomasi777,So Cal,-0.1
152,We applaud the meaningful work being done by the GVHD Alliance to raise awareness about graft-versus-host disease b… https://t.co/fLpQfoDLd5,SanofiCanada,"Toronto, Canada",0.5
153,"Lower extremity venous disease is more common than #PAD!

Comprehensive review of chronic venous disease. #varicose… https://t.co/GmPsBHOGJO",MyJSCAI,"Washington, DC",0.1
154,“is adhd a disease or disorder” GIRL???,ReRay_mao,,0.0
155,)@/5( Cancer is a deadly disease.    #上海 #天津    #青岛        https://t.co/FJZ9xARB2h,kagetu__000,,-0.2
156,"Dr Dinah Parums | Parums DV. Editorial: Targets for Disease-Modifying Therapies in Alzheimer's Disease, Including A… https://t.co/B5kY7zc5dM",DinahParums,United Kingdom,0.0
157,@gavinthomas2015 Diabeetus is a hell of a disease,AwkwardBde,,0.0
158,@JoramMD Diseases like cholera disproportionately affect the poor with little access to clean water sources. We hav… https://t.co/kVj2HE4OO9,WJS_Nyangulu,Malawi,-0.07361111111111111
159,"Persimmons contain a huge number of flavonoids, polyphenols, and tannins, which are all essential in reducing oxida… https://t.co/Klsr5Jmgm0",kollaJell,"Temecula, California",0.20000000000000004
160,"talking with hellz is a disease because we call cooking ""malewifing"" and now its become an unfortunate part of my vocabulary",therapytlbot,,-0.5
161,@JayneOnEarth @Theholisticpsyc Not if addiction is a true disease that you have no power over.,CarolynS4121420,USA,0.35
