,tweets,user,location,polarity
0,@littlelordpmd I HAVE A LIFE THREATENING DISEASE AND THE ONLY CURE IS JEREMY STRONG’S DICK IN MY MOUTH,teshigaharas,she,0.21666666666666665
1,@ulirs3 Attempts are made to inject this disease 🦠 of creating states based on religion in pluralistic Jammu. We re… https://t.co/MjpXjt4tRI,nsb1080,Jammu & Kashmir,0.0
2,"Bestselling author Dr. Mark Hyman presents the definitive guide to reversing disease, easing pain, and living young… https://t.co/RfeJeG87RL",bookclub022,,0.1
3,"Healthiest men  in earth  are living in Ethiopian salt mines,, least Cancer affected people are Pakistani hill trib… https://t.co/mDxdfi4sfk",Hillman75552931,,-0.3
4,"@DataSaves_Lives Also, if you are in the UK, also talk to the National Congenital Abnormality and Rare Disease Regi… https://t.co/VCE72aYHPh",inpdr_registry,,0.3
5,"👏Superb review! 👇
#hematología #hematology 
How I manage mantle cell lymphoma: indolent versus aggressive disease https://t.co/6IT88Zn6Xz",HematoPedro,Binéfar/Barbastro/Zaragoza,1.0
6,"BE-STEM's Mock Quals Prep and Research Seminars are back! Please join us Tuesday, March 7th at 1pm to support Reube… https://t.co/X1V1l0L8c4",BESTEM_UCSF,"San Francisco, CA",0.0
7,"Blount's disease is a deformity in the legs, mostly from the knees to the ankles.",BowLegsCorrect,,0.5
8,The new efficacy research shared Monday at CROI builds on previously released findings that in recent years have fu… https://t.co/ULcrvGqc2z,HIVptn,In more than 15 countries,-0.010101010101010102
9,"@SharylAttkisson tRump made 'deliberate efforts' to undermine Covid response
tRump repeatedly overruled public heal… https://t.co/5SzTQElZ2w",KoonsKarl,,0.0
10,"Given a chance to apologize for the theft of a Black man’s heart, Virginia House Republicans declined… https://t.co/fMHO5tJTAN",pjschneid73,"Virginia Beach, VA",-0.16666666666666666
11,3. Eggs are high in protein and help increase high-density lipoprotein (HDL) levels – or “good” cholesterol as it's… https://t.co/CqYEI1ltXT,FitnFueledPH,,0.34
12,"February is Cancer Prevention Month. Did you know that healthy lifestyle habits, like regular exercise and a balanc… https://t.co/uTPmdpZZbK",Tower_PS,"Oak Brook, IL",0.25
13,$PCVX 📰 Vaxcyte Announces FDA Clearance of Investigational New Drug Application for VAX-24 for the Prevention of In… https://t.co/svWGYp8JRG,quantisnow,,0.13636363636363635
14,life get worse when you find disease within you but can't find cure,HickIqs,,-0.4
15,"@UneditedView @MichaelPSenger What was lied about? To get natural immunity, you have to actually get the disease an… https://t.co/K9dTDPNIcN",OfficialFlintLW,Your mum’s place (heehee),0.05
16,"@REMASCULATE Masking x 3 yrs, took an experimental drug that didn’t prevent disease, then takes another experimenta… https://t.co/qkEqxPA53K",Markerz00,Arizona Bay,0.1
17,Was on Wikipedia at 5:30 this morning reading the list of notable people who have had Bright’s disease,JLanny8771,"Pittsburgh, PA",0.6000000000000001
18,@VenomWrld999 it's a disease...,neonxra,日本語 / eng • 20,0.0
19,"Trio Healthcare facilities deliver personalized care for individuals living with heart disease. 

To find a facilit… https://t.co/Ady42PnzKc",triohealthrehab,VA,0.0
20,"tRump made 'deliberate efforts' to undermine Covid response
tRump repeatedly overruled public health and testing gu… https://t.co/QJ7yKVrgYc",KoonsKarl,,0.0
21,"We’re excited to sponsor and attend the 2023 @FabryOrg Expert Fabry Conference this weekend to reconnect, hear stor… https://t.co/SsleItg921",AssistanceFund,"Headquartered in Orlando, FL",0.375
22,Denis is living with motor neurone disease. He speaks today about his own journey. He stresses that having access t… https://t.co/4shoeAVNdW,naiireland,"Dublin City, Ireland",0.6
23,"Q: What common conditions can we help with?
A: Functional Medicine can be used to treat a wide variety of chronic c… https://t.co/Wc0GfaBmvE",VitalityHealt13,"Portage, MI",-0.2
24,"Developing a biomarker that can accurately diagnose the earliest stages of Alzheimer’s.

This grand challenge is th… https://t.co/aKpoImtLvq",UCLBrainScience,London,0.45000000000000007
25,$PCVX Vaxcyte Announces FDA Clearance of Investigational New Drug Application for VAX-24 for the Prevention of Inva… https://t.co/TzG3PTOmkW,stock_titan,,0.13636363636363635
26,(2/3) .. risk for breakthrough infection with the Delta variant compared to those previously infected. The increase… https://t.co/xaLv4rslq0,papers_bar,,-0.16666666666666666
27,"While many women focus on little candy hearts with cute sayings printed on them, or large heart-shaped boxes filled… https://t.co/4BjLlRSHol",TahlequahTDP,"Tahlequah, Oklahoma U.S.A.",0.28535714285714286
28,@maria_drutska He’s either going to succumb to disease or have the dictator’s suite at the Hague…. My sense is that… https://t.co/TVKGlluMD5,RichStockand,Nevada,0.0
29,Check out our blog about the impact of Alzheimer's Disease on African Americans. https://t.co/RUiKawtolL https://t.co/Vinx9Ejv7R,CarmensLegacy,"Salado, TX",0.0
30,Heart disease is the #1 killer of American women. Watch these powerful stories of four women who have had heart att… https://t.co/GnxEwY2yrD,CarolineCoHD,"Denton, Maryland",0.15
31,February is American #HeartMonth! Join CDC this month in raising awareness about cardiovascular disease (CVD) preve… https://t.co/6jIoGJixIq,NYSOMS1,,0.0
32,"The Centers for Disease Control (CDC) on Tuesday announced the first monkeypox case this year, detected in a male R… https://t.co/WWzL2VJOap",Focus_Taiwan,Central News Agency (CNA),0.125
33,"Thank You Sindh Gvt for the last 7 years, NICVD has been acting as the frontline, force fighting against the rise o… https://t.co/UwJiu4AseQ",fahadshah76,"کراچی, پاکستان",0.0
34,Would You Hand Out Firearms in an Insane Asylum? | Nature's Real Health https://t.co/iFefBwEHsI,nicktompan,"Virginia Beach, Virginia",-0.4
35,Our Microbiota &amp; Parkinson’s Disease | Nature's Real Health https://t.co/N9WrWECRTV,nicktompan,"Virginia Beach, Virginia",0.2
36,"@RepMTG tRump made 'deliberate efforts' to undermine Covid response
tRump repeatedly overruled public health and te… https://t.co/Yszn2Om0BV",KoonsKarl,,0.0
37,Merck says late-stage trial for COVID pill failed in disease prevention https://t.co/mqTE5VHUGI via SeekingAlpha #news #SeekingAlpha,JacekWierzbicki,,-0.4
38,"A SEVERE INFLUENZA CAN AFFECT THE HEART❤️
Complications of heart disease and #cardiac thrombosis is more common in… https://t.co/XCh2Qo6wwk",DCAcademyDK,Denmark,0.1
39,2. Wheat is rich in dietary fiber that can help improve blood cholesterol levels and lower your risk of heart disease.,FitnFueledPH,,0.375
40,"@maulaalias What they call a “vaccine” is poorly-tested, poorly understood experimental treatment, and the side-eff… https://t.co/btyEYhgu6L",Oregon_Grom,"Portland, OR",-0.23333333333333336
41,A leading Australian doctor has said that restrictions on outdoor activity at the height of the Covid pandemic were… https://t.co/309HgSX1t3,margmopp,,0.0
42,"UGA Study: Fewer people are dying from heart disease, with a notable exception. https://t.co/tfQYNrDL3K",TheGeorgiaSun,"Georgia, USA",0.5
43,"The world is beautiful, but has a disease called man

2YRS ELOQUENT WINNER RUBINA",ManageIshu,𝒻𝓇ℴ𝓂 𝓎ℴ𝓊𝓇 ♥︎   🇱🇰,0.85
44,@spasskultur Contracted a disease after 5 shots to prevent said disease? The shots are clearly working,KimKarlstein,"England, UK",0.10000000000000002
45,"@Our_DA The core issue the country has is overpopulation.
Loadshedding, unemployment, crime etc are all just symptoms of the disease.",AlbertTheBrain1,Johannesburg ,0.0
46,@rowanheartless tik tok is a disease,iheartmusic0188,♪♡,0.0
47,@davebro__ heart broken ..damn ..its a contagious disease ....most have had or will get it,SmileAllthetim4,,0.04999999999999999
48,The US’ inability to address its “chronic disease” of gun violence lays bare the country’s declining governance cap… https://t.co/SL9b0FDTLx,globaltimesnews,"Beijing, China",0.05
49,"Thank You Sindh Gvt for the last 7 years, NICVD has been acting as the frontline, force fighting against the rise o… https://t.co/eEKS9zca46",Waqasfarooqui11,"Karachi, Pakistan",0.0
50,@NoContextBrits Heart disease,KeystoneArtUK,Scotland 🏴󠁧󠁢󠁳󠁣󠁴󠁿,0.0
51,@Chicklette8 @KristinaDilore1 @MariaHo21759976 @SmashMemez @jeanne31923250 @EdKrassen Dems even changed the definit… https://t.co/jdRh92Zwg7,KocorRay,,0.0
52,So despite being a Z-List celebrity only known for doing cheesy sketches once a week on tv he is aparently in const… https://t.co/uJ0AhejKs5,MYSHELL70105246,,-0.25
53,"@CAHWisco @mjeslfc @MattWalshBlog Again, you're comparing treatment for a potentially fatal disease to something we… https://t.co/T4o8r4o2dw",HaydenHewitt,Republic of Manchester,0.0
54,@smilemmaa It's not a gender-specific disease 😣,dotnagpur,MH DL KA,0.0
55,"Justin O. Schmidt, the adventurous entomologist behind the famous ""Schmidt sting index"" ranking the stings of diffe… https://t.co/mVl0NeIn1X",neville_park,Toronto,0.19999999999999998
56,"@wallacemick You have a disease, Wallace. Treat yourself and take your buddy Claire with you. https://t.co/rAvzgGlIJf",Ped_Firestarter,"Sintra, Portugal",0.0
57,"Hell, RNs should know these infectious disease and immunology fundamentals too. Infectious disease countermeasures… https://t.co/eDJgOixpxv",craigbob99,United States,0.0
58,"Purchase your tickets now for Parkinson Association of Alabama's annual Taste For A Cure, April 27th at the B&amp;A War… https://t.co/4Olj7TcFDZ",Executi77249743,,0.0
59,"@Sthanu5 The answer  is Lyne disease 
Periocular:risk factors are 
: Female sexAge &gt;40 years eczema Asthma
    Peri… https://t.co/wv5wOUmt31",garand_f,"Saint-Jérôme, Québec",0.0
60,@dr_cottrell And some will get to 70 and die of an unrelated disease. Get a grip.,tractorbadger,Middlesborough,0.0
61,"@RobynMHollister Math checks out, I've been called a disease",seer_subsequent,The Land of Snow and Sorrow,0.0
62,Sickness and disease hang around in anger and depression so today I chose to be happy!,sleepiaga_,,0.050000000000000044
63,@mind_marvelous 1. Endocarditis from dental infections is usually only a big risk if you have pre-existing valvular… https://t.co/VwnfQl9Ipn,zoonotic1,,0.0
64,Right. Boo still not eating but they had enough blood to run further tests and she has no pancreatitis. So it’s lik… https://t.co/A3tvydDTy1,missy_molly_mol,,0.09523809523809523
65,@AnyafromSaintP clout chasing is a disease.,burner_primary,,0.0
66,No greater feeling than hearing your oncologist say the words 'no evidence of disease'... 3 lovely jubbly months un… https://t.co/1Mqqw4LLSO,smiffy_69,"North West, England",0.125
67,Starting Today Off with KINGS DISEASE.....  Gotta prep for Friday😂😂🙌🏾💪🏾 #MSG #NasirJones #Car85 https://t.co/iiSzFGiM2A,JustBeing_Craig,United States,0.0
68,Many rosacea sufferers report that elimination of triggers has little or no eventual impact on the actual progression of the disease.,RosaceaRemedy,,0.10416666666666667
69,"Based on World Health Organization, the top 3 leading causes of death worldwide are: 
1. Ischaemic heart disease, 2… https://t.co/YkCVCWmTgG",FitnFueledPH,,0.5
70,Mad Cow Disease https://t.co/wjMBopedlK,Emiliofracchia1,"San José del Cabo, BCS, MX",-0.37916666666666665
71,John Hudson’s Fight for Survival (Living with a Progressive Disease Whil... https://t.co/xe7xOdJvP0 via @YouTube he… https://t.co/I3u74SyaE9,offlinebychoice,🌌,0.0
72,The Omicron wave data is exactly in line with what you would expect if: an intrinsically less virulent variant is a… https://t.co/AXjAtoTA0g,BrianRWasik,"Ithaca, NY, USA",0.04166666666666667
73,@SeddighEllie My thoughts exactly too they had no right to compare a stroke or mild heart attack to another's chron… https://t.co/bq3RCqVJUK,LadyLindaMarie1,,0.14682539682539683
74,“pink blooded” sounds like a radioactive disease https://t.co/y6gIVvSxOi,93cyberstar,❀ 17 | black | locked = 💤,-0.1
75,"...and hugely important it is too. Used for crop health, disease detection, and yield predictions. https://t.co/xifmuAvH9C",pavsmith,Great Cathedral of Chalesm,0.4
76,@OMAEKEHELEN @talk2veee And if it leads to Chronic Kidney Disease nko?,Ada_ego1,"Abia, Nigeria",0.0
77,"Wear blue on March 3; tell your friends &amp; family why.

March is National Colon Cancer Awareness Month and Fri., Mar… https://t.co/dQTsGz9g45",KyCancerProgram,"Louisville, Kentucky, USA",0.0
78,"@mind_marvelous Ok, so not a physician and this isn’t medical advice, but as a vet who treats lots of nasty periodo… https://t.co/RlaH1nNz6r",zoonotic1,,-0.16666666666666666
79,@drscottjensen Woke is a disease.,Naptwn7777,Your moms,0.0
80,@kbgadhvi I would say it depends on the stage of disease progression. Check out some podcasts with @DrDaleBredesen or read his book,KetoCounselor,USA,0.0
81,Do Repeat COVID Infections Increase the Risk of Severe Disease or Long COVID? https://t.co/fs5k3Y6ZCs via @sciam,Eloy_Sauvan,"Germany, France",-0.05
82,You can reverse fatty liver disease in a week with proper diet. Eat a low-carb diet for a week and poof. Fat gone.,DoctorAnarchist,"Florida, USA",-0.06666666666666667
83,@mumwhocares @JeremyVineOn5 They should all be free?! It’s not a competition to see who’s got the deadliest disease or condition.,TheWitchesCatX,,0.4
84,"The answer is C, ibrutinib (Imbruvica). The Bruton Tyrosine Kinase (BTK) inhibitor (antineoplastic) is indicated fo… https://t.co/tbPO4aOiyE",PhunQuiz,United States,0.0
85,"Good morning. Here is your Dose. Which lists refractory graft vs. host disease as an indication?

A. Ibalizumab
B.… https://t.co/aF1cTthhov",PhunQuiz,United States,0.7
86,"@shava23 I am so sorry i was so tired and a little, irritable last night. Sigh, this weather is not my friend and w… https://t.co/nyrFVgNfgB",MariThomas88,"Maryland, USA",-0.271875
87,hoes DO NOT want me ever i am very gross and strange and possibly a disease carrier so like i can dream all i want… https://t.co/1AtNU1x0Dx,swegsawse,follow 4 a free juicebox!! :D ,-0.016666666666666666
88,"@badmantoo @Jaayshugah @GbengaWemimo 😊
If I actually answer you with the right words that you need and deserve you… https://t.co/cl91svD7EN",Toluwanicity,"Ijoko, Nigeria",0.14285714285714285
89,@Kimuzi_ entitlement should be classified as a disease bana🤣🤣,djtintinkenya,"Nairobi, Kenya",0.0
90,❤️ disease is the number 1 killer of women and number 2 killer in black community.,ukiah_1,,-0.16666666666666666
91,@yuplateformeyu and judging from their recent posts absolutely no sign of snow-skin (a fatal disease that claims th… https://t.co/XnT0ZkeWrL,jie_yuzu,˚॰°ₒ৹๐,-0.05
92,We witness enough trauma like death and disease. We don’t need added hardships.,pochahontus3y3z,,0.0
93,"Rare exception to this is Micron, which is located in Idaho of all places. Goes to show you need to be away from th… https://t.co/pfMz4f86il",_moldbridge_,,0.3
94,@GhettoGriot @BobKnezevic @erichhartmann @AriMelber It cant reduce infection. It can reduce harm or disease for som… https://t.co/e0vP3rHmqC,Higgidec,Devon,0.0
95,The Ontario effort caught lightning in a bottle -it went viral:​The Centers for Disease Control in the United State… https://t.co/4JcmZfOAho,Dalio4President,,0.0
96,@TalatHussain12 @TalatHussain12 you have a disease as a result of which none of your tweets can go without a mentio… https://t.co/wzt1OzWvUB,Haider__Mahmud,پاکستان,0.0
97,the omg disease is real™ 😞,sseukamoto,this is also the owner of:,0.2
98,@TNjhd Because they don't want to catch the disease of out-of-control Liberal Bias from the co-hosts.,theRealJZsag,Sarasota/Siesta Key,0.0
99,"@rounak_joshi @porinju Itna pyar hai to ghar me paal le na 50 kutte? In addition to being a menace, this kind they… https://t.co/MYGZLXxZ1m",iammdeepak,"Atlanta, GA",0.6
100,"I just now found out what the term ""Chronic Wasting Disease"" is. Previously, I assumed  it was used to describe a t… https://t.co/pm1nM2gBnv",SlimSmith5,"Moss Point, MS",-0.16666666666666666
101,@dayosawyerr @DOlusegun Obidense is a disease. Damn,balogin,"Abuja,Nigeria.",0.0
102,@xx_che_xx So someone with a disease who is dealt with this for years would know exactly what would happen if they… https://t.co/TWLra4c86T,GoldenGGeeks,No Where Land,0.25
103,"Rare neurological condition discovered, connected to mutations of ATG4D gene &gt;&gt; https://t.co/rfHuZ051Fe",Biorasi,Florida,0.3
104,@OhsakaRin No it doesn’t. I feel like I have been amputated. My life (and the quality of it) has gone downhill ever… https://t.co/iQpGSgRKfU,Maedi_Visna,"York, England",0.0
105,Sociodemographic Profile Associated with Congenital Heart Disease among Infants Less than 1 Year Old - https://t.co/NFPAumNXLo,Dataemia,United States,-0.033333333333333326
106,@JulieViolet2 @ChrisAlvino America is now the country equivalent of a disease incubator. Not sure why other countri… https://t.co/RJgdcDzmeX,TheNergalCorp,,-0.1875
107,"Education is key when it comes to this disease. 
Here are your programs &amp; classes for the week.
Register at… https://t.co/BxZJuarDmb",alzct,"Southington, CT",0.0
108,@DaviMaree @Haylesurfer @KatieHorneshaw @GeezerBunker Some tactics never lead to health. Our Western medical system… https://t.co/A1q384EaqV,cryptodiaries,Decentralife,0.0
109,"@xx_che_xx Yeah, I’m sorry I should’ve finished that. She had an auto immune disease and that’s what she look like… https://t.co/5SHo74UZQ4",GoldenGGeeks,No Where Land,-0.5
110,Association of Acute Kidney Injury and Cardiovascular Disease Following Percutaneous Coronary Intervention: Assessm… https://t.co/zKz4SwRr1M,BlumFamilyFdtn,"Avon, OH",0.3
111,"[spelunking] and and incurable disease, which sticks to the gods. No
؟?
نمشے

🔹W77🔹
🔹W77🔹
🔹W77🔹",ciciet_cuiet,,-0.5
112,@CTIronman @JustinCaseNOB @ChrisMurphyCT Or maybe you see a politician who is consistent. And needle exchange progr… https://t.co/9Wg1nwWTjN,slay1215,,0.25
113,@_BanarasiMedicO Congestive Cardiac Disease 🫰,PrasenjitDas3o9,,-0.05
114,"@Otto_English Tomato scarcity in UK is definitely about Brexit, because Morocco became biggest source after leaving… https://t.co/f4cWfWHLsQ",localnotail,"Birmingham, Europe, Earth",0.0
115,the disease is in my head https://t.co/WiJQz9VDGn,xenalaveda,,0.0
116,Speaking to my hematologist last week about #EHE and Covid and the similarities.  Both are vascular diseases and bo… https://t.co/ayFA8Q3HhL,fionaross15,"ON, Canada",0.0
117,"@ravivij  Discussing with Adriana Rossi MD on Measurable Residual Disease (MRD) at #MCH
Join Us And Get Full Access… https://t.co/WukHj7wUts",My_Cancer_Haven,United States,0.35
118,"@GhettoGriot @erichhartmann @AriMelber That is the whole bloody point. We know the probability, who is likely affec… https://t.co/EeiVivn3Kl",Higgidec,Devon,-0.20000000000000004
119,"BPD is not a ""mental"" ilness
its a fucking disease

its normal to be hesitant / warry of others

but because of my… https://t.co/4CQWFaurhO",HighGeneral1,,0.1
120,"✿ oat milk is a dairy free, plant based milk drink, so good for those with intolerances. it is high in B group vita… https://t.co/t6RBDgNAUi",expiredmoth,fully committing 09/02/23,0.42
121,"@BarredinDC I have celiac disease, so I need to speak to an actual person before ordering. I would not feel comfort… https://t.co/5Lpkezdn4V",CarolSOtt,"Baltimore, MD",0.0
122,"Your attention-seeking is almost a disease at this point, but I guess I'm the one who just can't leave you alone.",ritsumao_bot,@tsukaizu,0.0
123,"$AKBA (-9.1% pre) Akebia slips as FDA issues second response on appeal for kidney disease therapy - SA

https://t.co/D3oG9335Ls",OpenOutcrier,"Chicago, IL & Austin, Tx",0.0
124,@HPlaysPiano Oh the joys of Menieres Disease... Hope it passes soon,jmbailey27,"Bury St Edmunds, England",0.0
125,and many were healed of their spiritual disease as well as of their physical maladies. The gospel still possesses t… https://t.co/D4goOa8kNj,ViraArmstrong,,0.16666666666666666
126,He turned away none who came to receive His healing power. He knew that those who petitioned Him for help had broug… https://t.co/6Ken9RMp5f,ViraArmstrong,,0.0
127,"@ApplauseSv @ChrisAlvino My close friends don't mask either, and I'm unable to get them to. So it's either a hermit… https://t.co/lu5qpaheYr",TheNergalCorp,,-0.5
128,"@Reservoirdogz76 @LogicalMD33 Lol. Listen to this 
""Conflict of interest statement

Competing interestsM.J.S., C.W.… https://t.co/y4GMMvNPOz",Dana25417963,"Olympia, Washington",0.8
129,@chroniclykat I’m sorry for your loss. Today is the 4 year anniversary of my only brother passing away from cancer.… https://t.co/oY3waHtvzf,HobsonWanda,Atlana Suburbs,-0.25
130,"@Our_DA @diontgeorge Too late, the ANC disease has spread.",wpbefokmanufan,,-0.3
131,"Thank You Sindh Gvt for the last 7 years, NICVD has been acting as the frontline, force fighting against the rise o… https://t.co/BvE5SY6ipc",Kimbery01276785,Karachi ,0.0
132,@instablog9ja Clout is a disease,omotayo_ace,Wakanda,0.0
133,It's #nationalchildrensdentalhealthmonth The Centers for Disease Control #CDC have an awesome kids resource page wi… https://t.co/zArxoqRIkP,gowasackdds,"Conyers, Georgia 30094",1.0
134,@no_stunts @scanpaths Best part of it is he canonically dies of heart disease in the show,elf_hole,,1.0
135,@KenWinsor4 @DanaMetcalfe5 I think this is a standard of how they count pandemic deaths.  A remnant from the days w… https://t.co/9u96MZKGsE,MorganBalanaser,"Ottawa ON, Canada",0.0
136,"@nvsmd @JedediahBila Everybody who paid attention to the data and not the media knew from VERY early on that:

Natu… https://t.co/t02UAd6fa9",EdwardScherer10,,0.13
137,@Sir_Farticus @nypost As I face symptoms of a neurological disease I regret the two coerced jabs of Fizer every day,ronswainy61,"London, Ontario",0.0
138,"New research aims to understand why women more likely to develop Alzheimer's disease
https://t.co/9MYdCxXq6r",tasnnette,United States,0.21212121212121213
139,Last Paper syndrome disease sab ho raha hai,amnaaa_Javed,,0.0
140,@johnsgunn Vaccine mandates are effective and based on solid evidence. Get vaccinated and don't catch the disease a… https://t.co/0c5g8AO68f,DWhelbourn,"New Brunswick, Canada",0.3
141,@gorotolu Maybe the designer has Parkinson's disease.🤦‍♀️,Valeria112311,,0.0
142,"@el_dentisto Ah, the healing forceps. That’s one way to get rid of periodontal disease!",wetherbyortho,"Wetherby, West Yorkshire, UK",0.0
143,@LouieDi13 Rubbish! Samething would be used by someone else again… na wa o/ how disease no go full everywhere,kolawoleayotund,Nigeria,0.35
144,@stateworship @TobyTurner It could be a slow death with a long period before disease manifests,headasshoncho,,-0.17500000000000002
145,"@kumar82sivesh @malpani That's awful. Sycophancy is the biggest disease in India, sad but true.",tusharUSC,Pune,-0.3833333333333333
146,"&gt;&gt; Give them your solution to their Headache, stomach pain, Skin disease or Learning Copywriting, Marketing and sal… https://t.co/HHY1v9eIzN",Tejiri_Festus,"Abuja, Nigeria",0.0
147,"You must understand that people have problems that seeks for SOLUTION

Some people needs to know how to cure their… https://t.co/JpL7wXG2DI",Tejiri_Festus,"Abuja, Nigeria",0.0
148,"@Konesjk The move is welcomed ,But how will those Infected with the Terminal disease be compensated ! Especially th… https://t.co/jo6RvCFpsi",SKosgy,"Nairobi, Kenya",0.0
149,"Thank You Sindh Gvt for the last 7 years, NICVD has been acting as the frontline, force fighting against the rise o… https://t.co/Uv1aPghKQS",Khan_Arsalan1,,0.0
150,@naomee_naomi @Sirodue1 @dayoisrael Bigotry is a disease. You're sick and need help.,prince_of_nimo,"Toronto, Ontario",-0.7142857142857143
151,@StevenBeschloss Giving the public information is now a danger to free society? Liberalism is a soul rotting disease.,keithmi22371653,,0.2
152,"@BohemianAtmosp1 I think it’s called W-H-O-R-I-N-G one’s self out, a common progressive disease of the soul!",PietroAntoni2,United States,-0.3
153,one of my co-assistant today has been struggling w her rare autoimmune disease n i was near teared up hearing her c… https://t.co/s1gRw4je6a,jiwonieyo,Indonesia,0.2
154,@kevinnbass No group can claim an equivalent number of success stories with regards to eliminating metabolic diseas… https://t.co/TLYOh4bQTc,raefneerg,,0.3
155,"@brodjustice The vaccine manufacturers did…. 

https://t.co/wz3ubLgMWQ https://t.co/RBsnVQNV1e",TheRustler83,"Aberdeen, Scotland",0.0
156,"""These syndromes are defined by excessive fatigue, which worsens after exertion, and include cognitive impairment o… https://t.co/9sZysanrra",Dakota_150,,-0.25
157,Action is needed in low- and middle-income countries to ensure that the benefits are felt equally around the world. https://t.co/DUKh0reAzK,JoeHillman5,"Overland Park, KS",0.025
158,"Thank You Sindh Gvt for the last 7 years, NICVD has been acting as the frontline, force fighting against the rise o… https://t.co/YVEca3uqGL",BilalHameedKhi,,0.0
159,@FNez_Blogger What makes me sick to my stomach is all those people that have this horrible disease &amp; could possibly… https://t.co/D5BIq0FKqD,TeresaS48252080,,-0.5714285714285715
160,"More than 800,000 people in the U.S. die from cardiovascular disease each year. About 160,000 of those deaths occur… https://t.co/3DMxMHdjbU",wdam,"Hattiesburg, MS",0.5
161,@harryjsisson Two criminal grifters who want World War III. People like you are a disease.,LarryKutcher_,"Los Angeles, CA",-0.4
162,"Adored, but and incurable disease.",myraachinny,,-0.5
163,I know what you are You are everything wrong that the world has to offer You are the amalgamation of all the glutto… https://t.co/eA07VTjZtQ,Bl00DYL0VE_,pfp by @jdhikdjdkfiwufh,-0.5
