,tweets,user,location,polarity
649,@azcentral Narrator: Don't nominate a disease in human form and be surprised when they lose the general election.,jumpinmpduke,,0.05000000000000001
650,🚨Diabetics are to be offered a daily pill that slashes their risk of developing life-threatening kidney and heart c… https://t.co/gz8YAMHx9F,EnnalsEthan,,0.0
651,the most dangerous heart disease: strong memory,gayboybot,,0.1111111111111111
652,@JamesHu29812484 @Teddysmom1 Republicans who are anti-vaxxers should pay heed to what happened to this person who r… https://t.co/rwmSFoHbyS,Dushan41,,0.0
653,Not my argonian ass being 50% resistant to disease 😂,fshglpr,SOUL CAIRN,0.0
654,The prevalence of pancreatic neuroendocrine tumor is rising daily. Listen to the causes and increase the awareness.… https://t.co/Uo2cB3ry0e,Dr_SwagatDash,"Faridabad, India",0.0
655,@Slpmom4Tracy @kdurquiza @MarkedByCovid It’s been happening for years and years (since before we got married)! We’v… https://t.co/0ZYYt4PtB0,Drenched_Novel,,0.25
656,I am Joe and my wife has Mad Cow disease. Bozo!,JoeBotLikes,Hell,-0.37916666666666665
657,"@Tates1984 @MaryDon51210301 @JamieSale Of course, I do. But the symptoms will be lessened and the time you are sick… https://t.co/kZYHAHirol",AmandaCaresAlot,"Toronto, Ontario",-0.7142857142857143
658,"What began as a little fundraiser in many years past, has now grown into an annual event to benefit local women who… https://t.co/b5M67u6v6f",plum_cheer,"Pittsburgh, PA",0.015625
659,"@simpgenocide It tasted like hose water. I always wonder what wonderful disease I picked up from it, waiting to spring forth at any moment.",FrankIreman,Idaho,1.0
660,"@JebadiahThomas @Dana25417963 @DiamondandSilk It’s a disease.
🤣🤣",troypallotto,"Ohio, USA",0.0
661,Does anyone have some good product recommendations for dark circles? Mine are so bad because of my disease and it’s… https://t.co/BTSZPORsYb,lisazara__,PORTFOLIO : ,-0.04999999999999997
662,Full Netanyahu: Antisemitism is the 'oldest disease' https://t.co/iKHbJvEk2N via @nbcnews,TomFlowers,"Neptune Beach, Florida, USA",0.35
663,"@DawnKikong @babsy1234 @GalvaniseEdu @MissMaddi_NL @celtic_won @Sandyboots2020 Also, I mean just think about it. Wh… https://t.co/yCPbTJQKKf",naoculton,United States ,-0.3125
664,@Guzmani54422771 @leonardocarella You don’t think calling a group of people a disease is a tiny bit fascist ?,k1482,Ocean City UK,0.0
665,"@tedcruz Or maybe we could just all act like adults and do our part to halt the spread of disease? 

But no, becaus… https://t.co/RhsMMpyeNb",BadAtPeopling,Next to Waldo.,0.0
666,"@POTUS The vaccine does not prevent contacting or transmission of Covid.

The vaccines kill more people than the disease",big_coffinhunt,,0.5
667,@POTUS How about holding those responsible for creating this disease and unleashing it into population.,RonSylvia3,,0.2
668,"@POTUS Vaccines don’t do shit anymore, thanks to your pro-death policies the virus has mutated &amp; spread so much tha… https://t.co/jRsFAv3EsX",marquess_desist,من النهر إلى البحر,0.2
669,"Communicable Disease Public Health Nurse (CDPHN) in
 
 Delta, British Columbia
https://t.co/TGPM4jPyHJ",CanadaVacancies,Canada,0.0
670,@CGL0WDUO @sillytubbo my son he has every disease,boboolvr,it/he 17,0.0
671,"#15ElectronicLPs Day 3 - Catching up!

Skinny Puppy - VIVIsect VI (1998)

From my years-long, post-goth, Industrial… https://t.co/HNLJfsCEvb",richy1311,"Maidenhead, UK.",0.27499999999999997
672,@Model_Shanti People who are cancers or the disease,EricMadere,Mississippi,0.0
673,"Your dreams. a goldfish named Fish, have never asked for and the disease in
؟?
نمشے

🔹H4🔹
🔹H4🔹
🔹H4🔹",TEHREEMMUSTUFA,,0.0
674,"@POTUS You are talking about a ""Liberal"" trend of ""acknowledging that some people are NOT like the others...Liberal… https://t.co/dxur4MX2iS",MartyFowler20,,0.0
675,@sniffydogs @WestJournalism Trash brings disease and creates a toxic environment.  Doesn't sound healthy to me.,CathySimms4,United States,0.45
676,"At the 4th International Conference on AIDS conference in Stockholm in 1988, Dr. Robert Gallo proclaimed that based… https://t.co/ZlXMzRKQyL",KITNOCapital,"New York, NY",0.0
677,"good doc s6e5 lol what a 'discovery' 😅 not his daughter, hereditary disease. poor that girl",aandeff,,0.3666666666666667
678,@Guzmani54422771 @leonardocarella He has no point he’s an attention seeker . Anyone calling people a disease should be slapped down .,k1482,Ocean City UK,-0.15555555555555559
679,"Justice for Forrest, a defenceless dog victim of negligence (a leg broken, dental disease, bladder stones) Plz sign… https://t.co/59uXXFKyxx",soldier_777,,-0.23750000000000002
680,when I was in... middle school I think there was this mass panic among students exclusively about the spread of legionnaires disease,Tadaimari,,0.0
681,"@UZ4lR @p4r51v4L @imagineffour its peak, when if u didnt have so called thigh gap u were actually excluded by ur pe… https://t.co/CrEjHibduJ",lnfucking4,4,0.0
682,"@Abigeilgarcia I was about to jump on board but I can't handle spicy stuff.(Crohn's Disease) Who am I kidding, I'd try a bite!",OldschoolTye,"Harlan, KY",0.0
683,Researchers at Lund University and Karolinska Institute explored how microglia cells can be triggered to slow down… https://t.co/95irNGNHPf,GENbio,"New Rochelle, NY",-0.2277777777777778
684,@IU_Wakilii @RealTutsi They are suffering from mendula disease,drealhorllar,"Taraba, Nigeria",0.0
685,"Lyme Disease Is on The Rise, But There Might Be Hope in a New Vaccine #Malliard https://t.co/Cej5cgsEhX",extension13show,,0.13636363636363635
686,"@Sandyboots2020 One flaw in you analogy, your are almost assured you will suffer severe injury if you get into an a… https://t.co/DYINvCof5H",joeba,Connecticut,0.0
687,"Sabine Navarro, an adventurer looking for the key to cure Parkinson's disease https://t.co/bxawPokhUV",AndalusianNews,Andalucía,0.0
688,"@OneJoblessBoy Clout chasing is a disease,Wizkid fc small for your fave the biggest fanbase in Africa",biggestmanny,,-0.25
689,The values that apply to obesity treatment are noticeably different than treatment of other medical issues such as:… https://t.co/foP6VoLBzI,NeilFlochMD,Connecticut,-0.03125
690,"“We also shine a light on our Dignity #Health, YRMC providers who are doing great work helping people with diabetes… https://t.co/st7JMr3dmM",lotusFyre1,Youtube Promotion Service →,0.6000000000000001
691,There has been plenty of research to look into the after-effects of Covid vaccines on the heart. There has been no… https://t.co/TNmdbhKocc,DocVatsa,DNA,0.0
692,@MonicaGandhi9 @JAMA_current I think it has been a very hard time for many with so much disease and death. There ar… https://t.co/jq9z3azH1F,_TheAncientOne_,USA,0.10694444444444444
693,"@Guzmani54422771 @leonardocarella ""the left is a disease"" not abhorrent enough for ya?  
So the left who want equal… https://t.co/rx6ldtpTik",stiptop1,Hastings,0.06999999999999999
694,"@ISephara @TimesLIVE Lol as an aside, I'm one of many ppl who benefit from mastering Trauma skills in SA because yo… https://t.co/56A6bWd6Bt",Emancipatedbla2,,0.65
695,"Noise levels for Oakland Airport's neighbors can reach 80-90 decibels per plane, from 60+ planes a day.… https://t.co/ByPzwZiMoD",stopOAKexpansn,"Oakland, CA",0.0
696,"@EdenicJesus “Do I fear death? I do in fact fear death by disease. That’s why I pray for an honorable death, a deat… https://t.co/Mf3UU55WXd",NewSchwabenland,,0.0
697,@BrianACarney321 @brclothwrites Yes. Besides annoying they carry disease. No context. Mosquitoes,KCallahanH,,-0.8
698,@OurSacredGrove @Telegraph 'disease carrying'? What about the millions of pheasants strutting around my locked poul… https://t.co/e2n6Z7aVeM,Aeolianharpist,"England, United Kingdom",-0.3
699,"@Scott_Wiener Agree with making it fair, but you should have made them felonies rather than making them all misdeme… https://t.co/cH6GVLakkh",jiffyclock,Your mom's room.,0.7
700,"@lavern_spicer No, he needs our help🩺, not our votes 🗳 

https://t.co/AvfkpQbh19",BorisTheBleu,Earth,0.0
701,I'm your brand new disease,lyricdolls,TWEETS EVERY 10 MIN,0.13636363636363635
702,"Patrick Tambay has sadly died aged 73.

The Frenchman raced for McLaren and Ferrari and was a x2 race winner with 1… https://t.co/Yg0nCINmJj",TheF1Republic,UK,-0.3
703,@DrEliDavid But it's a moot point at this stage. Whether the virus was natural or escaped from a lab doesn't change… https://t.co/XJY0wBvROt,sinz54,"Lowell, MA",0.1
704,"A community of elites that protect itself, but want to make their money and so they encourage others to spread a di… https://t.co/s9zJYgHAG4",DAlter007,Earth,0.0
705,"@ArijitBishnu Clusters mean ONLY

Infection (virus) triggered genetic disease.",jayukids,Ahmedabad/Jetpur/Junagadh/Bhav,-0.15625
706,"More than 1 in 4 U.S. adults — 26 percent — have untreated dental cavities, according to oral health data gathered… https://t.co/azG3O3b1vH",washingtonpost,"Washington, DC",0.5
707,"@dabitch @beleno @sarahspoon No, I think you'll find that for many decades (and centuries), homosexuality in the we… https://t.co/35cqdUWpFI",hamid,"London, England",0.5
708,Dim Bachelor. He's done something horrible. Yet he managed to track the disease.,stakhbot,,-0.45
709,"@LisaMarieBoothe @Newsweek Good for you, you have that right. It’s your body. But I will tell you this, I now have… https://t.co/ljolfng56L",lisamaeglenn, Florida,0.4928571428571428
710,"This is not an attack on care home workers, it's the care home owners who are at fault, they are advised every year… https://t.co/T2TxNmR3yP",richardblogger,Plague Island,0.0
711,@kdurquiza @MarkedByCovid It’s really rude to ask people to prove they aren’t vectors of disease. There is no way I… https://t.co/CBgZSaCzKc,Thor77594174,,-0.3
712,"IJMS, Vol. 23, Pages 15310: Growth Hormone Improves Adipose Tissue Browning and Muscle Wasting in Mice with Chronic… https://t.co/wzHmbPVcvb",myjournals,,0.0
713,I see a big ol' plate of heart disease. https://t.co/SrM6ln3d3O,LeighWilder42,"Columbus, OH",0.0
714,"RIP Patrick Tambay. 😢 Rapid on his day, it seems he has lost his battle with Parkinson’s Disease. By all accounts,… https://t.co/lFCCgGKfEe",gaittman,"London, England",0.0
715,"A disease away from losing life’s #savings?
Even with #healthinsurance, an emergency can exceed the coverage amount… https://t.co/Xo5stPtjWB",PrudentlyInvest,"Pune, India",0.0
716,The U.S. Centers for Disease Control and Prevention (CDC) has quietly confirmed that at least 1.1 million Americans… https://t.co/9DowtkhxrI,Deadman47745432,,0.05000000000000002
717,"FREQUENCY is how we cure disease, NOT poisonous drugs!  God/Yahuah gave us the knowledge to cure ourselves. https://t.co/OtNWYsAvqd",SchumanKimm,"Iron River, Wisconsin",0.0
718,@bullfrog35 Using leeches to cure disease 🔥,flyybyme,,0.0
719,Americans are a disease to the world,zahraaosmaan,NOYB,0.0
720,"@libsoftiktok No Fatphobia is based in health.  Diabetes, hypertension, cardiovascular disease and joint problems a… https://t.co/1mV01NBvpi",LincYellowBelly,,0.0
721,"I can't decide on one of them until I get not only many information but also ''lots of time''. However, it's not en… https://t.co/WrGmUwtHMj",SatoshiParkin,,0.25
722,@Sliceduparms @gravitydenier @hasanthehun @adinross You just said you have it cause it’s sounds like a disease😂😂 yo… https://t.co/HlcgtzK8Cv,Michael35594162,,0.0
723,"@LlJuju2022 @dinksella I'm so sorry.

As someone with an autoimmune/chronic disease I've got off lightly - so far..… https://t.co/wxDsdRnEM7",AuspiciousTimes,,-0.2
724,"@donnaweisher @CalltoActivism Being an addict is actually a disease, much like having cancer -judgmental ,not “Chri… https://t.co/Fh5vEg3OGA",Polishkimber32,"Park City, UT",0.1
725,@ProfessorFerg06 Hancock’s pond slime. But to see him taking flak over his response to a fake disease is classic.,JohnOmay4,,-0.16666666666666669
726,"Who comments on my sisters photo saying ""your sister must be jealous"" ??
Oh yeah, a bothered stalker bitch. You're… https://t.co/grX41NQL0M",urfavvvalleygrl,"Las Vegas, NV",0.0
727,"Because straight blood donors stay faithful, always use condoms, never have anal sex, and don’t use intravenous dru… https://t.co/n2YSUrUseN",laffmytitsoff,,0.2
728,Methods for postnatal disease prevention : Results from a rapid qualitative thematic overview,yournextreview,,0.0
729,@hodgetwins Mental disease is sad to see,Shteef2,,-0.3
730,@AnandPanna1 Going out freely which provides an open entry of the disease to your weak body and thus people die and… https://t.co/pqIjB4LQff,Srishti46911976,,0.00833333333333334
731,Aging envisage imbalance of the periodontium: A keystone in oral disease and systemic health… https://t.co/uBgCvADrlU,_MCRicardo_,México City,0.0
732,@B52Malmet it's a fast-spreading disease and it's here in Canada. See also Doug Ford (Ontario) and Danielle Smith (Alberta),OhEwe,London Ontario Canada,0.2
733,"Doctor: Do you want to hear the good news or the bad news?
Patient: Good news please.
Doctor: we're naming a disease after you.",dadjoke123,,0.23333333333333336
734,"@Guzmani54422771 @leonardocarella Abhorrent replies to being labelled "" a disease"". 🤔

Who would credit it?

Not as… https://t.co/gBO7g3nQO5",ra_tigger,Huddersfield,-0.7
735,"@DoctorTro You forgot

-arthritis
-crohn's disease and ulcerative colitis 
-IBS
-spondylitis
-anxiety and depressio… https://t.co/JOM3lkBwuS",DolfDoofinsky,"Arizona, USA",0.0
736,"https://t.co/L1TejaU3Iu Artificial Intelligence Predicts Future Heart Disease, Stroke Death Risk Using Single X-Ray",LongevityTao,,-0.2238095238095238
737,"@stargazeruk7 Possible, how many other man made viruses have (escaped ) so they say and gotten into animals and evo… https://t.co/IonVqpI7dz",Farrelljf0275,United States North Carolina ,0.125
738,Coronary heart disease. https://t.co/pabL1gnKEm,jahughes3,Cambridgeshire,0.0
739,Researchers at @IcahnMountSinai suggest that those with a form of AMD are more likely to develop cardiovascular dis… https://t.co/IcV6uUOwDs,IcahnMountSinai,"New York, New York",0.25
740,"People who restrict their intake of good fatty foods do not lose weight or gain other health benefits. 

Wild salmo… https://t.co/KzqE0K8Xv4",OrganicLiveFood,US,0.11875
741,@Stuuu_0628 @TopGyalKeiko so now the ? Is how much more r the #s exaggerated Then Red Cross confirms most of deaths… https://t.co/6BRmu1EzQl,buddha_brute,,0.1
742,Replies to a post calling people on the left a disease and calls others who rightly call it out abhorrent umm disgu… https://t.co/nfLUppGjl6,leeadamson2009,,-0.13809523809523808
743,"As I look more closely at the DCVax paper, I wanted to share one finding that needs to be further discussed:

Large… https://t.co/8yd79sPN8z",shawnkothari,"Atlanta, GA",0.2380952380952381
744,@MBBSMDDM You have cherry picked one point to showcase your confirmation bias. Please read through all 3 to 4 paper… https://t.co/MiixQmgYKU,theliverdr,India,0.0
745,"December 4th, 2022

The life of God in me has supplanted the human life that was susceptible to sickness and diseas… https://t.co/Cjbrr9JkmQ",iam_danijoe2,Zion ,0.0
746,The woman in the Simons euthanasia ad is “the same woman who spoke to us in June about her struggles to find treatm… https://t.co/h8wHB8nAFT,yuanyi_z,Britannia major,0.0
747,"@jasonhu10530544 It's actually a disease industry, or perhaps another money laundering scheme.🤨",CharlotteRuse3,,0.0
748,Is Alzheimer’s disease terminal? How can I improve the life of a loved o... https://t.co/xZGcHrlK0E via @YouTube,passionate_llc,,0.7
749,@hodgetwins Days after covid hit the world reports from scientists from China of how this disease came to be were o… https://t.co/jAmmNjp2Jg,ArthurG9619,"Massachusetts, USA",0.0
750,"@NHSEngland @jk_rowling Take it from a person who treats this disease, HPV vaccination and Pap smears are wonderful… https://t.co/EDHlfLJOfy",CenterLeftHuma1,,1.0
751,"@69Anonymouss420 @KeyboardWIC @IOHK_Charles It’s just the trait with the finger!
I know ligma as a disease as well… https://t.co/q1kyNrT2tf",Tootalljones91,,0.0
752,Cluster analysis reveals distinct patterns of saccade impairment and their relation to cognitive profiles in Parkin… https://t.co/4fAj5HNJXX,TC_papers,,0.3
753,Pocket watching another man's money trying to debate and dictate how he should choose to feed his family is a sick disease,nateonthebeat,"Atlanta, GA",-0.7142857142857143
754,In those eras every Gay character was dying from AIDS or ultra fem that catches disease in a way so you don't care… https://t.co/a4pKFhjwL5,Gwen6930,Chicago Il,0.0
755,The #tabacco industry killed millions with the collusion of governments.  But noone is saying anything about the mi… https://t.co/oQ7mVpR6XU,jaimz33,,-0.2
756,Yea. I’m wearing mine. I got a autoimmune disease and be taking care of my granny. I ain’t fooling with these folks. https://t.co/TY0kBmEkf0,TeeAiraJuanita,"My house, MI ",0.0
757,Towards the emergence of a new form of the neurodegenerative Creutzfeldt-Jakob disease: Twenty six cases of CJD dec… https://t.co/f5SRBclfAE,wuebardo,,0.13636363636363635
758,@Earstohearyou It helped me a great deal with fighting Lyme disease.,klio1212,,0.8
759,"@AnnLesbyPhD other disease shall befall those who strain against nature, so clearly let the unicows, the multipeopl… https://t.co/9Js6drkAzU",danjoyls2k,,-0.01249999999999999
760,Human faeces and ‘disease-causing bacteria’ found at self check-outs | LiverpoolWorld https://t.co/IFGfJmXjJU,canuk2006,Canada,0.0
761,@JebraFaushay The best way to understand butt sex disease is to get inside someones butt.,beatthemback,,1.0
762,"@cutiedisorder its gotta be because of the rise of obese people these days, the more we normalise being fat the mor… https://t.co/orvZ79Lke2",bl3zkcalx,anywhere not here,0.5
763,Local Drug Delivery for Coronary Artery Disease: Established and Emerging Applications QJFB2JW… https://t.co/LG23AowpPN,PJacobsonckb,,0.0
764,Uncovering Chronic Inflammation &amp; Hidden Infections: The Untold Story Behind Chronic Disease Prevention &amp; Reversal… https://t.co/Y9N5GsTj6S,binsmfpxz,,-0.2833333333333333
765,Dr  Sebi Cure for All Disease Made Simple: The Total Guide on How to Effectively Cure and Treat All Diseases Throug… https://t.co/9rnKcp1IbA,walton60h,,0.19999999999999998
766,Effects of recombinant ovine interferon-tau on ovine lentivirus replication and progression of disease https://t.co/CCl4yfWMDu,GsaJournals,Albuquerque,0.0
767,If your child is on antibiotics understand the timeframes of contagiousness. Keep children home for 48 hours! Help… https://t.co/tlU5bkIgf3,TRiiCiiAKANTREL,"Cambridge, England",0.0
768,"Started in 1998, the day care program caters to adults with Alzheimer’s disease or other forms of dementia. https://t.co/lmbzQ26pGS",monroenews,"Monroe, Michigan",-0.125
769,"@MasayoshiIto10 If I get the money, it would free me from paying the rent and help me with my mother disease, going… https://t.co/2ny3C9Yi64",DaHellzZ,,0.4
770,@JeremyFarrar Considering it can take mnth’s for disease to arise b/c of misfolding &amp;the fact most ppl expect vax A… https://t.co/B2NdTMgr1C,s3n10el,,0.5
771,"Mental, neurological and substance use disorders make up 10% of the global burden of disease and 25.1% of non-fatal disease burden.",Sft2101,,-0.05
772,Chuck Todd has the worst case of TDS!! If President Trump sneezes in public the top story on Meet the Press would b… https://t.co/reFs7bHhdE,corgimom51,"South Carolina, USA",-0.16666666666666666
773,"@Artificial1313 Come out, immune cells! Use the disease elimination magic！！！",yuhanzh76616314,,0.5
774,@catturd2 Including releasing a disease to ruin the economy and usher in the great reset.,Psuforever_1980,"Naples, FL",0.8
775,"Parkinson's Disease Guide for the Newly Diagnosed: Understanding the Disease, Managing Your Symptoms, and Navigatin… https://t.co/hmwwvX3nBX",EdwardoMcCullo2,,0.13636363636363635
776,"Whatever you do in life never be poor 
Poverty is a disease 😑😑",bfreshoflagos07,"Lagos, Nigeria",-0.4
777,"Parkinson's Disease For Dummies 5OFOODD

https://t.co/PUTO3OTLDv https://t.co/i71iHdiWZp",torp49pkl,,0.0
778,"Autoimmune Hepatitis: Learn to Cure Yourself, Your Doctor Never Will! (Autoimmune Disease, Autoimmune Paleo Cookboo… https://t.co/94jeBjrgfW",Madie54P,,0.0
779,The 30-Day Heart Tune-Up: A Breakthrough Medical Plan to Prevent and Reverse Heart Disease 98FJENS… https://t.co/ammYmGcG81,JDietrichwww,,0.0
780,Researchers use AI model to predict a person's 10-year risk #ArtificialIntelligence via https://t.co/FkZqUURWcG https://t.co/rtSaIerM8Y,MedicaliPhone,USA - Midwest,0.0
781,"@ISephara @TimesLIVE Of course I told you I was a doctor, it's relevant to my anecdotal experience of the burden of… https://t.co/L9mLMOqFiO",Emancipatedbla2,,0.4
782,"It typically associated w/ other autoimmune conditions, such as Sjögren's syndrome, Hashimoto Thyroiditis, Sclerode… https://t.co/yI04ngRoGq",RosenelliEM,United States,-0.09722222222222221
783,@howisthis2022 @Sandyboots2020 Unfortunately people that wear the most seat belts - and yet drive the least - have… https://t.co/Vb3IW6jBAJ,invalid_search1,,-0.09999999999999999
784,@ungerbn103 Mad cow disease,ClarenceJHoover,CoSo,-0.37916666666666665
785,"Keto Diet: Your 30-Day Plan to Lose Weight, Balance Hormones, Boost Brain Health, and Reverse Disease LBFXOWA… https://t.co/MhBv14pLdK",germaine8ubh,,0.0
786,"@Elysee @EmmanuelMacron Macron: - Joe, do you know what is ""French kiss""?
Biden: - Yeah, of course.
Macron: - And d… https://t.co/lCaFywDuVb",ka_edr,,0.0
787,@RampCapitalLLC @FiSurgi No it’s not the *cost* of the test that’s the main problem. It’s the pre test probability… https://t.co/36duAgYJTm,ScottTruhlar,"Iowa City, Iowa",0.16666666666666666
788,Poverty and disease are fast flowing. The poor find it harder to survive everyday. But the youth of this country co… https://t.co/NcKTwUzW8y,RashidI08335424,,-0.125
789,"People, especially those with chronic illness, need more than just diagnosis and treatment (which may not be curati… https://t.co/vKKOWKaUEr",markcheongwl,Malaysia,0.25
790,@kamatish yes - most people stop flossing because they notice that they're bleeding. but actually the root cause of… https://t.co/TLlEscY3nq,ohkaaye,MNL,0.25
791,Bacteria and cancer have been there from the origin of life.  I believe cancer and wounds/infections are on either… https://t.co/5P3ly0C87C,woundphysician,"Georgia,USA",0.0
792,"Woke up, sad, from a dream that Willy Adames wasn't offered a long-term contract after being diagnosed with a degen… https://t.co/60EXrP5SZN",djenders,"Milwaukee, Wisconsin",-0.275
793,"@ScotlandSalmon @timesscotland Gill disease in fishmonger’s trimmings box though?
The way you handle “truth” is alw… https://t.co/c8BlKdGUTe",SalmonScotland,"Scotland, United Kingdom",0.0
794,Poverty and disease are fast flowing. The poor find it harder to survive everyday. But the youth of this country co… https://t.co/oIqU51LuiS,arshian00r,"Islamabad, Pakistan",-0.125
795,@ShaunaKnows @NBCNews Well listening to ur statements is tough…ur history is foggy…u still think the vaccine works… https://t.co/nd0oeK3jZ8,micampy,,-0.3888888888888889
796,"@Kenyans I think this could be a serious disease, how comes you win MP seats but you loose speakers position which… https://t.co/sTifKex1dX",OKAMPO12,,0.12991452991452992
797,@SKProFootball @AdamSchefter What does this even mean? He's struggling with an addiction to sexual assault? Is it a… https://t.co/8JhAnWEMsn,David_Johnson41,,-0.3125
798,@ClaudetteGGibs1 My brother died of AIDS in early 2000’s. As a nurse who cared for many young men with this awful d… https://t.co/3EkJRYnuzs,angelofmercy911,"Hot,Hot,Hot",-0.07500000000000001
799,@SyracuseScorpio @MichelleAMilew body parts skulls disease skeletons conjoined babies in jars einstein’s brain defo… https://t.co/sg9r1aMYZ4,kiembery,Tiffany Circle,0.0
800,"It would be wonderful if the policies, mechanisms, &amp; staffing that have been returning to use were in force in 2019… https://t.co/kaCTynwnXT",carter84262,"ÜT: 42.280217,-83.755033",1.0
801,@gaiabiz @elonmusk A risk assessment to plot trends &amp; track exposures from IH data. I am cross credentialed in IH &amp;… https://t.co/drnAuQLlMQ,KristenMeghan,"Michigan, USA",0.0
802,"@OhLordImDone I'd rather not have Hypertension, Heart Disease, and Stroke, thank you very much, tonya.",gallifreyfun,Macondo,0.26
803,"Feels like it, and it’s all transparent ham fisted garbage…. And yet. The frightening part is the fraction of the e… https://t.co/BdtFxHelbw",Kenneth91040240,,-0.5
804,Tissue-dependent transcriptional and bacterial associations in primary sclerosing cholangitis-associated inflammato… https://t.co/UujPnuKHA6,NDM_Papers,,0.4
805,"The District of Columbia, Maryland, and Virginia are all registering very high flu activity levels, according to th… https://t.co/SNUs8cbR5G",wusa9,"Washington, DC",0.20800000000000002
806,Hyunvi getting the model disease whild they're at bbc,kimclaws,she/her 20 white ,0.0
807,@Gordy_Mc1ntosh @_NatashaDevon Is that a notifiable disease? I find it happens to me as well,Abarthista1,,0.0
808,"Newest data in!
Disease resistances from the wild peanut species Arachis cardenasii incorporated into agronomically… https://t.co/Oh8QdmDmcg",BotanyBert,,0.1
809,Congenital heart disease fellows are starting off day 3 of #SCAIFellows with a little healthy competition!… https://t.co/tVMP9GNbbd,SCAI,"Washington, DC",0.10416666666666667
810,@patriotbabe22 @incompleteocean @greg_price11 Oh an as an effort in full disclosure my great aunt was the head of i… https://t.co/j7ARBjum4F,TheresaMihalko,"Pennsylvania, USA",0.575
