,tweets,user,location,polarity
0,‘A disease’: Caste discrimination in Australia is on the rise – but some are fighting back https://t.co/elDRahvPua… https://t.co/P75yHAlpa1,DiplockColin,somewhere north of Sydney,0.0
1,"What is frontotemporal dementia? The disease afflicting actor Bruce Willis is incurable  
https://t.co/W3N6vtqhVZ",jlounsbury59,"Lake Frederick, Va",-0.5
2,@therealme_honey @vanderveer_jan @CRIXUSwasHERE @JillyBean929 @CreasonJana @fema @POTUS @JoeBiden @SecretaryPete… https://t.co/oGlHKeuUg7,AreaAre70940763,,0.0
3,What women survivors want you to know about #Heart Disease and #Stroke https://t.co/SSyPLTJBTV,AphasiaAnswers,Kansas City,0.0
4,"@KrisRoSS77 @ejustin46 I share much of your negativity and appreciate your ""rant""😁😁

I'm not anyone special. Just a… https://t.co/w5lKLjLYf1",DavidJoffe64,"Sydney, New South Wales",0.2785714285714286
5,"When asked if there should be more concern about #vinylchloride, Dr. Beier of @ArteelBeier said, ""Yes."" 

“Low leve… https://t.co/VhddLqqpAy",WritingLiYakira,"New York, NY",0.25
6,What disease is it when i read so many books but come about 10 pages before the end and just put them down and never pick them up again,8catsdeep,,0.17222222222222222
7,wallahi jealousy is an actual disease like get that man’s d1ck out of your mouth and focus on playing in a team tha… https://t.co/aBrevZ1Uar,aIImenaretrash,she/her,0.0
8,"Disease Twitter,
What are your favorite papers on density vs. frequency dependent transmission? Macroparasite paper… https://t.co/j8rlyKunBM",jtvannatta,,0.5
9,I suspect the epidemic disease that plagued koshuu &amp; goshuu wasnt a mere coincidence but maybe something unleashed… https://t.co/KP9IAvquXX,DarkSukehiro,,-0.5
10,There is a guy on here who wants everyone to know that @District8Manny suffers from Peyronie's disease. Oddly speci… https://t.co/9p7O4rqNEZ,rtrev1984,"Texas, USA",-0.18888888888888888
11,@BlackMambuh789 @misterington @seeyababe761 A diagnosis of dementia as well as any disease begins with a doctor's e… https://t.co/qE0onB7Eml,evieb52,United States,0.0
12,@SenatorTimScott how about rehabilitation centers ... the war on drugs has never worked! addiction is a disease!,perez_tonio,"Fort Worth, TX",0.0
13,Bruce Willis has frontotemporal dementia: Most common symptoms to be aware of https://t.co/YtVSPG6mx8 via @TODAYshow,WritePaintDraw,,0.15
14,@SteveBarclay @WolvesCouncil The government mandated vaccines that have killed more than the disease. We won't ever believe you again.,RobBenn39792564,"North East, England",0.15
15,"vascular dementia   血管性認知症

dementia of abrupt/gradual onset that is caused by cerebrovascular disease",HatsuonRobin,"Yokohama, Japan",-0.125
16,Pfizer removes HALF of patients from its Lyme disease vaccine trial after finding violation of 'Good Clinical Pract… https://t.co/MViFLqmkEc,GodGetslastWord,In this crazy world not of it,0.26666666666666666
17,@DrGaryFuller Where is the lifetime modelling for chronic disease? Does pollution cause cigarette smoking? I bet yo… https://t.co/jUTKjnHShy,PeterHealthEco1,,0.0
18,@TomW_CowVet @actionjohnes @DairyNZ 100% Agree more testing needed and culling very useful in reducing disease pres… https://t.co/5yLvHFf0e4,Rupert_Sheppard,"Ashburton District, New Zealand",0.445
19,"@RonFilipkowski It’s like a venereal disease, cosplay convention.",savageskyes,United States,0.0
20,"@Madmedic2002 @nytimes The problem lies in the inability of medical scientific research, not in the disease",AdaM_002022,,0.0
21,@WeAreCanProud He can't help himself. It's called. Foot in mouth disease.,bumper931,,0.0
22,@SueLaniMadsen @NBCNews @GovInslee “Our meta-analyses showed that protection from past infection and any symptomati… https://t.co/pwBbiQxj8Q,FarmerGran,The Beautiful PNW,-0.25
23,Judi Dench reveals she can no longer read or memorize lines because of deteriorating medical condition… https://t.co/cnhCkRABTr,hifjb666,New York,0.0
24,you guys are a literal disease https://t.co/WZsVT7WES7,1oserjk,🇭🇳— she/they,0.0
25,"@VigilantFox @MitchGhezzi @RobertKennedyJr Midazolam, sold under the brand name Versed among others.

currently use… https://t.co/jlUNDJMp9I",DeeLanga8,,0.0
26,Apellis Pharmaceuticals gets FDA approval for eye disease drug,DonnaTGibson,Atlanta,0.0
27,"High Levels of Spike Protein Found in Blood of Patients with Post-Vax Heart Disease: Harvard, MIT Researchers Find… https://t.co/VrRyfFHy1N",Oestegato,Emerald Coast,0.16
28,"Our food may be giving us Alzheimer’s disease, new research says https://t.co/cJqZmQW0MR via @Yahoo",RamsChiefs1816,,0.13636363636363635
29,Looks like heart disease. No matter how fast her metabolism is! https://t.co/On7QQHLunL,parrirain,"Nantahala, North Carolina",0.2
30,&lt;&amp;-&gt;/ Cancer is a deadly disease.       #上海 #天津    #青岛                   https://t.co/qZRLhEQZQv,prahtama2,,-0.2
31,"two hours before i have to run dnd and i am still prepping notes, frantically researching the fucking language of f… https://t.co/tla9jLCizs",foxgraves,they/them,0.0
32,"@Greg28431351 @BJNewsTW @ANTlWEF I have an autoimmune disease, I’m over 50 and no jab. Got COVID and was fine. So not necessarily",PodojakLynne,"Ohio, USA",0.20833333333333334
33,People with long COVID explain how it changed their lives https://t.co/Z4TTjRHDRe,ExiledNoMo,,-0.05
34,Paying it forward and wonderful to see @DDJoyce_BFA @vidit_sharma_ @MayoUrology present this important work to desc… https://t.co/18oDy3EhPZ,SWilliams_MD,"Galveston, TX",0.4666666666666666
35,Over one million heart attacks and strokes occur every year in the United States. Be proactive with your heart heal… https://t.co/L0WYOP1gf4,wellbuckeyes,"Columbus, OH",0.0
36,Every major disease that is killing us in first-world nations now have strong causal links to a lack of sleep.… https://t.co/3u3FUyjqKr,Bej43,"Statesville, NC",0.24861111111111112
37,Pfizer removes HALF of patients from its Lyme disease vaccine trial https://t.co/fWjE0KY6b7 via @MailOnline,socrates1951,"Texas, USA",-0.16666666666666666
38,Stella Stevens dead at 84: Hollywood star was battling Alzheimer's https://t.co/AeqlAevijH via @DailyMailCeleb,socrates1951,"Texas, USA",-0.2
39,@CavenderKeith Woof. Is Mad Dog disease like Mad Cow?,UncleBill_Not,Earth,-0.4611111111111111
40,"Long COVID Now Looks like a Neurological Disease, Helping Doctors to Focus Treatments - Scientific American https://t.co/6O6XQkYL6S",sujilu,"Colorado, USA",-0.025
41,"London, Ont. child with rare autoinflammatory disease pens book to share his experience https://t.co/30X10yqj3q #LdnOnt",AM980News,"London, Ontario",0.3
42,There's a window disease epidemic in RF seems like 😒 https://t.co/nEkaIjN83d,brush_tool,Oz,0.0
43,@Pinkgilly15 @cheesyredrocket @guardian @carolynharris24 @RishiSunak Exactly. Research shows hrt is beneficial (pre… https://t.co/v4QvRPhRpR,ViburnumCatapus,"Scotland, United Kingdom",0.25
44,"""We have shown experimentally – this is not in humans – that these lower concentrations will enhance liver disease… https://t.co/iY2vDHuhFf",WritingLiYakira,"New York, NY",0.1
45,"@no_Bones_ @Dinglemungus BTW look up SARS pandemic. Because there's been other disease outbreaks. 
And they were handled just as badly.",Sabamika1,The Bowels of Hell,-0.4124999999999999
46,@nypost Broadway is dead. Especially now the woke disease has reached the great white way &amp; turned it into the great white genocide way.,martinidayz,,0.23333333333333336
47,me when i cause lymes disease: https://t.co/9TeOkQCHZd,annoe9118,they/he ☆ 20,0.0
48,"@christianhoney_ @lainey184 @Gerashchenko_en 3- It's supposed, Putin has this disease for 10 years ago, He has to b… https://t.co/YHI5VrSv88",DashaKirill1,,0.0
49,"Ticks released that caused Lyme disease in animals and spread to people. This wasn't an ""accident"".",LadyBeatrice45,USA,0.0
50,@TanshiWT I TOLD U THIS IN VC BUT THIS IS REALLY WELL WRITTEN I LOVE THE EXPANSION ON THE SCAR AND DISEASE,soxxeonfire,my room probably,0.35
51,It wouldn’t be surprising. A whole lot of us threw a massive hissy fit over the idea of wearing a simple mask to pr… https://t.co/7YpSFfnALM,NinaNighting,New England,0.25999999999999995
52,"CAN SOMEONE PLEASE MAKE AN ""I LIKE THEM SO MUCH DISEASE"" ANTIDOTE!!!!",jetaemplus,she/her 22,0.2
53,"Our Food May Be Giving Us Alzheimer’s Disease, New Research Says - Barron's https://t.co/zKyvovsNB0",drnewbold,"Richmond, CA",0.13636363636363635
54,@matjendav4 They all need to be deported. Joe Biden needs to be impeached. His first duty to this country is to pro… https://t.co/o7m72Isyr6,mccoy_lonnie,Iowa USA,0.25
55,A leading Norwegian government public health and infectious disease expert. https://t.co/I0TNsdvxxB,ajlamesa,Earth,0.0
56,"My dad died in September from frontotemporal dementia. My heart breaks for Bruce Willis' family, because I know how… https://t.co/95S2Th9hTh",Mivia1,,0.0
57,@Maybelilpinch @HappyCamper2626 @RonFilipkowski Exactly its the disease itself causing these long term issues &amp; aft… https://t.co/7NRmu3BnEM,blazin_errl,"Toronto, Ontario/ Buffalo NY",0.1
58,"@erika_at_panama @gidderdunner @sarahbeth345 But if you do, your likelihood of serious disease is much lower.",jlazewatsky,,-0.06666666666666665
59,Chronic renal disease https://t.co/1NMBwEQw8B,WAssignmentspro,,0.0
60,@thecoastguy Tis long over due a cure for thee disease!,AlchemistsWays,AselectedTime&SpaceInTheAether,-0.0875
61,"I love Star Trek TNG. 

""Let's cure her of this strange disease by transporting her back to the ship, except we'll filter out that gene.""

😂",kesselman_sarah,California,0.15
62,Liver disease free https://t.co/hDh950oCQP,jporche944,,0.4
63,"I legitimately feel like I've to pinch myself when I see this.

My heart rate has been 100-110 at resting since the… https://t.co/5ZCALTj2Ej",Kokopopz_Lol,,0.0
64,"How these gaps occur developmentally &amp; change in disease/ageing, how much peripheral molecules/cells access the CNS… https://t.co/SZqrNtxsxr",SiegenthalerLab,"Aurora, CO",0.2
65,"@fairchild01 @mywildlens @amyboylanwrites Ideally, genetic testing would identify the inborn errors of immunity cau… https://t.co/uILf5mf5C9",renesugar,Earth,0.9
66,Wonderful news for the #IGAN community with the approval of Filspari by @TravereRare  So proud to have been involve… https://t.co/mOA7sP4YcK,gratefull080504,"Saint Louis, MO",0.9
67,Unemployment is a disease. https://t.co/59mnHOXos1,SeanBasquiat,Jamaica,0.0
68,@JoJoFromJerz of course! how else can they appeal to their constituents if everything going to be fixed. So they vo… https://t.co/ttiTSsqE5X,lekzzoid,"New Jersey, USA",0.1
69,@specialkidz4 @MikeGil21446788 @PAHAU6 @Grace2Amazing @Zer0LM It really is amazing to watch those who refuse to res… https://t.co/COFTZWecrM,ShineTh18697803,Earth,0.6000000000000001
70,Effects of Music-Based Interventions on Motor and Non-Motor Symptoms in Patients with Parkinson's Disease: A System… https://t.co/vMswlH31KW,chantsforhealth,,0.0
71,The doctor said I have Reggae Mylitis...incurable disease 🥵 https://t.co/JKNx1Aac9w,handasOclock,Juja,-0.5
72,luhg twitter is a disease,IindeIxf,,0.0
73,"February is American #HeartMonth, and we're taking this time to encourage you to take control of your heart health.… https://t.co/5iQaAEMDGL",CentroLaFamilia,"Fresno, CA",0.0
74,nZh&amp;d Cancer is a deadly disease.    #上海 #天津    #青岛         https://t.co/bSCyriPy4e,mayaya121,,-0.2
75,@justhoeinh Ur fave has Lyme disease 🥱,KosiOnuorah,,0.0
76,@Namzmusic I’d put my money on that bet. More of treatment to slow disease progression vs a cure.,BJsView,"Charlotte, NC",0.09999999999999998
77,@NewAgeNed @DaveF1975 @ClareCraigPath I don't remember him saying cremation was unusual. Event 201 simulation and C… https://t.co/4sqlCrKmKX,Matthew07683125,Mill Hill.,0.2
78,"@LifeIsACuldesac @marceelias She's always been wired for this, but like a brain impairment it took time to develop.… https://t.co/MlFOzfwgsx",LiberalMalcont,,0.0
79,@EmmaKennedy @flissy2k Been there sone that. Also ECG and echocardiogram and a four year diagnosis of rheumatoid ar… https://t.co/qOeKQAizrz,MatiGlasson,Sheffield,0.0
80,New tool better estimates cardiovascular risk in people with lupus | MDedge Dermatology. Promising research tool th… https://t.co/j026Hlb8ds,KathleenArntsen,"Verona, NY",0.2787878787878788
81,The team at Cardiac Rehab is here to help you take on your heart disease and get back to your life! Our multidiscip… https://t.co/HGuYCEZAPG,CheyRegional,"Cheyenne, Wyoming",-0.025
82,"Thinking about my friend @SenFettermanPA today. 
 
Depression is a disease that can't be battled alone, and John’s… https://t.co/UlnIeeCBsh",SenSherrodBrown,"Cleveland, OH",0.0
83,@msputthatshiton i think it’s a sign of like lung disease or something like that,icymeg,det,0.0
84,"Results suggests that in long term, similar to other human coronaviruses, there will be a low seasonal hospitalizat… https://t.co/TAucBfY0Gz",theripsnorter,,-0.034999999999999996
85,Immunity derived from past infection #NaturalImmunity provides high protection against severe disease (&gt;85% at 40 w… https://t.co/cQGakerRCf,theripsnorter,,-0.045
86,"#C8 Science Panel 
""...it is more likely than not that among class members a connection exists between PFOA exposur… https://t.co/BKVZYdoAan",wordsmithI,"Flyover Country, USA",0.25
87,@christianhoney_ @lainey184 @Gerashchenko_en 2- meaning they could maintain their balance and did not have dementia… https://t.co/v4eCKH2tlA,DashaKirill1,,0.0
88,"...and we are to trust their CV-19 vaccine???

Pfizer removes HALF of patients from its Lyme disease vaccine trial… https://t.co/Iz1ccL5DE8",1957Micky,"Co. Sligo, Ireland.",-0.16666666666666666
89,"Actor Bruce Willis was recently diagnosed with frontotemporal dementia, a form of dementia most often diagnosed whi… https://t.co/9TOQPythgO",AdventistHealth,"Roseville, Calif.",0.25
90,"@christianhoney_ @lainey184 @Gerashchenko_en 1- Lol, you speak with a doctor in this field. One long-term study fol… https://t.co/VduadZlJA4",DashaKirill1,,0.375
91,@coltybrah this dude cured his lyme disease by surfing,gambigambitho,,0.0
92,"@nicksortor Stop fear mongering

The official highlighted four agencies the Environmental Protection Agency (EPA),… https://t.co/89JUKwHPQm",andy_leads,,0.0
93,@K1ngFARRAR @aleveille6 @RonnieRadke The only thing you are doing is harming yourself.  Hate and anger builds insid… https://t.co/DtIdGoFdzY,ShininginChaos,United States,-0.5
94,Reel shippers are a disease to society,timsstuv,,0.0
95,@IsabellaMDeLuca My advice. Don’t wait until Monday. I lost my pitty to lime disease.,josh_walburger,,0.0
96,Workers’ safety and health matter. NIOSH research found that long-haul truck drivers have a higher risk for obesity… https://t.co/djkbpGJ0jt,NIOSH,Washington DC,0.1
97,"So eating 12,000 calories or pretending to is not promoting and glorifying an unhealthy lifestyle leading to diabet… https://t.co/VBDhlklKOP",Aizehinomo,,-0.4
98,Research opens the door to improved treatments for #congenital #heartDisease #HeartMonth @jmartinlab @BCM_CVRI… https://t.co/VS6Gyycnj7,BCMFromtheLabs,"Houston, TX",0.0
99,@iyaniahtml @kiarakcal edtwt a disease to society,scorploh,,0.0
100,@wadadli_albany @burtchintus @coug1988 @charliekirk11 A vaccine is supposed to prevent you from getting a disease.… https://t.co/buXJhddkeW,bronanbrobrien,"Spring, Texas",0.0
101,More on FDA approval for Apellis retinal disease drug: https://t.co/wPQiO3iHSa $APLS,PearlF,"Cambridge, MA USA",0.5
102,"My dad died in September from frontotemporal dementia. My heart breaks for Bruce Willis' family, because I know how… https://t.co/orE9q6YqbG",cranberryhorn,"Missoula, MT",0.0
103,"If you take the overwhelming historically supported line that males are general males and females are females, then… https://t.co/mWPxpG7C2c",quirkyllama,"Boulder, CO",0.18333333333333335
104,@elonmusk You mean I don't have Peyronie's disease?!,DaleJust2,,-0.3125
105,There are many great things about the Chats. Their madcap videos are one of the best. As is their subject matter: s… https://t.co/WIMVCFSTpL,heybriandawson,"Charlottesville, Virginia",0.5333333333333333
106,Thinking sustainable prevention is better than cure. Blood needs to be addressed with long term illness and disease… https://t.co/NEpK6IIhQY,itstimeISO,"England, United Kingdom",0.225
107,@hannahwa11 Why are the police bothering to watch and be distracted by this tiktok bullshit. It’s like a contagious… https://t.co/HSg2l2SgS9,angelsflight_,United Kingdom,0.0
108,"@SarahisCensored Yea I'm sure ""lime"" is the disease that'll most likely affect you",Keepounding0912,,0.3333333333333333
109,@LEAD_Coalition This is intuitive but nice to see it borne out. Cardiovascular disease and inflammation affect ever… https://t.co/4g9P9OCKcs,scruffage,"North Carolina, USA",0.6
110,@lainey184 @DashaKirill1 @Gerashchenko_en Parkinsons is a progressive disease which can be kept under control for a… https://t.co/jZGcwq8QDj,christianhoney_,,0.0
111,"Dear Father, I thank you for the power in the Name of Jesus, and the boldness, confidence and authority I have to u… https://t.co/CKmiEw6oaL",EvansThePriest,Italy,0.0
112,"#LongCOVID Now Looks like a #NeurologicalDisease, Helping Doctors to Focus Treatments. The causes of long COVID, wh… https://t.co/rw8aSqRa4R",timethief,unceded Snuneymuxw territory,-0.05
113,@BreitbartNews This is what happens when the spoiled brats with no discipline grow up and spread their disease even further,Joseph384774501,,0.0
114,@JATetro @jodyvance Can't a build up of IGg4 lead to issues like amyloidosis? Or does this woman get it all wrong?… https://t.co/28domt4ySC,lasthopeofman,"Vancouver, British Columbia",-0.5
115,@nohomelikeplace @nnjiww I thought they already proved the opposite of this? That infection *increases* your chance… https://t.co/ufu5vBfclp,JesterOfNoCourt,"Jersey City, NJ",0.0
116,Chronic kidney disease due to hypertension,HourlyDeath,Everywhere,-0.125
117,"@abcnews ""… infection carries with it the risk of disease (including severe disease in a proportion) whereas vaccin… https://t.co/e97vfdg5Da",OpinionatedOrg,,0.0
118,"“Avian flu” arrived to Santa Barbara County, Public Health announced today, with an undisclosed number of cases in… https://t.co/cRVn0kXTrM",SBIndyNews,Santa Barbara California,0.0
119,"We do not comprehend the organic fascination of self-poisoning, auditory damage and sexually transmitted disease.",Legion_Quotes,  -   🤖   -,0.5
120,@socialscrewup @NetOpWibby clout is literally an airborne disease,qeauxduis,,0.0
121,"96%of the world has been infected with a life altering disease, all your friends family and loved ones have lost it… https://t.co/e3jaWMra3U",y05o6,Downtown Canada,0.7
122,"With migration from South Asia on the rise, @AusHumanRights has heard from community organisations, experts and tho… https://t.co/pak99rW8E7",KarishmaLuthria,Sydney,0.0
123,"@JellyCraven @veganbadass_ They're right, though. Tics don't automatically mean Tourette's because they can have or… https://t.co/2xwVad94T8",FragSoulSys,,-0.01339285714285715
124,"The Air Quality Index (AQI) is an important number, especially for those who are or have suffered from heart diseas… https://t.co/6YsSDc6VN8",LCPublicHealth,"Cedar Rapids, Iowa",0.2
125,"Ghastly disease death and so it would
use this
_bath_and_body_onass_NOON_promo_NON_TOYOU_To_you_COUPON_SIVVI_NAMSHI… https://t.co/MXIcNAzTJH",vietthaidc,,0.0
126,@JackHorwood So pleased Rhod is recovering. He has such humility and I was very moved by what he said. My husband p… https://t.co/9yIa2Y92XI,AnneDel81230567,"England, United Kingdom",0.2333333333333333
127,"Brandon Varilek, an assistant professor in #SDState’s College of Nursing, has received a grant to study palliative… https://t.co/5MWnkhTQdE",SDStateNewsroom,"Brookings, SD",0.0
128,@CBSEveningNews Doctors don't cause a disease they try to prevent or cure it no matter their race. So what is your point?,JackSte61206225,,0.0
129,studies show 85% of tinder users suffer from “Fuggo “ Disease . its very serious &amp; few survive . here to spread awareness,colinnations,designer | 19,-0.31666666666666665
130,"The increased chance of myocarditis are 75% after the Pfizer shot &amp; 557% increase after the moderna injection. 

Th… https://t.co/r0XGcSfZnw",Abirthingperson,,0.0
131,@mariashriver My best friend died of this at age 50 leaving behind two middle school girls after being diagnosed at 48. Devastating disease.,KarenZacarias6,"Washington, DC",-0.1
132,"@markjenkinsonmp So, if the Tories are so tough on crime, when can we expect the arrest of all of those ""laughing a… https://t.co/jCJpxnx2g7",LynxSyndicates,UK,-0.21944444444444444
133,"In ""We the Scientists,"" WSJ reporter Amy Dockser Marcus chronicles the story of a group of activist parents and sci… https://t.co/TWTpUIvdSB",clancynewyork,,0.0
134,"@ABridgen You do know that covid causes heart disease, don't you?
No, I think you probably don't, like you don't kn… https://t.co/24AuxwA9ma",OliajiMeher,London /Egham,0.0
135,Klippel Feil is a benign bone disease.  It causes you to lose your teeth.  Lying @psychanne has spread lies about m… https://t.co/YLq8K4XeXc,HHb89496290,,0.0
136,It’s called Perriyones disease or some shit https://t.co/usORdzRZZ6,BigBrrrrandon,,0.0
137,Pfizer removes HALF of patients from its Lyme disease vaccine trial https://t.co/FbBHBYfy3Z via @MailOnline,no_jabs,Virgo Supercluster,-0.16666666666666666
138,"Soros called Trump a ""pitiful figure"" who is driven by narcissism and is losing GOP support. Who spends his time mo… https://t.co/lSlTRELajv",Edmart2531,"Harlingen, TX",0.0
139,"Stella Stevens, 'The Nutty Professor' and 'The Poseidon Adventure' actress, died Friday after a battle with Alzheim… https://t.co/JRr3GflHqF",EW,"Los Angeles, CA",0.0
140,This is not about all these younger folks getting heart attacks and dropping dead. This is not about Long COVID. Th… https://t.co/hgoULHpqrb,sunoppositemoon,The Emerald City,-0.08333333333333333
141,"Sedative medications: an avoidable cause of asthma and COPD exacerbations? https://t.co/911ib0vquD

You really need… https://t.co/6DzNCLxfps",doclip1,Scotingland ,0.2
142,Pfizer scraps half of participants in Lyme disease drug trial due to quality issues https://t.co/UwpgBwLlo7 via @statnews,Spanishcountry,"Eaubonne, 95, France",-0.14583333333333331
143,@selenagomez you are the spokesperson we never knew we needed. I lost my Mom to #Lupus in 2015. I admire you for yo… https://t.co/gFDgoBCPvp,MirandaWade84,"Tallahassee, FL",0.0
144,I GAVE BIRTH AGAIN  . people on reddit said that the usual number of babies u can get is between 4 and 7 and i only… https://t.co/mpIBrw43AA,CRlNGEFAIL,he/she 18,-0.125
145,Sex Disparities in Prevention of Atherosclerotic Cardiovascular Disease Across the Life Course https://t.co/SbjUxyhkd4,MugaAlejandro,La Rioja-Alava,0.0
146,@sleep_advocate WOAH! This is wild &amp; remarkably encouraging. We are approaching a state when advancements in realti… https://t.co/6nbccwvdka,SleepAndSports,UniversityOfWisconsin-Madison,0.2833333333333333
147,"@Ohemgeeitsalys1 They are ALL magatitis disease carriers and ANTI AMERICA taliban types.
We have them here in WI an… https://t.co/dyZNGxoxkP",NAVYBLUEAMERICA,,0.0
148,@fromthefrost36 Do u know smoking weed can give u lung disease?,CarolineWs6,,0.0
149,@keithwalls63 @cliftonaduncan Vaccinations (not just COVID) have been shown for over a century to reduce your chanc… https://t.co/qEH5qcQHQv,davethecanuck,"Boulder, CO",0.0
150,Stella Stevens dead at 84: Hollywood actress - who starred in The Poseidon Adventure and The Nutty Professor - was… https://t.co/Dx3gD6Sbhd,atasteofcreole,"Washington, DC",-0.2
151,"So the researchers agree with me. Getting sick from COVID is like two jabs of the vaccine, but like obviously, get… https://t.co/kJ1EiTFJfN",sunoppositemoon,The Emerald City,-0.35714285714285715
152,@B52Malmet Parkinson’s disease!,ShnjAnne,"Pennsylvania, USA",0.0
153,"@bittroldcatlady @hindman_e Shame to spread vaccine disinformation when COVID is killing hundreds, and 1 in 5 survi… https://t.co/Zd5MRddD1G",HellyerConnie,"Seattle, WA",0.0
154,"@girlsreallyrule #DonJr #DonJrTweaks. 
He's looking thin (which establishes NOTHING; he may have a digestive diseas… https://t.co/8ExTVayml3",RolfFunCycleIII,Earth (while it lasts),-0.4
155,@itsJeffTiedrich @purrmonsta I think the GOP doesn't  care who dies in our country. They blame people with diabetes… https://t.co/n9kM6TyVKT,JuanitaIguana1,"Arkansas, USA",0.0
156,"Bruce Willis has frontotemporal dementia, condition worsens https://t.co/bhSxneMJaZ",thingstodotampa,"Tampa Bay, Florida",0.0
157,The part of having a life threatening disease that nobody talks about is the fact that I constantly feel like a bur… https://t.co/FZtbelDyCa,danwichh,"Soquel, CA",0.0
158,Gacha is a DISEASE,no_pulling,gacha hell,0.0
159,@RandPaul He didn’t deny it. Fauci promotes the vaccine bc it also prevents severe disease and death in the overwhe… https://t.co/mGx8Lv24I8,LoriMH98,"Massachusetts, USA",0.0
160,@TheoVon Single payer. Eliminate the for-profit insurance middlemen. Which massively reduces Healthcare costs in th… https://t.co/JI3zkKhGS8,ExtropianEric,"Arizona, USA",-0.03571428571428571
161,@Ecohustler @ASC_aqua @ciwf @SalmonScotland @TheGAAIA @vivacampaigns @ecotricity @oceanrebellion @WildFishCons… https://t.co/RIVNg90K9W,Biospine,"St Helens, Lancs, UK",0.0
162,@BoSnerdley I remember this. Rush pointed out that Michael J Fox deliberately did not take his medicine that would… https://t.co/6bRAlqerlc,MichaelinMI,Michigan,0.0
163,@sentivcapital So pretty much a home run label.  My biggest commercial concern was monthly dosing on an asymptomatic disease.,BioPharmaMeat,United States,0.15
