,tweets,user,location,polarity
476,Europe Ultrasound Device Market 2023: Increased Awareness of Early Disease Diagnosis and Technological Advancements… https://t.co/r1lNsv66gR,Stock_Market_Pr,,0.1
477,"Podcast time! Today's topic is ""Outcomes of scleral lenses for dry eye disease in chronic ocular graft-versus-host… https://t.co/so797rWSR3",aaopt,"Orlando, FL",-0.06666666666666665
478,@DefiyantlyFree @Jamierodr14 That’s why I pay medical insurance premiums. Don’t waste that money on cancer or heart disease,OMJ327,,-0.1
479,"@LibertyCappy do covid deniers just dont know history, sure covid wasnt a sure death disease but long our history w… https://t.co/VrEEX1Za2P",Balakug,,0.31666666666666665
480,"Kyowa Kirin brings rare disease drug's marketing back in house, plots future US growth #strategy… https://t.co/MUgjC9pibE",_timos_,Global,0.09999999999999999
481,@Backstorymom1 @nytimes The American Disease spreads around the world.,admiralmpj,"Glendale, California",0.0
482,@rainbowvegan_ You do know I work in infectious disease right? Like I literally have a degree in public health and… https://t.co/9g3PDmovdk,planetcheri,est | doja x1,0.14285714285714285
483,"On tonight’s episode. Chloe’s baby has (insert random disease here because nothing can ever go smoothly).
#Emmerdale https://t.co/w9jtm9sKjl",ChewBarker78,"England, United Kingdom",-0.04999999999999999
484,An 11-year-old girl from Kerala has developed an AI-based eye disease detection app that has the potential to help… https://t.co/mZPuBx4zHV,Marco_Coffen,"Dubai, United Arab Emirates",0.06666666666666667
485,Fetal alcohol exposure impairs learning and memory functions and elevates levels of various biochemical markers of… https://t.co/wqF8S3P5Fh,ACERjournal,International,0.0
486,"@XSnotrocket They do well in Arid Climates like California.
And if you don’t spray to protect from disease they get… https://t.co/LskNZ0xKyA",SeanSean252,Northern California ,0.0
487,"🎙️ They talk about active surveillance for low-risk prostate cancer patients to avoid over-treatment, as well as th… https://t.co/sEhe7eCdCv",Uroweb,,-0.06666666666666667
488,It’s Huntington’s Disease awareness month. Spread the word! #huntingtonsdisease @Help4HDI https://t.co/E1ArIFtXn0,lauralu121222,"Exeter,  New Hampshire, USA",0.0
489,@Annalis02642514 @Wimbledon @iocmedia I know. It’s just that it’s yet another one facet of this russian disease sho… https://t.co/sCmpCRrBJl,kocanska,"Langley, Virginia",0.0
490,...the best thing you can do is leave it alone! Pathologic phimosis is caused by altered or scarred tissue that aff… https://t.co/4mPttVbhdK,YourWholeBaby,YourWholeBaby.org,1.0
491,"@missblondiemode COVID stands for

COronaVIrus Disease.

There's multiple versions of Covid",Fan2La88,Southern California,0.0
492,"@DrRichHuntsman You forgot fatty liver disease, sleep apnoea and digestive issues😂",StockpickB,"East Midlands, England",-0.2
493,@PenussyJones @_mstrdom @MoonzHz @raphousetv2 do you think heart disease only happens if you're fat lmao,cyberbabyyyy420,"Minneapolis, MN",0.0
494,"Have you considered the DASH diet? While it is a “diet,” it is a pattern of eating that is sustainable for life and… https://t.co/qdK2Dcgwht",shelrael,"Albuquerque, New Mexico, USA",0.0
495,@DBinSydney @javitagracia @Phil_Lewis_ Ur a liar. Ur forefathers play the long game of chess and undermine nations… https://t.co/hV7gOh2R9T,PisceanGoddessa,,-0.225
496,@cindi_feriby Oh I KNEW this would come out as how they are. I said repeatedly during COVID that their attitude is… https://t.co/pMP8UXTyuk,AnfelisaSpiorad,South Carolina,0.0
497,white supremacy remains a disease,jessiekaiser,everywhere,0.0
498,"@REMASCULATE It's Probably worse...
That tick has lemon Lime disease",halstead_shane,,-0.4
499,This #WellnessWednesday tip is to eat the Mediterranean way. Studies link the Mediterranean diet to a reduced risk… https://t.co/FGgT9W9fbf,IdahoAGC,Idaho,0.0
500,"After we received the heart breaking diagnosis that our twin newborns were born with a terminal illness (ML2), I wa… https://t.co/EWyVJfj17T",MRamirezJohnson,,0.0
501,"@b2the2ndd Idk given how much of our community has died to a disease that is now preventable because of prep, I can… https://t.co/OIAFURcPDH",GlizzyGaymer,"Oklahoma, USA",0.2
502,they gonna give us a new disease 😭😭😭 chicken pox 2.0 https://t.co/rWT7n2jqGe,rottewange,hotel oj,-0.2318181818181818
503,@Ifartedtrice @DonateYoKids Why are you pro disease?,_Credible_Hulk,,0.0
504,"@mynameisjro True, I empathize with your framing better &amp; think it is overall better to focus on those barriers to… https://t.co/QCYWbL2CCy",PatrickSBruck,"Maryland, USA",0.3375
505,@charliekirk11 White supremacy is a disease.,Jersey_Craig,New F’in Jersey,0.0
506,@JC75408607 I have Huntingtons disease a similar crappy disease. I’m 42. It’s HD awareness month also. ((Hug)),lauralu121222,"Exeter,  New Hampshire, USA",0.0
507,"Colorado18yr ALS Research can now show 90%+ ALS recovery in 6-12 months using stem cell support, while enabling the… https://t.co/oOOvkECXfx",DanielH03274759,,0.0
508,@Gi__Uhh Jealousy is a disease and I’m SICK,ntawrld_,She/Her ,-0.7142857142857143
509,"Assuming I even had a terminal disease and wld die soon, how is that anybody’s business? How is that something to u… https://t.co/UqUujvbtLg",oddy4real,"Edmonton, Alberta",0.0
510,Seminole Police are searching for a 69-year-old man with Alzheimer’s disease who they said was last seen over the w… https://t.co/SkXlCAQtgt,StreetMediaHype,,0.05
511,Travere's Sparsentan Stumbles in Phase III Rare Kidney Disease Study https://t.co/4P6rMgUGOQ https://t.co/HpVb7qWBU5,Corixis,,0.3
512,Travere's Sparsentan Stumbles in Phase III Rare Kidney Disease Study https://t.co/FSCWlbn2ZO https://t.co/fwSFLlNb6l,Biotechnology,,0.3
513,Eli Lilly and Co. said Wednesday its experimental Alzheimer’s drug appeared to slow worsening of the mind-robbing d… https://t.co/ePQkN42cGS,YourNewsNet,United States,-0.10000000000000002
514,"@IppoAng This has been my position from the start- as you know. I’m not an ME specialist, but a cardiologist, &amp; the… https://t.co/x2zN6b0aEn",calirunnerdoc,,0.0
515,"@JohnWoodrowCox It is a disease, the virus is violence, access to weapons makes it lethal...",RobinCogan,"New Jersey, USA",0.0
516,"When she started high school, Ekta Seth Chhabra had never met a woman scientist. She charted a scientific path that… https://t.co/EKS5tpLFVj",MCBDartmouth,,0.16
517,"@WebMD Well, getting diabetes and heart disease does tend to make one depressed.",HighDefHealth,"Atlanta, GA",0.0
518,Second new Alzheimer's drug said to slow progress of disease by a third but volunteers died of brain swelling https://t.co/xLLP5J87Wu,YopeyCharity,UK – mainly in #EastofEngland,-0.04090909090909092
519,Disease is autonomic nervous system disregulation.,InfoTHI,"4549B Kingston Road, Toronto",0.0
520,"@OUTASA Well done Outa, this was overdue, when corruption is left to grow into disease and everyone around hopes so… https://t.co/YusEAwF5Az",RBustas,,0.0
521,"@bennyjohnson Send her and the rest of Washington to Juarez, Tijuana and El Paso. Get the border sealed. Let immigr… https://t.co/ZxOjs0l6Od",TheDuchessofATX,,0.0
522,Religious people will treat outsiders like a disease in the name of god,fabo_0313,"Houston, TX",0.0
523,"Imagine a vaccine so safe you have to be threatened to take it, for a disease so deadly that over 99% of those who’… https://t.co/vJ2rCzwIBB",deancarlson90,RURAL AMERICA,0.15
524,"Out of all the bad shit I’ve seen in my life, addiction is the worst. I wouldn’t wish that disease on anyone. It’s… https://t.co/7Ruklm0Zzw",AHenny25,,-0.8499999999999999
525,#NEISvoid #TMJAwareness #TMJ #TMD #Fibromyalgia #EhlersDanlosSyndrome  #ChronicPain #JawPain #FacialPain… https://t.co/PhIe7CzDOi,TMJAdvoCAT,Somewhere in Sunny California,0.0
526,"@mohhnad93 smaple size may reflect the rarity of disease, beside that may open hope for unmet need",Manea__Q1,,0.0
527,"REGISTER TODAY for a Webinar with John Aucott, MD, Director of the Lyme Disease Research Center @HopkinsMedicine fo… https://t.co/DGYBw8h4ll",NancyNDougherty,Boston,-0.1
528,@MumbrianSpinner My gran used to put a teaspoon of whisky in my bottle I was a grizzler so I was told T-Total from… https://t.co/dkVa8qoJzW,MrBrittle1,mrbrittle@mastodon.online,0.0
529,@emadpill @suricidal capitalism truly is a disease considering the fact south korea has also the most amount of suicides per year,polpoltwt,ⵜⴰⵎⴰⵣⵉⵖⵜl,0.5
530,@kurtslimabean Mercedes Blaine and Santana bitching about people together would’ve cured every disease,TinkysToybox,"England, United Kingdom",0.0
531,@FmelUf also alot of interventions and efforts are needed in Uganda towards the control of vectors and neglected tr… https://t.co/QOEyrNvdRt,SsekyeruJ,,0.0
532,@REMASCULATE Bigger problems than Lyme disease,Haywood83062662,,0.0
533,@VoteDarkBrandon @springsteen omg yes take care of your corrupt family only thing is the trail ends sooner than can… https://t.co/qYHk6WgYUN,fredsophie3,,-0.25
534,@Youniquelycasey @P0iS0N_1VY_ @CindyNo11866524 @CNN And a person can absolutely abuse medical care. They can become… https://t.co/UlyaDt0A60,atom_jarvis,Seattle & So Dakota ,0.1
535,Florida Republican Kat Cammack attempted to fear-monger at a Hearing on use of “Antibiotics” and “Microbacterial Di… https://t.co/czx7ooIO3a,limelightonyou,"Jacksonville, Florida",0.0
536,Scotland's wildcat on brink of extinction. Too few wildcats in Scotland for the population to be viable. Reasons: t… https://t.co/N7uSpuoaNW,GreenerN_land,"Northumberland, England",-0.2
537,This picture was over 20 years ago. When I was 18. My mother in her health. Before she got sick (not cancer) rare f… https://t.co/P34TGyxnhs,dublincudz1,"Dublin, Ireland",-0.20714285714285716
538,"The earliest stages of #gumdisease can be reserved through oral treatments, dental hygiene, and committed… https://t.co/3tFzPLhc88",JohnCarsonDDS,"Tucson, Arizona",0.0
539,@MayorofLondon Dirty air causes cancer. OK. So does smoking. Drinking causes liver disease. Oh and by the way closi… https://t.co/i3VP5TI2ZG,Davenoisome,,-0.04999999999999999
540,".@CNN reports, “Drug overdose deaths in the US rose to record levels during the COVID-19 pandemic, and a new report… https://t.co/4ZalXKtD6w",ASHPOfficial,"Bethesda, Maryland",0.36818181818181817
541,"🎯 Functional roles: multi-connected hubs act as regulatory hotspots, influencing the activity of multiple target ge… https://t.co/b7ACuoJTW5",TejasavSehrawat,"Minnesota, USA",0.0
542,@Sujathavip @GopalKkoduru @DrAnkushG @mmamas1973 @mirvatalasnag @conceptmedicals @DrSaritaRao2 @aayshacader… https://t.co/q15WZxpDon,raghucardio,"Hyderabad, India",0.0
543,"@ushamcfarling @statnews @WordInBlack I’m happy who are morbidly obese have options beyond surgery, I’m worried the… https://t.co/VtYre5kKAf",JeromeAdamsMD,"Indianapolis, IN",0.8
544,"Sand begins stuffing itself down Osiris' throat. 

He puts the kid on his back finishing his cigarette. 

“ Cmon ki… https://t.co/ezt6oxSmE4",THEVIOLENTGOD,𝑭𝑬𝑬𝑫𝑰𝑵𝑮 𝑾𝑨𝑹,-0.07777777777777779
545,"@judith17554 Btw, me too with a heart condition. But I think ANY heart condition makes you extremely vulnerable. An… https://t.co/fxi3YBm22n",OldYesButWise,,-0.5
546,"Alberto Ascherio speaking on how viruses can cause disease (such as MS, Alzheimer’s and ALC) and what the Departmen… https://t.co/vstiVIdcaO",LindsayLuvDavis,"Manhattan, NY",0.0
547,New Alzheimer's drug slows disease by a third https://t.co/9waSIDqfM0,SVENNIECO,Europe,0.06818181818181818
548,"❗ New in vascular disease research !

🧑‍🔬 A team of scientists propose that dipeptidyl peptidase 4 (#DPP4)-regulate… https://t.co/43O7fewq2P",endothelialnews,,0.13636363636363635
549,"Assess current &amp; emerging therapies that can improve the management of ocular surface disease, dry eye disease, &amp; p… https://t.co/xagXstQxwS",OSDCME,"Thorofare, NJ",-0.033333333333333326
550,"Kirsten had dealt with dental issues for over 20 years. She struggled with painful, broken teeth, periodontal disea… https://t.co/78o4Y3bEZL",NewTeethNow,"Lakeland, Florida",-0.55
551,".@PMIgov partners with Thailand to strengthen 💪 disease surveillance to detect, treat, follow-up, and cure malaria… https://t.co/bGIBgqhX8z",PMIgov,Global,0.0
552,Revisiting NAFLD: Preventing &amp; Treating Non-Alcoholic Fatty Liver Disease | Nature's Real Health https://t.co/hxq7C1Stkf,nicktompan,"Virginia Beach, Virginia",-0.08333333333333333
553,"The other day when Kaycee and I had friendly banter and my enemies (plenty as usual) were out in full force, a cert… https://t.co/GL0Bfp1dKb",oddy4real,"Edmonton, Alberta",0.0875
554,@OliLondonTV It's a disease not girlhood,junell_nael,"Quezon City, National Capital ",0.0
555,"@SloanRachmuth Dr. Monique Chireau Wubbenhorst: “Abortion neither prevents, treats, or palliates any disease. It ha… https://t.co/p5ZURERhB2",DocnotDoctor76,"Weimerica, NC",0.0
556,"Over 944,000 people in the UK are affected by Dementia,  
Head over to their website to find out more about how you… https://t.co/XdFThFxA5D",HubHerts,West Herts - Tel 01923 624604,0.5
557,"@waterviewdoc Socialist are gross,they have no problem with 
being vile
insects for food and durian
it fits 
Carl M… https://t.co/sQs7R4Xsl3",SeaOatSunshine,q,0.0
558,Far UVC is the future of disease prevention,germ_guard,"Salt Lake City, UT",0.05
559,"@EleyiLagos CAn worm 🪱 eat parkinson disease?
Asking for escabor abi Esco-bat",MyCHOIC17130461,Nigeria ,0.0
560,"Ahhh! Mr hater must you always display your hatred towards the hausa's or Islam, I pray God will heal you from this… https://t.co/bK6hdrTXxb",Habib_ladan1,"Kaduna, Nigeria",0.0
561,@MaTeFerretti And now I would like to see the faces of the skepticals claiming that #amyloid is not a valid target… https://t.co/RdDNkvYdO2,alessandro5161,"Brescia, Lombardia",0.0
562,"@5lut_ nobody wants your nasty, disease-spreading asses over here.",peggyhill755,,-0.4
563,I wonder if rice has the disease sometimes,Jessica_Midder,,0.0
564,Incompetence is disease,1Decatur_D,"Decaturstan, Ga 👆",0.0
565,Had a patient this week that came in with the chief complaint that a rat was in her vagina. Did a pelvic exam on he… https://t.co/oY57y0s451,iamtheFLYEST,JXN ✈️ Ca$hville ✈️ STL,-0.3
566,@heavyredaction There's a semiotic disease we picked up badly in the early 20th Century. We figured out how to use… https://t.co/s9qQEIslgp,subjacentish,Subjacent,0.05
567,"Mental illness can also increase the risk of developing comorbidities, such as obesity, cardiovascular disease, and diabetes.",NudjHealth,"Los Angeles, CA",-0.05
568,Hey so #VaccineGenocide is trending because people are mystified by many people just dying suddenly as if we don't… https://t.co/yKwgmmElub,RyandaryStreams,"Fort Wayne, IN",0.25
569,New Research: The interplay between nonalcoholic fatty liver disease and atherosclerotic cardiovascular disease: Th… https://t.co/RKd0EQUI8K,FrontCVMedicine,"Lausanne, Switzerland",-0.03181818181818183
570,@BeatDAHeat @LisaMarieBoothe If you believe you are gullible. Can you look around this world and believe in the goo… https://t.co/IEGJ5x2xmU,drebin2323,"New London, CT",0.0
571,"#GodMorningWednesday Satlok is a pure world where there is no old age and disease.
While no one is saved from both… https://t.co/zGmnBQk3zp",NareshS43783027,🙏 Jind Haryana 🙏,0.08214285714285713
572,"Colorado18yr ALS Research can now show 90%+ ALS recovery in 6-12 months using stem cell support, while enabling the… https://t.co/NmrbqwxMpI",DanielH03274759,,0.0
573,@ziggy6769 @starrybright @IngrameThomas We had a whole hedge attacked with that disease a few years ago. It stood f… https://t.co/O6g2GHAHmH,KatePotts11,Scotland,0.0
574,"The inclination to label everyone who shows slightly off attitude as ""toxic"" is spreading like a disease. Gotta wat… https://t.co/HLF8Fm3XXT",UmmeHab32934285,"Islamabad, Pakistan",-0.16666666666666666
575,Learn how ACIST technologies promote optimal patient care for cardiac catheterization and angiography by providing… https://t.co/uZPV0PyFF5,acist_medical,"Eden Prairie, MN ",-0.05
576,The top influencer today would be long forgotten tomorrow - and I'll still be slowly dying from a disease no one ou… https://t.co/DCx9TiUwBg,Saltykid41,"Houston, TX",-0.08750000000000001
577,@OGdukeneurosurg Why not Pseudo gout? ! formally known as calcium pyrophosphate deposition disease or CPPD.,tariqtramboo,Relief pain clinic Dalgate Srg,0.0
578,@beansprouts_mom @amandalhu DBH &amp; Dix #GBD #demasking has normalized infectious disease spread. #FireBonnie… https://t.co/jE8zFjnYF3,mtnbvan,The Vancouver Model ,0.0
579,World Without Disease Summit https://t.co/709mgut18k https://t.co/F563RHyOXW,KarolynLeo67579,,0.0
580,"1️⃣🚀 FDA approves first-ever Respiratory Syncytial Virus (RSV) vaccine, Arexvy, for individuals aged 60 and above!… https://t.co/J7Qb1RKLJe",_timos_,Global,0.049999999999999996
581,@cosmichoneyy_ @oubbayy @MamasatHome_ I'm passionate about her not telling me being a land whale is normal. How do… https://t.co/hmmht4ruY6,Matty_Ice254,,0.049999999999999996
582,#ScreenTime from #adolescence to adulthood is associated with cardiometabolic disease in @UCSFPediatrics… https://t.co/Q0MonIbr9q,jasonmnagata,"San Francisco, CA",0.0
583,Stress is the longer term presence of a potential threat. The perception of that threat coupled with a lack of abil… https://t.co/V7OGaVTLjP,DrPalmquist,"Los Angeles, CA",0.0
584,"Presenting our @ERSpublications review of quality of life among home mechanical ventilation users

Covering
🔸Influe… https://t.co/Z82lRjeDbZ",RebDCruz,"London, England",0.0
585,@Sassafrass_84 @WWforUSA Right from the start my intuition said this was a crock/a hoax. history described several… https://t.co/xg2qM9u4l6,JypsyRose666,,0.14285714285714285
586,"@NoWay7790 @krassenstein Good morning, another 500k Americans will die from heart disease this year..",406_sick7,"Montana, USA",0.7
587,@USSGoodGirl The more fit man shouldn't have given the baby back it'll probably have diabetes and heart disease by 30,letsgotwitt_er,,0.3
588,"Regular sleep patterns are crucial for good health. Lack of sleep increases hunger and appetite, raising risk for o… https://t.co/b4JJAJULpR",biocoach_io,,0.2333333333333333
589,It’s that time again! If you’re a kidney patient aged 18-30 and would like to meet other young people living with k… https://t.co/Wv3KqU8lhr,HollyMLoughton,"Manchester, England",-0.041666666666666664
590,"@stats_feed Go vegetarian food,,, with less prone to fatal disease,,",kapilblossom,,-0.16666666666666666
591,"The results from the Phase 3 trial of donanemab are the ""strongest phase 3 data for an Alzheimer's treatment to dat… https://t.co/4Rbqqb5DCs",Rick_Sobey,"Boston, MA",0.0
592,Had a great time at the CHDI meeting last week in lovely Croatia presenting some recent work by the lab! It's wild… https://t.co/CU19MGXWWH,mehkary8,"Toronto, Ontario",0.28
593,3/ A 2011 study from the European Heart Journal showed that moderate alcohol consumption (1-2 drinks/day) was assoc… https://t.co/GKiRTnppnZ,TravisK9Crypto,"Deland, FL",0.0
594,"Thanks @revathijanaswam @SPECNews1BUF Highmark Health, and our local firefighters for helping us get pumped for the… https://t.co/aZB4ICIzxD",LungNE,"CT, MA, ME, NH, NY, RI and VT",0.1
595,Cancer is such a cruel disease 💔,paige_innesx,"Nottingham, England",-0.5
596,"@SeanSean252 Yikes! We had a peach tree that had fruit when purchased, planted it and it took 7 years before fruiti… https://t.co/gC33QY0eYJ",XSnotrocket,,0.0
597,@5lut_ Disease ridden asses… da fuq,russ48239,,0.0
598,"If you only eat the disease you become the disease, if you eat clean stuff then you have a lower probability of bec… https://t.co/MJPGdGhmbx",Jessica_Midder,,0.18333333333333335
599,"They found new land, they just need to plant a flag and start ""re-educating"" the natives while the others die from… https://t.co/1TOLNqtbct",Strang3Stranger,The Void,0.13636363636363635
600,"distribution in the airways.
-Ideal for asthma and Chronic Obstructive Pulmonary Disease (COPD) situations.

It has… https://t.co/czP6VebWuJ",BM_pharma,Nigeria,0.9
601,@REMASCULATE Looks like a liberal so you gotta definitely worry bout lyin disease,JMJNJ,Canada,0.0
602,2. Genetic Engineering: Modifies DNA to create new traits in organisms. This technology has led to the creation of… https://t.co/E0NNioHFIO,iGEMdesign,,0.13636363636363635
603,@Peter_luyolo My family has called me a Grass Eater for years after hearing about my healthy lifestyle choices and… https://t.co/F9gNuvL0wT,MrsDayFajardo,United States,0.5
604,According to the @BBCNews the police intend to arrest those with royalist fixations. Nicholaswitchellitis is a dise… https://t.co/49gwTU7Nwq,terminallytang1,,-0.05
605,"Does your dog need a #heartworm test? Find out in the infographic below.

For vet-approved info on… https://t.co/hnUSO8OWlL",HealthCare_Pets,"Toronto, Ontario",0.0
606,@MLS_Dave It is much worse than we &amp; @CDCgov @CDCGlobal ever thought. Germs cause cancers &amp; early aging. Period. Se… https://t.co/mwPKDxLA15,IamGreening,🌊,-0.15000000000000002
607,Asthma has become a silent killer disease &amp; it's cases are increasing day by day with the rising air pollution. Sai… https://t.co/1Gu0BPfkPF,Gurpree66946189,Bathinda ,0.0
608,"@nitinmeshram_ Don’t bark without knowing the shastras…you are too pretentious, too fake, too much hypocrite to des… https://t.co/m7WEQBhE6i",sushil_bgk,"Pune, India",-0.20000000000000004
609,New Alzheimer's drug slows disease by a third https://t.co/lst1lg2dUm,profgeraintrees,"Hammersmith, London",0.06818181818181818
610,"@moreisdifferent . . . if you have it, you transmitted it. Period. If you are very very lucky you only transmitted… https://t.co/FKMgJj15jA",Schr0dingersKat,In my box,0.21666666666666667
611,@DanielRegha @OfficialDoyin_ Are you suffering from kwashiorkor disease,YbizzyL,my home,0.0
612,My fellow Americans care more about their freedom to spread disease than they do about their freedom to exist witho… https://t.co/DyEfL8smuZ,keltothelean,"South Bend, IN",0.5
613,"@vancemurphy There have always been about 2,000 teens a year who died of heart disease. The most common symptom of… https://t.co/0J3heeVLLT",pewtergod,Earth. There is no planet B.,0.1
614,"Latest insights on Alzheimer’s disease, cancer, exercise, nutrition, and fasting | Rhonda Patrick | The Peter Attia… https://t.co/CXWU5l8B5U",podcastdisclosd,United States,0.5
615,"im super mixed and my passport doesn’t rlly match me 😭)

interesting to see the cultural differences and hope NA ca… https://t.co/CH2psI8Ix5",yoshiohka,top 0.6% 🤍💙 link below 💕 ,0.2333333333333333
616,"@WonderW97800751 There is a long list of infectious diseases that spread by what is called the fecal-oral route, ju… https://t.co/Ph07i95giU",NickMcGinley1,Terra Firma,-0.05
617,"May 2, 2022; AZ Daily Star; Akita Snow, AP reporting.
Cause of death: ""environmental heat exposure aggravated by he… https://t.co/xN1mfMuNXj",BeischJohn,,0.0
618,"Research in focus 🔍

We know that many kidney patients can struggle with their mental health, but how well are thes… https://t.co/TzBbQY8qlj",Kidney_Research,UK,0.2
619,Eli Lilly has announced that its Alzheimer's treatment drug has slowed cognitive decline and functional decline in… https://t.co/aJhPceU9i5,bostonherald,"Boston, MA",0.0
620,"@KetoPortuguese Have you watched any of Dr Ken Berry's videos. 
Especially the information on anti nutrients from p… https://t.co/z56xfETD2W",carboholicKim,Tweets = NOT medical advice,0.0
621,@t1depod i wont you cannot get rid of me im like a disease ☺️,IDOLGAMlNG,ic anmuhopii,0.0
622,I am deeply passionate about advancing the field of Alzheimer's Disease through implementation science and legal ep… https://t.co/ppUHfC4ZJZ,easmbr,,0.07500000000000001
623,#EliLilly #Alzheimer’s #treatment donanemab slowed disease progression in #clinicaltrial. The monthly #antibody inf… https://t.co/pf6hG5Mm92,CMichelW,Paris 🇫🇷 - New York 🇺🇸,0.0
624,europeans love coming to the americas and spread disease https://t.co/GhyUgSpiQl,pulperia_boi,"6969 coolstreet, weedsport",0.5
625,@juliewindsor59 @40yearoldgamer4 @unhealthytruth @Dems4DeSantis24 @ten_comics Did they per chance get Covid at all?… https://t.co/ILilxhZRWn,Peggles12,"Los Angeles, CA",0.0
626,"Not only does weight loss shrink fat cells, but it also decreases the number of them in your body. This can lead to… https://t.co/lJHz4MJCGk",Clara_selfhelp,,0.0
627,"@msralex4 @March_for_Life Pregnancy is a disease?
I judge those that kill innocent human lives. And bad grammar! 👆🏻",MissusHH,,-0.06666666666666661
628,"@arijitchakrav @PeteUK7 @kristenmag Great!👍

Now explain why so many people are blindly willing to accept reinfecti… https://t.co/qgGnxaX4RW",NickMackx,,0.5166666666666667
629,"Mfs just lie about their history online like we can’t do google searches ..

This is a sick disease lol",Young_Based_Rob,where the money isn't ...,0.04285714285714287
630,"In a recent article, an infectious disease doctor of over 30 years explained how observations led her to review evi… https://t.co/kH1f950GVh",anti_agingdoc,"Port Orange, Florida",0.0
631,"Jealousy is a disease, and he's a victim. 😉😉… https://t.co/WaLm3Jsgi4",YooWrites_,YooniVerse ,-0.07500000000000001
632,I could use help with medicine. I found out I have an extremely rare blood disease and I had heart failure. The med… https://t.co/hwVmqVMQfT,CooksKandi,United States,-0.00833333333333336
633,@SVaughn21 A DISEASE LMFAOOOO suddenly c*nversion therapy makes a little sense 😭,rvngeofthsith,they/them | lesbian | 25,-0.09375
