,tweets,user,location,polarity
632,"@Loni26200015 @AnnaSova17 @crmcleod87 Each of your case studies was over the age of 65, already high risk due to ag… https://t.co/IGpUi8eWc1",FreelancerTB,,0.0175
633,"Today is International #WorldAIDSDay, a day to unite to help end HIV &amp; remember those lost to AIDS-related illnesse… https://t.co/un2qeTdaiP",MGLFed,"Arlington, VA",0.0
634,"Asthma is a disease that affects your lungs. It is one of the most common long-term diseases of children, but adult… https://t.co/PMdX06Bot3",icarebilling,"1100 N Wells St, Chicago, IL",0.0625
635,"@MarriRajasekar @mlritin @MLRLaxmanReddy @MlritNss #WorldAIDSDay2022 
#RedRibbonDay
NSS Unit of MLR Institute of Te… https://t.co/EuXA5PnmSI",URS_NUR,Gajwel Constituency,0.0
636,"#WorldAIDSDay2022 
#RedRibbonDay
NSS Unit of MLR Institute of Technology Hyderabad organized Aids Awareness Rally t… https://t.co/c2dXTQ8jDy",URS_NUR,Gajwel Constituency,0.0
637,"HIV weakens a person’s immune system by destroying important cells that fight disease and infection, currently ther… https://t.co/LSuNuZzeVI",StellarMariza,,0.06666666666666667
638,@Michael96303310 No. A disease is something you contract. Addiction is a chemical response within your body.,WarmandFuzzy7,knee deep in it,0.0
639,Chronic kidney disease includes conditions that damage your kidneys and decrease their ability to keep you healthy… https://t.co/feYbISjrI6,Clinical_Renal,"Chester, PA",0.5
640,"Eating too much sugar can lead to unwanted weight gain and diabetes, which is the main cause of kidney disease.… https://t.co/L434JzX6n5",KidneySouthwest,"Arizona, USA",0.18333333333333335
641,"Today is World AIDS Day. 

Let’s take today to reflect on a horrible disease that’s wiped out an entire generation… https://t.co/786hOxhxzK",christinoflores,"Orange County, CA",-0.5
642,"CDC HIV/AIDS Sindh Treatment Centre Ratodero organised Worlds AIDS Day 2022 commemorative walk at Ratodero. Later,… https://t.co/RUIHID7T6E",ershadkazmi,"Karachi, Sindh, Pakistan",0.0
643,"We also need to stop criminalizing HIV. During the height of AIDS panic in the 1980s/90s, many states, including Ca… https://t.co/nVCJ4W1WKp",Scott_Wiener,"San Francisco, California",0.5
644,"Promoting gender equality is even more important during times of crisis caused by war and disease, German Chancello… https://t.co/rHjJ0JYvFG",BW,"Homes, screens, and stores",0.3
645,@punishedcrowman @TheOneOnlyGman @CherryDongerino @Corwin_Labour @AlexODiazNV @_sn_n And if I were a straight polit… https://t.co/LAaPyCO6YX,ReiaTheGeia,"Utah, USA",0.2
646,"@moneal_GA @PeterHotez @GregIacurci @CNBC It's a blood clotting disease, the main symptoms are pretty identifiable… https://t.co/cZuvH7Zva5",bobbylucasxiii,UK,0.1722222222222222
647,"@DARAREONE @Yostylist23 @Mr_Everythng I don’t why I’m entertaining some s***on the bottom of my shoe like you, bye… https://t.co/I5W0Xole2M",CCWhiteside,"Wauwatosa, WI",0.5
648,"""Phable is supported by the expertise of 17,000 doctors and the experience of helping 4.5 million Indians on their… https://t.co/SSJHjzbSPA",socialstarts,"NY, SF, LA",0.0
649,"@glowwh It's not chaotic my dear nurse.
The body just grows weak and finally a simple disease takes you out.
Sio uchungu ata kidogo",MunyuaLK,,-0.1875
650,"When this guidance was issued, an estimated 125 million people around the world were affected by emergencies, inclu… https://t.co/aL5PjX4YsP",IFECoreGroup,,0.0
651,"@SkyNews Guns have been around for years! This is American the disease nation, and allowing the Internet to raise y… https://t.co/qB5fLsPkpS",LouiseD46135339,,0.0
652,"Advent 2022
Today is World AIDS Day. Pray for those who suffer from this disease, their caregivers, and their healt… https://t.co/HbydHZklnI",epiphanythelord,7336 W. Britton Road OKC 73132,0.0
653,"@mlritin @MarriRajasekar @MLRLaxmanReddy @MlritNss @NSSMLRITM @nss_iare #WorldAIDSDay2022 
#RedRibbonDay
NSS Unit o… https://t.co/7z4VqvRjUn",URS_NUR,Gajwel Constituency,0.0
654,@scaryhowlsdad @crumblingviolet @jessieleelee99 @Mitch___Lowe @LaGataRosie @tbas7000 @fireashdustlife @kadamssl If… https://t.co/adXrjV71NR,BMFF0,,0.0
655,"#CrohnsAndColitisAwarenessWeek 

So What *IS* Crohn’s Disease? A 🧵

1/3

#crohnsdisease https://t.co/Fi7eWGcxWh",normanbatesjr,"Virginia, USA",0.0
656,#WorldAIDSDay is a day dedicated to raising awareness of the AIDS pandemic and honoring those who have died of or b… https://t.co/OV0UMF4LTf,CoalitionHemoB,"New York, NY",0.0
657,loveteam culture is a plague that’s been holding the ph industry in chokehold. a disease that should be burned istg… https://t.co/mfoZh7Gaj2,jqsdrgn,she/her,0.0
658,#WorldAIDSDay is dedicated to supporting people living with HIV &amp; remembering those who lost their lives to AIDS. T… https://t.co/tRPLuriz6I,Certara,"Princeton, NJ (Headquarters)",0.25
659,"According to a clinical trial, a new treatment is able to slow down cognitive decline in patients that have early s… https://t.co/vVXJcjvxWS",IndiaToday,India,0.05616161616161615
660,"(2/2) You can browse our entire test menu online at https://t.co/i2643cwJuv, where you can read each test's full de… https://t.co/FHOKiT4ZM2",NeoGenomics,"Fort Myers, FL",0.175
661,"Whether your child's needs are congenital, developmental, or resulting from disease or trauma, our team is fully pr… https://t.co/FBlSV6T4pk",bittybitesrva,"Richmond, VA",0.0
662,"Disease. It considered fair and rational. Come on then, I want
؟?
نمشے

🔹W77🔹
🔹W77🔹
🔹W77🔹",onebr1d,,0.7
663,This #WorldAIDSDay we are 4 decades into the HIV/AIDS pandemic and the goal is to eradicate the disease and end sti… https://t.co/ewAYCDavsq,braderb,New York,0.0
664,"In honor of World AIDS Day check out my book Remnants!!

https://t.co/G2lcrnMXGM

So many people place their trust… https://t.co/EiCrnufOE6",KyeateTheAuthor,"Nashville, TN",0.5
665,"""May we end this life-threatening disease to leave our generations a world free from AIDS."" ""AIDS has taken many li… https://t.co/6kr48stJCe",GLACUHO,"IL, IN, MI, OH",0.45
666,The plant kingdom boasts protective compounds that guard plants against disease. https://t.co/2lHorWposo https://t.co/HfI2xNztT5,HilaryGranat,"Washington, DC",0.0
667,This #WorldAIDSDay we are 4 decades into the HIV/AIDS pandemic and the goal is to eradicate the disease and end sti… https://t.co/8V3Wb6nHab,JMTCTheatre,New York City,0.0
668,@RepThomasMassie @RepMTG Why do doctors and nurses wear masks in surgery?  Do you think they’re worried about catch… https://t.co/RV6G20ss3c,Ddolle2246,,0.0
669,"Africa to receive first batch of 50,000 mpox vaccines via OODA Loop - The African continent will receive its first… https://t.co/xbhRdDChBj",Homeline_Secure,Pacific,0.16666666666666666
670,@thesphynxnft Giving liquidity backed tokens away for real cuz I’m a defi mfer and there’s a disease across the lan… https://t.co/wj9g3loRtN,ForeignSociety_,Lavendar Town,0.2
671,"Our laser will gently treat your gum disease, whiten your teeth, ease your TMJ pain, and more! Lasers are at the fo… https://t.co/q0SOyLUPc5",Dentalmakeoverr,"Vacaville, CA 95687",0.35
672,"Today is World AIDS Day.
Why do we Still have No Cute for this Disease that's still spreading and killing people. T… https://t.co/tWKCXErVOY",EdwardW136116,"Wilton Manors, FL",-0.25
673,Herschel Walker Ex: “He’s a pathological liar. Absolutely. But it’s more than that. He knows how to manipulate his… https://t.co/bproO4HNBM,RpsAgainstTrump,United States,0.35
674,"Cat #fleas #cause #disease in people, so be careful and practice good flea control! https://t.co/avYR3RSwfQ https://t.co/DamyZ35PDk",holisticpetdoc1,"Laguna Beach, CA",0.3
675,"Today, on #WorldAIDSDay, we reflect on the devastating impact that HIV/AIDS has had around the globe. We remember a… https://t.co/6JrQgb8sBO",janschakowsky,"Chicago, IL",-1.0
676,"You give a bunch of worthless employees money and the low T morons ridicule you.

Low testosterone is a frightening… https://t.co/4ndAwgL6AO",cxharme,,-0.42000000000000004
677,Data from the Centers for Disease Control and Prevention (CDC) showed that vaccinated and boosted people made up mo… https://t.co/RS5WbbDbf8,FurstenbergLori,"Washington, DC ",0.0
678,"Immune Resilience: The Breakthrough Plan to Protect Your Body and Fight Disease DPVUFZV

https://t.co/AnTZfkt98i https://t.co/Qs73WP4BAs",oads_s,,0.0
679,"@buildsummer @JUYEONTVB darling has been living with this disease for 15 years, after a childhood trauma. I only sp… https://t.co/JSvA8ij7Um",BodyLan78640315,Europa ,0.0
680,"Hope &amp; Healing, The Case for Cannabis: Cancer | Epilepsy and Seizures | Glaucoma | HIV and AIDS | Crohn's Disease |… https://t.co/Gj08eeScZs",LRohanitm,,-0.05
681,Sex Education is an important as career growth and development studies. A lot of WEALTHY dreams have been sent to g… https://t.co/sLczPTgLnP,kipngeno__kirui,"Nairobi, Kenya",0.45
682,"@connor757 @jungmark98 @kylenabecker Bob, surely even your wife would understand the value of a physical barrier ag… https://t.co/wR2BPEVuwo",here_shitter,,0.25
683,@ReiaTheGeia @TheOneOnlyGman @CherryDongerino @Corwin_Labour @AlexODiazNV @_sn_n If I were gay I would simply not g… https://t.co/VrigGOiPy0,punishedcrowman,,0.0
684,"""Physical activity is an important aspect of overall health and disease prevention, and it’s especially vital for p… https://t.co/C2Mp4V1w6U",PWRGymTucson,"Tucson, AZ",0.15000000000000002
685,"For those affected by Alzheimer’s disease, there are many ups and downs when it comes to potential treatment. https://t.co/j5LbMFxqoo",WTVYNews4,"Dothan, AL",0.25
686,"@MarshaBlackburn If a service member, infected by the disease, in turn infects members of his or her unit, that ent… https://t.co/8PlNPft0yM",JParkerSD46,"San Diego, CA",0.0
687,Congratulations to @PedramMD @RadiologyUcla @UCLAHealth @RSNA2022 @LIRADS5 @uclaVIR on R1-SSGI18-6 - Volumetric Ima… https://t.co/L91KoZdhtT,StevenSRaman_MD,"Los Angeles, CA",0.0
688,"Diagnosing a person with kidney disease means detecting one of the following: high blood pressure, creatine in the… https://t.co/38rfl3yg35",NKFArizona,"Phoenix, Arizona",0.08
689,"@EliErlick Wait I'm confused, is paying taxes a disability or serious disease?",Roedizzal,"Houma, LA",-0.3666666666666667
690,Reading our ID paper and I can’t stop thinking about how awful an infectious disease-themed Wheel of Fortune would… https://t.co/6oY73MgZiF,elora__renee,Florida,-1.0
691,"The next public health disaster may be Long #COVID ... 

| #LongCOVID | #disease | #Illness | #SARSCoV2 | #COVID19… https://t.co/kFsC77VzUO",MicrobesInfo,Earth,-0.016666666666666666
692,you can try and lie to yourself as much as you want. death to disease was a reality forced upon them in a need to “… https://t.co/o4SyoHeXak,hardrockmarxist,"Smalltown, USA",-0.05000000000000002
693,@myklassictweet @ehatch79 @ZemanLynnZ @tedcruz Maybe stick to the science of hitting a ball with a club. The scienc… https://t.co/inqGhWx8wn,VickValecek,Planning Abbott’s retirement,0.0
694,@bowtiedkobra Is administering a ‘vaccine’ that doesn’t prevent a disease wrong?,SovrgnCitizen,,-0.5
695,"Commenting on the drug #lecanemab, Prof Nick Fox @drcionucl @UCLIoN said ""I believe it confirms a new era of diseas… https://t.co/1wLn8KQmft",UCLBrainScience,London,0.13636363636363635
696,"Shawn Roerick carried the blue flower at our Walk to End Alzheimer's Twin Cities in September,  as a person living… https://t.co/ygvUQpg5qT",alzMNND,Minnesota-North Dakota,0.0
697,"Today, in honor of #WorldAIDSDay2022, hear directly from Dr. Fauci about his career defining decision to study HIV/… https://t.co/HxG4E5kcgX",HHSGov,"Washington, D.C.",0.1
698,"Cholesterol is part of the process that ultimately leads to heart disease, but it's not what starts the process. Wh… https://t.co/DR3IiC9E4m",ifixhearts,Get my book at,0.0
699,@PauloEastvan @ElaineCarol3 you gonna start bringing up Lyme disease next lol?,graeme_0,British Columbia,0.4
700,"After discussing nonmedical drivers of health and health care costs Rep. @TomOliverson, ""Primary care can help miti… https://t.co/pWpfb8cvWR",TxPCC,,0.4
701,@oklahomagirl_02 Fine. That's up to you. And I don't believe in forcing anyone to get the vaccine with the exceptio… https://t.co/6naLtfXREX,LeslieHawkGirl,"Tulsa, OK",0.4166666666666667
702,"#WorldAidsDay, observed annually every December 1, is a day to raise awareness for HIV and AIDS, while fighting the… https://t.co/VGXP9r5vRN",CCPHTexas,"Cameron County, TX",0.0
703,"📣 Don't wait until #RareDiseaseDay on February 28 to show your support for the rare disease community! 

👉 Download… https://t.co/R3dpdhQ9ve",rarediseaseday,Worldwide,0.3
704,December 1st is #WorldAIDSDay. To help battle the disease it's important to know your status and get #tested. Learn… https://t.co/cLqPzaB4SY,R2H_NY,New York State,0.4
705,"The price of open borders:

According to the U.S. Centers for Disease Control and Prevention (CDC), fentanyl is now… https://t.co/c7bUVfoZm4",RoyCWill,,0.0
706,@wil_da_beast630 Isn’t a key tenet of science to question science and by doing so advance human knowledge?  Isn’t i… https://t.co/wthnd2SGUh,BillDA2336,,0.0
707,Don't miss the latest episode of #OutoftheBlue! This week's episode: Cardiovascular Benefit of Continuous Positive… https://t.co/qZjVUwR6vU,ATSBlueEditor,,0.36363636363636365
708,"Start your Thursday with a new publication! 🌅

Dr. Scott Pegan's team (@PeganSd) from @UCRSoM examined how a certai… https://t.co/1oZsS593ZR",STEMCELLTech,"Vancouver, British Columbia",0.13636363636363635
709,The USGov is prepared to start a trade war with Mexico because they don’t want our goyslop. Take one look at Americ… https://t.co/LrpqzdfM5A,TyceAlbertP,"Ohio, USA",0.0
710,Deteriorating #neurons are source of human #braininflammation in Alzheimer's disease @salkinstitute @CellStemCell https://t.co/BrU02zJL3Q,medical_xpress,,0.0
711,@sibylle_berlin @Dr_B_Hohberger @klausholetschek Psychological symptoms in (post) infecious disease = psychological… https://t.co/Or7SnrGOxz,Kenny_Drrernat,Europe,0.0
712,"$15 New Member Shopping Bonus! Join now, when you make your first purchase within 45 days, we'll give you an extra… https://t.co/w15nI3CJHm",HDSA,U.S.A.,0.12878787878787878
713,"It's World AIDS Day, and activists will be raising awareness about how the disease disproportionately affects commu… https://t.co/7Ax989iWh7",nbcbayarea,San Francisco Bay Area,0.0
714,"$15 New Member Shopping Bonus! Join now, when you make your first purchase within 45 days, we'll give you an extra… https://t.co/radesgMKwt",APDAParkinsons,United States,0.12878787878787878
715,"Winter conditions can be seriously bad for our health, especially for people aged 65 or older, and people with long… https://t.co/dk737trXPu",Better_RB,"Banstead, South East",-0.13666666666666666
716,"A new Alzheimer’s drug may be able to buy time for people in the early stages of the disease, but after the promisi… https://t.co/ovbVSWHIfR",FrontBurnerCBC,,0.24545454545454545
717,The latest review from the University of Milan found links between periodontitis and both male and female fertility… https://t.co/aUBaC4bbKL,TerraLifeTweets,"New Westminster, BC",0.16666666666666666
718,"They star in “Beyond Xbox: A Player Like Me,” the next film in the Xbox “Beyond” series, which began with “Beyond G… https://t.co/7r0c1nRcCn",wwmstug,"New York, NY",0.0
719,"The best defense is offense. Preventation of disease is as good as an attack on it. For example, Boxers will not be… https://t.co/Lh9y8F6uX7",ichiyozan,千葉県松戸市,0.85
720,"The drug, called lecanemab, reduced the rate of cognitive decline by 27% in a study of nearly 1,800 people in the e… https://t.co/YuFBEqbCCY",woubnews,"Athens, OH USA",0.1
721,"Are you looking for Christmas decorations? 🎄

Stock up on handmade goodies at our Christmas Craft Fayre on 8 Decemb… https://t.co/vqFDsnnSZJ",Sheffunistaff,"Sheffield, UK",0.0
722,"“Nasdaq represents possibilities. It represents opportunities.”
 
@PrecisionHeart CEO &amp; Co-Founder @MeeshaDogan spe… https://t.co/HEI0jfolM7",NasdaqExchange,,0.0
723,"What if Americans had to wait in line each morning to get their heart medication? What about anti-depressants?

Tha… https://t.co/fjiUZ145zv",DonaldNorcross,,0.0
724,On #WorldAIDSDay we honor the victims of the AIDS epidemic and recognize the lived experiences of HIV-positive peop… https://t.co/7tirmIWIYJ,SpencerMuseum,"Lawrence, Kansas",0.22727272727272727
725,"Observed every year on the first of December, a day for community unity in standing against HIV/AIDS, offering supp… https://t.co/cf3CDouzOq",GLSAseven,Global,0.25
726,The water and sanitation crisis claims more lives through disease than any war claims through guns. You will never… https://t.co/2opTk0KYxg,interact__3220,Sri Lanka,0.5
727,"Today is the start of Crohn's and Colitis Awareness Week! Both are inflammatory bowel diseases, and both are more c… https://t.co/0CtnzkeX7V",BeyondCeliac,"Ambler, PA",0.5
728,"🌎Each year on Dec. 1st we come together in the fight against HIV/AIDS, we bring awareness and remember those we los… https://t.co/tN0KcjPc1l",Rx_Post,"Los Angeles, CA",0.0
729,"Dec. 1 is #WorldAIDSDay. To raise awareness and funds for those living with the disease, FUNCTION is hosting the Wo… https://t.co/t2kOLVrj38",globalnewsto,Toronto,0.0
730,"This evening, we will be lighting our clocktower in red in honour of those who have lost their lives to the disease… https://t.co/VcgcfDk0zY",britishlibrary,London NW1 2DB,0.0
731,"The December Issue of JASN is now available online!

This issue discusses parasympathetic innervation of the kidney… https://t.co/JD2XATgruU",JASN_News,"Washington, DC",0.4
732,#NHLBI researchers want to better understand the risk for developing blood clots in the limbs and lungs of people w… https://t.co/VFOUjMR4x6,NIHClinicalCntr,"Bethesda, MD",0.5
733,"Warm wishes on #WorldAIDSDay to everyone, May we put an end to this life threatening disease to leave our generatio… https://t.co/Gx3F92Y1pI",reecoupons,United States,0.6
734,The US Centers for Disease Control and Prevention (#CDC) announced that it will expand wastewater testing for… https://t.co/iuq4YkYTFj,NH_India,"New Delhi, India",0.0
735,"@NShamahDoesNews @iowasnewsnow ""vaping is not an epidemic. Vaping is not a disease &amp; not even a cause of any diseas… https://t.co/P1N81jbFbP",GoBeepUK,"Nottingham, England",0.0
736,being broke is a disease and i be getting cured every other friday😖,tweetlikela,"Florida, USA",-0.125
737,"On #WorldAIDsDay we remember friends and loved ones lost to the disease, and unite with people around the world who… https://t.co/6wKT74olkq",StackhouseJohn,Canada,0.7
738,"Toxic Teeth: How a Biological (Holistic) Dentist Can Help You Cure Cancer, Facial Pain, Autoimmune, Heart, and Othe… https://t.co/P4xvekHTEm",bethel40h,,0.0
739,Pretty packed fundamentals of diffuse lung disease session today! #RSNA22 @thoracicrad #chestrad. I agree: chest im… https://t.co/HfqBmggGN9,DavidNaegerMD,Denver,0.25
740,"World AIDS Day, designated on 1 December every year since 1988, is an international day dedicated to raising awaren… https://t.co/xu8N6Pi60P",bajanfire,Barbados,0.0
741,"With all of the experience, disease and bodies that he brings",Jeansgalore,"London, England",0.0
742,Yes because showing with your daughter is so Moral?  liberalism is a mental disease https://t.co/cNFNOs35z5,MarineGhosted,Free America,-0.05
743,"How to Eat to Beat Disease Cookbook: 75 Healthy Recipes to Protect Your Well-Being 9AY6K5O

https://t.co/YyRQdAE74o https://t.co/ASCBxIqGvp",terryirpkn,,0.5
744,"We never talk about the scores of black children who are left behind when their parent, guardian or support system… https://t.co/bqboK5nPib",50ShadesofKellz,KellyWood Where Its All Good ,-0.18888888888888888
745,@packersloren Same! Apparently it has to do with our adrenal glands. Which makes sense because I had Cushing’s dise… https://t.co/TEsW81EuH5,BillsMafiaG3,"Toronto, Ontario",0.025
746,The Northern Ireland Rare Disease Partnership celebrate ten years of hard work and look to the next ten years https://t.co/8M4IlunJUF,DerryNow,"19 Carlisle Road, Derry",0.0016666666666666607
747,Look forward to moderating the webinar on influence of sex on infectious disease #SGBA with leaders in this field… https://t.co/Ww4EDmjOfP,NMfromUManitoba,Winnipeg,0.0
748,A new drug for treating celiac disease may be an option in the next few years. KAN-101 is a drug that targets recep… https://t.co/ZAkVI9oFcY,schwindtcm,,-0.02121212121212122
749,"@Sky_Lee_1 Most of the deaths in Washington's Continental Army were from communicable disease, today easily prevent… https://t.co/SgxhInVNDY",mcjsa,,0.4666666666666667
750,@ben_a_goldfarb Is there Chronic Wasting Disease out there? Or any other diseases that can come from deer clustering?,gregseitz,"May Township, MN",-0.125
751,One group that can take some credit in changing the fate of the millions of people who’ve contracted AIDS is @amfAR… https://t.co/4AQ049f5aJ,havas_voice,"New York, NY",0.0
752,"Today is national AIDS Day, a day dedicated to raising awareness and education around the viral disease.  Thanks to… https://t.co/IdmHCXKrcf",havas_voice,"New York, NY",0.2
753,"@SkywalkerAgony The WHO never renamed it.
SARS-CoV-2 is the virus, Covid is the disease.",Astariel_,,0.0
754,My prayers for all whom she loved &amp; loved her. Cancer is an insidious disease. (I know I have lung cancer) God Bles… https://t.co/BJMltE65wP,snowlady09,"Wilmington, NC ",0.7
755,"Young people are at the center of this disease. We are victims, perpetuators, care-providers, and we need help in e… https://t.co/sEFzfzJuMh",ormanbangs,Sierra Leone,0.0
756,"New on the Node: The future of model organism research

Laura Hankins highlights the some of the key messages on be… https://t.co/uoL7oMUOIO",the_Node,,0.04545454545454545
757,@PaulaBraydi fun is good. disease is not! rape is not!,BlazeTheFox,,0.5
758,@sarte_dan @smninews @indaysara PDEA is for drugs and substance abuses. If youths are being tempted to turn away fr… https://t.co/ff3YjYLE2q,RHK_Ken,Philippines 🇵🇭,0.0
759,this man is gonna have some disease by the end of this like omg?2):))) https://t.co/H9Ott9d6Jt,quakeskory,she/her latina,0.0
760,@plantationdrip @KhalkeionGenos Immigration erodes the English language. Trashiness and rudeness increases. Quality… https://t.co/ATd78RNNu1,velvet_ironfist,,0.0
761,@MGScott9 @mazzu_lisa @math_sonnets @johnrich More people died from heart disease alone but you aren't going to man… https://t.co/GJxwLmHiMO,JNuthandler,,0.5
762,"I saw some tweets about AIDS is curable by meditation  FALSE STATEMENT❌❌

mediation can only decrease progression o… https://t.co/JWOXTLt2ZO",iamEnayat_,,-0.20000000000000004
763,"Their friends complication, you're probably it. Life is a lifelong disease. Once
؟?
نمشے

🔹H3🔹
🔹H3🔹
🔹H3🔹",shoaib5578,,-0.1
764,"You people know what life is like with more than a dozen illnesses ranging from leukemia, crohns chronic kidney fai… https://t.co/Wqw7i4BIN5",TPettitJr,"Louisiana, USA",0.5
765,"In 2005, Ferguson predicted that up to 150 million people could be killed from bird flu. In the end, only 282 peopl… https://t.co/jbUC21r0eN",LynneDMNoble1,world wide+Gloucs,-0.1
766,Does anyone know why? I don't really understand the mechanism for why vitamin C should be so important in disease.… https://t.co/JmnZozYHXS,arhpreston,"London, England",0.30000000000000004
767,Cognitive neuroscience postdoc on offer - come work with us at the wonderful @UCLHD @UCLIoN working on Huntington's… https://t.co/20ONG0slgk,profgeraintrees,"Hammersmith, London",1.0
768,@leonard_per @MarvinRJeffcoat We have to stop thinking Rep or Dems is God. And mentally illness is a disease. For s… https://t.co/gpMMYkn4mB,TyefiaM,,-0.1
769,"@alendersadloner @catturd2 Here is a small sampling of vaccines that prevent infection 100%, transmission 100% &amp; di… https://t.co/SZq3C9hJh9",BlankWhytPaper,The Free World,-0.25
770,"A whole food plant based diet reduces the chances of developing heart disease,high blood pressure and cancer… https://t.co/eDsV22D4Lu",Kenz300zx,,0.18
771,@CinnamonMelody2 @BeudotEzra @JordanBloch @dklmarxist By well behaved I refer to dogs that don’t eat poop etc. huma… https://t.co/id6ejKgU2K,basedbookshelf,United States,0.0
772,@Yuck15507977 @Thang_1_ @DrSdeG @anna_down Your lack of awareness and ability to google is the only 💩 here - look u… https://t.co/StNJWBwnyY,JinAChlog,Ceanadach in 🇮🇪 (Wicklow),0.0
773,"And absolutely nothing about reducing your risk besides PHARMACEUTICALS; antiviral and 💉.

Disease response instead… https://t.co/hDTUeIC0QH",LynnBCO,,0.2
774,@callmyname_xiao Doing great Xin!! Just finished some stuffs that I needed to do for school while suffering from th… https://t.co/iPfZMkAdaJ,sunshine_ju,Teyvat • Any Pronoun,0.8
775,@successtextpost im sad to say i suffer from this disease,MISSANGELKERR,˗ˋ꒰ 18 | ednos twt circle ꒱ˊ˗,-0.5
776,"John Fund writes:

 epidemiologist Neil] Ferguson was behind the disputed research that sparked the mass culling of… https://t.co/PBeuURMXtv",LynneDMNoble1,world wide+Gloucs,-0.4
777,"#Bales2022FilmChallenge
Day 2: Someone with special needs

Mask (1985) Based on a true story, it follows Rocky Denn… https://t.co/gtTB7AWEDr",DVD_Daddy,'Murica,0.35357142857142854
778,the American Library Association (ALA) puts books in your local library’s children’s section that promote pedophili… https://t.co/Sn8c2xSuFG,SkinmanSD,,0.0
779,"@maosbot It’s not a vascular disease, it’s now nothing more than a mild URTI",ltg1810,United Kingdom,0.41666666666666663
