,tweets,user,location,polarity
312,"NATIONAL WEAR RED DAY

National Wear Red Day, on the first Friday in February, is an annual campaign to raise aware… https://t.co/StBVd4RXif",HeartlandCPR,OKC ,0.125
313,"@Asif_Bachchan @Magnifico778 People are watching Saudi league with arabic commentary just to slate him , bro you ca… https://t.co/XGTrbQ9K3Q",UnitedbyKH,Under the shade…,0.0
314,"Fantastic Fido’s hosted today’s coffee. Many wore red (heart disease awareness &amp; Chiefs). Lori Tally, NTS, provided… https://t.co/1WlE8r5qy6",greaterville,"Maryville, MO",0.3
315,"@jdwalker1912 @lacontroller Noise, fuel, &amp; light pollution are linked to dementia, heart disease, violent crime, &amp;… https://t.co/BDNwgRrY0M",HowTheWestWS,California,-0.2
316,"1- Today, I underwent a CT cardiac scoring exam. I inherited hyperlipidemia from both parents, and my PCP offered m… https://t.co/7v4GQrEF4X",eleftheria119,United States,-0.05
317,February 3rd is National #WearRedDay! Heart disease is one of the leading causes of death for women. It’s important… https://t.co/266FDdH7VD,RIPCPC,Rhode Island,0.2
318,"@patrickdemdude @lacontroller @cwebbonline Noise, fuel, &amp; light pollution are linked to dementia, heart disease, vi… https://t.co/YNYiZJcCi0",HowTheWestWS,California,0.4
319,@AngelaJo59901 @sublimepilgrim Yes they do.  It’s long been known that GBS is triggered from viral infections.  A d… https://t.co/rZ3kyGdTTG,ShaneRoo43,,-0.05
320,👇👇👇👇👇👇👇👇👇👇👇👀👇👇👀👇👇👇👀👇👇👀👇👇👇👇👇👇👇👇👇👇👇Ranchers warn disease that would 'decimate' the cattle industry could cross the so… https://t.co/5mp6VNrDmP,TimCrise,,0.0
321,"Today, our EDC staff is proudly wearing red in honor of National Wear Red Day. We stand with the American Heart Ass… https://t.co/i20MYOvIQ9",fresnocountyedc,"Fresno, CA",0.2
322,Fri-YAY and wearing red to bring attention to women’s heart disease ❤️ https://t.co/awWPKLICWw,RiggsReport,"New York, NY",0.0
323,"@PabloRivet7 @KTLA Noise, fuel, &amp; light pollution are linked to dementia, heart disease, violent crime, &amp; hearing l… https://t.co/kn7FFvH09Q",HowTheWestWS,California,-0.2
324,"@naamakates @SquizzRadical Agreed that it is nonsense, but I think it is an opportunity for incels to learn to comm… https://t.co/VGRTVhg6l0",AldousH31917934,"Gale Crater, Mars",0.0
325,"@SanMargolis @KTLA Noise, fuel, &amp; light pollution are linked to dementia, heart disease, violent crime, &amp; hearing l… https://t.co/57pXa3w0X8",HowTheWestWS,California,-0.2
326,we probably progress disease by doing things against our biology like smoking and fucking family,hollyxhawthorne,the dirty south,0.0
327,Happy #WearRedDay! Today we wear red because heart disease is a leading cause of death for women in NYC. Calculate… https://t.co/wikuHEFk2L,nycHealthy,"New York, NY",0.4
328,February 3 is National #WearRedDay! DYK heart disease is the leading cause of death in the U.S.? We’re joining… https://t.co/ZeQ0ecZ0XS,Unitil,"M-F 7a-9p, emergencies S/S 8-8",0.0
329,LaunchPM team Going Red for Women today! Together we raise awareness on National Wear Red Day to support women's he… https://t.co/9is3VfqvrR,TheLaunchPM,"Scottsdale, AZ",0.0
330,"@MarcSchmidt14 @KTLA Noise, fuel, &amp; light pollution are linked to dementia, heart disease, violent crime, &amp; hearing… https://t.co/koSS66bLrG",HowTheWestWS,California,-0.2
331,"@Paulsha11192885 I’m not saying it’s a moral failing to have high blood pressure, I hope no one thinks that. I’m ju… https://t.co/flG1KfsWHt",CinnixRedux,,0.08
332,#NationalWearRedDay is a day we wear red to raise awareness about cardiovascular disease and help save lives.  Clic… https://t.co/ust9urw7Ju,Odyssey_Family,"College Park, GA",0.0
333,"@Pizzaballz @KTLA Noise, fuel, &amp; light pollution are linked to dementia, heart disease, violent crime, &amp; hearing lo… https://t.co/TyHL9Kw64C",HowTheWestWS,California,-0.2
334,Cumulative Muscle Strength and Risk of Cardiovascular Disease and All-cause mortality: A Prospective Cohort Study… https://t.co/ueAq3HroIS,agingdoc1,Community of #Aging #Biology🌎,0.0
335,Today we come together to shine a light on the importance of heart health for women. We wear red to show our suppor… https://t.co/yIOXDrzNMl,pepperhillrehab,"Aiken, South Carolina",0.2
336,Today we come together to shine a light on the importance of heart health for women. We wear red to show our suppor… https://t.co/iCG4Jk697e,AcuteHomeHealth,"Orlando, Florida",0.2
337,Today we come together to shine a light on the importance of heart health for women. We wear red to show our suppor… https://t.co/haq0h1iUUi,Intensivehosp,"Shreveport & Bossier City, LA",0.2
338,"Join us on #NationalWearRedDay in raising awareness about cardiovascular disease, which remains a woman’s greatest… https://t.co/O4oSy8t94H",my_cardiologist,,1.0
339,@escaped_ferret @msnicole329 @phillipsdo @MrsMelCole @DrSuneelDhand I don’t deny that; my problem was with the abso… https://t.co/Yder4fZQ6p,rosepoptosis,"Edmonton, Alberta",0.0
340,exols caught the lying disease too i fear https://t.co/fyEKcOP1Wl,exotzvrse,「she/her」,0.0
341,"UF Health faculty and staff celebrate February as American Heart Month, and are strutting their stuff in RED today… https://t.co/rTcGDdVVR2",UFHealth,"Gainesville, FL",-0.09999999999999999
342,"@femigbaja You guys should hide your faces in shame.
In a sane society,men like you would apologize with sincerity.… https://t.co/LyKkmvp2nH",godison0,Very Close To You,0.0
343,"Dr. ANTRIKSH KUMAR (Gastroenterologist Liver and Pancreas Disease Specialist) first time in Jamshedpur.

At
BALAJI… https://t.co/FajDDTRGKH",_rakeshagarwal_,"Jamshedpur, India",0.25
344,@abbyduck1 @CateSpice We’re like a plague here🇺🇸Though our Mommy dearest has done her part🇬🇧 to spread the disease,edesinw,Tranzcontinental divide ,0.0
345,@XXL I suffer from that disease. No cure,FoxKingdxm,"Washington, DC",0.0
346,@NotCarryingRam1 @SriramMadras Ur casteist slur stinks. I was the one who exposed jayas link with vv minerals  vaik… https://t.co/Q9wYuOLPA4,JayaramArappor,Chennai,-0.6
347,War is not an adventure. It is a disease. It is like typhus.~Antoine De Saint-Exupery #quotes,NiaSugihara,rangkas bitung,0.0
348,@ObuvKite @XXL You sure do have a disease,Dannyaries___,Hell,0.5
349,The MSDH Office Against Interpersonal Violence is wearing red today to support heart health! Heart disease kills mo… https://t.co/NTgLWsZ8Vc,msdh,Mississippi,0.0
350,This Is The Root of All Chronic Disease | Naveen Jain on Health Theory https://t.co/HK6yd7XJi7 via @YouTube,Amma007,"Akwesasne, turtle island ",0.0
351,"@MissREVO @KTLA Noise, fuel, &amp; light pollution are linked to dementia, heart disease, violent crime, &amp; hearing loss… https://t.co/o7tvXUE2kc",HowTheWestWS,California,-0.2
352,Today is National #WearRedDay! Put on something red to raise awareness about #HeartDisease and explore heart diseas… https://t.co/GAV73QvtaO,MillionHeartsUS,"Atlanta, Georgia, USA",0.0
353,Today is #NationalWearRedDay. It’s a day to help raise awareness of heart disease in women. It’s also a day that th… https://t.co/pefP97ep7Z,baycareclinic,"Green Bay, Wisconsin, USA",0.0
354,"Sources:

https://t.co/1SL1MnJqBF

https://t.co/kr16VmaKL7

https://t.co/70uOm2J55D",shovas,Canada,0.0
355,"Ontario Covid Indicators (Week/Week)

Cases 👇

Positivity 👇

Wastewater 👆

https://t.co/1SL1MnJqBF… https://t.co/eo5ueWhBe0",shovas,Canada,0.0
356,"@princeaiden9 @KTLA @kennethmejiaLA Noise, fuel, &amp; light pollution are linked to dementia, heart disease, violent c… https://t.co/NXusOGU4IT",HowTheWestWS,California,-0.2
357,"On the first Friday of every February, which is designated as American Heart Month, the nation wears red to raise a… https://t.co/wYptiIcHRh",TulsaHealthDept,"Tulsa, OK",0.08333333333333333
358,A first-in-class bispecific antibody achieved durable responses in a fourth of patients with advanced small cell… https://t.co/Ksz5NizvZK,MedpageOnco,,0.1
359,"@mark_sdlitepi @KTLA Noise, fuel, &amp; light pollution are linked to dementia, heart disease, violent crime, &amp; hearing… https://t.co/Xy9UlMQ2UO",HowTheWestWS,California,-0.2
360,"""Millions Still Suffer from Leprosy"" Warns Pope Francis 
According to the Centers for Disease Control and Preventio… https://t.co/qYzO2YE2MZ",gustavokralj,"Toronto, canada",0.0
361,"@CCSACanada @Interior_Health #alcoholawareness Alcohol is a Group 1, toxic carcinogen,cancer causing substance,link… https://t.co/q62iIwDFg2",fscarfe,Greater Vancouver,0.0
362,"@Crystauxx @veronica2629_a @railboss @LakotaMan1 Yes, they knew disease could spread through the blankets in the 17… https://t.co/ENntQK1KBy",MacTrolling,Entertaining your mother.,0.0
363,February 3rd is National Wear Red Day. Heart disease is the #1 killer of women -killing more than all forms of canc… https://t.co/MPAXRAPPpj,debrajweber,"Pennsylvania, USA",0.16666666666666666
364,"“Heart disease is 90% treatable – everyone can PREVENT heart disease anywhere in the world, especially by eating fo… https://t.co/mycGjDxADK",BlueCure,"Houston, Texas",0.0
365,"Weak from hunger and oxygen deprivation, she abandons the nest and moves on in search of food. Not far away, a lone… https://t.co/nJg0gkGojP",IsaiahCTorre,,-0.2125
366,"Dr. Jen, Can we account the increase in cardiovascular disease in women from #scad - spontaneous coronary artery di… https://t.co/5zpe4WTAdk",Karine3Chicago,Mentally in Paris ,0.6
367,"TODAY is National Wear Red Day!

Although we LOVE to wear RED everyday – today it’s to raise awareness of cardiovas… https://t.co/beZ8dV9uoy",southerndst1913,"AL, BA, FL, GA, MS, TN",0.075
368,"Stupidity like this is so rampant in America it's 
like a disease.
Suspect arrested in case of tamarin monkeys miss… https://t.co/XWdSLWxgqz",KARMARedux101,,-0.6
369,"February is Heart Health Month! All month, we'll be sharing tips to help you reduce your risk of heart disease.

To… https://t.co/IgKGu23uCq",Asplundh_Tree,"Willow Grove, Pennsylvania",0.0
370,"@HibernianFC Horrible disease, all the best Ron on your recovery 🙏🏻❤️",HeartsTillWeDie,"Edinburgh, Scotland",0.0
371,@skydog576 @AlpacaAurelius Mice have much faster metabolism and we can control what they eat in contrast of epidemi… https://t.co/CIFxoGrdyr,rlynotvincent,Spain,0.2
372,just woke up and im already wondering why if god is real why is there disease and im kinda chalking that up to human error,hollyxhawthorne,the dirty south,0.1
373,"@SpeakerMcCarthy  IMPEACH JOE BIDEN NOW!
No Chinese incursions our AIRSPACE should be permitted! If we EVER needed… https://t.co/YauwBLTz0u",CooI4Cats,,0.0
374,@againstgrmrs These people should be arrested ! They are spreading an infectious disease!,bascromblake,,0.0
375,"@vintagerebelle @KTLA Noise, fuel, &amp; light pollution are linked to dementia, heart disease, violent crime, &amp; hearin… https://t.co/V2fyT99r5G",HowTheWestWS,California,-0.2
376,"I also have MS, diagnosed at 17, so 20 years. My MS +  no disease modifying therapy would’ve killed me by now. I ag… https://t.co/3KXiCVUaJf",erinryanhey,"Massachusetts, USA",-0.2
377,"It is American Heart Month! At HCH, our highly trained staff in Cardiac Rehab provide a safe environment for patien… https://t.co/D6D5DoGxkk",HCHospital,"Napoleon, Ohio",0.1525
378,"@tach18k @KTLA Noise, fuel, &amp; light pollution are linked to dementia, heart disease, violent crime, &amp; hearing loss.… https://t.co/P7czJIuXrl",HowTheWestWS,California,-0.2
379,"@lkolb01 Thank you so much for helping us raise awareness for women's heart health. ❤️️ Together, we can change the… https://t.co/sVLx3J8PAq",GoRedForWomen,,0.2
380,"“No one prepares us for the mental health side effects of dealing with chronic illness,” he says. #ohmycrohns… https://t.co/sRrhUAHYHb",annmarie309,New Jersey,-0.1
381,"@healthbyjames Do you imply Russia developed a vaccine, built a hospital in Moscow in record time because of the ex… https://t.co/qSLUqhkDO5",KPhilby_Na_Kiev,"Nürnberg, Deutschland",0.1
382,Progress has been made to treat and prevent the complications of #sickle cell disease. Watch our video to learn mor… https://t.co/zXN8FGC9jC,thecuresci,,0.0
383,"“Making sure your heart is healthy needs to be an important part of your health regimen,"" says cardiologist Dr. Jon… https://t.co/my3e7ksqDA",SouthCoastWell,"Savannah, GA",0.4666666666666666
384,"@Filip80005682 @KTLA Noise, fuel, &amp; light pollution are linked to dementia, heart disease, violent crime, &amp; hearing… https://t.co/1CxhLSYYLN",HowTheWestWS,California,-0.2
385,February 3rd is National Wear Red Day. Heart disease is the #1 killer of women -killing more than all forms of canc… https://t.co/IY2G3ci70V,JohnHFlick,"Charlottesville, VA",0.16666666666666666
386,@Saiffreelance @Azvameth @RealMariaButt And plz read it carefully as well medical science DOESN'T consider it a dis… https://t.co/knn0nDHBRk,Gogeta111650,Turkey,-0.05
387,"Having the diagnosis of SCT and working in SCD clinic, I’m aware of the stigma and harm joking about this disease d… https://t.co/QofiXWfhFt",Kristen01852807,Bay Area ,0.25
388,"@markbgger @KTLA Noise, fuel, &amp; light pollution are linked to dementia, heart disease, violent crime, &amp; hearing los… https://t.co/smCUb4ogyi",HowTheWestWS,California,-0.2
389,@XXL putting out any midboy music makes me feel like I have a disease,ObuvKite,,0.0
390,@XXL W disease‼️,LockedInRatio,Youngboy and NLE Enthusiast,0.0
391,"@MysteryAdExec @NightshiftWorkr @KTLA Noise, fuel, &amp; light pollution are linked to dementia, heart disease, violent… https://t.co/eAXogA0sjv",HowTheWestWS,California,-0.2
392,"@cagrown5 Or disease… weird idea,  take a spy balloon fill it with poison or biological weapons then send it up and… https://t.co/Z3eJpPGQnH",DavidCu50060618,Washington,-0.5
393,Beyond Pellagra—Research Models and Strategies Addressing the Enduring Clinical Relevance of NAD Deficiency in Agin… https://t.co/6CWMxc8vvC,Mirella_MeyerFi,"Logan, Utah",0.0
394,@bpajer @sinclair4school @thehoffather @wethegoverned No one ignores risks.  We allow exemptions for school vaccine… https://t.co/O7qSbLA7Lw,handmadekathy,pinging off cell towers,0.0
395,I don't have a cardiovascular disease but this one is causing some palpitations...the HAIR😭 https://t.co/nRSSXT7E3M,CybValle,"Essen,Nordrhein-Westfalen 🇩🇪",0.0
396,"Contact me if you need free treatment for any animal disease
00971552048326",LOVEALLWORLD12,"الفجيرة, الامارات العربية المت",0.4
397,@Sachamarseille1 @atensnut Is she the lunch lady everyone claims to be eating all the kids deserts?  Hahah…you woul… https://t.co/oQMMqB3Ohr,Bird36640180,"San Francisco, CA",0.0
398,"@h8XqUTCcUa7nfSY @KTLA Noise, fuel, &amp; light pollution are linked to dementia, heart disease, violent crime, &amp; heari… https://t.co/cDNhEKKr7Q",HowTheWestWS,California,-0.2
399,"DETAILS: NBA YoungBoy says he has a disease of putting out too much music 🤔

https://t.co/FjqGgAy2bQ",XXL,,0.2
400,"@mandovizion @KTLA Noise, fuel, &amp; light pollution are linked to dementia, heart disease, violent crime, &amp; hearing l… https://t.co/vP3sQ0Iwdx",HowTheWestWS,California,-0.2
401,jealousy is a disease and i HAVE IT https://t.co/vQCt9okohu,ilove1dbroo,louis house,0.0
402,"In an effort to prevent American foulbrood disease, a fatal bacterial disease commonly found in honey bees, the USD… https://t.co/F6pFz9YSTU",PCOpro,"Bay Shore, NY",-0.15
403,February is American Heart Month. Learn about the risk factors for heart disease and if your individual health puts… https://t.co/rKvVTKFZ8h,HITE_SITE,"New York, NY",0.0
404,"@holliplex @cszabla ""We can only assume that Covid resulted in undiagnosed brain inflammations that manifested itse… https://t.co/HmZwCLQ9fF",ellinst,around,0.0
405,Today is #WearRedDay in honor of American #HeartMonth - a time to draw awareness to cardiovascular health. Cardiova… https://t.co/6YBCSaoy11,Welldoc,"Columbia, MD",0.0
406,@HibernianFC Horrible disease. Get well soon Ron❤️,FreeNwakali,,-1.0
407,"@maybeelse Yeah, and it looks like it ramps up pretty quickly once age hits like 50 (for cancer) or 60 (for heart d… https://t.co/g105Kg3XIR",humanisque,,0.29166666666666663
408,@Sora48091 @Mrbandot1 @SebGorka @RepMTG I mean to the second point have you ever heard of HIV? People are spreading… https://t.co/AA9sBk5orW,JSeabisquick,,-0.15625
409,Herpetic Eye Disease After SARS-CoV-2 Vaccination: A CDC-VAERS Database Analysis https://t.co/x275TrcSt3 #Cornea… https://t.co/M79tbr2xu5,CorneaJournal,,0.0
410,Wear red to raise awareness about cardiovascular disease and help save lives. Why? Because losing even one person t… https://t.co/PDcgyedCDv,slSurgicenterls,"Lee's Summit, MO",0.0
411,"The Nation Goes Red in February (and not just for the Chiefs!)

From local landmarks to online communities, neighbo… https://t.co/3QrTAY2JzE",slSurgicenterls,"Lee's Summit, MO",0.0
412,@KaiseratCB I think a lot of British “celebrities” suffer from a disease called verbal diarrhea. Why must they answ… https://t.co/uQvUZCqqXj,tma285,"London, England",0.0
413,@DailyLoud Wonder what new deadly disease they’ve accidentally concocted this time.,PainedCuler,,-0.03181818181818183
414,@solanaisaul @redpilled678 @TheRealKeean Guilty of what? Trying to keep their land while populations were being des… https://t.co/x1dZTKo2z8,gordbouch,"Hamilton, Ontario",-0.5
415,"Leading cause of death in women, heart disease. Welcome to Tulane @TulaneMedicine Dr. Samar El Khoudary #WearRedDay… https://t.co/m5K0EtTLaF",AJPRenalEIC,"New Orleans, LA 🏴󠁧󠁢󠁷󠁬󠁳󠁿",0.8
416,@drugsarecooI_ the disease??,sausageIy,21 ,0.0
417,Study shows Indigenous #patients with autoimmune #liverdisease face worse symptoms and outcomes @ualberta… https://t.co/GIqwAlvJUA,physorg_health,,-0.4
418,Knowing more about the relationship between thyroid disorders and diabetes can prevent one or both conditions and i… https://t.co/L53XAw4Cim,LompocVMC,"Lompoc, CA",0.5
419,"Geriatric Problems like Cognitive Impairment, Falls, Polypharmacy increase with Kidney Disease. Likewise, Kidney Di… https://t.co/3kMk6rnEQ5",LeeLindquistMD,"Chicago, IL",0.0
420,Lower Division students are partnering with Engineering Tomorrow to determine the time required to treat Grover’s D… https://t.co/J7n3NsQJI4,CSSJBronx,"Bronx, NY",0.0
421,@GinAndTonic1965 @pnw_vetprincess @HWMcgee87 @PolitiBunny @ESugarloaf @prof_mw @Acyn @AOC Even worse for the contro… https://t.co/tZKYoMUtRW,cat_gorm,,-0.4
422,"@jaweihan lobsters don’t stop growing through their lifetime, outside of predators they only die from disease or fr… https://t.co/bFkPCFuvZg",ceegetlizzy,reppin the set,0.0
423,"Held on the first Friday of every year, #WearRedDay helps the American Heart Association raise awareness of… https://t.co/l7M17xtk67",BayCommunityHC,"West River, MD",0.125
424,@PlutosNumberOne I have an addition to that - Pluto owns a flowershop to cover up his Hanahaki disease /shot,kreide_bruch,,0.0
425,The Town of Irondequoit supports the effort to bring attention and show importance to heart health and the preventi… https://t.co/5TfIuxB6nj,irondequoit_ny,"Irondequoit, New York",0.0
426,Today is Wear Red Day! The American Heart Association recognizes this day every year to raise awareness to cardiova… https://t.co/bfMZhbE3w9,irondequoit_ny,"Irondequoit, New York",0.0
427,It's National Go Red for Women Day and happening now the City of Columbia is hosting an event at City Hall to raise… https://t.co/aiF77bM9a7,abc_columbia,"Columbia, SC",0.0
428,"Without the use of #pesticides, one of the America’s most popular beverages would be at risk! Unprotected, up to 10… https://t.co/2KE7YkksNG",CropLifeAmerica,"Washington, DC",0.55
429,There are more than 23 million people living in active recovery from a SUD today — yet the pervasive narrative that… https://t.co/O5HZKGzN2u,CaronConnect,"243 N. Galen Hall Road, Wernersville, PA",0.18333333333333335
430,"Get your red out! We wear red to raise awareness about cardiovascular disease and by coming together, we can save l… https://t.co/9VI1DcUyx7",Jazz_Char_Hall,,0.0
431,#Biostatistics Journal Club. Hui Zheng @MassGeneralNews will discuss machine learning approaches to visualize disea… https://t.co/tjxwsjAUnh,HarvardCatalyst,"Boston, MA",0.0
432,"Important!⚠️ FDA approves #elacestrant for patients with ER+, HER2- and ESR1 #breastcancer variant of advanced or m… https://t.co/foeSZlP7sU",Dr_Ivanoncologo,"Puebla, Pue.",0.4
433,"@JamesAria1 @KTLA Noise, fuel, &amp; light pollution are linked to dementia, heart disease, violent crime, &amp; hearing lo… https://t.co/CKxToeUChm",HowTheWestWS,California,-0.2
434,"Educating and Diversifying Clinicians to Help Overcome Gaps in Parkinson Disease Management: Eli Pollard 

#MedPub… https://t.co/uf6t0d372f",MedPubNeurology,Look here 👉,0.0
435,"@Tikosricos @KTLA Noise, fuel, &amp; light pollution are linked to dementia, heart disease, violent crime, &amp; hearing lo… https://t.co/8WppB0UpIJ",HowTheWestWS,California,-0.2
436,"@JennyErikson ""A teacher put my kid in a mask to stop them from getting a deadly disease if you want to know what i… https://t.co/9rZGoQQffm",Lexaclarklover,,-0.2
437,"@Grt8Trails @KTLA Noise, fuel, &amp; light pollution are linked to dementia, heart disease, violent crime, &amp; hearing lo… https://t.co/GiKncJrd1n",HowTheWestWS,California,-0.2
438,"As part of our #PetDentalHealthMonth observance, the AVMA has released two new videos to help pet owners improve th… https://t.co/9BKgvphF6N",redaguessoumdvm,,0.13636363636363635
439,"@Captaintrips74 @AllenShrugged I never said anything about the death rates of other things

And yes COVID has been… https://t.co/dIhESS4qmA",greg_travis,The Midwest,-0.125
440,"#Mushrooms are a rich, low calorie source of fiber, protein, and antioxidants. They may also mitigate the risk of d… https://t.co/Wxx782PBPK",Joy14163779,"California, USA",0.1875
441,"@BrianMcNutt @KTLA Noise, fuel, &amp; light pollution are linked to dementia, heart disease, violent crime, &amp; hearing l… https://t.co/O4CVoVwVwx",HowTheWestWS,California,-0.2
442,Antioxidants in olive oil can reduce the risk of many diseases that include heart disease and also a few types of c… https://t.co/h6HanIfSnm,EVOOPremo_,Online Only,0.15
443,"Here in Coral Springs, we value the health of our employees. Today, we wear red to raise awareness of the actions w… https://t.co/apyHG4OINL",CoralSpringsFL,"Coral Springs, FL",0.0
444,"Valley fever is an infection of the lungs and causes respiratory symptoms like a cough, difficulty breathing, fever… https://t.co/adse02ENBu",FOX5Atlanta,Atlanta,0.0
445,"@kilogrammlite @KTLA Noise, fuel, &amp; light pollution are linked to dementia, heart disease, violent crime, &amp; hearing… https://t.co/tW8YS6z3CC",HowTheWestWS,California,-0.2
446,"@TheDemocrats Foot and Mouth Disease (FMD) is a highly contagious virus that affects cows, pigs, sheep and other an… https://t.co/ihhb3fJzUq",stepper44,U.S.A. MAGA TRUMP 2024,0.0175
447,"#Alaska wears Red in honor of National #WearRedDay and to raise awareness of heart disease, the #1 killer of women,… https://t.co/MmdO8HUIO8",FishingResort,"Ketchikan, Alaska",0.0
448,"Today is National Heart Day! A day to raise awareness of cardiovascular disease, the world's number one killer. Wea… https://t.co/X7vr0xHPrT",WanikaFisher,Maryland,0.0
449,"@daininspace @KTLA Noise, fuel, &amp; light pollution are linked to dementia, heart disease, violent crime, &amp; hearing l… https://t.co/xntop1UUSI",HowTheWestWS,California,-0.2
450,"@MarshaBlackburn Democrats fix unemployment, roads and bridges, disease,pollution...
Republicans lie, steal, and tw… https://t.co/2eKXFM8C6h",twentytwestions,"Poughkeepsie, NY",0.0
451,@66MrKaline @ebtapper @juanpabloarab @Dr_Vijay_Shah @geneyim Dear Mark. Thanks for sharing your story. Most transpl… https://t.co/XEzQob1Fxh,rabataller,"Barcelona, Spain",0.35
452,This Is The Root of All Chronic Disease | Naveen Jain on Health Theory https://t.co/r8eRdn5IDM via @YouTube,BarryAn27934981,,0.0
453,"On #RareDiseaseDay, the rare disease community will #LightUpForRare!

Join the ✨ Global Chain of Lights ✨ by:

🔦 Il… https://t.co/ggGpRovew4",rarediseaseday,Worldwide,0.15
454,Happy National Wear Red Day! Today we're wearing red to raise awareness for heart disease and stroke among women. L… https://t.co/sD8IOWbvGO,ACP_DCchapter,"Washington, DC",0.26666666666666666
455,"Colorado18yr ALS Research can now show 90% ALS recovery in 6-12 months using stem cell support, while enabling thes… https://t.co/C8DS0Fi44N",DanielH03274759,,0.0
456,"TKP: Air pollution emerging as a not-so-silent killer

Nepal is among countries with highest age-adjusted death rat… https://t.co/yE04xutpLT",Nepal_News_En,"Kathmandu, Nepal",0.0
457,Katalyst turns RED! We want everyone to live a heart-healthy life. Below are CDC tips to lower your risk of heart d… https://t.co/13bRdO5sRQ,Katalyst_Group,"Cincinnati, OH",0.21212121212121213
458,The MyCare Team showing off their red today to support National Wear Red Day 2023 and help raise awareness to heart… https://t.co/pCBeCmTRlv,MyCare_Health_,"Center Line, MI",0.0
459,"Tools developed by federal agencies to help you conduct your disease prevention research, including databases, asse… https://t.co/ELocoVPKpz",NIHprevents,"Bethesda, Maryland",0.1
460,"We have a massive problem in America. Our toxic food supply is a public health issue

Who is thinking about this fu… https://t.co/szczf69Pur",StoneColdPillar,"California, USA",0.0
