,tweets,user,location,polarity
0,"Hope on the horizon for those fighting this deadly disease
@letswinpc @lustgartenfdn @PanCancerCanada  💜 https://t.co/KSC1WNWcly",yegjohnny,"Edmonton, Alberta",-0.2
1,"@VitruVN Cant take an L like a man going out sad lmao 

This is why it took you 500 years to conquer a technologica… https://t.co/TQYxOEQFNR",Alec51100718,,-0.5
2,"Positive preclinical results have been announced by @RedxPharma for #RXC007, which is being developed to treat… https://t.co/A2wa6elbF9",RareDisease_Adv,"New York, NY",0.16363636363636364
3,"So sorry for your loss. As a survivor who has also lost a sibling to this insidious disease, we are reluctant membe… https://t.co/mAmWEAZzur",DreherLou,,-0.5
4,@Lance_Dudley @BuckSexton About 100 days of sunshine per year. SAD DISEASE,Coach_Rusty,North Carolina,-0.5
5,"@UCBUSA Thank you so much for joining us, and for your continued support of the community impacted by psoriatic disease.",NPF,"Headquartered in Portland, OR",0.2
6,"@DeAngelisCorey There was a pandemic. Apparently Republicans would've been just fine with 2,000,000 Americans dying… https://t.co/sLkYgg05k8",brassman3141592,The Bronx,0.23333333333333334
7,#ParasKalnawat was on medications still he never revealed about it till the end &amp; spondylitis is a lifelong disease… https://t.co/QwJVdqyp7C,ParvengerJDJ,India,-0.1
8,"I’m a veteran with a brain injury &amp; neurological disease that results in cognitive disability.

I still know Hitler… https://t.co/VGfwp18N5O",Tara_Writer,,0.0
9,@DaphneT57763104 @HabsBillsfan @billyphillyboi @RobertCahaly @trafalgar_group @HerschelWalker @ReverendWarnock… https://t.co/ZTBMdi54UV,jim98800218,,0.0
10,"This Gulp of Engineered Bacteria Is Meant to Treat Disease

A small study of people with a rare disorder that preve… https://t.co/P4tcjLMl2b",SMediaNut,World,0.024999999999999994
11,"Where are the other layers? 
#LayerUp #ForUsAll as the Goverment Slogan goes.
Vaccines/Boosters = 1 Layer
And if it… https://t.co/uHjvUUrV67",vicmidnightsun,Ireland,-0.125
12,Exposure to higher concentrations of air pollution linked with chronic kidney disease risk https://t.co/flgXwQjJEO,SOCAAR_UofT,"Toronto, Ontario",0.25
13,"A few days after Bayer ended its collaboration with Ionis, the biotech is trudging forward with another program it… https://t.co/qPHGKfs4ZV",endpts,Global,-0.2
14,I think it’s bc of Lyme disease. https://t.co/yepFAhZyAs,parodymyass,Py.,0.0
15,"@Advjalila Virility , corruption, violence propaganda and the idea of him being great leader = all five components of strongmen disease !",shaintaj,"Balochistan, Pakistan",0.35000000000000003
16,"@monacharen While the total U.S. violent crime rate does not appear to have increased recently, the most serious fo… https://t.co/T8vvz8yjNo",Joe74912,,-0.15833333333333333
17,"Could only dream of sleeping on floors and passing disease around like sweets on a playground.

Do you represent pe… https://t.co/dL9dvyZKTf",CarnorJax87,The United Kingdom,0.0
18,"Deep Question.
Especially when health &amp; disease management agencies through the world over COVID-19 “fact checking”… https://t.co/rLHlDwgY91",kayzone2260,LOS ✈️ ABV,0.0
19,Addison’s Disease in Dogs: The Guide for Pet Owners https://t.co/LLMGgfU1WN https://t.co/B1OkT3VPZl,toptips_dogs,"Detroit, MI",0.0
20,"@POTUS USA destroys families and lives. you make money from the disease and the drug trade, you allow thousands of… https://t.co/pf2t0GrgkD",KalimaSvetlana,,0.0
21,All earlier vaccines were developed without genetic modification. I never got a disease I was vaccinated against.… https://t.co/jDc5gUvV0a,htmcg,USA,0.05
22,@btsreignishere oh wait. For a minute jwae disease got me and made me forget hes actually loud as hell 💀,nymeriawoIf,JHP Entertainment,0.1
23,"The longer a patient is ill with Lyme disease before treatment, the longer the course of therapy must be, and the m… https://t.co/iBMvNSMHME",RobertCAyala,"North Region, Singapore",-0.5
24,"7th November is observed as National Cancer Awareness Day, on this day we must make efforts to spread awareness abo… https://t.co/j2eggtnVRi",drm_kir,,0.0
25,Garden Tip of the Day: There is a new Phytophthora disease that mum growers have to worry about. Phytophthora chrys… https://t.co/q51umJFU0e,WDCGardener,"Washington, DC",0.13636363636363635
26,@btssomma JEALOUSY IS A DISEASE AND I HAVE THAT,Ot7girl10Ot7,,0.0
27,Did you know that people with diabetes have a higher risk of developing heart disease? This National… https://t.co/oYOlGykxPI,CDCHeart_Stroke,"Atlanta, GA",0.25
28,Is Crohn’s Disease’s Cure Around The Corner? https://t.co/LQk3OwexMp,GilmoreHealth,,0.0
29,Nas - King's Disease III (Promo) #KD3 #shorts https://t.co/BnAIaJdRr4 via @YouTube,QueensHipHop,The land where stars are born,0.0
30,@BThereallukey @_evelynrae Mental disease.,SousaSRMateus,SP,-0.1
31,"Weekly pathology ‼️‼️
Menieres disease ✨👂🏼🧠

#neurosurgery #medicine #medstudent #medschool #meded #disease… https://t.co/uYeljtQA4m",missionbrainES,Espanya,0.0
32,"Lastly, I hope to normalize chronic illness - despite receiving surgery there a chance the symptoms will resurface… https://t.co/z6HM26imPC",katie_orona,"Cambridge, MA",0.0
33,Personal update: I was recently diagnosed with #endometriosis. It is a chronic inflammatory disease that has no cur… https://t.co/b1zDj6cIlI,katie_orona,"Cambridge, MA",0.0
34,@MartinJ_MND Sending love and prayers. I pray they find a cure for this disease. 🙏,_M_A_Z_Z_A,Somewhere special,0.5
35,New @cziscience grants help expand metagenomics capacity in several countries around the world. Through this commit… https://t.co/2NJ4k1nO1o,StephenQuake,,0.06818181818181818
36,"At the same time: longer life expectancy, less hunger, less disease, less infant and maternal mortality, more wealt… https://t.co/40RIcPYBcE",JoeyFox1,Indiana,0.0
37,A randomized clinical trial of lipid metabolism modulation with fenofibrate for acute coronavirus disease 2019 |… https://t.co/HwoWgWjO4M,ParentSecurity,,0.6
38,"There's a feeling. The feeling of two people being desperate for one another, but still unsure if they can hold the… https://t.co/Cqe7wlvsJ9",beombeombot,,-0.6
39,"Closing windows to keep warm this winter 'increases health risk' - Metro
So die from disease or die from hypothermi… https://t.co/b2Z8kwZegW",Michael53418170,"Bexhill, England",0.6
40,@jj__george Agreed. He wasn’t a good person. He could’ve been one and that’s what’s really tragic. We’ve seen the s… https://t.co/xllf6M7V20,drealities,Metro NYC,-0.025000000000000022
41,"If people going to COP27 think this is anything even remotely like a plausible scenario, they should lose their job… https://t.co/diTtQmtDON",CuriousnTT,"Sandnes, Norge",0.2
42,I cannot believe that one of the new insurances offered through my employer had Crohns Disease listed as a chronic… https://t.co/qi0SGEQa5a,kenzieibd,Oregon,0.13636363636363635
43,"@AudreyJeanne I believe the demonizers of these foods meant well, to reduce rising cases of heart disease.

But the… https://t.co/tz9liEv8kq",jason_muthomi,Telegram 👉,0.0
44,The idea of implanting brain chips to people for enhancing their memory might be useful for study of Alzheimer's disease.,nagayama0706,,0.3
45,"Prophetic!🧐

""A common cold virus could be given traits from the AIDS virus resulting in a highly communicable dise… https://t.co/tAAZMnw6qY",covidiotsavant,,-0.24666666666666662
46,"@fuckoff104 i have pulsating tinnitus because of a brain disease, but i have been obsessively cleaning my ears beca… https://t.co/xBcEsHKPOX",mushvampykcaIs,"they/them, tw: ed",0.0
47,"@horrormuseum Demodicosis, a skin disease caused by rapid over-multiplication of demodex mites, is more likely to o… https://t.co/tm4nW6gVyH",AlixBurack,,0.25
48,"@VP USA destroys families and lives. you make money from the disease and the drug trade, you allow thousands of chi… https://t.co/Wjk13ufGx5",KalimaSvetlana,,0.0
49,Lost a dear friend of mine to addiction a few weeks ago. Today I learned one of my best friends just lost someone t… https://t.co/GHVnHQray2,meghancolleen,,0.4
50,"Croí was delighted to attend @fhpatienteurope's Annual Networking meeting.  

1 child is born every minute with #FH… https://t.co/YwhWU93Nyh",CroiHeartStroke,Galway Ireland,0.7
51,"@michaelmalice I used to feel that was true, because I was surrounded by intelligent people who I could actually de… https://t.co/pOBQpvbgKl",andyalmq,NY,0.3833333333333333
52,"@lisa_iannattone In trying to keep it simple stupid for those people, can we reframe covid as a “respiratory” disea… https://t.co/pXydH2LWNm",CherStrong0,,0.0
53,@rein_reeee they have every disease known to man,KadenKilljoy,he/him ,0.0
54,Lipid profile test is carried out to check adults and children who are risk prone to high blood cholesterol value a… https://t.co/Ln1UG1Cr34,everightlab,Nigeria,0.16
55,big man at the helm of this site has a real case of sad fuck disease if you ask me,griffski,she/her - library city,-0.09999999999999999
56,@LeorSapir It is a disease marker. Using this language signals both prioritizing a harmful belief system and failin… https://t.co/ZMkBRKFjYU,anethum_dylla,Forest of Arden,0.0
57,"@Deiloh @ShellyChildre15 @Die4weasel @euph_22 @ken3598 @glentonrich @BoogerCory @elonmusk Yes, they do and display… https://t.co/KDLvUdpx87",DuayneSharpe,Texas,0.0
58,"@SkinnyboyTunes The UK seems to suffer from a disease of failing to recognize what should be valued, while at the s… https://t.co/zXx5ETX5Mi",tobisonics,Luxembourg,0.0
59,"@mcuban As we saw with the 'covid' nonsense, we see that those that had been considered 'true' and those that were… https://t.co/tMOBLLLSQw",TruthFrqncyNews,Earth,0.35
60,"Then have to go to an Infectious Disease Specialist since my first TB test was inconclusive, recent Xray ruled it o… https://t.co/laHksvZNsY",okami_hylia,Skyloft,0.125
61,"@SomeDude1942 @WayneDevlin5 @TristenLavalle @JustinTrudeau Well polio needed 4 boosters at first, this particular d… https://t.co/OpWCCKlbZl",bliddiar,St. Catharines  Ontario Canada,0.20833333333333331
62,@RepThomasMassie Every Republican KNOWS that vaccines cause disease. Who can blame them for refusing to give up the… https://t.co/IWp3WQYolp,david_barkin,,0.0
63,"As Roche prepares to take a kidney disease drug into PhIII, Ionis fleshes out the data - https://t.co/bAHhfP4kpR",E2DGr1,"Ile-de-France, France",0.0
64,"13/ Once you’ve made the diagnosis of GIST, the next step is risk stratification. Not all GISTs behave aggressively… https://t.co/NotpvLvwUI",RaulSGonzalezMD,New cases posted every Monday and Thursday-ish,0.0
65,"you'll never get rid of me, oh i'm like a fucking disease",futilebot,admin in following,0.0
66,"During #NationalDiabetesMonth, join us in spreading the word about how people with diabetes can protect their visio… https://t.co/DJ6JiOK3q9",NatEyeInstitute,"Bethesda, MD",0.0
67,"The true face of smoking is disease, death and horror - not the glamour and sophistication the pushers in the tobac… https://t.co/hPPITQi5r3",FajecLKKPI,Greenland,0.35
68,@EdwinBrillante @LakelandLlc @MikeStuchbery_ @Timcast @elonmusk If you can't understand your POV is driven by delus… https://t.co/bektrRil7a,kennazfehu,Hyperborea,0.0
69,"A new #Epi job posting from the Armand-Frappier Santé Biotechnologie Research Centre. Tenure track position, all re… https://t.co/RfrxhEYKbt",Atlantic_PATH,"Halifax, NS, Canada",0.13636363636363635
70,The state Health Department confirmed Legionella was discovered in a large number of samples at the facility and sa… https://t.co/Fmu6frX8Q7,ESTechLab,"Louisville, Kentucky 40206",0.30714285714285716
71,"@CurtisWass @PremierScottMoe @SKGov @JeffWaltersSask @CarlaBeckSK @MMandryk @NightShiftMD @picardonhealth So, homel… https://t.co/2zWe1dmraW",DennisKendel,Saskatoon,0.0
72,"Watch this month’s recipe video for Pozole here: https://t.co/HuZwC0wzL4 

The Food Distribution Program on Indian… https://t.co/aOHw7ndBZS",ITCofMichigan,"Sault Ste Marie, MI",0.0
73,Feeling pressure is quite common but getting overwhelmed with stress can lead to various health issues and mental p… https://t.co/RXATGv0Vf9,GeneticsAmerica,"Delray Beach, FL",-0.13333333333333333
74,"SeaStar Medical’s Lead Product Candidate, the Selective Cytopheretic Device (SCD), Included in Consensus Statement https://t.co/KQQBKpc89i",CrweWorld,"Las Vegas, NV",0.0
75,"$ICU NEW ARTICLE : SeaStar Medical's Lead Product Candidate, the Selective Cytopheretic Device (SCD), Included in C… https://t.co/QaN78gjuns",StckPro,,0.13636363636363635
76,“Achieving these milestones and reducing disease is only possible with strong and committed partnerships.”  - @ijaz_kashef,CarterCenter,Worldwide (HQ in Atlanta),0.14444444444444443
77,"@ritson44 @wotisay @Akpbglobal @JustStop_Oil Look, mate. 100% honest here:

We KNOW the climate is going to make th… https://t.co/9fHtX8SqVh",5p3ktrum,Free Europe,0.6
78,@HunterWumpus @SuckleOnMyBalls @CBSNews It's not bigotry to defend children from chemical or physical mutilation for a disease of the mind.,BDolackAMG,The Boondocks,0.0
79,i say all of this as someone who does consume processed food because i live in a major city and dont have time to m… https://t.co/NylmlsjNky,kaworukcals,he/it/she | bmi 17.5,0.09943181818181818
80,Peripheral arterial disease is the leading cause of amputations in the U.S. Research presented #AHA2022 found surge… https://t.co/AcwVHgA7c5,EverydayHealth,United States,0.0
81,Every infectious disease scientist that leaves twitter makes me more powerful,HellewellJoel,"Nottingham, England",0.4
82,Mocking a disease that *still* kills 2500 people a week is certainly a decision… https://t.co/SHeodhtzoE,blvckcement,10880 Malibu Point,0.21428571428571427
83,@RachelCDailey The same with Chronic-Fatigue/ME. The disease is identical in almost every respect to Long Covid. It… https://t.co/PRSzZXgDQw,johnandi,Cornwall.,-0.025
84,@britbratcali @BillyM2k @elonmusk That i why i hate my gov that it literally sold itself and ourself to murican gov… https://t.co/4coLuRxOXq,PiotParf,,-0.8
85,Prof Helen McShane: 'These findings give insight into what kind of immune response is needed in a new TB vaccine.'… https://t.co/XTET6Pnrng,UniofOxford,"Oxford, UK",0.36818181818181817
86,From a 1949 study. An important reminder that we only entered the era of widespread vaccination rather recently. Be… https://t.co/xwn6BsbgbX,Max_Goerlitz,,0.13333333333333333
87,GLP-1 receptor agonists &amp; semaglutide are game changers and can really change the course of heart disease. Watch my… https://t.co/iiUxKVbjRa,CMichaelGibson,Harvard Professor & MD,-0.1
88,&amp; y’all got 22 disease’s 😂😂😂😂 https://t.co/nrxHFG5DEA,ShmackHarv,purchase your tracks today ,0.0
89,"@SatelitaRzeszow @gary_graefen @RonnyJacksonTX I didn't say you couldn't, but I will debate your erroneous belief t… https://t.co/5OVuxb17cS",cosmos_mother,Earth 🌎 ,-0.5
90,@B1844Constance @squishsmawmaw @foxinngamerTTV @Alvinastrickla @FreeAtLast2021 @dreamin_jade @secularprolife You're… https://t.co/fJB4UMe8R4,clebtheviking,,0.0
91,Thrilled about the first of its kind 3 yr. data w/ @DrJasonAndrade &amp; #Medtronic #cryoablation tech. Data showing th… https://t.co/UEApzY33cT,SeidelRebecca,"Minneapolis, MN",0.48333333333333334
92,The biggest disease this day and age is that of people feeling unloved,MahaiCHSYX,Falkland Islands (Malvina,0.0
93,"@VibezyRBLX It would be immoral to bring somebody back from the dead because they may be confused.
Not feeling pain… https://t.co/36CgJkI3CK",Gasterboi2,Nowhere,-0.20000000000000004
94,"@gerdosi 
I suspect you will agree with this paper.
Level A recommendations: the vaccine does not show efficacy at… https://t.co/oYgsmGzvvf",ESpacetime,Cyberville,0.0
95,"@sandypriester @googlenews The authors are saying that Long Covid produces similar processes in the brain as ""schiz… https://t.co/FkDN8ssBxI",fundthescience,"California, USA",-0.025
96,"@connellyandrew @AdamBienkov Can only dream of  being a squalid, disease-ridden detention centre. Not the sort of s… https://t.co/0gmpc3G9MX",White692742,,0.0
97,"Guwahati: Conjunctivitis is an eye disease or viral infection of the eyes which commonly causes redness, swollen ey… https://t.co/ttA9l74Wce",thetruthin,India,-0.3
98,"Guwahati: According to a student who recently suffered from conjunctivitis, the disease is spreading mainly among t… https://t.co/rmUisnR2yu",thetruthin,India,0.08333333333333333
99,"@HecticTeacher @cursesinvogue I'm feeling all of this for 4 days by now, even the cold sweat, I'm only 35, but obes… https://t.co/HBxGglsKTC",that_sad_woman,,-0.3
100,"@cheriloo I don't know how to copy
But I fully understand how terrible cancer is 
I lost 2 sisters to this terrible… https://t.co/DqKgzNiMzg",GaleaGalea13,,-1.0
101,Large-scale #metabolome profiling in Tartary buckwheat! The results will facilitate genetic improvement of… https://t.co/EpCGC0poMV,MetwareGlobal,,0.21428571428571427
102,"@bigpazi1 @Oluomoofderby She’s still bloated, she suffered Kidney disease that retained water in her body.",daplustic,"📍Vancouver, British Columbia",0.0
103,Monkeypox—What Pediatricians Need to Know : The Pediatric Infectious Disease Journal https://t.co/gJLSSTY2Dc,NawalAlKaabi,Abu Dhabi,0.0
104,@stellamydog Yeah because taking precautions so people with HIV disease or those on chemotherapy don't get COVID or… https://t.co/NaZL4Y3HeX,JoshKrugerPHL,philadelphia,0.0
105,"HUGE EXPLOSION In Australia Cancer, Ischemic Heart Disease &amp; Cerebrovascular Disease Deaths After Vs https://t.co/TpJ2yhtXj9",videosean,"Columbus, OH",0.4000000000000001
106,"This Lung Cancer Awareness Month, Rohit Godbole, MD, board-certified pulmonary disease physician, will share a uniq… https://t.co/dchm2bt5Zz",RiversideHospCA,"Riverside, CA",0.0
107,Symptom. Disease. https://t.co/Gg91pW95yi,JeffLieber,"Venice, CA",0.0
108,"@PrisonPlanet 3) Coincidentally, visited cardiologist in Nov 2019 to prepare for retirement. A lifetime of good hea… https://t.co/NqZgjQu8ou",paul_apfelbeck,Alaska,0.7
109,@elonmusk @InfamousInsania Thass all well and good. But y’all be bannin people for prayin someone gets a disease n… https://t.co/1n7volOKzP,kiddinmesmalls,terrancewtf’s #melancholyamiga,0.7
110,RGT Asteroid is ideally suited to the grain distilling market where it has found favour with end users. It is highe… https://t.co/SGY5wmBoPl,ragtseedsuk,"Ickleton, England",0.9
111,@itsbackwereover At least not a war on disease,noxraptus,,-0.3
112,Often times we forget that addiction is a disease of selfishness and self centeredness. Seeing a lot of interest in… https://t.co/8JcQI4IhuK,RichLux713,"Houston, TX",0.0
113,"@wheresrosinow @LifeFreedomFam @anthonyfurey Check your facts. Hundreds of thousands? Covid killed 46,000 Canadians… https://t.co/A75XdLh020",Cerendipitous,"Langley, British Columbia",-0.2
114,@DougColorist @SerafinaGroup @KathyHochul @NYCMayor @nyc311 @NYC_Alerts911 @leezeldin I’ve lost many loved ones to… https://t.co/zZrZrv54Nc,lauradandre,NYC,0.6
115,"#NewAlbumAlert💯🔥🎶🤌🏾✨✨✨✨✨✨✨ #KD3💯🔥👌🏾By @Nas - King's Disease III https://t.co/GWHHTPn1ey via @YouTube
Produced By @Hit_Boy #Available #1111",PromoBoombastic,"Toronto, Ontario",0.0
116,@joncoopertweets Maybe he suffers from this disease! https://t.co/aMi8d0DX9p,sh1cfd,,-0.6
117,"@CBSNews Good because gender dysphoria is a mental disease, not a physical one.",BDolackAMG,The Boondocks,0.19999999999999998
118,"Doctors were starting to suspect Covid was not just a respiratory disease but a blood vessel disease.
https://t.co/3NDU3GnhhU",ReeshamRasheed,Male',0.0
119,Laziness is the British disease said my ALBANIAN taxi driver - JAMES WHALE !! What a load of horseshitte  https://t.co/OcJchOsqDI,markqpr55,,0.0
120,@ToxicUnicorn19 @mackkloserr @netflix An estimated 40 - 50 million people died during World War II. Many died from… https://t.co/fu4hyndjpT,PGLohan1,"Galway, Ireland/Orlando, FL",0.5
121,@kelly_j_baker Thank you for doing this. I can identify with almost everything on your list. Living with this disea… https://t.co/0eKp9TAIyZ,badnocall,,0.0
122,@RobSchneider THIS!!! So many people around me now have moved from California but are unable to see the disease tha… https://t.co/LxpxscT3ll,tyken_mccalson,,0.0
123,@dansmith2022 If you don't think it's important to understand how viruses transmit fair enough but many people are… https://t.co/onU30Nthmb,PeteUK7,UK,0.4
124,"@YohDood HLD was a tale tied directly to the creator, showing his fear of an unavoidable death due to heart disease… https://t.co/8UhH6O1Mew",RealTankTheta,Thank you Dad.,-0.012499999999999997
125,@fasc1nate Life always finds a way. I think generally we have an irrational fear of rats. The disease carrying narr… https://t.co/XqchnROfMf,LiamGarvey8,,0.05000000000000002
126,LeBron literally says that a lot and has been quoted saying it over the last decade numerous times. Here are just 3… https://t.co/Xz9ssSqvJv,SuperDopeHipHop,"Indianapolis, IN",0.0
127,$AMRN NEW ARTICLE : Amarin adds 13% as independent study supports heart disease therapy https://t.co/kChqGcGl2V Get… https://t.co/NB86CQbVEX,StckPro,,0.06818181818181818
128,"Monthly clean out starting @1902Hsfc today under mercy,grey and rainy skies🌱🌧 @DennisMowers brushed length ways the… https://t.co/sncQMYqaGU",CarelFourie015,"England, United Kingdom",0.07916666666666668
129,@clinewilson212 @Phepsy__ @Temmy1118 Shebi Naso your mama and your siblings get chronic disease 😒 don’t cap about t… https://t.co/ppkn1vP4vq,uglyfinegeh,"Birmingham, England",0.0
130,Great thread on a very impressive paper by @MarkCanney and @SeanJBarbour showing that there is a small absolute ris… https://t.co/0AKYHDMePu,BryceBarr9,,0.4375
131,@aoifewalsh10x The way I spin kings disease 2 is so crazy 😂,mannysharpz,London,-0.6
132,"Check up with /u/anthropology_nerd for a lesson on how the human body fights disease, develops immunity, and tackle… https://t.co/a4hPnhnuH8",askhistorians,,0.0
133,"Check out these 7 tips for parenting with a chronic condition, like thyroid eye disease (TED). We’d love to hear wh… https://t.co/o8iWo3t5PR",ThyroidEye_HU,,0.5
134,@alexmeshkin There are quite a few variables to consider here. One that stands out to me is that it may be the case… https://t.co/w7jG8GwFc1,Aaron_Kincer,,-0.2
135,Jealously is a disease and I have it https://t.co/UIVYRU2Eia,Harryscurl28369,Ns larrie|| he/they,0.0
136,"Infectious disease preparedness is not only possible, it’s already happening. To protect us all, the global communi… https://t.co/lbUsMeRy1u",DrTomFrieden,"New York, NY",0.0
137,"I'm not sure if this topic interests you or not, but
 What would you do if your son, neighbor, or friend had a pati… https://t.co/BbaQNIoid3",magdyabdul,"القاهرة, الهضبة الوسطى بالمقطم",-0.25
138,@saltsims @mackkloserr @netflix An estimated 40 - 50 million people died during World War II. Many died from tortur… https://t.co/Zg2qpWAAFh,PGLohan1,"Galway, Ireland/Orlando, FL",0.5
139,"$ICU SeaStar Medical’s Lead Product Candidate, The Selective Cytopheretic Device (SCD), Included In Consensus State… https://t.co/BBEqyemNal",FastestAlert,,0.0
140,Bruxism in awake dogs as a clinical sign of forebrain disease: 4 cases | #ECM #VetMed https://t.co/aJ09EcjC0Y,ProfVeterinario,"Strada della Moia 1, Arese",0.0
141,"@PiotrTrebisz The U.S. has also worked collaboratively to improve Ukraine’s biological safety, security, and diseas… https://t.co/sVh8xIxwa1",DMicdrop,"Terre Haute, IN",0.0
142,"$ICU SeaStar Medical’s Lead Product Candidate, the Selective Cytopheretic Device (SCD), Included in Consensus State… https://t.co/kICaAfvXqb",stock_titan,,0.0
143,@WorldwideTrials is seeking a (Senior) Project Manager to join and grow our #RareDisease and #Respiratory program.… https://t.co/hFhws0P9Fb,staciea2011,,0.0
144,"A major trial evaluating Jardiance®, showed it reduced the risk of cardiovascular death and chronic kidney disease… https://t.co/z6gGAwJhyw",PharmaReview,United Kingdom,0.0625
145,"Living with metastatic disease is a challenging, and often an all-consuming complex process. Join our discussion ab… https://t.co/nRhcxVWxni",CHNw,"Indianapolis, Indiana, USA",0.1
146,Installing sneeze guards can help in stopping the spread of dangerous airborne microbes: Click here to find out how… https://t.co/X8ThsqbueN,Absolute_SAS,,-0.6
147,"Community advocate Stan Smith is taking the initiative to begin an Alzheimer’s disease support group in Thomaston,… https://t.co/TQNbfDKWZx",TheUpsonBeacon,,0.0
148,Long-term consequences of food insecurity among Ebola virus disease-affected households after the 2013–2016 epidemi… https://t.co/KHtXCR51Y1,GlobalBioD,"Seattle, WA",-0.05
149,An Alabama mom won a $21 million verdict against two doctors and a nurse practitioner at Jackson Hospital in Montgo… https://t.co/CXFJcjKm9O,aldotcom,Alabama,0.0
150,@meaningfulideas @Brookltnwilliw @StephenKing Liberal propaganda made people think you'd die without one. The masks… https://t.co/c5Atri9n2r,MarshallWeber,,-0.1
151,@cathy_finnis This is utterly baffling. Surely the professionals in GOSH understand that whatever your health statu… https://t.co/kmBFaDbBA9,strawthatbroke,,0.25
152,Finacial stress on the parents translates into physiological stress in the children.  They didnt inherit anything i… https://t.co/sX5INJmncg,Meinards85,"Riga, Latvia",0.0
153,Doug and Stefanie Kahn's generous donation will help support the operating expenses of the newly established Alzhei… https://t.co/nPYzWvxa4d,MaryEKlotman,"Durham, NC",0.13636363636363635
