,tweets,user,location,polarity
0,@TMZ It's like people wanna see her die of heart disease,MarkieTrill,"Texas, USA",0.0
1,@5lut_ Keep your self over there there you disease ridden red coats,luvturn,"Manhattan, NY",0.0
2,"@MobilePunch Since efcc stated arrested and bursting young boys,has it in anyways reduced or stopped cyber crime ?… https://t.co/gZRkSugULL",logical_pyper,Somewhere,0.1
3,Post cancelled I just remembered I'm bad at life and existing on this earth yes it is a pattern yes I will do it ag… https://t.co/8W0kV6V737,MudLoach,Poo Poo Town USA,-0.6999999999999998
4,@Sesyline_KE Revenge is a disease,truth_sa_,"Giyani, South Africa",0.0
5,"anyone of us could get motor neurone disease, it’s like cancer. it simply doesn’t care if you’re young, old, fit, h… https://t.co/iHiSsMzNbu",pedrospastel, alphabet community🌈,0.15000000000000002
6,"We can struggle with other enemies, pain, suffering, disease, injury but strength and courage cannot overcome death… https://t.co/X7VbQMPw3S",AngieMarginez,Uganda,-0.125
7,@jallepap @evolutionarypsy @MarkELindsay And there are additional problems like C-spine disease/DJD. Plenty of midd… https://t.co/gGH5TUfrii,dawso007,Minnesota ,0.0
8,@snrrkle The logic virus being a technical form of Red Eye disease definitely fits well! Also I dont think the two… https://t.co/Wu9296QlP9,PostiiNieR,The Nightlands,0.0
9,Apparently suffering from foot in mouth disease. https://t.co/6Nv5zsL7M1 https://t.co/CfzHihZXji,arrmshotels,"Delhi, India",0.05
10,"35% is a breakthrough, but I hope we something disease-modifying right around the corner https://t.co/YhP2nR2Tmj",ArtemyShumskiy,Bali,0.2857142857142857
11,"I asked AI to write a poem about infectious disease doctors! Here you go- 

Infectious disease doctors, brave and t… https://t.co/Ih62G16EfB",MasannatF,"Sioux Falls, SD",0.8
12,"@RealMrsKuhl @Nationals @Nats4Good @ThePrevivor @BreastCareDC Breast cancer chose the wrong person to tangle with,… https://t.co/iW6gU8H4un",EngberJohn,United States,-0.5
13,"For any new followers, please give my @ENDALZRacing account a follow as well. No politics, no controversy, no hate,… https://t.co/fMgj0bpLAG",jaxhockey,"Jacksonville, FL",0.2681818181818182
14,"@LumoAlter14 @CounterStrikeW @ScrimWarren @Eyelithios @cringesonicfan @ShitpostGate That's not a disease, that's de… https://t.co/6PLSNqryV2",hirumikun2,,0.0
15,"@brianlilley Oh are you a doctor now? An infectious disease specialist? 
No?
Then sit down lilley. We've killed eno… https://t.co/hKGdsqmjWr",Ms_Christine_D,Toronto ON,-0.1777777777777778
16,@5lut_ Bringing disease to foreign nations? How very British of you.,_King_Kairo_,"Missouri City, TX",-0.0625
17,Only 2% of all sperm donors are black and they wanted one that doesn’t carry the same disease genes as Judy. https://t.co/8KgqFFzO5M,2xDeja,DalHouston,-0.05555555555555555
18,Coming 5.5.23 to Pediheart - an important conversation about mental health in chronic disease. Why are rates of dx/… https://t.co/Oemqa0nnaS,RobertHPass,"New York, NY",0.15000000000000002
19,"Two new studies, while both observational, suggest that the longstanding practice of prescribing beta blockers for… https://t.co/F7WbaY3to9",statnews,,0.13636363636363635
20,IL-2 has been shown to increase within 4 hours after gluten ingestion in those with diagnosed celiac disease. This… https://t.co/KZnZyJakjZ,CCAceliac,"Mississauga, Ontario",0.0
21,"Sociologist Jonathan Kennedy rewrites human history in ""Pathogenesis: A History of the World in Eight Plagues.""

As… https://t.co/7WxDMBhf0H",WorksAndDays_,,0.0
22,"This month is #BrainTumorAwarenessMonth, and we hope you'll join us in raising more awareness about this terrible d… https://t.co/0OlACHi2J3",carsonleslie3,"Dallas, TX",-0.25
23,"""He was vision-impaired and had numerous serious health issues, but Brooklyn rescuers were determined to help him a… https://t.co/vcSBdubRue",ColeTheBlackCat,"Tampa, FL",-0.16666666666666666
24,"From The Daily Telegraph??!!

https://t.co/gc0E774r9b",CovidSolidarit1,,0.0
25,@lyssasphere Prion disease. A protein that matches a host's protein type won't trigger immune response. It's only a… https://t.co/BADG9dRcsx,Zar_Nioclas,Between the living and dead,0.0
26,@Censored4sure @RWMaloneMD @delbigtree @SabinehazanMD @Alec_Zeck everybody needs to BOOST this to all the big names… https://t.co/s5scFO5bKz,themechanic0000,,0.0
27,"“Masks obscure facial expression; contribute to feelings of isolation negatively impact human connection, trust,  p… https://t.co/q2Q9ldYHoE",lemanrb,"Charleston,S.C.",-0.15
28,#POZStories Facing the Facts: Knowing that #HIV was a manageable chronic disease helped Kesy Pillay-Höss with his o… https://t.co/8V7vQj1Ppv,pozmagazine,"New York, NY",0.0
29,"Lyme disease can be transmitted by an infected tick quickly

Transmission of Lyme disease and other infections can… https://t.co/GdExqDuOcQ",TracyMansolillo,Rhode Island,0.10416666666666666
30,"Hating is quite an emotional disease. So for those who hate me.... They all need to get well soon. 

No wonder… https://t.co/jJv4ZRUQh6",cheelay7277,,-0.4
31,@ojrose_ @nate_robinson He has kidney disease bro,Flip_3xx,City Of Dreams ,0.0
32,jus got diagnosed wit “wettest pussy ever” disease 😭😭 yall pray for me fr😭😭😭🙏🏽,taatianaxo,pluto,0.0
33,Lance Reddick died of heart and artery disease .....Please follow to show support..... https://t.co/b0X67Pl5NH,abt_live,India,0.0
34,"@Jexo_XIII The reality of the situation is, cats are domestic animals, which means they were domesticated to be ins… https://t.co/s9j06XK2js",Kaiijumon_,Area Zero,0.0
35,@xintra They're protesting for the right to sterilize and castrate unhappy children.   Because projecting adult sex… https://t.co/IGRa95NTDb,weejoy,california,-0.07142857142857142
36,Hey #indiedevhour! Check out this well-executed Plague Beam. Leading the enemy army into a choke point sets things… https://t.co/VHYRmLMOUT,ageoffeargame,Poland,0.0
37,"@MsAmitripped What are you talking about mate? 

It’s like you make these little stories up about what I’ve apparen… https://t.co/YXHbEGWqlG",candy_clowns,"Bristol, England",-0.1875
38,May is Amyotrophic Lateral Sclerosis (ALS) Awareness Month. For people diagnosed with this rapidly progressive brai… https://t.co/Qg26t2nKtL,ABFbrain,"Minneapolis, MN",0.0
39,"Today, the U.S. FDA approved Arexvy, the first respiratory syncytial virus (RSV) vaccine approved for use in the Un… https://t.co/ZxABjm7hCk",AgnieszkaSzust3,"Lublin, Poland",0.25
40,@clairem_sl @Sol_bits @HumansNoContext what makes you think that i suffer from parkinsons disease?,WomanAfraidVry,Ireland,0.0
41,"@TeslaAndDoge @stats_feed Naa bruh.....

When someone falls ill to fatal disease with serious symptoms, even the mo… https://t.co/xJR1ZAcnmB",HeyAnalyst,Dunya,-0.41666666666666663
42,@JeonSlayerAce @Min_Seonhee @statsforbangtan Like crazy was separated in its first day. They don’t count English ve… https://t.co/mHySM6vArN,ell01120,,-0.11666666666666665
43,"I'm such a nostalgia merchant, shit is a disease",cosgeyyy,lulusia ,0.0
44,"@PostiiNieR Right! And I think it's specifically infected with Red Eye Disease / whatever the thing is, which means… https://t.co/liBLuXTANg",snrrkle,"Online, on the Internet",0.14285714285714285
45,@Starchild199269 Eveyln being trapped for more than 200-300 years is actually terrible and scary given she was prob… https://t.co/a1iI9jL9uV,chaostheory343,,-0.3
46,"Describe the communicable disease (causes, symptoms, mode of transmission, complications, treatment) and the demogr… https://t.co/qtPLw2EAVV",WAssignmentspro,,0.0
47,"BBC News - New Alzheimer's drug slows disease by a third
https://t.co/OEX2Ynomgx",amstelnews,"Amsterdam, Nederland",0.06818181818181818
48,"@April__Addams @OKWildlifeDept Armadillos carry disease if you touch them.  I know you see one in UK, but you might… https://t.co/gpqpD9IN7H",newco93452,,0.0
49,"#ALS_disease is a slow motion catastrophe! 
It slowly paralyzes your muscles but not your sensory nerves.
In 2018 m… https://t.co/YighfGxXSV",CharellWyatt,"Los Angeles, CA",-0.30000000000000004
50,"if they are undercounted by 10x: severe disease becomes 3% so 1 in 30 roughly need oxygen etc.

Whatever way you wa… https://t.co/wDf4k1Tk8S",EnemyInAState,,-0.1
51,"@MelonieMac By my understanding God deemed foods unclean because they carry disease and because they rot easily.

F… https://t.co/ezBAttOHVJ",RedNosedTruth,Apocalypse from Revelation,0.43333333333333335
52,"When it comes to equity in the healthcare system, there are glaring differences in the prevalence of peripheral art… https://t.co/eRmsLuKi2f",cookvascular,"Bloomington, IN USA",0.0
53,Deflecting is a disease. My Gawd .... so many pathetic adults can't just take responsibility it's so sad to witness. 😪,sapiosexual_cee,"Brooklyn, NY",-0.3333333333333333
54,Where you hibernating when your cult was dragging BH's disease and for enlisting in public service way before your… https://t.co/CgKclPvPdI,baekessence,EXO ONLY ,0.0
55,@anyoldashley @newsobserver You injected yourself with a toxic experimental substance that can't protect you from a… https://t.co/ceBY06ejfR,5gisweapon,,0.1
56,"Today's Topic is How to lower blood pressure. High blood pressure, also known as hypertension, is a common health p… https://t.co/tRvIJTi8ZM",healthtipsforr,,-0.06999999999999999
57,"At the @KelseyTuoc household, Smallpox Eradication Day is a moment for celebration https://t.co/zRVGbLg7jK",bryanrwalsh,New York,0.0
58,"@allkpop My question is why is he going to do it as a social worker, does he have a disease? why public service worker?",BeingsOth,KÖLN,0.016666666666666666
59,"@sebpowell @RWMaloneMD Well, since nobody has taken that particle and introduced it in a healthy host and caused di… https://t.co/DM3r0VNW9e",KingKon92680857,,0.5
60,Covid Hospital Protocols Destroyed Thousands of American Families https://t.co/XrPlBIpx0x Someday there may be a mu… https://t.co/ByX7E04zXo,MicheleSchiesse,"Spotsylvania County, Virginia ",0.0
61,“More political and public awareness of the plight of the world’s crops when it comes to fungal disease is crucial… https://t.co/q31s3Lu26q,clminks,huSTLe City,0.125
62,"@PapaKing73 The man funny

Him say e dey cure one disease like that abi",kemmartins,portharcourt rivers state,0.25
63,@Kaafir_insaan Islam is a disease,BidensToenail1,,0.0
64,@fiercalicious @luxxnoirlondon ealousy is a disease,finnlvnd,"Toronto, Ontario",0.0
65,Jealousy is a disease and I’m SICK. he’s my bias when’s it MY TURN! https://t.co/QKn30Ixaz1… https://t.co/lIkm857g8Y,7moon81,"06, she/her infp-t SC",-0.7142857142857143
66,"@ObiWK88 @lavern_spicer Serbia has about 9million people.
Maybe things that work there don’t work when you have 350… https://t.co/JrDAALNGKe",LarryWilton2195,,0.0
67,"BBC News - New Alzheimer's drug slows disease by a third
https://t.co/pAS6hwc7K4",sandygill32,"Ohio, USA",0.06818181818181818
68,"This is a positive development. Donanemab, a new drug for Alzheimer's disease, has shown promising results in a cli… https://t.co/gd7OdS7NXP",VinzenzReinecke,,0.1878787878787879
69,"Today's Topic is How to lower blood pressure. High blood pressure, also known as hypertension, is a common health p… https://t.co/BZuVleECra",healthtipsforr,,-0.06999999999999999
70,"@rhynopowered @brownecfm @GreatDismal Not sure if this is sarcasm or not, but of course it is. You can’t be repeate… https://t.co/hQo1zutAAD",FashionableRes1,,-0.25
71,"@EffieMcAvoy @BmbEmpower Hope you had a great day. Me, I found out the hard way not to cross-contaminate my kitchen… https://t.co/JjptN5y5C3",GreatDadof5,"Tucson, AZ and West Philly!",0.16944444444444443
72,@RepAdamSchiff YES!!WE MUST BE RID OF THIS DISEASE!,LegalModerate,"Bronx, NY",0.0
73,"Feng Xin has awkward moron disease but like, kinda hard to blame him cuz like.... what do you even say lmaoooo espe… https://t.co/5Q6hCmMGyH",transwolverine,,-0.4458333333333333
74,ok i rly need to stop retweeting things before i finish reading the actual tweet… this is some kind of trigger finger disease,mintlit93z,,0.3666666666666667
75,theSome have questioned how reliable the case fatality rate and severe disease rate is given that so many cases are… https://t.co/ImdtaoEXaW,EnemyInAState,,0.5
76,"@alzheimerssoc If it only slows the disease by seven months, please explain the headline of how the disease can be… https://t.co/rwhg4TQLBa",Chelan96831786,"NW, England",0.0
77,"@mcribbHistory The Peninsular War definitely deserves more attention, far bigger conflict than most appreciate. Sta… https://t.co/w0QNBNE974",GerardPHorgan,"Cork/Corcaigh, Ireland/Éire",0.22000000000000003
78,"You see disease of just want to be correct even if its on the wrong side 

Is a major plaque",Mighty_20,United Kingdom,-0.21875
79,@rusty0216 @davidtheirl84 I think in greenhouses they even use co2 generators to improve conditions for plants.  Th… https://t.co/lze5M0CDpy,anti_disease,,0.0
80,"@ndeverydayistay My question is why is he going to do it as a ""social worker"", does he have a disease? why🧐?",BeingsOth,KÖLN,0.03333333333333333
81,PhD candidate Morgan Robinson who is under the supervision of @SUPCCBeazely is talking about the “The interplay bet… https://t.co/GLI8DCBiGT,alistairkcchan,"Waterloo, Ontario",0.0
82,"Next Weds! Spread it around. Like a disease that’s good for you. 

https://t.co/sjw7EXljvt https://t.co/pJ45P0zkEy",MrMadness,"Passed out in Orlando, FL",0.35
83,not me being an actual disease when it comes to hanbin.. turned my entire household into stans 😭😭😭 https://t.co/r0Hiax6VNX,hijabifilm,hanbin pmore twd tlou & games,0.0
84,The Eye in the Sky: Detecting Disease Outbreaks from Space https://t.co/DqsfKKqbgn https://t.co/zHM6lfrAvn,CGlobalProgress,,0.0
85,@sho3ko I’m a disease remember,m0nke_yy,,0.0
86,"“So while May 8 isn’t a conventional holiday, in my house we celebrate it as one — with piñatas shaped like the sma… https://t.co/EkhchdVaUz",jasoncrawford,Boston,-0.14285714285714285
87,@hedsaymommy living in the dorms is like a ceasepool of disease,monsteralover8,The Netherlands,0.0
88,Hasbulla is just Joe Pesci with Benjamin button disease,slz4_,"Austin, TX",0.0
89,"""... like crash victims, but also parents experiencing difficult childbirths, those facing cancer and people living… https://t.co/EtMjYBPmY7",CGALawFirm,"York, PA",-0.5
90,"""We were intubating sick patients very early. Not for the patients’ benefit, but to control the epidemic.""

For me,… https://t.co/JtSYQlKuc1",johndefeo,New York City,-0.29214285714285715
91,Looking to score a job at Atrium Health? You're in luck. Click the link in our bio for the job description and info… https://t.co/Wxwz5l347r,tmj_nct_eng,"Triad Area, NC",0.0
92,@VisscherJp @UkraineInEurope We are a disease spreading around the globe 😌,uuuomo,A tribe called women,0.0
93,"@comicxbook Chris Pratt is a horrible person, he hides behind his beliefs to hide his horrible person by belittling… https://t.co/EyrYMVtlIH",CriminalThunde1,México,-0.7999999999999999
94,New Alzheimer's drug slows disease by a third.. really positive news #neuroscience and proud of my daughter who has… https://t.co/bXXtf6DbN2,myobstetrician,Arya from the North ,0.2909090909090909
95,"@Racethetrain45 @srburris That’s a ridiculous statement. Foxx has been smoking over 30 years, since the early 90s,… https://t.co/noeCu8WQ4q",Mandiana_Jones,"Orange County, CA",-0.11666666666666665
96,May is Lupus Awareness Month. I have been living with lupus for the past 14 years. My aim is to share information a… https://t.co/sEEwFnWSiZ,dejaymom,,-0.25
97,seriously the greens should’ve kissed team blacks ground that they walked on cause 🥬 are a literal disease and done… https://t.co/tlJbS3wHmE,theeitgirl_, she/her 22 🇵🇭🇨🇦,-0.3333333333333333
98,"Novel immunotherapy approach benefits patients with melanoma, leptomeningeal disease https://t.co/lBbYuPR9FI",leowaxmderm,Ciudad México,0.0
99,"Government (etymology: gubernaŕe menté) means, ""control over minds."" 
STATISM is a terminal disease, masquerading a… https://t.co/1v6IGrNT0U",ChUnKyPoOp_1976,,0.0
100,@tyongstrife “Red Velvet Disease” 😂. Sounds like a legit name for a real disease.,MetalCaptain99,"New York, NY",0.1
101,@IsagiHive Disease ho gayi h,slayyyybestiee,,0.0
102,"@KagutaMuseveni The problem we have always kept treating the signs and symptoms and forgot about the real disease,… https://t.co/xYhRoeOUfN",mondayboaz,Uganda,0.2
103,@KW33NSOHI9H She really childish and about to have Heart Disease.,yeahhhyadig,Tha Creole Cockpit ⚜️,-0.2
104,"If you observe this among your fish, here is what to do 👇🏽

https://t.co/G8cN2AhBS2

#Prodave
#Catfishpreneur https://t.co/BG5ldhPtqR",catfishpreneur,Fish Farm &  Market,0.0
105,"@PapiTrumpo Definite sign of neurological issues... in all seriousness... disease, condition, or drug induced... or all three.",ddan2000,USA,0.0
106,"Did you know that in Swedish the word ""jealous"" is ""avundsjuk"" and the second half of that word (sjuk) literally me… https://t.co/pMIpK4ff4d",lanablakelys,"Stockholm, Sweden",-0.08333333333333333
107,"@MohammedAlo 80%diet,20%exercise.LCHF/keto/Carnivore obliterates Diabetes,heart disease,cancers into remission,add… https://t.co/tNFuhqz20y",tonegamer13,,0.0
108,"@OliLondonTV It all went down hill when they started labeling  those, doing incongruent sexual acts, as members of… https://t.co/wlDnq0zDAv",GeneWeigel,,-0.15555555555555559
109,"you wanted to sit there , taunt me ab my disease w ur new gf &amp; still call me on a blocked # &amp; email me for ur shit… https://t.co/oPcMcWS9Zp",gkobe12,"Los Angeles, CA",0.13636363636363635
110,@KUTRRH @CEOAhmedDagane today presided over the official launch of the Blood Cell Separator (Apheresis) Machine.… https://t.co/wqSugHPfOB,kutrrh,"Nairobi, Kenya",0.0
111,"@bambkb Fact-checked by: Doğruluk Payı, Turkey/FALSE: He was killed because he said the PCR test cannot diagnose di… https://t.co/hWPH7P2Ssv",LizNetherland,,-0.30000000000000004
112,And THIS is why fundraising is so important. Phenomenal waves being made in managing and potentially curing this ab… https://t.co/XcCBzdkYD7,esin_huseyin,London,0.3
113,isg enjoying all those headpats until it’s ksr and suddenly it’s like he caught some sort of unknown disease 😭 https://t.co/Y5LiP0NKz7,Akkkey,"20 ㅤ — ㅤ ngis, allsagi",0.13333333333333333
114,"@uvalde_kid @tedcruz Most homes don’t even have gas stoves in the U.S. 71-90% of homes in Texas, have electric stov… https://t.co/J1tRNEG9vD",MsMariaT,"California, USA",0.5
115,This really is great news - as Dr Rich says - it’s the beginning of the end for Alzheimer’s disease. https://t.co/ki3GaqIWH4,acwooding,"Tottenham, London",0.5875
116,Internet clout is a disease and these bitches willing to catch it,VegVirghoe,A place,0.25
117,Randomly reading about the efforts of one Dr. Joseph Goldberger who laboured in vain to convince the southern US el… https://t.co/J5ADJ2eKrs,jm_mcgrath,Toronto,-0.25
118,"@TeslaAndDoge @stats_feed Of a population of 1.4 billion people it would be impossible to account of most cancers,… https://t.co/FagBKCqolb",JakeMax55174713,,-0.08333333333333331
119,@NicoleFreed7 @NBCNews RSV is a childhood disease that generally disappears by age 2.,USBornNRaised,United States,0.05000000000000002
120,"i love bsd characters, they’re so easy to assign disabled headcannons too , like yes fyodor does have chronic kidne… https://t.co/QsA0sKJI3x",sigmasbabygirl,,0.24444444444444446
121,"Colorado18yr ALS Research can now show 90%+ ALS recovery in 6-12 months using stem cell support, while enabling the… https://t.co/LsQxQ7SEFT",DanielH03274759,,0.0
122,"@wabbitwarrior @JoeTurco No. 

You could not indoor dine and you worked remotely. Or got paid during work closures.… https://t.co/9HWEYjcUYF",LlustriousLlama,,-0.1
123,Just attended an amazing lecture on veridical data science by Prof. Bin Yu at the 7th David Finney Lecture. I loved… https://t.co/DeUCWNhOjW,maciejdrawsdata,"Edinburgh, Scotland",0.65
124,The art of medicine consists of amusing the patient while nature cures the disease.,RojasLloyd1,,0.6
125,"Lots of wheat never got to ride in the combine due to disease in 2022. 

Find out how much in the NEW Extension pub… https://t.co/VNvTaRUMyd",CropNetwork,A field near you.,0.005681818181818177
126,M2 Cortex Circuitry and Sensory-Induced Behavioral Alterations in Huntington's Disease: Role of Superior Colliculus… https://t.co/QEBAgc3HG9,BrainSightsApp,,0.7
127,@RNCResearch Mental illness is a mean disease.,As_Lazarus,,-0.20625
128,"@Harvard2H Myocarditis has to be one very rare disease in one unvaxed covid, if is not so, something trig that",RosarioP70,,0.39
129,"😷🏭 Breathing in dirty air can increase the risk of respiratory infections, heart disease and lung cancer.

https://t.co/1oPxY2xRr4",_LiverpoolWorld,Liverpool,-0.6
130,"@Sir_Tom_Malory Evidence addiction IS a disease. Used to define it as "" feel good disease"" well..until you no longe… https://t.co/GyLr3ByCOG",Janis4you,,0.7
131,Callif: The alzheimer’s data begs the question doesn’t it? How early should you start if you are at risk. Who knows… https://t.co/Vc7K9ZFWg2,SarahKarlin,"Washington, DC ",0.1
132,@ask_aubry I pity the women who get shackled with these cretins the first time they get a chronic disease and end u… https://t.co/NQZTGv0bdH,Jeffrey831972,,0.075
133,@JingsWings @malegauze @Paris_Nova_ @Glinner @Baddiel Yeah that's gender. I don't think there is any way to physica… https://t.co/0y4TwcKIkM,sarsapamander,Here,0.0
134,"@JojoAnnKitty I don't see it as a disease, but the way society accepts will affect how spread it is. like in Rome t… https://t.co/AJlrCNBE5B",ButchL2022,California,0.0
135,"oomf just put fucking nagabe on my twitter, sending bad vibes and disease to him",HanaKaibou,𝘩𝘦'𝘴 𝘵𝘩𝘦,-0.6999999999999998
136,Think I’m going to start explaining “men are misogynistic” with a metaphor about rats. “Rats carry disease” may not… https://t.co/7kVg011YGL,TRANSFEMCYCLONE,white indig 🧋 wiiya he tma,0.0
137,"Anyway, endometriosis is when your uterus is too powerful and so it tries to devour the rest of your body, and doct… https://t.co/rDm10UCzPQ",ericavioletlee,,0.09999999999999999
138,"In the search for better ways to fight disease, Jing Fan is pushing the boundaries of immunometabolism. Read more i… https://t.co/pxGqHudIxf",UWMadisonCALS,"Madison, WI",0.5
139,@Tiredwhiteguy jealously is a disease,toiletpunch,"Philadelphia, PA",0.0
140,"😲The world’s largest #monoculture is a field of genetically uniform #wheat in Canada - 14,000ha. These #monoculture… https://t.co/qvhglFknkO",maloucao,Lisbon. Portugal,0.0
141,"🔴 Results of trial ‘hugely exciting’ and herald ‘treatment era’ for the disease after decades-long search

https://t.co/rrqlKEsFI4",Telegraph,"London, UK",0.125
142,JUST IN: Wisconsin health leaders say the state's number of bacterial infection cases have doubled in the past 15 y… https://t.co/BOyLBhoyUY,620wtmj,Milwaukee,-0.25
143,"@Michael_Yon These people are going to find ad  folks start getting MDR disease,or when we don't have enough bread… https://t.co/uTggVTsztL",Jean58680787,United States,0.0
144,"i know who you are, it’s okay i completely understand that jealousy is a disease. dw it can be cured tho. i hope yo… https://t.co/UssWu6cizS",7SIREYA,21 | she/they 🇲🇨🇳🇿,0.3
145,Positive Alzheimer's drug trial data pushes Eli Lilly shares to another all-time high and brightens our outlook: El… https://t.co/FdibFLmwBZ,Fallenberg,Algiers                       ,0.19363636363636363
146,If this is true - AND it is. I believe recent Israeli studies ALSO showed no increase in heart inflammation from Co… https://t.co/uey1jxlHle,VillainsbrewC,New Mexico ,0.175
147,@OryaMaqboolJan IJI to PDM same disease same germ.,Imran29982370,,0.0
148,@plantsarecool_ @DevinedPaladins There's a cure. You have to fall in love with the people your in love with or get… https://t.co/kp1rEcburz,WaffleBotExpert,In Vanilla Kingdom,0.5
149,. . . I’m not sorry I’m disabled or immunocompromised bc even if I wasn’t I still wouldn’t be a disease-spreading m… https://t.co/SqfmPkC4GV,Schr0dingersKat,In my box,0.024999999999999994
150,"@MohmdBio Usually in Hashimoto's disease, the immune system produces an antibody to thyroid peroxidase (TPO), a pro… https://t.co/XL2HeDIix1",i_rwf12,,-0.25
151,"@the_urb @cnnbrk Depends on the nature of the disease. They pretty much eradicated the likes of Deptheria, Polio Ty… https://t.co/Pp2hK7O88B",WallaceBuster1,"Tennessee, USA",0.225
152,{Fighting Stigma} Eli Lilly: Donanemab Meets Primary Endpoint In Phase 3 Study Of Early Alzheimer's Disease: ... 3… https://t.co/shGJDXTpsL,stigmabase,Worldwide,0.25
153,{Fighting Stigma} Eli Lilly: New Alzheimer's treatment slows disease in late-stage study - https://t.co/fonl2KwSGR:… https://t.co/jJQZ4QnDeB,stigmabase,Worldwide,-0.08181818181818182
154,"@AlekJ14 They are disgusting subhuman animals that spread filth, disease, drugs, and crime",Coldbruj,,-1.0
155,Illiteracy na disease for real https://t.co/OdJR0IKEgY,iamkuzukings,Inside life,0.2
156,@John_P_Neal @CNN If that was the case she could sue them for pain and suffering but it’s not true and you know it’… https://t.co/W1LGGnJ8f7,OdanSymbiont,WI,-0.175
157,"To them God, the source of light. Disease
OUNASS_NOON_PROMO_NON_TOYOU_TO_Fordeal_HM_and_Body_H&amp;M
YOU_H_AND_M_OUNAS_… https://t.co/0sgXLflb7r",nallyukenin,,0.4
158,"@CalAliwell I do get that, but I wish they would be really honest that these drugs are about disease modification,… https://t.co/hiwiXxFg59",neilmcrowther,London,0.6
