,tweets,user,location,polarity
0,"Y’all can have the men who treat your menstrual cycle like a disease. I want to be loved on,  store run for my need… https://t.co/zYKl0GwKIs",chocolatevee5,,0.7
1,"For 75 years NHS healthcare science has played a vital role in the diagnosis, prevention and treatment of disease a… https://t.co/0GuLOEyHKD",OurDemChoir,,0.1
2,"@HeathenOnEarth_ Yes, I saw that too. 
His uncontrolled movements could be caused by Parkinson's disease, or anothe… https://t.co/KrY1Ob7pbT",luciecmz,Netherlands,0.0
3,"#GodMorningMonday
Now a wrong misconception has been spread in the devotee community
by the fake gurus
that after a… https://t.co/4KyDF67G7R",SangwanPartap,,-0.5
4,"@Blessedkennday @amerix Yes so that those extra eggs that you would've eaten you replace with, bread, cornflakes, w… https://t.co/IZ7Y9dEAAd",pic_speak,"Nairobi, Kenya",0.0
5,"“That kind of monitoring is already offered to low-risk prostate cancer patients, but this study suggests that it “… https://t.co/wKojfAkN1D",ChrisSylvain,New Orleans,0.3
6,"@AshleyB18571313 @KekwayB @ThePoliticalPom Melania is such such a class act that her husband, after the birth of th… https://t.co/LRWi5BRSiE",mysterytweet29,"Los Angeles, CA",0.0
7,Tragedy as dad diagnosed with terminal cancer after his mum dies of disease https://t.co/KNXVT63XrK,Daily_Express,London,0.0
8,@BrownJHM Cat scratch disease.,crizcruz16,,0.0
9,"Only a life lived for others is a life worthwhile.
Our mission isn’t accomplished by only treating the ill but we a… https://t.co/8bZulX307E",SGBCjo,Hashemite Kingdom of Jordan,0.039999999999999994
10,"Kidney disease diet package
The main reason for kidney failure is high blood pressure and diabetes. 

You can book… https://t.co/huuVtLGnuj",drrajattrehan,"B-1,626, Block B1, Janakpuri, ",0.003333333333333318
11,"@BrownJHM Bacillary angiomatosis. A skin disorder characterized by red, elevated lesions surrounded by a scaly ring… https://t.co/7HeQiLXAP9",OverwhelmedHea1,,0.0
12,SitRep#1128-03-13-2023_Situation Update Report on Health Sector Response to Coronavirus Disease COVID-19 (In the Ne… https://t.co/zAmGZbwWKb,mohpnep,"Kathmandu, Nepal",0.0
13,@fivehundredpou1 If adults do not know what the real causes of disease are(although we are all exposed to it every… https://t.co/6z1gYdBvpG,Veronic05502788,,0.2
14,@AshwiniVaishnaw @PMOIndia @narendramodi @DDNewslive @PIB_India Disease is spreading in India.,GautamAdani_Ji,"Blue Earth, MN",0.0
15,"L'alimentaire et le mode de vie dans ""Prevention of Alzheimer’s Disease and Cognitive Decline with Diet &amp; Lifestyle… https://t.co/QsSWOfSTsV",CentreOMSfragil,"CHU de Toulouse, France",0.0
16,"@abhiandniyu @DrSJaishankar What disease you are suffering from ? 
Because he is in his 60's and you are in 30's. W… https://t.co/EwDUqdVqDv",DehalVixit,"Hamirpur, India",0.0
17,Happy #CommonwealthDay from Zero Malaria GB! Our Commonwealth partners are key allies in the fight against malaria.… https://t.co/QBYoN3fi00,ZeroMalariaGB,,0.4
18,"Today I told another founder exactly this but Chon explains it better.

My response to yesterday’s news was “we are… https://t.co/T8fy7BBeJU",laurinop,Handcrafted in Caballito,0.375
19,Grooming a skin disease dog https://t.co/N5reipeg2E,WODRashmipihu,भारत,0.0
20,jR&lt;L} Cancer is a deadly disease.  3542      #喷水   https://t.co/lh5gj6Ck68,cristia00748201,,-0.2
21,@joeolivermd Why on earth would you give an infant an experimental vaccine with known side effects for a disease th… https://t.co/4XE1YLBYK1,emheld45,,0.1
22,Dementia for instance mam. I have a patient who suffers from Alzheimer's disease. Different from your case. She hal… https://t.co/4xcSDEnHl1,harperaste4th,,-0.3
23,V)XTD Cancer is a deadly disease.  3542      #喷水   https://t.co/gfj5Fskqvw,shariqsiddiqi3,,-0.2
24,Looking for a new role? We have two exciting opportunities coming up in the #SocialMedia team here at #Sightsavers… https://t.co/CvuNIXX8ay,Sightsavers_Pol,,0.21818181818181817
25,"@endmalaria @WHO Great to see progress towards malaria elimination, but we must stay vigilant. Malaria still affect… https://t.co/H8H7DuML4f",asdo_rwanda,"Kigali, RWANDA",0.8
26,#BetaSitosterol Reduces the Risk of Non-Alcoholic Fatty Liver Disease https://t.co/yEjfZOBsL0 https://t.co/poSnmBaTJn,kylejnorton,"Calgary, Alberta, Canada",-0.225
27,"@realscottchegg @meter_usaid @DiedSuddenly_ I know what a legitimate vaccine is, I didn't say the covid vaccine is… https://t.co/v3XbRoOjmn",jrjcampbell,"Brighton, England",0.0
28,"In Pakistan, the flour you get at the local store, the packaging the poor people eat my opinion, it is worse than a… https://t.co/wlrmtvPTKs",RazaShahSrs1,"Hala, Pakistan",-0.26666666666666666
29,"@vasu1439688 @AdnanSamiLive Even then same people would have problem, saying if they learn our language they will c… https://t.co/DO2OHsxALK",RamanGaonWala,,0.0
30,@RNCResearch The disease is this rhetoric,MichaelCupo1,United States,0.0
31,"@MarkusKnoell @visegrad24 What do you know about Ukraine, China? What truth about covid do you want to tell? Do you… https://t.co/iaWDbE2gli",AlenaMagi,,0.0
32,Brain transplants are often seen in movies but here in #Wales we are researching whether neural transplants can imp… https://t.co/nFiln1drWn,ResearchWales,"Powys, Wales",0.0
33,"#InnovaHeart2023!
Come and join us to meet Prof. @oscarcamararey   from @DTIC_UPF, @UPFBarcelona - Barcelona workin… https://t.co/b1zwBfZASY",BCN_MedTech,"Barcelona, España",0.0
34,"#BorisJohnson is like a contageous disease. Anyone who comes into contact with him seems to lose all reason and, if… https://t.co/IVHdM5YtIZ",derekjames150,EU Citizen,0.0
35,The predictive relationships between advanced dynamic balance and physical activity/quality of life in Parkinson's… https://t.co/mrh3ctAYa3,geripapers,,0.13333333333333333
36,What disease did cured meats have?,MonotoneofBill,"Scarborough, Maine USA",0.0
37,@nightviewss jealousy is a disease 🤩🤩🤩,legofroggo,constant existential crisis,0.0
38,"@AngusTheBastard Yes, she did. I had to put her to sleep in October. Weeks before she was diagnosed with congestive… https://t.co/xKlBnSCSsL",DEFendFURiously,"Connecticut, USA",0.0
39,Vitamin D increases the absorption of calcium in the body while vitamin k2 allocates calcium to where it can be use… https://t.co/vg6HEO2wT9,pharmexng,"Abuja, Nigeria",0.0
40,@RegXIV @johnbind2 @MeghanEMurphy Well his point is that people are fooled into taking these hormones that only fuc… https://t.co/wOAx1CG1pv,myranie54_23,,0.0
41,@ZetaReticulon @moveqifreely @Censored4sure The toxic filled state(illness) creates the germs. The germs do not cre… https://t.co/ztp9S9GGrq,moody_bugg,the Truman Show,0.4
42,"@S_h_e_e_n_a_ @VICE Evolved, but due to neurotic dillusions and misperceived demand. Now, truly the vinereal diseas… https://t.co/JPlIj3g0Bu",gitgudsec69,"Val-David, QC, CAN",-0.125
43,"Hot Topics: A new study shows that human ageing is absolutely precise, when disease is eliminated, and accompanied… https://t.co/QISxRGY6GC",hccentralpharm,United States,0.1965909090909091
44,@ershadkazmi @SindhHealthDpt @dghealthsindh @control_disease @UNAIDS_Pakistan @UNDP_Pakistan @UNICEF_Pakistan… https://t.co/u10Xf7j72i,DrSarwarSoomro1,,0.0
45,@Sime0nStylites @henrymance @steverichards14 Ahem Nadhim Zahawi-itis seems to be his local variant of this incompetence disease.,SimonWhiteley6,,0.0
46,Robert Reich shows up in my feed way too much.  He clearly has little man’s disease.,wbm,"ATL, KnoxVegas, DC",-0.04374999999999999
47,"The role of diet and lifestyle on ""Prevention of Alzheimer’s Disease and Cognitive Decline with Diet &amp; Lifestyle: P… https://t.co/nZeHKmTJfq",WHOCenterFrailt,"CHU de Toulouse, France",0.0
48,for reference i can have 3-5 grams of sugar every 12 hours before risking a migraine from spirochetes from lyme dis… https://t.co/nOzhKYpVO0,theBRIX_me,Sowocatuck Wabanaki,0.0
49,Opinion | How to Prepare for the Next Pandemic - The New York Times - https://t.co/NgCa1Fb1YR,RobinCogan,"New Jersey, USA",0.06818181818181818
50,HIV disease resulting in other diseases,HourlyDeath,Everywhere,-0.125
51,The early presence and high specificity of #AntiCCP antibodies represent a superior marker for the diagnosis and pr… https://t.co/mKA7PfT5fm,fortressdiag,United Kingdom,0.32
52,Only time will tell. But it seems like a missed opportunity to potentially reduce the disease burden on our society… https://t.co/ql3Xsno6oC,1t1sAdam,,0.0
53,"@MeetJess Worrisome: “The positivity rate for flu jumped to 41.6% this week from 25.1% the previous week, the Chine… https://t.co/il2aUGrmDP",amandalc77,"MI, United States",-0.16666666666666666
54,"@BlZZLESPEACHES @ngelsspeak She spreads it willingly tho, that girl a walking disease!",DEEego96,,0.25
55,@regularsquidd_ Nah. It's to treat a skin disease called vitiligo.,curiosityman2,He/Him/His They/Them/Their,0.0
56,"#Giveaways #NFTArt #Design #OpenSea #NFT #Quote

Eating cholesterol and bad fat will contribute to heart disease if… https://t.co/9FWI1l048V",SareOzciftci,,-0.6999999999999998
57,@BrownJHM Cat scratch disease (lymphoreticulosis)?,iNduati,NGOYA Inc,0.0
58,@CancerToolsOrg tools for diagnostics of cancer disease in vitro and in vivo: Bench to bedside - translational research,madar_igal,,0.0
59,"This is common in malignant disease when attachment to deeper structures, such as underlying muscle, may also occur.",HAROONU88542874,Pakistan,-0.15
60,"@DrOribaDan @lacor_hospital @GuluResearch Query 1)Cancer of the lungs, 2) Post TB lung disease",MasembeFrancis1,"Kampala, Uganda",0.0
61,@mariah_ino @Alec_Zeck Was an autoimmune disease diagnosed or did someone online tell you that? Because if it’s the… https://t.co/GqgqPtoSTr,rubrogram,...rent free...,0.0
62,"WHEN ONE FORGETS SOMETHING, IT IS NO BAD SIGN TO NO DISEASE; ONLY A BETTER IDEA OR KNOWN IS ON ITS WAY THAT's WHY'.… https://t.co/ReuAzF5dYd",cemaler90726532,"Hackney, London",0.28333333333333327
63,Thank you for the disease.,bobyfauzi_w,"Jakarta Barat, DKI Jakarta",0.0
64,@jordanbpeterson Endocrinologists everywhere I’m Sure are shuddering in horror how hard it is to treat hormonal imb… https://t.co/e9XsMqK9t5,Lacyjohnston123,,0.10416666666666666
65,@Comp_Interst @NutritionMadeS3 Is there any heart disease in your family?,bledwine,"North Shore, Boston ",0.0
66,"Not even a hailey baldwin fan, but how did age this badly? Is it really from a disease? She's still quite young I d… https://t.co/NvLroiwcm7",littlevixentate,probably on a plane ,0.15000000000000002
67,@AnnadeBuisseret Perhaps doctors would regain respect &amp; earn their money if they actually promoted health care with… https://t.co/sHefyFqDUo,PawsforThough15,,0.0
68,"This disease, all of it...",circuscard,30 • ic D_misang he doll,0.0
69,"Together, poor cattle, you will become my sheep! We will pay our dues and earn the love of our planet! No more stor… https://t.co/kVyrHwPJyE",Elijahfuckoff,"Arkhangelsk, Dsmp fans dni",-0.05000000000000001
70,"Provisional data from CDC shows that from January 1st to today, 22000 people in the US have died from COVID-19, the… https://t.co/lw8lp1EhMw",kakurady,https://aka.ms/nohello,0.0
71,"Since 1986, the Carter Center has been a pioneer in neglected tropical disease prevention, control, and elimination… https://t.co/BpXSv8cCgp",TheNewsWrapped,Malaysia,-0.1
72,"Camilla Omann:
School performance is impaired in children with both simple and complex congenital heart disease
https://t.co/k68LYXVZne",chop_pubs,,-0.15
73,@jeffjarvis Maybe I'm not as susceptible to 'click bait' but I see this headline as asking the question of what we… https://t.co/PDwqPTFq5h,icedcoffee,London,0.0
74,"#Giveaways #NFTArt #Design #OpenSea #NFT #Quote

Eating cholesterol and bad fat will contribute to heart disease if… https://t.co/eYKCIJg4po",magas_mouss,,-0.6999999999999998
75,@PMOIndia pl give institution to the  management of HEC Ranchi to pay my sanctioned medical advance as my wife is s… https://t.co/B3tVN14fwi,ffccsltdranchi,"Ranchi, India",0.0
76,"there is a darkness reaching like rust into everything around us. we let it grow, and now it's here. it's here, and… https://t.co/Jt8QHhlMoA",wontwhispers,,0.0
77,@KatusiimeCarol5 But this disease must be dealt with once and for all!,KwikirizaJonat1,Kampala Uganda,0.0
78,Very excited to share our new publication with @florin_neuro @Retune_CRC @HHU_de out now in @Nature_NPJ Parkinson's… https://t.co/a9WZ77erqk,SpoonerRK,"Düsseldorf, Germany",0.3119318181818182
79,"My people the day to settle sickness, suffer suffer and all the yama yama disease don near. 
Make we continue to pr… https://t.co/LLSwO9pa6o",mog14christ,South Africa.Frankfurt Germany,0.1
80,"@catturd2 Hey 🐈💩, did you know Fauci discovered a cure for vasculitis, saving countless lives, but donates all his… https://t.co/ssCyWfPudc",JayBee2Ewe,,0.0
81,@MeriSha24039822 Jealousy is a disease 😭😭,hobibi1789,,0.0
82,"Great article!
Lineker is a symptom, the BBC is the disease https://t.co/wUSntggZMt via @theconwom",lojolondon,London,0.8
83,@MojoTejas My brother ended up getting cancer and a rare nuralogical condition called Stills disease and that puts… https://t.co/7Y9Kk6Kitu,snakeeyesrebel,,0.3
84,"Sweden works better for me, plain and simple.  Having an auto-immune disease, the health care system here gives me… https://t.co/VbOCuqs3gs",ChrisBValle,"Karlstad, Sverige",0.09523809523809523
85,"@Botanygeek Correction: she spoke 10 languages fluently, and was learning 2 more (one was Romanian, I don’t recall… https://t.co/73QM7Y8kF3",tomkimmerer,Maury silt loam,0.5
86,"@DaveAtherton20 @Wayne57072607 He sounds like a laugh a minute, chill pill required. They wonder why people die of… https://t.co/624SV7VcX6",pinkprincessZ68,,0.3
87,"As of Feb. 24, 34,576 deaths have been reported to the Centers for Disease Control and Prevention via the governmen… https://t.co/e9FgnhW4C8",stephan632,"Studio City, Los Angeles",0.0
88,@_oluwaseun9 Imagination na disease these days oo 😂,Drakid7,𝐓𝐡𝐞𝐦𝐲𝐬𝐜𝐢𝐫𝐚,0.0
89,"my mom yelling at me taking my phone for forgetting to take my medicine for strep throat: 👹
her after finding out i… https://t.co/z4q7nLeImY",em0r3x1c,he/him   ★ 🦴( EDTWT),0.0
90,"@gardengirl778 @annie_sparrow @mvankerkhove @WHO I didn't know it, or how it spread either. Miraculously, even thou… https://t.co/8FGSMgI3rk",greatgreyowls,🇨🇦,0.0
91,@NYCMayor You are forcing my wife to take down her mask. She's on medication that makes her susceptible to disease.… https://t.co/uW0P31mDud,StashColTV,St. Louis,-0.15555555555555559
92,"@ichudov In 35 years I've been sick twice.  And I have one autoimmune disease and one liposomal disease.
Very few v… https://t.co/I8sNDzQchE",Robertvegan7,United States 🇺🇸 🇨🇦,-0.48714285714285716
93,of the unmet needs that remain for those living with this complex disease.,JanssenIE,Ireland,-0.3
94,"@ANI Honorable sir, not only you, crores of people of India are troubled by this ridiculous disease, treatment is n… https://t.co/o4YBAC6s02",DkPaliw64828093,,-0.27777777777777773
95,"Off recent, relationship heart breaks kills more than any deadly disease.",AmadouDarboe16,,0.09999999999999999
96,March is Myeloma Action Month. Multiple Myeloma is currently an incurable disease with a mortality rate that is sti… https://t.co/As0F4i5QOG,JanssenIE,Ireland,-0.13333333333333333
97,i'm sorry nonnie! I hope you're doing alright😭 jealousy is the most annoying disease https://t.co/uXEa3AvxOi,hlslaundryday,mid twenties | she/her | 🇫🇮,-0.26666666666666666
98,"1 second ago, a Mining Bee that could potentially pollinate 25,000 pumpkin flowers has died, because it was infecte… https://t.co/6qLQzPNlSM",HiveEmpty,,0.0
99,Animal disease threats a focus of ag committee https://t.co/bQXeGuNbow,ktoenews,"Mankato, MN",0.0
100,Shit after 10 years of hospitalizations for having a disease? Why did she have to take everything when I was waking… https://t.co/fDAwQ9H9Do,JustDelok,Hell's Fortress,0.0
101,@markjessse076 @GRVlagos Slavery and poverty na disease,rhemafort,,0.0
102,"Things that are much more deadly than disease as true cause of death:
- automobiles
- drugs
- alcohol
- water",og_oregano,Where freedom still reigns,0.21666666666666665
103,@rubrogram @Alec_Zeck Narcoleptic here. I found out narcolepsy is an autoimmune disease (most likely) and instead o… https://t.co/jYYXNvcUlG,mariah_ino,,0.25
104,@Tendar i hope you noticed the giant letters ... kidney disease can lead to vision loss,ArpadSzeghalmi,,0.0
105,Tank in middle of an estate known for its issue and a mental health hospital surrounded by a clean up system to tre… https://t.co/XQVxgfIIek,Sp72298066,"Camden Town, London",0.0888888888888889
106,"@LazadaPH What fitness habits that I want to work on is to being physically active, makes improve my brain health,… https://t.co/UQecoRfKCI",jayson2933,,-0.13333333333333333
107,Learn more about the story of our very own Martin Brunker who has been featured by @Kent_Online 👇… https://t.co/piOxGvZT6F,WDBSofficial,International,0.64
108,"@LazadaPH What fitness habits that I want to work on is to being physically active, makes improve my brain health,… https://t.co/SlxivcsbfS",jayson2933,,-0.13333333333333333
109,@GuinnKalli Am thinking the days are just neutral. Alcoholism &amp; addictions contain cyclic patterns of emotional neg… https://t.co/vAFALc3Aic,andrewf89978086,,0.0
110,"@Dochudson70 @newscomauHQ You should ask  the indigenous people, aka the first people of Australia, how they had to… https://t.co/acDo466GX5",LiangJi12,,0.25
111,I stress the need for reforms on kenyan Health insurance policy for sustainable universal health coverage attainmen… https://t.co/tenedVfxk4,zeblorackstorn,,0.0
112,"Crypto/nft twitter be like:

Bittersweet announcement but after an amazing year as an expert in eastern european af… https://t.co/rEoTZ5KyfO",Nevbaha84253775,Metaverse,0.30000000000000004
113,@fox13seattle Great to see States stopping this social disease.,TheJayW1,,0.4166666666666667
114,This strikes me as a potentially misleading and somewhat irresponsible NYT home-page promo for a hypothetical. Shou… https://t.co/cflIGB3bZz,jeffjarvis,"New York, NY",0.0
115,A recent study found that three out of five women over the age of 40 suffer from osteopenia - a condition that caus… https://t.co/JEJtCiGELp,JournBoneres,United States,0.0
116,@Meghanduggan1 @JerasIkehorn My thoughts exactly.   Dr. Fauci has devoted his life to helping fight disease &amp; bring… https://t.co/HSypqMOFut,DavidJuno,"Glasgow, KY",0.25
117,Medscape: ❓ Which specialists should be on your team in order to effectively manage anemia in patients with chronic… https://t.co/Dew75a0nQ4,fpizart,"Miami, Florida",0.6
118,"Women are also at higher risk of other diabetes-related complications such as blindness, kidney disease, and depres… https://t.co/vReZQQiG1F",HospitalTriton,"Nehru Enclave, Kalkaji New Del",0.03125
119,@HeathenOnEarth_ @RichersonJulie Parkinsons disease,Dennis87571067,,0.0
120,"Gut Microbial Metabolites on Host Immune Responses in Health and Disease

This review highlights microbial metaboli… https://t.co/tmZr2eOv3K",heniek_htw,Poland,0.0
121,Real-time PCR has advantages over culture-based methods in identifying major airway bacterial pathogens in chronic… https://t.co/u0McLLYL6R,MedEdPapers,,0.13125
122,@theliverdr @NishTWL T2D is lifestyle disease . Fixing lifestyle should fix it. T1 is separate matter - NHS UK now… https://t.co/CLuThoIcu7,desitechy,"Austin, TX",0.0
123,"Abhi, today proved to be mentally and emotionally ill with a disease called Akshu, and he became incredibly obsesse… https://t.co/7zafZ4ln9Z",ImeNe1239,,0.2
124,Animal disease threats a focus of ag committee https://t.co/gexDWuxEAE,TheFANMankato,"Mankato, MN",0.0
125,SciTechDaily: Nanofiber-Hydrogel Shows Success Treating Severe Complication of Crohn’s Disease https://t.co/mvZerXbCAC,xalfeed,Internet,0.3
126,$PRVB was soaring 260% after the U.S.-based biopharmaceutical company focused on autoimmune diseases agreed to be a… https://t.co/Af2G7obbSz,thudderwicks,Wall Street,0.0
127,"( specifically, the heart ) due to his body having suffered a life-threatening disease at a young age.",VOIDEDAGONY,mun is 18 | parody。,-0.012499999999999997
128,"https://t.co/Smo581zs2f #2 https://t.co/BYogOUYuYr Model Portfolio
, recommended 10/19 at $ 8.00 .  $prvb… https://t.co/MZxxAPVuH9",alphavestcap,"Radnor,Pennsylvania",0.0
129,Did you know that chronic stress can increase your risk of heart disease? Take steps to manage stress and prioritiz… https://t.co/aLwYUNvIe3,GoHealthHero,"San Francisco, CA",0.0
130,@gabbystern The world was unprepared for an airborne disease pandemic. That lack of preparedness was partly due to… https://t.co/FYfWHuD3wA,NjbBari3,New South Wales ,-0.125
131,@ChriseanMalone When you meet the right one you will know.  They won’t allegedly make you get all those tattooes of… https://t.co/9rXXAFXx92,panel___yes,,0.09285714285714285
132,@Maximus56859434 @IGN I dont have that disease. sorry,boiii1i1i1i,Raya Lucaria,-0.5
133,The Supreme Lord can also increase the age and destroy any disease because it is the Lord Himself. @SaintRampalJiM… https://t.co/YmQy5gYzba,JyotiDe82833354,,-0.2
134,"@themaidenjaden @Prolife_Tamy @GraduatedBen Ok, most people, but what about the people that don't have insurance? T… https://t.co/pzcIhipLkp",cyberzbunny,,0.5
135,@BillDA I mean everyone became an infectious disease expert a few years ago just catching up on the knowledge base 😜,ryan444123,"Brighton, Michigan",-0.178125
136,"#Hepatitis means #inflammation of the #liver. The liver is a #vital_organ that processes nutrients, filters the… https://t.co/ybCxQcvmWK",DiseaseLiver,,0.0
137,"Exercise regularly 

You can re-subscribe to your gym subscription 

Regular physical activity can help improve kid… https://t.co/UGVmtKNUFC",organstationltd,OrganStation,0.0
138,"1/2
The evidence so far (based on the genome sequence of the pathogen and the disease's epidemiology) is that
a) SA… https://t.co/kbs2Q6GitL",htuhairwe,Kampala,0.1
139,!|6sl Cancer is a deadly disease.    #上海 #天津    #青岛         https://t.co/DEyJC5SeUq,grxph01x,"กรุงเทพมหานคร, ประเทศไทย",-0.2
140,"@Marc_Veld yes, less than 1 in 10,000
Although Lauterbach acknowledges that PostVac exists, this disease, which is… https://t.co/41pC79kVsU",LooftSabine,,-0.16666666666666666
141,"@LayahHeilpern Does he have like a super deadly contagious disease and was finally let out?

Don't tell me this is for COVID prevention....",Emanuel_nld,"Rotterdam, The Netherlands",0.04444444444444443
142,"As many as 60 percent of those with a thyroid disorder are unaware of their condition, and women are 5 to 8 times m… https://t.co/DtZSc1XGzb",QuidelOrtho_PH,Philippines,0.25
143,"क्या आप जानते हो 
🌾🌾🌾🌾🌾🌾🌾
#सर्वशक्तिमान_कबीरभगवान है। 
The Supreme Lord can also increase the age and destroy any d… https://t.co/0CF4XwPPK7",GayatriPandhar3,,-0.2
144,"@KVarming If Gates really wanted to save &amp; improve lives in the 3rd world, he wouldn't be spending his billions on… https://t.co/l4R88yME5o",AndrewBC1983,,0.1
145,"@PenitentBaller @UHD42098047 Leftism is a disease. Just look at the ""trans"" movement and the people that can't even… https://t.co/iVEzlECmHA",Eeeethan_Eethan,"Arkansas, USA",0.0
146,bj2Xd Cancer is a deadly disease.    #上海 #天津    #青岛         https://t.co/b5bCGPBJ11,bw2_BGT,,-0.2
147,"4/
In the opinion of the study investigator, there was NO reasonable possibility that the death was related to the… https://t.co/cTjbYtVCRQ",IamBrookJackson,"Texas, USA",-0.05
148,"3/
According to the medical examiner, the probable cause of death was progression of atherosclerotic disease. Relev… https://t.co/YBvFhAfz9y",IamBrookJackson,"Texas, USA",0.0
149,"I totally agree here 💚💙

I am #LivingWithObesity and #MS 
Both chronic diseases!

I get treatments, understanding,… https://t.co/49zG3pUpUD",solveigsig,"Reykjavík, Iceland.",0.0
150,"@ybbshieru https://t.co/KGhFS29EfC
i love this AU of the despair disease chapter so much that i kinda wish it was canon.",TSoupful,,0.35
151,#Viral_hepatitis is an infection that causes #liver_inflammation and damage. Several different viruses cause hepati… https://t.co/GfQsmdDlXG,DiseaseLiver,,0.0
152,The race to stop starfish from melting into goo | A mysterious disease causing sea stars to waste away isn’t just a… https://t.co/Dgt7YyDymw,bocvip,,-0.1
153,Fatty liver disease: Changes in your walking style could be a sign of a troubled liver - Times of India https://t.co/oSMeVrrlYi,JustinBiberxfb,New York,-0.35
154,"#Giveaways #NFTArt #Design #OpenSea #NFT #Quote

Eating cholesterol and bad fat will contribute to heart disease if… https://t.co/H5pKdpGPmc",Marina96033200,Pomonaverse,-0.6999999999999998
155,U7\RF Cancer is a deadly disease.    #上海 #天津    #青岛         https://t.co/poK7KCytMe,nastasiyabum,ижевск,-0.2
156,".@MicrobioticaLtd, @sangerinstitute spin-out, is a global leader in gut bacterial microbiology, genomics and identi… https://t.co/Yuy1rsHT3d",wellcomegenome,"Hinxton, England",0.0
157,Research of CNN-SCN for Early Diagnosis of Alzheimer's Disease #preprints https://t.co/b9y1PHnndQ,RS_Preprints,"Durham, NC",0.1
158,"Check out the symptoms and consequences of kidney disease

#Health #KidneyDisease #Harmony #Brotherhood #Peace… https://t.co/rBDeQKLwHL",Dnn24Network,New Delhi.,0.0
159,@warlord365 @US2SOMALIA @hrw I hope that the son's disease does not develop in your souls and minds🦠🦠💉,rwathi2,Somaliland,0.0
