,tweets,user,location,polarity
627,"@rishibagree On the contrary, it does. 
These are the countries which recognize depression as a disease and put eff… https://t.co/oJ4TFCilVq",TheLiberalIndi8,,0.0
628,I think your team don't update I said metabolic neuronal disease which can be corrected thanks… https://t.co/UwAXcFIzOI,gunjanjeni,भारत,0.2
629,Rare liver disease https://t.co/mQxjpJLVeF,SuchMark,Philly,0.3
630,"@stopyerbitchen @JoeGamaldi Noise, fuel, &amp; light pollution are linked to dementia, heart disease, violent crime, ca… https://t.co/Q4rxXMsihc",HowTheWestWS,California,-0.2
631,"@Taylor031295 Noise, fuel, &amp; light pollution are linked to dementia, heart disease, violent crime, cancer, &amp; hearin… https://t.co/J4frgyllx2",HowTheWestWS,California,-0.2
632,"her husband played with her feelings over and over, lied to her face, his mistress tried to steal her husband after… https://t.co/DKIlYvQPqM",korygarthinker,,0.0
633,"By smoking and consuming tobacco, a person becomes a victim of a terrible disease like tuberculosis. Following the… https://t.co/gY6XAUFYML",soniasainiinsan,Sonipat-Haryana (india),-0.35833333333333334
634,"@Dontcarebear74 Noise, fuel, &amp; light pollution are linked to dementia, heart disease, violent crime, cancer, &amp; hear… https://t.co/6ceTZ7D6x2",HowTheWestWS,California,-0.2
635,"Online Focus Group for Patients on Sickle Cell Disease 
https://t.co/9TogCrSi4A https://t.co/sZewe4cXlI",TheFocusGroups,"Seattle, WA",0.0
636,@SecBecerra @SenFinance @POTUS @HHSGov What about those with Alzheimer’s? The only disease to ever be denied covera… https://t.co/ussgc5QOyv,homestagermimi,"Vienna, VA",0.0
637,jealousy is a disease that is incurable https://t.co/SHN59JfJjo,yyeopcy,🎻🐿🦝🐻,-0.5
638,"@ZoomerNat123 @dontneednomom @Krysta92kat_ If anything y’all cause for death, people were living fine and thriving… https://t.co/reIGOB2lpf",Ladybug_13895,,0.4166666666666667
639,@WendyOrent @mcfunny @JimeeLiberty @pawley_robert @Scary7Dr @doom37455413 @richykirsh @Nicoleg425 @ryanbeed… https://t.co/J11bZSIGrn,tomsirolimus,2021... still?!,0.0
640,#WorldTBDay annually aims to to raise public awareness about TB Saint Gurmeet Ram Rahim Ji also guide everyone to q… https://t.co/P7OXLT16ve,PriyaMa95305023,,0.0
641,"#TBMuktBharat
#WorldTBDay is observed on every year on 24th of March to aware the masses about its causes and metho… https://t.co/bQUp25P6x2",DC_Insan,Ludhiana,0.25
642,"@TinaAm2021 Noise, fuel, &amp; light pollution are linked to dementia, heart disease, violent crime, cancer, &amp; hearing… https://t.co/ZyLKolcPPH",HowTheWestWS,California,-0.2
643,"@PR3GAM3_FR3AK He narrowed his gaze .

❝ Kokichi .

Why do you act like ' honey ' it's a disease ?

You need to sta… https://t.co/szrPlWkeGt",UR_BEGGIN__SLUT,#SubbyQuinnMun,0.0
644,"@dunlasco @FoxNews Noise, fuel, &amp; light pollution are linked to dementia, heart disease, violent crime, cancer, &amp; h… https://t.co/eDx3tHKw3k",HowTheWestWS,California,-0.2
645,"@derrickstheman @iamgregk @stkirsch @RMConservative While this is true, Trump did sign off on it. As soon as I hear… https://t.co/ojhupBkrLS",JimGleeson,"Georgia, USA",0.35
646,"@Mark57538188 Noise, fuel, &amp; light pollution are linked to dementia, heart disease, violent crime, cancer, &amp; hearin… https://t.co/yD5GXNgN0p",HowTheWestWS,California,-0.2
647,@StrongholdMag @TheMcKenziest @BradleyRBloom I'd say that any disease that starts at a 10% chance of disabling you… https://t.co/2plZJasR0k,CannibalHoliday,Eastern Ontario,0.0
648,"@MadScientistFF If I had my way, I'd be above. But I have kidney disease and have to be careful with how much liquid I intake.",JCisthetruth,"Branson, MO",0.03333333333333333
649,"- could beautiful sadness- beautiful sadness is a never ending light that shines
OUNASS_NOON_PROMO_NON_TOYOU_TO_For… https://t.co/G53q2WCQ8z",mkhalaf180,,0.7000000000000001
650,"@FoxNews Noise, fuel, &amp; light pollution are linked to dementia, heart disease, violent crime, cancer, &amp; hearing los… https://t.co/rnJtHTuYwn",HowTheWestWS,California,-0.2
651,"TB is a curable disease, but it still affects millions of people worldwide, particularly in low- and middle-income… https://t.co/q4ZUAemchk",BloomIVFIndia,,0.0
652,@DonnaLfromNY @CompeteToDefeat @cspan @RandPaul “Treatment” and good health is what keeps you out of the hospital.… https://t.co/LYPTM4ela6,Kathlee16363451,,0.7
653,"@spoonflipper @CatWorkers Noise, fuel, &amp; light pollution are linked to dementia, heart disease, violent crime, canc… https://t.co/f4aT8p2ofh",HowTheWestWS,California,-0.2
654,"To talk about balance, it's easier to talk about what's out of balance. And I think anytime that you have any disea… https://t.co/whccIx1jUo",jojosiza5,,0.0
655,Read Hope Johnson's new article about the lack of coverage that public health issues get in mainstream media right… https://t.co/h21X0nBSsi,pbpoliticalal,United States,0.14069264069264067
656,"@tom70006983 Noise, fuel, &amp; light pollution are linked to dementia, heart disease, violent crime, cancer, &amp; hearing… https://t.co/BR8by2vizk",HowTheWestWS,California,-0.2
657,@jiyuval_ @yoridere thanks for curing me from every disease know to man,T0nk12___,Your heart TEEHEE,0.2
658,literally thirty minutes into this phacetime call we all ended up w cat whiskers on our faces btw phannieism is a d… https://t.co/CahmVPrZbJ,chaoticmothy,she/her =•= 16,0.0
659,"@sherif_sakla Noise, fuel, &amp; light pollution are linked to dementia, heart disease, violent crime, cancer, &amp; hearin… https://t.co/RqXO8xDKJD",HowTheWestWS,California,-0.2
660,@RudyCerda I think it’s obesity or heart disease.,coastalpiloting,,0.0
661,"I gathered all the teeny bit of energy I had left and started to work on hw I’m behind in, but I did it on the comp… https://t.co/nL1UIdNkDW",RisaMichelle18,,-0.2
662,@bannayolla @theliverdr Diabetes dose is increased due gradually due to increase in severity of the disease over ti… https://t.co/cvSQva0EV1,subbia1988,sankarankoil,-0.125
663,"How is Tuberculosis treated?
Oh yes! TB can be treated and cured. A standard 6month course of four antimicrobial ag… https://t.co/HvO1lpaeKa",LilyFound1,"Northern, Ghana",0.0
664,@Rarecandypod1 Questlove is a disease,SafetyPropagan1,Theater of Cruelty ,0.0
665,"By smoking and consuming tobacco, a person becomes a victim of a serious disease like TB. Saint Gurmeet Ram Rahim j… https://t.co/PJISLRMhh1",SimranTayal4,"Bathinda, India",-0.20416666666666666
666,Tuberculosis is one disease that can take away so many good things from our lives. Let us celebrate the occasion of… https://t.co/sJtcckqVFw,rakeshcoelho,Mumbai,0.6
667,24th March is marked as World TB Day to spread awareness on aspects relating to TB and eliminating it. On this occa… https://t.co/7u1NEmyeBz,baneja87,"405, Sector 16, Hisar, Haryana",0.1
668,"To avoid disease TV, put pulses, fruits and vegetables in your diet. 
Do exercise in the morning and take morning s… https://t.co/yv1rhhG8GZ",baneja87,"405, Sector 16, Hisar, Haryana",0.0
669,Approximately 1 crore people are being fight with TV and 15 lakhs people dead due to this harmful disease ... Let c… https://t.co/sKIW0oo425,rakhi7rakhi,"(Abul khurana) Malout, India",-0.2416666666666667
670,"South Australian woman Amanda Hancock has told 10 News First that she is thankful her mother, a sufferer of Hunting… https://t.co/0IExZtSsu8",10NewsFirstAdl,"Adelaide, South Australia",0.125
671,"Warm Greetings on World Tuberculosis Day. 

On this Day, Let’s Spread Awareness about this Infectious disease and s… https://t.co/SBIENPSH7k",IamAkashDNayak,Odisha,0.6
672,"In a world ravaged by greed, disease and climate disasters, i can't fathom what motivates someone to get up in the… https://t.co/qF4YowbyCl",chrisjensenj,New Zealand,0.0
673,"@PaolaViland They pay the same docs to push drugs on people that don't need them. Its the medical establishment, tr… https://t.co/cFZOl8hKCn",TreaderThe,,0.0
674,"@dianemgoldstein @SteveBellow @Prof_357 @mudrmdb @Jerry_Ratcliffe Noise, fuel, &amp; light pollution are linked to deme… https://t.co/wfhODlfAuP",HowTheWestWS,California,0.4
675,"Welcome to the New Normal.

Altered DNA. Permanent Immunocompromised bodies. Neurological damage. Clotting. Long Co… https://t.co/RrjahdokLD",EndoceneHunter,Planeta Tierra,0.2590909090909091
676,@1boreen_ye @MaxDentalUG @UweraLyndah Serious gum disease mate! Floss daily until your next appointment.,sum109,London,-0.1111111111111111
677,"#By smoking and consuming tobacco, a person becomes a victim of a terrible disease like tuberculosis. Following the… https://t.co/cAH0r9EisB",Dharam523,"New Delhi, India",-0.35833333333333334
678,@MsAvaArmstrong I have chronic dry eye from an unusual eye eye disease. I use artificial tears all the time. Someti… https://t.co/hO2D9KLuTn,SRae78,,-0.15555555555555553
679,Several Chickens infected with Measles have spilled into Lake Michigan. The Fake Outbreak Center for Disease Contro… https://t.co/HizTpzhqsI,FakeOutbreak,,-0.19999999999999998
680,TV is a very dangerous disease.Which is causing a lot of deaths. To avoid this terrible disease and create… https://t.co/KzEcZsQd0k,AmanKou33349481,,-0.89
681,"Saint Gurmeet Ram Rahim Ji explains that by chanting the name of God continuously, a person can easily get rid of b… https://t.co/HyRAIXKwa8",gu_insan,"Dal Singh Wala, Jaito,Punjab ",0.43333333333333335
682,"Many people are dying due to TV disease, this disease flourishes due to intoxication, following the inspiration of… https://t.co/VkWvni4yDb",Vihu17691346,"Rajasthan, India",0.0625
683,New from #wellcometrust https://t.co/iAF67LQrrc Characterization of tungiasis infection and morbidity using thermog… https://t.co/uXC9uMCOo5,EuropePMC,"London, UK",0.13636363636363635
684,"@omwambaKE USD is currency of violence. It thrive in turmoil, war, anarchy, disease etcetera. In an ideal situation it wouldn't be needed.",damwaweru,"Nairobi, Kenya",0.9
685,"Every year 200000 people die due to TB disease, this disease is more for those who are addicted to cigarettes and t… https://t.co/Dp0mWVsFaK",Anu04616834,Anupgarh,-0.00833333333333334
686,anyways sorry for the behavior i will be exhibiting in half an hour i have terminal delusional jimin fan disease so…,blommyu,they/them • 22 (‘00) ,-0.3333333333333333
687,World Tuberclosis Day is March 24-a day to educate the public about the impact of TB around the world.This disease… https://t.co/7kiQcRQfic,Vihu17691346,"Rajasthan, India",0.0
688,"@PygmyClay @SmilingOutrage Noise, fuel, &amp; light pollution are linked to dementia, heart disease, violent crime, can… https://t.co/NO0sbnI0UI",HowTheWestWS,California,-0.2
689,@CollinRugg Mad Cow disease,Kenneth53522785,,-0.37916666666666665
690,"Tuberculosis (TB) is an infectious disease that usually affects the lungs, though it can affect any organ in the bo… https://t.co/bvw2GCrwhB",simraninsa832,,-0.25
691,"Smoking leads to heart disease,cancer,lung diseases and high risk of Tuberculosis.
Shun smoking,stay safe and healt… https://t.co/vTBA2P5cOU",Savita135,Gurgaon,0.33
692,"@Tarunashree1 Nah, I say embrace it. There is no risk of disease that makes injecting metals beyond all bodily defe… https://t.co/02NQqfVuFH",AgoristView,Eastern NC,0.0
693,@ShaneLovesGames Hang in there. Disease + personal is a rough patch. It'll get better.,queb_ra,,0.13333333333333333
694,"This is my final notice: I am BEGGING people not to subtweet or vaguetweet about discourse, it is intensely stressf… https://t.co/bcn9Ktaurg",speedybrowncoat,,0.1
695,"@GavinMo57088935 @Debunk_the_Funk They weren't approved for reasons of funding, not for reasons of lack of success.… https://t.co/bV5PrbwNIV",AgainstKookery,,0.3
696,"@RLanceMartin @lexfridman @OpenAI @LangChainAI Can I say I had the idea, and thank you for making it happen? If any… https://t.co/vTNFNAa9KV",AndrewVoirol,"Right Here, Right Now",0.0
697,"@stopyerbitchen @JoeGamaldi Noise, fuel, &amp; light pollution are linked to dementia, heart disease, violent crime, ca… https://t.co/9mpTdYMEwm",HowTheWestWS,California,-0.2
698,"Liz Rimler has had to get multiple diagnostic mammograms, a test used to check for breast cancer after a doctor fin… https://t.co/OpvgEMJimQ",KLTV7,"Tyler, Longview, Jacksonville",0.0
699,TB is a very serious disease Saint Gurmeet Ram Rahim ji says that we should practice meditation and have a balanced… https://t.co/tA60HXHQc9,Vihu17691346,"Rajasthan, India",-0.43333333333333335
700,@peter_weissmann @abcnews Keep up its already dropping for gen z next 20 years between obesity sedentary lifestyle… https://t.co/giRoNXeWCd,Nicole99899955,,0.0
701,"How is the disease transmitted?
The bacterium that causes TB is transmitted when a healthy person comes into contac… https://t.co/FFFnzsoc8q",LilyFound1,"Northern, Ghana",0.5
702,TB is a serious disease due to which more than 2 lakh peoples lose their lives. Whose reason is  low immunity power… https://t.co/OhGwV8KaVq,BabyInsan15,,0.010416666666666671
703,@DexMarcos @jakeshieldsajj I have a friend in Canada who has a child with a rare disease.  The gov won't cover the… https://t.co/aDbmYuSdHu,MichelJohnss,Commiefornia 💔,0.3
704,"Not everyone from North is HAUSA or FULANI!
And ABOKI means FRIEND not ILLITERATE!🤡
MALLAM means TEACHER not MUMU!
Ignorance is a disease 😎",abbaamss,"Borno, Nigeria",0.0
705,Tb is a disease caused by germs that are spread from person through the air.we arehelping tb paitents by taking car… https://t.co/6gQ48zMN9I,GursimranK75357,,0.0
706,"@JamesMelville They seen how real the Nazis/Ukrainian refugees are they think everyone have disease, We seen the sh… https://t.co/VVRajVCub1",williamtjzhuo,Malaysia,0.2
707,"But there's a rumour spread nasty disease around town. 
 You caught round the houses with your trousers down. 
 A headrush in the bush.",LibertineLyrics,,-0.4518518518518519
708,@616ODlNSON i need to fake a disease to get out of my exam tomorrow so i don’t have to put my mom through the horrors of ticketmaster,twocrpseswewere,she/any | 18,-0.5
709,Today people are spoiling their life due to wrong food and drugs.Due to which the immunity system of people deterio… https://t.co/07KQvWv1e9,MeetPooja2,,-0.25
710,"(1)
👉🏼 TB is a preventable and curable disease, yet it remains one of the world's deadliest infectious diseases. On… https://t.co/sGeCbRjUms",apcom,"Bangkok, Thailand",0.0
711,The natural reservoir of M. tuberculosis is the human host. An untreated pulmonary tuberculosis is the primary sour… https://t.co/LFBSCZn2np,LilyFound1,"Northern, Ghana",0.0875
712,"Due to TB, more than 2 lakh people are dying in a year, due to weak immunity and drug addiction, TB disease is form… https://t.co/9fs5ufbEwJ",NishaGrower,Kurukshetra,-0.03125
713,"@CrustyJockstrap @1pohled @OskarJaeger @ZMiST_Ua In reality no ammunition should be used for the ""disease"" it cause… https://t.co/xyZHQI26G0",MikofCaerbannog,Na casa deste senhor,0.0
714,"@LAPDHQ Noise, fuel, &amp; light pollution are linked to dementia, heart disease, violent crime, cancer, &amp; hearing loss… https://t.co/m5lHFqxs5c",HowTheWestWS,California,-0.2
715,"Join the fight to end TB: Let's raise awareness, support those affected, and work towards a TB-free world.… https://t.co/UDWmKyZSVs",drishtiiaseng,"21,Pusa Rd,Karol Bagh,Delhi-05",0.4
716,"Join hands to end Tuberculosis! 

TB हारेगा, देश जीतेगा।

On World Tuberculosis Day, let's raise awareness and take… https://t.co/Mc5bnKdqVU",drm_umb,"Ambala Cantt, Haryana",0.0
717,"In 2021, a total of 1.6 million people died from TB (including 187 000 people with HIV). Worldwide, TB is the 13th… https://t.co/Pnx7vsKmAc",LilyFound1,"Northern, Ghana",0.0
718,"Today, we remember those we have lost to TB and pledge to create a brighter future for those affected by this disea… https://t.co/r84Q5KgfYN",Sapphire_Goa,"Navelim, Goa, India",0.0
719,#TB is a potentially serious #infectiousdisease that mainly affects the lungs. If you have cough which has lasted f… https://t.co/OBTBcJbzK1,KDAHMumbai,Mumbai,-0.08333333333333333
720,"#World_Tuberculosis_Day, observed on 24 March each year, is designed to build public awareness about the global epi… https://t.co/aA2pir9aOK",RRMCH,Bangalore,0.0
721,"World Tuberculosis Day is recognized annually to raise awareness about the disease and stop its spread.  For years,… https://t.co/Lb1GB44oSZ",GHC_Hospitals,"Thane, Mumbai",0.0
722,"24th  March - World Tuberculosis (TB) Day - #World_Tuberculosis_Day, observed on 24 March each year, is designed to… https://t.co/DggFWW7nlP",SUTAMS_TP,"Thiruvananthapuram,  Kerala",0.0
723,"This #WorldTuberculosisDay, let us aim to eradicate the second-most dangerous disease after #COVID. 

#lunghealth… https://t.co/vpWk1o2Ghs",MedcellPharma,"Leiden, Netherlands",-0.033333333333333326
724,"Spring is here~🌸 and so is #TAN, and they're missing their #SODA so much that they're falling lovesick! 

What's th… https://t.co/LmtnGaZy7W",_Simplykpop,,0.0
725,"#World_Tuberculosis_Day, observed on 24 March each year, is designed to build public awareness about the global epi… https://t.co/Ii1NgCoX4j",schchannapatna,"Channapatna, Karnataka, India",0.0
726,#WorldTuberculosisDay reminds the world that #tuberculosis is still the number one killer among the infectious caus… https://t.co/hAHNltSDTZ,PACEHospitals,"Hyderabad, India",0.0
727,Tuberculosis has been a deadly disease that has troubled humanity for a long time now. Let’s eradicate it from our… https://t.co/QdnW199IQw,KyteroImmigrat5,"Connaught Place, Delhi",-0.25
728,"Increased #awareness, #earlydetection and timely treatment is the key to fight this disease. Consult a doctor if yo… https://t.co/2T4rTdfEFx",KDAHNaviMumbai,"Maharashtra, India",0.0
729,"@CNN Perfect! 

But CNN wants to disfigure children and give them cancer, heart disease &amp; mental health problems.… https://t.co/0PfhcjXpFP",ChloeKittieKat,Northern California,0.36666666666666664
730,"@Andreadobbs2 poison: a substance that is capable of causing illness

illness: a disease or period of sickness affe… https://t.co/ZsUaq5qdWL",smacdonald10,"London, Ontario, Canada",0.2
731,@m4nd4y @realstewpeters The crazy things is nobody is even questioning why all these celebrities are coming up with… https://t.co/bifgY7G8Ar,Mujer_DOM,,-0.6
732,"@dolly_note Noise, fuel, &amp; light pollution are linked to dementia, heart disease, violent crime, cancer, &amp; hearing… https://t.co/s4GurX8IBH",HowTheWestWS,California,-0.2
733,"@DrunkWiseOwl Sign and share Oh Wise One; 

Noise, fuel, &amp; light pollution are linked to dementia, heart disease, v… https://t.co/FQNFZs1Yyx",HowTheWestWS,California,0.55
734,"TB disease flourishes due to drugs and alcohol, wrong eating. Saint Gurmeet Ram Rahim Ji explains that continuous m… https://t.co/fy8BhXBvfC",InsanMonali,,-0.3125
735,@CsOpondo @This_is_Kibande @edgarwabwire_ @MrRightke Being obsessed about anal sex is a disease most of the Kenyan… https://t.co/XuK3NJjVhw,BARDIKENYA,,0.0
736,"Hunger &amp; disease used as a weapon
And a complete siege to suffocate you 
To dry ur fertile womb
To degrade ur honor… https://t.co/WhBkR2Usc7",DaniYeqdmas,Sweden,0.016666666666666677
737,"TB disease flourishes due to drugs and alcohol, wrong eating. Saint Gurmeet Ram Rahim Ji explains that continuous m… https://t.co/asAl8M2G1K",GumberSoumya,,-0.3125
738,"Meditation increases the will power and self confidence by leaps and bounds. Patients, who learnt meditation and pr… https://t.co/KscH4SqMKZ",SimranK15332929,"Ratia , Fatehabad",0.0
739,"More than 20% of TB patients worldwide get the disease from smoking and using tobacco.
            Quit smoking or… https://t.co/gV0V8wB882",HarshG12670,,0.5
740,@HungSingMA @saj9291113 @ProudCatholic15 @KirstiMiller30 @JulesLikely @JBPritzker @JustinTrudeau @wada Trans people… https://t.co/DTLlfgiqe9,gatsby_Kate,"Chicago, IL",0.0
741,@UCLAMaltese @uclatheden Did you know smoking increases your risk for coronary heart disease by 2 to 4 times? Learn… https://t.co/MY8Nkcc3Bd,Dominga17762584,,0.0
742,There is only one cure for terrible to terrible diseases that we increase our self-confidence and self-confidence c… https://t.co/YRvYPJ6Rql,HarshG12670,,-0.6666666666666666
743,"@_aussie17 Part 1 &amp; 2 of this investigation shows the Mrna is causing excess mortality &amp; triggering disease. 
https://t.co/9ntsWpIOL8",kenjera2,,0.0
744,$EDSA - Edesa Biotech to Participate in HC Wainwright Autoimmune &amp; Inflammatory Disease Conference https://t.co/XEwOsxgCQk,Beeken_health,,0.0
745,"@bluemaxmb @LAPDHQ Noise, fuel, &amp; light pollution are linked to dementia, heart disease, violent crime, cancer, &amp; h… https://t.co/j0wpv91WWW",HowTheWestWS,California,-0.2
746,"Acknowledging World Tuberculosis Day with an aim to build public awareness about the disease.
This World TB Day, le… https://t.co/zr59FwKnI9",Nimishaben_BJP,"Morva (h), Gujarat",0.0
747,"A profound video from NYC ICU doctor (3/31/20):

🔥Every hospital working under ARDS paradigm - it was WRONG!
🔥COVID… https://t.co/0QGYXCpec4",WilliamMarsWard,,-0.20833333333333334
748,TB is a contagious disease and can be prevented by timely direction.The volunteers of Dera Sacha Sauda organize mon… https://t.co/uk1u5UB8Ww,Ravinde98390835,"sirsa, India",0.0
749,"@Geospetial @LAPDHQ Noise, fuel, &amp; light pollution are linked to dementia, heart disease, violent crime, cancer, &amp;… https://t.co/P9GQqsrmkR",HowTheWestWS,California,-0.2
750,@Cernovich korotkoff/1905/blood pressure/it’s meaning &amp; importance in cardiovascular disease &amp;how 2 measure it/Nico… https://t.co/iSpymqdbth,Y888AB5,,0.0
751,"@SazeracNELA @LAPDHQ Noise, fuel, &amp; light pollution are linked to dementia, heart disease, violent crime, cancer, &amp;… https://t.co/nR1Ox5XgzW",HowTheWestWS,California,-0.2
752,"I feel like NGP is a disease anyways. It's just a bunch of single braincelled people in a single chat, arguing abou… https://t.co/WvZAD5PJts",Desaulnierist,,-0.07142857142857142
753,"@jamusndit @LAPDHQ Noise, fuel, &amp; light pollution are linked to dementia, heart disease, violent crime, cancer, &amp; h… https://t.co/BZ8woXUA3f",HowTheWestWS,California,-0.2
754,"@killercop1984 @LAPDHQ Noise, fuel, &amp; light pollution are linked to dementia, heart disease, violent crime, cancer,… https://t.co/PgEAgJfURZ",HowTheWestWS,California,-0.2
755,@LindaG_RN @krassenstein He leaves out context because he’s a cancer.  He’s a tweeter disease that is the definitio… https://t.co/8ujdGqlCte,DavidBilder,"Dallas, TX",0.0
756,"@ChapelReza @LAPDHQ Noise, fuel, &amp; light pollution are linked to dementia, heart disease, violent crime, cancer, &amp;… https://t.co/NV76Bv10EK",HowTheWestWS,California,-0.2
757,TB is a very serious disease Saint Gurmeet Ram Rahim ji says that we should practice meditation and have a balanced… https://t.co/CrXVzrAwfH,HarshG12670,,-0.43333333333333335
758,"Saint Gurmeet Ram Rahim Ji explains that by chanting the name of God continuously, a person can easily get rid of b… https://t.co/7HuooDFd96",RavinderBhuka10,,0.43333333333333335
759,"This is the problem with bite sized information! https://t.co/3ugsVG0jey 

#keto #ketodiet #misinformation
Mean age… https://t.co/jb8C6afTsB",WookieBandit,,-0.3125
760,"@VoteNPrice Safe Storage = Criminals Do Whatever They Want

Rare Disease = #CovidInjured",MI_MollyPitcher,Michigan,0.4
761,"@sarahs_berg @LAPDHQ Noise, fuel, &amp; light pollution are linked to dementia, heart disease, violent crime, cancer, &amp;… https://t.co/iXfNUPBalN",HowTheWestWS,California,-0.2
762,"@CriticalCupcake I think that is a toy hauler. That type of door lowers down as a ramp and motorcycles, four wheele… https://t.co/kUHGZ6pWrD",phil8656,"OK, US.",-0.15555555555555559
763,"@saj9291113 @gatsby_Kate @ProudCatholic15 @KirstiMiller30 @JulesLikely @JBPritzker @JustinTrudeau @wada You don't ""… https://t.co/Qlg8PZGCMw",HungSingMA,Naar`ch,0.0
764,"#WorldTBDay is celebrated to raise awareness about TB and efforts to end the global epidemic,
We can end TB! Smokin… https://t.co/DHSw9SCkGE",insan_rabia,"Fazilka, India",0.175
765,"@PaulBlanda @LAPDHQ Noise, fuel, &amp; light pollution are linked to dementia, heart disease, violent crime, cancer, &amp;… https://t.co/l6u8TI9MwD",HowTheWestWS,California,-0.2
766,"To avoid disease TV, put pulses, fruits and vegetables in your diet. 
Do exercise in the morning and take morning s… https://t.co/EIB6wM1juj",Su_BRO777,,0.0
767,"@curtis91324 @LAPDHQ Noise, fuel, &amp; light pollution are linked to dementia, heart disease, violent crime, cancer, &amp;… https://t.co/XPL74llXUO",HowTheWestWS,California,-0.2
768,@1NewsNZ Facts about the Globalists use of many different vaccines to produce many negative affects in children are… https://t.co/F76YHlf7Ky,JamesOnekaka,Golden Bay,0.175
769,"@MusingsMany @3dom13 Yeah lol.

We went from one germ one, disease, one cure (bad enough) to ""everything is covid""… https://t.co/H8M7t98zyu",andzsy,,0.0333333333333334
770,@pannacottabun @kkdreamers_ stanning oor is a disease and it's hella luxury,endingstoru,she/they ,0.0
771,"@DolioJ She's too busy succumbing to heart disease and diabetes. I'm tired of pretending to be cordial. Show up at my door, cupcake...",cailleach_feasa,Wherever you aren't.,-0.15000000000000002
772,"@magnoliafan_1 @LAPDHQ Noise, fuel, &amp; light pollution are linked to dementia, heart disease, violent crime, cancer,… https://t.co/YUN5qWG2ui",HowTheWestWS,California,-0.2
773,"A friend I used to run with just got diagnosed with interstitial lung disease.

We as a nation can't possibly scrat… https://t.co/gaNO7yOkEA",mykill,"HSV, AL",0.0
