,tweets,user,location,polarity
0,Researchers uncover how gene that increases heart disease risk works https://t.co/IGhhuAMGja via @medical_xpress,mogeladze1,boyton beach  kutaisi madrid brooyklin,0.0
1,"It’s Endometriosis awareness month! If I could fight anything to the death, it would be this disease. 

https://t.co/fFN78i1CcD",page_weaver,Butter Bis,0.0
2,@EyeglassEmma I am so sorry.  I have read that longer lasting covid feels like an autoimmune disease.  If that is t… https://t.co/PhbaOjEmel,LateMandy,,-0.25
3,"First thing first
Y r u broke?
How you complaining about the $ somebody spending/sending u?
Be grateful somebody di… https://t.co/BdYtEymocK",prezidentyoung,,0.25
4,"@tribelaw Rather than aggressively prosecuting Trump, FBI/DOJ charades as weekend virologists citing origins of con… https://t.co/WXyb0YIWpC",Whitman1977,"Yakima, WA",0.0
5,@DrLoupis Why? Is it a girl trying to change to a man or Disease?,republican4613,"Gilbert, AZ",0.0
6,"PIKfyve inhibition rescues ALS pathology
https://t.co/l6dFmrgTtd
Our highlight of a study reporting that inhibition… https://t.co/s151sCeDYi",NatRevDrugDisc,London,0.0
7,"Cory Castro, U.S. Representative from AK - ""Humanity First""
In his first 100 days in office, Cory will: 
1. Tackle… https://t.co/Z1mYWO7lz0",demgen2020,,0.25
8,UPDATE 1-Reata shares hit 1-year high after surprise FDA nod for rare disease drug $RETA $SRPT $BIIB $AMLX https://t.co/vBuIjphzrK,newsfilterio,"New York, NY",0.22999999999999998
9,March is #KidneyCancerAwarenessMonth. Let's spread awareness and support those affected by this disease. Early dete… https://t.co/YtZ3KtCYnj,CU_Urology,"Aurora, Colorado",0.1
10,@UsAgainstAlz Alzheimer's can be characterized as an autoimmune disease. 79% of Autoimmune Disease patients are wom… https://t.co/GFTEOZTP1H,dementiamites,,0.0
11,"March is Endometriosis Awareness Month. Why? This chronic disease affects one out of ten women and girls, but still… https://t.co/mU26WS4ikM",WomanCareIN,"Jeffersonville, IN",0.0
12,"@RepAndyBiggsAZ In 2017 — Trump's first year in office — more than 42,000 Americans died from overdoses linked to h… https://t.co/l5RVXDHzaE",SetiokaibaDL,,0.375
13,@SandraYozipovic What dosage do you use for Lyme Disease?,kiwi_seeker,Twilight Zone,0.0
14,"Acute pancreatitis occurs suddenly and is a short-term condition. Several variables contribute to this disease, aff… https://t.co/FPR224PRfa",drnitin_manglik,Noida,0.19999999999999998
15,"Anthony Fauci, American physician-scientist: 'Cruel' Fauci is condemned for spending $2m on experiments which saw b… https://t.co/2igV8B8G7N",john2021animals,UK,-0.5
16,"Someone please make me understand in detail how does a chronic periodontal disease increased risk of CVS. I mean, c… https://t.co/t4HCxWuBTv",simp4Lyaaaaaa,,-0.3125
17,"The IPU, along with @CroiHeartStroke @NIPCIRELAND @1Hildegarde @Irishheart_ie is calling on the government to addre… https://t.co/PYnNBty6kM",IrishPharmacy,,0.0
18,as I approach the anniversary of my cardiac event… a great share/reminder that not all symptoms are experienced ‘as… https://t.co/a71NaNhJfP,technolandy,"Powell River, British Columbia",0.5166666666666667
19,"@AmritHallan @mariawirth1 Sorry u were wrong sir , neither British nor Islamic invaders are the disease. They can b… https://t.co/GRWfk7dI94",VenkatNithin1,,-0.3333333333333333
20,"@Timcast Well when your engaging in satanic ritual, you have evil spirit going in and out of you and it almost alwa… https://t.co/e5CIQBHVaU",Maximus44HD,Your house,-0.3
21,"@_sid_the_cat__ Thanks I have a rare disease also. Best to your mom,sid",ChrisGoeeeee,,0.5
22,The Link Between Oral Health Disease and Overall Well-being: Prevention and Treatment Strategies https://t.co/tsWH6iUGeN,hrsynews,,0.0
23,in a way that didn’t increase their chances of dying of Covid. It was feared chemotherapy would make them more vuln… https://t.co/L5PkmuLdQg,MOGANDERSONBAK1,"Cholsey, England",0.5
24,"@RealUnsweetDee @MsBlaireWhite @ShifterofShapes Having flashbacks to that time when my doctor put me on a low-salt,… https://t.co/LBiEp4hU77",regeya,,0.0
25,@science_lil @thepedimom @drsiyabmd One of your fellow Team Halo propagandists said COVID mutated🤣🤣🤣🤣🤣 You shills a… https://t.co/z8nT0Epqv4,tme_toni,"Miami, FL",0.0
26,"At your diabetes check-up speak to your doctor about kidney health.
Your diabetes team can work with you to help yo… https://t.co/2D12FJg83b",Diabetes_ie,Dublin & Cork,0.0
27,This is the biggest lesson I learned researching the history of the theory that oral polio vaccination in the Belgi… https://t.co/XuvmwkQZds,erikmbaker,,0.0
28,"""It was very hard, definitely confusing as a kid, and I remember just being very scared,"" says Jodi Young about wat… https://t.co/ad4WlgjguG",calgaryherald,"Calgary, Alberta",-0.09479166666666666
29,@RogerDHD_ @OrcpilledGnomer Im in so much pain because of ADHD. But a fat femboy ass on my face might help to calm… https://t.co/t2eFPZ6Ygk,RyoIsDesu,,0.25
30,"@GalgosdelSol Poor Flossy, horrible disease but she will flourish with your undying help and love.❤️💕",ferrakers,,-0.3
31,"COVID-19's origins remain hazy. Three years after the start of the pandemic, it's still unclear whether the coronav… https://t.co/GfJq9peNiP",WashTimesLocal,"Washington, DC",0.0
32,Rockstar Regina Myers @CHOP_Research @CHOPCancerCntr looks at impact of prior therapies to #CARTcell outcomes. High… https://t.co/xtbkmPTo2v,CapitiniMD,"Madison, WI, USA",0.08
33,"Doubt. For protect my heart, intertwined with a lot of
OUNASS_NOON_PROMO_NON_TOYOU_TO_Fordeal_HM_Bath_and_Body_H&amp;M… https://t.co/NxS8SGHcw3",JadaLarocca,Heavenly Zswagger California(;,0.0
34,Glad to be part of this team! Come and join us in Madrid on 10-11th March for this new @PCRonline course on valvula… https://t.co/vRJqvryyzd,vincenzo_tufaro,"London, England",0.3181818181818182
35,"“From tracking the disease’s spread in wild birds to updating human vaccines, there are measures that could help ke… https://t.co/fbDpzM64Yx",AmeshAA,"Pittsburgh, Baltimore, NYC",0.05
36,Thanks to all who gave! There's still time to honor #RareDiseaseDay and #DADA2 patients by sharing this tweet or ma… https://t.co/TVyxpPhdFr,dada2foundation,,0.2
37,That area was being studied because everyone thought it was likely that a future infectious disease would emerge from that area,TheLastNeocon,He/Him/His,0.0
38,"Casper, Wyoming lighting up for Rare Disease Day! Thank you Kala McWain for the submission. #RareDiseaseDay #NPKUA… https://t.co/cGka5bf1J3",NPKUA_Info,USA,0.3
39,"@NjbBari3 @djammurray Noor, can you explain how this is legal/ethical? I can’t believe there aren’t rules about inf… https://t.co/rQ5kwHvN0l",SMpwrgr,,0.2
40,"Huntington's disease impacts EVERYTHING, even sleep patterns.
Swing In A Tree: ""Into the Night""… https://t.co/izdrYG8XQU",LizbatChapman,"San Antonio, Texas",0.0
41,"Facts you don’t know about Diabtes:
1. Worldwide, diabetes is the leading cause of blindness
2. Those with type 2 d… https://t.co/RufPOl8mvR",beksbinnoor,"Isiolo, Kenya",0.0
42,"@balletcoke @slaydiarabian @ThunderBay45 Idk why u keep coping with this, sure Pakistan has this disease.

Doesn't… https://t.co/k2cBTZ8L2W",BihariSher0102,Butifool Bihari,0.5
43,"@BatmanJ27190203 @spooniechels Exactly, which is why folks in this country need to make a fundamental decision. How… https://t.co/tDcuExvegB",JanieChuckles,"Pennsyltuckey, USA",0.25
44,Looking for DRs in @RepGusBilirakis district who support #raredisease and want to advocate! Help Patients get off l… https://t.co/u8j0NTZnjf,GillianHSapia,"Wellington, FL",0.0
45,which causes the immune system to attack the small intestine after ingesting gluten. https://t.co/8sKjg6e7Jz https://t.co/Ljuigah6yF,RawHarvest,,-0.25
46,"@GSUgambit vs the disease's affect on the body?
or vs slowing the spread of the particles that once consumed, give you covid?",BlaktimusPrimus,Wherever Negativity Thrives,0.0
47,"Stop obesity stigma 🚫

Obesity is a disease, not a lifestyle choice. Causes of #obesity include genetic + environme… https://t.co/KfncMjaDaM",EASOobesity,Europe,0.0
48,@hope_terror Having the “if it hasn’t happened to me it’s not real” mentality is the disease,furkyourwurk,"San Antonio, TX",-0.1
49,THE BEDROCK DISEASE CONTINUES...,cawthelesbian,20 | they/them | ac: @danotiel,0.0
50,@PaulSkallas That it's impossible to build grand public buildings anymore is one of the most glaring and telling sy… https://t.co/J0FxjkYdal,peterpattakos,Northeast Ohio,0.08333333333333334
51,"PSA - do NOT let Galen Weston con you into PAYING for vaccines! 
https://t.co/vmKUw5rVIb?",BuxomDiva,"Toronto, Ontario, Canada",0.0
52,Impaired Curve Negotiation in Drivers with Parkinson's Disease https://t.co/HuhGZpQeDR,EurekaMag,Tallinn,0.0
53,@RobertJohnDavi Addiction is a suffocating disease that requires long term intervention and treatment.,CGeliebter,,-0.275
54,"According to @nkf 37 million American adults have kidney disease, and most don’t know it. Take control of your kidn… https://t.co/ghjljcU6RW",carevantexas,Texas,0.25
55,"Why is prior auth so damaging for patients?
👉 You shouldn’t have to choose between paying rent and paying for medic… https://t.co/BEUrf4rRXd",candacegranberg,"Rochester, MN",0.0
56,That it's impossible to build grand public buildings anymore is one of the most glaring and telling symptoms of our… https://t.co/vfBD6BVzga,peterpattakos,Northeast Ohio,0.08333333333333334
57,@furkyourwurk They have very little sympathy for people struggling mentally or with an invisible physical disease.… https://t.co/nRz472eAhq,hope_terror,,-0.11458333333333333
58,"15-year-old John Eary Jr., or as his family calls him “Lake,” was diagnosed with SMA when he was only a year old. https://t.co/fPTpZEmGCJ",WDTV5News,,0.06666666666666667
59,"February 28 was Rare Disease Day. ""Leprosy Patient Demonstrate Against State Administration""; Bhopal. India - Octob… https://t.co/znsF0GT1nJ",dispatchpress,"New York, U.S.A",0.3
60,@AfricaCDC in partnership with @MastercardFdn thru the #SavingLivesLivelihood initiative is supporting the integrat… https://t.co/qwSY0OkUtQ,AfricaCDC,"Addis Ababa, Ethiopia",0.25
61,@jsuryareddy He die from lung disease... What is this? I think we all are living in fake world ? He would have surv… https://t.co/s2rjlw5NMV,Thumno2,India,-0.5
62,@jbassendine @freddiesayers Seriously? They lied about everything! How many died of covid or with merely a positive… https://t.co/sGQIFlZA5a,grumblechuk,канада,0.1313131313131313
63,"March is  #EndometriosisAwarenessMonth 🎗
Millions of people globally are affected by this “mysterious” disease. Alt… https://t.co/XZcY4QLRRC",cviiitie,South Africa,0.0
64,Hey @globalnews how did you find out about the Legionnaires disease on Kingston base you reported on Feb. 23? Was i… https://t.co/cgbCuelADs,NChartierET,Montreal,-0.8
65,I cannot believe this is a real study. @imperialcollege What happens when your participants develop #longcovid? The… https://t.co/jR88sJOP3v,annesmithmcc,England,0.2
66,"@ValanyHNDRXX Bruh, Big disease.",Chuma_001,Web3,0.0
67,"Badmind a di wussest disease. 
Thank Jah mi nuh predisposed 🙏🏽",jahknowsue,Neverland,0.0
68,i was already born sick like a zombie and i was forced to take 3 shots of pure poison because my family are loyal s… https://t.co/WyRxa8Lkfi,leprosy108,third world,-0.11666666666666665
69,Let's start at the beginning--what is Feline Chronic Kidney Disease?  It is a gradual deterioration of the kidneys… https://t.co/S00TyNjQ1C,FelineRenalRsch,,0.0
70,"Kidney Month is here, and It's time for our 9th annual #FelineCKD awareness campaign! Chronic Kidney Disease claims… https://t.co/u9s0IR96Hs",FelineRenalRsch,,0.0
71,"@natalieben @TheGreenParty What's really worrying is that obesity has an impact on cancer, diabetes, heart disease,… https://t.co/oF33PGaiav",JosephW56436640,,0.2
72,parasocial dick sucking disease exists bo ja na to cierpie https://t.co/pI7OJ6Gz7r,wayvisie,she/her 22 w6yv,0.0
73,"@HHillespie @tomhfh You do realise 80+ people are at risk of dying from influenza, heart disease, cancer etc too ri… https://t.co/P3J21gAdRa",OutlierBlackBox,,0.0
74,"@CharlieGorr @ForwardSaratoga @ninaturner While this may be true, don't think that 30K doesn't play a role. What's… https://t.co/dPsUabacaB",snakefield1,West Texas,0.35
75,@eternalbruises @dejadehaan his disease is what makes him shaped the way he is which is what they were making fun o… https://t.co/ezuWv5PXLl,delusi0nal_VSA,19+f@tphonic+she+blk,0.3
76,8x more people died due to C-19 Vaccination over 6 months than died of COVID-19 over 18 months according to UK GOV.… https://t.co/02vJTRabZj,justaplacetosee,,0.1875
77,also what if they find out I have a terminal disease,traderjoeh0e,25 • they/them ,0.0
78,"Powerful #researchethics op-ed: 

""In this kind of situation, use of a placebo in a progressive rare disease should… https://t.co/738I0wrXb0",TranspariMED,"Bristol, England",0.39999999999999997
79,"Fish oil Dosage per Day Recommendation for healthy adults and adults having heart disease, High Blood Pressure, Rhe… https://t.co/uuvTnkpxze",healthyious,,0.33
80,"""It was very hard, definitely confusing as a kid, and I remember just being very scared,"" says Jodi Young about wat… https://t.co/5bKcADcKpJ",winnipegsun,"Winnipeg, Manitoba",-0.09479166666666666
81,Spider angioma(nevus)- tortuous dilatation of arterioles just beneath the skin which radiate outwards like a spider… https://t.co/zHDBd2I5TH,Drgomathi_tn,India,0.0
82,"Throwing out all my #erythritol tainted stevia. Just got a big box of this at @Costco, but erythritol is now linked… https://t.co/hnfLh36zcU",thepresenceusa,"Lexington, KY",0.0
83,"@ParkerThune ""Greed is a disease""... says the guy whose school is destroying college football by chasing a bigger payday in the SEC...",noblecane,,-0.10000000000000002
84,Satisfying mid-life relationships linked to lower multiple chronic disease risk in older age https://t.co/ogxjr1J8i4,AMHCA1,,0.16666666666666666
85,@CathySimms4 @GenFlynn Please tell me you know this. 🙄 “ the Trump administration eliminated a key American public… https://t.co/HiHbVVABcD,mindfulkoala,,0.0
86,@Rap The way people smoke weed increases their risk for heart disease.,Westernophobic,,0.0
87,"@Gizmodo Hypothesis: the link is that obesity and cardiovascular disease are already correlated, and obesity and ar… https://t.co/0wSk4mI7rM",logfromblammo,en-US,0.0
88,"""I can see progeria as a disease that can be cured in the not-too-distant future. I feel very optimistic about that… https://t.co/PsPeo5wkZL",Progeria,"Boston, MA",0.03333333333333333
89,"@Dave_Likes_CO2 @foxiedoxie777 @schlengerg865 @ZaleskiLuke @alx here's a good start..

Transmission of the disease… https://t.co/3XvjqoesZF",CoLonghorn,,0.7
90,March is colorectal cancer awareness month. Most of you know I had my own battle with this horrible disease in 2014… https://t.co/BoVVDi8RPf,johnpogas,"ÜT: 40.324487,-74.629542",0.03333333333333336
91,"Former NFL star, CBS anchor Irv Cross had brain disease CTE
https://t.co/W4itF5izTQ",RiceFame,"Radcliff, KY and Global",0.0
92,@ebrose92 @Zuxs13 @bolivershagna2 @catturd2 It was weaponized in a lab.  It’s a bacteria that causes disease unlike… https://t.co/RPGIz0MC7E,jcryptoscience,,0.0
93,"International Symposium on Tick-Borne Pathogens and Disease,
in honor of the late Dr Gerold Stanek
October 22-25, 2… https://t.co/0t2WMEXGTb",BStevensonLab,,-0.15
94,93% of the global burden of disease from climate change falls on children. - Dr Were #StJudePIDS2023,PIDSociety,"Arlington, VA",0.0
95,"...noting the ""link between loneliness and chronic health conditions, including heart and lung disease, stroke [...… https://t.co/B8NnQmBBt4",bnjm,"Albuquerque, NM",0.0
96,"The Irish Times encouraging seniors to start living like it's 2019: ""fears about the virus cannot be allowed 'to st… https://t.co/N1zkfT0XtF",bnjm,"Albuquerque, NM",0.0
97,"FOR WHICHEVER ANIMAL THEY WANT TO PUT TO SLEEP. THEY THEN USE ALSO DISEASE LIKE PNEUMONIA OR OTHER ONES, AS AN EXCU… https://t.co/sm5xqZ6JTI",NatashaBready1,,-0.125
98,And guess who’s working 36 hours? the doctor— who understands human body and disease. Who tell you not to not too i… https://t.co/kUIvHkMKZd,lucentbeam12,,0.0
99,"quit playing victim, it's a disease.",nisia_am,why?,-0.07500000000000001
100,🔛a must-read: a good summary of #genetictesting in the diagnosis of chronic kidney disease #CKD @senjoven https://t.co/4sB7thaTH3,m_furlano,España,0.7
101,Rare Disease Day zebras were sighted at Emory University Hospital! #ShowYourStripes  #RareDiseaseDay https://t.co/EyNFkAxVCS,EmoryGenetics,"Atlanta, GA",0.3
102,@benshapiro Victimhood is a disease,LukeSwartout,"Ellensburg, WA",0.0
103,"@AOgieglo I am not saying i don't have sympathy for this family. I 
 hope BC reverses the decision. I travelled wit… https://t.co/jj7ZQiQ5eM",terryjago,Moose Jaw SK Canada,0.0
104,"@IsThisOkay2 @AriDrennen Nobody reasonable advocates for ""free"" anything. Least of all an expensive commodity like… https://t.co/Jc5vbV8tPR",Freedomalternat,"Cluj-Napoca, Romania",-0.049999999999999975
105,"TSC in the News: On #RareDiseaseDay, Corpus Christi 2-year-old shows not all hope is lost via @KRIS6News 

https://t.co/ujl8hXEC5O",tscalliance,United States,0.1
106,Bowel cancer is treatable and curable especially if diagnosed early. Nearly everyone survives bowel cancer if diagn… https://t.co/HHOArQ3rYy,Tsinghalsurgeon,Orpington Kent,0.06666666666666667
107,"37 million in the US suffer from CKD, and millions more are at risk of developing the disease. Evergreen's goal dur… https://t.co/W8Gf4lHD8A",EvergreenNeph,"Nashville, Tennessee",0.5
108,@StevePhillipsMD I have Graves’ disease . It had been in remission for years. It came back with a vengeance after I… https://t.co/elBhMgArWk,strandedonli,"Long Island , New York ",0.0
109,"2) In Ireland, family life &amp; connection were seen as a luxury add on. Residents were seen  as vessels of disease ra… https://t.co/fWPIHcYaES",CareChampions2,Ireland ,0.0
110,"Frequent exercise helps lower the chance of developing chronic conditions including diabetes, heart disease, and so… https://t.co/Ypf6nirEuD",GuiltlessE,,0.1
111,"This news makes me incredibly sad, not only because I was a fan but the devastating reminder that addiction can str… https://t.co/nQjtNfn6YF",cooltxchick,"El Paso, TX",-0.5
112,@Pawkeshup @Rudi2Shoe @fuckyouiquit @Zarren364 Addicts 100% need support or they will never get better. We can't ju… https://t.co/sZCSfYChD3,JoeRice9717,"Wright City, MO",0.5
113,@heisveryhappy @devgru1980mi Have you looked into the affects of magic mushrooms and or cannabis. It may alleviate… https://t.co/TSbMiMZnt8,BabajiPalmtree,,0.5
114,Researchers uncover how gene that increases #heartdisease risk works https://t.co/6qOY97iHj0 https://t.co/6gjbJ2V9CH,medical_xpress,,0.0
115,'Beyond parody': Critics torch Marjorie Taylor Greene for her latest appeal to Republicans https://t.co/MCOHOPTfya… https://t.co/C6nAF49h5o,crucifriar,,0.5
116,Serious Injury/Industrial Disease law firms needed to take referrals. (Guideline compliant.) Can be solicitors or D… https://t.co/LKzjjDHvMg,conveyancy1st,United Kingdom,-0.3333333333333333
117,Online speculation about the origins of COVID-19 are soaring following a new report from the Energy Department that… https://t.co/OUsebvmmgb,ksatnews,"San Antonio, TX",0.06818181818181818
118,"Non-occupational physical activity and risk of cardiovascular disease, cancer and mortality outcomes: a dose–respon… https://t.co/QmngbRYKSm",drlhodgson,"Worthing, England",0.0
119,This month is Ovarian Cancer Awareness Month. Ovarian cancer is a disease that can disrupt the normal function of t… https://t.co/OBRoi8sVzR,CtSLincs,"Lincolnshire, UK",0.15
120,"Long-term levodopa ameliorates sequence effect in simple, but not complex walking in early Parkinson's disease pati… https://t.co/uxn193rlQy",ParkinsonJC,,0.05
121,"@BigBenDeCastro True that, you have the choice for regular Eucharist wafer, or hold up your little finger when you… https://t.co/D7rN6iV0lM",GriffenBurkes,"New England, Prov Rhode Island",0.05416666666666666
122,The term Center for Disease Control implies they are controlling these diseases and outbreaks. There is a reason th… https://t.co/4JyKbI2yTn,Whatyou15061841,Texas,-0.1
123,To well controlled Harvard studies have shown that walking 20 minutes a day will reduce your risk for heart disease by 30%,RandyStru,,0.0
124,"&amp;""Bd} Cancer is a deadly disease.    #上海 #天津    #青岛         https://t.co/RRzi7cbi0B",flores15_maria,,-0.2
125,@TPUSA Utterly ridiculous.. wokism is a mental liberal disease of the mind and it doesn't get better it gets worse..,Candida21378059,,-0.08333333333333334
126,"@StuartMeissner @aaronjmate In early 2020, the director of the Centers for Disease Control and Prevention spoke at… https://t.co/79GE0byngY",Lele_huang1203,,0.1
127,@TakesAppalling its a disease,sigma9431,Northern Columbia,0.0
128,"March is #NationalKidneyMonth!

In the US, Chronic Kidney Disease, or #CKD, affects almost 40 million adults.

Kidn… https://t.co/m1GX2PKXZh",RVANephrology,"Richmond, Virginia",0.0
129,Jealousy is a disease 🙃,suppe_entusiast,"Levanger, Norge",0.0
130,i’m starting to believe 100% that i have crohn’s disease like my dad but i will never find out bc i refuse to have… https://t.co/XdxciqKDNG,sirenwingzs,ʚ 𝟏𝟖 𝐭𝐡𝐞𝐲/𝐭𝐡𝐞𝐦 ɞ,0.0
131,"Let yourself slow down properly. Please take good care of your body. I sincerely hope you can live a healthy, happy… https://t.co/ZqnUi651mz",JP_sweetheart,,0.2726010101010101
132,"My niece Rania suffers from an auto-immune disease which weakens her and gives terrible,painful lesions on her body… https://t.co/j6e8Gs5Jbn",Marniama,"Soissons, France",-0.7666666666666666
133,"Please, don’t ruin your child’s adult life because of a distressing puberty. Puberty is being sold as a disease, an… https://t.co/ZQWT1UbFmy",detransaqua,"Big Rapids, MI",0.1
134,"@cperruna Chris,

I respectfully disagree with you on this one. Yes, he might have done several mistakes on assessi… https://t.co/9EfRpsGqw7",Kumar_5686,,0.25
135,Playing CoD daily is a terminal disease,Highweaver_,Earth,0.0
136,@houstontxas Of course we are happy to be part of NATO but you see that the big nations always look down on smaller… https://t.co/KF1cyy47c5,Jarek_73_,Czech republic,0.16111111111111112
137,"@franalicee @McDonalds Books to help them read, burgers to make sure they die prematurely due to total ecological c… https://t.co/W3sCIPjS8P",TEOTWP,Miranda,0.19375
138,I was really pleased to be invited on @BBCRadio4 this afternoon to talk about Coeliac Disease and the cost of livin… https://t.co/NPoKAsCYCh,Steeliac,Sheffield,0.5
139,@PZonLAKEontario @rachbarnhart What’s the disease?,OracleRochester,"Rochester, NY",0.0
140,@RepMTG Now where exactly did you get your medical degree and infectious disease qualifications from? Right you don… https://t.co/IRwYzdBFna,maryderrickart,Canada,0.17857142857142858
141,"when did asia become ""world"", idk but being dumb on your fandom is like a disease 🥴🥴 https://t.co/C9n7Genl84",KEI4HWAN,"selective, DNF/ slow in dms",-0.375
142,"Cycling teacher, 44, felt 'a disruption' in her body. 3 days later, she had a 'widow maker' heart attack.… https://t.co/y7hPamkN8I",uma_johnny,"Anywhere, USA",0.0
143,@wlwkaeya LMAOO NOT THE LUNG DISEASE,0milo_,,0.0
144,"@cannoli1000 @Connabin0id @PhysicistTx @shannonbaker114 Liberalism is a mental health disease, so it seems the sick ones are on your side.",opforban1,"Georgia, USA",-0.40714285714285714
145,@NattieForsyth @EllisDunegan @MTFs_Posting_Ls It has been previously reported that men with and without known disea… https://t.co/3r8cAWuyJB,BettyBoo2023,,-0.16666666666666666
146,@spcjinx @marymporte @EdKrassen He studied coronavirus for decades then went on 60 minutes in MARCH and told Americ… https://t.co/hb3N5g4fjC,marketmoves11,,0.0
147,"(3) There are many more details to the HIV, but it means that the HIV were not a zoonotic transfer to humans. It wa… https://t.co/4AGJ7JEtkq",skyfienergy,Genuine Earthlings,0.5
148,@RonFilipkowski @RonDeSantisFL The definition of short man’s disease,ChrisLove9467,,0.0
149,Disgusting disease spreading unmannered i can't emphasis just how much they ahnoy me,fairestlilac,Shtwt + Edtwt,-0.4
150,"no one knows !
-
Three years after the start of the pandemic, it’s still unclear whether the #coronavirus that caus… https://t.co/QaupuDMBFO",tameryazar,Turkey-Israel,0.0
151,"#Ghana joined the Global Community to #LightUpForRare yesterday at the #NationalTheatre.
#thankyou so much for part… https://t.co/ZW1lIxgt96",RareDiseaseGh,Ghana,0.1
152,"Elon Musk says ‘media is racist’ against white people, defends ‘Dilbert’ creator’s racist comments… https://t.co/0bB40yEc9G",Sumanitu,"Lewisburg, Oregon",0.0
153,Federal regulators approved a drug to treat a debilitating disease using data collected about patients over decades… https://t.co/v7voLvdoVH,WSJscience,"New York, NY",0.0
154,"Out of spec products, Hispanic race, high risk cytogenetics, infants, extramedullary disease and Down Syndrome do n… https://t.co/CqinP1aycp",CapitiniMD,"Madison, WI, USA",0.0022222222222222088
155,@0milo_ i wish she was obsessed with me and not lung disease over there,wlwkaeya,gracie | she/her | 16,-0.5
156,"@jihadwatchRS indeed, has to be mental disease",RakeshD38069650,"New Delhi, India",-0.1
157,Justin Bieber just canceled his tour. Continuing problems from Ramsey had disease which we know how it was caused.,laureldezan,"Boise, ID",0.0
