,tweets,user,location,polarity
1831,"AIDS is a disease that is hard to talk about!

#worldaidsday #worldaidsday2022 #AIDS #HIVAwareness #aidsawareness… https://t.co/7y29QwFLht",ubuydk,Denmark,-0.2916666666666667
1832,"#WorldAIDSDay2022
#WorldAIDSDay
Continuous practice of True Method of Meditation can helps us to get rid of incurab… https://t.co/ADEjSrVC7u",behindYourGF,,0.35
1833,"World AIDS Day is being observed today to create awareness among masses about causes, symptoms and precautionary me… https://t.co/d87Af2en5g",RadioPakistan,Islamabad,0.0
1834,@elonmusk @ashleevance Hope someone finds similar device for Parkinson's disease too.,Saltwatermate,"Dubai, United Arab Emirates",0.0
1835,"In future,Neuralink prostheses might help people with various kinds of neurological disorders where there is a disc… https://t.co/F5FnPRpSjV",OfBloomberg,🇨🇦 🇫🇷 🇪🇺 🇺🇸,0.0
1836,here you can see all the mental disease that has inhibited my brain via ms paint https://t.co/2F9DS2icSk,bakudadadan,any pronouns,-0.1
1837,AIDS is said to be incurable disease. There r hundreds of DSS followers have medical report of practising method by… https://t.co/wcfQg6Twsa,Priyainsan_00,,-0.25
1838,Together we must work hard to put an end to this disease and have a beautiful tomorrow. Best wishes on World AIDS D… https://t.co/b0cr92axZk,AstroRajKaushik,,0.5194444444444445
1839,@DzintraSullivan Agriculture. Led to class systems and disease.,WhistleAlley,"Seattle, WA",0.0
1840,jealousy is a disease &amp; I am sick to my stomach because kim yesung holy fxxk 😩 https://t.co/xn9rDnJZy0,_kimiganaitara, 🏳️‍🌈•hyukhae•rpf/rps•🔞,-0.7142857142857143
1841,Chennai: Apollo doctors perform first brain bypass surgery on 8-year-old twins with Moyamoya disease… https://t.co/boYut9FkCb,medicaldialogs,"New Delhi, India",0.175
1842,There’s that “disinformation” word again…liberalism is a disease. https://t.co/i9kdLYdWET,upland_guy,,0.0
1843,"@elonmusk @ashleevance 2 questions.
1) will neuralink be compatible with nano tech in the future to help humanity f… https://t.co/1LVUqFsQU1",Ivan_the_grate,Америка,0.0
1844,"AIDS is a disease that is hard to talk about!

#worldaidsday #worldaidsday2022 #AIDS #HIVAwareness #aidsawareness… https://t.co/GqPIMTJsg2",ubuycz,Czech,-0.2916666666666667
1845,@ashleevance If I could have saved my dad from his disease progression with a chip. Oh gosh we would have in a heartbeat.,AnnaKathr,,0.0
1846,Grateful invasive cardiovascular technology (CVT) profs Pacana &amp; Woods invited me into their classroom 2 see how ou… https://t.co/uQ7zF909kH,HACCSki,South Central Pennsylvania,0.0
1847,Together we must work hard to put an end to this disease and have a beautiful tomorrow. Best wishes on World AIDS D… https://t.co/Tgo0RlR1Gn,INSUREGAIN,Chennai,0.5194444444444445
1848,World AIDS Day is significant to fight the stigma around it and focus on providing care and support for those who a… https://t.co/7nJKowiI9s,OfficialGwda,"Nakuru, Kenya.",0.375
1849,"things like long covid and celiac can disable you, depending on the person, but it doesn't usually change how u LOO… https://t.co/VjntvIy7Lu",soffbrownie,,-0.15
1850,"Research uncovered that if a close friend is happy, it increases the risk of heart disease and dementia.",UberFactsEbooks,,0.8
1851,"@drobwlldiad @AlanBixter @slsandpet @camybobany Many from the cruise ship are wearing masks, while Hobartians seem… https://t.co/8REZelSCYh",bagger_blue,Australia,0.5
1852,Practicing Meditation helps one to cure even an incurable disease. 100s of Dera Sacha Sauda followers have recovere… https://t.co/eezfDYsRV4,KukrejhaPooja,"Faridabad, India",-0.5
1853,"AIDS is a disease that is hard to talk about!

#WorldAIDSDay #AIDS #HIVAwareness #aidsawareness #ubuy https://t.co/GS3dRUyrR3",ubuybhr,Bahrain,-0.2916666666666667
1854,AIDS is such a disease whose treatment is not possible. Saint Ram Rahim Ji told that by the method of meditation we… https://t.co/BPme8vEsSV,Kasam03575994,,0.0
1855,@LJ54401 @AlexBerenson Try Cancerous Oral/Venereal Infectious Disease. Aka herpes. If you saw commercials during th… https://t.co/9SyNQO8eci,youllbehoright,,0.0
1856,@90sjisunglix jealousy is a disease and i have it.,sugas_princesa,She/her 19,0.0
1857,"HIV/AIDS is a global pandemic affecting over 35 million people worldwide. This World AIDS Day, take a step in comba… https://t.co/LV5pHCQAQU",ISC_Updates,India,0.0
1858,"On World AIDS Day, let us all pledge to be sympathetic and empathetic towards those who are fighting a battle again… https://t.co/4C48dzLgEN",faidepro,India,0.5
1859,Together we must work hard to put an end to this disease and have a beautiful tomorrow. Best wishes on World AIDS D… https://t.co/GFJwsUPqpW,sparmar6925,,0.5194444444444445
1860,"@1Creole_Pisces @evelynvwoodsen This why our people be sick and dying from heart disease, diabetes, and cancer 🤦🏾‍♂️",IllWillofficial,"📍#CHICAGO/ OUT WEST ,ILLINOIS",-0.7142857142857143
1861,Prediction of Decompensation and Death in Advanced Chronic Liver Disease Using Deep Learning Analysis of Gadoxetic… https://t.co/p35xNzeghQ,Dataemia,United States,0.2
1862,"Ram Rahim ji has told that DNA works as a powerhouse in our body, it works on our thoughts. With DNA we can beat an… https://t.co/9X3jR8fLBN",Ashokin98910758,,0.0
1863,Demo of this “basic” first generation device producing visual stimulation to monkey by researcher who wants to rest… https://t.co/hgI1yMdpMi,yyolk,"Chicago, IL",0.08
1864,"@grog18b @Kaffir_Kanuck @Kam_Bach Never said you were, But I am under a mask mandate, that was set in place to prot… https://t.co/qTAsmuX9dh",GEEBEE25080796,Ontario,0.0
1865,@ERICSORENSEN So if you disagree with a scientist and learns more and realizes they are wrong what’s that dim wit.… https://t.co/eluWr5YTRM,dmz215,,0.03333333333333333
1866,@don4georgia @ztexas17 @SenRonJohnson This vaccine won’t stop them from being sick or disease ridden.  That is the… https://t.co/llgXAzsjt7,SChazaq,,-0.7142857142857143
1867,"By April 2022, the United States Centers for Disease Control and Prevention (CDC) data show that about 6 in 10 adul… https://t.co/kbD9cBeElB",cayenne55,SC,0.0
1868,"May we put an end to this life-threatening disease to leave our generations a world free from AIDS.

#WorldAIDSDay https://t.co/TqAarO5ObZ",odiadailyin,Odisha,0.4
1869,@XRPvegas_ @LeftAnimalFarm @SebGorka What is shocking to me is that people do not know that only a portion of the 6… https://t.co/PhYhOBfbIf,TrevorL24072839,,-0.5
1870,"#WorldAIDSDay
Aids consider an incurable disease. But, Do you know? That one can overcome these types of deadly dis… https://t.co/jztm90iWV0",Pruthi_Monu78,"Jind, Haryana, India",-0.35
1871,@ArtKatona A disease embedded deep within,jameslavish,"Las Vegas, NV",0.0
1872,"World Aids Day.

World Aids Day was established in 1988, just four years after the virus was discovered.

Today, le… https://t.co/0pwVcxfYR9",newvisionwire,"Kampala, Uganda",0.0
1873,"AIDS is a disease that is hard to talk about!

#worldaidsday #worldaidsday2022 #AIDS #HIVAwareness #aidsawareness… https://t.co/8hxzq2jLAh",Ubuy_au,Australia,-0.2916666666666667
1874,The largest barrier to accessing healthcare is income and demographic; about 20% of low-income women are uninsured.… https://t.co/b223FfJ5sl,Kelleyjulie2,,0.0
1875,One can defeat any type of incurable disease by medirarion and self confidence. By chanting the Guru Mantra told by… https://t.co/rurOeV9vJT,Geetabatrabatra,,-0.5
1876,the world was going to die of?  disease probably.,senoritajosie,"Los Angeles, CA ",0.0
1877,World AIDS Day 2022: What are different treatments for AIDS? - Firstpost https://t.co/5fxArxqEiN,AlternMedicine1,London,0.0
1878,"Ckirirahpiks isn't a bad guy. Hes a Pawnee man trying to survive like the rest of his people. 

What I found intere… https://t.co/HkUKlAC5nw",DarthSagaswag,"Oklahoma, USA",-0.6999999999999998
1879,"#WorldAIDSDay2022
#WorldAIDSDay
Explore blog to understand the importance of True Method of Meditation and how it i… https://t.co/OpZpJqj4Fu",behindYourGF,,0.35
1880,"It is possible to cure many small diseases and to eliminate the biggest disease of HIV, then it is possible only an… https://t.co/UknYIm1gFb",DeepKaur2207,,0.05
1881,@JohnTelich8 @fox8news @John_Sabol Best of luck Jim. Terrible disease.,tkimbroo,,0.0
1882,and the disease continues... https://t.co/b3CyhhUTkW,azad_hersh,India,0.0
1883,@banduflower @oompaville @METAPCs @idolmassacre i have a disease....♡,Lateralxyz,Any Pronouns ,0.0
1884,With strong self confidence one can defeat any type of incurable disease .by chanting the guru mantra told by Saint… https://t.co/FAb5YeI8si,SIMRAN60783911,,-0.033333333333333354
1885,"The mountains I knew so well burned with hellfire in the blue light of midnight. Brother, I watched the sky burn- a… https://t.co/LFHg8NIyj0",crimeboyszone,ic RADIO00_ / every 30 mins,0.2
1886,"*TAKES DEEP BREATH*

I AM FINALLY FREE FROM TWITTER JAIL AND I HATE TWITTER JAIL AS MUCH AS I HATE TWITTER AND I WI… https://t.co/JnCP7QWnoJ",regenerateleft,,-0.2333333333333333
1887,With strong self canfidence one can defeat any type of incurable disease .what do you know ? According to the by Sa… https://t.co/7EUt6P7veB,ReshamS23320131,"Haryana, India",-0.033333333333333354
1888,#WorldAIDSDay       #WorldAIDSDay2022       Saint Ram Rahim Ji tells in his satsang that self-confidence increases… https://t.co/HLwZhrP29F,AmandeepPB,"Chandigarh, India",0.0
1889,"AIDS is a disease that is hard to talk about!

#worldaidsday #worldaidsday2022 #AIDS  #HIVAwareness #aidsawareness… https://t.co/IaFLXpbqG9",UbuyUAE,"Dubai, United Arab Emirates",-0.2916666666666667
1890,"@Flowman @OotyMcTooty @lavern_spicer For example 
a post claims that a specific plant can help cure a disease.

Doe… https://t.co/SsiL9BqeAq",TheMagicFolf,✨Among the Celestial Bodies✨,0.0
1891,"END of ghastly disease
؟?
نمشے

🔹W77🔹
🔹W77🔹
🔹W77🔹",tsania_kiniko,Semarang,0.0
1892,Fighting any incurable disease is a big challenge for a human being. Today hundreds of people are living a happy li… https://t.co/HlxKHgXjje,AmandeepPB,"Chandigarh, India",0.07500000000000001
1893,"#WorldAIDSDay 
#WorldAIDSDay2022  Anyone can get scared after having a disease like AIDS because it is incurable, b… https://t.co/k7DoqpJTgM",InsanGeet,Australia,-0.5
1894,top .5% of listeners.... succession is a disease.......... https://t.co/5dQn6jeliw,spookyspooooks,,0.5
1895,Gene therapy from Penn's Jim Wilson gets $65 million to treat liver disease 23 years after Gelsinger - The Philadel… https://t.co/N1Bosw4btb,_timos_,Global,0.0
1896,Together we must work hard to put an end to this disease and have a beautiful tomorrow. Best wishes on World AIDS D… https://t.co/JBtZ4oUIFv,sanjupatel20228,Bharuch,0.5194444444444445
1897,"@AHinkle628 @BluesteinLinda Me: all of the above. Dx with JHS, IBS, asthma, fibromyalgia, TMJ. Being tested for PoT… https://t.co/56KuRZs6z5",Holz1_LPsoldier,Scotland,0.0
1898,HIV attacks the body's immune system. And it is a disease that never gets cured. Saint Ram Rahim Ji told that if we… https://t.co/yXGl2ljmUw,mong570,"Ballabgarh, Faridabad",0.0
1899,"#WorldAIDSDay
May we put an end to this life-threatening disease to leave our generations a world free from AIDS.… https://t.co/hNRhcLEfDb",Fukkard,"Hyderabad, India",0.4
1900,What if the reflective routine ate the disease? ☘ #facebook买赞 #instagram推广 #涨粉涨赞 https://t.co/OIuUeXMOhb,Jerica99796577,,0.0
1901,"#WhatIsTheTruth

The COVID-19 pandemic is one of the most manipulated infectious disease events in history, charact… https://t.co/4pZ7mJdq3D",ai_action,Earth,0.5
1902,@annamolly45 @ThroughCheated @BillClinton Vaccination: The act of introducing a vaccine into the body to produce pr… https://t.co/knKbqOU39j,Kyley67,,0.0
1903,The theme of World #AIDS Day 2022 is “#Equalize”. It is a light of #caution for all of us to focus on the practical… https://t.co/SjfoJfDrnM,agrivision4u,"Guwahati, India",0.4
1904,"#Tobacco use increases risk of #latentTB &amp; active #TB disease, and risk of progressing from latent to disease. To… https://t.co/Muf9Te71zf",APCATNCD,,-0.13333333333333333
1905,AIDS is said to be an incurable disease. We not only need to fight the disease but also the stigma &amp; discrimination… https://t.co/fbcBLEJZ4Y,MehtaYash9513,,-0.25
1906,YOU'LL NEVER GET RID OF ME OH I'M LIKE A FUCKING DISEASE,universsecity,tweets every ten minutes ☆,0.0
1907,A prayer to the sow in the sidewalk and the prayer of the 3 seas.. he she attention whores and all that vanity is a… https://t.co/hBgK62V3uj,BORNagainWARIOR,Devil’s Grounds,0.0
1908,@Mollyploofkins @VoteBlue25 My best friend and I had it once. We both have developed kidney disease and our kidneys… https://t.co/8Qbh240SUC,pwc911,United States,0.55
1909,"#WorldAIDSDay2022
#WorldAIDSDay
Saint Ram Rahim Ji Insan taught True Method of Meditation to millions, a sure shot… https://t.co/K13HtS7uGY",robotOO7,ROBO-Factory,0.425
1910,Addiction and Virtue: Beyond the Models of Disease and Choice (Strategic Initiatives in Evangelical Theology) VZDTX… https://t.co/UHjSwB4BmW,kristina88y,,0.0
1911,"At the end of Kurukshetra war, his holiness Sri Krishna cursed Ashwatthama (son of Sri Dronacharya) that he will su… https://t.co/bStrjJVige",Gurubowy,Garhwal - No abroad plans.,0.0
1912,Give my playlist a listen: Ultimate King’s Disease  https://t.co/fFJK84QRpl @Nas @MassAppeal #ultimatekdplaylist,OfficialJwalk,Ohio 🎢,0.0
1913,@dcexaminer Worked in England over 25 years ago and I still can’t donate blood because they think I’ll give everyon… https://t.co/ML9kdCLSZX,SOMD_STEM,Maryland,0.0
1914,"@VAmisem @greeklamby @elonmusk @ashleevance The foot in the door is always the ""greater good"" safety, health, disea… https://t.co/D0Ar1s9M2x",NotPrfctButGud,Your Heart,0.6
1915,"AIDS has taken many lives with ignorance being the main reason. 

Let us put an end to it by making everyone aware… https://t.co/WtHETNpD2f",Ayatiworks1,"Chennai, India.",0.3055555555555555
1916,"#WorldAIDSDay Saint Ram Rahim Ji
AIDS is said to be a fatal disease. Not just illness but stigmas &amp; prejudice assoc… https://t.co/QwM6qf8ipW",TyagiTyagi57nov,"Sydney, New South Wales",0.0
1917,Lilly Shares Positive Donanemab Data in First Active Comparator Study in Early Symptomatic Alzheimer's Disease https://t.co/Zz5AfkeQu0,CrweWorld,"Las Vegas, NV",0.11098484848484849
1918,"1 second ago, a Megachile Bee that could potentially pollinate 30,000  flowers has died, because it was infected by… https://t.co/DIjDUvuBat",HiveEmpty,,0.0
1919,@fesshole And instead of seeing how badly you hurt her…so much that the pain is stronger than her disease…you complain on Twitter.,annarobin6,,-0.24999999999999992
1920,Together we must work hard to put an end to this disease and have a beautiful tomorrow. Best wishes on World AIDS D… https://t.co/2RBYYHdHRl,ISuperhub,"Cochin, India",0.5194444444444445
1921,"The Mouth-Body Connection: The 28-Day Program to Create a Healthy Mouth, Reduce Inflammation and Prevent Disease Th… https://t.co/9Af0MVC05J",larsonetoc,,0.5
1922,"The disease is spreading, and all children under  are at risk #开云体育 https://t.co/pmOHECybGL",Arleen71457122,,0.0
1923,"@DrDevanRomero Bartonella henselae Infection, or Cat Scratch Disease, is spread by an infected cat's saliva on huma… https://t.co/teCxwWjOcs",castr263,,0.0
1924,Together we must work hard to put an end to this disease and have a beautiful tomorrow. Best wishes on World AIDS D… https://t.co/KpsBA3jlM1,RanjiveMadhu,India,0.5194444444444445
1925,@VinnieAntoneli @PaulRoundy1 COVID is the leading cause of death from disease in children &amp; the leading cause of ho… https://t.co/UvfdXhMoAY,greg_travis,The Midwest,0.0
1926,An international day is dedicated to raising awareness of the AIDS pandemic caused by the spread of HIV infection a… https://t.co/nqHXXEANfw,LtdNamaste,Nepal,0.0
1927,"@YourMusicWhore In no order:

Kings Disease 3 - Nas
Didnt Mean to Haunt You - Quadeca
Misery - Ekkstacy
Dawn FM - W… https://t.co/xittdIeFcN",caleb_mnk,Canada,-0.3125
1928,Together we must work hard to put an end to this disease and have a beautiful tomorrow. Best wishes on World AIDS D… https://t.co/lLkcZmpd1E,ELifeMantra,"Delhi, India",0.5194444444444445
1929,"Diabetes is a disease that occurs when your blood glucose is too high &amp; affects about 37 million Americans, includi… https://t.co/TY1Upmc4qF",CaanhInc,New Haven,0.16
1930,"Prevention is Better Than Cure!
On this World AIDS Day, let's pledge to spread awareness about the disease and supp… https://t.co/wsv2JyhYXv",MoonhiveSocial,"Thiruvananthapuram, Kerala",0.5
1931,"@deaksbear @robert_legare The cracks are by design, they are a hard wired systemic response making all injury/hurt/… https://t.co/3yAENNN57a",stock_knife,"Edmonton, Alberta",-0.2916666666666667
1932,@lyemcfly i meant sheep instead of goats. i read that disease thing and was like okay it could explain it but a lot… https://t.co/0H52DGNrsE,bvmper,philly,0.5
1933,"@SushantBSinha People, no, turds like you are a disease. Nothing more, nothing less.",nav_neet71,,0.16666666666666669
1934,Together we must work hard to put an end to this disease and have a beautiful tomorrow. Best wishes on World AIDS D… https://t.co/jZCBsPomMI,MahaprasadG,PARK STREET ,0.5194444444444445
1935,AIDS can be cured with the help of the method of meditation. Saint Ram Rahim Ji tells that through the method of me… https://t.co/jmBgjq2dZw,kaur_kiran11,,0.0
1936,@ziibiing This is the best advice I’ve heard in a long time. My brother and I used to care for my mother with diabe… https://t.co/NmSr22xDxG,jim_chu,New York City,0.475
1937,"@IrritableDragon @CritFacts @ijyodesu @UltraDane Trans people are not a mental health condition, treating us as a d… https://t.co/EfadTUDYCQ",Dragonkat42,Living rent free in GC heads,0.05
1938,Warm wishes on World AIDS Day to everyone. May we put an end to this life-threatening disease to leave our generati… https://t.co/UGLYN8zymw,execfunerals,"Mbubi Road, Lungujja, Kampala",0.6
1939,"More truth coming out! “The UK lockdown cost £376 billion, and did nothing at all at an epidemiological level, if n… https://t.co/pxDPRTa2NT",MarthaTF1663839,,0.5
1940,By practising the method of meditation given by  Saint Ram Rahim Ji hundreds of DSS volunteers have been recovered… https://t.co/LGvoOyDbKS,shanaya_gaur,,0.0
1941,"A day to educate one another, a day to spread greater awareness of AIDS and take action in fighting the disease and… https://t.co/40BVyYZf0o",sivawestcoast,"Eathamozhi, Nagercoil",0.3
1942,"I really appreciate the community that developed from the ACT UP movement, it just underpins that it wasn’t just ab… https://t.co/OHo5OeQo80",purplefrostingg,,0.15000000000000002
1943,"Magnesium: Reversing Disease H68JVPY

https://t.co/PNAKo5idyp https://t.co/ay0ciUOiLY",Freida45wH,,0.0
1944,"PARKINSON'S DISEASE COOKBOOK: Health Friendly, Easy to Make Recipes To Stay Safe 2MENP0S

https://t.co/nKaqLmFjzu https://t.co/FyclY4JEeV",KathryneGerhold,,0.4361111111111111
1945,Together we must work hard to put an end to this disease and have a beautiful tomorrow. Best wishes on World AIDS D… https://t.co/NfeeBZoq67,insure2care,,0.5194444444444445
1946,"Venous Disease and Ulcers 9IS76QU

https://t.co/exx31oOHTz https://t.co/hSSyskMnip",padbergimm,,0.0
1947,"Saint Ram Rahim Ji
 It is said that the one who has self-confidence can win his defeat by defeating any disease and… https://t.co/mDdJVKingS",Bharatkalra3333,,0.8
1948,"Join the Mount Paul United Church tomorrow for World AIDS Day.  

Hear how this disease has, and continues to, impa… https://t.co/rfcitjNulX",ColeHicksonSD73,"Kamloops, British Columbia",0.0
1949,The Great Cholesterol Con: The Truth About What Really Causes Heart Disease and How to Avoid It PVXDQXS… https://t.co/yKicPN61Nu,Clementina12G,,0.5
1950,The theme of World AIDS Day 2022 is “Equalize”. It is a wake up call for all of us to focus on the practical soluti… https://t.co/qvDmk3OwE0,ClaretWorld,"Sonipat, Haryana, India",0.0
1951,"@NickAdamsinUSA Spoken like a bloke who’s never done a minute of cardio in his life.
Heart disease is coming for you, lad.",molehole12,"Melbourne, Australia",0.0
1952,AIDS can be cured with the help of the method of meditation. Saint Ram Rahim Ji tells that through the method of me… https://t.co/xRWMnh7wQp,Kimminsan4,,0.0
1953,"The Paleovedic Diet: A Complete Program to Burn Fat, Increase Energy, and Reverse Disease W7ADM5H… https://t.co/fOn3NIuZIR",Webster3111,,0.1
1954,"Ayurveda Lifestyle Wisdom: A Complete Prescription to Optimize Your Health, Prevent Disease, and Live with Vitality… https://t.co/1k7QeO419g",bednar56gfl,,0.11818181818181818
1955,I have Parkinson disease.  I have been going to a teaching hospital for treatment.  I am dissatisfied.  Do you have… https://t.co/GKBgGdOcgX,kirkboulden,,0.0
1956,"#WorldAIDSDay2022
#WorldAIDSDay
Explore video to watch the life changing tips to fight against incurable disease su… https://t.co/Ej0NJGbqgt",robotOO7,ROBO-Factory,-0.5
1957,AIDS is said to be an incurable disease. Some people are scared to not our things with others . Did you know that t… https://t.co/G6fOnGTFMZ,Sanvi02006183,"New Delhi, India",-0.5
1958,Together we must work hard to put an end to this disease and have a beautiful tomorrow. Best wishes on World AIDS D… https://t.co/f4xqZap7sF,ravi_ravi_ravi,Howrah,0.5194444444444445
1959,sufferers #万博 of #尊龙娱乐 chronic #红黑大战 disease https://t.co/6c6EAcpaBt,Ingrid48132123,,0.0
1960,@stellamoonglow1 Christian people are a disease in society. It absolutely blows my mind. Y’all are actually cancerous it’s disgusting,babycat9899,,-0.2
1961,Together we must work hard to put an end to this disease and have a beautiful tomorrow. Best wishes on World AIDS D… https://t.co/phbaxfoTvq,hindusabhahosp,"Mumbai, India",0.5194444444444445
1962,The link between inflammation and heart disease is well-established. Here's what you need to know about this import… https://t.co/qTCON1smkm,healthyious,,0.0
1963,"2. Minimize testing of Missile etc.
3. Please Acknowledge, Prepare &amp; Use of SAME STRAIN HOMOEOPATHIC NOSODE - the o… https://t.co/azzMdsdwPu",DrPNMisra,l,0.0
1964,"since the Glaciers are melting due to Global Warming,many such Dangerous Viruses may become Active -they may create… https://t.co/16f9LZzGKS",DrPNMisra,l,-0.05972222222222221
1965,jealousy is a disease and i have it https://t.co/H7RAWEDxiQ,yoongiggler,OT7 or perish,0.0
1966,@kicksixwde @kklassy14 @jim_mcneil @ERICSORENSEN It a link to literally thousands of articles on using masks to pre… https://t.co/Qbkgxq6uZc,DataNerd808,"Cookeville, TN",0.0
1967,@JmTheArtist2021 @getorga @sean_bernstein @andrewzimmern @wildtypefoods So you are vegan. Ok. For me vegetarianism… https://t.co/PnuMPbbCJh,anandsr21,"Gurgaon, India",0.5
1968,"Hence, in summary:

1) RA is a relatively common disease that is polygenic and multifactorial in pathophysiology.… https://t.co/2EkVPhTIa3",robinwjsia,"Melbourne, Victoria, Australia",-0.3
1969,"Any of this agents can be used, but the idea is:
Early initiation -&gt; utilize nb-DMARDs and early escalation to bDMA… https://t.co/0siVzuZ7I8",robinwjsia,"Melbourne, Victoria, Australia",0.1
1970,"Pharmacological will be the main discussion here. 

Pain relief with steroids/NSAIDs work well. 
After that, diseas… https://t.co/bcJaNIIixz",robinwjsia,"Melbourne, Victoria, Australia",0.16666666666666666
1971,AIDS is an incurable disease. So let's pledge to organize railies for spread AIDS awareness on  the… https://t.co/I0WjN8WRRS,AlyssaSetia,,-0.5
1972,Together we must work hard to put an end to this disease and have a beautiful tomorrow. Best wishes on World AIDS D… https://t.co/EGFpI24sIG,soniambrish,,0.5194444444444445
1973,AIDS can be cured with the help of the method of meditation. Saint Ram Rahim Ji tells that through the method of me… https://t.co/aLX4tc0RJ5,Jaskira24125007,,0.0
1974,The Great Cholesterol Myth Now Includes 100 Recipes for Preventing and Reversing Heart Disease: Why Lowering Your C… https://t.co/g4u31sJklZ,breitenbergzdq,,0.8
1975,"However, serology is NOT correlated with disease activity unlike CRP/ESR. They are good to PPV to diagnose and also… https://t.co/5AEMJhCcbQ",robinwjsia,"Melbourne, Victoria, Australia",0.7
1976,@queenpatriot_45 And dead from Epstein island disease 👍,haleybaebee,My house ,-0.2
1977,"The disease 🦠 that is truly threatening the entire world?

TDS.

Truth Derangement Syndrome.
🗣#𝗠𝗔𝗩𝗘𝗥𝗜𝗖𝗞",TheFuryShow,This Dark World,0.0
1978,"AIDS is an incurable disease, thousands of people are suffering from this disease,many of them has loose hope for l… https://t.co/9F6GWzGZEa",Antima170577,,-0.025641025641025644
1979,i tried the blush nails thing and it looks like i have some disease,thekyum,ღ they/he | 20 | multi ,0.0
1980,Together we must work hard to put an end to this disease and have a beautiful tomorrow. Best wishes on World AIDS D… https://t.co/rgGtlZ1HZt,GKFORWI47775045,"Warangal-Hamamkonda, India",0.5194444444444445
1981,"@Mangan150 Everyone has been conditioned to believe in genetic determinism and the inevitability of disease, this k… https://t.co/ehOW5L7mNH",SteadyHabs,Factsville,0.0
1982,"#WorldAIDSDay2022
#WorldAIDSDay
God words can cure any disease.
@DSSNewsUpdates
@Gurmeetramrahim
https://t.co/3vxEpo9dmA",robotOO7,ROBO-Factory,0.0
1983,mental pacifist inherit the disease,PurwoPrasetyo2,bintaro id,-0.1
1984,"The life is so fragile in front of the disease, cherish the body, cherish the present.",MilesCharlott13,,0.0
