,tweets,user,location,polarity
0,The Tongue Of Ulamah Engaging Excessively In Backbiting Defaming Slandering - Their Hearts Getting Sick With Diseas… https://t.co/qX6viYnuw6,MissionOfQuran,Karachi,-0.1880952380952381
1,"@PattyMurray You are setting up women to require protection from men, giving men an excuse to deny liability for ha… https://t.co/RsmLAVhSXK",TheoriesAreFak3,,-0.05
2,"I know this is so cliche of me to say, but seriously: jealousy is a real disease, &amp; the only way to get better is r… https://t.co/yFuJTHFEv4",arcidanii,,0.09166666666666667
3,"This famous grape is thick skinned, late-budding and late-ripening. It ripens well in the warmth of Greece. However… https://t.co/SadJcn52eP",TheBarrelAlex,"Bordeaux, France",-0.06000000000000001
4,"@Gr33ndough @FoxfordComics They lost for mainly three reasons, disease, the natives hated each other and often side… https://t.co/DoCY63yqYe",garrison_reid,,-0.28611111111111115
5,GOSH I HATE THIS SM WHY AM I READING A HANAHAKI DISEASE FANFIC,minxieses,she  🪵  6teen,-0.8
6,"Pick swap dead, Lakers in the western conference finals…we talking about lottery picks….and I couldn’t feel any better.

It’s a sick disease",Impatientbull,FromNewOrleans/live in the Chi,-0.10357142857142858
7,@Allie4Freedom My girl is on a special diet 2 she has kidney disease. We have it so under control that it is not detected. 🥰🐾🐶,RondaGLarson,"Michigan, Metro Deroit",0.35714285714285715
8,fake bitches are a disease,makailahhhhhh,,-0.5
9,"#GodNightTuesday 
If a devotee has leprosy and he has started doing devotion, then do not hate him. Salute him He s… https://t.co/wB32mVjGrK",SarojDa92215300,,0.4
10,"@mandeep_mayo Upfront hemodynamic support, aspiration, no reflow meds, ivus, if disease then stent and if no diseas… https://t.co/jZBn3BTuGk",MuhammadAjmalMD,"Arizona, USA",0.0
11,"Stay Safe and Stay Informed! 
On #HIVVaccineAwarenessDay, we emphasize the need for continued research and preventa… https://t.co/td1Vy29kIl",NBJContheMove,"Washington, DC",0.5
12,"@RageSheen Well we are lazy and get too many holidays to start with.

It’s got nothing to do with #covid and the disease soup we teach in.",samteachernsw,,0.125
13,@GBravo1242 @killakay_szn Yeah that disease is something that,Cmoon05,Winnipeg,0.0
14,"@mmavra2 @HullioSikandar Research: trauma caused bad leg Nov ‘22, hematoma same time or Jan’23.  KMC failed to diag… https://t.co/01c2HQRkkP",c91034,,-0.3999999999999999
15,"For a Healthy Body and a Healthy Mind, it is very important to have a Balanced and Vegetarian Diet. With the inspir… https://t.co/TaTzqc2BVp",deep00107,,0.5066666666666667
16,"Due to a resurgence of #opioid deaths, we are employing  evidence-based treatment, harm reduction strategies, fenta… https://t.co/AzO1cuWId9",drmasizer,,-0.125
17,"@dieathon not my problem 
as designated discriminate
problem solver E 
racing  champion laser 
light beams precede… https://t.co/LU2EhJ584c",boonkhabeen1,off planet,0.4
18,"Desire without thought nothing could have steamed itself
OUNASS_NOON_PROMO_NON_TOYOU_TO_Fordeal_HM_and_Body_H&amp;M
YOU… https://t.co/EuJUj5guQy",Alfajrin18,,0.0
19,I hate diabetes.... Such a fucking lame ass disease to have... I wouldn't wish this on my enemies.,HuskyKota90,"Phoenix, AZ",-0.43333333333333335
20,"@AltPost @Melissa52295620 @Thekeksociety If that were the case, then shame on the church for allowing someone that… https://t.co/LFOLFlaNn8",Azelements1,,0.0
21,Does he have like a disease or something cuz ajaundice usually mean liver shit no? https://t.co/P9vmz2EWi7,j_fx201,"San Diego, CA",-0.3125
22,"@EricDJuly That a disease is specifically a ""gay disease?"" As in, gay people somehow created a disease, and it's th… https://t.co/t8Bt0rBuc3",JackShades13,,0.4166666666666667
23,"@Bitboy_Crypto From Wall Street to Main Street, everyone's talking about the crypto craze! Exciting times for digit… https://t.co/bTtDDuXtzX",OsborneCay88244,,0.23333333333333334
24,#Every human being is suffering from one or the other disease. He wants to lead a healthy life. According to Saint… https://t.co/p9otvXhV2t,BrijPal9466,Ambla,0.14375
25,@comfysarah Yeah he has some kind of disease but I’ve heard he gets really mad when people treat him like a kid (understandably),cleverandquiett,,-0.012500000000000011
26,@P___2___P My young son just got diagnosed with a rare disease where the blood flow cut off to his leg and it disin… https://t.co/R3AKNTphBc,bigjd75,,0.2
27,oh no guys it’s almost june we have to stop the radical left wing spread of the non binary trans woke gay disease f… https://t.co/WhWPB5apSI,jas_babyxoxo,"Indiana, USA",0.0
28,I have Alzheimers disease. I swear to God I’m not making this shit up.,stansbruno,"San Francisco, CA",0.0
29,People want the Lakers to lose more than they want their team to win it’s really a sickening disease,jaeighsherwood,,0.13333333333333333
30,"@2TallTrees @ScottMGreer -you steal the shoes off a man you just filmed getting shot.

Because you don't know him,… https://t.co/K7ItG7V9nM",StariTrik,,0.0
31,@ScottKumka @GoAwayGreen @bioreconstruct Decaying ruins breeding disease ridden insects is not something,JudyWinslow_fm,My bedroom,-0.15
32,"""Heal Your Heart with Mindfulness Meditation: A Powerful Tool Against Heart Disease""
https://t.co/qeRBsyJhVq",Herbanauts,,0.3
33,"We now have the website close to finished.  New links to Cancer, Heart Disease, and Pharma Therapy",holistichosp23,,0.13636363636363635
34,"🧬Celiac dz - autoimmune attack on small intestines when gluten (wheat, rye, barley) ingested;  Anti-tissue transglu… https://t.co/sr4m2oSVmB",DoctorsOverseas,The Americas,-0.25
35,"Hey, maybe some infectious disease doctors can get moving and answer me.

They're (mostly) not doing any research o… https://t.co/VtODaLKNvn",jmcrookston,Canada,-0.25
36,"@roytolentino That's okay because COVID testing is now mainstream. They have to focus on the next disease, whatever… https://t.co/hLpRZwjgOU",lelanddelacruz,,0.25
37,"🧬Celiac dz - autoimmune attack on small intestines when gluten (wheat, rye, barley) ingested;  Anti-tissue transglu… https://t.co/ShLJRxjJ4f",DoctorsOverseas,The Americas,-0.25
38,"@inapandemic @emily_rj They’re conflating hiv and aids and claiming to know people with aids. 

AIDS is a disease o… https://t.co/Qk8HG6fT0O",reluctantlyjoe,"New York, NY ",0.0
39,"Let me give an example

So on the promised neverland side of the story, the kids in the enclosure are completely de… https://t.co/CPwpO6g9ZS",SinamonLance,With Alybun,0.1
40,"Sad to hear this about Dennis Kucinich.

RFK Jr. looks so old and mummified because he's never had a vaccine in his… https://t.co/5yIghClKBC",LeitShelly,Atlanta,-0.2
41,Protestantism is a disease of the soul,comrade_eagle,occupied kaw nation (kansas),0.0
42,@diana_continimd @NBCNews By whom? An MD who lied and told people to take an experimental drug that did not prevent… https://t.co/dysaRoIEug,USBornNRaised,United States,0.1
43,i haven’t been able to watch any qsmp streams bc the boober disease is kicking my ass but i literally get all of my… https://t.co/gdbWMMgOi6,peanus1ubber,he/they  ic : cyani07,0.5
44,C'mon @WGNNews don't interview people who think wiping down equipment and washing hands is a way to avoid Legionnaire's disease.,bluebirdofunhap,Chicagoland,-0.15555555555555559
45,"@anjali13485 @DSSNewsUpdates Self-confidence will increase with the method of meditation, so that a person can get… https://t.co/pa2cRKkCJb",Vihu17691346,"Rajasthan, India",0.0
46,Every human being is suffering from one or the other disease. He wants to lead a healthy life. According to Saint G… https://t.co/sOB171gXFp,RuhaniDhiman,,0.14375
47,Many eye conditions are preventable if detected early. Gippsland Primary Health Network aims to improve detection o… https://t.co/WYTxN9RDcH,gippslandphn,"Gippsland, Victoria, Australia",0.3333333333333333
48,Every human being is suffering from one or the other disease. He wants to lead a healthy life. According to Saint G… https://t.co/sDklVotNkT,SukhbirDhiman,India,0.14375
49,@AugustoRhodes @thealthype Your rendition follows the official narrative inaccurately. Precedents hold meaning whic… https://t.co/oFnaZwYByC,atwilkinson_,Canada,0.0
50,maybe this is hypocritical because my favorite character is akito but he's fine he just has a disease called being… https://t.co/zdh731crYW,mymarifae,23 | she/fae/they | black,0.45833333333333337
51,@emily_rj @mynameisjro @reluctantlyjoe Yup - a professional conference for immunologists HOSTED a large unmasked da… https://t.co/N9Cg0Cmx3i,progressiveer,"Chicago, IL",0.15714285714285714
52,"World Inflammatory Bowel Disease Day

#WorldIBDDay

Preventative tips to avoid IBD
Reduce the consumption of foods… https://t.co/Xe26XbbaQF",hegemonyschools,,0.0
53,@fogarty_dr @discernableco @Cazziegirl 1/2 That’s a laugh 😂 look at his credentials- he is an absolute expert on ma… https://t.co/LgFSASfeck,BobKnezevic,"Sydney, AUSTRALIA",0.25
54,"#FridayFitnessFor a Healthy Body and a Healthy Mind, it is very important to have a Balanced and Vegetarian Diet. W… https://t.co/xy7jltD9oO",LalitKu44483275,,0.5066666666666667
55,@AjeboDanny Hey could you please help me get treatment? I have sickle cell disease and I have been in pain for so l… https://t.co/SRn7UIFxyo,Able1431,Africa,0.0
56,Maintaining health nd fitness is very important in our life.Saint Gurmeet Ram Rahim Ji tells about some habits like… https://t.co/4SkU1NpgFn,Preeta24182489,,0.52
57,Pulmonologist G C khilnani talks about TB. Is it a poor man’s disease as believed? Why is India vulnerable? Is it a… https://t.co/Dnpegfl38T,IndiaToday,India,-0.45
58,"🍻TSH assay - most appropriate single screening test  for thyroid disease.

🍻ALBUMIN - Second most prevalent CSF pro… https://t.co/M9jwXe3dlW",LwkyyRMT,,0.2857142857142857
59,In high school when we wrestled we always had to shower frequently and we did all that but it was never really enou… https://t.co/vQQdS16BZV,JoshuaW05882759,,0.05333333333333334
60,"@Basalus 2:1 AVB, short PR (&lt;180ms) concern for infranodal disease. Ventriculophasic response. Needs EPS",rraven8,"New Haven, CT",0.0
61,@bek816 Educate yourself as much as you can. This is a serious disease. Gov't has done little to understand it or i… https://t.co/poeeQy2wHQ,TonyaLampley,Queen City,-0.10694444444444444
62,"🧬Celiac dz - autoimmune attack on sm. intestines when gluten (wheat, rye, barley) ingested;  Anti-tissue transgluta… https://t.co/AFph2077qB",DoctorsOverseas,The Americas,0.0
63,Healthy mind needs a healthybody but all are trapped into tension and disease the reason behind this is our diet we… https://t.co/htAhClIAGK,GuruGajewasia,MSG's Heart ❤ ,-0.03333333333333335
64,@TobyTurner @DonutOperator Tobuscus do you really have legionaries disease? :(,LikeDouglas,United States,0.2
65,"Lesbians, gay men face very different heart disease risks: US cardiac experts
#lesbian #aha #omarderaz #phd… https://t.co/KBRwKWQUv9",upstract,,-0.025
66,"A U.S. Experiment on Single-Payer Care Just Ended. The system for one disease, Covid, had similarities to “Medicare… https://t.co/QYF4k98a8n",NancyBordier,"Washington, D.C.",-0.07142857142857142
67,had my insta account on public for  a bit and they ss my pics. obsession is a disease,m4inlycee,"England, United Kingdom",0.0
68,"This is my son, he has recently completed his collection of every disease, please congratulate him https://t.co/pW1InZcsC0",DungeonEnvy,"Abbotsford, British Columbia",0.0
69,@EKoutroumpakis @cezar_ciliescu @datsunian @PalaskasN @anita_deswal @MDAndersonNews Carcinoid heart disease is an a… https://t.co/jc8WsIMBnO,husam247,"Toronto, Ontario",0.0
70,"#FridayFitness
Every human being is suffering from one or more other disease. He wants to lead a healthy life. Acco… https://t.co/OEtOGDQZWh",PSiksarthi,,0.215
71,A strong immune system can fight any disease. Use good habits and make your body and brain healthy. Saint Gurmeet R… https://t.co/CxzwnMRcCj,BabbarMokshi,,0.5444444444444444
72,"#FridayFitness
Every human being is suffering from one or more other disease. He wants to lead a healthy life. Acco… https://t.co/i8vT2l6pZ8",PSiksarthi,,0.215
73,"#FridayFitness
Every human being is suffering from one or more other disease. He wants to lead a healthy life. Acco… https://t.co/poil2861WG",PSiksarthi,,0.215
74,today i learned that scurvy was something literally anybody lacking vitamin C can get and not just a disease that only pirates get,henthaiicedtea,22 ★ $25 tribute,0.0
75,"#FridayFitness
Every human being is suffering from one or more other disease. He wants to lead a healthy life. Acco… https://t.co/qDlUFtkfV1",PSiksarthi,,0.215
76,"#FridayFitness
A strong immune system can fight any disease. To boost immune system Meditation with Pranayam is the… https://t.co/2yIO4vjqPx",LalitKu44483275,,0.4333333333333333
77,"#FridayFitness
Every human being is suffering from one or more other disease. He wants to lead a healthy life. Acco… https://t.co/1t2qHxRsBf",PSiksarthi,,0.215
78,"TW: Post operation, nothing graphic i promise 

Ok so I don’t really talk about my chronic illnesses on here but li… https://t.co/rqzJ69O9IW",CaptWitchyFuck,"Manassas, VA",0.2333333333333333
79,"@DaveAlexanderID @ChengJD_MD @pyttipannen @jack_turban Lol, you are creating a somewhat arbitrary distinction here.… https://t.co/MvkoXHrBa3",TimHuttonAu,Meanjin (Brisbane) ,0.35000000000000003
80,"#FridayFitness
Every human being is suffering from one or more other disease. He wants to lead a healthy life. Acco… https://t.co/972nn0rI1D",PSiksarthi,,0.215
81,"@realTuckFrumper I'm anti-grifter, anti-traitor, anti-Trump/QuAnan cult.  They are like a malignant noxious disease… https://t.co/0ggEuv8Znz",TRUTHLOVERRA,"Henderson, NV",0.0
82,"I didn't even want to wrestle my senior year because I thought skin disease was nasty, I didn't want anymore of tha… https://t.co/HsKWu7s3bV",JoshuaW05882759,,-1.0
83,Myocarditis: Baby dies and three more admitted to hospital in ‘unusual’ cluster of heart infections https://t.co/Yv5zXdmp5q,16rock_rock,,0.35
84,"#FridayFitness
Every human being is suffering from one or more other disease. He wants to lead a healthy life. Acco… https://t.co/Z5o0zsp9X0",PSiksarthi,,0.215
85,"#FridayFitness
Every human being is suffering from one or more other disease. He wants to lead a healthy life. Acco… https://t.co/vRR9MLcTuh",PSiksarthi,,0.215
86,"3. Privacy concerns

Large datasets may require developers to request for patients data. Meanwhile some patients ma… https://t.co/2EJVLgeOB9",Hamzatwrites,,0.21428571428571427
87,Every human being is suffering from one or the other disease. He wants to lead a healthy life. According to Saint G… https://t.co/r9X8AjEBAW,deep00107,,0.14375
88,@LauraMiers Fibro doesn’t have a look. This looks like a systemic disease and is the same kind of situation my fami… https://t.co/jceiC16btx,hausofhemlock,Jagera and Turrbal Country,0.3
89,"Wrestling is good for you, but skin disease is bad; we need to find a compromise on how to facilitate wrestling wit… https://t.co/TApWm9CtgH",JoshuaW05882759,,5.551115123125783e-17
90,"#FridayFitness
Every human being is suffering from one or more other disease. He wants to lead a healthy life. Acco… https://t.co/P8Ky7nliVg",PSiksarthi,,0.215
91,@johncusack Leftism is a disease....,PKallDAY313,,0.0
92,"@MayorOfLA @USICHgov Noise, fuel, &amp; light pollution are linked to dementia, heart disease, violent crime, cancer, &amp;… https://t.co/wtvv8W6rBy",HowTheWestWS,California,-0.2
93,"The Australian Government has handed over 500,000 doses of lumpy skin disease vaccines to Indonesia at a ceremony i… https://t.co/HfqVJ1BfwX",ChiefVetAus,"Canberra, ACT, Australia.",0.0
94,"#FridayFitness
Every human being is suffering from one or more other disease. He wants to lead a healthy life. Acco… https://t.co/JtuTnhJUxi",PSiksarthi,,0.215
95,"@Cassebby i don't want heart disease and 10 types of diabetes, maybe that is why i exercise?",SoumiHirvi,,0.0
96,@DailyLoud More than that.. that’s straight gum disease. No wonder he’s makes such a good pirate,yourgawddess,,0.35
97,"https://t.co/tsYIwrKzxk
I have come a long way. This was just as Covid-19 started.
 God was with me
 March 3, 2020… https://t.co/HinM2VUS7p",DaytzMichelle,"Beverly Hills, CA",-0.05
98,@EmilyM0703 I get them too. I must say that I refuse to open them too. Maybe they have a worm or some social diseas… https://t.co/B462Cn6MKA,SaulWright12,,0.016666666666666666
99,"Looking for funding opportunity on Alzheimer’s disease related dementias, check out this CWOW notice of funding opp… https://t.co/mxQqO2vPwe",Neuroimmunity,"Bethesda, MD",0.0
100,God had to nerf me with Heart Disease so I wouldn't become a powerful giga chad. 😤,ItsHAMMY_TIME,Rocket City,0.3
101,@Duofan4 Lol jealousy is a disease,Nay_Hanyy,,0.8
102,"Dr Richard Lipscombe, Managing Director of Proteomics International spoke with ABN Newswire regarding the agreement… https://t.co/3sjpRphq5U",ProteomicsI,"Perth, Western Australia",0.0
103,"This is not a convo I can take part in w a clear, logical mind

I have an autoimmune disease from getting Lyme. I f… https://t.co/Uojlw4Fvl4",PiquantParvenu,USA,0.17500000000000002
104,@CP24 Hopefully that bird wasn't a carrier of a serious disease that can affect those hit by the blood. Blood from… https://t.co/mqqK7RtRyD,Cin98609046,,-0.3333333333333333
105,"When they’re trying to convince you that building railroads is nefarious and will cause disease, or that 500 vague… https://t.co/OyTG1Driv9",bimbocommunist,LACTOSE INTOLERANT SOYGIRL,-0.5
106,Herpes Simplex Virus Infection Increases Beta-Amyloid Production and Induces the Development of Alzheimer's Disease… https://t.co/vcBU4rBHO3,NannyNoisy,"Victoria, Australia",0.0
107,"@MrPete1985 @TheMFingCOO Depression.
hypertension.
High cholesterol, high, triglycerides, diabetes, arthritis, hear… https://t.co/FTqiagA5OB",bunnygalore714,United States,0.16
108,"@miz_rat You're kidding right?
Investing in people that make a difference or those that leach on society. 
The anti… https://t.co/wMOzRyoEhw",kyle_snodgrass1,"Perth, Western Australia",0.2857142857142857
109,Marijuana Users Have Triple the Odds for Leg Artery Disease (Study) https://t.co/7LZLYyrzue from @WebMD;,JohnJr_1334,"New York, NY",0.0
110,@Shawcroft @AlanMayDay As many people died of the cure as the disease.,speaks09,,0.5
111,"@Travis_in_Flint @Theresa45922439 No they didn't like, both of those are rare side effects resulting from a severe… https://t.co/06d6uwuuGL",Charles07788205,"Big Bend, Texas",0.3
112,"@acoyne those who hate our society, like smith, poilievre,  Scott Moe and Maxime Bernier everyone at Postmedia, use… https://t.co/CydKHZ3YPs",reillyoreilly4,,-0.8
113,"There Is No Greater God Than Fear

The Sea Is Full Of His Stories Written In Block

The Only Thing More Frightening… https://t.co/Zsy009cZXa",NTR_Devotee15,,0.019999999999999997
114,@TimHuttonAu @ChengJD_MD @pyttipannen @jack_turban Natural puberty shouldn’t be stopped. It’s okay to treat a disea… https://t.co/vKysn9JVtg,DaveAlexanderID,Texas,0.3
115,Officials have been silent about the increasing amount of peer-reviewed research showing that what scientists thoug… https://t.co/a8Bq1cP7zX,TheGreenGarret,Pittsburgh,0.0
116,CDC NCIRD Morehouse School of Medicine  Vaccine-Preventable Disease Internship Program – Haemophilus Influenzae  Da… https://t.co/34U1fJHrI9,Epijobs,,0.0
117,Saint Gurmeet Ram Rahim Ji explains that:physical exercises/walking help to keep us health as it helps to manage we… https://t.co/Rn1iuEkrwO,POOJAMAVI11,,0.0
118,"#FridayFitness
Method of Meditation is such a medicine that cures every disease. ""Saint Gurmeet Ram Rahim Ji Insan,… https://t.co/pT5SjCaLT3",iritu2837,,0.0
119,"The Creutzfeldt-Jakob disease (CJD) is the most common form of human disease that I cause, and it can be sporadic, familial, or both.",prionthekiller,"California, USA",0.06666666666666667
120,@EnemyInAState Very interesting. I've been thinking similar theories. The clotting is what's odd. What newer vaccin… https://t.co/9ywIZitb9y,Elejed1,USA,0.16111111111111112
121,@mehdirhasan Both sides disease strikes again.  How will journalism survive this?,glarrisharris,New York,0.0
122,@WatchYourRepsSC @POTUS Lol!! All politicians have a case of blowing 💩out they mouth! It’s a disease called shitolician!!!,PrisonSouth,"Florence, SC",0.8
123,"Alzheimer’s is a disease that is found in a lot of individuals. According to a study by the CDC, there were nearly… https://t.co/j7ZvByRHe4",kslnewsradio,"Salt Lake City, UT",0.1
124,Considerate of people who wont wear masks to protect others from an easily transmissible disabling &amp;/or deadly dise… https://t.co/H4Dslp0m0W,aposiopesist,,0.11666666666666667
125,@J4MTARTT hope you don’t get a disease from that 😐,bmontagov,"admin: 19, they/xe",0.0
126,@PenOfAPisces @James34duh @rw_christian @dan_gadd @tonymac5 @DdkDav @thisisnothappen @macgyvertang20… https://t.co/Wm00ClR2VX,Burki677,,0.0
127,"#GodNightTuesday 
If a devotee has leprosy and he has started doing devotion, then do not hate him. Salute him He s… https://t.co/iWDDoa0INr",Mohan13520563,,0.4
128,Our members have wide interests including what we can learn about breast disease from art. Free entry at Royal Soci… https://t.co/rMrlVTT3rH,trustdemocracy,New Zealand,0.15000000000000002
129,Sorry but the concept of immunity debt is fairly compelling and supported by many serious thinkers in the field of… https://t.co/xAxDcN84Kz,pooya_kazemi,,-0.008333333333333331
130,"@TegTronix @callatebocaputo @Majick666 @Gucia6666 @sar_ahspeaks @DailyLoud nobody has to justify being fat, you are… https://t.co/qDM9SK3w9r",kineticvirgo,under your skin ,0.0
131,"@gaelpichault @anti_disease @jonathanstea That’s my point Gael, there’s no evidence that low levels of Aspirin in t… https://t.co/cJ4TX6eQi8",TomMostlyZen,Birmingham UK,0.0
132,@TheRealFatG @pavandhanush6 Not a huge fan of yours but man to man this looks like edema… especially if it’s on one… https://t.co/LiTphDRboK,CMHAuthor780,"Alberta, Canada",-0.10000000000000002
133,"@Mike_Honey_ @_PH___PH_ No hat no play but sure spread a deadly disease,  we don't care 😱",martha_finkle,,0.15
134,@ttemp1950 @LadyJayPersists That is very humorous. You have strange notions. I wouldn’t expect anything else. I am… https://t.co/6hmUSZclHd,MillerMatthew20,"Indiana, USA",0.3
135,"“About nine crore cattle have been vaccinated against the disease so far, and the recovery rate is above 94%.” 

Ce… https://t.co/OGaOcIjbut",nsitharaman,"Delhi, India",0.05
136,U.S. FDA Approves Rinvoq (upadacitinib) as a Once-Daily Pill for Moderately to Severely Active Crohn's Disease in A… https://t.co/YWUwaHo7v7,trooper_trading,,-0.044444444444444446
137,Increasing PGK1 activity and glycolysis can show promising results in slowing neurodegeneration from Parkinson's Di… https://t.co/C5ZSOo3B2d,GlycolysisXD,,0.2
138,@Travis_in_Flint Didn’t Justin Bieber get this? I wonder what they have in common to make a rare disease strike pub… https://t.co/uz2GOpSvCp,StrokeJoke,"Houston, Texas",0.0
139,"Jealously is a huge disease fr. 
detox pleaseeee https://t.co/gTEGh7YSzy",NationAnaya,,0.4000000000000001
140,@VP @POTUS Children mining Cobalt in Africa for our Electric busses.. Sure it's healthier for the children in Ameri… https://t.co/dOSMupAMMZ,MarkMarkportd,,0.5
141,Native-state proteomics of Parvalbumin interneurons identifies novel molecular signatures and metabolic vulnerabili… https://t.co/QHXzmydmRP,NeuroNNNNN_bot,,0.0
142,When their store was vandalized they clapped like seals and cheered defund the police.  If you need anymore proof t… https://t.co/y0QOfvqDo8,BuckeyeChi5,,0.0
143,@CharcoalEpitaph There is a free documentary on Youtube called Under Our Skin if you are ever interested... that wa… https://t.co/FXSfivhIhu,sprinkleskei,"Montréal, Québec",0.21666666666666667
144,"@Americanista70 @JebraFaushay It's a disease that people need help, support and understanding for",magentawillow,,0.0
145,I just went afib in my house @shondarhimes and I have bicuspid heart valve disease. How could you do that?! In the… https://t.co/HY2dJZ0xo3,ramonathemona,"New York, NY",0.0
146,my neighbour keeps on burning stuff up every morning and i feel like im gonna have a heart disease,shizukaayo, 🍑🗣️,0.0
147,"Consequently, governments were willing to accept considerable collateral damage to mental health resulting from the… https://t.co/ODv4BwgRvN",ljd216,Australia,0.08333333333333333
148,"@krassenstein It should be concerning for Americans not republicans, because what the leftist globalist dems are do… https://t.co/NqFN6mphaY",cvmagreek,Middle America ,-0.05
149,Every human being is suffering from one or the other disease. He wants to lead a healthy life. According to Saint G… https://t.co/ipPUhtJRdB,sumitN22,"रोहतक, भारत",0.14375
150,@AmirArison Bummed Timothy Keller is dying. Made me laugh when my son(7) told my daughter(5) not to go near the woo… https://t.co/vN1jokiN5M,treu_lia,,0.2
151,@CrohnsCarnivore It's like they put their docs on a perfect pedestal....they have no idea what kickbacks the doc is… https://t.co/Po9CvU4hzq,ValerieAnne1970,South West Ohio,1.0
152,"im going to fucking die disease

(tummy hurts)",str4ydxg,,0.0
153,@BleacherReport jimmy butler disease is spreading lol,markyrod1,the octagon,0.8
154,@dom_lucre My grandfather died of the same disease Hawking had (ALS).  Hawking lived longer than most with that dis… https://t.co/P7U6r4W03v,adelaura72,"North Fort Myers, FL",0.25
155,"For a Healthy Body and a Healthy Mind, it is very important to have a Balanced and Vegetarian Diet. With the inspir… https://t.co/cyFUISzyxT",Poonam34389177,,0.5066666666666667
