,tweets,user,location,polarity
0,@ZJAyres Cardiologist told A&amp;E I was anxious. I had 3 vessel coronary artery disease caused by over production of c… https://t.co/VnFFbMd9oK,AnnieMacfarlan8,Scotland,-0.25
1,When Andy Lyons was diagnosed with pancreatic cancer after a series of early detection screenings from UPMC's Dr. B… https://t.co/xlmm8oCnTQ,UPMCHillmanCC,"Pittsburgh, PA",0.1
2,@raquellrussell @disclosetv That’s a ruse.  The groomers and pronoun police have a he right to say anything.  Licen… https://t.co/blkZI8ZUnn,ruggerdpmme,,0.2857142857142857
3,"Stand up, make a difference by taking the lead and joining hands to fight for this incurable disease...

# spread a… https://t.co/zSKsnqc1Ig",SaathiInc,chicago,-0.5
4,"@GOPLeader Yeah, George Washington never should have had his soldiers vaccinated for small pox either. Who cares if… https://t.co/97VjN324L2",SharonS50215953,,-0.25
5,It’s World AIDS Day. This disease is still with us and impacting lives.,SlouchingYogi,,0.0
6,I have multiple auto-immune conditions (re: food intolerances and a skin disease-vitiligo) I am not God's strongest… https://t.co/YTURMJ4RFi,bashour_nazira,,0.0
7,"@Ecotainment_YT @kylegriffin1 If the likelihood of variants are known, and you have a vaccine that isn’t designed t… https://t.co/Oq6lugjWHL",mitrebarnet,North Norfolk,0.0
8,@GOPLeader We the People find tha Reps want million more to die with COVID.When  did vaccines that protect American… https://t.co/vl4hQYE4gP,DrLillie4,,0.25
9,Read about rob burrow this former rugby player with motor neurone disease and now watching a video where he's so rude to his mum for jokes,T6X87_ALT,"London, England",-0.15
10,@michael_ny_law @fever_dream69 of liver disease. So far.,PinkeminaDPie,,0.1
11,The Contagion Myth: Why Viruses (Including Coronavirus) Are Not the Cause of Disease R1XGZDH… https://t.co/80b1scMHrO,rowe13rjvj,,0.0
12,"Form of Vitamin B3 Can Increase the Risk of Serious Disease, Including Cancer, Researchers Find - Eat This, Not Tha… https://t.co/LnqNFQEiEo",AnaGVillarreal1,California ,-0.3333333333333333
13,Cost disease is gonna get you https://t.co/ARNcehrPqo,willcooling,"Wolverhampton, England",0.0
14,Great talk by @ASaykin about multiomics and precision medicine for #Alzheimer disease. There is still time to join… https://t.co/mL6iQzlcS6,ccrugom,"St. Louis, MO",0.8
15,"In Japan, even if no abnormalities are seen on images, if symptoms are present, immobilization procedures are perfo… https://t.co/HusqOSAGcg",bone_boy_jusei,東京,0.0
16,"Today is World AIDS Day, dedicated to raising awareness of the HIV/AIDS pandemic and mourning those who have died o… https://t.co/mttAywnmsP",ANACnurses,"Akron, OH",0.0
17,"Feeling shit is not a disease, it's a reminder that you must do something to fix your life.",gmfrensmaxi,Web3,0.0
18,"Crawling through this world
As disease flows through my veins",EvBot13,,0.0
19,"In a new study, researchers at BIDMC found that diets rich in fruits and vegetables can lower one's risk for cardio… https://t.co/hGnQr0oy1S",BIDMChealth,"Boston, MA",0.2556818181818182
20,submit to  Thematic Series in Patient Related Outcome Measures : Veterans and military patient-related health outco… https://t.co/YG3McHagaB,DovePress,United Kingdom and New Zealand,-0.025
21,@scott_vfr @sean_monteyne @FoxNews Lmao watch YouTube. The black lady from the cdc admitted if a person had the cov… https://t.co/yMUVsotev5,TomyRaiders,,-0.16666666666666666
22,@JeffFarkas11 @nowtvman @ABC I’m talking about the covid vaccines ability to prevent infection/transmission—not the… https://t.co/eUAezEaPOO,Shannon_10Ten,,0.0
23,New Research: Reductions in extracellular vesicle-associated microRNA-126 levels in coronary blood after acute myoc… https://t.co/WEeisfc1uX,FrontCVMedicine,"Lausanne, Switzerland",0.36818181818181817
24,"On #WorldAIDSDay, we stand in solidarity with people everywhere affected by HIV and AIDS. Let us continue our effor… https://t.co/nAC1flFOyt",RepJoeMorelle,"Rochester, NY",0.0
25,"""Approximately 10% of the global female population develop lipedema, a disease characterized by the abnormal accumu… https://t.co/EAWkFtQdtE",VaserDoc,"Harley Street, London, UK",0.0
26,@BillClinton That is the least of your “tested positive” disease history-I am confident.,authormcewen,"Alpine, CA",0.14242424242424243
27,Reborn Undead/Undying Warlock based on a Canopic Golem. The character was dying or had a disease of some kind and h… https://t.co/leoZpVoqSV,FlowerPatch_Kid,,0.6
28,"CDC HIV/AIDS Sindh, DHO N.Feroze &amp; Civil Hospital NF organised World AIDS Day 2022 commemorative Seminar followed b… https://t.co/iRFUqBAGEJ",ershadkazmi,"Karachi, Sindh, Pakistan",0.0
29,@BillClinton People think they’re dunking on Bill Clinton in this thread without noting he’s 76 and has a long hist… https://t.co/3er85BTlTS,jgrust,The Commonwealth Of Kentucky,-0.05
30,"#TipofTheDay in #Pneumologia:

Congrats to Professor John Hurst for updating the “#COPD on a page”, an outstanding… https://t.co/dhwKGaLweQ",PulmaoSA,"Bay Hill,FL/ CWB Brazil ",0.5
31,@Aabhas24 he wanted to say he wants people to stay in filth suffer disease and he is proud to say v have largest sl… https://t.co/hGEUXHulUZ,dshetty03,Thane,0.5
32,I just pray whoever is the new president doesn’t come with a new disease or a virus,justbusisiwe,"Johannesburg, South Africa",0.13636363636363635
33,"@WillAttract You think in historic times with less opportunity for growth, knowledge shared, more sickness &amp; diseas… https://t.co/bVXuhI7DuI",syntheticenvy,🔞 NO MINORS 🔞 | GB | 27,0.11111111111111112
34,"@TalonyaAdams That’s the problem with the whole debate, it’s been reduced down to homelessness (caused by  addictio… https://t.co/hJN4hYHmvC",CatherineSenate,"Phoenix, Arizona",0.022222222222222213
35,ill explain later (if i remember to) but cant do math disease has stricken its grief upon me once more,skunkVT,under ur house,-0.2
36,@Arcticdust1 That is why. I am buying a disease wig and dying mine to the color I want,narwhollie,proship/klc dni,0.0
37,@Scott_Wiener You know what stops the transmission? People actually knowing when someone's infected. You decided th… https://t.co/8f1v0dCzU9,HiDesertDude,Middle Of Nowhere ,0.0
38,Frontiers | SARS-CoV-2 and Multiple Sclerosis: Potential for Disease Exacerbation https://t.co/HFmcuT0eIW,VintageKidsNL,"Amsterdam, Nederland",0.0
39,"2/10🧵THREAD: In a recent study, we found that out of 39 patients, 11 who had been diagnosed with Crohn’s disease an… https://t.co/njVF32zbsL",biomedresearch_,,0.0
40,Vaccines are more effective at helping your body resist disease than natural resistance to disease. That's why we t… https://t.co/xx2D5oJ4RY,smandraws,Drawin fat guys doot de doo,0.4000000000000001
41,World AIDS Day is a reminder to all of us that there is no need to fear away from the disease. It does not discrimi… https://t.co/adjXkukE0n,ArmguardS,9154 Delemar Ct. Wellington Fl,0.0
42,Jealousy is a serious disease.. get all soon hackers! 😂 @Sinake_X,iAmDeehzus,♡𝓚𝓲𝓷𝓰 𝓛𝓾𝓴𝓪𝓼♡,-0.3333333333333333
43,"We cannot end AIDS, nor achieve the SDGs without investing in children &amp; adolescents. New HIV infections amongst ch… https://t.co/5K7vYLzxBi",childrenandHIV,,0.13636363636363635
44,"@EnemyInAState If I read that correctly, seems they're asking for a school lockdown? To stop all the spread of disease? 🤔
🤯",GallomirGirl,Canada,0.0
45,So many things seem to have some effects in mice models of #ALS...but here is an interesting one i have never heard… https://t.co/tkqcw5mKHP,exosome,"La Jolla, CA ",0.5
46,"“Aids is no longer just a disease, it is a human rights issue.” -Nelson Mandela 

World AIDS Day is a day for sprea… https://t.co/tttNEK4Cos",WaterburyBTS_,"Waterbury, CT",0.0
47,@MattPerryFan I need help I'm dying for my disease of drink what do I do???,LOGAN069,,0.0
48,1/10🧵 THREAD: How your sleep body clock and diet contribute to gastrointestinal symptoms in people who have inflamm… https://t.co/PJyKWUAToM,biomedresearch_,,0.0
49,@avinashkunnath @KoreAmBear Complacency is a disease.,JustinWilcocks,Zeta psi fraternity for men,0.0
50,@BaggerDon @LayahHeilpern good point. if I had a neurological disease without a cure and this could cure.....,zerperella4,,0.7
51,"The U.S. government did not inform these men that a cure existed for syphilis, instead treating them like human gui… https://t.co/h0UVlEO7cz",hollyepappas,,0.0
52,"Crazy

Africa’s top public health body says the continent is set to receive its first batch of mpox vaccines as a d… https://t.co/jZgekvAbqL",drogon_dracarys,Flying around USA,0.037500000000000006
53,"@XEXEEZY I can't think of any one that could use help with memory loss 🤔

We live in the land of good health free f… https://t.co/4lRlLF4e2A",maf7825,,0.4121212121212121
54,"In addition to remembering those we've lost to this disease, #WorldAIDSDay is also a time to honor the millions wor… https://t.co/fGsxHj24lJ",PureOnli9,India & USA,0.0
55,@LR25308330 @Jacob69821809 @harleybz49 @bot_tastic @shine0ncrazyd @FaymusRighter @johnrich Populations with 96+% va… https://t.co/LAciwhOqaM,AtConsent,,0.0
56,We have put out a separate explanation on How COVID-19 Spreads as a compliment to the IAQ and Masking documents whi… https://t.co/pQr5f4jV3e,joeyfox85,"Toronto, Ontario",0.0
57,While there are other types of UV systems that can be used to provide the equivalent air changes for airborne disea… https://t.co/ruJwQL0mZh,joeyfox85,"Toronto, Ontario",-0.125
58,@neuralink @elonmusk  would #Neuralink be a possibility to help my daughters neurological disorder #battens disease… https://t.co/da0LW1miGU,sneakzandstylz,,0.0
59,"Airborne Disease Mitigation

The main recommendation to mitigate the spread of airborne diseases is to target a min… https://t.co/wKU8mkO7W3",joeyfox85,"Toronto, Ontario",0.16666666666666666
60,"As a highschooler, I fundraised for #WorldAIDSDay each December. I even planned it as a senior.

Little did I know… https://t.co/baEizkFjux",RachelKayWeiner,"Maryland, USA",-0.1875
61,"@Michael96303310 No….not if YOU signed up for it! My niece was a meth addict, but nobody held a gun to her head say… https://t.co/oKQzWH1u80",TouchdownIrish_,"Woodbridge, VA ",0.0
62,"We have the NIH—Natl Institute of Health. U.S. has a CDC (Center For Disease Control) + Prevention.

Yet doctors ar… https://t.co/T5ZJfZPmL1",ThomasA06104694,,-0.1
63,"#WorldAIDSDay is a reminder that we have made great progress in the fight to end HIV/AIDS, but this disease still c… https://t.co/EO0BK6ui9V",NormaJTorres,,0.8
64,@super_brains @bucklr01 @RealMilesBerger @NEJM @RoreBole @gilliano122 It would be great to see a sex by baseline am… https://t.co/s9lQpOVQG7,BrianGordon81,"Saint Louis, Missouri",0.8
65,@Fabio_Galletti @borekl @noclador If they are afraid to use the toilets they will be very uncomfortable and are lik… https://t.co/sFAaM4p1km,robinFenn5,,-0.625
66,#棋牌   free from disease.  https://t.co/LHvX93LgEk,A6kan_Zerox, ,0.4
67,@AnnWilson1198 @ThereseOSulliv2 @DarkPouncer @Sofaman7 @MistressRedWasp @Zirnike @ToganJoe @JamesCa70626795… https://t.co/eMQs9EjYL2,FredHarris_GC,United States,0.0
68,The study focused on 39 patients that had been diagnosed with IBD with 28 diagnosed with ulcerative colitis (UC) an… https://t.co/GchKJ6II0q,RayyanYoussef7,,0.0
69,The most common disease in the middle east is toxic masculinity,ghettoboyCairo,Cai at midnight,0.06666666666666667
70,It’s a disappointing and disgusting reality as a woman who was ignored and dismissed with an autoimmune disease and… https://t.co/RYKCbSZQH7,WriterMelissaB,Wakanda forever,-0.8
71,@atrupar Never mind that George Washington required his army to be vaccinated against small pox. Can you imagine wh… https://t.co/rZB2Elu2IU,schulz_ann,"Springfield, OR",-0.25
72,@MrVanGriffin @WhiteHouse Oh yes it is! Ignorance is absolutely funny. Number of people I knew or know with AIDS th… https://t.co/t6B1BzhmRt,StockTipsTips,East Coast USA,0.25
73,Hypertension is a huge contributor to coronary artery disease(CAD) and other coronary issues. CAD is the number one… https://t.co/C7fbWALezE,schwindtcm,,0.13750000000000004
74,Jealousy is a disease 😂😂 #hoesmad,chestneychiller,Halloweentown  RVA,0.0
75,Some skin conditions still require a surgical solution to remove lesions from the skin or to repair damage caused b… https://t.co/df09kN6yOa,DevonshireClini,"16 Devonshire St, London, W1",0.0
76,"@smc429 The magnetron, which generates the microwave energy, has a sintered ceramic insulator that is made from ber… https://t.co/V3oszwh3Kv",ThomasJEdwards4,"Olympia, WA",0.0
77,"I like children but pretending like they’re *not* disease-riddled, mucusy, sticky, disgusting little monsters is wild.",TDTimeBaby,,-0.3625
78,@POTUS Now you just need to start working on the biggest disease we have. The woke mind virus. 🤷🏽‍♂️,Nine9November,,0.0
79,"@alendersadloner @catturd2 Definition - Vaccine
a substance used to stimulate the production of antibodies and prov… https://t.co/U47uxMQ4WN",CirrusCapo,"Sunrise, FL",0.0
80,$IGC IGC Commences Phase 2 Clinical Trials Evaluating Drug Candidate IGC-AD1 for the Treatment of Agitation in Deme… https://t.co/GVBx3Eodo7,MarcJacksonLA,,0.0
81,"@DavidDavisMP You must think we are crackers, you say a lot and do nothing. This is very serious and allowing in is… https://t.co/qnYw24sIZC",roscyprus,"Sheffield, England",-0.43333333333333335
82,"Promoting gender equality is even more important during times of crisis caused by war and disease, German Chancello… https://t.co/FCuPT3iIhe",BBGEquality,,0.3
83,"#WorldAIDSDay HIV hasn't gone away - we still need to increase awareness, raise money and improve education about t… https://t.co/DW465hMjmq",vitalconsular,"Batley, UK",0.0
84,Thank you @rickdayton of @KDKARadio for speaking to us about the results of the Phase 3 clinical trial of lecanemab… https://t.co/TmM9ZMwGs7,AlzGPA,Pennsylvania,0.0
85,"@theShakinr00m @LozzaFox The question mark at the end is a clue. 
I think dementia might be kicking in 🤔
Thankfully… https://t.co/bgRdMHhlG3",TheGr3atReset,next to applebees,0.0
86,"#Parkinson's not only affects humans, but other primates as well, which have often been used in researching the disease.",ParkinsonsFacts,Worldwide,-0.0625
87,"July 3, 2008 was the day I was diagnosed. I became undetectable in September 2008. Here I am 14 years later healthi… https://t.co/P66GQtsmHd",KatheyFreaknLi,"Elm City, NC",0.0
88,"@Makavelli275 O Lord my God, why have thou forgotten your people and then allowed them to be used as political tool… https://t.co/oLcS5xAq2R",CountryCallObey,Minister Of The Gospel ,0.0
89,@mfstern Disease. What disease? Pathological lying a disease? I don't think so.,WFPBLifer,"Roaming Gypsy, Carpe Diem",0.0
90,I am recruiting for my Doctorate of Clinical Psychology research thesis. If you are an expert in the field of Parki… https://t.co/vNU7d8IXHB,SNC0204,,0.0
91,Maleficent Is Non Fiction. Depravity Is the Disease AMC Is the Cure. https://t.co/YFEwARtqZR via @YouTube,Ormus3,USA,0.0
92,"What the public doesn't understand: This ""cure' is worse than the ""disease"".  Docs will allow benign tumors to grow… https://t.co/dgxpp8qv7k",KevyneShandris,"Georgia, USA",-0.2
93,"Every year since 1988, this international day is dedicated to raising awareness of the AIDS and mourning those who… https://t.co/iXZ6vhVBJX",triyounginc,Phoenix Arizona,0.0
94,"Today, about 94% of people in the U.S. with HIV take a drug created by @GC_CUNY alumnus Dennis Liotta. 

On… https://t.co/T2G5QNsnY5",CUNY,"New York, NY",0.0
95,@greg_price11 Liberalism is an official disease.,spadejack1234,,0.0
96,"🚨@SenTedCruz @SenRickScott ⬇️

Stay in your lane, the military has many required vaccines, it called military readi… https://t.co/kET8vaH29y",Sky_Lee_1,"Charlotte, NC",0.10000000000000002
97,"@WorthyJC (1/2) Hi Jo, current statistics suggest that roughly one in three of those living with Alzheimer’s diseas… https://t.co/6AyuE5dzpb",AlzResearchUK,United Kingdom,-0.05
98,Men are a fucking disease 😭🤣,Artofcremation_,TX,0.0
99,What brain disease do I need to post like this https://t.co/IetnznSzyc,PixelCole,"Iowa, USA",0.0
100,"2/12
What is asthma?

An obstructive lung disease involving airflow limitation as a result of airway inflammation:… https://t.co/lbam7s5mSc",vshaiyan,,0.0
101,Yale study uncovers new potential root cause of Alzheimer's disease https://t.co/cyjaeEfed1,jt4u0904,"Chapel Hill, North Carolina",0.06818181818181818
102,"@ninaturner Hakeem Jeffries is Democrats new Paul Ryan. 

Speaker Pelosi was never radical wherein a MIC corrupt na… https://t.co/K02sBbO1Mu",AquaBlueLounge,"Portland, OR",-0.18181818181818182
103,It’s an STD( sexually transmitted disease) https://t.co/OutCUEBVs9,BobMcHugh175,NJ,0.5
104,"@Storm4Congress Lyme disease can cause Bells Palsy. 

Is Justin Bieber still suffering from Bells Palsy? His concerts are still on hold.",StarSpangled20,,0.0
105,"No, I really don't want my twin to suffer an incurable disease. IBD Awareness Week starts today and I am raising fu… https://t.co/DZCDDn8dGv",Lilithiel,With my head in the clouds.,-0.3
106,"Ulcerative Colitis. Chron’s disease can affect any part of the GI tract however, Ulcerative Colitis only occurs in… https://t.co/9d7PAPr8aF",RayyanYoussef7,,0.0
107,@YuckyKazoo @ChadOBrien4 @RepThomasMassie Sometimes surgeons spread disease to patients. That's the price we pay fo… https://t.co/iyRwMSb2Rz,ElectricInfidel,KY 4th District,0.0
108,"#HustlerNation wishes CS Moses Kuria a successful trip given he has shown signs of being our best Trade CS

Only pl… https://t.co/g1TXXVmbCY",TonyKingv20,Kenya,0.5833333333333334
109,@Evanmemba Clout is a disease,CfcAbu,,0.0
110,@SophicManatee @ZeynabDay @KimIversenShow You didn't refute diet&amp;exercise as a primary prescription for curing dise… https://t.co/pANmONciUP,GEFastRail,California,0.4
111,@maxxx__power @pol1tically @catturd2 Oh that explains it and justifies it. Didn’t “science” tell you that if u got… https://t.co/uBaiT6dloM,sarntsierra67,,0.0
112,How do we maximise #DigitalHealth to address pandemics Palladium's Tupime Kaunti project demonstrates that using da… https://t.co/708jeKXKzR,PalladiumImpact,Worldwide,0.0
113,To remember those who have died from the disease. 🫶 World AIDS Day #WorldAIDSDay  #WorldAIDSDay2022 https://t.co/kSekmc1uZf,yolabastos,London,0.0
114,@paultoxford @sapien_hugo @RonnieLuceroNM Imagine having to take a drug (Paxlovid) not fully approved by the FDA fo… https://t.co/xToMro3LDs,Kikinroks1,New Mexico,0.0
115,"There was lots of pearl clutching yesterday that ""44% of fellowship slots in infectious disease fellowship went unf… https://t.co/a0zyBnsVbu",denise_dewald,Ohio,0.0
116,"@JewelsJourneys1 I’m sorry about your husband. There are no guarantees in medicine. Wearing a well fitting, high qu… https://t.co/i6kKBJgCqk",ScholerinED,United States,0.05333333333333334
117,Chart via @AZDHS https://t.co/GYDSmNy0ih,KDYJournalist,"Phoenix, AZ",0.0
118,@REHAB_ The King’s Disease series has been fire and I also do not want to hear any of those tracks when I’m in the… https://t.co/K4RYbwH82n,NoCar_Kevin,"Bay Area, CA.",0.0
119,Check the timeline Chat. What are the chances Europe spread the Corona virus in China while on this visit to tey an… https://t.co/77QVJ8iXBS,KAMlKAZESHOT,"California, USA",0.0
120,"Disease and duty will deliver us,
After gold and silver and what is congenial.
Let a bush be their shelter in rewar… https://t.co/IUKBjeEc4c",Bearcingetorix1,,0.0
121,@juliaeads @NPRShortWave Thanks for listening! Pt 1: https://t.co/MVNgmCqsdI -- Pt. 3: https://t.co/kHijGIrVTh,gabrielspitzer,"Seattle, WA",0.2
122,"We were motivated to carry out this work in part by the iPSC neurodegenerative disease initiative (iNDI), co-led by… https://t.co/npimujjF4k",FlorianMerkle,"Cambridge, UK",0.0
123,"What is Irritable Bowel Disease (IBD) and a chronotype?

Irritable Bowel Disease (IBD) is the chronic inflammation… https://t.co/9FKS0Gn06y",RayyanYoussef7,,0.0
124,@WONF4W GWS Dave. Please everyone pray for Dave for this old age disease./s,Kyrilhasan,"Johore, Malaysia",0.1
125,"@CDCDirector The 1619 Project
MEDICINE @lindavillarosa
Page 323
""In reality, it's never been race that predicts the… https://t.co/7x8Re91mTm",ericlo,Metro DC,0.0
126,@MCBama231 @stephen_instict @GeoffreyCase @Liz_Wheeler This vaccine itself does NOT help with the “transmission” of… https://t.co/mEgu45m15W,WSportspicks,,0.0
127,"@JackPosobiec For those of us with neurological conditions/disease, parkinsons, epilepsy, multiple sclerosis, just… https://t.co/jpC3YZvlkU",LindaSchleg76,,0.0
128,@LocalBateman @DudespostingWs It takes real courage to say you have the disease  .people will mock and won't even g… https://t.co/P0CNZWv9iy,doggy_ho,,0.2
129,"Universities News:  @AndreasPapasso1: '1. Unfortunately, overall rather disappointing results from the CLARITY tria… https://t.co/IwfK6FabRh",jmagCH,Geneva/Berlin,-0.3
130,@ABrokenBattery @rowlsmanthorpe If one reads the papers by Dr Gary Holmes of the CDC who authored the 1988 CFS defi… https://t.co/YLpCZWYnF9,erikmoldwarrior,Incline Village Nevada,0.0
131,Hero worship is a disease. https://t.co/UnSJafESKo,absoluterelati1,,0.0
132,@kimguilfoyle @ThisIsKyleR FACT: Trum lied to the American people about a truly deadly disease that resulted in ove… https://t.co/3bQ9wLfI1J,LordFerenczy,,-0.1
133,"Rallybio, AbCellera form new partnership around antibodies for rare disease - https://t.co/DgEEGhpDP8",E2DGr1,"Ile-de-France, France",0.21818181818181817
134,@POTUS Aids could be easily controlled if only you would push a moral lifestyle instead of a perverted lifestyle.… https://t.co/0rE9SBGPnJ,JillAll4USA,,0.14444444444444446
135,@cskyriakis @dan_gadd @Censored4sure Bacteria doesn't cause disease either. Virology which is based off that incorr… https://t.co/Yd2UYq4LdS,James34duh,,0.0
136,"Is it possible that an Inflammatory Bowel Disease (IBD) patient’s chronotype can play a vital role in?
•Nutrition
•… https://t.co/XZzGeRAut9",RayyanYoussef7,,0.05
137,Non-Alcoholic Fatty Liver Disease: First Degree Relatives Of Patients At Higher Risk https://t.co/ujWerUS2aN https://t.co/MoLzHnc7aB,91healthtips,"New Delhi, India",0.012499999999999997
138,"Protect your pet from heartworm disease, intestinal parasites, fleas and ticks today and the first of EVERY month w… https://t.co/uTd1wAGUHj",citypawsvet,,0.25
139,@TomCottonAR @HerschelWalker He is as incapable as you and would only pull Georgia down. Under GQP leadership we ha… https://t.co/8M8s0smK8l,Frank33470271,Desert Southwest,-0.07777777777777779
140,"Grieving Parents SPEAK OUT: Vaxx KILLS 23 Year Old Daughter, Triggered Disease, Adrenal Glands Destroyed https://t.co/tgG5Is7mxA",darrel_beatty,Unknown,0.1
141,"@kylegriffin1 What disinformation? You mean the ""disinformation"" that the COVID jab can cause myocarditis &amp; pericar… https://t.co/Ucf2ZLcLrx",Mary25410275,,-0.3125
142,@eds_manifesto This is pretty fucked. The cure is worse than the disease.,thermo_vending,The seven hells,-0.07500000000000001
143,"A newly published article shows that AI-based gait analysis may help diagnose Parkinson’s Disease.

At Magnes AG we… https://t.co/fkyRrQNKAv",magnesCH,"Zurich, Switzerland",0.13636363636363635
144,"The U.S. government did not inform these men that a cure existed for syphilis, instead treating them like human gui… https://t.co/EVCJWmugDS",TeamAmerica4Him,,0.0
145,"HeartSciences and Rutgers will collaborate to develop AI-based ECG algorithms, which are expected to accelerate Hea… https://t.co/zIedZb5on8",HeartSciences,"Southlake, Texas",-0.1
146,"Celiac Disease, Symptoms &amp; Its Treatment | Dr. Nadeem Rahman | Kulsum In... https://t.co/fjRmhyl6vu via @YouTube Celiac Disease",sherkhan0595,,0.0
147,".@IndiaGlobalCap (#IGC), has begun “A Phase 2, Multi-Center, Double-Blind, Randomized, #Placebo-Controlled, #Trial… https://t.co/xwE85RLvpa",ProfilesInLegal,Worldwide,-0.19999999999999998
148,@StephenKing Wokeism is a disease.,R5Snapper,North West UK,0.0
149,"Fighting Stigma — New Alzheimer's drug slows progression slightly, study results show - https://t.co/eA4TzwMmRs: Pu… https://t.co/NtbtwW5XxP",stigmabase,Worldwide,-0.015151515151515152
150,#LUNGFORCE is the nation’s first movement dedicated to defeating #lungcancer. Learn how you can get involved and he… https://t.co/K9Pp1dCWE1,LUNGFORCE,,0.25
151,"Bitches be mad because they have a disease or something, idk. And they have a parent or a parents thats a cop. That… https://t.co/JpNlAtUbWo",puregolderica,heaven,-0.625
152,@Vl65620408 @tomthegrinch @Borg36271416 @Grey52Grey @OzKaterji @Wengerbrawl They were blocked from leaving to contr… https://t.co/6kGP25xlQX,AmyVulpecula374,,0.0
153,"@NoLieWithBTC Ninety-nine percent of ailing NFL player brains show hallmarks of neurodegenerative disease, autopsy… https://t.co/se3nQZrt2N",namedrop7,,0.0
154,Trading COVID for Heart Disease Buys You Both https://t.co/LkQLh17l82,paralegal1999,New York,0.0
155,@icod Yes but it was a terrible disease and a terrible time for many people. I’m just reading 1989 by Val McDermid… https://t.co/54fzIXfYmU,jberthostguen,22530 France,-0.5
156,@maosbot Hcov-nl63 enters through the ace2 receptor. Is it an airborne vascular disease?,mr_raiderMD,Canada,0.0
157,"@GayAsInLesbian @BehaisaE @KashaJacqueline You are suffering for a curable disease one day God will set you free,",Joshuamwebya,,0.4
158,"“He’s a pathological liar. Absolutely. But it’s more than that,” Parsa told The Daily Beast. “He knows how to manip… https://t.co/8sq7WwqnrR",mfstern,The Empire State,0.2333333333333333
