,tweets,user,location,polarity
315,Gurmeet Ram Rahim ji explain that by chanting the name of God continuously a person can easily leave drugs habits l… https://t.co/lTfQyrsfTN,Geetgoyal1,"New Delhi, India",0.43333333333333335
316,"Tuberculosis is a contagious disease. In India, many people die of tuberculosis every year. 
Saint Gurmeet Ram Rahi… https://t.co/0ks8ylKdEs",Lovepre22641144,,0.5
317,Madam what disease is this injection Madam due to this injection i m getting protein leakage from sugar urine can y… https://t.co/sN2zQcqIIc,SantoshSonla,,-0.125
318,"Tuberculosis is a contagious disease. In India, many people die of tuberculosis every year. 
Saint Gurmeet Ram Rahi… https://t.co/5bKGoQ6Yyf",Lovepre22641144,,0.5
319,"Tuberculosis is a contagious disease. In India, many people die of tuberculosis every year. 
Saint Gurmeet Ram Rahi… https://t.co/bm3yEIyvzw",Lovepre22641144,,0.5
320,"Saint Dr gurmeet Ram Rahim Singh Ji Insan suggest, Together , we can end this disease once and for all . Let's rais… https://t.co/gEtfEMQaA9",RashmiInsa4,,0.0
321,"Tuberculosis is a contagious disease. In India, many people die of tuberculosis every year. 
Saint Gurmeet Ram Rahi… https://t.co/EbTPxwnzDz",Lovepre22641144,,0.5
322,"@MikeKillam Pronouns in bio, cat disregarded. Send it to a shelter before it contracts some of your woke clown disease.",Duckydapper,,0.0
323,@Thamsanqamz1 @ATMovement_SA @ZungulaVuyo Ignorance is a disease,PutinAffiliate,"The Kremlin , Russia ",0.0
324,Check out my latest #podcast https://t.co/oVwEif72Rs on #Podbean,PharmacyPodcast,United States,0.5
325,@Spongeafreak89 96 at 47 here. I’ve had this autoimmune disease since I was 12. It has just gotten worse. I have ma… https://t.co/asn1MixODl,STADIUMARCADIA,"Las Vegas, NV",-0.4
326,"Tuberculosis is a contagious disease. In India, many people die of tuberculosis every year. 
Saint Gurmeet Ram Rahi… https://t.co/56ljbkbqaP",Lovepre22641144,,0.5
327,@anish_koka It's fascism to not give children heart disease.,ChocoratHoarder,call da judge n get some fudge,0.0
328,"Today is World TB Day! 
Let's come together to raise awareness about the impact of tuberculosis and the need to acc… https://t.co/3cc2sYIG4m",RFhospital,Mumbai,0.0
329,"Tuberculosis is a contagious disease. In India, many people die of tuberculosis every year. 
Saint Gurmeet Ram Rahi… https://t.co/l0NLZsjxG1",Lovepre22641144,,0.5
330,"@choeshow I’ll say again, seatte has no detox or treatment center for those who want/need it, they shut the doors o… https://t.co/FeygoxmvHv",lancemercer66,"Seattle, WA",-0.1
331,#Tuberculosis is a disease that severely affects one's body especially the lungs and breathing functions. On… https://t.co/D0kobeBDFC,MadhuAgrawalla2,"Kendrapara, India",0.0
332,"Tuberculosis is a contagious disease. In India, many people die of tuberculosis every year. 
Saint Gurmeet Ram Rahi… https://t.co/7vzYhgrs9o",Lovepre22641144,,0.5
333,@kathyfin1 @FoxNews Genderdysphoryia is a disease,johnwixkspencil,,0.0
334,Tuberculosis is a preventable and treatable disease. Let's raise awareness and encourage everyone to get tested and… https://t.co/UfmkReLrnz,MahaHospital,Rajamahendravaram,0.0
335,"“Life is for living and Living isn't for smoking, Spread the work and be aware of the deadly tuberculosis.”

Let's… https://t.co/oiA1aQv79N",President_PCI,"New Delhi, India",0.024999999999999994
336,"Tuberculosis is a contagious disease. In India, many people die of tuberculosis every year. 
Saint Gurmeet Ram Rahi… https://t.co/qVANaj3C11",Lovepre22641144,,0.5
337,World Tuberculosis Day is a call to action to eradicate a growing global health issue.  Honeyy Group is joining the… https://t.co/z66MFhCJqh,HoneyyGroup,"Lawson's bay colony,vizag",0.05
338,"Tuberculosis is a contagious disease. In India, many people die of tuberculosis every year. 
Saint Gurmeet Ram Rahi… https://t.co/By7SNsm257",Lovepre22641144,,0.5
339,"In an effort to eliminate #TB from the state by 2025, we have launched the Aashwasan Campaign with the aim of raisi… https://t.co/voWr5ooBSZ",ChownaMeinBJP,"Itanagar, India",0.0
340,"Tuberculosis is a contagious disease. In India, many people die of tuberculosis every year. 
Saint Gurmeet Ram Rahi… https://t.co/5weNGnJd3j",Lovepre22641144,,0.5
341,my son (he has every disease) https://t.co/IBqTil1MeF,duckpines,he/him (pfp: mobsbentspoon),0.0
342,@PandoraAnastas2 @luvlindy @ericareport THOSE vaccines made you immune from the disease.   The covid vaccine does not.,AOCUnchecked,America ,0.0
343,@DrSamba959 The Salutogenic put importance in maintaining and achieving a good state of health rather than ways to… https://t.co/jSBbWlDpMg,Hafizi_Data,,0.7
344,"Today, on World Tuberculosis Day, let us raise awareness about this curable disease and work towards achieving a TB… https://t.co/fkqPfhPh8n",PriyaMishra1007,"Bhubaneshwar, India",0.0
345,"On this World Tuberculosis Day, let us all join hands in the global fight to end TB by educating people about the d… https://t.co/XYh51iVvck",ChownaMeinBJP,"Itanagar, India",0.0
346,"Before the development of the measles vaccine, 500 American children died from the disease every year. Wall Street… https://t.co/wzM7ysA6Bv",stanleythornton,"Lubbock, TX",0.0
347,"World Tuberculosis Day, observed on 24 March each year, is designed to build public awareness about the global epid… https://t.co/jkMjvGtIDy",latteyspumps,"Naroda, Ahmedabad",0.0
348,@SaycheeseDGTL How is this relevant? Better yet how is he relevant? 🤦🏾‍♂️… clout a disease.,abiolaftw,,0.43333333333333335
349,bitches always tryna crack a joke h0e go fight that disease,destiniraye,,0.0
350,"You look ugly today. Given the scale of issues like global warming and epidemic disease, we shouldn't underestimate… https://t.co/PPkGRKfTWF",ECOTerminator,Your Motherboard's house,0.0
351,"#WorldTBDay lets pledge to make I
#TBMuktBharat.Low immunity n improper diet n smoking  cause TB.

@DSSNewsUpdates… https://t.co/wjqW99THFD",RenuNarula5,Canada,0.0
352,"A deadly combination of disease, climate risks, &amp; unsafe water, sanitation and hygiene creates a triple threat for… https://t.co/T0P2yH2ch4",UNICEF_AUOffice,"Addis Ababa, Ethiopia",-0.2
353,"#WorldTBDay
Revered Guru Saint Gurmeet Ram Rahim Ji says that TB disease develops due to use of drugs, prolonged il… https://t.co/eoBStCnczl",BishanMalik,"Vpo Barsana, Kaithal, INDIA",-0.125
354,"The hard stuff is still happening. It isn’t all trips and whiskey. 

When your strong, healthy husband drops dead o… https://t.co/OkYr0299Ul",WidowWhiskey,Join the journey at:,0.11041666666666665
355,@chesterraps @dijoni and like she is in the early stages of a metabolic disease,erin1234569,"Intercourse, PA",0.1
356,@Tapas1776 @abortivus @1717mule @JSterling007 @WeisbergSarah @TreatHunterDog @moimasita @LordButters22 @Flaffenbam… https://t.co/FOjbitB3B6,Zirnike,@Zirnike@universeodon.com,0.0
357,@NeuroBlazeJP @Cornhusker54321 @RedPillXR @DiedSuddenly_ The video where this comes from even states this is in the… https://t.co/XJojuBb9RI,Ravex24,"California, USA",0.0
358,"#EndometrialCancer can affect any woman, but certain #RiskFactors increase your chances of developing this disease.… https://t.co/jLR3v47HXq",cherishwomen,Brisbane,0.21428571428571427
359,"i am so angry 
 i am so at ease 
 i feel just like some great, big disease",catpowerbot,,0.10000000000000002
360,Tuberculosis cases reported in the United States appear to be returning to levels seen before the Covid-19 pandemic… https://t.co/BabUaJKnrT,CNN,,0.0
361,@realstewpeters I don't know if this is true or not. Does anyone have a link to the link to this LIVE tv show she s… https://t.co/DLstTOCpPG,Lynniegal1,,0.24318181818181817
362,"World TB Day - March 24, 2023!

World Tuberculosis Day, observed on 24 March each year, is designed to build public… https://t.co/tSY19RiVZ4",enlite_ias,"Trivandrum, India",0.0
363,@KamalKheraLib Focus on the disease called #Wokeism,Revered_Joker,India,0.0
364,"This World TB Day, let's raise awareness about the serious bacterial disease that affects the health of the lungs,… https://t.co/ozggiiBPAC",ClinicFortune,"Mumbai, India",-0.3333333333333333
365,"The pharmaceutical chemical CAS 84290-49-3 can be used in synthesizing a sickle cell disease agent.
#Benzene… https://t.co/F5Vp62a9CC",LinkchemL,Shanghai,0.0
366,"Scientists have sequenced the genome of Ludwig van #Beethoven, gaining insight into his fatal #liverdisease. The re… https://t.co/r8k62Gr4km",BJNewsWorld,,0.0
367,"Every year on March 24, World Tuberculosis Day is commemorated to raise awareness and to strengthen efforts to elim… https://t.co/clkUWGm11l",GenuPathlabs,India,0.0
368,"depression is a very fucked up disease, it can affect you even if you don't even have serious problems, it makes yo… https://t.co/z01ihFsI7t",l3nno_,Casa do @l3nno_,-0.06666666666666665
369,"#WorldTBDay
#TBMuktBharat
@DSSNewsUpdates 
@Gurmeetramrahim 
@insan_honey 
@GreenSwelfares
Dera sacha sauda volunte… https://t.co/ESs3lDpiPK",rajiinsan8,"punjab,punjab",0.0
370,@vocal_ism @TamTamGeorge @CasuallyGreg Being provocative on national tv shows my children and other children that s… https://t.co/vjqt6PpDmh,wherearethesane,,-0.125
371,"In these paroxysms of disease, Thomas felt brought almost face to face with death.",erikjaviersoli1,,0.0
372,"Article by Inês Vigo, Luis Coelho, and Sara Reis. ""Speech- and Language-Based Classification of Alzheimer’s Disease… https://t.co/pjYqeyGKmi",Bioeng_MDPI,"Basel, Switzerland",0.0
373,"@vicky22mansa Saint MSG tells that if you increase your immunity power to get rid of the most terrible disease, the… https://t.co/WqIXrxxq2W",Ranikavita10,,-0.25
374,WHO warning as Marburg cases rise in Equatorial Guinea and Tanzania https://t.co/bmUgHUHjYD,syramadad,NYC 🗽,0.0
375,Living with an autoimmune disease freaking sucks and what sucks more is not knowing exactly how bad it will get bec… https://t.co/RJmncsgwGp,Cindy_luvs_kpop,Atiny P1ece engene... ∞ ,-0.10999999999999996
376,Let us commemorate the occasion of World Tuberculosis Day by helping people recover from this disease and embrace a… https://t.co/23Kq0aTbDp,AbbayyaFans,"Hubli, India",0.0
377,@iluvtrump112 @Movanhook @ReOpenChris It is true. We must amend the public health code to remove HHS current legal… https://t.co/XIfHxIzHDg,maija_hahn,"Florida, USA",0.1375
378,"Live a healthy and disease free life, by adopting vegetarian food. Saint Gurmeet Ram Rahim Ji give tips to prevent… https://t.co/xMc4yxjqdj",iritu2837,,0.34545454545454546
379,Freedom is a kind of emotion that can be felt but cannot be forced upon anyone.  If it influence by the force then… https://t.co/8CqbdjEIqs,VIARTECHNOLOGI1,,0.14999999999999997
380,@CNN It isn't disease according to US consulate General KHI. I have been 4times rejected &amp; my wife twice telling VO… https://t.co/fAla0qJSyq,SahtoAsghar,,0.05000000000000002
381,Alzheimer’s disease: problems with the brain’s energy supply could be a cause https://t.co/0lblDwq6S8 a través de @ConversationUK,DanielNavasSund,Barcelona,0.0
382,@Sebastian2Blue @LetsKickHateNow @LHWesteman Hope Justin Trudeau didn’t catch any disease!,lozavi01,"Mesquite, TX",0.0
383,"@spinesurgeon Nice story about Pott disease, Bruno ! 👌🏼👍🏼👏🏼",imgsthana,தமிழ்நாடு,0.6
384,"According to WHO, the world's deadliest infectious disease takes over 4,000 people a day.

This World Tuberculosis… https://t.co/FbEGKhHKMr",JaipurGolden,"Sector 3, Rohini, Delhi,110085",0.0
385,"Today, on World Tuberculosis Day, let us raise awareness about this curable disease and work towards achieving a TB… https://t.co/UnMRX2Ftr4",NewsNowNation,"New Delhi, India",0.0
386,@DoctoradeS @IU_Wakilii Misconception is a disease in our community nowadays. 🤦‍♀️,dapperfaruq,"Ibadan, Nigeria",0.0
387,Saint @Gurmeetramrahim Ji says that by regularly chanting God's name while meditating &amp; living &amp; eating healthy foo… https://t.co/Jpk6AZeuAX,ShineSonia53,,0.25
388,"@tnseyfried “#Cancer as a Metabolic Disease” (55 mins)

https://t.co/EAw3vDAN0u https://t.co/RXp7XsTYjo",TheUnknownMous1,away from cats,0.0
389,"TB is a serious infectious disease. It's mainly caused by substance abuse,kidney diseases,weak immune system etc.… https://t.co/9y5VZfCSOS",Insan_girl_01,"Gokulpur , Delhi ",-0.18055555555555555
390,"@IanCalv63274296 @battleforeurope @DrJBhattacharya the left collectively suspended disbelief, abandoning everything… https://t.co/WJEj83757b",financejawn,,0.0
391,"I'm not sure entirely what it is, but I know it's not a disease. It's an intangible quality, not dissimilar to char… https://t.co/nNSLf8BtVZ",VBSLibrarian,Eddie 21+ Mun |ō| Minor Muse,-0.125
392,"#worldTBday
Every year more than two lakh people die due TB. TB disease occurs due to alcoholism, prolonged linlnes… https://t.co/SStv9SWtpq",KajalSa21386433,,0.08333333333333333
393,"Today is World Tuberculosis Day. It's a reminder of the power of collective action to control, treat and eliminate… https://t.co/2bvqRig90L",ProTeamSolutio1,"Bengaluru, India",0.1
394,"@DrSamba959 The salutogenic approach, also known as salutogenesis, is a term used in the health sciences and more r… https://t.co/aaaw0C23j0",elvianeyyy,,0.5
395,@mawbyte Hope you're feeling better soon♥︎ transphobia is a disease,fORGOTT3nSqUID,the river,0.5
396,@fmtoday Damn scary disease if bck to haunt us,da_thespian,MALAYSIA,-0.5
397,"Albright portrayed the body’s vulnerability—to age, disease, and death—in works that provoked outrage and admiration.",AsaYounts,,0.0
398,My girls they have every disease ever https://t.co/zW2yKdAYDe,akuhatepage,they/them minor,0.0
399,"On this World Tuberculosis Day, let us come together to raise awareness about this deadly disease and show our supp… https://t.co/HwWvSZIzyT",mega_banknepal,"Durbarmarg, Kathmandu",-0.2
400,"Terrible disease like TV in India can be caused due to excessive intoxication, some prolonged illness.  According t… https://t.co/vCBx5xfrkQ",MeenuGo67470716,,-0.4583333333333333
401,"Finance Officer at International Centre for Diarrhoeal Disease Research
Dhaka, Bangladesh
https://t.co/66coUP96au… https://t.co/Ywrsweay94",indevjobs,Global,0.0
402,New disease model pits zombies against clerics for clarity - Discover LANL https://t.co/4OnuMrZst8,WebSurfZombie,,0.13636363636363635
403,"The United Kingdom provides some coverage for obesity medication - but is it fair? - Dr Sue. Great blog Sue, covera… https://t.co/0pydw46v4k",seanwharton,Toronto,0.75
404,@DrSamba959 to make it clear and understand salutogenic describes an approach focusing on factors that support huma… https://t.co/XooONjgyhk,ntshafzra_,,0.10000000000000002
405,"Every year more than two lakh people die due to TB. TB disease occurs due to alcoholism, prolonged illness, wrong e… https://t.co/d3lOiHKjWF",its_meet_insan,,-0.0625
406,"On this World Tuberculosis Day, CV Infotech Family joins hands to accelerate the end of TB by raising awareness abo… https://t.co/IPLaws152S",cvinfotech,Gurgaon,0.0
407,"@icodeblockchain Objection your honor, calls for speculation.
You've got a lot of onion peels to get through before… https://t.co/DE4yuBDns1",Guygies,"Rogue River, Oregon",0.0
408,My supervisor is like ‘The team you work with said some amazing things about you but I don’t want to tell you exact… https://t.co/Zez5tPzlup,rarecombo,,0.42500000000000004
409,"okay, so, so far, from my understanding, when you defeat a hollow knight boss,
if they got the orange goopy disease… https://t.co/ZyYz2Es9Mv",rainbowresort_,australia (the other one),0.16666666666666666
410,"⠀⠀I DO ？！？！ … Wait, it’s not a disease, is it ？！？！ Oh no ！！！！  Σ(⺣°ロ°⺣) https://t.co/1N1MRIXrGF",WONDERSOPTIMISM," ༘♡ ⋆⠀𝘛𝘏𝘌⠀𝘈𝘋𝘜𝘓𝘛𝘚 ’⠀𝘚𝘏𝘈𝘙𝘗⠀,⠀𝘔𝘖𝘕𝘌𝘠 — 𝘔𝘈𝘒𝘐𝘕𝘎⠀𝘔𝘌𝘔𝘖𝘙𝘐𝘌𝘚⠀𝘔𝘈𝘒𝘌⠀𝘜𝘚⠀𝘞𝘖𝘙𝘙𝘠⠀𝘛𝘖𝘖⠀𝘔𝘜𝘊𝘏⠀.ᐟ",0.0
411,@vaultempowers @IAmSteveHarvey And don't be infected by disease of pressure,Browniesliu007,🇳🇬,0.0
412,"On World Tuberculosis Day, an appeals to everyone not to ignore the early symptoms of TB. Also, to spread awareness… https://t.co/fudDH0LuM6",AbcKnowledge,Delhi,0.1
413,"TB is a serious infectious disease. It's mainly caused by substance abuse,kidney diseases,weak immune system etc.… https://t.co/MBqzTEjaKB",virendr56747888,,-0.18055555555555555
414,"@CDCTobaccoFree After dealing with Lyme disease and listening to your Covid BS, I’d argue that the CDC is more dangerous than tobacco.",SWalk58,,-0.04999999999999999
415,"By smoking and consuming tobacco, a person becomes a victim of a terrible disease like tuberculosis.

Tuberculosis(… https://t.co/GrMZDVq45V",ArunYadav0007,"Gurgaon,Narnaul,Haryana, India",-0.5375
416,@VandanaMegastar Freedom is a kind of emotion that can be felt but cannot be forced upon anyone.  If it influence b… https://t.co/AVJqPH9OAR,VIARTECHNOLOGI1,,0.14999999999999997
417,i’m gonna die of hopeless romantic disease,bbgorlbin,,0.0
418,Sir what disease is this injection sir due to this injection i m getting protein leakage from sugar urine can you h… https://t.co/hGEvV8S44t,SantoshSonla,,-0.125
419,Every year more than 2 lakh deaths are due to TB in India. This disease flourishes due to intoxication and alcoholi… https://t.co/qdHf642GTa,iritu2837,,0.08333333333333333
420,World Tuberclosis Day is March 24-a day to educate the public about the impact of TB around the world. This disease… https://t.co/po09c0jSsp,deepwaraich04,,0.0
421,@Carnage4Life Utah has the 8th lowest child death rate in the USA according to ChatGPT citing the following CDC dat… https://t.co/iP3XI5zrqn,CyrusEVM,USA,0.0
422,"@CriticalRole @Orrington16 Wow, what a brilliant observation! I'm so glad you're using your extensive knowledge of… https://t.co/ovjTwsY7gY",aaaprliaa,,0.375
423,"Very interesting talk. Dr. Mark Harman &amp; Tucker on our food 
crisis , obesity , poor metabolism, sugar and their re… https://t.co/50Bandnx1e",shawniefc,"Ontario, Canada ",0.125
424,"@c_dodson_thatch @peta Triggered!  Hope you know what coronary artery disease and atherosclerosis are, and what act… https://t.co/jltzxeGeuQ",roseannroseanna,,0.0
425,SteamDrills -Mountaintop removal is the symptom of a disease called: if-I-can't-see-it-I-don't-care Climate #Coal 5Star @RiveraSunAuthor,RiveraSunAuthor,"Taos, New Mexico, USA",0.0
426,"#WorldTBDay
More than 20% of global tuberculosis patients caught the disease due to smoking and consuming tobacco.… https://t.co/0NU6d5kxSy",iritu2837,,0.125
427,"Smoking has major effects like cancer, heart disease, stroke, lung diseases,diabetes, &amp; more. It also increases the… https://t.co/fnC5CUQOmu",wasimakram_0786,Ghaziabad,0.28125
428,"Every year millions of people are infected by TB &amp;many of them die due to it
Saint Gurmeet Ram Rahim Ji says that t… https://t.co/ahWBKqm3nx",iritu2837,,0.1875
429,"1 in 3 Americans are at risk for kidney disease. Making healthy food choices is important to everyone, but it is es… https://t.co/qT2wOPiC7s",mdvagov,Maryland,0.45
430,"By smoking and consuming tobacco, a person becomes a victim of a terrible disease like tuberculosis. Following the… https://t.co/fWPqoMJoHL",iritu2837,,-0.35833333333333334
431,@CNN not an illness but a condition and why cdc involved? ain't a disease or any contagious... you yanks always com… https://t.co/vHaSkIsvRO,sbarrios_seba,"Punta Alta, Buenos Aires",0.0
432,"Arabs and all Asians respect strength. No wonder, both allies and enemies respect Trump. Except those infected with… https://t.co/XnOU5pud9H",wokeinamm,,0.0
433,"By smoking and consuming tobacco, a person becomes a victim of a serious disease like TB. Saint Gurmeet Ram Rahim j… https://t.co/LNWrmz3Byp",rinky_its,JAITO ,-0.20416666666666666
434,If we want to live a disease free life then make a routine for meditation twice in a day .Let us spread awareness a… https://t.co/KNzZDDTrKq,MeenuSa13485087,Meerut,0.2681818181818182
435,Oh jealousy is a disease . My god please let me pull this one too 😭😭😭😭😭😭 https://t.co/waiqF2X8Kw,Amnesiasdp,,0.0
436,@EndTN I'm a long time sufferer of this disease 😕 https://t.co/kq9UzALHWz,FiestyClaws,Wales🏴󠁧󠁢󠁷󠁬󠁳󠁿 Uk,-0.05
437,There is only one cure for terrible to terrible diseases that we increase our self-confidence and self-confidence c… https://t.co/CeYiuHaAA0,sandyra04132899,,-0.6666666666666666
438,"By smoking and consuming tobacco, a person becomes a victim of a terrible disease like tuberculosis. Following the… https://t.co/28UfyAJurt",deepwaraich04,,-0.35833333333333334
439,@Kuldeep26142474 @Rajnees87860155 Saint MSG always thinks for the welfare of humanity and social welfare. Guruji te… https://t.co/JPwIT268yT,kajalku25367586,,0.03333333333333333
440,Heart disease leading cause of death for Americans https://t.co/k2fWrREpmG,daddylongdreads,peace,0.0
441,@BarstoolBigCat Bad coaching is a disease.,MakeNYMGreat22,,-0.6999999999999998
442,"Well..Bro, how did y’all know? I was gonna write about Thai Doctors; how they’ve stop the disease from spreading..b… https://t.co/MeLIA9ZgVl",OffeePloy,"Las Vegas, NV",0.0
443,"Today is  #WorldTuberculosisDay, observed on 24 March each year, is designed to build public awareness about the gl… https://t.co/Q7wDgWNfmI",30anju,"Mumbai, India",0.0
444,@joncoopertweets Heart disease.,Dolly_4_Pres,,0.0
445,"""Yes! We can endTB!""

Tuberculosis is a preventable and treatable disease with timely diagnosis and treatment. On … https://t.co/402Xdeh6h1",saraka_fan,"Bisamcuttack, Rayagada Odisha ",0.0
446,NJF Capital and Nicole Junkermann presents Gordian Biotechnology. Gordian is motivated by the observation that the… https://t.co/wgr6BzScKW,AlexDanUrb,,0.0
447,"To Avoid Disease TV , put pulses, fruits and vegetables in your diet. Do exercise in the morning and take morning s… https://t.co/OJJisnL0HN",sandyra04132899,,0.0
448,World TB Day is observed to spread awareness about the social and economic consequences of the disease that impacts… https://t.co/5jRKpXNDqN,IYCWestBengal,"Kolkata, West Bengal",0.11666666666666667
449,Today's is #WorldTBDay as you all smoking is very harmful to us it also increase Risk of TB so stop smoking . Estim… https://t.co/FDQJLr27Wx,AshirvadBansal,,0.2
450,This article highlights the importance of plumbing in our everyday lives. It discusses how plumbing allows us to ma… https://t.co/INyh1FOabo,business_brain9,"USA, New York, New York City",-0.2
451,"Whether there is the risk for Intelligent #Silicon #Footprint that could influence the disease states in #humans?
W… https://t.co/VCNlrt8R6W",nksharmaiitr,"Pune, India",0.8
452,=h^\( Cancer is a deadly disease.   #上海   https://t.co/QORzH4rshk,Khalid481921,,-0.2
453,"The main cause of severe disease, tuberculosis, is unchecked consumption of alcoholic beverages and tobacco.
To mak… https://t.co/cPmPNVp4gq",SanehaM834,"Jaipur, India",-0.04166666666666667
454,#NowPlaying Ben Lee - Catch My Disease https://t.co/0FBlKOin7j,radio_poprock,Perth WA,0.0
455,@weishaarems @Heartsoulmagick Ultralibs is an insult. Liberalism is a disease and decaying form (way better than conservativism).,grinddbass,,0.5
456,"According to the @CDCgov, about 20.1 million adults, age 20+, have coronary artery disease in the United States. Wi… https://t.co/y5paYQF4Dr",CueHealth,"San Diego, CA",0.0
457,"Sorry for the translation.  Apparently something is missing, yes?  I didn't mean a disease from other parts of… — T… https://t.co/ZlmjVJCtSI",musicgirl1120,,-0.21749999999999997
458,"TB disease flourishes due to drugs and alcohol, wrong eating. Saint Gurmeet Ram Rahim Ji explains that continuous m… https://t.co/BebE13Cgd5",iritu2837,,-0.3125
459,"@VP We’re the fattest, most pill addicted nation in the world. People dying by the thousands every day from heart disease but",ChaseDa501,,0.04999999999999999
460,World TB Day is observed to spread awareness about the social and economic consequences of the disease that impacts… https://t.co/Zeji7mB6P5,IYCUttarakhand,,0.11666666666666667
461,"From the WA epi report (note the different time period to the national report, so the numbers won't align exactly),… https://t.co/gTQSzZyoS1",dbRaevn,,0.125
462,"A video of my new invention, 20 TwenTea:cancer, diabetes, dementia, depression, brain, heart, liver disease, eyesig… https://t.co/GmjxKQpHfY",DrNakaMatsBot,東京都世田谷区,0.13636363636363635
463,"In today's world, due to the need of bad diet, or due to some major disease, a disease like TB has arisen. To avoid… https://t.co/Jxh62YGcQY",chalana_riya,"Sadulshahr, India",-0.22187499999999996
464,TB is deadly disease but with method of meditation we can our inner health so strong that anyone can win over any d… https://t.co/zutcoMAtmw,amolpreet7,,0.2583333333333333
465,Tuberculosis is the disease which mainly affects Lungs.The main leading cause of TB is Smoking.For #TBMuktBharat Sa… https://t.co/dskIpzcfmr,iritu2837,,0.16666666666666666
466,Let's end the deadly disease#a monster it is#say NO to TB#Lets keep safe#TB Kills https://t.co/X2s1RsBeye,Mash440867111,"Nairobi,Kenya.",0.15
467,"✨[ WORLD TUBERCULOSIS DAY ]✨

Tuberculosis is one disease that can take away so many good things from our lives. Le… https://t.co/fNQnWVU0zM",kesmasums,"surakarta, indonesia",0.6
468,"#WorldTBDay
#TBMuktBharat
Dera sacha sauda volunteer awareness to the people from many disease like TB, Cancer,
And… https://t.co/4dY8YPbxsK",rajiinsan8,"punjab,punjab",0.5
469,"The date marks the day in 1882 when Dr. Robert Koch announced that he had discovered the bacterium that causes TB,… https://t.co/WVmIIBzIIs",amsa_unismuh,"Makassar, Indonesia",0.0
