,tweets,user,location,polarity
316,"Last Friday, it was our pleasure to support the mission of the American Heart Association by attending the SWFL Go… https://t.co/GEgcfIZ8jA",ChrisTelConst,Fort Myers,0.0
317,"@so_solstice @DavidRy01734524 Whataboutitis:  A mental disease or defect of double deflection, in which, rather tha… https://t.co/NlnNfEybDU",Jmhenderson58,"North Carolina, USA",-0.05
318,Thalassemia is a disease when body could not produce hemoglobin and the patient have to transfer blood so the volun… https://t.co/gKjUSrovXM,RAJATnarang90,"Hanumangarh, India",0.0
319,"@TheSpecter9 @ergonoatia @ProudSocialist @BernieSanders Only so much detail one can afford on Twitter, but being en… https://t.co/CcfyJWB9QN",The___Maestro,,0.1
320,"@marwilliamson @peterdaou Serious Mental Illness is a brain disease not unlike Alzheimer’s.
Poverty is not the caus… https://t.co/HmcHQtMEve",Freedom84202716,,-0.21666666666666667
321,Attending the LeadingAge Maryland Annual Conference in Ellicott City? Stop by the @MDHealthDept #ProjectFirstline b… https://t.co/g9xjnZmT5y,MD_Firstline,,0.0
322,"Millions of people worldwide are affected by lung disease, making it the third leading cause of death in the United… https://t.co/eNoWBA81Sy",BCBSWNY,"Buffalo, NY",0.0
323,"&lt; I wonder how anybody can be comfortable about the current world order, which condemns masses of our fellow humans… https://t.co/VR8Iww5ALE",Linguagroover,"London, Home Counties, world",0.2
324,"https://t.co/Dx3ynb4rte… Here’s the VAERS thread: Milken institute 2019 Dr.Fauci, and head of BARDA Rick Bright dis… https://t.co/3ulpeukDPd",jdata17,Chula Vista,0.7000000000000001
325,"Marin County is a very expensive place to live.  It is mostly an exclusive community, just outside of San Fran.  No… https://t.co/kC3jnxztXS",nettermike,"California, USA ",-0.003409090909090917
326,"🧵8 May marks #WorldOvarianCancerDay, to help raise awareness of the disease, affecting many women in South Africa… https://t.co/pWRY4FZskZ",CANSA,"Jhb, SA",0.5
327,"Chia seeds are a rich source of omega-3 fatty acids, which are thought to lower your risk for heart disease, dement… https://t.co/OywANJ0H5M",MontclairBreast,"Montclair, NJ",0.0875
328,"https://t.co/W4nZHY1LOi ⬅️ You’re going to have to research this one to see more benefits!

📷: @JamiaFields4

*Stat… https://t.co/eu6xALVb8A",NOWFoods,"Bloomingdale, IL",0.5
329,Survey on the Impact of the COVID-19 Pandemic on Patients with Parkinson’s Disease and Their Caregivers in Japan https://t.co/5WscvuagFg,EINPfizerNews,"Washington, D.C.",0.0
330,"@aesthetica_s GM, Aes! 🌻🌞

""No disease that can be treated by diet should be treated with any other means. : Maimon… https://t.co/4WqXu5Eju1",GoldenMongoose,Mumbai ,-0.125
331,"@CoconutBird80 I am sorry.  I've had more ""sporadic kidney disease"" - had nephritis for about 18 months when I was… https://t.co/HtPV3tI4Sn",lauriedtmann,"Pittsburgh, PA",0.0
332,Feline hypertrophic cardiomyopathy (HCM) is the most common form of cat heart disease and can thicken the heart's w… https://t.co/TUEfe92Bdn,Zumalka,,0.1
333,"Explore April's Ask the Mito Doc Q&amp;A transcript on ""Endocrine Complications of Mitochondrial Disease:""… https://t.co/ih0Ivm74cA",UMDF,"Pittsburgh, PA",0.0
334,"#Squirrels are noisy and carry disease just like any other #rodent, you’ll likely hear them before you see them if… https://t.co/pdtV5MiQ2I",1ManAndALadybug,"Calgary, Alberta",-0.0625
335,"This Saturday, May 13, we will walk for those impacted by breast cancer to fight against this disease. The opening… https://t.co/tW43DCbUKY",ILMeridian,Illinois,0.0
336,@maxfawcett Get a grip.. They actually had medical pass cards for them during the H.. They were deemed dirty and ca… https://t.co/GjurVjNCgc,Thinker_crit,,-0.19999999999999998
337,Modern treatments are effective at managing the early motor symptoms of the disease.,ParkinsonsFacts,Worldwide,0.3
338,"Today, May 8, is World Ovarian Cancer Day, and OGT fully supports the initiative to raise awareness of this disease… https://t.co/M2nDJ65SmH",OxfordGeneTech,"Oxford, UK",0.0
339,Today we celebrate World Thalassemia Day! CTI has been lucky to work closely with this rare disease.… https://t.co/l7nzlnsxtg,CTIClinical,"Cincinnati, Ohio",0.31666666666666665
340,"May is ALS Awareness. ""ALS is a progressive disease in which a person’s brain loses connection with the muscles, sl… https://t.co/WecmSWDZD6",hospicenw,"Mount Vernon, WA 98273",-0.3
341,Today is World Ovarian Cancer Awareness Day. Let's raise awareness and spread the word about the symptoms and risk… https://t.co/pERpFlFKVC,nhsfyp,North East & North Cumbria,0.0
342,"Stay off My Operating Table: A Heart Surgeon's Metabolic Health Guide to Lose Weight, Prevent Disease, and Feel You… https://t.co/dEZZY1hK6F",ifixhearts,Join me at,0.0
343,NEW From the Cardiology Advisor Institute: #MitralValve Disease: Role of Transcatheter Intervention for Optimal Lif… https://t.co/zoMLhnRtcx,myCME,"Paramus, NJ",0.13636363636363635
344,"5. Supplement Cocoa extract

Research suggests supplementing can reduce death from heart disease by 27% in older Ad… https://t.co/jesr5LAaY2",TheWarEnglish,Transform Your Body →,0.16666666666666666
345,"...The “cure” was definitely so much worse than the “disease.”
And, it’s now proven and widely reported that the pa… https://t.co/vBfD4LhN0f",DLawrenceSims1,"Kentwood, Mich.",-0.25
346,@eclecticbrotha Caused by the American media’s  addiction to twitter and acute case of online brain disease,Ryan_Abrams7,"Philadelphia, PA",0.3
347,@Fightin4Rights @Morning_Joe Whataboutism is a disease.,xhoipolloix,"Houston, TX",0.0
348,"A @PennMedicine study has developed a test that can identify at-risk people &amp; those with early, non-motor symptoms… https://t.co/jqeAWHUO3Z",AAUniversities,"Washington, DC",0.1
349,"@2011Madness @tamsully12 @JesseKellyDC Plot twist-- they won't let you.

Because it isn't enough that they sink int… https://t.co/GJfN73SxoM",KarambitKrunch,Pennsyltucky,0.0
350,The @TeagascCrops / Boortmalt Joint Programme will run a series of walks on monitor farms. Topics to be discussed i… https://t.co/KvPirgN3XJ,teagasc,Carlow,0.0
351,Director of Robotic General Surgery Dr. Rodolfo Oviedo presents today at #DDW2023 about the outcomes of combined tr… https://t.co/Itb5qOIaJf,HMethodistMD,"Houston, TX",-0.024999999999999994
352,"During pregnancy, women may be more prone to gum disease and cavities. Don't skip your dental check-up because poor… https://t.co/HNtXqIHXMf",DeltaDentalNC,"North Carolina, USA",0.04999999999999999
353,"The NAD+ IV Drip is for anyone who wants the most in their anti-aging support. (Not intended to diagnose, treat, cu… https://t.co/HVpVupUIEs",DRIPBaRsatxFC,"San Antonio, TX",0.35
354,I hate when someone needs company in their misery of stress so they try to spread that shit like a disease. Please… https://t.co/TPeNufxndE,SL_Reign,,-0.8
355,It’s National Fitness &amp; Sports Month! Physical and mental benefits of #exercise are undeniable. Being physically ac… https://t.co/JFOmvxrEW0,NJOrthopaedic,New Jersey,-0.03333333333333333
356,"If you have Inflammatory Bowel Disease and are looking to start a family, you may have a lot of questions regarding… https://t.co/6l1g7SCnxj",TheCDHF,Canada,0.0
357,"Make COVID-19 shot part of gov’t vaccination program –infectious disease expert

https://t.co/ycEvoVs9Cg",gmanews,Philippines,0.0
358,"50 years ago, enzyme injections showed promise for treating a rare disease https://t.co/yZ2b8CeDXT https://t.co/4wXjbTfkZV",futurenewstech,"Houston, TX",0.3
359,"Music and art enrich the lives of seniors, especially seniors with Alzheimer’s disease and dementia. To find suitab… https://t.co/z2Zh8CNlZW",thoughtfulhomec,"Upland, California",0.0
360,"Cardiometabolic multimorbidity, lifestyle behaviours, and cognitive function: a multicohort study

▶️Cognitive decl… https://t.co/dxYVeuNwxQ",agingdoc1,Community of #Aging #Biology🌎,0.0
361,"Over the #BankHoliday, many of us will be spending more time outdoors. Ticks &amp; the potential risk of #LymeDisease s… https://t.co/9ODzqVkIob",UKHSA_NorthEast,North East England,0.3333333333333333
362,"The Panama Canal is a testament to human ingenuity and perseverance, overcoming significant challenges such as dise… https://t.co/AETQikmgF1",thepanamacanal,"Panama, Rep. of Panama",0.125
363,The risk of high blood pressure or hypertension is higher for senior citizens and older adults. It can increase the… https://t.co/qmfG9trRpl,healingtouchhca,"Whiteville, North Carolina",0.1922222222222222
364,"According to the Centers for Disease Control, murder is the third leading cause of death for Indigenous women.
https://t.co/ojygmupqph",OKCFOX,"Oklahoma City, OK",0.0
365,"Helping ovarian #cancer patients attain high-quality, long-term survival is now the key focus of medical treatments… https://t.co/nwNtR22NBr",ChinaDaily,"Beijing, China",0.0275
366,Please let us know if you have a loved one with a terminal disease for whom curative treatments are no longer an op… https://t.co/yjW1Dutyrs,myfamilyhospice,"Texas, USA",0.7
367,Click to watch this brief overview of the pivotal trial supporting the emergency use authorization of Pfizer’s… https://t.co/0yGfmZsGKk,PfizerMed,USA,0.25
368,Stress can increase the risk of many health-related or age-related issues. A few common examples include high blood… https://t.co/2caWsobcko,siloehomehealth,"Rockport, Texas, United States",0.02666666666666667
369,"Over the #BankHoliday, many of us will be spending more time outdoors. Ticks &amp; the potential risk of #LymeDisease s… https://t.co/FzFKy0zycK",UKHSA_NorthWest,"North West, England",0.3333333333333333
370,"Can you name me a better disease .ᐣ
I'm YOUNG and DUMB , got vacancy .ᐟ",chaIIengerdeep,Posts every 4 hours,0.075
371,More than 6 million Americans are living with Alzheimer’s. We join the Alzheimer’s Association in sharing the facts… https://t.co/HdjFnQT1vc,WayForth_,"Richmond, VA",0.5
372,"American dog ticks in the US can carry germs that make people sick, but dog ticks in Maine do not. The UMaine Tick… https://t.co/BYHYmcYwOB",MEPublicHealth,Maine,-0.35714285714285715
373,"Alzheimer's disease is a neurodegenerative condition that gradually affects a person's ability to remember, reason,… https://t.co/Qvq6zSo19T",moghomehealthcs,"Secane, PA",0.0
374,"Tragedy in the Omo Valley: Dam and sugar plantation projects bring hunger, disease and misery for #Indigenous commu… https://t.co/pSBhfnlFMa",oak_institute,,0.0
375,"When you're living with a chronic disease, there's no question that you need to take your medication. But it's impo… https://t.co/IhVhpjisJA",bestcarehhealth,"Lincolnwood, IL 60712-2620",0.0
376,The @getgaitQ Tempo is a wearable device that employs @NordicTweets' nRF5340 SoC to provide walk cueing for people… https://t.co/9TaVptXcIG,EdgeImpulse,"San Jose, CA",0.0
377,Public health officials have a duty to advance health and serve the common good. They abandon that responsibility w… https://t.co/998MXqkIze,Kassandra2_0,Country without #CleanAir ,0.13333333333333333
378,"""BITTER TASTE,"" on the now two-decade-long fight against citrus greening in #Florida. Great story @abbeyhasebroock… https://t.co/GoG6CDeuR0",cynthiabarnett,"Gainesville, Florida",0.21666666666666667
379,"We are virtually lighting up in teal today for #WorldOvarianCancerDay. 
It’s important to learn the signs and sympt… https://t.co/tBpQz6bd0v",SailBluenoseII,"Lunenburg, Nova Scotia",0.4
380,"@RahulBanerjeeMD @jitcancer Thanks for sharing. Technically, though, the BCMA CAR-T was for plasmablastic lymphoma… https://t.co/wVTlzim6Jl",RyanCassaday,"Seattle, WA",0.1
381,"@RealDrJaneRuby @TheFreshMarket Apeel contains monoglycerides, which can cause hart attacks and strokes. Maybe a re… https://t.co/loEFFXkGQe",Waldorf172602,,0.0
382,Evil disease took my Mum. #WOCD23 #OvarianCancerAwarenessDay https://t.co/EpOy2V3lpB,kirstie1971,Cleethorpes,-1.0
383,"@CaseyPfluger It's an absolutely horrific disease. I felt like I was rotting, and it was only a matter of time befo… https://t.co/dhgAXbD7dC",Darling_Jeeling,United Kingdom,-0.5
384,@matt_syk34 @Shaniaxx @RogerHallamCS21 Isolated from fertiizer changes and disease resistant crop selection! Not fr… https://t.co/MHjV38uTsP,GlennCarr6,,0.0
385,"#Power_Of_TrueWorship

There is no such disease which cannot be solved by true devotion.  An incurable disease like… https://t.co/Ke9SgVkX7X",Sandhya24889139,,-0.05000000000000001
386,"15 yr boy, dx with ALK + LBCL: CD20/30/3/4/79a/Tdt/SALL4/PAX5 [-] CD138/EMA/Mum1/ALK [+] stage 1E (spinal tumor - r… https://t.co/dNEg2z7JUT",Arif_Hameed,Pakistan,0.0
387,"The bottom line is, regular lawn fertilization (particularly when it is applied professionally) promotes lawn growt… https://t.co/jWeT05d1ph",Jeffrey74608372,,0.08888888888888889
388,"Did you know bad breath can be a symptom of dental disease?

If you are on our Pet Care Plan, take advantage of our… https://t.co/qqfOPeVySu",warrenhousevets,"Burntwood, England",-0.6999999999999998
389,"Bruxism—the technical term for grinding your teeth—is a dental disease on the rise, dentists say.... #BreakingNews… https://t.co/3Rpm8PNHpT",ConservNewsDly,"Florida, USA",0.0
390,@ScottAdamsSays Who said that they want to join our side?  Many our Communists who are anti-American and who want t… https://t.co/84IleuXE3I,GaryZ22427643,,0.25
391,"Ophthalmologists can spot eye disease before vision is compromised and protect your sight.
Don't neglect this impor… https://t.co/vEAOgS628G",ECVABuffalo,"Buffalo, NY",0.0
392,"@lore37_ GM, Lore! 🌻🌞

""No disease that can be treated by diet should be treated with any other means. : Maimonides… https://t.co/JcKAea51ca",GoldenMongoose,Mumbai ,-0.125
393,getting  a lung disease  from  her secondhand  smoke  who snobs me because she  makes  more than  I did . People li… https://t.co/HXPMA4C8zQ,ClydeSparks1465,,0.2
394,@GavinNewsom @GregAbbott_TX Have you noticed those hundred of thousand+ people dying in CA gutters in carboard boxe… https://t.co/jsKyxrymk1,ThomasAKaspar,"Tampa, FL",0.0
395,@freedomregent It saddens me to hear that your both are dealing with this disease.  The worst being that there’s so… https://t.co/0beUj4V90E,deana_belli,"Riverside, CA",-1.0
396,@Dilmerv This is great but I agree with Bill. Yes we need adversity to build resilience but just like a treadmill o… https://t.co/zdyyecQJI3,JaredMichaels17,,0.8
397,My disease is getting worser and worser every day fuk,Chaaming18,,0.0
398,"Brian prolific life style boy girl next door disappearing acts Stones , carrying out their circus since 1962 rollin… https://t.co/D7FVyeVZzu",TamaraAlexis,Toronto ,0.0
399,"Join me in raising awareness so we can make #OvarianCancer a global priority. If nothing is done right now, over 4… https://t.co/9myeq1nToP",Silusaphocancer,South Africa,0.14285714285714285
400,Do you have high cholesterol or a history of heart disease? Join the SGBCHC's registered dietitian on May 10th from… https://t.co/5BxHQ7HI5A,SGB_CHC,"Wasaga Beach, Ontario",0.16
401,Anchovies are high in Omega-3 fatty acids which reduce cholesterol and help in the prevention of cardio-vascular di… https://t.co/NxFHQmNwsU,exceptionalfood,,-0.020000000000000004
402,Mukumu Girls: Students return after deadly disease outbreak https://t.co/bkEyhBzjxS https://t.co/KZAgHCIoXr,NationAfrica,Kenya,-0.2
403,"@HelenBranswell @WHO No longer an emergency, just an endemic contagious disease that kills more than any other cont… https://t.co/gejjysbh0Q",murdochdavis,Valparaiso IN Team @mlh_holmes,0.1875
404,@AhHunnetMiLL @tariqnasheed Forgiveness without change in behavior and killing the disease racism is pointless. Say… https://t.co/o780h87g8T,TrawickMychal,,-0.25
405,@RachelK01840150 Puberty is not a bloody disease that need stopping Webberly!,elegantferal61,Sol system,0.4
406,"In union, there is strength!
By raising awareness for every person affected by thalassaemia and the people who care… https://t.co/JTh30HfLy4",tcs_couriers,Pakistan,0.0
407,@TheDragonFeeder The US must resist the CCP disease.,FEHAstoria,"Astoria, OR",0.0
408,dies of not having an accordion disease,hylicorn,◉‿◉,0.0
409,"@TruQuest_69 @TiTs_JaCkEd GM, TruQuest! 🌻🌞

""No disease that can be treated by diet should be treated with any othe… https://t.co/8MQfu0fQyb",GoldenMongoose,Mumbai ,0.0
410,"@BonBunFilms ""Welcome to the US army, how can I help you?""
""I need some of that disease you guys invented.""
""Crack?… https://t.co/KgLwCdUqyy",BritishCitrus,he/him,0.8
411,This is messed up. Jah was yet another failure in his namby pamby handling of what remains a crisis disease. We nee… https://t.co/YW9MDpqPGk,BlueTigerPub,"Not sure, but it burns!",-0.3166666666666667
412,"@jen_thejew They're alive though? And possums are nice to have around, they eat ticks and prevent the spread of lyme disease :)",RobTheChick,The Internet,0.35
413,"Discover a Lupus Kidney Disease Treatment To Add to Your Regime!
https://t.co/Hahafty90t https://t.co/PU10uRor9b",KidneyRestore,"Wood-Ridge, NJ",0.0
414,"The thing about rare, terrible diseases like Huntington’s Disease is that they’ll never make it into the public con… https://t.co/4UO3jNTBgV",TimLammersFox61,"Hartford, CT",-0.2333333333333333
415,@allicovington @Suebdo50 Yes mam. Society needs nutrition fixed to restabilize the world. Each person helped is one… https://t.co/c4Hxu0ZuOh,AlexJournal2019,,0.1
416,@fox101773 @ClarityCaring @wopizza Libertarian also means taking PERSONAL RESPONSIBILITY. That means you do NOT hel… https://t.co/qTeyki6mTQ,Bigrig_North,Back end of nowhere.,0.0
417,"@PeterRQuinones I'd add that Polumbo's implied claim is, at the very least, highly misleading.  The world shown the… https://t.co/lbHjJiVvb4",WDalasio,,-0.115
418,@MeganTheOracle I think you'll find the information seek very easily. But if you ask them I think they will tell yo… https://t.co/PZKCZR3Su1,Lynette18041128,,0.5633333333333334
419,@NickAdamsinUSA You know that's not true. Data would show pedophiles don't correlate with Political views. It's a d… https://t.co/0z6Y82x4bj,TWFoodLover,Taiwan R.O.C.,-0.0875
420,"@GenoVeno73 @RNCResearch Title 8, another law that won't be enforced. Actually Title 42 didn't replace Title 8, it… https://t.co/f8KQniB9ui",LarrySwearinge5,,0.0
421,"Vedanta Biosciences Receives Fast Track Designation for VE303 and Presents Phase 2 Data at Digestive Disease Week

https://t.co/7Pe8WzyvRE",VedantaBio,"Cambridge, MA",0.2
422,"@Luking_sol GM, Luking! 🌻🌞

""No disease that can be treated by diet should be treated with any other means. : Maimo… https://t.co/z10bcJTp9R",GoldenMongoose,Mumbai ,-0.125
423,verlaine med student disease but feelings instead of illnesses. he learns a new emotion and for the next week only… https://t.co/DVjvJYFcoL,vroomlaine,"♿️ any/all, 19, bsd vnc & mxtx",0.04545454545454545
424,"The inaction by both government, both parties, to address #obesity as a disease and support prevention and treatmen… https://t.co/w6d9gDMdf6",NeilFlochMD,Connecticut,0.0
425,"@YussyGod @kieranmccoey @YannickMrCrypto @Rainmaker1973 It's a theory, like the theory of general relativity or the… https://t.co/e0uVSBaNEZ",DuneSlaya,Poorman,0.05000000000000002
426,Thinking your opinion matters on Twitter is actually a disease 😂 nobody really gives afuck,NIGHT_OWL_256,mars,0.1
427,@tomaskenn Water run off of roads is going to be an issue in ground water for drinking. Small amounts of radioactiv… https://t.co/qFwAwiq1o9,atm_cwa,Tampa Bay Area,-0.25
428,"Vedanta Biosciences Receives Fast Track Designation for VE303 and Presents Phase 2 Data at Digestive Disease Week
https://t.co/4pdz0KsfiJ",bernatolle,"Hub of the Solah System, MA",0.2
429,⚠️WARNING: Long-Term Opioid Therapy may result in partial to full restoration of function from debilitating chronic… https://t.co/EVoO41VTDm,sky_dvr,Somewhere free falling...,0.06666666666666665
430,"""𝐓𝐡𝐚𝐥𝐚𝐬𝐬𝐞𝐦𝐢𝐚 affects approximately 𝟏𝟎𝟎,𝟎𝟎𝟎 𝐩𝐚𝐭𝐢𝐞𝐧𝐭𝐬 𝐢𝐧 𝐏𝐚𝐤𝐢𝐬𝐭𝐚𝐧, and tragically, 𝟓,𝟎𝟎𝟎 𝐛𝐚𝐛𝐢𝐞𝐬 are born with this li… https://t.co/TB0i25SwF8",akfpvolunteers,"Lahore, Pakistan",-0.4
431,"Smalpox disease was the greatest killer of history.Many world famous kings &amp; queens, famous people died of smallpox… https://t.co/TC5IS891a5",GujaratHistory,"Gujarat, India",0.625
432,She😇 knows the Enemy will not survive a year locked-Away(For Fraud &amp; Murder)and without telling the audience the de… https://t.co/fjnZz3h68u,NDCPimentel,,0.0
433,"BOOKBUB99p/c
If you altered MAD COW DISEASE to infect humans
And fed it to your enemies
Death would be down to Natu… https://t.co/IHAxejS6cg",AYPuckett,Somerset,-0.30462962962962964
434,@chuurexics @dollykittycalz U shud eat 2-3 hard boiled eggs everyday for breakfast with the yolk cuz they cut ur ri… https://t.co/yHVoUskHaL,MrGrade_A,(D) M V,-0.24583333333333335
435,@NjbBari3 Not before it leaves a massive amount of people disabled &amp; with numerous new complex disease processes wh… https://t.co/fKent468hw,EndemicPrepared,Australia,-0.07272727272727272
436,"Me: give me an example of a waterborne disease. 
My students : Influenza 

You know what…… https://t.co/Rcak3YBfm1",Lene_Marlene_,namibia,0.0
437,@Acruelpastime @JosefKalfsGran @MasalaFry69 @dippydappyduck @gomiriam63 @carmel_prescott @cool_grandad @BillWard60… https://t.co/KQHv4lveVv,AndrewGillies9,,0.0
438,"@smwise55 Yeah! GM, Darnas! 🌻🌞

""No disease that can be treated by diet should be treated with any other means. : M… https://t.co/wWT7lvJMJe",GoldenMongoose,Mumbai ,-0.125
439,26.2 miles added for the #850challenge- raising awareness of the 850 million people living with kidney disease worl… https://t.co/rvf3PiKL4v,MaryFHannan,"Chicago, IL",0.0
440,"The world is beautiful, but has a disease called man.

(Ritik)

KUCHITNEHASEEN HT 1M IG
#PriyAnkit",ItsUrRitik,,0.85
441,"@shannonrwatts @GovAbbott So I guess this means that every murderer in prison has a ""mental disease."" Nope. Some pe… https://t.co/0HAh7q1aCe",BostonBedelia,,-0.1
442,"ASYMPTOMATIC, CT ANGIOGRAPHY-DETECTED CORONARY ARTERY #DISEASE ASSOCIATED WITH 8-FOLD INCREASED RISK FOR #HEART ATT… https://t.co/d7IXuHUFHI",BinaPattel,,0.0
443,@mechdoll I have some fucked up brain sleep disease and i do this to help reinforce my sleep cycle and walkies real… https://t.co/7kajHtn2iE,faygocytosis,fran or bio he/they,0.2
444,"@Justdrewisme @floridafrenzy @RepSwalwell No pedophilia mental disease, and the guy who created that pride flag acc… https://t.co/fqUtgepDKG",AutomatonM99,"Kraken Mare, Titan, Saturn",0.05
445,Researchers have found a connection between gum disease and tooth loss with an increased risk of dementia. Get more… https://t.co/dLCCyittiq,SDReddickDMD,"Lake Wales, FL",0.5
446,"We don’t believe in coincidences, amazingly Ayuh Ventures invested in @pepper_bio before @numberoneks cancer diagno… https://t.co/y3lVGpzAcZ",AyuhVentures,Mind,0.6000000000000001
447,"@sieco @Runningtaxman1 @JuliaHB1 @RMCunliffe heard of mad cows disease -?
We know what the science said about that… https://t.co/aIbbLxdYRx",kossoff333,England,-0.625
448,@mindyourwildli3 Brucellosis was originally imported to North America with non-native domestic cattle which transmi… https://t.co/tXkIX9X2FI,JoanGrech,,0.1875
449,@holdingonto369 jealousy is a disease and i have it,lousmine,london,0.0
450,@Pianokit @CraigARobinson @PEHJackson @KHefferon @holisticgrenade Parasites need hosts to live but parasites have b… https://t.co/h06y7GiUQq,ChrisKazana,,0.13636363636363635
451,me realising the random ass diseases AQA use are real #gcses2023 (I stand in solidarity with Maple Syrup Urine Dise… https://t.co/HxMlFcDRsS,jigglyblink,uk,-0.15
452,"@powerfultakes @charlesmurray Prion disease, scaled to the species level.",2084Spacejack,,0.0
453,@COVID19_disease From 2018 peeps,sasswashere,Zombie planet. ,0.0
454,@gurgavin Maybe it’s just that these is no more demand for that disease ridden food,xSNB,,-0.25
455,@BadVaccineTakes I have cracked the code: vaccine shedding disease is caused by reading about vaccine shedding disease.,AuntIkeRyste,United States,0.0
456,"@0720Dwyer Lord, You are our Great Physician &amp; I praise You now for Austin &amp;for what You’re doing in his life &amp;that… https://t.co/RrUXS7RaRG",bbdycus,🎼Nashville TN🎵,0.8
457,"The City of Richmond Hill proclaims May to be Lyme Disease Awareness Month

As you enjoy our wonderful outdoor spac… https://t.co/SdVvusxa8U",DavidWestRH,Richmond Hill,0.7
458,"This week on Lights, Camera, Crohn’s a close look at the reasoning behind safety labs. We hear from esteemed GI's… https://t.co/VzH7TtCey3",nataliesparacio,,-0.4
459,"@DetectiveFury It absolutely should be. But mfs make a post like this blaming her for letting him hit raw. Uhhh, he… https://t.co/829LfOIDa0",RebornOfAeterna,,-0.015384615384615385
460,"For example, AI can help predict which compounds are most likely to be effective, while CRISPR can be used to creat… https://t.co/MO4odUp7Vw",ZoicCapital,"Seattle, WA",0.3666666666666667
461,"@Singer953 GM, Singer! 🌻🌞

""No disease that can be treated by diet should be treated with any other means. : Maimon… https://t.co/q4TxpchfXI",GoldenMongoose,Mumbai ,-0.125
462,"All Unvetted, Undocumented carrying drugs, disease and no fear of breaking Laws. Congratulations Biden voters.  🖕🤬 https://t.co/vLZ2nOQD6i",mafia_mastiff,The Jersey Shore ,0.0
463,"Just got out of Twitter jail. Apparently for Seth Meyers, corporate prostitution is much more than a job, (accordin… https://t.co/SatCtSWe3P",Jarvis2503,,0.1125
