,tweets,user,location,polarity
0,"@heidithewiz @TRyanGregory It really is some twisted, sadistic, death cult/disease fetish of some sort isn't it? 🤔",skymelilemyks,,-0.15
1,“Warm wishes on World AIDS Day to everyone. May we put an end to this life-threatening disease to leave our generat… https://t.co/Y1SHuwywQK,cad_solid,"Kottayam, India",0.6
2,"@IronStache @johncusack Hello,
Danish person, who never ever pays for sick days, here. Are the employers interested… https://t.co/XEvo3n7KkQ",NaestAar,Fredensvang eller troperne,-0.23214285714285715
3,"HIV does not make people dangerous to know, so you can shake their hands and give them a hug. On #WorldAidsDay, let… https://t.co/CRv4qXsjJU",QualityCouncil,"New Delhi, India",-0.6
4,New Research: Acupuncture in treating cardiovascular disease complicated with depression: A systematic review and m… https://t.co/oGi1gh71vf,FrontPsychiatry,"Lausanne, Switzerland",-0.18181818181818182
5,@RearmostGorilla @crispycritter48 @natus_ex_aere @hugh_mankind Vaccine was 100% effective in preventing severe dise… https://t.co/9Eh4Szrmp8,darlkin,,0.6
6,#WorldAIDSDayAdopting celibacy regular meditation selfless service can save one from getting infected from the Dise… https://t.co/nzDHVPsv1Q,PalRachi,,0.0
7,"Diagnostic Efficiency
1)Diagnostic sensitivity -detect a given disease or condition
2)Diagnostic specificity -detec… https://t.co/brOa6TDyun",dttb_rmt,,0.0
8,"Today we commemorate those who lost their lives battling the HIV pandemic, its our duty as the society to fight aga… https://t.co/SridaDxrpK",GOMO_SA,MABOPANE,0.0
9,"HIV is a deadly but treatable disease, it can be protected from this disease by taking full precautions,… https://t.co/CNhPSUVTBn",MahiSayss,,0.07499999999999998
10,"HIV is a curable disease, it is also possible to prevent this disease through proper awareness.
#WADPK2022 https://t.co/SjaBVABTWW",MahiSayss,,0.0
11,"#开云 #亚博体育  My disease is an asthma and a dropout and, what is less curable, seventy- five https://t.co/phx9MPaEuO",Lisha78423056,,-0.16666666666666666
12,World AIDS Day is here to remind us that the only way to remove fear and stigma around the disease is through educa… https://t.co/PT772q6Y7l,pinaki_d1,"Jagatsinghpur,Odisha ",0.0
13,This year's theme for #worldaidsday2022 Day is “Rock the Ribbon.” Let us all pledge to be sympathetic and empatheti… https://t.co/8KQRcTsWkz,Apollomedics,"Lucknow, India",0.5
14,@ziibiing So the solution to my migraines is more of my magnesium supplement that the MFM told me to take. But that… https://t.co/dn127Euf1S,kategrames,"St Louis, MO",0.5
15,"Irony is that people are not even aware of HIV and those who know, they don't talk about it. We should talk about t… https://t.co/GEx6PjDbNk",AbdullahQamarr,Pakistan,0.25
16,"@Needle_of_Arya Reminder that measles essentially wipes your immune system's memory, so you're at higher risk to ge… https://t.co/zm1BxHJVcp",ehs06702,"Las Vegas, NV",0.125
17,Pet Gulshan was rushed into CGS Hospital with chronic #tick fever &amp; an aggressive life-threatening auto-immune dise… https://t.co/GJCGS3sqVI,CgsHospital,"Gurgaon, India",0.0
18,Warm wishes on World AIDS Day to everyone. May we put on end to this life-threatening disease to leave our generati… https://t.co/gJNnpZcfkx,spaciumofficial,Mohali,0.6
19,Pocket watching a real disease,ry_train,Jersey,0.2
20,"The Essential Hoof Book: The Complete Modern Guide to Horse Feet ― Anatomy, Care and Health, Disease Diagnosis and… https://t.co/R9Nuk4BlYm",Carole91D,,0.10000000000000002
21,Guys I really request you please do not hesitate yourself talking about this virus as awareness can save us from th… https://t.co/aPNJNi0sBt,bloggersayss,"Karachi, Pakistan",0.2
22,Warm wishes on World AIDS Day to everyone. May we put an end to this life-threatening disease to leave our generati… https://t.co/IUDeYI5rfH,SignatureITSof1,"GomatiNagar, Lucknow",0.6
23,"In the year 2010, Gujarat was awarded the 'Prime Minister's Award for Excellence in Public Administration by the Go… https://t.co/VOQEpq8a2P",BhavinBhut_22,"Gujarat, India",0.0
24,The day cannot be too far off when biobots will be developed that can deliver deadly toxins or viruses deep into th… https://t.co/gXfTYDohWM,listen_2learn,,0.0
25,And if you think you’re somehow exposed to this disease get yourself tested as soon as possible. In Pakistan there… https://t.co/G9Cnm7vSVl,itsbee009,PAKISTAN,0.0
26,"Let’s talk about how to stop this life taking disease. Firstly, know that how HIV spreads through one person to ano… https://t.co/iofJOJfAsv",itsbee009,PAKISTAN,0.25
27,"@Krissie_r @lalaleena @winstonpeters Theyre the single most disease ridden demographic, so yes",JacobianPhil,,0.2142857142857143
28,December 1 is World AIDS Day and it is dedicated to spread awareness of the AIDS. Please note that this disease spr… https://t.co/ICpcUZMa1l,itsbee009,PAKISTAN,0.0
29,#AaoBaatKarein is an initiative to create awareness for the disease which goes neglected due to it being considered a taboo #WADPK2022,mtemptymtt,لاہور ، پاکستان,-0.125
30,"In the year 2010, Gujarat was awarded the 'Prime Minister's Award for Excellence in Public Administration by the Go… https://t.co/YBrOpTFROZ",ShubhnkrDable,,0.0
31,"In the year 2010, Gujarat was awarded the 'Prime Minister's Award for Excellence in Public Administration by the Go… https://t.co/ggjdZteLSj",BjymPy,,0.0
32,"On the account of World AIDS Day, there was an event conducted in which a report was released by Mr.Abdul Qadir Pat… https://t.co/OFtrSyjV5d",MehaktiDunia,"Karachi, Pakistan",0.0
33,"Today, December 1, is World AIDS Day, a day when people all across the world, including Pakistan, show their suppor… https://t.co/Iop6Qoq48Q",aliarham_,"Islamabad, Pakistan",0.0
34,"Get educated about the disease; shun darkness, spread light World AIDS Day..! 

#WorldAIDSDay #WAD2022 #WAD… https://t.co/tQuz26rgY2",oakfieldrealty,Gurgaon,0.4
35,"On World Aids Day, let’s spread awareness and help to put an end to the social stigma associated with the disease.… https://t.co/FssNAyglvM",kavya_books,"Delhi, India",0.03333333333333333
36,The theme of World AIDS Day 2022 is “Equalize”. It is a wake up call for all of us to focus on the practical soluti… https://t.co/FDVfLwTCwm,CEOMagazine1,india,0.0
37,"Happy new month to you all♥️

On this special day,we celebrate the heroes that battled the deadly disease and to th… https://t.co/H9GDq5MW2i",Birungiteddyamo,Omuka,0.2733766233766234
38,"Today is the World Aids Day, every year on this day we spread awareness regarding HIV so that we put a stop on the… https://t.co/uLqsr4L10V",handsupp___,Pakistan,0.0
39,Warm wishes on World AIDS Day to everyone. May we put an end to this life-threatening disease to leave our generati… https://t.co/B5TjUegypZ,manasabeautyoff,,0.6
40,@NOTTlRED jealousy is a disease,xinnamoroII,"( 22 ooc | gmt+7 | singleship | demiromantic )

yuno. haku. kairo. ryo. joowon. kai. hyun. levi. cheyi. robyn. loid. obie. kyle.",0.0
41,"6/  doubt watch over me, and to those friends still living with and fighting this battle with this terrible disease… https://t.co/WVjSjo72Dm",galaxyfarrahway,Melbourne Australia,-1.0
42,Canadians with Alzheimer’s have renewed hope as a new drug appears to slow the disease’s progression. Adrian Ghobri… https://t.co/XhkMPlWKgl,CTVCalgary,"Calgary, Alberta, Canada",-0.08181818181818185
43,Together we must work hard to put an end to this disease and have a beautiful tomorrow…. Best wishes on World AIDS… https://t.co/LPUSULs3nX,dronainfotech,"New Delhi, India",0.5194444444444445
44,"“Environmental Pollution is an incurable disease,            it can only be prevented”. Prevent pollution adopting… https://t.co/Vo8vSA8Te2",GCPC_Gujarat,"Gandhinagar, Gujarat",-0.25
45,"On World AIDS Day, let us all pledge to be sympathetic and empathetic towards those who are fighting a battle again… https://t.co/BUvEmWtbME",DrGKBalaji,Mohali,0.5
46,"The World AIDS Day has raised awareness of an increasing number of issues around the world, including this year's d… https://t.co/Ta24NW5DTZ",Fariha_Shkh6266,Pakistan,0.0
47,Together we must work hard to put an end to this disease and have a beautiful tomorrow…. Best wishes on World AIDS… https://t.co/GRKcS3jvlB,anihachaudhry,"Karachi, Pakistan",0.5194444444444445
48,"World AIDS day is held on 1st December every year worldwide. On this day,  everyone should come forward to support… https://t.co/mT0fIBlUu5",LalaLoyalist,Pakistan,0.0
49,"Don't hesitate to take help and get more information about this deadly disease by calling on 0800-22209.

Take help… https://t.co/hPkuyFZo2O",Talhaareef,"Karachi, Pakistan",0.15
50,"@jk12330867231 @lordnikon42069 @kyledoescode If you are viewed as a disease vector, I believe it right and true tha… https://t.co/JHzjlscaz0",pacrozier,North Cascades,0.31785714285714284
51,New Research: The Frontal Assessment Battery (FAB) effectively discriminates between MCI and dementia within the cl… https://t.co/rFtChURBXX,FrontPsychol,"Lausanne, Switzerland",0.36818181818181817
52,An awareness programme on World AIDS Day was today on 01-12-22 held at ANMT School Doda to educate the students and… https://t.co/XoR8zgRNbD,CMODoda,Behind OPD Block AH GMC Doda ,0.0
53,HIV cases are increasing day by day. Now is the time #AoBaatKarein  to spread awareness that it's a preventable dis… https://t.co/A7nK8PsZKx,MAYBE_QUEENN,🇵🇰 ,0.0
54,@RReddingtn @JennaEllisEsq @Scott_Wiener I honestly don’t know. I just know he’s an activist for “gay rights.” But… https://t.co/xOM4XKYm5R,Skillmare,,0.6
55,"AIDS caused by HIV is life threatening disease leading the victim more susceptible to opportunistic infections, awa… https://t.co/59ZJZDVPw5",daniawaheed3,,0.2125
56,HTLV-1 infection of donor-derived T cells might promote acute graft-versus-host disease following liver transplanta… https://t.co/RbndOiUAj0,ychrom_papers,,0.3
57,Being responsible citizens we shall also play our role in spreading awareness regarding the disease and ways to cou… https://t.co/D5b5EKDCGg,WordsByImran,Pakistan,0.2
58,"In the year 2010, Gujarat was awarded the 'Prime Minister's Award for Excellence in Public Administration by the Go… https://t.co/9KzPe0Mq4h",Ratilalkatakia,"Surat,Gujarat,India,",0.0
59,"In the year 2010, Gujarat was awarded the 'Prime Minister's Award for Excellence in Public Administration by the Go… https://t.co/eWaDIZCX7H",Arundabhi27,"Gujarat, India",0.0
60,On the occasion of World AIDS Day May we put an end to this life-threatening disease to leave our generations a wor… https://t.co/32KUXi4qng,Humanity_Grain,"Ahmadnagar, India",0.0
61,"You may never be a morning person, but a good night’s sleep can help you feel more chipper and think clearly. It’s… https://t.co/m4kdDixis8",micheal_profit,,0.43333333333333335
62,"World AIDS day is being commemorated by Ministry of National Health Services, Regulations and Coordination in colla… https://t.co/IHNHtYOUFd",WordsByImran,Pakistan,0.0
63,"Alot of people are not even aware about  HIV disease and its increasing rapidly, lets pledge that we will fight aga… https://t.co/QaJRTfIoyK",sagarsamy,"Karachi, Pakistan",0.25
64,"@BillClinton Hey, at least he doesn't have Ebola, or Swine Flu, or Bird Flu, or Mad Cow Disease.",DJMentalManiac,"Kettering, OH",-0.3527777777777778
65,"As we observe World Aids Day today under the theme #RockTheRibbon ,let us shed our ignorance of this incurable dise… https://t.co/VBv0fl41yr",DicsLaxmiNagar,,-0.5
66,"Clinical Manifestations and Assessment of Respiratory Disease (Des Jardins,Clinical Manifestations and Assesments o… https://t.co/hoJcQjB6R6",lyda70l,,0.0
67,"Ageing is considered a disease that can be cured. 

WAI aims to accelerate research in ageing and to reframe how we… https://t.co/g7IVakAbx4",WAI_institute,,0.0
68,"@flysurfer3 @kinuthiamwang10 @BillClinton Scientists are not baffled. The vaccine does not eradicate the disease, i… https://t.co/VfJU0nmiM7",PaulHoofman,"Tappan Zee Bridge, NY",0.0
69,How do you keep yourself together if you find out this life taking disease is growing inside you? Talk to your doct… https://t.co/dctDNEXM1s,ihusnashaban,Pakistan,0.0
70,now the only pure thing left in my fucking world is wearing your disease,Ieftspinedown,ic Legalize-Nuclear-Bombs,0.07142857142857142
71,"There's a lot of disinformation out there. We must publicly discuss Aids and dispel myths about the disease, so we… https://t.co/aIuMAIEPIe",nmbxhehe,huh?,0.0
72,"Let’s understand that we need to tackle the disease,not the people having it.This #WorldAidsDay let’s justify the ‘… https://t.co/MK8ZpWLNDP",Iamshaktii,"Kanpur, India",0.0
73,Today is the worlds AIDS day so it's important to contain some myths associated with this disease. HIV can't be spr… https://t.co/RSPmntguIM,ShahidRasul94,"Lahore, Pakistan",0.4
74,the broader sni gets the more i want to see him stuffed full &amp; sobbing it’s like a disease,lunarwxsn,nsfw ahead • she they,0.425
75,Worlds AIDS day is an international day dedicated to raising awareness of the AIDS pandemic caused by the spread of… https://t.co/z96bqQ1r3G,IRameen88, Pakistan,0.0
76,@Fredmunene_ How can we get those pest and disease control herbs!?,Selevelien31,,0.0
77,"@pushkardhami ADHD is such a critical disease 
so is social media addition. 

I hope sanity would prevail someday,… https://t.co/YZmbwHkqnN",harawal_malik,@jaymeru,0.011111111111111112
78,"The World AIDS Day has raised awareness of an increasing number of issues around the world, including this year's d… https://t.co/Djnhrp4UWt",huzaifadotcom,Faisalabad,0.0
79,"Not only this but Dr. Luay Shabaneh, UNFPA Representative quoted that HIV/AIDS has to be integrated in high-quality… https://t.co/z5KIUkcXcj",suniisayss,"Karachi, Pakistan",0.08
80,"On the occasion of World AIDS Day,  Let's join hands and put an end to this life-threatening disease to leave our g… https://t.co/6NfgxiiTuq",Sapnaa25_,"Karachi, Pakistan",0.0
81,"Today December 1 World is talking about HIV/AIDS Disease to raise awareness, To keep everyone safe, and to protect… https://t.co/BvXnw1BheJ",Iam_Syedaa,Pakistan,0.5
82,"HIV is a very dangerous disease and its prevention is very important, with proper care and precautions one can be p… https://t.co/sy0eOpCkON",useelessperson,Pakistan,-0.08666666666666667
83,"Sweden's ambassador to Pakistan, Henrik Persson, expressed his full support and said that the time has come to erad… https://t.co/KtR9QcPIGR",JahanZaibb_,Fort Abbas,0.35
84,"HIV is a immunosuppressive disease  that attacks and weakens the body's immune.
If not treated in time, it can lead… https://t.co/8cEGYI11Cb",heybeautybae,Pakistan,0.0
85,"@nytimes If you had a debilitating disease like ACLS or Parkinson’s, you might sing a different tune. I’d be willin… https://t.co/zoXHdpcTHn",coriw17570,,0.0
86,"AIDS caused by HIV is life threatening disease leading the victim more susceptible to opportunistic infections, awa… https://t.co/GtAm74a5IN",OrhanShykh,kpk pakistan ,0.2125
87,"HIV is a preventable disease. So, without any hesitation get information about this disease by calling on 0800-2220… https://t.co/bK6aFyw7ct",Aimilicious_,,0.0
88,HIC is a preventable disease. Better safe than sorry. Please be cautious as cases are increasing in Pakistan!… https://t.co/XkiveRlqwx,MaryamAhmad_23,Pakistan,0.16666666666666666
89,"Learn all about HIV to be able to tackle the disease. Becaue Ehtyaaat krege to is se bachain ge. 
#WADPK2022 https://t.co/6kPWOYK5L7",LeAnam__,🇵🇰,0.5
90,HIV is a serious disease guys please do not ignore it and take it for granted and educate yourself and educate abou… https://t.co/SpYU9vF7jx,NainaNainuu, Pakistan,-0.3333333333333333
91,"Awareness is much important about HIV disease
#AoBaatKarein is a great initiative by @UNAIDS_Pakistan. It's importa… https://t.co/yWJ7U8HFDj",Iam_Syedaa,Pakistan,0.6000000000000001
92,"Let's take a pledge not to discrimminate against the diseased, rather support them &amp; spread awareness to help preve… https://t.co/6arfi8hFWI",OSL_GROUP,"Cuttack, Odisha",-0.6
93,Please don't hesitate about talking about this virus as awareness can save us from this incurable disease!… https://t.co/wBkCCcjzZ2,MaryamAhmad_23,Pakistan,-0.5
94,"HIV is a curable disease, it is also possible to prevent this disease through proper awareness.
#WADPK2022 https://t.co/EStu5DxRzz",JahanZaibb_,Fort Abbas,0.0
95,"The theme of this World AIDS Day is “Equalize”. 

Let us all use this day as a reminder to focus on gaining awarene… https://t.co/gL556JQlSR",RoofingsGroupUG," Plot 126, Lubowa, Entebbe RD",0.0
96,The reason they could pull this off is precisely because CV19 is not a serious disease like polio. It is the flu re… https://t.co/boZ0fAkUVQ,sanjay_world,Chile,0.2833333333333333
97,"Denial of natural immunity, jab even after getting disease:

Imagine repeatedly injecting the polio vx to a child w… https://t.co/py1XNHc6uA",sanjay_world,Chile,0.1
98,"Nice lofty speech by the prime minister, except for one thing:

The ""mother of democracy"" trope is simply not true.… https://t.co/ZJFArZNykf",Hindumachiavel,Eurafrasia,0.2125
99,HIV is a disease that is curable. Let's take action to stop it from getting worse. By receiving early diagnoses and… https://t.co/ZgF7KmkZgd,iamnomantoor,Sialkot,-0.06666666666666668
100,It's a time where on many places in pakistan have seen the increasment in cases of Aids and HIV. @UNAIDS_Pakistan… https://t.co/LFQq6hiNCR,Slay_With_Kiran,,0.5
101,"HIV is a deadly but treatable disease, it can be protected from this disease by taking full precautions,… https://t.co/N6xxyi2TB6",JahanZaibb_,Fort Abbas,0.07499999999999998
102,On this World AIDS Day #AoBaatKarein about HIV disease because communication can clear many misconceptions and spre… https://t.co/xc2zrCy4OU,Aimilicious_,,0.3
103,"The number of HIV cases have gone a rapid increase in Pakistan which is alarming, the only we can tackle this is to… https://t.co/jwYvCQ7u2K",NimrahMemon,"Karachi, Pakistan",-0.05
104,"""World AIDS Day serves as a reminder that we must treat those who have the disease with dignity and equality. Happy… https://t.co/FXb6ytlwZk",LifepointMulti1,,0.8
105,"AIDS is a chronic, potentially life-threatening condition caused by HIV. By damaging your immune system, HIV interf… https://t.co/pZKz0jg4aS",WellnessFelix,"नोएडा, भारत",0.0
106,"Good morning gems💕
#AoBaatKarein on this world's AIDS day let's talk about the disease which are likely to ignore.… https://t.co/JwqLvjoVNK",Slay_With_Kiran,,0.35
107,Awareness helps in eliminating the disease completely. Let us join hands together and drive away the virus far away… https://t.co/bRYI1CCr1i,aftekmotors42,"Uttar Pradesh, Bihar ",0.1
108,"Today is World AIDS day, govt of Pakistan have allocated around 2 million Rs to overcome the spread of this disease… https://t.co/beGgHXUAPw",NimrahMemon,"Karachi, Pakistan",0.0
109,"IS IT ENOUGH? An experimental Alzheimer’s drug modestly slowed the brain disease’s inevitable worsening, researcher… https://t.co/X7TGoB6pRf",8NewsNow,"Las Vegas, Nevada",0.05
110,HIV cases are increasing day by day. Now is the time #AoBaatKarein  to spread awareness that it's a preventable dis… https://t.co/uDUrJOMRAS,madiharazzak_,"Karachi, Pakistan",0.0
111,"Our next #CrisisReporting session will feature Sergii Antoniak, a researcher and infectious disease physician in Ky… https://t.co/QbtxeqB0l9",ICFJ,"Washington, DC",0.0
112,"@_Hero_Hei_ You got Lyme disease. Ur gonna die, sorry bro.",Pontif_Reflet,,-0.5
113,Bariatric Surgery Lowers Risk for Heart Disease in People With Fatty Liver Disease https://t.co/bo2lMwUjuQ #fattyliver #nash #nafld,hepatitismag,United States,-0.2
114,Atrial fibrillation has been the low man on the totem pole and so we're just trying to get more visibility about th… https://t.co/c0lTJCP1c7,CaPPsiEBot,"England, United Kingdom",0.25
115,"The grant, administered by the Centers for Disease Control and Prevention, provides funds directly to state and loc… https://t.co/IShpK4RSWY",StarAdvertiser,"Honolulu, Hawaii",0.1
116,"#WorldAIDSDay, designated on 1 December is a day dedicated to raising awareness of the AIDS pandemic caused by the… https://t.co/21tgOiZYRo",IIMMDelhi,"B-50, South Ex-I, Delhi-110049",0.0
117,"It is due to lack of education around AIDS that fear, panic and stigma around it exists in society. On World AIDS D… https://t.co/hiRYGholw1",NiftelResources,Lucknow,-0.125
118,Most of us get confused with asthma and chronic pulmonary disease (COPD) assuming they are the same. They share sim… https://t.co/zWwYRosafa,ibreathefree,India,0.033333333333333326
119,"On World AIDS Day, we need to remember to be sensitive to those suffering from AIDS. Let's not judge them harshly.… https://t.co/AnhBfDtaAS",NiftelComPvtLtd,"Lucknow, India",-0.05
120,Let’s debunk some myths related to HIV. Remember it’s a treatable disease so get yourself tested and do not treat i… https://t.co/UonZv7UwHn,Mussanaf,Cultural Capital of Pakistan,0.0
121,I love my heart disease with a side of session,botofthestates,USA USA,0.5
122,"""I got King's Disease but I move like a knight"" i'm 0.0000021 seconds away from making this an ig caption DONT LOOK AT MEEE 😭",sopeepop,California,0.0
123,"On World AIDS Day, let us all pledge to be sympathetic and empathetic towards those who are fighting a battle again… https://t.co/mRxns4hlAB",pavitceramics,Ahmedabad,0.5
124,@blingusbogus @HeironimousX @Nillabraz russian boot lickers be bootlicking even for free. It’s an incurable mental… https://t.co/gUdhCXPxmM,wallofballs,,-0.049999999999999996
125,"Your test results help your doctor follow what's happening with your infection, how well your treatment is working,… https://t.co/JMX0vlZn4M",PathcareKenya,Kenya,0.0
126,"We were lucky that COVID, and especially Omicron, was a mild disease with a .01 CFR for the under 70's. The next bu… https://t.co/5fxGMZPb96",jaycurrie,"Oak Bay, BC",0.16666666666666666
127,"On this World AIDS Day, let us spread awareness among people about the causes of this deadly disease HIV and create… https://t.co/ULO3vmcI4Y",Colt_Equipments,New Delhi,-0.2
128,"When it comes to HIV, prevention is the cure.

Don't hesitate to take help and get more information about this dead… https://t.co/ZAellZyc4J",Huda_Nav,"Islamabad, Pakistan",0.15
129,"This #WorldAIDSDay, let's pledge to eliminate inequalities and spread awareness about the disease with empathy. Thi… https://t.co/iB848er7Nn",ESLSteelLimited,,0.0
130,Warm wishes on World AIDS Day to everyone. May we put an end to this life-threatening disease to leave our generati… https://t.co/7f70UayxZL,satya__bonam,India,0.6
131,"Students of Namasalima primary school, Zomba proudly displaying their #cholera vaccination cards. Go get yours too!… https://t.co/BfFd4X4zen",MalawiUNICEF,Malawi,0.6000000000000001
132,A day to remember those who have been lost and to recommit to stopping this disease. #WorldAIDSDay https://t.co/A3586rvWi5,luxescipod,,0.0
133,"@SeanPlunket @TheSpinoffTV @theplatform_nz Apparently I'm not allowed to give blood due to some disease in the UK in the 90s, sorry.",MayaOfAuckland,New Zealand,-0.21666666666666667
134,@nathanbaugh27 “It’s the poor’s fault for wanting more—that’s the real disease!” (Not my millions and millions I’m… https://t.co/Fu5yUYtNoa,harkshetweets,Lummi Nation,0.09999999999999999
135,"World AIDS Day, designated on 1 December every year since 1988 is an international day dedicated to raising awarene… https://t.co/aesAqSmkxL",offclfplhyundai,India,0.0
136,"Ritsu: Secchan Disease is contagious. Be careful, everyone, and remember to wash your hands!",euthanasiatxt,,-0.1
137,"Remember, prevention is better than cure, especially for a disease like AIDS. 

This #WorldAidsDay, let’s spread aw… https://t.co/2XUPtluTZD",paybimaofficial,,0.25
138,@DavidJoffe64 I've been wondering the same thing. It was the cocktail that really changed HIV treatment. And covid… https://t.co/7kMHMRvfQm,kayemclaren,New Zealand,0.1
139,@SumanIn14143772 Meditation is the cure for every disease,roohani71478272,"Fatehabad, India",0.0
140,@akaetorres2001 @catturd2 Imagine dying from a disease that has a 99 percent survival rate,JB0ne407,,0.0
141,we all should play our part in controling this disease. https://t.co/m4UEBQvSsR,salmanravian,"Islamabad, Pakistan",0.0
142,"May we put an end to this life-threatening disease to leave our generations a world free from AIDS. 
Best wishes on… https://t.co/alc2Jtp3uf",DigitalJovial,"Noida, Uttar Pradesh",0.7
143,"WORLD AIDS DAY
Is celebrated on 1 December every year as an opportunity for the world community to unite in the fig… https://t.co/I2NDdFYAJm",VarmaGroup,Hyderabad,0.35
144,DR  SEBI CURE FOR HEART DISEASE MADE SIMPLE: The Total Guide on How to Effectively Cure and Treat heart disease Thr… https://t.co/mpKPcN5x3F,brakuscick,,0.19999999999999998
145,@JByGodRod Nope we’re wired this way. Most people with this disease had addiction behaviors before they got into th… https://t.co/mZ4flxPSLk,Epic_Faile_,"New Orleans, LA",0.5
146,@GOPLeader Our country would be a hell of a lot more unsafe if there was a major break out of Covid in the military… https://t.co/8lhuUE0L8m,MizNanC1,The Great Northeast,0.15416666666666667
147,"On #WorldAIDSDay , Speaker &amp; Deputy Speaker have said that HIV is fatal disease &amp; unfortunately spreading at alarmi… https://t.co/2ZxxfX0juR",NAofPakistan,"Islamabad, Pakistan",-0.5
148,@Meet13s @Gurmeetramrahim @derasachasauda Meditation can cure every disease.,roohani71478272,"Fatehabad, India",0.0
